id	model.x	model.y	lemma	pos	genre	broad_genre	marisense	mbroad	mari3	mari2	sensekey	wnsense	wnbroad	wn3	wn2	text	cues	cues_with_weight	mean_weight	weighted.cues_ratio	weighted_cw
state/NN/br-h07/1566	0.0134040057511131	0.117823890912963	state	NN	miscellaneous	non-fiction	A4	A	AB	ABC	Z	Z	Z	Z	Z	 An analysis of the fiscal-tax collection year calendars throughout the <font color=green>state</font>  indicates that transition may not be as painful as is	2	0	1.06276077834822	0	7
state/NN/br-h07/261	0.287536012155104	0.0205081788079146	state	NN	miscellaneous	non-fiction	A	A	AB	ABC	Z	Z	Z	Z	Z	 cities( June 30) is the same as that of the <font color=green>state</font> : Alaska, Arizona, California, Delaware, Massachusetts, Montana, Nevada, New Mexico, North	8	4	1.3099099034732	0.5	4
state/NN/br-h07/318	0.0748092728798218	-0.0301836492127803	state	NN	miscellaneous	non-fiction	A3	A	AB	ABC	Z	Z	Z	Z	Z	 year of the cities ends on December 31, while the <font color=green>state</font>  fiscal year ends on June 30( Arkansas, Colorado, Indiana, Kansas	6	5	1.17238076685982	0.833333333333333	9
state/NN/br-h07/398	0.0905293602446065	-0.0853132472164559	state	NN	miscellaneous	non-fiction	A1	A	AB	ABC	Z	Z	Z	Z	Z	 Iowa, Kentucky, Maine, Maryland, Minnesota, Virginia, and South Carolina). One <font color=green>state</font> , Alabama, closes its fiscal year on September 30, and all	8	3	1.55060306959174	0.375	8
state/NN/br-h07/415	0.0507141937481618	-0.0190406109870157	state	NN	miscellaneous	non-fiction	A4	A	AB	ABC	Z	Z	Z	Z	Z	 fiscal year on September 30, and all cities in the <font color=green>state</font> , with one exception, also close fiscal years on September 30	2	3	1.1844240173809	1.5	8
state/NN/br-h07/482	0.0563177060108479	-0.00295268376625655	state	NN	miscellaneous	non-fiction	A3	A	AB	ABC	Z	Z	Z	Z	Z	 The remaining twelve states have varying fiscal years for the <font color=green>state</font> , city and local governments. However, only Illinois, Oregon, Louisiana and	7	5	1.54437313308714	0.714285714285714	10
state/NN/br-h07/983	0.0542884396591803	0.000986873288273005	state	NN	miscellaneous	non-fiction	A3	A	AB	ABC	Z	Z	Z	Z	Z	 bases on a uniform fiscal year. Both the federal and <font color=green>state</font>  governments commence their fiscal years on July 1. Both units	3	4	1.48731393448052	1.33333333333333	8
state/NN/br-h08/1051	0.0380171718206964	-0.0638668583837766	state	NN	miscellaneous	non-fiction	A4	A	AB	ABC	Z	Z	Z	Z	Z	 various youth, health, welfare and community betterment activities throughout the <font color=green>state</font> . Miss Sally May Saabye,( Miss Rhode Island 1960) says that	3	2	1.38404500176643	0.666666666666667	6
state/NN/br-h08/1251	-0.0621342699329201	-0.063498583013159	state	NN	miscellaneous	non-fiction	A5	A	AB	ABC	Z	Z	Z	Z	Z	 peace and promoting the advancement of all people, the United <font color=green>States</font>  of America joined in founding the United Nations. The United	1	0	0.910021919108038	0	5
state/NN/br-h08/1654	-0.155286582514668	-0.0927201580682917	state	NN	miscellaneous	non-fiction	A	A	AB	ABC	Z	Z	Z	Z	Z	 pursue a career and to develop others for the professional <font color=green>state</font> ; And now, therefore, do I, John A. Notte, Jr., Governor	1	0	0.314597573082709	0	6
state/NN/br-h08/650	-0.0159388224150419	-0.105449426406153	state	NN	miscellaneous	non-fiction	A5	A	AB	ABC	Z	Z	Z	Z	Z	 one hundred and eighty-sixth. Governor. The President of the United <font color=green>States</font> , pursuant to a Joint Resolution of Congress, has issued a	1	0	0.824275429625387	0	5
state/NN/br-h08/796	-0.0875891137102101	-0.0736473704496491	state	NN	miscellaneous	non-fiction	A5	A	AB	ABC	Z	Z	Z	Z	Z	 is carrying out its historic mission of linking the United <font color=green>States</font>  of America with friendly nations across the seas; And now	1	0	0.99263987718337	0	7
state/NN/br-h09/1237	0.00324488494859316	-0.0541117339114922	state	NN	miscellaneous	non-fiction	C	C	C	ABC	secretary_of_state%1:18:00::	C1	C	C	ABC	 development may, subject to the approval of the Secretary of <font color=green>State</font>  to assure that such activities are consistent with the foreign	1	1	1.19668219648253	1	8
state/NN/br-h09/1253	-0.0227488585618471	0.00486755085065423	state	NN	miscellaneous	non-fiction	A5	A	AB	ABC	united_states%1:14:00::	A52	A	AB	ABC	 are consistent with the foreign policy objectives of the United <font color=green>States</font> , be expended in cooperation with public or private agencies in	1	0	1.40990280010993	0	7
state/NN/br-h09/1279	-0.0143823512516554	0.00942694349568443	state	NN	miscellaneous	non-fiction	A5	A	AB	ABC	united_states%1:15:00::	A51	A	AB	ABC	 development of processes useful to the program in the United <font color=green>States</font> : And provided further, That every such contract or agreement made	1	0	0.612570456902997	0	5
state/NN/br-h09/1325	0.0102633628259485	0.0151217113094869	state	NN	miscellaneous	non-fiction	A5	A	AB	ABC	united_states%1:14:00::	A52	A	AB	ABC	 connection therewith shall be available without cost to the United <font color=green>States</font>  for the use of the United States throughout the world	1	0	1.04922447481145	0	7
state/NN/br-h09/1332	0.00622234811291043	0.0133479388279213	state	NN	miscellaneous	non-fiction	A5	A	AB	ABC	united_states%1:14:00::	A52	A	AB	ABC	 to the United States for the use of the United <font color=green>States</font>  throughout the world and for the use of the general	1	0	1.03161013479829	0	7
state/NN/br-h09/1347	-0.00517144884164997	-0.00574374501057143	state	NN	miscellaneous	non-fiction	A5	A	AB	ABC	united_states%1:15:00::	A51	A	AB	ABC	 for the use of the general public within the United <font color=green>States</font> . Section 4 of the joint resolution of September 2, 1958	1	0	1.32988193979896	0	6
state/NN/br-h09/14	0.00829944304804358	-0.0746561705122061	state	NN	miscellaneous	non-fiction	A5	A	AB	ABC	united_states_of_america%1:15:00::	A51	A	AB	ABC	 by the Senate and House of Representatives of the United <font color=green>States</font>  of America in Congress assembled, That the Act of July	1	0	1.71926661374821	0	6
state/NN/br-h09/1488	0.000282766642206	-0.0124069508080329	state	NN	miscellaneous	non-fiction	A3	A	AB	ABC	state%1:14:01::	B	B	AB	ABC	 Congress. Upon such sale, there shall be returned to any <font color=green>State</font>  or public agency which has contributed financial assistance under section	4	4	1.14878475136572	1	9
state/NN/br-h09/1534	0.0180103614631048	-0.0875643198103076	state	NN	miscellaneous	non-fiction	A5	A	AB	ABC	united_states_of_america%1:15:00::	A51	A	AB	ABC	 by the Senate and House of Representatives of the United <font color=green>States</font>  of America in Congress assembled, That the Secretary of the	1	0	1.93207322606978	0	6
state/NN/br-h09/1659	0.0238826731806778	-0.199621769199551	state	NN	miscellaneous	non-fiction	A3	A	AB	ABC	state%1:14:01::	B	B	AB	ABC	 coal and lignite mines); and the scope and adequacy of <font color=green>State</font>  mine safety laws applicable to such mines and the enforcement	3	3	1.58526522035567	1	8
state/NN/br-h09/1709	0.180150603630322	-0.230714410178236	state	NN	miscellaneous	non-fiction	A4	A	AB	ABC	state%1:14:01::	B	B	AB	ABC	 of, any metal or nonmetallic mine which is in a <font color=green>State</font> ( excluding any coal or lignite mine), the products of which	3	2	1.09702005235306	0.666666666666667	5
state/NN/br-h09/172	0.203156840458767	-0.0443077006285142	state	NN	miscellaneous	non-fiction	A5	A	AB	ABC	united_states%1:15:00::	A51	A	AB	ABC	 other mineralized or chemically charged water, and the term' United <font color=green>States</font> ' extends to and includes the District of Columbia, the Commonwealth	1	0	2.05152951483702	0	5
state/NN/br-h09/1765	0.199098539051554	0.0201499186100335	state	NN	miscellaneous	non-fiction	Z	Z	Z	Z	state%1:14:01::	B	B	AB	ABC	 of this Act. As used in this section- the term`` <font color=green>State</font> '' includes the Commonwealth of Puerto Rico and any possession of	1	0	1.53667584174113	0	10
state/NN/br-h09/1779	0.242183650747199	0.017943151195369	state	NN	miscellaneous	non-fiction	A5	A	AB	ABC	united_states%1:14:00::	A52	A	AB	ABC	 Commonwealth of Puerto Rico and any possession of the United <font color=green>States</font> ; and the term`` commerce'' means commerce between any State and	1	0	2.11762263606786	0	8
state/NN/br-h09/1791	0.161185887254499	-0.0607413767449454	state	NN	miscellaneous	non-fiction	A4	A	AB	ABC	state%1:14:01::	B	B	AB	ABC	 United States; and the term`` commerce'' means commerce between any <font color=green>State</font>  and any place outside thereof, or between points within the	4	5	1.86877006110889	1.25	8
state/NN/br-h09/1804	0.176357523270718	-0.161898991746284	state	NN	miscellaneous	non-fiction	A4	A	AB	ABC	state%1:14:01::	B	B	AB	ABC	 any place outside thereof, or between points within the same <font color=green>State</font>  but through any place outside thereof. The Secretary of the	4	2	2.26605906610401	0.5	6
state/NN/br-h09/1886	0.0180103614631048	-0.0875643198103076	state	NN	miscellaneous	non-fiction	A5	A	AB	ABC	united_states_of_america%1:15:00::	A51	A	AB	ABC	 by the Senate and House of Representatives of the United <font color=green>States</font>  of America in Congress assembled, That the Secretary of the	1	0	1.93207322606978	0	6
state/NN/br-h09/197	0.164698724548967	0.0257153376214896	state	NN	miscellaneous	non-fiction	A5	A	AB	ABC	united_states%1:14:00::	A52	A	AB	ABC	 Puerto Rico, and the territories and possessions of the United <font color=green>States</font> . In order to accomplish the purposes of this Act, the	1	0	1.26362910992977	0	5
state/NN/br-h09/431	-0.0397445850854106	0.0420435619875795	state	NN	miscellaneous	non-fiction	A5	A	AB	ABC	united_states%1:15:00::	A51	A	AB	ABC	 for beneficial consumptive purposes in various parts of the United <font color=green>States</font>  by the leading saline water processes as compared with other	1	0	0.759741677913991	0	4
state/NN/br-h09/634	-0.068563588765275	0.0338501705975096	state	NN	miscellaneous	non-fiction	A5	A	AB	ABC	united_states%1:15:00::	A51	A	AB	ABC	 and, in the case of projects located in the United <font color=green>States</font> , cooperate and participate in their development in instances in which	1	0	0.884490712209754	0	7
state/NN/br-h09/704	0.0610317920163017	0.0921084642839417	state	NN	miscellaneous	non-fiction	A3	A	AB	ABC	state_department%1:14:01::	C2	C	C	ABC	 projects; and cooperate with other Federal departments and agencies, with <font color=green>State</font>  and local departments, agencies, and instrumentalities, and with interested persons	4	5	2.02575958976902	1.25	7
state/NN/br-h09/832	-0.00593298159882977	-0.0138431224903434	state	NN	miscellaneous	non-fiction	C	C	C	ABC	department_of_state%1:14:00::	C1	C	C	ABC	 the Department of Health Education and Welfare, the Department of <font color=green>State</font> , and other concerned agencies shall also be carried out in	2	3	1.3828258952815	1.5	10
state/NN/br-h09/859	0.083465400205896	-0.054207722391724	state	NN	miscellaneous	non-fiction	A5	A	AB	ABC	united_states%1:15:00::	A51	A	AB	ABC	 the objectives of this Act. All research within the United <font color=green>States</font>  contracted for, sponsored, cosponsored, or authorized under authority of this	1	0	1.46419576680721	0	6
state/NN/br-h10/1667	0.0121557920715945	-0.124272913377439	state	NN	miscellaneous	non-fiction	A5	A	AB	ABC	Z	Z	Z	Z	Z	 established in 1949, has published, since January 1950, the United <font color=green>States</font>  Armed Forces Medical Journal as a triservice publication to furnish	1	0	0.749230970034271	0	5
state/NN/br-h11/1680	-0.072231787484924	-0.241769093099755	state	NN	miscellaneous	non-fiction	A5	A	AB	ABC	united_states%1:15:00::	A51	A	AB	ABC	 Canada, The Netherlands, United Kingdom, U. S. S. R., United <font color=green>States</font> , and West Germany, met at the NBS to devise means	1	0	0.984261449244929	0	4
state/NN/br-h12/1064	0.154347882606143	0.138485069818359	state	NN	miscellaneous	non-fiction	A5	A	AB	ABC	united_states%1:14:00::	A52	A	AB	ABC	 8, as reimbursement for the expenses incurred by the United <font color=green>States</font> , an amount equal to 5 per centum of such payment	1	0	1.00709466890641	0	5
state/NN/br-h12/1180	0.0476030718375912	-0.17321445997887	state	NN	miscellaneous	non-fiction	A5	A	AB	ABC	united_states%1:14:00::	A52	A	AB	ABC	 or persons found by the Comptroller General of the United <font color=green>States</font>  to be entitled thereto, without the necessity of compliance with	1	0	0.891452687536379	0	3
state/NN/br-h12/12	0.0190216613811211	0.0410172263363831	state	NN	miscellaneous	non-fiction	A5	A	AB	ABC	united_states%1:14:00::	A52	A	AB	ABC	 In addition to the penalties provided in title 18, United <font color=green>States</font>  Code, section 1001, any person guilty of any act, as	1	0	1.01024331131221	0	7
state/NN/br-h12/1261	0.0922989936283144	-0.194716267932803	state	NN	miscellaneous	non-fiction	A5	A	AB	ABC	united_states%1:14:00::	A52	A	AB	ABC	 or persons found by the Comptroller General of the United <font color=green>States</font>  to be entitled thereto; if a receiver or trustee for	1	0	1.02291424167731	0	2
state/NN/br-h12/1291	0.147054216046136	-0.0304231450518752	state	NN	miscellaneous	non-fiction	A5	A	AB	ABC	united_states%1:15:00::	A51	A	AB	ABC	 appointed by a court of competent jurisdiction in the United <font color=green>States</font>  and has not been discharged prior to the date of	1	0	1.49373553359911	0	9
state/NN/br-h12/1345	0.14373147452481	-0.0557401273771865	state	NN	miscellaneous	non-fiction	A5	A	AB	ABC	united_states%1:15:00::	A51	A	AB	ABC	 appointed by a court of competent jurisdiction in the United <font color=green>States</font> , makes an assignment of the claim, or any part thereof	1	0	2.15938134203447	0	6
state/NN/br-h12/1473	0.184079379216751	-0.0929553756947971	state	NN	miscellaneous	non-fiction	A5	A	AB	ABC	united_states%1:14:00::	A52	A	AB	ABC	 of the Treasury, or the Comptroller General of the United <font color=green>States</font> , as the case may be, shall find that any person	1	0	1.42867091977824	0	3
state/NN/br-h12/1519	-0.00236934664436647	0.0484584870524052	state	NN	miscellaneous	non-fiction	A5	A	AB	ABC	united_states%1:14:00::	A52	A	AB	ABC	 bar to recovery by any other person against the United <font color=green>States</font> , its officers, agents, or employees with respect to such payment	1	0	1.16584741587333	0	7
state/NN/br-h12/1573	0.0806148970431179	0.140440690320525	state	NN	miscellaneous	non-fiction	A5	A	AB	ABC	united_states%1:14:00::	A52	A	AB	ABC	 construed as the assumption of any liability by the United <font color=green>States</font>  for the payment or satisfaction, in whole or in part	1	0	0.894023232004532	0	5
state/NN/br-h12/1597	0.0130760189527486	-0.044832135827651	state	NN	miscellaneous	non-fiction	A5	A	AB	ABC	united_states%1:15:00::	A51	A	AB	ABC	 any claim on behalf of any national of the United <font color=green>States</font>  against any foreign government. There are hereby created in the	1	0	1.3878013993907	0	5
state/NN/br-h12/1613	0.178652559093149	0.0207479502680125	state	NN	miscellaneous	non-fiction	A5	A	AB	ABC	united_states%1:14:00::	A52	A	AB	ABC	 There are hereby created in the Treasury of the United <font color=green>States</font> ( 1) a special fund to be known as the Yugoslav	1	0	0.976768262164129	0	5
state/NN/br-h12/1681	0.0225847860671121	-0.0428079962052803	state	NN	miscellaneous	non-fiction	A5	A	AB	ABC	united_states%1:15:00::	A51	A	AB	ABC	 into a settlement agreement with the Government of the United <font color=green>States</font>  as described in subsection( a) of section 4 of this	1	0	1.3245096649713	0	5
state/NN/br-h12/1839	0.00838215801031628	-0.00886778601947275	state	NN	miscellaneous	non-fiction	A5	A	AB	ABC	united_states_dollar%1:23:00::	A52	A	AB	ABC	 a) of this section any amounts hereafter paid, in United <font color=green>States</font>  dollars, by a foreign government which has entered into a	1	0	1.08793197526029	0	8
state/NN/br-h12/1860	0.0240541859660639	-0.0358422787908923	state	NN	miscellaneous	non-fiction	A5	A	AB	ABC	united_states%1:15:00::	A51	A	AB	ABC	 a claims settlement agreement with the Government of the United <font color=green>States</font>  as described in subsection( a) of section 4 of this	1	0	1.38686129336252	0	6
state/NN/br-h12/2127	0.136155976891109	-0.065468844246392	state	NN	miscellaneous	non-fiction	C	C	C	ABC	secretary_of_state%1:18:01::	C1	C	C	ABC	 of the Treasury, upon the concurrence of the Secretary of <font color=green>State</font> , is authorized and directed, out of the sum covered into	3	3	1.63030675999077	1	6
state/NN/br-h12/2215	0.135729605505757	-0.0864630951131213	state	NN	miscellaneous	non-fiction	C	C	C	ABC	secretary_of_state%1:18:01::	C1	C	C	ABC	 of the Yugoslav Claims Agreement of 1948. The Secretary of <font color=green>State</font>  shall certify to the Secretary of the Treasury the total	3	4	1.91422110095037	1.33333333333333	5
state/NN/br-h12/2273	0.0711603111716701	-0.0412164986167796	state	NN	miscellaneous	non-fiction	A5	A	AB	ABC	united_states%1:14:00::	A52	A	AB	ABC	 other official or department, agency, or establishment of the United <font color=green>States</font> . There is hereby authorized to be appropriated, out of any	1	0	1.574701503935	0	6
state/NN/br-h12/298	0.0989710507406711	0.0172939941310751	state	NN	miscellaneous	non-fiction	A5	A	AB	ABC	united_states%1:15:00::	A51	A	AB	ABC	 of the provisions of this subsection. Whoever, in the United <font color=green>States</font>  or elsewhere, pays or offers to pay, or promises to	1	0	1.21114532747958	0	6
state/NN/br-h12/457	0.0256363844052664	-0.0542923734467814	state	NN	miscellaneous	non-fiction	A5	A	AB	ABC	united_states%1:14:00::	A52	A	AB	ABC	 of Justice as may be necessary to represent the United <font color=green>States</font>  as to any claims of the Government of the United	3	1	1.28500410897638	0.333333333333333	4
state/NN/br-h12/468	0.0974011684837892	-0.0246868424662619	state	NN	miscellaneous	non-fiction	A5	A	AB	ABC	united_states%1:15:00::	A51	A	AB	ABC	 as to any claims of the Government of the United <font color=green>States</font>  with respect to which the Commission has jurisdiction under this	1	0	1.6389486785112	0	6
state/NN/br-h12/512	0.112027873164414	-0.0386724542877552	state	NN	miscellaneous	non-fiction	A5	A	AB	ABC	united_states%1:15:00::	A51	A	AB	ABC	 made by the Commission to the Government of the United <font color=green>States</font>  shall be covered into the Treasury to the credit of	1	0	1.23591519701573	0	5
state/NN/br-h12/691	0.018613973823405	-0.0363372176813922	state	NN	miscellaneous	non-fiction	C	C	C	ABC	secretary_of_state%1:18:01::	C1	C	C	ABC	 fact and not subject to review by the Secretary of <font color=green>State</font>  or any other official, department, agency, or establishment of the	3	3	1.60387627888731	1	8
state/NN/br-h12/706	0.0174407195093413	-0.0539182939832564	state	NN	miscellaneous	non-fiction	A5	A	AB	ABC	united_states%1:14:00::	A52	A	AB	ABC	 any other official, department, agency, or establishment of the United <font color=green>States</font>  or by any court by mandamus or otherwise. The Commission	1	0	1.4640480268345	0	5
state/NN/br-h12/810	0.0751940180579068	-0.0627926761278123	state	NN	miscellaneous	non-fiction	C	C	C	ABC	secretary_of_state%1:18:01::	C1	C	C	ABC	 the Secretary of the Treasury and to the Secretary of <font color=green>State</font>  copies of the awards made in favor of the Government	3	4	1.87593219393754	1.33333333333333	7
state/NN/br-h12/824	0.0394947272973856	-0.016100793335226	state	NN	miscellaneous	non-fiction	A5	A	AB	ABC	united_states%1:15:00::	A51	A	AB	ABC	 awards made in favor of the Government of the United <font color=green>States</font>  or of nationals of the United States under this Title	1	0	1.4537245316757	0	5
state/NN/br-h12/831	0.0818779591985396	-0.00811273156427608	state	NN	miscellaneous	non-fiction	A5	A	AB	ABC	united_states%1:15:00::	A51	A	AB	ABC	 of the United States or of nationals of the United <font color=green>States</font>  under this Title. The Commission shall certify to the Secretary	1	0	1.6108591025892	0	3
state/NN/br-h12/844	0.099586125318233	-0.0893530831183394	state	NN	miscellaneous	non-fiction	C	C	C	ABC	secretary_of_state%1:18:01::	C1	C	C	ABC	 this Title. The Commission shall certify to the Secretary of <font color=green>State</font> , upon his request, copies of the formal submissions of claims	1	1	1.48539723396079	1	6
state/NN/br-h13/1432	-0.194122850150525	-0.184539066125543	state	NN	miscellaneous	non-fiction	A5	A	AB	ABC	united_states%1:15:00::	A51	A	AB	ABC	 and planes in Cuba jeopardize the security of the United <font color=green>States</font> , violate the Monroe Doctrine, and threaten the security of every	1	0	1.17614053894141	0	8
state/NN/br-h13/1525	-0.0333463540046276	-0.0782687648102354	state	NN	miscellaneous	non-fiction	A5	A	AB	ABC	united_states%1:15:00::	A51	A	AB	ABC	 Cuba off the Inter-American Defense Board. For years the United <font color=green>States</font>  had been trying to get these countries to exclude Castro	1	0	0.910596284720869	0	6
state/NN/br-h13/1758	-0.131862597653609	0.00325412225976337	state	NN	miscellaneous	non-fiction	A5	A	AB	ABC	united_states%1:14:00::	A52	A	AB	ABC	 and agents to threaten the Americas. How can the United <font color=green>States</font>  act? Blockade is one answer offered by experts. In it	2	0	1.12307680834359	0	6
state/NN/br-h13/1947	-0.170501253365666	-0.12986125929695	state	NN	miscellaneous	non-fiction	A5	A	AB	ABC	united_states%1:14:00::	A52	A	AB	ABC	 most severe reprisal, short of declared war, that the United <font color=green>States</font>  could invoke against Castro. It is the strategy of blockade	1	0	1.25115030251443	0	5
state/NN/br-h14/1016	0.158527649896231	0.108016867103163	state	NN	miscellaneous	non-fiction	A	A	AB	ABC	state%1:15:01::	A	A	AB	ABC	 which bears the same ratio to 50% as the particular <font color=green>State</font>  's average per capita income bears to the average per	4	3	2.16764508583019	0.75	10
state/NN/br-h14/1049	0.0381807365074896	0.0358658966588978	state	NN	miscellaneous	non-fiction	A	A	AB	ABC	state%1:15:01::	A	A	AB	ABC	 in item 3 above by the result obtained for each <font color=green>State</font>  in item 1 above.) Determine the particular State 's`` allotment	3	2	2.10198571957333	0.666666666666667	9
state/NN/br-h14/1059	0.0557176137819707	0.0299427372231089	state	NN	miscellaneous	non-fiction	A	A	AB	ABC	state%1:15:01::	A	A	AB	ABC	 for each State in item 1 above.) Determine the particular <font color=green>State</font>  's`` allotment percentage''. By law this is 75% for the	5	4	2.11266699538498	0.8	9
state/NN/br-h14/1102	0.0540918250811028	0.0276199752197313	state	NN	miscellaneous	non-fiction	A	A	AB	ABC	state%1:15:01::	A	A	AB	ABC	 in effect prior to fiscal year 1962.) In all other <font color=green>States</font>  it is the difference obtained by subtracting from 100 the	1	0	1.09982413748378	0	7
state/NN/br-h14/1123	0.116764706794699	0.0748182257038142	state	NN	miscellaneous	non-fiction	A	A	AB	ABC	state%1:15:01::	A	A	AB	ABC	 the result obtained in item 4 above; except that no <font color=green>State</font>  shall have an allotment percentage less than 33- 1 3	2	2	2.13410536200728	1	7
state/NN/br-h14/1149	0.0208809710424864	0.0198078839241007	state	NN	miscellaneous	non-fiction	A	A	AB	ABC	state%1:15:01::	A	A	AB	ABC	 more than 75%. If the resulting difference for the particular <font color=green>State</font>  is less or more than these extremes, the State 's	4	2	1.37468823965617	0.5	4
state/NN/br-h14/1159	0.0971211818250283	0.0402071333440692	state	NN	miscellaneous	non-fiction	A	A	AB	ABC	state%1:15:01::	A	A	AB	ABC	 particular State is less or more than these extremes, the <font color=green>State</font>  's allotment percentage must be raised or lowered to the	4	2	1.9161769096294	0.5	6
state/NN/br-h14/1175	0.0759028060511362	0.0400362168628979	state	NN	miscellaneous	non-fiction	A	A	AB	ABC	state%1:15:01::	A	A	AB	ABC	 be raised or lowered to the appropriate extreme. Square each <font color=green>State</font>  's allotment percentage. Determine each State 's population.( See Source	4	3	1.71402793969021	0.75	9
state/NN/br-h14/1182	0.0697288167500037	0.0395275681695213	state	NN	miscellaneous	non-fiction	A	A	AB	ABC	state%1:15:01::	A	A	AB	ABC	 appropriate extreme. Square each State 's allotment percentage. Determine each <font color=green>State</font>  's population.( See Source of Data, below for population data	4	3	1.5352323349333	0.75	9
state/NN/br-h14/1209	0.144408951281481	0.0842958067176266	state	NN	miscellaneous	non-fiction	A	A	AB	ABC	state%1:15:01::	A	A	AB	ABC	 be used in this step.) Multiply the population of each <font color=green>State</font>  by the square of its allotment percentage.( Multiply result obtained	3	3	1.57557189628669	1	8
state/NN/br-h14/1251	0.0474595306031989	0.0326574188917289	state	NN	miscellaneous	non-fiction	A	A	AB	ABC	state%1:15:01::	A	A	AB	ABC	 the products obtained in item 8 above, for all the <font color=green>States</font> .( For each State, make all computations set forth in items	2	1	1.79382861030334	0.5	6
state/NN/br-h14/1256	0.0360530484397977	0.020981383168398	state	NN	miscellaneous	non-fiction	A	A	AB	ABC	state%1:15:01::	A	A	AB	ABC	 in item 8 above, for all the States.( For each <font color=green>State</font> , make all computations set forth in items 1 to 8	1	1	1.46409564052838	1	5
state/NN/br-h14/1278	0.0852166935324386	0.0947185005142375	state	NN	miscellaneous	non-fiction	A	A	AB	ABC	state%1:15:01::	A	A	AB	ABC	 8 above, and then add the results obtained for each <font color=green>State</font>  in item 8.) Determine the ratio that the amount being	1	0	1.77829142815554	0	7
