id	model.x	model.y	lemma	pos	genre	broad_genre	marisense	mbroad	mari3	mari2	sensekey	wnsense	wnbroad	wn3	wn2	text	cues	cues_with_weight	mean_weight_x100	wcratio_x100	weighted_cw	wf	new_pos	new_broad_genre
state/NN/br-g01/1187	0.271401906029525	-0.0520845745575741	state	NN	belles_lettres	fiction	A	A	AB	ABC	state%1:15:01::	A	A	AB	ABC	 traditional way of life persists much more in the older <font color=green>states</font>  than in the new ones. Probably a larger percentage of	5	0	252	0	1	states	NNS	fiction
state/NN/br-g01/1276	-0.171935074421558	0.190326668907864	state	NN	belles_lettres	fiction	A4	A	AB	ABC	state%1:15:01::	A	A	AB	ABC	 of course, important minority enclaves. The long settled areas of <font color=green>states</font>  like Virginia and South Carolina developed the ante-bellum culture to	4	1	211	25	3	states	NNS	fiction
state/NN/br-g01/1429	-0.0344161275384509	0.270945143125354	state	NN	belles_lettres	fiction	A	A	AB	ABC	state%1:15:01::	A	A	AB	ABC	 by the mother country. And no doubt many people in <font color=green>states</font>  like the Carolinas and Georgia, which were among the most	3	1	128	33	1	states	NNS	fiction
state/NN/br-g01/1498	-0.131681443015675	0.0583837219438279	state	NN	belles_lettres	fiction	A	A	AB	ABC	state%1:15:01::	A	A	AB	ABC	 that except for Northern meddling it would have ended in <font color=green>states</font>  like Virginia years before it did. Southern resentment has been	2	2	152	100	5	states	NNS	fiction
state/NN/br-g01/26	0.066039074131101	0.174880744066604	state	NN	belles_lettres	fiction	C	C	C	ABC	welfare_state%1:14:00::	B	B	AB	ABC	 also led the nation in the direction of a welfare <font color=green>state</font> . And both in their objectives of non-discrimination and of social	4	2	229	50	2	state	NN	fiction
state/NN/br-g01/454	-0.0719804419892127	0.0456642866244749	state	NN	belles_lettres	fiction	A1	A	AB	ABC	state%1:15:01::	A	A	AB	ABC	 to coerce an uncooperative Congress or Supreme Court. As for <font color=green>states</font> ' rights, they have never counted in the thinking of my	4	1	184	25	4	states	NNS	fiction
state/NN/br-g17/2109	-0.0121216799460414	0.395820186077641	state	NN	belles_lettres	fiction	A5	A	AB	ABC	united_states%1:15:00::	A51	A	AB	ABC	 the chief universities, colleges, and preparatory schools of the United <font color=green>States</font> . Why should this be so? It is true that New	1	0	183	0	1	States	NNPS	fiction
state/NN/br-g17/2194	-0.177190328009991	0.0820761615284318	state	NN	belles_lettres	fiction	A	A	AB	ABC	state%1:15:01::	A	A	AB	ABC	 country? Is n't it a bit odd that the three <font color=green>states</font>  of Southern New England( Massachusetts, Connecticut, and Rhode Island) have	4	2	177	50	4	states	NNS	fiction
state/NN/br-g17/2210	0.00792178355840526	0.144478216600538	state	NN	belles_lettres	fiction	A2	A	AB	ABC	state%1:15:01::	A	A	AB	ABC	 Southern New England( Massachusetts, Connecticut, and Rhode Island) have had <font color=green>state</font>  institutions of university status only in the very recent past	5	2	196	40	4	state	NN	fiction
state/NN/br-g17/2310	0.0364735013904113	0.171906738132477	state	NN	belles_lettres	fiction	A	A	AB	ABC	state%1:15:01::	A	A	AB	ABC	 the West? Is it not ironical that Roger Williams 's <font color=green>state</font> , Rhode Island, should have been the very last of the	1	0	168	0	3	state	NN	fiction
state/NN/br-g19/545	0.0884982028646055	0.312872120705846	state	NN	belles_lettres	fiction	A5	A	AB	ABC	united_states%1:15:00::	A51	A	AB	ABC	 of the giant corporations in Western Europe and the United <font color=green>States</font>  dates from the period 1880- 1900. Now, although the roots	1	0	206	0	2	States	NNPS	fiction
state/NN/br-g21/1159	-0.364390596097858	-0.0932381850698558	state	NN	belles_lettres	fiction	A5	A	AB	ABC	united_states%1:14:00::	A52	A	AB	ABC	 During the next five years liberal leaders in the United <font color=green>States</font>  sank in the cumulative confusion attendant upon and manifested in	1	0	107	0	1	States	NNPS	fiction
state/NN/br-g21/2009	-0.169226841931853	0.000283449088788974	state	NN	belles_lettres	fiction	A5	A	AB	ABC	united_states%1:14:00::	A52	A	AB	ABC	 same refrain mentioned above:`` The paramount goal of the United <font color=green>States</font> , set long ago, was to guard the rights of the	1	0	114	0	2	States	NNPS	fiction
state/NN/br-g21/2184	-0.222334201660243	-0.309656295869024	state	NN	belles_lettres	fiction	D	D	D	D	state%1:03:00::	D1	D	D	D	 to you an uncertain and uneasy, not to say confused, <font color=green>state</font>  of the public mind? What is the common man 's	4	2	156	50	2	state	NN	fiction
state/NN/br-g21/244	0.125228159604127	-0.143094288481789	state	NN	belles_lettres	fiction	A5	A	AB	ABC	united_states%1:14:00::	A52	A	AB	ABC	 to be the duty of the destiny of the United <font color=green>States</font>  to assist in the creation of a better world by	1	0	183	0	3	States	NNPS	fiction
state/NN/br-g21/991	-0.114377103999405	-0.439826727366455	state	NN	belles_lettres	fiction	C	C	C	ABC	state%1:14:01::	B	B	AB	ABC	 the Marxist dream of a classless society under a Socialist <font color=green>State</font> . And the USSR existed as the revolutionary experiment in radical	4	0	138	0	1	State	NNP	fiction
state/NN/br-g22/1822	0.0442447618195141	0.082659307968122	state	NN	belles_lettres	fiction	B	B	AB	ABC	state%1:14:01::	B	B	AB	ABC	 acting as controllers of the corporation whose responsibility to the <font color=green>state</font>  would now be defined against proprietorship because employees and proprietors	3	1	185	33	2	state	NN	fiction
state/NN/br-g22/594	0.0160710381023394	0.116729594630292	state	NN	belles_lettres	fiction	C	C	C	ABC	state_department%1:14:00::	C1	C	C	ABC	 of`` The Soviet Cultural Offensive'', he says,`` Long before the <font color=green>State</font>  Department organized its bureaucracy into an East-West Contacts Staff in	2	1	172	50	2	State	NNP	fiction
state/NN/br-g22/643	0.00102049211608371	0.118481064602091	state	NN	belles_lettres	fiction	C	C	C	ABC	state_department%1:14:00::	C1	C	C	ABC	 when the enterprising promoters of' Porgy and Bess' overrode the <font color=green>State</font>  Department to carry the contemporary' cultural warfare' behind the enemy	1	1	179	100	2	State	NNP	fiction
state/NN/br-g28/1728	-0.138982967948091	0.136373771850284	state	NN	belles_lettres	fiction	A4	A	AB	ABC	state%1:15:01::	A	A	AB	ABC	 preacher and a college and university president in four Southern <font color=green>states</font> , published the earliest of these backwoods sketches and in the	1	1	152	100	3	states	NNS	fiction
state/NN/br-g43/2228	-0.175746294039288	-0.0462704590577387	state	NN	belles_lettres	fiction	D	D	D	D	state_of_affairs%1:26:00::	D1	D	D	D	 a search for the human significance of an event or <font color=green>state</font>  of affairs, a tendency to look at wholes rather than	2	1	125	50	2	state	NN	fiction
state/NN/br-h09/1237	-0.00744995693991911	0.0391131591863067	state	NN	miscellaneous	non-fiction	C	C	C	ABC	secretary_of_state%1:18:00::	C1	C	C	ABC	 development may, subject to the approval of the Secretary of <font color=green>State</font>  to assure that such activities are consistent with the foreign	1	1	179	100	5	State	NNP	technical
state/NN/br-h09/1253	0.00952758295010854	-0.0348586746278133	state	NN	miscellaneous	non-fiction	A5	A	AB	ABC	united_states%1:14:00::	A52	A	AB	ABC	 are consistent with the foreign policy objectives of the United <font color=green>States</font> , be expended in cooperation with public or private agencies in	1	0	181	0	4	States	NNPS	technical
state/NN/br-h09/1279	0.00198514578753234	-0.0993285307620514	state	NN	miscellaneous	non-fiction	A5	A	AB	ABC	united_states%1:15:00::	A51	A	AB	ABC	 development of processes useful to the program in the United <font color=green>States</font> : And provided further, That every such contract or agreement made	1	0	111	0	1	States	NNPS	technical
state/NN/br-h09/1325	0.022684539768687	-0.00642833809655558	state	NN	miscellaneous	non-fiction	A5	A	AB	ABC	united_states%1:14:00::	A52	A	AB	ABC	 connection therewith shall be available without cost to the United <font color=green>States</font>  for the use of the United States throughout the world	1	0	139	0	5	States	NNPS	technical
state/NN/br-h09/1332	0.0280779306635632	-0.0137893345650067	state	NN	miscellaneous	non-fiction	A5	A	AB	ABC	united_states%1:14:00::	A52	A	AB	ABC	 to the United States for the use of the United <font color=green>States</font>  throughout the world and for the use of the general	1	0	149	0	4	States	NNPS	technical
state/NN/br-h09/1347	0.00206010993291439	0.00691921124529958	state	NN	miscellaneous	non-fiction	A5	A	AB	ABC	united_states%1:15:00::	A51	A	AB	ABC	 for the use of the general public within the United <font color=green>States</font> . Section 4 of the joint resolution of September 2, 1958	1	0	143	0	5	States	NNPS	technical
state/NN/br-h09/14	-0.0145325772790174	0.0294532154289267	state	NN	miscellaneous	non-fiction	A5	A	AB	ABC	united_states_of_america%1:15:00::	A51	A	AB	ABC	 by the Senate and House of Representatives of the United <font color=green>States</font>  of America in Congress assembled, That the Act of July	1	0	172	0	6	States	NNPS	technical
state/NN/br-h09/1488	0.0244502440937136	0.0269990558918981	state	NN	miscellaneous	non-fiction	A3	A	AB	ABC	state%1:14:01::	B	B	AB	ABC	 Congress. Upon such sale, there shall be returned to any <font color=green>State</font>  or public agency which has contributed financial assistance under section	4	3	164	75	5	State	NNP	technical
state/NN/br-h09/1534	-0.012870531781267	0.0509688564613269	state	NN	miscellaneous	non-fiction	A5	A	AB	ABC	united_states_of_america%1:15:00::	A51	A	AB	ABC	 by the Senate and House of Representatives of the United <font color=green>States</font>  of America in Congress assembled, That the Secretary of the	1	0	193	0	6	States	NNPS	technical
state/NN/br-h09/1659	-0.10839874313582	-0.032550541352144	state	NN	miscellaneous	non-fiction	A3	A	AB	ABC	state%1:14:01::	B	B	AB	ABC	 coal and lignite mines); and the scope and adequacy of <font color=green>State</font>  mine safety laws applicable to such mines and the enforcement	3	3	179	100	7	State	NNP	technical
state/NN/br-h09/1709	0.188342430944085	-0.179097100298742	state	NN	miscellaneous	non-fiction	A4	A	AB	ABC	state%1:14:01::	B	B	AB	ABC	 of, any metal or nonmetallic mine which is in a <font color=green>State</font> ( excluding any coal or lignite mine), the products of which	3	2	134	67	3	State	NNP	technical
state/NN/br-h09/172	0.139422642304035	0.0731926941991128	state	NN	miscellaneous	non-fiction	A5	A	AB	ABC	united_states%1:15:00::	A51	A	AB	ABC	 other mineralized or chemically charged water, and the term' United <font color=green>States</font> ' extends to and includes the District of Columbia, the Commonwealth	1	0	252	0	4	States	NNPS	technical
state/NN/br-h09/1779	0.197682076763198	0.0423453759977191	state	NN	miscellaneous	non-fiction	A5	A	AB	ABC	united_states%1:14:00::	A52	A	AB	ABC	 Commonwealth of Puerto Rico and any possession of the United <font color=green>States</font> ; and the term`` commerce'' means commerce between any State and	1	0	234	0	7	States	NNPS	technical
state/NN/br-h09/1791	0.105099529914375	0.104021225944864	state	NN	miscellaneous	non-fiction	A4	A	AB	ABC	state%1:14:01::	B	B	AB	ABC	 United States; and the term`` commerce'' means commerce between any <font color=green>State</font>  and any place outside thereof, or between points within the	4	5	205	125	7	State	NNP	technical
state/NN/br-h09/1804	0.0877197194806722	0.15690686401298	state	NN	miscellaneous	non-fiction	A4	A	AB	ABC	state%1:14:01::	B	B	AB	ABC	 any place outside thereof, or between points within the same <font color=green>State</font>  but through any place outside thereof. The Secretary of the	4	2	227	50	6	State	NNP	technical
state/NN/br-h09/1886	-0.012870531781267	0.0509688564613269	state	NN	miscellaneous	non-fiction	A5	A	AB	ABC	united_states_of_america%1:15:00::	A51	A	AB	ABC	 by the Senate and House of Representatives of the United <font color=green>States</font>  of America in Congress assembled, That the Secretary of the	1	0	193	0	6	States	NNPS	technical
state/NN/br-h09/197	0.148890290836209	0.00329810646304147	state	NN	miscellaneous	non-fiction	A5	A	AB	ABC	united_states%1:14:00::	A52	A	AB	ABC	 Puerto Rico, and the territories and possessions of the United <font color=green>States</font> . In order to accomplish the purposes of this Act, the	1	0	195	0	3	States	NNPS	technical
state/NN/br-h09/431	0.110280072280295	-0.111455033826965	state	NN	miscellaneous	non-fiction	A5	A	AB	ABC	united_states%1:15:00::	A51	A	AB	ABC	 for beneficial consumptive purposes in various parts of the United <font color=green>States</font>  by the leading saline water processes as compared with other	1	0	104	0	1	States	NNPS	technical
state/NN/br-h09/634	-0.006580404618078	-0.100276327909654	state	NN	miscellaneous	non-fiction	A5	A	AB	ABC	united_states%1:15:00::	A51	A	AB	ABC	 and, in the case of projects located in the United <font color=green>States</font> , cooperate and participate in their development in instances in which	1	0	153	0	3	States	NNPS	technical
state/NN/br-h09/704	0.0926105788363615	0.0779950611191403	state	NN	miscellaneous	non-fiction	A3	A	AB	ABC	state_department%1:14:01::	C2	C	C	ABC	 projects; and cooperate with other Federal departments and agencies, with <font color=green>State</font>  and local departments, agencies, and instrumentalities, and with interested persons	4	5	226	125	6	State	NNP	technical
state/NN/br-h09/832	0.0164120126083646	0.0461789419180332	state	NN	miscellaneous	non-fiction	C	C	C	ABC	department_of_state%1:14:00::	C1	C	C	ABC	 the Department of Health Education and Welfare, the Department of <font color=green>State</font> , and other concerned agencies shall also be carried out in	2	3	216	150	5	State	NNP	technical
state/NN/br-h09/859	0.0479150894322987	0.053679068542978	state	NN	miscellaneous	non-fiction	A5	A	AB	ABC	united_states%1:15:00::	A51	A	AB	ABC	 the objectives of this Act. All research within the United <font color=green>States</font>  contracted for, sponsored, cosponsored, or authorized under authority of this	1	0	171	0	5	States	NNPS	technical
state/NN/br-h11/1680	-0.161179484252315	0.11254255808522	state	NN	miscellaneous	non-fiction	A5	A	AB	ABC	united_states%1:15:00::	A51	A	AB	ABC	 Canada, The Netherlands, United Kingdom, U. S. S. R., United <font color=green>States</font> , and West Germany, met at the NBS to devise means	1	0	122	0	3	States	NNPS	technical
state/NN/br-h12/1064	0.277150125963196	0.176681427806337	state	NN	miscellaneous	non-fiction	A5	A	AB	ABC	united_states%1:14:00::	A52	A	AB	ABC	 8, as reimbursement for the expenses incurred by the United <font color=green>States</font> , an amount equal to 5 per centum of such payment	1	0	168	0	2	States	NNPS	technical
state/NN/br-h12/1180	0.0771962034268236	0.245130341022838	state	NN	miscellaneous	non-fiction	A5	A	AB	ABC	united_states%1:14:00::	A52	A	AB	ABC	 or persons found by the Comptroller General of the United <font color=green>States</font>  to be entitled thereto, without the necessity of compliance with	1	0	128	0	1	States	NNPS	technical
state/NN/br-h12/12	0.077259214500242	0.0931038059329043	state	NN	miscellaneous	non-fiction	A5	A	AB	ABC	united_states%1:14:00::	A52	A	AB	ABC	 In addition to the penalties provided in title 18, United <font color=green>States</font>  Code, section 1001, any person guilty of any act, as	1	0	141	0	4	States	NNPS	technical
state/NN/br-h12/1261	0.0771962034268236	0.245130341022838	state	NN	miscellaneous	non-fiction	A5	A	AB	ABC	united_states%1:14:00::	A52	A	AB	ABC	 or persons found by the Comptroller General of the United <font color=green>States</font>  to be entitled thereto; if a receiver or trustee for	1	0	128	0	1	States	NNPS	technical
state/NN/br-h12/1291	0.126282092208783	0.076007792668293	state	NN	miscellaneous	non-fiction	A5	A	AB	ABC	united_states%1:15:00::	A51	A	AB	ABC	 appointed by a court of competent jurisdiction in the United <font color=green>States</font>  and has not been discharged prior to the date of	1	0	200	0	6	States	NNPS	technical
state/NN/br-h12/1345	0.0521188931419213	0.0969232999855252	state	NN	miscellaneous	non-fiction	A5	A	AB	ABC	united_states%1:15:00::	A51	A	AB	ABC	 appointed by a court of competent jurisdiction in the United <font color=green>States</font> , makes an assignment of the claim, or any part thereof	1	0	216	0	6	States	NNPS	technical
state/NN/br-h12/1473	0.153571368809732	0.153539832508872	state	NN	miscellaneous	non-fiction	A5	A	AB	ABC	united_states%1:14:00::	A52	A	AB	ABC	 of the Treasury, or the Comptroller General of the United <font color=green>States</font> , as the case may be, shall find that any person	1	0	187	0	2	States	NNPS	technical
state/NN/br-h12/1519	0.0311457871701905	0.0467276784768157	state	NN	miscellaneous	non-fiction	A5	A	AB	ABC	united_states%1:14:00::	A52	A	AB	ABC	 bar to recovery by any other person against the United <font color=green>States</font> , its officers, agents, or employees with respect to such payment	1	0	155	0	4	States	NNPS	technical
state/NN/br-h12/1573	0.203284707734412	0.147130184166996	state	NN	miscellaneous	non-fiction	A5	A	AB	ABC	united_states%1:14:00::	A52	A	AB	ABC	 construed as the assumption of any liability by the United <font color=green>States</font>  for the payment or satisfaction, in whole or in part	1	0	134	0	2	States	NNPS	technical
state/NN/br-h12/1597	-0.00146986396563707	0.0244610072264282	state	NN	miscellaneous	non-fiction	A5	A	AB	ABC	united_states%1:15:00::	A51	A	AB	ABC	 any claim on behalf of any national of the United <font color=green>States</font>  against any foreign government. There are hereby created in the	1	0	169	0	4	States	NNPS	technical
state/NN/br-h12/1613	0.175880991304187	0.081927240100529	state	NN	miscellaneous	non-fiction	A5	A	AB	ABC	united_states%1:14:00::	A52	A	AB	ABC	 There are hereby created in the Treasury of the United <font color=green>States</font> ( 1) a special fund to be known as the Yugoslav	1	0	213	0	2	States	NNPS	technical
state/NN/br-h12/1681	0.00571116569929922	0.0380123421010314	state	NN	miscellaneous	non-fiction	A5	A	AB	ABC	united_states%1:15:00::	A51	A	AB	ABC	 into a settlement agreement with the Government of the United <font color=green>States</font>  as described in subsection( a) of section 4 of this	1	0	157	0	4	States	NNPS	technical
state/NN/br-h12/1839	0.0118509674932664	0.0241407397555466	state	NN	miscellaneous	non-fiction	A5	A	AB	ABC	united_states_dollar%1:23:00::	A52	A	AB	ABC	 a) of this section any amounts hereafter paid, in United <font color=green>States</font>  dollars, by a foreign government which has entered into a	1	0	151	0	4	States	NNPS	technical
state/NN/br-h12/1860	0.0106952970226978	0.0330200349681387	state	NN	miscellaneous	non-fiction	A5	A	AB	ABC	united_states%1:15:00::	A51	A	AB	ABC	 a claims settlement agreement with the Government of the United <font color=green>States</font>  as described in subsection( a) of section 4 of this	1	0	160	0	5	States	NNPS	technical
state/NN/br-h12/2127	0.0860743743414703	0.0847561489924325	state	NN	miscellaneous	non-fiction	C	C	C	ABC	secretary_of_state%1:18:01::	C1	C	C	ABC	 of the Treasury, upon the concurrence of the Secretary of <font color=green>State</font> , is authorized and directed, out of the sum covered into	3	3	191	100	5	State	NNP	technical
state/NN/br-h12/2215	0.0846734164506405	0.118700196591203	state	NN	miscellaneous	non-fiction	C	C	C	ABC	secretary_of_state%1:18:01::	C1	C	C	ABC	 of the Yugoslav Claims Agreement of 1948. The Secretary of <font color=green>State</font>  shall certify to the Secretary of the Treasury the total	3	4	226	133	4	State	NNP	technical
state/NN/br-h12/2273	0.0513452182481015	0.0756640333247451	state	NN	miscellaneous	non-fiction	A5	A	AB	ABC	united_states%1:14:00::	A52	A	AB	ABC	 other official or department, agency, or establishment of the United <font color=green>States</font> . There is hereby authorized to be appropriated, out of any	1	0	206	0	4	States	NNPS	technical
state/NN/br-h12/298	0.112660963608572	0.0319687376249124	state	NN	miscellaneous	non-fiction	A5	A	AB	ABC	united_states%1:15:00::	A51	A	AB	ABC	 of the provisions of this subsection. Whoever, in the United <font color=green>States</font>  or elsewhere, pays or offers to pay, or promises to	1	0	159	0	4	States	NNPS	technical
state/NN/br-h12/457	0.000746380285433253	0.0405963231684754	state	NN	miscellaneous	non-fiction	A5	A	AB	ABC	united_states%1:14:00::	A52	A	AB	ABC	 of Justice as may be necessary to represent the United <font color=green>States</font>  as to any claims of the Government of the United	3	1	162	33	3	States	NNPS	technical
state/NN/br-h12/468	0.0553563082540076	0.0479932397752927	state	NN	miscellaneous	non-fiction	A5	A	AB	ABC	united_states%1:15:00::	A51	A	AB	ABC	 as to any claims of the Government of the United <font color=green>States</font>  with respect to which the Commission has jurisdiction under this	1	0	193	0	5	States	NNPS	technical
state/NN/br-h12/512	0.0694477286988009	0.0732240185025673	state	NN	miscellaneous	non-fiction	A5	A	AB	ABC	united_states%1:15:00::	A51	A	AB	ABC	 made by the Commission to the Government of the United <font color=green>States</font>  shall be covered into the Treasury to the credit of	1	0	195	0	3	States	NNPS	technical
state/NN/br-h12/691	0.0122376004449959	0.0540123080053916	state	NN	miscellaneous	non-fiction	C	C	C	ABC	secretary_of_state%1:18:01::	C1	C	C	ABC	 fact and not subject to review by the Secretary of <font color=green>State</font>  or any other official, department, agency, or establishment of the	3	3	200	100	6	State	NNP	technical
state/NN/br-h12/706	0.00811993486186187	0.0690084611006081	state	NN	miscellaneous	non-fiction	A5	A	AB	ABC	united_states%1:14:00::	A52	A	AB	ABC	 any other official, department, agency, or establishment of the United <font color=green>States</font>  or by any court by mandamus or otherwise. The Commission	1	0	198	0	3	States	NNPS	technical
state/NN/br-h12/810	0.0266627873353861	0.0621422574320378	state	NN	miscellaneous	non-fiction	C	C	C	ABC	secretary_of_state%1:18:01::	C1	C	C	ABC	 the Secretary of the Treasury and to the Secretary of <font color=green>State</font>  copies of the awards made in favor of the Government	3	4	188	133	7	State	NNP	technical
state/NN/br-h12/824	0.0260158308010948	0.0289352466175533	state	NN	miscellaneous	non-fiction	A5	A	AB	ABC	united_states%1:15:00::	A51	A	AB	ABC	 awards made in favor of the Government of the United <font color=green>States</font>  or of nationals of the United States under this Title	1	0	145	0	5	States	NNPS	technical
state/NN/br-h12/831	0.0585622758710995	0.0391454574243572	state	NN	miscellaneous	non-fiction	A5	A	AB	ABC	united_states%1:15:00::	A51	A	AB	ABC	 of the United States or of nationals of the United <font color=green>States</font>  under this Title. The Commission shall certify to the Secretary	1	0	161	0	3	States	NNPS	technical
state/NN/br-h12/844	0.0384674660789732	0.0881860468180031	state	NN	miscellaneous	non-fiction	C	C	C	ABC	secretary_of_state%1:18:01::	C1	C	C	ABC	 this Title. The Commission shall certify to the Secretary of <font color=green>State</font> , upon his request, copies of the formal submissions of claims	1	1	168	100	5	State	NNP	technical
state/NN/br-h13/1432	-0.255902823460896	-0.0454101956309966	state	NN	miscellaneous	non-fiction	A5	A	AB	ABC	united_states%1:15:00::	A51	A	AB	ABC	 and planes in Cuba jeopardize the security of the United <font color=green>States</font> , violate the Monroe Doctrine, and threaten the security of every	1	0	177	0	4	States	NNPS	technical
state/NN/br-h13/1525	-0.11132577784376	-0.00177227060969279	state	NN	miscellaneous	non-fiction	A5	A	AB	ABC	united_states%1:15:00::	A51	A	AB	ABC	 Cuba off the Inter-American Defense Board. For years the United <font color=green>States</font>  had been trying to get these countries to exclude Castro	1	0	142	0	3	States	NNPS	technical
state/NN/br-h13/1758	-0.155795531668167	-0.123231881989322	state	NN	miscellaneous	non-fiction	A5	A	AB	ABC	united_states%1:14:00::	A52	A	AB	ABC	 and agents to threaten the Americas. How can the United <font color=green>States</font>  act? Blockade is one answer offered by experts. In it	2	0	138	0	3	States	NNPS	technical
state/NN/br-h13/1947	-0.247800381385291	-0.0228565848524049	state	NN	miscellaneous	non-fiction	A5	A	AB	ABC	united_states%1:14:00::	A52	A	AB	ABC	 most severe reprisal, short of declared war, that the United <font color=green>States</font>  could invoke against Castro. It is the strategy of blockade	1	0	169	0	3	States	NNPS	technical
state/NN/br-h14/1016	0.150473565633297	-0.0431328228041984	state	NN	miscellaneous	non-fiction	A	A	AB	ABC	state%1:15:01::	A	A	AB	ABC	 which bears the same ratio to 50% as the particular <font color=green>State</font>  's average per capita income bears to the average per	4	3	217	75	10	State	NNP	technical
state/NN/br-h14/1049	0.0533093935372123	-0.0253971352926116	state	NN	miscellaneous	non-fiction	A	A	AB	ABC	state%1:15:01::	A	A	AB	ABC	 in item 3 above by the result obtained for each <font color=green>State</font>  in item 1 above.) Determine the particular State 's`` allotment	3	2	225	67	8	State	NNP	technical
state/NN/br-h14/1059	0.0543670576531111	-0.0186129939772488	state	NN	miscellaneous	non-fiction	A	A	AB	ABC	state%1:15:01::	A	A	AB	ABC	 for each State in item 1 above.) Determine the particular <font color=green>State</font>  's`` allotment percentage''. By law this is 75% for the	5	4	211	80	9	State	NNP	technical
state/NN/br-h14/1102	0.118371590532675	-0.018058482549485	state	NN	miscellaneous	non-fiction	A	A	AB	ABC	state%1:15:01::	A	A	AB	ABC	 in effect prior to fiscal year 1962.) In all other <font color=green>States</font>  it is the difference obtained by subtracting from 100 the	1	0	177	0	3	States	NNPS	technical
