id	model.x	model.y	lemma	wf	pos	genre	broad_genre	marisense	mbroad	mari3	mari2	sensekey	wnsense	wnbroad	wn3	wn2	text	cues	cues_with_weight	mean_weight_x100	wcratio_x100	weighted_cw	new_pos	new_broad_genre
state/NN/br-b27/1505	-0.0871576215893263	-0.0203323732284339	state	States	NN	press_editorial	press	A5	A	AB	ABC	Z	Z	Z	Z	Z	 one of these schools, in England, Canada, and the United <font color=green>States</font> . We set up the Lloyd 's Neck school, worked out	1	0	121	0	7	NNPS	press
state/NN/br-c01/1164	0.162789791918354	-0.00725130294438712	state	state	NN	press_reviews	press	C	C	C	ABC	welfare_state%1:14:00::	B	B	AB	ABC	 we should take from these pages is that the welfare <font color=green>state</font>  in England still allows wild scope for all kinds of	1	1	126	100	7	NN	press
state/NN/br-c03/237	-0.0147726031719174	0.361693578977353	state	States	NN	press_reviews	press	A5	A	AB	ABC	Z	Z	Z	Z	Z	 Bella Bella'', by Robert Fleming, was given its first United <font color=green>States</font>  performance. The title refers to the nickname given his wife	1	0	96	0	2	NNPS	press
state/NN/br-c06/257	0.0379827744157995	-0.00382043645696165	state	State	NN	press_reviews	press	C	C	C	ABC	Z	Z	Z	Z	Z	 subsequently convicted of perjury in denying that he gave secret <font color=green>State</font>  Department documents to Soviet agents, was at Yalta. And Harry	2	1	132	50	6	NNP	press
state/NN/br-c06/581	0.00068895289918619	0.068262205186987	state	State	NN	press_reviews	press	C	C	C	ABC	Z	Z	Z	Z	Z	 Union in 1941, he penned a private note to a <font color=green>State</font>  Department official, expressing the hope that`` never would we associate	1	1	115	100	5	NNP	press
state/NN/br-c06/671	-0.254686859936396	0.102074776236994	state	States	NN	press_reviews	press	B	B	AB	ABC	Z	Z	Z	Z	Z	 what had been going on in Poland and the Baltic <font color=green>States</font> ''. He also speaks of Franklin D. Roosevelt 's`` puerile'' assumption	2	1	85	50	6	NNPS	press
state/NN/br-c12/531	0.177222571985497	0.146295265594022	state	state	NN	press_reviews	press	A4	A	AB	ABC	Z	Z	Z	Z	Z	 U. S. Negroes live outside the southeastern states. Also, the <font color=green>state</font>  with the largest number of Negroes is New York- not	5	4	90	80	6	NN	press
state/NN/br-c12/91	-0.0917789925577933	-0.129311053979737	state	States	NN	press_reviews	press	A5	A	AB	ABC	Z	Z	Z	Z	Z	 partly at Negro listeners- an audience which, in the United <font color=green>States</font> , comprises some 19000000 people with$ 20000000000 to spend each year	1	0	125	0	3	NNPS	press
state/NN/br-c14/1234	-0.183703187691681	0.308362722596346	state	state	NN	press_reviews	press	D	D	D	D	Z	Z	Z	Z	Z	 own sensitive reactions.`` A writer lives, at best, in a <font color=green>state</font>  of astonishment'', he says.`` Beneath any feeling he has of	4	0	74	0	3	NN	press
state/NN/br-c16/1216	0.104253158400981	-0.0405912575497867	state	state	NN	press_reviews	press	C	C	C	ABC	Z	Z	Z	Z	Z	 Government devoted its attention to the creation of a welfare <font color=green>state</font> . With Britain looking inward, overseas problems were neglected and the	4	3	147	75	7	NN	press
state/NN/br-c16/1236	0.138093201797	-0.162608103441444	state	States	NN	press_reviews	press	A5	A	AB	ABC	Z	Z	Z	Z	Z	 neglected and the baton was passed on to the United <font color=green>States</font> . Montgomery believes that she started well.`` America gave generously in	2	1	103	50	5	NNPS	press
state/NN/br-c16/1391	0.0613075061290451	-0.175652928992685	state	state	NN	press_reviews	press	D	D	D	D	Z	Z	Z	Z	Z	 not to be surprised again, and now insist on a <font color=green>state</font>  of readiness for war which is not only unnecessary, but	2	2	117	100	5	NN	press
state/NN/br-c16/1508	0.0175471193549053	-0.103627327167444	state	States	NN	press_reviews	press	A5	A	AB	ABC	Z	Z	Z	Z	Z	 As faulty as has been our leadership clearly the United <font color=green>States</font>  must be relied upon to lead. The path to leadership	1	0	86	0	6	NNPS	press
state/NN/br-c16/1593	0.0710647945050288	-0.0722101321474597	state	States	NN	press_reviews	press	A5	A	AB	ABC	Z	Z	Z	Z	Z	 that heretofore have shaped the foreign policy of the United <font color=green>States</font> , namely that Russia will agree to a reunited Germany, that	1	0	105	0	7	NNPS	press
state/NNP/br-a01/1035	-0.0905730225753523	-0.0491721213300999	state	State	NNP	press_reportage	press	A3	A	AB	ABC	person%1:03:00::	C1	C	C	ABC	 night in Blue Ridge brought enthusiastic responses from the audience. <font color=green>State</font>  Party Chairman James W. Dorsey added that enthusiasm was picking	2	1	223	50	9	NNP	press
state/NNP/br-a01/1240	-0.031814609705935	0.030119810391949	state	State	NNP	press_reportage	press	A2	A	AB	ABC	group%1:03:00::	B	B	AB	ABC	 system which the party opposes in its platform. Sam Caldwell, <font color=green>State</font>  Highway Department public relations director, resigned Tuesday to work for	5	4	220	80	9	NNP	press
state/NNP/br-a01/1412	-0.000773894971281351	0.00124742079433001	state	State	NNP	press_reportage	press	A2	A	AB	ABC	group%1:03:00::	B	B	AB	ABC	 as his first priority item. Meanwhile, it was learned the <font color=green>State</font>  Highway Department is very near being ready to issue the	2	1	247	50	8	NNP	press
state/NNP/br-a01/1928	0.0331089345909781	0.0485211049699273	state	State	NNP	press_reportage	press	A3	A	AB	ABC	group%1:03:00::	B	B	AB	ABC	 event Congress does provide this increase in federal funds'', the <font color=green>State</font>  Board of Education should be directed to`` give priority'' to	5	3	196	60	8	NNP	press
state/NNP/br-a01/352	0.022134722231901	0.0773780808236538	state	State	NNP	press_reportage	press	A3	A	AB	ABC	group%1:03:00::	B	B	AB	ABC	 be effected''. The grand jury took a swipe at the <font color=green>State</font>  Welfare Department 's handling of federal funds granted for child	3	2	226	67	8	NNP	press
state/NNP/br-a01/392	0.0188110351424451	0.0476203061646192	state	State	NNP	press_reportage	press	A3	A	AB	ABC	group%1:03:00::	B	B	AB	ABC	 Fulton County general assistance program'', the jury said, but the <font color=green>State</font>  Welfare Department`` has seen fit to distribute these funds through	3	1	175	33	9	NNP	press
state/NNP/br-a02/1194	-0.0305709742669524	0.0597931389505422	state	State	NNP	press_reportage	press	C	C	C	ABC	group%1:03:00::	B	B	AB	ABC	 An adverse vote of 81 to 65 kept in the <font color=green>State</font>  Affairs Committee a bill which would order the referendum on	2	1	196	50	5	NNP	press
state/NNP/br-a02/1860	-0.090580430024499	0.0219518733947195	state	State	NNP	press_reportage	press	A2	A	AB	ABC	group%1:03:00::	B	B	AB	ABC	 A+I College and a Bachelor of Science degree from Southwestern <font color=green>State</font>  College, Weatherford, Okla.. In addition, Dr. Clark has studied at	1	0	191	0	4	NNP	press
state/NNP/br-a02/1877	-0.0347748617031653	0.0234915365992087	state	State	NNP	press_reportage	press	A2	A	AB	ABC	group%1:03:00::	B	B	AB	ABC	 Okla.. In addition, Dr. Clark has studied at Rhode Island <font color=green>State</font>  College and Massachusetts Institute of Technology. During his college career	2	0	249	0	10	NNP	press
state/NNP/br-a02/1952	-0.0943674147917737	-0.00128006412835117	state	State	NNP	press_reportage	press	A2	A	AB	ABC	group%1:03:00::	B	B	AB	ABC	 associate professor of education at Fort Hays , Kan. , <font color=green>State</font>  College. He has served as a border patrolman and was	2	1	190	50	5	NNP	press
state/NNP/br-a02/793	0.00369817088108595	0.0278824067673746	state	State	NNP	press_reportage	press	A3	A	AB	ABC	group%1:03:00::	B	B	AB	ABC	 finally, and sent to the Senate, a bill extending the <font color=green>State</font>  Health Department 's authority to give planning assistance to cities	5	4	200	80	10	NNP	press
state/NNP/br-a02/914	-0.0255536969483814	0.0189187639412819	state	State	NNP	press_reportage	press	A2	A	AB	ABC	location%1:03:00::	A	A	AB	ABC	 will be sought later on but in the meantime the <font color=green>State</font>  Hospital board can accept gifts and donations of a site	1	1	176	100	6	NNP	press
state/NNP/br-a06/128	-0.159308367170574	0.124490518627895	state	State	NNP	press_reportage	press	A3	A	AB	ABC	Z	Z	Z	Z	Z	 500 women in Trenton Monday at a forum of the <font color=green>State</font>  Federation of Women 's Clubs. Hughes said Monday,`` It is	2	2	242	100	7	NNP	press
state/NNP/br-a06/1299	-0.0308513159371971	-0.0136882038462416	state	State	NNP	press_reportage	press	A3	A	AB	ABC	Z	Z	Z	Z	Z	 the resignation of Neil Duffy, now a member of the <font color=green>State</font>  Board of Tax Appeals.`` My experience as public safety commissioner	4	0	85	0	4	NNP	press
state/NNP/br-a06/2141	-0.148314023272611	0.167238107527903	state	State	NNP	press_reportage	press	A3	A	AB	ABC	Z	Z	Z	Z	Z	 tangle with the Republican nominee''. Fifteen members of the Republican <font color=green>State</font>  Committee who are retiring- voluntarily- this year were honored yesterday	2	0	141	0	3	NNP	press
state/NNP/br-a06/422	0.0698517014038113	0.0313945700972198	state	State	NNP	press_reportage	press	A2	A	AB	ABC	Z	Z	Z	Z	Z	 launched into what the issues should be in the campaign. <font color=green>State</font>  aid to schools, the continuance of railroad passenger service, the	3	3	228	100	7	NNP	press
state/NNP/br-a06/475	0.0287091163877998	0.031244882564173	state	State	NNP	press_reportage	press	A3	A	AB	ABC	Z	Z	Z	Z	Z	 the state and said the Meyner administration and the Republican-controlled <font color=green>State</font>  Senate`` Must share the blame for this''. Nothing that Plainfield	3	2	145	67	5	NNP	press
state/NNP/br-a07/149	-0.0398541128683915	0.0323660141628438	state	State	NNP	press_reportage	press	A2	A	AB	ABC	Z	Z	Z	Z	Z	 Democratic district and county leaders are reported trying to induce <font color=green>State</font>  Controller Arthur Levitt of Brooklyn to oppose Mr. Wagner for	5	5	232	100	13	NNP	press
state/NNP/br-a10/979	-0.168318363240786	0.0727830946376156	state	State	NNP	press_reportage	press	A3	A	AB	ABC	Z	Z	Z	Z	Z	 Circuit Judge. He will attend a meeting of the Republican <font color=green>State</font>  Central Committee Saturday in Portland and see the Washington-Oregon football	4	0	210	0	6	NNP	press
state/NNP/br-a12/156	-0.173320345864605	0.0661754187485855	state	State	NNP	press_reportage	press	A5	A	AB	ABC	group%1:03:00::	B	B	AB	ABC	 last Saturday night in the 41- 8 slaughter of Washington <font color=green>State</font> . Moritz is listed on the Longhorn roster as a right	1	1	240	100	5	NNP	press
state/NNP/br-a12/1811	-0.113802752953136	0.0863119056529961	state	State	NNP	press_reportage	press	A	A	AB	ABC	group%1:03:00::	B	B	AB	ABC	 M. C. Reynolds and Warren Rabb. Rabb, the former Louisiana <font color=green>State</font>  field general, came off the bench for his debut with	2	2	236	100	6	NNP	press
state/NNP/br-a12/2223	-0.0794456395771318	0.0120690428793753	state	State	NNP	press_reportage	press	A5	A	AB	ABC	group%1:03:00::	B	B	AB	ABC	 the statistics last week. Texas' 545- yard spree against Washington <font color=green>State</font>  gave the Longhorns a 3- game total offense of 1512	1	1	234	100	7	NNP	press
state/NNP/br-a12/777	-0.108812342562171	-0.018304292315733	state	State	NNP	press_reportage	press	A5	A	AB	ABC	group%1:03:00::	B	B	AB	ABC	 second-half appearance this season and that was in the Washington <font color=green>State</font>  game, for four plays: he returned the kickoff 30 yards	2	2	206	100	6	NNP	press
state/NNP/br-a12/821	-0.180221681675082	-0.0331057964325093	state	State	NNP	press_reportage	press	A5	A	AB	ABC	group%1:03:00::	B	B	AB	ABC	 bench. Wingback Jack Collins injured a knee in the Washington <font color=green>State</font>  game but insists he 'll be ready for Oklahoma. Last	3	3	293	100	6	NNP	press
state/NNP/br-a14/1200	-0.200055494943141	0.0150486069211244	state	States	NNP	press_reportage	press	A5	A	AB	ABC	Z	Z	Z	Z	Z	 the past twelve months. He won the Masters, the United <font color=green>States</font>  Open and a record$ 80738 in prize money. He was	2	0	149	0	4	NNPS	press
state/NNP/br-a15/1617	-0.205058960788255	-0.184950991203446	state	State	NNP	press_reportage	press	A2	A	AB	ABC	group%1:03:00::	B	B	AB	ABC	 baseball history, as the Blue and White beat Southeast Missouri <font color=green>State</font>  College, 5- 1, at Crystal City. The victory was the	2	1	266	50	4	NNP	press
state/NNP/br-a17/1758	-0.352195889637879	0.00634619484465735	state	State	NNP	press_reportage	press	A2	A	AB	ABC	Z	Z	Z	Z	Z	 Saturday to Elvis Leonard Mason, an honor graduate of Lamar <font color=green>State</font>  College of Technology, in the chapel of the First Presbyterian	1	0	288	0	3	NNP	press
state/NNP/br-a17/2060	-0.146503806859348	0.0636560393991943	state	State	NNP	press_reportage	press	A2	A	AB	ABC	Z	Z	Z	Z	Z	 Miss Shirley Joan Meredith, a former student of North Texas <font color=green>State</font>  University, was married Saturday to Larry W. Mills, who has	2	1	263	50	6	NNP	press
state/NNP/br-a17/2075	-0.191780340541071	0.0672708293997574	state	State	NNP	press_reportage	press	A2	A	AB	ABC	Z	Z	Z	Z	Z	 married Saturday to Larry W. Mills, who has attended Arlington <font color=green>State</font>  College. They will live at 2705 Fitzhugh after a wedding	2	0	181	0	4	NNP	press
state/NNP/br-a19/1333	-0.109931520417911	0.0329752145488015	state	State	NNP	press_reportage	press	A2	A	AB	ABC	Z	Z	Z	Z	Z	 their Chesapeake Bay-front home, has been sent to Spring Grove <font color=green>State</font>  Hospital for detention. The victims were H. Malone Dresbach, 47	1	1	184	100	5	NNP	press
state/NNP/br-a19/775	-0.143066946134817	0.0927640002890004	state	State	NNP	press_reportage	press	A3	A	AB	ABC	Z	Z	Z	Z	Z	 board member said later, that Dr. Thomas G. Pullen, Jr., <font color=green>State</font>  superintendent of schools, told Dr. Jenkins and a number of	3	2	231	67	8	NNP	press
state/NNP/br-a19/865	-0.0351542864039896	0.0373390541840959	state	State	NNP	press_reportage	press	A4	A	AB	ABC	Z	Z	Z	Z	Z	 notes, however, that most of the school boards in the <font color=green>State</font>  do not do so. State Senator Joseph A. Bertorelli( D.	4	1	80	25	8	NNP	press
state/NNP/br-a21/242	-0.0371684335091553	-0.018475008925022	state	State	NNP	press_reportage	press	A2	A	AB	ABC	Z	Z	Z	Z	Z	 being questioned about several fires in the Westphalia area by <font color=green>State</font>  Police. He also admitted killing Mrs. Hengesbach. However, the confession	2	1	122	50	9	NNP	press
state/NNP/br-a22/2193	-0.236762961885713	-0.0928785445909975	state	State	NNP	press_reportage	press	A3	A	AB	ABC	Z	Z	Z	Z	Z	 two of them in a fiery crash near Snellville, the <font color=green>State</font>  Patrol said Sunday. The latest death reported was that of	1	0	155	0	4	NNP	press
state/NNP/br-a22/538	-0.156353566229312	-0.129241705135316	state	State	NNP	press_reportage	press	A	A	AB	ABC	Z	Z	Z	Z	Z	 other hand, Emory University derives its corporate existence from the <font color=green>State</font>  of Georgia.`` When and if it can do so without	1	1	217	100	4	NNP	press
state/NNP/br-a23/1258	-0.20133521448925	0.0290729960726582	state	State	NNP	press_reportage	press	A2	A	AB	ABC	Z	Z	Z	Z	Z	 and entertainment for functions throughout the Northwest. These included Oregon <font color=green>State</font>  Fair, for which he had been booked on and off	3	0	180	0	3	NNP	press
state/NNP/br-a23/1535	-0.0963006720597008	0.0468393998731484	state	State	NNP	press_reportage	press	A2	A	AB	ABC	Z	Z	Z	Z	Z	 the Year'' in national competition completed this week at Ohio <font color=green>State</font>  University, Columbus, Ohio. Tim Larson, a junior at Wilson High	2	2	222	100	8	NNP	press
state/NNP/br-a26/1076	-0.117163060448547	-0.147336495518535	state	State	NNP	press_reportage	press	A2	A	AB	ABC	Z	Z	Z	Z	Z	 year history. The exhibition of cotton ginning machinery at the <font color=green>State</font>  Fair grounds is valued at more than a million dollars	1	0	217	0	8	NNP	press
state/NNP/br-a28/1967	-0.0330732275926173	0.153736799669887	state	State	NNP	press_reportage	press	A3	A	AB	ABC	Z	Z	Z	Z	Z	 could be ruled taxable to them in the year made. <font color=green>State</font>  Briefs: Voters in four counties containing and bordering Denver authorized	4	1	240	25	6	NNP	press
state/NNP/br-a30/456	-0.0646041562801533	-0.0128384079896581	state	State	NNP	press_reportage	press	A2	A	AB	ABC	Z	Z	Z	Z	Z	 Angeles. He started practice in 1917, and served on the <font color=green>State</font>  Board of Medical Examiners. Giving up the violin opened a	1	0	142	0	7	NNP	press
state/NNP/br-a37/260	-0.0303390748468846	-0.0584407472272245	state	State	NNP	press_reportage	press	C	C	C	ABC	Z	Z	Z	Z	Z	 new Administration with the breakoff decision. Kennedy, through Secretary-designate of <font color=green>State</font>  Dean Rusk, declined. He thus kept his hands free for	2	0	167	0	6	NNP	press
state/NNP/br-a40/1740	-0.243589874002205	-0.0640491663822932	state	State	NNP	press_reportage	press	A2	A	AB	ABC	Z	Z	Z	Z	Z	 and star halfback. Charlayne studied journalism at Detroit 's Wayne <font color=green>State</font>  University. Last fall, after they took their hopes for entering	1	0	196	0	5	NNP	press
state/NNP/br-a40/1784	-0.0163211226313508	-0.0481928644677	state	State	NNP	press_reportage	press	A5	A	AB	ABC	Z	Z	Z	Z	Z	 fall, after state investigators questioned her white roommate at Wayne <font color=green>State</font> . But Holmes was rejected again`` on the basis of his	1	0	212	0	7	NNP	press
state/NNP/br-a43/155	0.15720521585393	0.0821800760031056	state	State	NNP	press_reportage	press	A3	A	AB	ABC	Z	Z	Z	Z	Z	 the prices of these tax-exempt bonds. Other tax-exempt bonds of <font color=green>State</font>  and local governments hit a price peak on February 21	4	4	252	100	9	NNP	press
state/NNP/br-a43/66	-0.042022028451225	-0.0882456935065956	state	State	NNP	press_reportage	press	A3	A	AB	ABC	Z	Z	Z	Z	Z	 Things are looking up these days for many of the <font color=green>State</font>  turnpikes on which investors depend for income from their toll-road	4	2	125	50	8	NNP	press
state/NNP/br-a43/728	-0.15821640513455	-0.00894934868234908	state	State	NNP	press_reportage	press	A3	A	AB	ABC	Z	Z	Z	Z	Z	 to prove what they can do. The 187- mile Illinois <font color=green>State</font>  Toll Highway, for example, was not opened over its entire	3	2	168	67	7	NNP	press
state/NNP/br-a44/1069	-0.118981809800072	0.183337780997016	state	State	NNP	press_reportage	press	A2	A	AB	ABC	Z	Z	Z	Z	Z	 requests every day. It is connected by teletype with the <font color=green>State</font>  Library in Albany, which will supply any book to a	1	1	240	100	6	NNP	press
state/NNP/br-a44/278	0.00435722174144854	0.00618802692422776	state	State	NNP	press_reportage	press	A5	A	AB	ABC	Z	Z	Z	Z	Z	 book resources on a county-wide or regional basis. New York <font color=green>State</font>  has what is probably the most advanced of these co-operative	1	0	176	0	7	NNP	press
state/NNP/br-a44/346	-0.0313476554139316	0.0130326301573198	state	State	NNP	press_reportage	press	A5	A	AB	ABC	Z	Z	Z	Z	Z	 At one extreme are the systems of upper New York <font color=green>State</font> , where libraries in two or more counties combine to serve	1	0	231	0	7	NNP	press
state/NNP/br-a44/650	-0.0568775041167001	-0.000519423989194637	state	State	NNP	press_reportage	press	A5	A	AB	ABC	Z	Z	Z	Z	Z	 nearly 95 per cent of the population of New York <font color=green>State</font>  now has access to a system, and enthusiastic librarians foresee	1	0	171	0	8	NNP	press
state/NNP/br-b01/1166	0.0456689313461877	0.0988482035952312	state	State	NNP	press_editorial	press	A2	A	AB	ABC	Z	Z	Z	Z	Z	 the form of a$ 1750000 budget increase for the Milledgeville <font color=green>State</font>  Hospital. Actually it amounts to$ 1250000 above what the institution	2	1	162	50	5	NNP	press
state/NNP/br-b02/1148	-0.160842741705893	0.028778300206095	state	State	NNP	press_editorial	press	A2	A	AB	ABC	Z	Z	Z	Z	Z	 is finding it awkward to campaign against his own record. <font color=green>State</font>  Controller Arthur Levitt, on the other hand, cannot effectively deny	2	1	181	50	6	NNP	press
state/NNP/br-b04/1446	-0.114725800858362	-0.00648081185468804	state	State	NNP	press_editorial	press	A2	A	AB	ABC	Z	Z	Z	Z	Z	 to get gulled. According to The Chicago Tribune News Service, <font color=green>State</font>  Atty. Gen. Stanley Mosk of California has devised a series	3	1	180	33	7	NNP	press
state/NNP/br-b11/747	-0.0251596060640486	0.146171056572381	state	State	NNP	press_editorial	press	A3	A	AB	ABC	Z	Z	Z	Z	Z	 Memorial Bldg., which graphically illustrates the CDC 's broad appeal. <font color=green>State</font>  Sen. Dick Richards will keynote; state and county committeemen, CDC	3	1	241	33	6	NNP	press
state/NNP/br-b12/283	0.0113933522086566	0.0338282877871489	state	State	NNP	press_editorial	press	A3	A	AB	ABC	Z	Z	Z	Z	Z	 when accompanied by a prisoners' committee with powers of veto. <font color=green>State</font>  and federal approval of right to walk out at any	4	2	178	50	9	NNP	press
state/NNP/br-b14/1767	-0.0676251209368512	0.0272793674406426	state	State	NNP	press_editorial	press	A3	A	AB	ABC	Z	Z	Z	Z	Z	 and Lt. Gov. Byrd accepted the invitations of the Georgia <font color=green>State</font>  Chamber of Commerce to join the tour next November, the	2	1	260	50	8	NNP	press
state/NNP/br-b14/1827	-0.0930069930215145	-0.0407532990008411	state	State	NNP	press_editorial	press	A3	A	AB	ABC	Z	Z	Z	Z	Z	 opportunity, when the bravado comments are cast aside. The Georgia <font color=green>State</font>  Chamber of Commerce tried to guard against the danger of	2	1	277	50	8	NNP	press
state/NNP/br-b14/1845	-0.0257499895064067	-0.0880837835035387	state	State	NNP	press_editorial	press	A3	A	AB	ABC	Z	Z	Z	Z	Z	 against the danger of eliminating potential candidates. It wanted the <font color=green>State</font>  Democratic Executive Committee to pick the`` serious candidates''. But State	3	2	278	67	7	NNP	press
state/NNP/br-b14/1858	-0.111378273752744	0.00673997201692364	state	State	NNP	press_editorial	press	A3	A	AB	ABC	Z	Z	Z	Z	Z	 State Democratic Executive Committee to pick the`` serious candidates''. But <font color=green>State</font>  Party Chairman James Gray of Albany said no, and he	4	1	245	25	7	NNP	press
state/NNP/br-b15/365	-0.146628382394399	0.122297721202883	state	State	NNP	press_editorial	press	A2	A	AB	ABC	Z	Z	Z	Z	Z	 grow. Mr. Richard Preston, executive director of the New Hampshire <font color=green>State</font>  Planning and Development Commission, in his remarks to the Governors	4	0	261	0	5	NNP	press
state/NNP/br-b25/264	-0.0559695764958226	-0.170470362656489	state	State	NNP	press_editorial	press	A	A	AB	ABC	Z	Z	Z	Z	Z	 the dictatorship of the proletariat by an`` All People 's <font color=green>State</font> '', and also of having laid down the lines for a	1	1	118	100	7	NNP	press
state/NNP/br-c02/2186	-0.0831849876598714	0.0666455557198278	state	States	NNP	press_reviews	press	A5	A	AB	ABC	group%1:03:00::	B	B	AB	ABC	 Earlier this month Edward R. Murrow, director of the United <font color=green>States</font>  Information Agency, came to Hollywood and had dinner with more	2	0	221	0	8	NNPS	press
state/NNP/br-c11/589	-0.0585973613000091	0.00702523497175378	state	State	NNP	press_reviews	press	B	B	AB	ABC	Z	Z	Z	Z	Z	 final change of bill in its London season, the Leningrad <font color=green>State</font>  Kirov Ballet chose tonight to give one of those choreographic	2	0	172	0	7	NNP	press
state/NNS/br-a03/1391	0.00937955668257872	0.0471212472916407	state	states	NNS	press_reportage	press	A1	A	AB	ABC	Z	Z	Z	Z	Z	 that Congress last year passed a law providing grants to <font color=green>states</font>  to help pay medical bills of the needy aged. He	5	4	231	80	9	NNS	press
state/NNS/br-a03/1809	0.124722634950685	0.140916028772265	state	states	NNS	press_reportage	press	A1	A	AB	ABC	Z	Z	Z	Z	Z	 another 10 million dollar`` initial'' appropriation for`` stimulatory grants'' to <font color=green>states</font>  to improve nursing homes. He further proposed grants of an	1	2	331	200	6	NNS	press
state/NNS/br-a03/1877	0.153340602297946	0.200103346895019	state	states	NNS	press_reportage	press	A1	A	AB	ABC	Z	Z	Z	Z	Z	 President said he will ask Congress to increase grants to <font color=green>states</font>  for vocational rehabilitation. He did not say by how much	3	1	207	33	6	NNS	press
state/NNS/br-a04/2052	0.0584365519190852	0.062899524961408	state	states	NNS	press_reportage	press	A1	A	AB	ABC	Z	Z	Z	Z	Z	 through the enactment of legislation to provide federal grants to <font color=green>states</font>  for specified efforts in combating this disturbing crime trend. The	4	3	316	75	8	NNS	press
state/NNS/br-a04/2103	0.0412774447613755	0.0254255222002709	state	states	NNS	press_reportage	press	A1	A	AB	ABC	Z	Z	Z	Z	Z	 the development of a program of federal leadership to assist <font color=green>states</font>  and local communities in their efforts to cope with the	5	5	218	100	9	NNS	press
state/NNS/br-a06/1820	0.0511111654327048	-0.0222918082721882	state	states	NNS	press_reportage	press	A4	A	AB	ABC	Z	Z	Z	Z	Z	 and a stop to the piracy of industry by Southern <font color=green>states</font> , and a strong fight against discrimination in business and industry	3	1	236	33	6	NNS	press
state/NNS/br-a08/246	-0.070985765535905	-0.0311729078966745	state	states	NNS	press_reportage	press	A	A	AB	ABC	Z	Z	Z	Z	Z	 route. Pennsylvania Avenue, named for one of the original 13 <font color=green>states</font> , perhaps is not the most impressive street in the District	3	2	182	67	8	NNS	press
state/NNS/br-a08/597	-0.134936512622505	0.0543368720553553	state	states	NNS	press_reportage	press	A	A	AB	ABC	Z	Z	Z	Z	Z	 will include the representations of Massachusetts and Texas, the respective <font color=green>states</font>  of the President and of Vice-President L. B. Johnson. Then	3	3	313	100	5	NNS	press
