id	model.x	model.y	lemma	pos	genre	marisense	mbroad	mari3	mari2	sensekey	wnsense	wnbroad	wn3	wn2	text
church/NNS/br-f15/1425	0.114912801735478	0.247022652944209	church	NNS	popular_lore	B	B	AB	AB	christian_church%1:14:00::	B	B	AB	AB	 turn of the century, contraception was condemned by all Christian <font color=green>churches</font>  as immoral, unnatural and contrary to divine law. This was
church/NNS/br-f15/1455	0.0268287209638363	0.0609464856368127	church	NNS	popular_lore	B	B	AB	AB	orthodox_church%1:14:00::	B1	B	AB	AB	 laws of Christian countries. Today, the Roman Catholic and Orthodox <font color=green>Churches</font>  stand virtually alone in holding that conviction. The various Lambeth
church/NNS/br-f15/1720	0.0123877332427585	-0.0154838340284448	church	NNS	popular_lore	B	B	AB	AB	group%1:03:00::	C	C	C	CDE	 28 members of a committee of the Federal Council of <font color=green>Churches</font>  ratified artificial methods of birth control.`` As to the necessity
church/NNS/br-f15/1887	0.0586088351535801	0.0375961786021571	church	NNS	popular_lore	B	B	AB	AB	group%1:03:00::	C	C	C	CDE	 1961, by the general board of the National Council of <font color=green>Churches</font> , the largest Protestant organization in the US. The board approved
church/NNS/br-f15/1944	0.107920542435586	0.0441355121979725	church	NNS	popular_lore	B	B	AB	AB	church%1:14:00::	B	B	AB	AB	 of contraceptives. The general board declared:`` Most of the Protestant <font color=green>churches</font>  hold contraception and periodic continence to be morally right when
church/NNS/br-f15/1998	0.0810842737474276	0.24667604027006	church	NNS	popular_lore	B	B	AB	AB	christian_church%1:14:00::	B	B	AB	AB	 of conception''. An action once universally condemned by all Christian <font color=green>churches</font>  and forbidden by the civil law is now not only
church/NNS/br-f15/821	0.037759667877963	0.0634679015788073	church	NNS	popular_lore	B	B	AB	AB	orthodox_catholic_church%1:14:00::	B1	B	AB	AB	 the exception of the Roman Catholic and the Orthodox Catholic <font color=green>Churches</font> , most churches make no moral distinction between rhythm and mechanical
church/NNS/br-f15/824	0.043594749157611	0.0624790414300502	church	NNS	popular_lore	B	B	AB	AB	church%1:14:00::	B	B	AB	AB	 of the Roman Catholic and the Orthodox Catholic Churches, most <font color=green>churches</font>  make no moral distinction between rhythm and mechanical or chemical
church/NNS/br-f44/1106	0.223481606769213	0.00747519904512355	church	NNS	popular_lore	C	C	C	CDE	church%1:14:00::	B	B	AB	AB	 who will strengthen the social class nucleus of the congregation. <font color=green>Churches</font>  can be strengthened through this process of co-optation so long
church/NNS/br-f44/1189	0.0715607486576995	-0.0210918425386547	church	NNS	popular_lore	C	C	C	CDE	church%1:14:00::	B	B	AB	AB	 and publicity in reaching new members. The proclamation of the <font color=green>churches</font>  is almost totally confined to pastoral contacts by the clergy
church/NNS/br-f44/124	0.0895373283480662	-0.0369060059104638	church	NNS	popular_lore	C	C	C	CDE	church%1:14:00::	B	B	AB	AB	 inner city blight account for the decline of central city <font color=green>churches</font> . Central cities reveal two adverse features for the major denominations
church/NNS/br-f44/1262	0.1125594256102	-0.0450304448896038	church	NNS	popular_lore	C	C	C	CDE	church%1:14:00::	B	B	AB	AB	 will account for a major share of recruitment by the <font color=green>churches</font> , making it quite evident that the extension of economic integration
church/NNS/br-f44/1427	0.106541511272763	-0.0139685851998909	church	NNS	popular_lore	C	C	C	CDE	church%1:14:00::	B	B	AB	AB	 for more than a single generation. The fact that metropolitan <font color=green>churches</font>  of the major denominations have moved approximately every generation for
church/NNS/br-f44/1475	0.0871029317625382	0.0342698760900741	church	NNS	popular_lore	D	D	DE	CDE	church%1:06:00::	D	D	DE	CDE	 in religious life, when one recalls the number of city <font color=green>churches</font>  which deteriorated beyond repair before being abandoned, raises fundamental questions
church/NNS/br-f44/1683	0.130797881527731	-0.0651880822176201	church	NNS	popular_lore	C	C	C	CDE	church%1:14:00::	B	B	AB	AB	 hopelessly unstable environment. More than creatures of metropolitan forces, the <font color=green>churches</font>  have taken the lead in counteracting the interdependence of metropolitan
church/NNS/br-f44/1802	0.170083476752533	0.0123988950954022	church	NNS	popular_lore	D	D	DE	CDE	church%1:14:00::	B	B	AB	AB	 fight their way into the lower middle-class suburbs, and the <font color=green>churches</font>  will experience the same decay and rebuilding cycle which has
church/NNS/br-f44/1918	0.0757453279531921	0.0169899734404954	church	NNS	popular_lore	C	C	C	CDE	church%1:14:00::	B	B	AB	AB	 of middle-class culture could lead to various projections for the <font color=green>churches</font> . It could be argued that any fellowship which centers in
church/NNS/br-f44/2015	0.161481417789976	0.0551789312112188	church	NNS	popular_lore	C	C	C	CDE	church%1:14:00::	B	B	AB	AB	 next chapter to the style of association in the denominational <font color=green>churches</font> ; this style is characteristically an expression of the communal style
church/NNS/br-f44/2181	0.0323148590021115	-0.149375526975053	church	NNS	popular_lore	C	C	C	CDE	church%1:14:00::	B	B	AB	AB	 have fashioned the iron cage of conformity which imprisons the <font color=green>churches</font>  in their suburban captivity. The perplexing question still remains as
church/NNS/br-f44/2201	0.0764316122284053	-0.0545783351862616	church	NNS	popular_lore	C	C	C	CDE	church%1:14:00::	B	B	AB	AB	 remains as to why the middle classes turn to the <font color=green>churches</font>  as a vehicle of social identity when their clubs and
church/NNS/br-f44/343	0.125166201519317	-0.0123340529049081	church	NNS	popular_lore	C	C	C	CDE	church%1:14:00::	B	B	AB	AB	 moreover, residential mobility is so high in metropolitan areas that <font color=green>churches</font>  have to recruit constantly in their core stratum in order
church/NNS/br-f44/868	0.0110845382719071	-0.0904448085407298	church	NNS	popular_lore	C	C	C	CDE	church%1:14:00::	B	B	AB	AB	 and congregational outreach have not been carefully studied in the <font color=green>churches</font> ; one study in Pittsburgh, however, has illuminated the situation. In
church/NNS/br-f44/890	0.0454128431948899	-0.0322017875299158	church	NNS	popular_lore	C	C	C	CDE	church%1:14:00::	B	B	AB	AB	 the situation. In a sample of new members of Pittsburgh <font color=green>churches</font> , almost 60 per cent were recruited by initial`` contacts with
church/NNS/br-g13/1130	0.152329288042766	-0.19994909293795	church	NNS	belles_lettres	D	D	DE	CDE	Z	Z	Z	Z	Z	 holy barbarians; they will destroy the shrines, temples, museums, and <font color=green>churches</font>  of the state that is the implacable enemy of the
church/NNS/br-k01/769	-0.218167221168538	-0.167546767622262	church	NNS	fiction_gral	D	D	DE	CDE	church%1:06:00::	D	D	DE	CDE	 It was a Negro section of peeling row houses, store-front <font color=green>churches</font>  and ragged children. Rachel had to bend toward Scotty and
church/NNS/br-k04/2307	-0.0398166648228467	0.0454097314843972	church	NNS	fiction_gral	B	B	AB	AB	church%1:06:00::	D	D	DE	CDE	 his career in the Methodist church, if not in all <font color=green>churches</font> .
church/NNS/br-k06/1925	0.0575083126793336	-0.464556380115256	church	NNS	fiction_gral	D	D	DE	CDE	church%1:06:00::	D	D	DE	CDE	 them open. Lightning might strike the steeples of the other <font color=green>churches</font> ; not of Drew Church. A flash illumined the trees as
