id	model.x	model.y	lemma	pos	genre	marisense	mbroad	mari3	mari2	sensekey	wnsense	wnbroad	wn3	wn2	text
church/NNP/br-b22/1245	-0.00453098727862225	-0.0900932864980573	church	NNP	press_editorial	B	B	AB	AB	Z	Z	Z	Z	Z	 Churches assembly in New Delhi as`` official'' observers reverses the <font color=green>Church</font>  's earlier stand. The public appeal by the new Vatican
church/NNP/br-b22/1318	0.0347723964188547	0.0329072376427042	church	NNP	press_editorial	B	B	AB	AB	Z	Z	Z	Z	Z	 as directly as anyone the new spirit that pervades the <font color=green>Church</font>  's stance toward the Protestant and Orthodox Churches. Noting all
church/NNP/br-d03/1914	-0.0262777277524625	0.0605511851399524	church	NNP	religion	B	B	AB	AB	group%1:03:00::	C	C	C	CDE	 the Observer depicting clergymen of the Church of England, the <font color=green>Church</font>  of Rome and the Nonconformist Church. The Catholic priest, though
church/NNP/br-d03/1920	-0.0214824479094236	0.0704667116459597	church	NNP	religion	B	B	AB	AB	group%1:03:00::	C	C	C	CDE	 Church of England, the Church of Rome and the Nonconformist <font color=green>Church</font> . The Catholic priest, though somewhat superficially drawn, easily came out
church/NNP/br-d03/2022	-0.0298044323978417	0.104356620351057	church	NNP	religion	B	B	AB	AB	group%1:03:00::	C	C	C	CDE	 comments were equally made by an Anglican parson, a Free <font color=green>Church</font>  minister and a Catholic priest. Catholic priests have frequently appeared
church/NNP/br-d03/91	0.0652185774232637	0.0664513489228463	church	NNP	religion	A	A	AB	AB	group%1:03:00::	C	C	C	CDE	 the religious sphere so popularly discussed as Christian unity. The <font color=green>Church</font>  Unity Octave, January 18- 25, was enthusiastically devoted to prayer
church/NNP/br-d05/1515	-0.11221868684096	0.13592861252183	church	NNP	religion	C	C	C	CDE	Z	Z	Z	Z	Z	 the world-at-large, disguised as the minister of a`` twenty-eighth Congregational <font color=green>Church</font> '' which bore no resemblance to the Congregational polities descended from
church/NNP/br-d05/207	0.199985557202228	0.152852202918361	church	NNP	religion	C	C	C	CDE	Z	Z	Z	Z	Z	 existed for their returning the Public Lecture to the First <font color=green>Church</font> , and so to suppress it, rather than let Parker use
church/NNP/br-d09/1115	0.0622973177842447	0.0460199625228881	church	NNP	religion	A	A	AB	AB	Z	Z	Z	Z	Z	 Reception Service. There is a growing conviction among pastors and <font color=green>Church</font>  leaders that all those who come into the fellowship of
church/NNP/br-d09/1127	0.221762235818345	0.0392464660465444	church	NNP	religion	C	C	C	CDE	Z	Z	Z	Z	Z	 that all those who come into the fellowship of the <font color=green>Church</font>  need preparatory training, including those coming by transfer of membership
church/NNP/br-d09/1156	0.00807665314578105	-0.157694413707978	church	NNP	religion	A	A	AB	AB	Z	Z	Z	Z	Z	 There is danger in trying to make admission to the <font color=green>Church</font>  so easy and painless that people will scarcely know that
church/NNP/br-d09/129	-0.0194763029603416	0.00158209358750805	church	NNP	religion	A	A	AB	AB	Z	Z	Z	Z	Z	 one-third of those visited make commitments to Christ and the <font color=green>Church</font> . The pastor and the Membership Preparation and Assimilation Committee must
church/NNP/br-d09/1297	0.0112986716851382	0.0265904049693689	church	NNP	religion	B	B	AB	AB	Z	Z	Z	Z	Z	 faith and to be received into the fellowship of the <font color=green>Church</font> . This should be a high moment in their lives, a
church/NNP/br-d09/1404	0.0637541456283648	-0.0170367021604429	church	NNP	religion	A	A	AB	AB	Z	Z	Z	Z	Z	 to determine the attitude of the new members toward the <font color=green>Church</font> . It can mean the difference between participation and inaction, spiritual
church/NNP/br-d09/1436	0.0203856798002524	-0.0206389598635396	church	NNP	religion	A	A	AB	AB	Z	Z	Z	Z	Z	 natural and logical time to receive new members into the <font color=green>Church</font> . The atmosphere for this momentous experience can be created most
church/NNP/br-d09/1708	0.090843523427933	-0.0781188286682017	church	NNP	religion	A	A	AB	AB	Z	Z	Z	Z	Z	 be a participant. Yet the most difficult problem in the <font color=green>Church</font>  's program of evangelism is right at this point- helping
church/NNP/br-d09/172	0.0693920469014127	0.019150375664806	church	NNP	religion	A	A	AB	AB	Z	Z	Z	Z	Z	 determine their interest and participation in the life of the <font color=green>Church</font> . Neglect means spiritual paralysis or death. Churches that have a
church/NNP/br-d09/1774	-0.0429564002148264	-0.092643914046807	church	NNP	religion	C	C	C	CDE	Z	Z	Z	Z	Z	 that nearly 40 per cent of those who joined the <font color=green>Church</font>  were lost to the Church within seven years. One denomination
church/NNP/br-d09/1779	0.0184257098574463	-0.0296133773708865	church	NNP	religion	C	C	C	CDE	Z	Z	Z	Z	Z	 of those who joined the Church were lost to the <font color=green>Church</font>  within seven years. One denomination had a membership of 1419833
church/NNP/br-d09/2131	0.058471104200931	0.062642818659299	church	NNP	religion	A	A	AB	AB	Z	Z	Z	Z	Z	 the meaning of Christian discipleship. When they unite with the <font color=green>Church</font>  they must find in this fellowship the satisfaction of their
church/NNP/br-d09/2155	0.0464448648116224	0.00210903390237557	church	NNP	religion	A	A	AB	AB	Z	Z	Z	Z	Z	 needs or they will never mature into effective Christians. The <font color=green>Church</font>  expects certain things of those who become members. The new
church/NNP/br-d09/231	0.0664384796359116	-0.041010343731121	church	NNP	religion	A	A	AB	AB	Z	Z	Z	Z	Z	 It is important that persons desiring to unite with the <font color=green>Church</font>  be prepared for this experience so that it may be
church/NNP/br-d09/262	0.0673906649868794	0.0358719197111747	church	NNP	religion	A	A	AB	AB	Z	Z	Z	Z	Z	 to ask a person to take the sacred vows of <font color=green>Church</font>  membership before he has been carefully instructed concerning their implications
church/NNP/br-d09/276	0.00760421105977386	-0.017888701207082	church	NNP	religion	B	B	AB	AB	Z	Z	Z	Z	Z	 he has been carefully instructed concerning their implications. Preparation for <font color=green>Church</font>  membership begins immediately after the commitment is received. The pastor
church/NNP/br-d09/39	0.105551758242068	0.129648260312671	church	NNP	religion	A	A	AB	AB	Z	Z	Z	Z	Z	 to achieve Christian stature, it is an indictment of the <font color=green>Church</font> . These fatalities are dramatic evidence of`` halfway evangelism'', a failure
church/NNP/br-d09/515	-0.0103901087271554	0.00506697891972714	church	NNP	religion	A	A	AB	AB	Z	Z	Z	Z	Z	 require more. None should ask less. Those who join the <font color=green>Church</font>  need to be instructed in the faith and the meaning
church/NNP/br-d09/544	0.0815298996769754	-0.00528547135589669	church	NNP	religion	A	A	AB	AB	Z	Z	Z	Z	Z	 sacred vows. They will have a greater appreciation for the <font color=green>Church</font>  and a deeper devotion to it if membership requires something
church/NNP/br-d09/6	-0.00275844327282796	-0.070143125232128	church	NNP	religion	A	A	AB	AB	Z	Z	Z	Z	Z	 Few persons who join the <font color=green>Church</font>  are insincere. They earnestly desire to do the will of
church/NNP/br-d09/624	0.0294322593394195	0.00614467363509137	church	NNP	religion	C	C	C	CDE	Z	Z	Z	Z	Z	 cover four major areas: The Christian Faith History of the <font color=green>Church</font>  Duties of Church Membership The Local Church and Its Program
church/NNP/br-d09/627	0.0229804645371908	0.00127340510464311	church	NNP	religion	C	C	C	CDE	Z	Z	Z	Z	Z	 areas: The Christian Faith History of the Church Duties of <font color=green>Church</font>  Membership The Local Church and Its Program Following each instruction
church/NNP/br-d09/631	0.0282130932390722	-0.00722480686920617	church	NNP	religion	C	C	C	CDE	Z	Z	Z	Z	Z	 History of the Church Duties of Church Membership The Local <font color=green>Church</font>  and Its Program Following each instruction period a piece of
church/NNP/br-d14/1311	-0.0245398193732114	0.0318899446898686	church	NNP	religion	B	B	AB	AB	Z	Z	Z	Z	Z	 men and women of New England ancestry also issued the <font color=green>Church</font>  of Jesus Christ of Latter Day Saints, the Seventh Day
church/NNP/br-e13/1916	-0.08721817022449	-0.0634741518061469	church	NNP	skill_and_hobbies	D	D	DE	CDE	Z	Z	Z	Z	Z	 a road toward another gate in the distance, past the <font color=green>Church</font>  of St. Irene, completed by Constantine in 330 A. D.
church/NNP/br-g02/1539	0.0589819257813773	0.112097697911134	church	NNP	belles_lettres	A	A	AB	AB	Z	Z	Z	Z	Z	 and influence of such other claimants for loyalty as the <font color=green>Church</font> . The breakup of the Holy Roman Empire and the downfall
church/NNP/br-j25/691	0.175534199739359	0.0414271360399364	church	NNP	learned	B	B	AB	AB	Z	Z	Z	Z	Z	 indicators of expected adherence to group norms. However, because of <font color=green>Church</font>  laws, lately more stringently enforced, which forbid the marriage of
church/NNP/br-j57/304	-0.02197352396344	0.0961078102029362	church	NNP	learned	B	B	AB	AB	group%1:03:00::	C	C	C	CDE	 Indeed, it is even surprising in the Canon of Christ <font color=green>Church</font>  and Regius Professor of Ecclesiastical History, who fathered this most
church/NNP/br-k04/233	-0.0772194787219662	-0.075676318163584	church	NNP	fiction_gral	D	D	DE	CDE	group%1:03:00::	C	C	C	CDE	 of this crowded region was the Allen African Methodist Episcopal <font color=green>Church</font> . It was an old and dirty wooden structure, sadly in
church/NNP/br-k06/1930	-0.0344175598768256	-0.0111289966953792	church	NNP	fiction_gral	D	D	DE	CDE	group%1:03:00::	C	C	C	CDE	 strike the steeples of the other churches; not of Drew <font color=green>Church</font> . A flash illumined the trees as a crooked bolt twigged
church/NNP/br-k06/698	-0.146653775283088	0.236196781767285	church	NNP	fiction_gral	D	D	DE	CDE	group%1:03:00::	C	C	C	CDE	 the foothills, was the city of God. The Dutch Reformed <font color=green>Church</font> , with two steeples and its own school was on Main
church/NNP/br-k06/714	-0.0990916722478033	0.132293107458552	church	NNP	fiction_gral	D	D	DE	CDE	group%1:03:00::	C	C	C	CDE	 and its own school was on Main Street; the Episcopal <font color=green>Church</font>  was one block down Sussex Street; the Catholic Saint Mary's
church/NNP/br-k06/726	-0.0936983971934777	0.101316289952502	church	NNP	fiction_gral	D	D	DE	CDE	group%1:03:00::	C	C	C	CDE	 was one block down Sussex Street; the Catholic Saint Mary's <font color=green>Church</font> , with an even taller steeple and a cross on top
church/NNP/br-k06/841	-0.108274299691518	0.0686631754023567	church	NNP	fiction_gral	D	D	DE	CDE	group%1:03:00::	C	C	C	CDE	 became familiar with God, who resided chiefly in Drew Centennial <font color=green>Church</font>  with its high steeple and clock. There was no church
church/NNP/br-k06/855	-0.0888364124933141	0.0382898771163489	church	NNP	fiction_gral	D	D	DE	CDE	group%1:03:00::	C	C	C	CDE	 high steeple and clock. There was no church like Drew <font color=green>Church</font> , no preacher like Papa, who was intimate with Him, and
church/NNP/br-k10/1229	-0.0842962702762474	-0.114119133009321	church	NNP	fiction_gral	B	B	AB	AB	group%1:03:00::	C	C	C	CDE	 smashing images and tearing down symbols sacred to the Old <font color=green>Church</font> . John found it difficult, but he held him in check
church/NNS/br-a09/1417	-0.0123838130010983	-0.151874454277749	church	NNS	press_reportage	D	D	DE	CDE	Z	Z	Z	Z	Z	 will feature row houses, garden apartments, four small parks, schools, <font color=green>churches</font> , a shopping center and several small clusters of stores. The
church/NNS/br-a10/1674	-0.120603694406995	-0.0596763847748725	church	NNS	press_reportage	D	D	DE	CDE	Z	Z	Z	Z	Z	 need for their forthcoming program,`` Breakthrough'' scheduled to fill the <font color=green>churches</font>  for the next two years. In his opening address Wednesday
church/NNS/br-a10/1831	-0.0955748322916777	-0.224207820546101	church	NNS	press_reportage	C	C	C	CDE	Z	Z	Z	Z	Z	 with this challenge''.`` In 35 years we have opened 7000 <font color=green>churches</font> '', the Rev. Mr. Brandt said, adding that the denomination had
church/NNS/br-a10/1863	0.194785458309206	-0.30282846134501	church	NNS	press_reportage	C	C	C	CDE	Z	Z	Z	Z	Z	 for every 10000 persons.`` In this light we need 1000 <font color=green>churches</font>  in Illinois, where we have 200; 800 in Southern New
church/NNS/br-a10/1918	0.0245927151316982	-0.212518328913418	church	NNS	press_reportage	C	C	C	CDE	Z	Z	Z	Z	Z	 Brandt suggested the vision of 8000 new Assemblies of God <font color=green>churches</font>  in the next 10 years. To accomplish this would necessitate
church/NNS/br-a10/1980	0.087268763326084	-0.00233074039687315	church	NNS	press_reportage	C	C	C	CDE	Z	Z	Z	Z	Z	 includes: Encouraging by every means, all existing Assemblies of God <font color=green>churches</font>  to start new churches. Engaging mature, experienced men to pioneer
church/NNS/br-a10/1984	0.0666029579816845	-0.000927244304256116	church	NNS	press_reportage	C	C	C	CDE	Z	Z	Z	Z	Z	 means, all existing Assemblies of God churches to start new <font color=green>churches</font> . Engaging mature, experienced men to pioneer or open new churches
church/NNS/br-a10/1996	0.0790361993349657	-0.0668063823467749	church	NNS	press_reportage	C	C	C	CDE	Z	Z	Z	Z	Z	 churches. Engaging mature, experienced men to pioneer or open new <font color=green>churches</font>  in strategic population centers. Surrounding pioneer pastors with vocational volunteers
church/NNS/br-a10/2022	0.0429906541077433	-0.116749007745915	church	NNS	press_reportage	C	C	C	CDE	Z	Z	Z	Z	Z	 will be urged to move into the area of new <font color=green>churches</font>  in the interest of lending their support to the new
church/NNS/br-a10/2051	-0.247078583183259	-0.0224535001934413	church	NNS	press_reportage	C	C	C	CDE	Z	Z	Z	Z	Z	 to spend from 6- 12 months as apprentices in well-established <font color=green>churches</font> . U. S. Dist. Judge Charles L. Powell denied all motions
church/NNS/br-a31/1594	0.123989970421201	-0.110638054574531	church	NNS	press_reportage	C	C	C	CDE	Z	Z	Z	Z	Z	 than 300 top teenagers and 65 adult advisers from Presbyterian <font color=green>churches</font>  of the area sat enthralled at the four-hour program. This
church/NNS/br-a31/1753	0.153725928962558	-0.124227711980007	church	NNS	press_reportage	C	C	C	CDE	Z	Z	Z	Z	Z	 Auditorium may be set up soon. And to encourage other <font color=green>churches</font>  to try their own programs, Kern said this Sunday 's
church/NNS/br-a31/1806	-0.0143274308833221	-0.0328036593086219	church	NNS	press_reportage	D	D	DE	CDE	Z	Z	Z	Z	Z	 special services marking National Christian Family Week in Miami area <font color=green>churches</font>  next week. Of particular meaning to the Charles MacWhorter family
church/NNS/br-b04/1480	-0.019753648738996	-0.0871490173370726	church	NNS	press_editorial	C	C	C	CDE	Z	Z	Z	Z	Z	 his money and his name: Does it assail schools and <font color=green>churches</font>  with blanket accusations? Does it attack other traditional American institutions
church/NNS/br-b12/2239	0.00615431861885974	0.025251959576323	church	NNS	press_editorial	B	B	AB	AB	Z	Z	Z	Z	Z	 Methodist Church, Congregational Union, Baptist Union, Presbyterian Church of England, <font color=green>Churches</font>  in Wales, Churches in Ireland, Society of Friends, British and
church/NNS/br-b12/2243	0.00541777862796624	0.0192177340984054	church	NNS	press_editorial	B	B	AB	AB	Z	Z	Z	Z	Z	 Union, Baptist Union, Presbyterian Church of England, Churches in Wales, <font color=green>Churches</font>  in Ireland, Society of Friends, British and Foreign Bible Society
church/NNS/br-b22/1233	0.00403174756195137	-0.0369457340041315	church	NNS	press_editorial	B	B	AB	AB	Z	Z	Z	Z	Z	 of five Catholic theologians to attend the World Council of <font color=green>Churches</font>  assembly in New Delhi as`` official'' observers reverses the Church
church/NNS/br-b22/1326	0.126301367347415	0.170296785415166	church	NNS	press_editorial	B	B	AB	AB	Z	Z	Z	Z	Z	 pervades the Church 's stance toward the Protestant and Orthodox <font color=green>Churches</font> . Noting all the difficulties that stand in the way of
church/NNS/br-c08/1853	0.0756521600259461	0.0297400704862952	church	NNS	press_reviews	C	C	C	CDE	Z	Z	Z	Z	Z	 the early jazz forms and the music of the Negro <font color=green>churches</font> . To help him on this religious aspect of primitive jazz
church/NNS/br-d02/548	0.141136565676134	-0.0279235471971689	church	NNS	religion	B	B	AB	AB	church%1:14:00::	B	B	AB	AB	 observed to characterize the preaching and teaching of the American <font color=green>churches</font> . In the absence of a truly adequate conceptuality in which
church/NNS/br-d03/1011	0.154923719742993	-0.329350186582976	church	NNS	religion	D	D	DE	CDE	church%1:06:00::	D	D	DE	CDE	 often, the sale of 764 chapels''. Most of these former <font color=green>churches</font>  are now used as warehouses, but`` neither Anglicans nor Nonconformists
church/NNS/br-d03/1027	0.0434859429583898	0.156896102007542	church	NNS	religion	D	D	DE	CDE	church%1:06:00::	D	D	DE	CDE	 as warehouses, but`` neither Anglicans nor Nonconformists object to selling <font color=green>churches</font>  to Roman Catholics'', and have done so. While it must
church/NNS/br-d03/1051	0.0914108848978306	0.0318285416057886	church	NNS	religion	D	D	DE	CDE	church%1:06:00::	D	D	DE	CDE	 be said that these same Protestants have built some new <font color=green>churches</font>  during this period, and that religious population shifts have emptied
church/NNS/br-d03/1063	0.0828627529159738	0.00716523165347233	church	NNS	religion	C	C	C	CDE	church%1:06:00::	D	D	DE	CDE	 during this period, and that religious population shifts have emptied <font color=green>churches</font> , a principal reason for this phenomenon of redundancy is that
church/NNS/br-d03/110	0.0228777032639846	-0.00784532897845608	church	NNS	religion	C	C	C	CDE	church%1:14:00::	B	B	AB	AB	 was enthusiastically devoted to prayer and discussion by the various <font color=green>churches</font> . Many people seem hopeful, yet it is difficult to predict
church/NNS/br-d03/1472	-0.0318002688971658	0.265899667105143	church	NNS	religion	E	E	DE	CDE	church%1:06:00::	D	D	DE	CDE	 thy Son''. A hymn often to be heard in Catholic <font color=green>churches</font>  is`` Faith of our Fathers'', which glories in England 's
church/NNS/br-d03/1884	0.00983752842820243	0.0416744609426989	church	NNS	religion	B	B	AB	AB	church%1:14:00::	B	B	AB	AB	 at least of equal stature in England with the Protestant <font color=green>churches</font> . On successive Sundays during October, 1960, Paul Ferris( a non-Catholic
church/NNS/br-d03/313	0.031080885927282	0.0748638172398646	church	NNS	religion	B	B	AB	AB	anglican_church%1:14:00::	B2	B	AB	AB	 saying and writing and implying about the Roman and Anglican <font color=green>Churches</font>  and about the present religious state of England. Since the
church/NNS/br-d03/35	0.00616583694064725	0.0572742596532587	church	NNS	religion	B	B	AB	AB	anglican_church%1:14:00::	B2	B	AB	AB	 efforts of only unauthorized individuals of the Roman and Anglican <font color=green>Churches</font> , and urging a communion of prayer unacceptable to Rome, this
church/NNS/br-d03/779	0.0305151501511031	0.0870908750621391	church	NNS	religion	D	D	DE	CDE	church%1:06:00::	D	D	DE	CDE	 less than ten. From many sides come remarks that Protestant <font color=green>churches</font>  are badly attended and the large medieval cathedrals look all
church/NNS/br-d03/849	0.0233450582968458	-0.0119595171661741	church	NNS	religion	C	C	C	CDE	church%1:06:00::	D	D	DE	CDE	 admit the great falling off in effective membership in their <font color=green>churches</font> . According to a newspaper report of the 1961 statistics of
church/NNS/br-d03/929	-0.0643847519407319	-0.125071007241531	church	NNS	religion	C	C	C	CDE	church%1:06:00::	D	D	DE	CDE	 the Manchester Guardian of last November, entitled`` Fate of Redundant <font color=green>Churches</font> '', states than an Archbishops' Commission`` reported last month that in
church/NNS/br-d03/952	-0.0241190345110501	0.037148257401859	church	NNS	religion	C	C	C	CDE	church%1:06:00::	D	D	DE	CDE	 that in the Church of England alone there are 790 <font color=green>churches</font>  which are redundant now, or will be in 20 years
church/NNS/br-d05/1536	0.311749508613864	0.0431773350434767	church	NNS	religion	C	C	C	CDE	Z	Z	Z	Z	Z	 descended from the founders( among which were still the Unitarian <font color=green>churches</font> ), made explicit from the beginning that the conflict between him
church/NNS/br-d05/1935	0.247343629583203	-0.297499254383814	church	NNS	religion	C	C	C	CDE	Z	Z	Z	Z	Z	 his colleagues know that he intended them:`` Even the Unitarian <font color=green>churches</font>  have caught the malaria, and are worse than those who
church/NNS/br-d09/1216	0.26148254580829	0.0509352672724237	church	NNS	religion	C	C	C	CDE	Z	Z	Z	Z	Z	 membership training, since this is a recent development in many <font color=green>churches</font> . Those coming from other denominations will welcome the opportunity to
church/NNS/br-d09/181	0.0399953357293017	-0.0214599597963125	church	NNS	religion	C	C	C	CDE	Z	Z	Z	Z	Z	 life of the Church. Neglect means spiritual paralysis or death. <font color=green>Churches</font>  that have a carefully planned program of membership preparation and
church/NNS/br-d09/1910	0.0950669374895423	-0.0154840289654275	church	NNS	religion	C	C	C	CDE	Z	Z	Z	Z	Z	 This problem is illustrated by the fact that many local <font color=green>churches</font>  drop from the active membership rolls each year as many
church/NNS/br-d09/1946	0.0572115539822344	-0.0252144213223607	church	NNS	religion	C	C	C	CDE	Z	Z	Z	Z	Z	 some areas where population is expanding, show that numbers of <font color=green>churches</font>  have had little net increase, though many new members were
church/NNS/br-d09/502	0.114499197203766	-0.0576240028060337	church	NNS	religion	C	C	C	CDE	Z	Z	Z	Z	Z	 sessions of preparation for membership is necessary for adults. Some <font color=green>churches</font>  require more. None should ask less. Those who join the
church/NNS/br-d09/559	0.0223710171305806	0.00259811364921444	church	NNS	religion	C	C	C	CDE	Z	Z	Z	Z	Z	 devotion to it if membership requires something of them. Many <font color=green>churches</font>  find the Sunday school hour to be the most practical
church/NNS/br-d09/891	0.0642125221507532	-0.077444244315254	church	NNS	religion	C	C	C	CDE	Z	Z	Z	Z	Z	 have been found effective. Extend the number of classes. Some <font color=green>churches</font>  have six or more training sessions of two hours each
church/NNS/br-d10/1095	0.122174992510846	-0.0304068669725482	church	NNS	religion	C	C	C	CDE	Z	Z	Z	Z	Z	 Asians tend to consider not only missions but the local <font color=green>churches</font>  they have produced as centers and agents of Western culture
church/NNS/br-d10/2114	0.0826109197614723	-0.0305530013466281	church	NNS	religion	B	B	AB	AB	Z	Z	Z	Z	Z	 Newbiggin reflects the dominant position within the World Council of <font color=green>Churches</font>  when he says,`` We must claim absoluteness and finality for
church/NNS/br-d10/305	0.302500149581405	-0.28841833233835	church	NNS	religion	C	C	C	CDE	Z	Z	Z	Z	Z	 may have a certain justification, we ought to dispense with <font color=green>churches</font> . The suggestion is naive. Man is at once a gregarious
church/NNS/br-d14/1926	0.0869014723013416	0.0798782267337446	church	NNS	religion	B	B	AB	AB	Z	Z	Z	Z	Z	 John Greenleaf Whittier( 1807- 1892) he eventually attacked the orthodox <font color=green>churches</font>  for what he deemed their cowardly compromising on the slavery
church/NNS/br-d14/199	0.00882308225608752	0.00513477644040661	church	NNS	religion	C	C	C	CDE	Z	Z	Z	Z	Z	 proportion, although in 1914 still a minority, were members of <font color=green>churches</font> . Presumably those who did not have a formal church connexion
church/NNS/br-d14/457	0.0412533544275931	-0.00425700140836109	church	NNS	religion	C	C	C	CDE	Z	Z	Z	Z	Z	 church members mounted, the degree of discipline exercised by the <font color=green>churches</font>  lessened and the trend was towards conformity to the general
church/NNS/br-d14/507	0.0416047157452048	-0.00917033881938964	church	NNS	religion	C	C	C	CDE	Z	Z	Z	Z	Z	 the ethical codes to which the majority subscribed. Thus Baptist <font color=green>churches</font>  on the frontier took cognizance of charges against their members
church/NNS/br-d17/569	0.115161346613446	-0.121438414375852	church	NNS	religion	C	C	C	CDE	Z	Z	Z	Z	Z	 one of my editorial workers wanted to find out how <font color=green>churches</font>  and philanthropic organizations met the needs of New York 's
church/NNS/br-e12/1082	-0.0291120490086266	-0.124012768202927	church	NNS	skill_and_hobbies	D	D	DE	CDE	Z	Z	Z	Z	Z	 famous Alamo and photograph 18 th Century Spanish buildings and <font color=green>churches</font> . The Great Smoky Mountains is another area of the South
church/NNS/br-e13/808	0.0514912300844909	-0.117777759704362	church	NNS	skill_and_hobbies	D	D	DE	CDE	Z	Z	Z	Z	Z	 fell in. Nevertheless, it remained one of the most splendid <font color=green>churches</font>  of the Eastern Empire, where the Byzantine Emperors were crowned
church/NNS/br-f15/1245	0.0813901430415869	0.0668046687050416	church	NNS	popular_lore	B	B	AB	AB	church%1:14:00::	B	B	AB	AB	 Consider what happened during World War 1,, when the Protestant <font color=green>churches</font>  united to push the Prohibition law through Congress. Many of
