id	model.x	model.y	lemma	pos	sensekey	marisense	mbroad	wnbroad	text
state/NN/br-b02/1892	-0.00146515021977073	-0.00184129921553119	state	NN	NA	C	C	NA	 concept that for six years it bypassed as unreasonable. The <font color=green>State</font>  Department tacitly rejected the neutral Laos idea after the Geneva
state/NN/br-b02/1928	-0.00146748056018988	-0.00185935161683996	state	NN	NA	A5	A	NA	 neutral Premier Souvanna Phouma. But since last fall the United <font color=green>States</font>  has been moving toward a pro-neutralist position and now is
state/NN/br-b02/2137	-0.00144946533336422	-0.00185131820682913	state	NN	NA	A3	A	NA	 Columbia with$ 1000000 to be used in support of private, <font color=green>state</font> , or municipal ETV efforts. The funds would be used for
state/NN/br-b04/2010	-0.00145042286353687	-0.00186566675691796	state	NN	NA	A4	A	NA	 that their deliberations be conducted openly.`` The people of this <font color=green>state</font>  do not yield their sovereignty to the agencies that serve
state/NN/br-b04/640	-0.00147163641079066	-0.00184893049092432	state	NN	NA	A3	A	NA	 consistently. So have the people 's elected spokesmen at the <font color=green>state</font>  and federal levels. Interama, as it rises, will be a
state/NN/br-b04/715	-0.00145212814217944	-0.00185784680808766	state	NN	NA	A3	A	NA	 happened in this field during the past 12 months. Each <font color=green>state</font>  advisory committee documented its own activity. Some accounts are quite
state/NN/br-b04/830	-0.00145883091451285	-0.00184807734553989	state	NN	NA	A3	A	NA	 progressed in a sound and equitable program at both the <font color=green>state</font>  and local levels in its efforts to review and assess
state/NN/br-b05/1334	-0.0014534006896445	-0.00184027993113335	state	NN	NA	C	C	NA	 secretary 's neck may be spared. Cambodia 's chief of <font color=green>state</font> , who has been accused of harboring Communist marauders and otherwise
state/NN/br-b05/2071	-0.00146670612444263	-0.00185157459115935	state	NN	NA	A1	A	NA	 has tagged the sanctuary as the kind of place the <font color=green>state</font>  hopes to include in its program to double its park
state/NN/br-b05/556	-0.00144647161827536	-0.00185222080582663	state	NN	NA	A5	A	NA	 Secretary Freeman 's claim that the high estate of United <font color=green>States</font>  agriculture is the`` strongest deterrent'' to the spread of communism
state/NN/br-b05/804	-0.00146509365035796	-0.00186619686755727	state	NN	NA	C	C	NA	 by Sen. Jackson of Washington has been going over the <font color=green>State</font>  Department and has reached some predictable conclusions. The department needs
state/NN/br-b06/1981	-0.00145507526264901	-0.00186142421256511	state	NN	NA	A5	A	NA	 likely to happen, however, should prompt the sending of United <font color=green>States</font>  soldiers for other than instructional missions. The Indochina struggle was
state/NN/br-b06/2079	-0.00145981504877122	-0.00185870035140385	state	NN	NA	A5	A	NA	 be forthcoming. South Viet Nam has received$ 1450000000 in United <font color=green>States</font>  aid since 1954 and the rate of assistance has been
state/NN/br-b06/285	-0.00145790130095637	-0.00184743525429942	state	NN	NA	A	A	NA	 conference. The University can make a valuable contribution to the <font color=green>state</font>  's economic development through such a study. In Southern Illinois
state/NN/br-b07/2016	-0.00145426199426768	-0.00185064043855144	state	NN	NA	D	D	NA	 doing his greatest service with his straightforward report on the <font color=green>state</font>  of the public schools. A fascinating letter has just reached
state/NN/br-b07/293	-0.0014681677077613	-0.00184853789367908	state	NN	NA	A5	A	NA	 the nature of his relationship with them. Although the United <font color=green>States</font>  and the U. S. S. R. have been arguing whether
state/NN/br-b07/452	-0.00145612903303922	-0.00186757518361605	state	NN	NA	A5	A	NA	 instructions. This is the root issue for which the United <font color=green>States</font>  should stand. We should not become confused or let our
state/NN/br-b11/1043	-0.00146808924212025	-0.00185136852528291	state	NN	NA	A5	A	NA	 played up artificially because it is needed by the United <font color=green>States</font>  to justify its arms drive''. The Soviet news agency TASS
state/NN/br-b11/1246	-0.00145147275398882	-0.00186559375354053	state	NN	NA	A5	A	NA	 the most vital domestic and foreign problems confronting the United <font color=green>States</font> . In fact, the world heard nothing but sabre-rattling, the same
state/NN/br-b11/1305	-0.00146088506807403	-0.00185667102934085	state	NN	NA	A5	A	NA	 to solve the internal and external problems besetting the United <font color=green>States</font>  and its NATO partners. Washington apparently decided to use an
state/NN/br-b11/754	-0.00147105924480079	-0.00184807117413947	state	NN	NA	A3	A	NA	 CDC 's broad appeal. State Sen. Dick Richards will keynote; <font color=green>state</font>  and county committeemen, CDC directors and representatives, members of 16
state/NN/br-b11/910	-0.0014688637409042	-0.00185182714906664	state	NN	NA	A5	A	NA	 's latest warning to the Communist world that the United <font color=green>States</font>  will build up its military strength to meet any challenge
state/NN/br-b12/55	-0.00148009012660733	-0.00186967251412262	state	NN	NA	A3	A	NA	 34- hour week, all holidays off and fringe benefits including <font color=green>state</font>  contributions toward lawyers' fees. Some day we might see a
state/NN/br-b12/673	-0.00147648367574366	-0.00185546319111644	state	NN	NA	A5	A	NA	 man who was instrumental in opening relations between the United <font color=green>States</font>  and Korea, Frederick T. Frelinghuysen, secretary of state in the
state/NN/br-b12/683	-0.00147252501742002	-0.00186040302290978	state	NN	NA	C	C	NA	 the United States and Korea, Frederick T. Frelinghuysen, secretary of <font color=green>state</font>  in the administration of Chester A. Arthur. In addition Rep.
state/NN/br-b12/732	-0.00146786589295719	-0.0018668589877128	state	NN	NA	A5	A	NA	 the signing of the treaty between Korea and the United <font color=green>States</font>  and experts in Seoul are trying to find the correspondence
state/NN/br-b12/751	-0.00144486027811826	-0.00182990057710369	state	NN	NA	C	C	NA	 find the correspondence between Frederick Frelinghuysen, who was secretary of <font color=green>state</font>  in 1883 and 1884, and Gen. Lucius Foote, who was
state/NN/br-b14/2124	-0.0014608753401578	-0.00183915188106532	state	NN	NA	B	B	NA	 tour of debates, it can provide a service to the <font color=green>state</font> . But the Legislature should be granted the opportunity to complete
state/NN/br-b15/2065	-0.00146958220004532	-0.00184963008384157	state	NN	NA	A2	A	NA	 hospitalization. The public should understand that whether they support a <font color=green>state</font>  hospital or a VA hospital, the tax dollar has to
state/NN/br-b15/2108	-0.00146370044525736	-0.00186017110376227	state	NN	NA	A2	A	NA	 VA hospital or the tax dollar is spent for the <font color=green>state</font>  hospital. An adequate system of VA hospitals is better equipped
state/NN/br-b15/2128	-0.00148133774672277	-0.00186443148233416	state	NN	NA	A2	A	NA	 better equipped to care for the veterans than any 50 <font color=green>state</font>  hospitals. It seems that open season upon veterans' hospitalization is
state/NN/br-b16/1030	-0.00146451967419896	-0.00186503765710465	state	NN	NA	A3	A	NA	 a member for more than 40 years, on the recent <font color=green>state</font>  convention. I regret that Bertha Madeira[ today 's`` Voice''] obtained
state/NN/br-b16/117	-0.00144806792699851	-0.00187062616399236	state	NN	NA	A5	A	NA	 our prestige and morale? If the President of the United <font color=green>States</font>  really feels he won himself a`` lousy job'', then heaven
state/NN/br-b16/1654	-0.00143406771602048	-0.0018579660067191	state	NN	NA	A5	A	NA	 burden on du Pont stockholders, in connection with the United <font color=green>States</font>  Supreme court ruling that du Pont must divest itself of
state/NN/br-b17/1171	-0.001474040626175	-0.00185788454165756	state	NN	NA	A3	A	NA	 of the men in the toll booths on the Garden <font color=green>State</font>  Parkway. Recently I traveled the parkway from East Orange to
state/NN/br-b17/565	-0.00144158820049186	-0.0018551918467644	state	NN	NA	A5	A	NA	 natural standards, they were justified in doing so. The United <font color=green>States</font>  and the U. N. denounce their own principles when they
state/NN/br-b18/898	-0.00145098748114065	-0.00186097793028177	state	NN	NA	A5	A	NA	 Court of Justice. The Connally amendment says that the United <font color=green>States</font> , rather than the court, shall determine whether a matter is
state/NN/br-b18/931	-0.00146901476444208	-0.0018473773479266	state	NN	NA	A5	A	NA	 a case before the World Court to which the United <font color=green>States</font>  is a party. If the case is thus determined by
state/NN/br-b19/530	-0.00145932207569155	-0.00186810037306553	state	NN	NA	A5	A	NA	 new boss of British Guiana, was educated in the United <font color=green>States</font>  is no reason to think he is n't a Red
state/NN/br-b20/358	-0.00145834743873475	-0.00184708088021266	state	NN	united_states%1:14:00::	A5	A	G	 seek a discontinuity in the arms policy of the United <font color=green>States</font>  is the least risky path our government can take. His
state/NN/br-b21/1367	-0.00145850665624695	-0.00186681469716726	state	NN	NA	A5	A	NA	 risk of health damage to some people in the United <font color=green>States</font> ''. Then it added:`` It is not possible to determine how
state/NN/br-b21/944	-0.00146250332673034	-0.00186066759638546	state	NN	NA	A5	A	NA	 human race. But the guilt is shared by the United <font color=green>States</font> , Britain and France, the other members of the atomic club
state/NN/br-b22/97	-0.00146798823721889	-0.00187919886510776	state	NN	NA	A5	A	NA	 obvious- during the mid to late' 50 's- the United <font color=green>States</font>  appeared to have three choices. It could have unilaterally abandoned
state/NN/br-b23/1010	-0.00148338681751338	-0.00183807201495317	state	NN	NA	B	B	NA	 is Tibet. Tibet has historically served China as a buffer <font color=green>state</font> . A friendly state, sometimes only semi-independent, but never hostile. China
state/NN/br-b23/1014	-0.00142916645870389	-0.00186248952860122	state	NN	NA	B	B	NA	 has historically served China as a buffer state. A friendly <font color=green>state</font> , sometimes only semi-independent, but never hostile. China never tried to
state/NN/br-b23/1096	-0.0014375113541315	-0.00186651634146706	state	NN	NA	D	D	NA	 military, are doing much to keep China in a heightening <font color=green>state</font>  of tension. The imposition of yet another pressure, a strong
state/NN/br-b24/1716	-0.0014650324910437	-0.00184992140139626	state	NN	NA	D	D	NA	 Oskar Kokoschka, is widely known in the U. S.. This <font color=green>state</font>  of unawareness may not last much longer. For ten years
state/NN/br-b24/2301	-0.0014636361737815	-0.00187339428826735	state	NN	NA	D	D	NA	 most was the female body, which he painted in every <font color=green>state</font> - naked, half-dressed, muffled to the ears, sitting primly in a
state/NN/br-b25/1008	-0.00144847733715189	-0.00186290275580676	state	NN	NA	D	D	NA	 line of peaceful coexistence, reducing this concept merely to the <font color=green>state</font>  of peace or rather, the absence of war at a
state/NN/br-b25/404	-0.00145066540125967	-0.00186033806708109	state	NN	NA	A2	A	NA	 system and replace it by uniformly wage-earning sovkhozes, i. e., <font color=green>state</font>  farms( which were, moreover, to be progressively`` urbanized'')? As we
state/NN/br-b25/593	-0.00146032746255226	-0.00185165609323661	state	NN	NA	C	C	NA	 other'' 50 per cent of the nation from that`` welfare <font color=green>state</font> '' which the Soviet Union so greatly prides itself on being
state/NN/br-b25/842	-0.00144053904812782	-0.00187336442410578	state	NN	NA	C	C	NA	 against all the more popular features of the Khrushchev`` welfare <font color=green>state</font> ''. The trouble with all these doctrinal quarrels is that we
state/NN/br-b27/1479	-0.00145557178744207	-0.00185852398807056	state	NN	NA	A5	A	NA	 and its teaching. Four of us here in the United <font color=green>States</font>  attended, first as students, then as instructors, almost every one
state/NN/br-c03/237	-0.00146438285179965	-0.001865789841496	state	NN	NA	A5	A	NA	 Bella Bella'', by Robert Fleming, was given its first United <font color=green>States</font>  performance. The title refers to the nickname given his wife
state/NN/br-c06/581	-0.00146146436821258	-0.00184249729303752	state	NN	NA	C	C	NA	 Union in 1941, he penned a private note to a <font color=green>State</font>  Department official, expressing the hope that`` never would we associate
state/NN/br-c06/671	-0.00147522429228225	-0.00185660021009878	state	NN	NA	B	B	NA	 what had been going on in Poland and the Baltic <font color=green>States</font> ''. He also speaks of Franklin D. Roosevelt 's`` puerile'' assumption
state/NN/br-c16/1216	-0.00144697459149231	-0.00185704148767872	state	NN	NA	C	C	NA	 Government devoted its attention to the creation of a welfare <font color=green>state</font> . With Britain looking inward, overseas problems were neglected and the
state/NN/br-c16/1236	-0.00145452269620693	-0.00188979392333176	state	NN	NA	A5	A	NA	 neglected and the baton was passed on to the United <font color=green>States</font> . Montgomery believes that she started well.`` America gave generously in
state/NN/br-d03/319	-0.00146606947214805	-0.00185741202554541	state	NN	state%1:03:00::	D	D	B	 the Roman and Anglican Churches and about the present religious <font color=green>state</font>  of England. Since the Protestant clergy for the most part
state/NN/br-d04/1599	-0.00146712853513182	-0.00185277067047427	state	NN	state%1:03:00::	D	D	B	 interminable and irremediable. But He set a bound to his[ <font color=green>state</font>  of] sin, by interposing death, and thus causing sin to
state/NN/br-d04/2174	-0.00146593477769832	-0.00184443152728455	state	NN	state%1:03:00::	D	D	B	 existence itself is a form of punishment rather than the <font color=green>state</font>  into which man is put by the will of the
state/NN/br-d06/1779	-0.00142239009204548	-0.00185141087178636	state	NN	NA	A5	A	NA	 paid yearly to the 80000 full-time fortune-tellers in the United <font color=green>States</font>  by fearful mankind who want to`` know'' what the future
state/NN/br-d07/925	-0.00146173309425288	-0.00185878777678932	state	NN	NA	A5	A	NA	 the same effect on Communists. The President of the United <font color=green>States</font>  has said:`` We will never negotiate out of fear, and
state/NN/br-d10/1157	-0.00145295120485514	-0.00184796061561268	state	NN	NA	B	B	NA	 many Buddhists argue that Buddhism ought to be the official <font color=green>state</font>  religion. In 1960 Ceylon nationalized its sectarian- preponderantly Christian- schools
state/NN/br-d10/1318	-0.00147469709555672	-0.00186111418732236	state	NN	NA	A5	A	NA	 funds to contract for them. After returning to the United <font color=green>States</font>  and raising the money, he discovered on getting back to
state/NN/br-d10/1630	-0.00144829330610378	-0.00184504236426214	state	NN	NA	B	B	NA	 enactment. Pakistan was created in 1947 expressly as a Muslim <font color=green>state</font> , but when the army took over eleven years later it
state/NN/br-d10/1699	-0.0014676142925505	-0.00185609768955068	state	NN	NA	B	B	NA	 Adams reports the Pakistanis as asking,`` in demanding an Islamic <font color=green>state</font>  and society if no one, not even the doctors of
state/NN/br-d10/1727	-0.00146745903176679	-0.00186540369053695	state	NN	NA	C	C	NA	 say clearly and succinctly what the nature of such a <font color=green>state</font>  and society is''? The current regime of President Mohammad Ayub
state/NN/br-d13/922	-0.00145344678855109	-0.00185294078694408	state	NN	NA	A4	A	NA	 rate, so I decided to take another measure- the whole <font color=green>state</font>  of Pennsylvania. Imagine that there is a blizzard over Pennsylvania
state/NN/br-d14/13	-0.00144505284390406	-0.00185513836124312	state	NN	NA	A5	A	NA	 extent and in what ways did Christianity affect the United <font color=green>States</font>  of America in the nineteenth century? How far and in
state/NN/br-d14/853	-0.00146581720445909	-0.00184891770462068	state	NN	NA	A5	A	NA	 on the Evangelical revivals. The great seal of the United <font color=green>States</font>  was obviously inspired by the Christian faith. Here was what
state/NN/br-d15/1409	-0.00145560313970801	-0.00183133538453485	state	NN	NA	D	D	NA	 words, or any other manifestations that belong to the normal <font color=green>state</font>  of consciousness are considered only the surface of experience. The
state/NN/br-e02/1595	-0.00144821781325505	-0.00182287844448985	state	NN	united_states%1:15:00::	A5	A	F	 made it possible to ship avocado anywhere in the United <font color=green>States</font> . It has a great many assets to recommend it and
state/NN/br-e02/1889	-0.00144733713750205	-0.00186575963587242	state	NN	state%1:03:00::	D	D	B	 temperature at which it lapses into a sort of dormant <font color=green>state</font> . This cooling does not change the avocado in any way
state/NN/br-e05/1327	-0.00147414534061465	-0.001865390886387	state	NN	NA	A5	A	NA	 who has placed in the Junior Classes in both United <font color=green>States</font>  and Canada. Karen Marcmann, age 16, Trapp, Penna., showing a
state/NN/br-e06/115	-0.00148871475534002	-0.00187056424124279	state	NN	NA	A4	A	NA	 from sea to shining sea. Boats are operated in every <font color=green>state</font>  in the Union, with the heaviest concentrations along both coasts
state/NN/br-e06/1425	-0.00148198703540406	-0.00186231688212717	state	NN	NA	A	A	NA	 restriction on boating. Laws on boating vary according to the <font color=green>state</font>  in which the craft is to be used and according
state/NN/br-e06/1446	-0.00147199552704246	-0.00189246016841597	state	NN	NA	A4	A	NA	 according to its horsepower. What may be acceptable in one <font color=green>state</font>  may be strictly prohibited across the boundary line. The main
state/NN/br-e06/1473	-0.00143156121532968	-0.00184563369949576	state	NN	NA	A	A	NA	 the boat is numbered according to the regulations of the <font color=green>state</font>  in which the boat will be principally used. If your
state/NN/br-e06/1485	-0.00143424636220131	-0.00184704903555073	state	NN	NA	A	A	NA	 in which the boat will be principally used. If your <font color=green>state</font>  has no provisions for the numbering of pleasure boats, you
state/NN/br-e06/1922	-0.0014515827220469	-0.00186814636544254	state	NN	NA	A5	A	NA	 It is important to note the work of the United <font color=green>States</font>  Power Squadrons and the U. S. Coast Guard Auxiliary. Each
state/NN/br-e06/2225	-0.00145814433782067	-0.00186878608912928	state	NN	NA	A5	A	NA	 commercially and municipally operated marinas and boatyards in the United <font color=green>States</font> , the majority of which are equipped to handle outboard boats
state/NN/br-e06/72	-0.00144832877923793	-0.00186901587755537	state	NN	NA	A5	A	NA	 more than 8000000 recreational boats in use in the United <font color=green>States</font>  with almost 10000000 the prediction for within the next decade
state/NN/br-e12/1033	-0.00147933708890359	-0.00185168660475519	state	NN	NA	A	A	NA	 adventure are the Luray Caverns, lit by photofloodlights. The great <font color=green>state</font>  of Texas offers metropolitan attractions such as the Dallas Fair
state/NN/br-e12/887	-0.00147421048254703	-0.00186076916562457	state	NN	NA	A5	A	NA	 Fredericksburg, Virginia. Florida provides tropical scenes unequalled in the United <font color=green>States</font> . At Cypress Gardens special bleachers are set up for photographers
state/NN/br-e19/762	-0.0014356441958559	-0.00188448499191838	state	NN	NA	A2	A	NA	 they had quadrupled. Had we taken a lien on a <font color=green>state</font>  park? Not at all. We had merely been discovered by
state/NN/br-f05/242	-0.00146338813817893	-0.0018502712746986	state	NN	NA	A4	A	NA	 had offices- and wondered how to move the mail. The <font color=green>state</font>  's railroad system counted miles of broken bridges and missing
state/NN/br-f05/356	-0.00145950689223102	-0.00182975031604179	state	NN	NA	A4	A	NA	 planes to fly the mail in and out of the <font color=green>state</font> , it seemed a likely temporary solution, easing Burlington 's bottleneck
state/NN/br-f09/1758	-0.00145759623778318	-0.00185909783742547	state	NN	NA	A5	A	NA	 a temporary passport, good only for return to the United <font color=green>States</font> . And return to the United States she did, into waiting
state/NN/br-f09/1765	-0.00146262409578637	-0.00184001281292149	state	NN	NA	A5	A	NA	 return to the United States. And return to the United <font color=green>States</font>  she did, into waiting arms- the unromantic ones of the
state/NN/br-f11/1746	-0.00145990659104012	-0.00183310494457733	state	NN	NA	A5	A	NA	 of months or years. In many cities in the United <font color=green>States</font>  clinics associated with dental schools will take patients at a
state/NN/br-f12/2279	-0.0014449570750886	-0.00183605024569061	state	NN	NA	D	D	NA	 taken with other details it could have referred to a <font color=green>state</font>  of mental or spiritual confinement. In this connection it is
state/NN/br-f12/338	-0.0014562616166366	-0.00184635046785486	state	NN	NA	D	D	NA	 to realize that the medium was describing very vividly his <font color=green>state</font>  of mind. He himself might not have been really aware
state/NN/br-f14/457	-0.00144775945203369	-0.00182474731521158	state	NN	united_states%1:15:00::	A5	A	F	 and the tightening of Stalin 's dictatorship; in the United <font color=green>States</font>  the initiation of militant anti Communism, with the repentant ex
state/NN/br-f15/701	-0.00145002518911489	-0.00185435158470874	state	NN	state%1:15:01::	A1	A	A	 considered by non-Catholics in family planning. The laws of many <font color=green>states</font>  permit birth control only for medical reasons. The Roman Catholic
state/NN/br-f17/1114	-0.00144931557953788	-0.0018423881152548	state	NN	united_states%1:14:00::	A5	A	G	 presence of a colony on the Red prompted the United <font color=green>State</font>  War Department in 1819 to send Lieutenant-Colonel Henry Leavenworth from
state/NN/br-f17/1627	-0.00148058839953574	-0.001869956693675	state	NN	united_states%1:15:00::	A5	A	F	 Swiss also decided to cast their lot with the United <font color=green>States</font> , and in 1823 several families paid guides to take them
state/NN/br-f17/743	-0.0014578256827957	-0.00185123144045139	state	NN	united_states%1:15:00::	A5	A	F	 return to the Atlantic coast by way of the United <font color=green>States</font> . In September 1817 at Fort Daer( Pembina) Dickson met the
state/NN/br-f17/811	-0.00146436713964237	-0.00184856224603694	state	NN	united_states%1:15:00::	A5	A	F	 from England to reach Red River and that the United <font color=green>States</font>  was a better source of supply for many goods than
state/NN/br-f17/844	-0.00145484626912313	-0.00186543541592896	state	NN	secretary_of_state%1:18:01::	C	C	H	 on December 22 wrote to John Quincy Adams, Secretary of <font color=green>State</font>  at Washington, inquiring about laws covering trade with`` Missouri and
state/NN/br-f19/1831	-0.00149887712609364	-0.00184547901291656	state	NN	united_states%1:15:00::	A5	A	F	 of the hundred odd folklore courses given in the United <font color=green>States</font>  survive on sentiment and nationalism alone. If one wishes to
state/NN/br-f19/231	-0.00146207003960669	-0.00184781636242475	state	NN	united_states%1:15:00::	A5	A	F	 pine, and they can be applied again to the United <font color=green>States</font>  in more recent years. The popularity of local color literature
state/NN/br-f19/373	-0.00146469658285216	-0.00187573005899888	state	NN	united_states%1:15:00::	A5	A	F	 of the major culture lags of the twentieth century United <font color=green>States</font> . Yet nationalism has lost few of its charms for the
state/NN/br-f19/619	-0.0014712268473794	-0.00184336364927575	state	NN	state%1:15:01::	A	A	A	 symbol of honesty and the father image of the uniting <font color=green>States</font> . Abraham Lincoln emerged as an incarnation of the national Constitution
state/NN/br-f20/1147	-0.00146830911251304	-0.00185202361456533	state	NN	state%1:03:00::	D	D	B	 guest list is in itself a little parable of the <font color=green>state</font>  of American civic life at this time. It included the
state/NN/br-f23/1235	-0.00144459700006766	-0.00184790027525093	state	NN	united_states%1:15:00::	A5	A	F	 it. The evidence suggests that foreign peoples believe the United <font color=green>States</font>  is weaker than the Soviet Union, and is bound to
state/NN/br-f23/1705	-0.00146530807910246	-0.00184981777751713	state	NN	united_states%1:15:00::	A5	A	F	 isolation and capture, not of Ghana, but of the United <font color=green>States</font> - and this purpose may be served very well by countries
state/NN/br-f24/1855	-0.00145638201520777	-0.00186914613773481	state	NN	state%1:14:00::	C	C	D	 without violence. That 's a big step toward a modern <font color=green>state</font> . You might say we are in the nation building business
state/NN/br-f24/525	-0.00144828180015472	-0.00186886743488637	state	NN	state%1:03:00::	D	D	B	 11, 1960). And now, in March, all Laos suffered a <font color=green>state</font>  of siege. The Pathet Lao forces held two northern provinces
