id	model.x	model.y	lemma	pos	sensekey	marisense	mbroad	wnbroad	mari2	mari3	wn2	wn3	wnsense	text
country/NNS/br-j22/347	0.283082328245284	-0.000350708489360768	country	NNS	country%1:14:00::	B2	B	B	B	B23	B	BB2	B2	 world scene. When necessary, we should make it clear that <font color=green>countries</font>  which choose to derive marginal advantages from the cold war
country/NNS/br-j22/397	0.291230622181429	0.0894977640976586	country	NNS	country%1:14:00::	B3	B	B	B	B23	B	BB2	B2	 As a nation, we feel an obligation to assist other <font color=green>countries</font>  in their development; but this obligation pertains only to countries
country/NNS/br-j22/408	0.415606900844752	-0.00437155455989772	country	NNS	country%1:14:00::	B2	B	B	B	B23	B	BB2	B2	 countries in their development; but this obligation pertains only to <font color=green>countries</font>  which are honestly seeking to become responsible members of a
country/NNS/br-j22/429	0.354828017034939	0.186835336248956	country	NNS	country%1:14:00::	B2	B	B	B	B23	B	BB2	B2	 a stable and forward-moving world community. When we look at <font color=green>countries</font>  like Iran, Iraq, Pakistan, and Burma, where substantial progress has
country/NNS/br-j22/474	0.392756165168482	-0.170375530301752	country	NNS	country%1:14:00::	B2	B	B	B	B23	B	BB2	B2	 of centralized government exist, we find a second category of <font color=green>countries</font>  with a different set of problems and hence different priorities
country/NNS/br-j22/603	0.148352435097643	-0.0257141081339003	country	NNS	country%1:14:00::	B2	B	B	B	B23	B	BB2	B2	 achieve the national goals of modernization already symbolically accepted. Most <font color=green>countries</font>  in this second category share the difficulty of having many
country/NNS/br-j22/892	0.247757317381317	0.157748410635946	country	NNS	country%1:14:00::	B2	B	B	B	B23	B	BB2	B2	 performance can we provide telling assistance. With respect to those <font color=green>countries</font>  whose leaders prefer to live with their illusions, we can
country/NNS/br-j22/929	0.247757317381317	0.157748410635946	country	NNS	country%1:14:00::	B3	B	B	B	B23	B	BB2	B2	 clear for all to see. Our technical assistance to these <font color=green>countries</font>  should place special emphasis on inducing the central governments to
country/NNS/br-j37/1682	0.197976671757902	-0.00165257374728484	country	NNS	country%1:14:00::	B2	B	B	B	B23	B	BB2	B2	 solutions devised in the electoral experiences of the rapidly changing <font color=green>countries</font>  are often of comparative value and essential to evaluating election
country/NNS/br-j42/428	0.35079681283157	0.135763499160147	country	NNS	country%1:14:00::	B2	B	B	B	B23	B	BB2	B2	 from the North) was the neutralization of the Latin American <font color=green>countries</font> ; out of the question was the neutralization of Asia and
country/NNS/br-j42/665	0.121606471434949	-0.0762627159262024	country	NNS	country%1:14:00::	B2	B	B	B	B23	B	BB2	B2	 civilization must formally enter into the circle of law governed <font color=green>countries</font> . They must do something with the acquiescence of the latter
