id	model.x	model.y	lemma	pos	genre	broad_genre	marisense	mbroad	mari3	mari2	sensekey	wnsense	wnbroad	wn3	wn2	text	cues	cues_with_weight	mean_weight	weighted.cues_ratio	weighted_cw
state/NN/br-j03/577	-0.1282444181949	0.145520941326713	state	NN	learned	non-fiction	D	D	D	D	state%1:03:00::	D1	D	D	D	 fluid measured from the top of the block, and steady <font color=green>states</font>  were apparently reached with these fluids. It is presumed that	3	2	0.935426672956569	0.666666666666667	6
state/NN/br-j07/1320	-0.101245881528275	0.367251678853488	state	NN	learned	non-fiction	A5	A	AB	ABC	united_states%1:15:00::	A51	A	AB	ABC	 cause a deviation from a linear relationship. In the United <font color=green>States</font> , most of the sensors are calibrated by dropping small spheres	1	0	0.93901275743385	0	3
state/NN/br-j07/414	0.0481957264734138	-0.229681362232352	state	NN	learned	non-fiction	D	D	D	D	state%1:03:00::	D1	D	D	D	 the material spiraling into the sun, maintaining a fairly steady <font color=green>state</font> . Asteroidal collisions are also thought to contribute material. It is	3	1	0.855147993437489	0.333333333333333	5
state/NN/br-j10/14	-0.415286558272574	0.00692737528236697	state	NN	learned	non-fiction	D	D	D	D	state%1:03:00::	D1	D	D	D	 the honeybee, practically all bees and bumblebees hibernate in a <font color=green>state</font>  of torpor. Occasionally, you may come across one or two	2	0	0.826275754909001	0	3
state/NN/br-j10/1969	-0.290277118291821	-0.0987452582680123	state	NN	learned	non-fiction	A5	A	AB	ABC	united_states%1:15:00::	A51	A	AB	ABC	 found in tremendous numbers in certain parts of the United <font color=green>States</font>  west of the Great Plains, for example, in Utah and	1	0	0.744414547126728	0	3
state/NN/br-j10/1988	0.00786993978529502	-0.0874924817689894	state	NN	learned	non-fiction	A5	A	AB	ABC	united_states%1:15:00::	A51	A	AB	ABC	 for example, in Utah and central Washington. In the United <font color=green>States</font>  Department of Agriculture 's Yearbook of Agriculture, 1952, which is	1	0	1.61556542085702	0	5
state/NN/br-j10/543	-0.115956171006625	-0.0428819546087951	state	NN	learned	non-fiction	A5	A	AB	ABC	united_states%1:15:00::	A51	A	AB	ABC	 Bombus; there must be several dozen species in the United <font color=green>States</font>  alone. If you really insist on knowing their names, an	1	0	0.630363758815794	0	5
state/NN/br-j11/799	-0.0764442248044531	0.234496470561069	state	NN	learned	non-fiction	A5	A	AB	ABC	united_states%1:15:00::	A51	A	AB	ABC	 summary of the habits of the snakes of the United <font color=green>States</font> , could supply data on the maturing period for only three	1	0	0.731993358893903	0	5
state/NN/br-j11/916	-0.0178932624476167	-0.18687521256927	state	NN	learned	non-fiction	A5	A	AB	ABC	united_states%1:15:00::	A51	A	AB	ABC	 three. Other herpetologists have ascertained that in the northern United <font color=green>States</font>  the prairie rattlesnake may not give first birth until it	1	0	1.04863141868419	0	3
state/NN/br-j17/1109	-0.220418712961441	0.244995508801597	state	NN	learned	non-fiction	D	D	D	D	state%1:03:00::	D1	D	D	D	 balance, but for the sake of correlating autonomic and clinical <font color=green>states</font> , and of studying the effect of certain therapeutic procedures on	5	3	1.22021166607088	0.6	5
state/NN/br-j17/1231	-0.153582491089143	0.140261790241299	state	NN	learned	non-fiction	D	D	D	D	state%1:03:00::	D1	D	D	D	 persons by drugs. The fundamental differences between physiological and pathological <font color=green>states</font>  of parasympathetic( and also of sympathetic) dominance remain to be	5	3	1.20149040797509	0.6	8
state/NN/br-j17/1283	-0.161656373817464	0.140474855576087	state	NN	learned	non-fiction	D	D	D	D	state%1:03:00::	D1	D	D	D	 its balance lead also to qualitative alterations in reactivity. A <font color=green>state</font>  of parasympathetic`` tuning'' of the hypothalamus induced experimentally causes not	6	2	1.02781887309067	0.333333333333333	5
state/NN/br-j17/1330	-0.108293805178318	0.0684935243303336	state	NN	learned	non-fiction	D	D	D	D	state%1:03:00::	D1	D	D	D	 a stimulus acting sympathetically under control conditions elicits in this <font color=green>state</font>  of tuning a parasympathetic response! Furthermore, conditioned reactions are fundamentally	4	4	1.08081989061591	1	9
state/NN/br-j17/1500	-0.119187973609435	0.0885207216544619	state	NN	learned	non-fiction	D	D	D	D	state%1:03:00::	D1	D	D	D	 altering the hypothalamic balance alter conditioned reactions;( 3) in a <font color=green>state</font>  of depression, the positive conditioned stimulus may fail to elicit	4	4	1.30206629518036	1	10
state/NN/br-j17/1558	-0.12970865456013	0.101290606988769	state	NN	learned	non-fiction	D	D	D	D	state%1:03:00::	D1	D	D	D	 fundamental alterations in conditioned reactions occur in a variety of <font color=green>states</font>  in which the hypothalamic balance has been altered by physiological	4	3	1.23323721781255	0.75	10
state/NN/br-j17/1626	-0.146730809733594	0.0992234168358743	state	NN	learned	non-fiction	D	D	D	D	emotional_state%1:26:00::	D1	D	D	D	 just mentioned which alter the hypothalamic balance would influence emotional <font color=green>state</font>  and behavior but that emotion itself would act likewise. We	4	4	1.14328546440292	1	10
state/NN/br-j17/2022	-0.193519187658095	0.162402639343229	state	NN	learned	non-fiction	D	D	D	D	state%1:03:00::	D1	D	D	D	 a functional antagonism exists between an aggressive attitude and a <font color=green>state</font>  of anxiety. Although in both emotions sympathetic symptoms are present	3	1	1.24577137086071	0.333333333333333	7
state/NN/br-j17/2059	0.0350168626016258	0.23407634390071	state	NN	learned	non-fiction	D	D	D	D	state%1:03:00::	D1	D	D	D	 by the rate of the excretion of the catecholamines, the <font color=green>state</font>  of the muscle tone, and the Mecholyl test. The psychological	2	1	0.917083790131134	0.5	2
state/NN/br-j17/2076	-0.156061441551563	0.10854606044445	state	NN	learned	non-fiction	D	D	D	D	emotional_state%1:26:00::	D1	D	D	D	 and the Mecholyl test. The psychological incompatibility of these emotional <font color=green>states</font>  seems to be reflected in, or based on, this marked	2	2	1.30062621332559	1	5
state/NN/br-j17/2207	-0.176344080107223	0.178814832260419	state	NN	learned	non-fiction	D	D	D	D	state%1:03:00::	D1	D	D	D	 for major changes in behavior seen in various moods and <font color=green>states</font>  of emotions in man and beast under physiological circumstances, in	4	3	1.04984221247578	0.75	5
state/NN/br-j17/2256	-0.11428108062313	0.0970226842131539	state	NN	learned	non-fiction	D	D	D	D	state%1:03:00::	D1	D	D	D	 neurotic and psychotic disorders and the parallelism observed between autonomic <font color=green>states</font>  and psychological behavior in several instances, it is further suggested	3	2	1.11779796712068	0.666666666666667	7
state/NN/br-j17/504	-0.167475820143436	0.154241265177129	state	NN	learned	non-fiction	D	D	D	D	state%1:03:00::	D1	D	D	D	 level, the lessened hypothalamic cortical discharges lead to a diminished <font color=green>state</font>  of activity in the cortex with consequent reduction in the	4	3	0.960062195814015	0.75	5
state/NN/br-j17/574	-0.152017285507333	0.164915116917332	state	NN	learned	non-fiction	D	D	D	D	state%1:03:00::	D1	D	D	D	 these pathological conditions, we should remember that changes in the <font color=green>state</font>  of the hypothalamus within physiological limits distinguish sleep from wakefulness	5	4	0.987046304085231	0.8	8
state/NN/br-j17/891	-0.156814422067031	0.0993797568839581	state	NN	learned	non-fiction	D	D	D	D	emotional_state%1:26:00::	D1	D	D	D	 direction causes excitatory effects and, eventually, maniclike changes. The emotional <font color=green>states</font>  produced by drugs influence the cortical potentials in a characteristic	5	4	1.06320614304565	0.8	6
state/NN/br-j22/1281	-0.0196356088357754	0.0166645321297364	state	NN	learned	non-fiction	A5	A	AB	ABC	united_states%1:14:00::	A52	A	AB	ABC	 By holding out prospects for external capital assistance, the United <font color=green>States</font>  can provide strong incentives to prepare for the concerted economic	1	0	1.11949718590202	0	8
state/NN/br-j22/182	-0.141628938191896	-0.0248562725649711	state	NN	learned	non-fiction	A5	A	AB	ABC	united_states%1:15:00::	A51	A	AB	ABC	 countries passing through this stage can be escaped. The United <font color=green>States</font>  can help by communicating a genuine concern with the problems	1	0	0.650611204490357	0	7
state/NN/br-j22/976	0.0229712207236906	-0.0252194464424443	state	NN	learned	non-fiction	A3	A	AB	ABC	state%1:15:01::	A	A	AB	ABC	 the governments to develop their own technical assistance to communities, <font color=green>state</font>  and provincial governments, rural communities, and other smaller groups, making	3	4	1.29919242919057	1.33333333333333	9
state/NN/br-j23/1025	-0.193876949446702	0.00720085713596122	state	NN	learned	non-fiction	A5	A	AB	ABC	united_states%1:15:00::	A51	A	AB	ABC	 reaffirms, and maintains the fundamental values. Even in the united <font color=green>states</font> , with its freedom of religious belief and worship and its	1	0	1.0218844203364	0	5
state/NN/br-j23/1206	-0.323853271968039	-0.010204535975057	state	NN	learned	non-fiction	D	D	D	D	state%1:03:00::	D1	D	D	D	 marriage as a sacrament, much law-breaking as sinful, occasionally the <font color=green>state</font>  as a divine instrument. It places certain values at least	4	2	0.809115268611941	0.5	4
state/NN/br-j23/1793	-0.154490710702709	-0.0659399712425275	state	NN	learned	non-fiction	A5	A	AB	ABC	united_states%1:15:00::	A51	A	AB	ABC	 at many secular semi-public and public occasions in the United <font color=green>States</font> ; and it is evidenced in the prayers offered, in the	1	0	1.08081838413036	0	7
state/NN/br-j23/786	-0.13887768306526	0.03145580581686	state	NN	learned	non-fiction	D	D	D	D	state%1:03:00::	D1	D	D	D	 a principle of compensation, mainly in a promised perfect future <font color=green>state</font> . The belief in immortality, where held, functions as a redress	2	2	1.09164798026232	1	9
state/NN/br-j28/1108	-0.173694903589732	0.110843690885289	state	NN	learned	non-fiction	D	D	D	D	Z	Z	Z	Z	Z	 acceptable to the examiner as`` normal''. The nai ^ ve <font color=green>state</font> , Condition 1,, could therefore be viewed as an inhibiting one	3	0	0.766264775243828	0	3
state/NN/br-j28/1633	0.0801698959187023	-0.317018414919024	state	NN	learned	non-fiction	D	D	D	D	Z	Z	Z	Z	Z	 arm-elevation on the second trial in the nai ^ ve <font color=green>state</font>  but not in the first. She had felt that her	3	0	0.533986859196227	0	1
state/NN/br-j28/1879	-0.250969231633658	0.0992793073555683	state	NN	learned	non-fiction	D	D	D	D	Z	Z	Z	Z	Z	 in which she first had difficulty accepting for herself a <font color=green>state</font>  of being in which she relinquished control. However, she was	2	2	0.499578648857843	1	6
state/NN/br-j28/640	-0.340560824516688	0.0959589031996333	state	NN	learned	non-fiction	D	D	D	D	Z	Z	Z	Z	Z	 who responded with an arm-elevation in the nai ^ ve <font color=green>state</font>  did not change their reaction when told that there were	2	1	0.306952297633768	0.5	2
state/NN/br-j28/712	-0.0969516545369207	0.0595677822513642	state	NN	learned	non-fiction	D	D	D	D	Z	Z	Z	Z	Z	 positive Kohnstamm reactivity in Condition 1,( the nai ^ ve <font color=green>state</font> ) is not adequately explained by such a concept as suggestibility	3	0	0.745192281117164	0	6
state/NN/br-j29/2105	-0.291929043080834	-0.0403231684890578	state	NN	learned	non-fiction	D	D	D	D	state%1:03:00::	D1	D	D	D	 able to achieve because he is aroused to an energetic <font color=green>state</font>  without becoming confused or panicked. Sarason et al. present evidence	4	1	0.759064532719612	0.25	4
state/NN/br-j31/1184	-0.184708181118741	-0.291138230373222	state	NN	learned	non-fiction	D	D	D	D	state%1:03:00::	D1	D	D	D	 room which she preferred to keep in a very cold <font color=green>state</font> , and plunking myself down in my chair- in short, behaving	2	0	0.320494442471134	0	2
state/NN/br-j34/732	-0.102918613318073	0.177035388122402	state	NN	learned	non-fiction	D	D	D	D	emotional_state%1:26:00::	D1	D	D	D	 differences from one speaker to another, or from one emotional <font color=green>state</font>  to another, may far exceed the small differences between tones	1	1	0.974296040253114	1	6
state/NN/br-j38/1125	-0.00980409786152453	0.0110860625111495	state	NN	learned	non-fiction	A1	A	AB	ABC	state%1:14:01::	B	B	AB	ABC	 which make it an asset to industrial development efforts. Few <font color=green>states</font>  make effective use of their existing vocational education programs or	5	5	0.986782221267524	1	8
state/NN/br-j38/1149	0.00081796401509024	0.0141104611150427	state	NN	learned	non-fiction	A1	A	AB	ABC	state%1:14:01::	B	B	AB	ABC	 the purpose of attracting new industry. The opportunity exists for <font color=green>states</font>  to reserve some of their vocational education funds to apply	4	4	1.09504899939016	1	11
state/NN/br-j38/1549	0.0238977097440806	-0.0115837677953738	state	NN	learned	non-fiction	A1	A	AB	ABC	state%1:14:01::	B	B	AB	ABC	 the Federal government but from an exchange of experiences among <font color=green>states</font> . State and local agencies in the vocational education field must	6	4	1.51156476663658	0.666666666666667	7
state/NN/br-j38/1818	0.0187317842306238	-0.0233861155194703	state	NN	learned	non-fiction	A3	A	AB	ABC	state_government%1:14:00::	C2	C	C	ABC	 unless a new industry is in sight and requests it. <font color=green>State</font>  governments have been taking the lead in establishing area vocational	2	2	0.886275505291068	1	9
state/NN/br-j38/1888	0.00628201052186746	0.0286635640156202	state	NN	learned	non-fiction	A1	A	AB	ABC	state%1:14:01::	B	B	AB	ABC	 for the vocational education, it could be argued that the <font color=green>state</font>  should not have to bear the cost of vocational training	3	3	1.37894682479202	1	7
state/NN/br-j38/1905	0.0502994506216573	0.0228241029920409	state	NN	learned	non-fiction	A4	A	AB	ABC	state%1:15:01::	A	A	AB	ABC	 cost of vocational training which would benefit employers in other <font color=green>states</font> . However, if Federal funds are used, it would be entirely	3	2	1.12067345236924	0.666666666666667	10
state/NN/br-j38/249	-0.00178652072854523	-0.0215349363905337	state	NN	learned	non-fiction	A1	A	AB	ABC	state%1:14:01::	B	B	AB	ABC	 control remain primarily with the local school districts. Even the <font color=green>states</font>  remain primarily in an assisting role, providing leadership and teacher	4	4	0.957907943912574	1	11
state/NN/br-j38/276	0.0115301776249029	-0.0138763686054385	state	NN	learned	non-fiction	A3	A	AB	ABC	state%1:14:01::	B	B	AB	ABC	 is limited to half of the total expenditure, and the <font color=green>state</font>  or local districts must pay at least half. The state	3	2	1.14319800169609	0.666666666666667	8
state/NN/br-j38/287	0.00604757069381186	-0.0178852317576826	state	NN	learned	non-fiction	A1	A	AB	ABC	state%1:14:01::	B	B	AB	ABC	 state or local districts must pay at least half. The <font color=green>state</font>  may decide to encourage local programs by paying half of	4	5	1.06214476864863	1.25	11
state/NN/br-j38/303	0.0257310096699992	-0.00705879263486488	state	NN	learned	non-fiction	A1	A	AB	ABC	state%1:14:01::	B	B	AB	ABC	 local programs by paying half of the cost, or the <font color=green>state</font>  may require the local district to bear this half or	4	4	1.22510372678854	1	9
state/NN/br-j38/326	0.0521036237025259	0.0102783828722144	state	NN	learned	non-fiction	A3	A	AB	ABC	state_government%1:14:00::	C2	C	C	ABC	 some part of it. Throughout the history of the program, <font color=green>state</font>  government expenditures in the aggregate have usually matched or exceeded	3	3	1.16855347809056	1	6
state/NN/br-j38/353	0.0597738839254722	-0.00325922123951577	state	NN	learned	non-fiction	A3	A	AB	ABC	state_government%1:14:00::	C2	C	C	ABC	 districts all together have spent more than either Federal or <font color=green>state</font>  governments. Today, Federal funds account for only one-fifth of the	3	4	1.94164279414192	1.33333333333333	7
state/NN/br-j38/388	0.0150849291249415	0.0155104213255793	state	NN	learned	non-fiction	A1	A	AB	ABC	state%1:14:01::	B	B	AB	ABC	 matching fund principle has been in initially encouraging the poorest <font color=green>states</font>  and school districts to spend enough to obtain their full	3	2	1.32426147777656	0.666666666666667	10
state/NN/br-j38/687	-0.0224163447234395	0.00757788606658428	state	NN	learned	non-fiction	A4	A	AB	ABC	state%1:15:01::	A	A	AB	ABC	 it provides the essential groundwork for developing skills. In most <font color=green>states</font> , trade and industrial training is provided in a minority of	4	3	0.627984829251067	0.75	10
state/NN/br-j38/769	0.00559200761961696	-0.0123114235487423	state	NN	learned	non-fiction	A1	A	AB	ABC	state%1:14:01::	B	B	AB	ABC	 For a number of years Kentucky, Louisiana and several other <font color=green>states</font>  have been building state sponsored vocational education schools that serve	5	5	1.11789933614069	1	14
state/NN/br-j38/773	0.00793622289580743	-0.012885945199512	state	NN	learned	non-fiction	A1	A	AB	ABC	state%1:14:01::	B	B	AB	ABC	 years Kentucky, Louisiana and several other states have been building <font color=green>state</font>  sponsored vocational education schools that serve nearby school districts in	4	4	1.24288829514155	1	15
state/NN/br-j38/885	-0.032031382109666	-0.0141830001909359	state	NN	learned	non-fiction	A4	A	AB	ABC	state%1:15:01::	A	A	AB	ABC	 By 1960 there were such schools in all but 4 <font color=green>states</font> . They were operating in 10 of the 17 major areas	4	2	0.327062764496418	0.5	4
state/NN/br-j41/109	-0.0699082003963702	-0.0119239500006352	state	NN	learned	non-fiction	A5	A	AB	ABC	united_states%1:15:00::	A51	A	AB	ABC	 wages and prices in the steel industry of the United <font color=green>States</font>  since World War 2,. Indeed, the apparent stiffening of the	1	0	0.581032523942904	0	6
state/NN/br-j42/1014	-0.217530541654911	-0.0545299460356338	state	NN	learned	non-fiction	C	C	C	ABC	state%1:14:00::	B1	B	AB	ABC	 occurred. It reached its ultimate philosophical statement in notions of`` <font color=green>state</font>  will'' put forward by the Germans, especially by Hegel, although	4	3	1.06169454965245	0.75	7
state/NN/br-j42/1082	-0.0443797172608676	-0.0793142047032664	state	NN	learned	non-fiction	C	C	C	ABC	state%1:14:00::	B1	B	AB	ABC	 community this reduced law to Jellinek 's auto limitation. A <font color=green>state</font> , the highest form of human organization in fact and theory	4	3	0.760842348490309	0.75	5
state/NN/br-j42/1184	-0.105930684224969	0.0412017134878085	state	NN	learned	non-fiction	B	B	AB	ABC	state%1:14:00::	B1	B	AB	ABC	 except that willed by, acknowledged by, or consented to by <font color=green>states</font> . Hidden behind Hegelian abstractions were more practical reasons for a	3	2	0.986875816226131	0.666666666666667	6
state/NN/br-j42/148	-0.0924652924855433	-0.00878242020988905	state	NN	learned	non-fiction	B	B	AB	ABC	state%1:14:00::	B1	B	AB	ABC	 with an international political system in which a number of <font color=green>states</font>  were competitive, suspicious, and opportunistic in their political alignments with	4	4	0.395271519067578	1	6
state/NN/br-j42/2015	-0.0764261806017971	-0.0367134931346029	state	NN	learned	non-fiction	B	B	AB	ABC	state%1:14:00::	B1	B	AB	ABC	 arrangement. It is not surprising that the international obligations of <font color=green>states</font>  were also viewed in terms of contract. In fact, some	3	2	0.56141455051364	0.666666666666667	8
state/NN/br-j42/2212	-0.0157271259784413	-0.0494384479409723	state	NN	learned	non-fiction	B	B	AB	ABC	state%1:14:00::	B1	B	AB	ABC	 proper, or, as it is often called, public international law. <font color=green>States</font>  were free to enact, within broad though( perhaps) determinate limits	5	4	0.830745170541961	0.8	5
state/NN/br-j42/301	-0.109281182452511	-0.00690773234519816	state	NN	learned	non-fiction	B	B	AB	ABC	state%1:14:00::	B1	B	AB	ABC	 doctrine applicable among the great nations and the smaller European <font color=green>states</font>  did not really comfortably fit less developed and less powerful	4	3	0.982632405134841	0.75	10
state/NN/br-j42/339	-0.158501025911162	-0.15233453167476	state	NN	learned	non-fiction	A5	A	AB	ABC	united_states%1:15:00::	A51	A	AB	ABC	 in Latin America by the special interest of the United <font color=green>States</font>  as expressed in the Monroe Doctrine, itself from the outset	1	0	1.30439153136094	0	6
state/NN/br-j42/635	-0.0232152829541805	-0.164890397150048	state	NN	learned	non-fiction	B	B	AB	ABC	state%1:14:00::	B1	B	AB	ABC	 law if they were to join this community as sovereign <font color=green>states</font> . Hall, for example, was quite explicit on this point when	2	2	1.35494986515722	1	5
state/NN/br-j42/652	-0.217983151026295	-0.20556354163702	state	NN	learned	non-fiction	B	B	AB	ABC	state%1:14:00::	B1	B	AB	ABC	 example, was quite explicit on this point when he said`` <font color=green>states</font>  outside European civilization must formally enter into the circle of	2	2	1.36548804367662	1	5
state/NN/br-j42/777	-0.0571163250119082	0.0205918151078712	state	NN	learned	non-fiction	B	B	AB	ABC	state%1:14:00::	B1	B	AB	ABC	 of Justice into particular rules governing the relations of sovereign <font color=green>states</font> . The difference is important, for although the older law of	2	2	1.44507995404176	1	7
state/NN/br-j42/879	-0.0943215422354342	0.0181106085057532	state	NN	learned	non-fiction	C	C	C	ABC	state%1:14:00::	B1	B	AB	ABC	 entirely and confined itself to rules limiting the exercise of <font color=green>state</font>  power for reasons essentially unconnected with justice or morality save	4	4	0.835948708231868	1	9
state/NN/br-j42/964	-0.00907751954738493	0.00304349086166718	state	NN	learned	non-fiction	C	C	C	ABC	state%1:14:00::	B1	B	AB	ABC	 was the growing nationalism and the tendency to regard the <font color=green>state</font> , and the individual 's identification with the state, as transcending	4	3	1.15255122557256	0.75	6
state/NN/br-j42/973	0.0045602779658283	-0.000853830303302505	state	NN	learned	non-fiction	C	C	C	ABC	state%1:14:00::	B1	B	AB	ABC	 regard the state, and the individual 's identification with the <font color=green>state</font> , as transcending other ties of social solidarity. National identification was	3	2	0.976256018350601	0.666666666666667	7
state/NN/br-j52/965	-0.145948001151034	0.0145861547865641	state	NN	learned	non-fiction	D	D	D	D	state%1:03:00::	D1	D	D	D	 since all that is expressed in either case is a <font color=green>state</font>  of feeling, and that feeling is still there. And our	2	3	0.398109616130155	1.5	4
state/NN/br-j56/249	0.0440404797405194	-0.00671622776246052	state	NN	learned	non-fiction	A3	A	AB	ABC	state%1:15:01::	A	A	AB	ABC	 1958 town meeting directed town authorities to seek federal and <font color=green>state</font>  funds with which to conduct a preliminary survey of a	3	3	1.0798538151101	1	9
state/NN/br-j58/1112	0.0660246133201129	-0.260811020266308	state	NN	learned	non-fiction	A2	A	AB	ABC	state_prison%1:06:00::	A2	A	AB	ABC	 claimed that there were a score of men in the <font color=green>state</font>  prison who were a thousand times more deserving of sympathy	1	1	0.693193054107361	1	3
state/NN/br-j58/146	-0.0455616939370496	-0.149494791963453	state	NN	learned	non-fiction	A4	A	AB	ABC	state%1:15:01::	A	A	AB	ABC	 principles that they do not interfere with slavery in the <font color=green>states</font> ''. The two major newspapers in Providence continued, throughout the crisis	3	3	0.907589629943715	1	7
state/NN/br-j58/1974	0.080546204350108	-0.111339596855398	state	NN	learned	non-fiction	B	B	AB	ABC	state%1:15:01::	A	A	AB	ABC	 recalled that in Rhode Island a party opposed to the <font color=green>state</font>  's condemnation of a man( Thomas W. Dorr) proclaimed the	1	0	1.00888497091772	0	6
state/NN/br-j58/1987	0.0409439919868718	-0.149574983652608	state	NN	learned	non-fiction	A1	A	AB	ABC	state%1:15:01::	A	A	AB	ABC	 's condemnation of a man( Thomas W. Dorr) proclaimed the <font color=green>state</font>  's action as a violation of the law of the	4	2	1.19330492143446	0.5	4
state/NN/br-j58/320	-0.0463085451003723	-0.250887845685948	state	NN	learned	non-fiction	A1	A	AB	ABC	state%1:15:01::	A	A	AB	ABC	 1859, John Brown was found guilty of treason against the <font color=green>state</font>  of Virginia, inciting slave rebellion, and murder. For these crimes	1	1	1.44939885897408	1	6
state/NN/br-j58/34	-0.0418581055805537	-0.12744318828992	state	NN	learned	non-fiction	A4	A	AB	ABC	state%1:15:01::	A	A	AB	ABC	 the Declaration of Independence. During the Brown trial, however, the <font color=green>state</font>  's most powerful Democratic newspaper, the Providence Daily Post, stated	2	2	0.711903862994445	1	6
state/NN/br-j58/369	-0.00294370923422495	-0.0941996313348472	state	NN	learned	non-fiction	A4	A	AB	ABC	state%1:15:01::	A	A	AB	ABC	 editors, and clergymen heaped accusations of murder on the Southern <font color=green>states</font> , particularly Virginia. Although Rhode Islanders were preparing for the state	3	2	1.37874179755819	0.666666666666667	6
state/NN/br-j58/381	0.00171704857727247	-0.0668441680198581	state	NN	learned	non-fiction	A3	A	AB	ABC	state%1:15:01::	A	A	AB	ABC	 states, particularly Virginia. Although Rhode Islanders were preparing for the <font color=green>state</font>  elections, they watched John Brown 's trial with extreme interest	3	1	0.964464520412618	0.333333333333333	8
