id	model.x	model.y	lemma	pos	sensekey	marisense	mbroad	wnbroad	text
state/NN/br-f33/1948	-0.00143111860323911	-0.00183859807703258	state	NN	united_states%1:15:00::	A5	A	F	 get in. In a far distant part of the United <font color=green>States</font> , I was talking to an instructor about a boy who
state/NN/br-g01/1276	-0.00147583507829355	-0.00185477908512125	state	NN	state%1:15:01::	A4	A	A	 of course, important minority enclaves. The long settled areas of <font color=green>states</font>  like Virginia and South Carolina developed the ante-bellum culture to
state/NN/br-g01/1429	-0.00147203259679541	-0.00182579665406333	state	NN	state%1:15:01::	A	A	A	 by the mother country. And no doubt many people in <font color=green>states</font>  like the Carolinas and Georgia, which were among the most
state/NN/br-g01/1498	-0.00147048665525259	-0.00186424953764426	state	NN	state%1:15:01::	A	A	A	 that except for Northern meddling it would have ended in <font color=green>states</font>  like Virginia years before it did. Southern resentment has been
state/NN/br-g01/26	-0.0014465088273648	-0.00185147891263267	state	NN	welfare_state%1:14:00::	C	C	C	 also led the nation in the direction of a welfare <font color=green>state</font> . And both in their objectives of non-discrimination and of social
state/NN/br-g01/574	-0.00145306736684771	-0.00185094502091933	state	NN	state%1:15:01::	A	A	A	 And if he is so scornful of the rights of <font color=green>states</font> , why not advocate a different sort of constitution that he
state/NN/br-g02/1005	-0.00145245151809423	-0.00185713489361374	state	NN	NA	A	A	NA	 national responsibility for local economic distress won out over a`` <font color=green>state</font>  's- responsibility'' proposal- provision was made for payment for unemployment
state/NN/br-g02/1113	-0.00145767649150165	-0.00184461536211044	state	NN	NA	A5	A	NA	 individual welfare is a concept not limited to the United <font color=green>States</font>  or even to the Western nations. A measure of its
state/NN/br-g02/1335	-0.00144598675384242	-0.0018490863553683	state	NN	NA	C	C	NA	 better or for worse, we all now live in welfare <font color=green>states</font> , the organizing principle of which is collective responsibility for individual
state/NN/br-g02/1584	-0.00145155871620777	-0.00186325518115625	state	NN	NA	A5	A	NA	 nation-state coincides roughly with the separate existence of the United <font color=green>States</font>  as an independent entity, it is perhaps natural for Americans
state/NN/br-g02/381	-0.00143132321647833	-0.00186487884019168	state	NN	NA	A5	A	NA	 in motivation, however much other nations( e. g., the United <font color=green>States</font> ) may have incidentally benefited. At the same time, all suggestions
state/NN/br-g02/411	-0.00144508277333699	-0.00185265787978348	state	NN	NA	C	C	NA	 existed for the welfare of the people within the territorial <font color=green>state</font>  was strongly resisted. Social Darwinism was able to stave off
state/NN/br-g02/533	-0.00144430986011973	-0.00187210532838996	state	NN	NA	C	C	NA	 was transformed from one essentially negative in nature( the`` night-watchman <font color=green>state</font> '') to one with affirmative duties to perform. The`` positive state
state/NN/br-g02/547	-0.00145071780790141	-0.0018499552808967	state	NN	NA	C	C	NA	 state'') to one with affirmative duties to perform. The`` positive <font color=green>state</font> '' came into existence. For lawyers, reflecting perhaps their parochial preferences
state/NN/br-g02/681	-0.00144482564459487	-0.00186284070657019	state	NN	NA	C	C	NA	 the many facets of the American version of the welfare <font color=green>state</font>  have become part of the conventional wisdom. A national consensus
state/NN/br-g02/9	-0.00146763241197133	-0.00186374083503124	state	NN	NA	C	C	NA	 In the past, the duties of the <font color=green>state</font> , as Sir Henry Maine noted long ago, were only two
state/NN/br-g03/875	-0.00146357424745812	-0.00187316093019568	state	NN	NA	A5	A	NA	 Soviet missiles shortly after they are launched against the United <font color=green>States</font> . BMEWS intelligence is simultaneously flashed to NORAD( North American Air
state/NN/br-g06/1016	-0.00145710629689156	-0.00184961525423831	state	NN	NA	A5	A	NA	 insistence of Arturo Toscanini, Steinberg left Germany for the United <font color=green>States</font> , by way of Switzerland. After he had spent the first
state/NN/br-g07/2122	-0.00146623692228151	-0.00185021358515436	state	NN	NA	A	A	NA	 former and Jefferson and Madison upholding the latter position. The <font color=green>state</font>  's rights position was formulated by Jefferson and Madison in
state/NN/br-g07/2238	-0.00148141413352197	-0.00185303468987345	state	NN	NA	A	A	NA	 in 1832, the South Carolina nullifiers adopted the principle of <font color=green>state</font>  interposition which Madison had advanced in his old Virginia Resolve
state/NN/br-g07/546	-0.00147281958659028	-0.00185315668850418	state	NN	NA	A3	A	NA	 France and the peace that ended the war, headed the <font color=green>state</font>  government of Pennsylvania, and exercised an important moderating influence at
state/NN/br-g10/1095	-0.00144754000228781	-0.0018629410868047	state	NN	NA	A5	A	NA	 are the two Preambles:`` we the People of the United <font color=green>States</font> , in order to form a more perfect Union, establish Justice
state/NN/br-g10/1160	-0.00147758298211581	-0.0018761789505632	state	NN	NA	A1	A	NA	 of America''.`` We the people of the Confederate States, each <font color=green>state</font>  acting in its sovereign and independent character, in order to
state/NN/br-g10/1216	-0.00144017817443034	-0.00182975700819767	state	NN	NA	A5	A	NA	 God- do ordain and establish this Constitution for the Confederate <font color=green>States</font>  of America''. One is tempted to say that, on the
state/NN/br-g10/1430	-0.00144602255328514	-0.00186009831406313	state	NN	NA	A1	A	NA	 slavery, Lincoln was always willing to concede to each`` slave <font color=green>state</font> '' the right to decide independently whether to continue or end
state/NN/br-g10/1790	-0.00148185574122386	-0.00187544030417115	state	NN	NA	C	C	NA	 Inaugural. To my knowledge, Lincoln remains the only Head of <font color=green>State</font>  and Commander-in-Chief who, while fighting a fearful war whose issue
state/NN/br-g10/586	-0.00149729819391937	-0.00184985993398573	state	NN	NA	A5	A	NA	 to secede'', they formed what they officially styled`` The Confederate <font color=green>States</font>  of America''. Dictionaries, as we have seen, still cite this
state/NN/br-g10/731	-0.00145401578631936	-0.00183938129724777	state	NN	NA	A1	A	NA	 Constitution was that the former recognized the right of each <font color=green>state</font>  to secede. But though each of its members had asserted
state/NN/br-g17/2109	-0.00147690706033013	-0.00182740806428574	state	NN	united_states%1:15:00::	A5	A	F	 the chief universities, colleges, and preparatory schools of the United <font color=green>States</font> . Why should this be so? It is true that New
state/NN/br-g17/2194	-0.00147804793256758	-0.00184248417201174	state	NN	state%1:15:01::	A	A	A	 country? Is n't it a bit odd that the three <font color=green>states</font>  of Southern New England( Massachusetts, Connecticut, and Rhode Island) have
state/NN/br-g17/2210	-0.00147482400308299	-0.00185467344323007	state	NN	state%1:15:01::	A2	A	A	 Southern New England( Massachusetts, Connecticut, and Rhode Island) have had <font color=green>state</font>  institutions of university status only in the very recent past
state/NN/br-g19/545	-0.00145690431338951	-0.00185544464847065	state	NN	united_states%1:15:00::	A5	A	F	 of the giant corporations in Western Europe and the United <font color=green>States</font>  dates from the period 1880- 1900. Now, although the roots
state/NN/br-g21/1159	-0.00147009301373994	-0.00185873631639856	state	NN	united_states%1:14:00::	A5	A	G	 During the next five years liberal leaders in the United <font color=green>States</font>  sank in the cumulative confusion attendant upon and manifested in
state/NN/br-g21/2009	-0.00146530204082047	-0.00187445800953309	state	NN	united_states%1:14:00::	A5	A	G	 same refrain mentioned above:`` The paramount goal of the United <font color=green>States</font> , set long ago, was to guard the rights of the
state/NN/br-g21/2184	-0.00146973728596549	-0.00185203488251906	state	NN	state%1:03:00::	D	D	B	 to you an uncertain and uneasy, not to say confused, <font color=green>state</font>  of the public mind? What is the common man 's
state/NN/br-g21/244	-0.00144418999658307	-0.00186049053924849	state	NN	united_states%1:14:00::	A5	A	G	 to be the duty of the destiny of the United <font color=green>States</font>  to assist in the creation of a better world by
state/NN/br-g21/991	-0.00146807143528186	-0.00185420396718675	state	NN	state%1:14:01::	C	C	C	 the Marxist dream of a classless society under a Socialist <font color=green>State</font> . And the USSR existed as the revolutionary experiment in radical
state/NN/br-g22/1822	-0.00146233615394252	-0.00184514498898556	state	NN	state%1:14:01::	B	B	C	 acting as controllers of the corporation whose responsibility to the <font color=green>state</font>  would now be defined against proprietorship because employees and proprietors
state/NN/br-g22/643	-0.00145037740330957	-0.00184758254492812	state	NN	state_department%1:14:00::	C	C	H	 when the enterprising promoters of' Porgy and Bess' overrode the <font color=green>State</font>  Department to carry the contemporary' cultural warfare' behind the enemy
state/NN/br-g43/2228	-0.00145913220386329	-0.00182985608350509	state	NN	state_of_affairs%1:26:00::	D	D	B	 a search for the human significance of an event or <font color=green>state</font>  of affairs, a tendency to look at wholes rather than
state/NN/br-h02/1137	-0.00145903751059213	-0.00184512008288365	state	NN	NA	A5	A	NA	 it is politically essential in the long run. The United <font color=green>States</font>  can use its aid as an incentive to self-help by
state/NN/br-h02/1996	-0.00144441270253819	-0.00185902722069412	state	NN	NA	A5	A	NA	 to be persuaded to adopt a long-term approach, the United <font color=green>States</font> , as the principal supplier of external aid, must be prepared
state/NN/br-h03/102	-0.00146225754908062	-0.00184695139969886	state	NN	NA	A5	A	NA	 years not only for this body but for the United <font color=green>States</font>  of America and the free world. You remember the words
state/NN/br-h03/1478	-0.00144906547236966	-0.00186528187176005	state	NN	NA	A5	A	NA	 years to come for this is an influence the United <font color=green>States</font>  and the whole world can ill afford to lose. All
state/NN/br-h03/1886	-0.00148761752111274	-0.00184970728770862	state	NN	NA	A5	A	NA	 the House of Representatives in the Congress of the United <font color=green>States</font> . Others may speak of Speaker Rayburn' S uniquely long and
state/NN/br-h04/1044	-0.00146133389824627	-0.00187173304395089	state	NN	NA	A2	A	NA	 and in almost the same proportion to the increase of <font color=green>state</font>  employees. In the past twenty years the ratio of state-owned
state/NN/br-h04/1058	-0.00147184185289031	-0.00186883259850021	state	NN	NA	A2	A	NA	 the past twenty years the ratio of state-owned automobiles per <font color=green>state</font>  employees has varied from 1 to 22 then to 1
state/NN/br-h04/1129	-0.00146944900039096	-0.00187846580248685	state	NN	NA	A2	A	NA	 obscured, subsequent developments concerning the assignment, use, and management of <font color=green>state</font>  automobiles can be related more clearly. Prior to 1942, automobiles
state/NN/br-h04/120	-0.00146089512258479	-0.00185550622450625	state	NN	NA	A2	A	NA	 in 1959 for an average .027 per mile. Purchase of <font color=green>state</font>  vehicles is handled similarly to all state purchases. Unit prices
state/NN/br-h04/1221	-0.00146819401818953	-0.00185930542056532	state	NN	NA	A1	A	NA	 at war. Gasoline and automobile tires were rationed commodities. The <font color=green>state</font>  was confronted with transportation problems similar to those of the
state/NN/br-h04/1243	-0.00146375875931057	-0.00184823928383045	state	NN	NA	A2	A	NA	 individual. It met these problems by the creation of the <font color=green>state</font>  automobile maintenance unit( more popularly called the motor pool), a
state/NN/br-h04/1266	-0.00146574699190924	-0.00185472625450722	state	NN	NA	A2	A	NA	 a centralized operation for the maintenance and control of all <font color=green>state</font>  transportation. The motor pool then, as now, had headquarter facilities
state/NN/br-h04/127	-0.00145511132507177	-0.00185383694753413	state	NN	NA	A2	A	NA	 mile. Purchase of state vehicles is handled similarly to all <font color=green>state</font>  purchases. Unit prices to the state are considerably lower than
state/NN/br-h04/1288	-0.00145345928599307	-0.00185282990326543	state	NN	NA	A4	A	NA	 headquarter facilities in Providence and other garages located throughout the <font color=green>state</font> . It was organizationally the responsibility of the Department of Public
state/NN/br-h04/134	-0.00145723308666848	-0.00186102191350209	state	NN	NA	A1	A	NA	 handled similarly to all state purchases. Unit prices to the <font color=green>state</font>  are considerably lower than to the general public because of
state/NN/br-h04/151	-0.00145534974815738	-0.00186514210557694	state	NN	NA	A3	A	NA	 general public because of quantity purchases and no payment of <font color=green>state</font>  sales or federal excise taxes. The legislature 's role in
state/NN/br-h04/1854	-0.00144607396699538	-0.0018616514003396	state	NN	NA	A2	A	NA	 in excess of 10000 miles annually is more economical by <font color=green>state</font>  car than by payment of allowances for use of personally-owned
state/NN/br-h04/192	-0.00145611036964596	-0.00185937927305351	state	NN	NA	A2	A	NA	 meaningful policies governing the purchase, assignment, use and management of <font color=green>state</font>  vehicles have been shaped by the state 's administrative officers
state/NN/br-h04/199	-0.00145914262120387	-0.00185432130227705	state	NN	NA	A1	A	NA	 and management of state vehicles have been shaped by the <font color=green>state</font>  's administrative officers. Meaningful policies include:( a) kinds of cars
state/NN/br-h04/2084	-0.00143970738902219	-0.00185526027252153	state	NN	NA	A1	A	NA	 to the general public. The reasons are obvious:( 1) the <font color=green>state</font>  is buying in quantity, and( 2) it has no federal
state/NN/br-h04/21	-0.0014618455831408	-0.00185941548600265	state	NN	NA	A2	A	NA	 on business dates back over forty years. At least one <font color=green>state</font>  vehicle was in existence in 1917. The state presently owns
state/NN/br-h04/2100	-0.00146172735191566	-0.00186487822531836	state	NN	NA	A3	A	NA	 in quantity, and( 2) it has no federal excise or <font color=green>state</font>  sales tax to pay. Until 1958 the state was also
state/NN/br-h04/2134	-0.00145523217456575	-0.00187141117367265	state	NN	NA	A2	A	NA	 dealers. In that ownership of all vehicles rests with the <font color=green>state</font>  motor pool, cars are paid for with funds appropriated to
state/NN/br-h04/2265	-0.00146453646779801	-0.00186194696471358	state	NN	NA	B	B	NA	 to the judgment of the chief administrative officer of the <font color=green>state</font> - the Director of Administration.
state/NN/br-h04/267	-0.00144780841374835	-0.00185488917778791	state	NN	NA	A2	A	NA	 taking cars home, and( f) need for liability insurance on <font color=green>state</font>  automobiles. A review of these policies indicates: The state purchases
state/NN/br-h04/278	-0.00145541016666558	-0.0018610973654152	state	NN	NA	A1	A	NA	 on state automobiles. A review of these policies indicates: The <font color=green>state</font>  purchases and assigns grades of cars according to need and
state/NN/br-h04/30	-0.00145433404998606	-0.0018545536910601	state	NN	NA	A1	A	NA	 least one state vehicle was in existence in 1917. The <font color=green>state</font>  presently owns 389 passenger vehicles in comparison to approximately 200
state/NN/br-h04/354	-0.0014549467216382	-0.00185769383786482	state	NN	NA	A2	A	NA	 efforts have been made to replace high mileage allowances with <font color=green>state</font>  automobiles. It is reasonably economical for the state to have
state/NN/br-h04/363	-0.00145898392399295	-0.00186552254805994	state	NN	NA	A1	A	NA	 allowances with state automobiles. It is reasonably economical for the <font color=green>state</font>  to have drivers garage state cars at their homes. The
state/NN/br-h04/368	-0.00145893119386646	-0.00186067081280727	state	NN	NA	A2	A	NA	 is reasonably economical for the state to have drivers garage <font color=green>state</font>  cars at their homes. The state has recently undertaken liability
state/NN/br-h04/375	-0.00145938147467479	-0.00186056635819203	state	NN	NA	A1	A	NA	 to have drivers garage state cars at their homes. The <font color=green>state</font>  has recently undertaken liability insurance for drivers of state cars
state/NN/br-h04/491	-0.00145588624292462	-0.00184744354981554	state	NN	NA	A2	A	NA	 vehicles. Nineteen states report laws, policies or regulations for assigning <font color=green>state</font>  vehicles in lieu of paying mileage allowances. Of these states
state/NN/br-h04/602	-0.00147326531018249	-0.00185989398588108	state	NN	NA	A1	A	NA	 by conditions and restrictions set forth in detail in the <font color=green>state</font>  's Travel Regulations. Rhode Island 's reimburseable rate of .07
state/NN/br-h04/681	-0.00146831069188793	-0.00186066469624449	state	NN	NA	A1	A	NA	 mileage allowances are well-administered and not unduly expensive for the <font color=green>state</font> . The travel regulations, requirements and procedures governing reimbursement are controlled
state/NN/br-h04/745	-0.00148929178674408	-0.00186927579890256	state	NN	NA	A1	A	NA	 payments over$ 50 per month are more expensive to the <font color=green>state</font>  than the assignment of state-owned vehicles. Travel allowances, including subsistence
state/NN/br-h04/780	-0.00146428946353786	-0.00185249249061584	state	NN	NA	A2	A	NA	 favorably with other states' allowances. With few exceptions travelers on <font color=green>state</font>  business are allowed actual travel expenses and$ 15 per day
state/NN/br-h04/821	-0.00144168827694291	-0.00186307864865284	state	NN	NA	A1	A	NA	 is difficult to pinpoint the time of origin of the <font color=green>state</font>  purchasing automobiles for use of employees in Rhode Island. Few
state/NN/br-h04/861	-0.00145864713368946	-0.00187354947441354	state	NN	NA	A2	A	NA	 The Registry of Motor Vehicles indicates that at least one <font color=green>state</font>  automobile was registered as far back as 1917. It should
state/NN/br-h04/901	-0.00144255509466309	-0.00185057993641467	state	NN	NA	A1	A	NA	 old. The best reason that can be advanced for the <font color=green>state</font>  adopting the practice was the advent of expanded highway construction
state/NN/br-h04/952	-0.00146905560076262	-0.00186626295461806	state	NN	NA	A2	A	NA	 personal hardship for such employees, and the matter of providing <font color=green>state</font>  transportation was felt perfectly justifiable. Once the principle was established
state/NN/br-h05/1130	-0.00145383702688731	-0.0018495576636235	state	NN	NA	A2	A	NA	 centralizing all aspects of property tax administration in a single <font color=green>state</font>  agency professionally organized and equipped for the job''. The resulting
state/NN/br-h05/130	-0.00143908421651538	-0.00185561600064289	state	NN	NA	A1	A	NA	 there has come into being a situation in which the <font color=green>state</font>  must raise all of its own revenues and, in addition
state/NN/br-h05/40	-0.0014574608851458	-0.00186026429439343	state	NN	NA	A3	A	NA	 of the state government as well. For many years a <font color=green>state</font>  tax on cities and towns was paid by the several
state/NN/br-h05/54	-0.00146293308069405	-0.00184654829850335	state	NN	NA	A1	A	NA	 and towns was paid by the several municipalities to the <font color=green>state</font>  from the proceeds of the general property tax. This tax
state/NN/br-h05/90	-0.00145898601473961	-0.00185567328251889	state	NN	NA	A1	A	NA	 new and expanded services have placed financial burdens on the <font color=green>state</font>  which could not have been foreseen in earlier years. At
state/NN/br-h05/976	-0.00146831602505028	-0.00186736657628145	state	NN	NA	A3	A	NA	 This condition will undoubtedly continue until such time as a <font color=green>state</font>  uniform system of evaluation is established, or through mutual agreement
state/NN/br-h06/1102	-0.00147059341709806	-0.00185834085446859	state	NN	NA	A5	A	NA	 Its purpose was to find ways of offsetting the United <font color=green>States</font> ' declining balance of trade for 1958 and 1959. Approximately 100
state/NN/br-h06/1649	-0.00145638763536963	-0.00185859711510524	state	NN	NA	A4	A	NA	 as a background for all other planning activities in the <font color=green>state</font> . Recognizing the truth of the statement by the Institute of
state/NN/br-h06/1678	-0.00145663744117074	-0.00186621170398437	state	NN	NA	A3	A	NA	 that`` Metropolian Planning( in Rhode Island) means, or should mean, <font color=green>state</font>  planning'', the state guide plan will take into account the
state/NN/br-h06/1766	-0.00146295307804714	-0.00184769122540352	state	NN	NA	A4	A	NA	 cost basis, technical planning assistance to those communities in the <font color=green>state</font>  unable to maintain their own planning staff. The planning division
state/NN/br-h06/1829	-0.00145589067295397	-0.00185471372496585	state	NN	NA	A	A	NA	 England states. On the basis that all citizens of the <font color=green>state</font>  are entitled to benefit equally in the development of its
state/NN/br-h06/1870	-0.00145876832533737	-0.00185054816782823	state	NN	NA	A3	A	NA	 regardless of arbitrary political boundaries, within the framework of the <font color=green>state</font>  plan. The state development budget will reflect the capital needs
state/NN/br-h06/1874	-0.00145621270206967	-0.00186076562540244	state	NN	NA	A3	A	NA	 political boundaries, within the framework of the state plan. The <font color=green>state</font>  development budget will reflect the capital needs of all the
state/NN/br-h06/1885	-0.00145359687070304	-0.00185234601153197	state	NN	NA	A2	A	NA	 development budget will reflect the capital needs of all the <font color=green>state</font>  agencies and the priority of the projects in the budget
state/NN/br-h06/1942	-0.00145558400122726	-0.00185984984774243	state	NN	NA	A3	A	NA	 recreation. Functionally the planning division carries out four activities: long-range <font color=green>state</font>  planning, current state planning, local planning assistance; and the preparation
state/NN/br-h06/1946	-0.00145569169118517	-0.00185818798994486	state	NN	NA	A3	A	NA	 planning division carries out four activities: long-range state planning, current <font color=green>state</font>  planning, local planning assistance; and the preparation of the state
state/NN/br-h06/1958	-0.00145826505135525	-0.00184848788459513	state	NN	NA	A3	A	NA	 state planning, local planning assistance; and the preparation of the <font color=green>state</font>  development budget. The planning division has embarked on the most
state/NN/br-h06/2205	-0.00145151425129688	-0.00185345495714675	state	NN	NA	A3	A	NA	 July 1, 1960 to complete the inventory phase of the <font color=green>state</font>  planning program. this phase consists of four items: urban land
state/NN/br-h06/2318	-0.00146424894489338	-0.00184437720937015	state	NN	NA	A4	A	NA	 Rhode Island and identifies all agricultural land uses in the <font color=green>state</font>  by type of use. The mapping of important physical features
state/NN/br-h06/248	-0.00147760548430555	-0.00184364338623148	state	NN	NA	A	A	NA	 in a Rhode Island location. They are conscious of this <font color=green>state</font>  's new feeling of optimism and assurance and are definitely
state/NN/br-h06/805	-0.00146936079492725	-0.00186162214132701	state	NN	NA	A4	A	NA	 Plant Location. The direct mail campaign consisted of 3 intra <font color=green>state</font>  mailings of 1680 letters each and 6 out-of-state directed to
state/NN/br-h06/870	-0.00145491315058466	-0.00186267698347852	state	NN	NA	A5	A	NA	 and nineteen were received from 35 of our 50 United <font color=green>States</font>  and 11 came from foreign countries. New York led in
state/NN/br-h07/1010	-0.00144104339152664	-0.00186043358304319	state	NN	NA	A4	A	NA	 sums of money to the several local governments in this <font color=green>state</font>  as indicated below: It has been said that when local
state/NN/br-h07/1285	-0.00146088326001367	-0.00183151869146156	state	NN	NA	A4	A	NA	 city. Fortunately, there are no cities or towns in the <font color=green>state</font> , with one or two possible exceptions that are in too
state/NN/br-h07/1566	-0.00146041179611835	-0.00187231380195483	state	NN	NA	A4	A	NA	 An analysis of the fiscal-tax collection year calendars throughout the <font color=green>state</font>  indicates that transition may not be as painful as is
state/NN/br-h07/398	-0.00144756346415239	-0.00184663685484148	state	NN	NA	A1	A	NA	 Iowa, Kentucky, Maine, Maryland, Minnesota, Virginia, and South Carolina). One <font color=green>state</font> , Alabama, closes its fiscal year on September 30, and all
state/NN/br-h07/482	-0.00146143928178307	-0.00185299004918434	state	NN	NA	A3	A	NA	 The remaining twelve states have varying fiscal years for the <font color=green>state</font> , city and local governments. However, only Illinois, Oregon, Louisiana and
