id	model.x	model.y	lemma	pos	genre	broad_genre	marisense	mbroad	mari3	mari2	sensekey	wnsense	wnbroad	wn3	wn2	text	cues	cues_with_weight	mean_weight_x100	wcratio_x100	weighted_cw	wf
country/NN/br-f13/1645	0.288749219650891	-0.0664665987433634	country	NN	popular_lore	fiction	A	A	A	A	country%1:15:01::	A	A	A	A	 a neighborhood of well-kept homes. There are slums in the <font color=green>country</font>  as well as in the city. Few rural areas are	5	1	254	20	1	country
country/NN/br-f13/637	0.406285804537466	-0.130349160097784	country	NN	popular_lore	fiction	A	A	A	A	country%1:15:01::	A	A	A	A	 Generally, the same level of living costs less in the <font color=green>country</font>  than in the city. The savings are not as great	3	0	218	0	1	country
country/NN/br-f13/701	0.346063713068045	-0.105230479665962	country	NN	popular_lore	fiction	A	A	A	A	country%1:15:01::	A	A	A	A	 similar municipal services are of equal quality in city and <font color=green>country</font> , real estate taxes are usually about the same. A part-time	4	0	210	0	1	country
country/NN/br-f15/2048	0.0637512316328905	-0.0263474739235832	country	NN	popular_lore	fiction	B1	B	B14	B	country%1:14:00::	B2	B	BB2	B	 translated into action by the majority of people in this <font color=green>country</font> . Repeated polls have disclosed that most married couples are now	4	0	233	0	4	country
country/NN/br-f15/235	0.134766752424325	0.00769568506116014	country	NN	popular_lore	fiction	B4	B	B14	B	country%1:14:00::	B2	B	BB2	B	 more tension, rancor and strife among religious groups in this <font color=green>country</font>  than the birth-control issue. It has flared up periodically on	3	0	209	0	1	country
country/NN/br-f15/664	0.373447051871591	-0.29496560072212	country	NN	popular_lore	fiction	B	B	B14	B	country%1:14:00::	B2	B	BB2	B	 necessities of life, the degree of population density of a <font color=green>country</font>  and the shortage of housing facilities may legitimately be taken	4	0	256	0	1	country
country/NN/br-f17/2140	0.408420724873029	-0.024348665588659	country	NN	popular_lore	fiction	A1	A	A	A	country%1:15:02::	A1	A	A	A	 three men to cart goods to them from the Mississippi <font color=green>country</font> . Others carried pemmican from`` the Forks'' to St. Paul and	4	0	249	0	1	country
country/NN/br-f18/2329	0.264987304722169	-0.392330130627075	country	NN	popular_lore	fiction	B1	B	B14	B	country%1:15:00::	B1	B	B1	B	 have been satisfied to have staid at home when my <font color=green>country</font>  is invaded by a thievin foe By a set of	3	0	250	0	1	country
country/NN/br-f19/1206	0.0598850388567228	0.415643735653217	country	NN	popular_lore	fiction	B1	B	B14	B	country%1:14:00::	B2	B	BB2	B	 and seldom taught properly to American undergraduates. In addition, this <font color=green>country</font>  has been settled by many peoples of many heritages and	3	1	227	33	1	country
country/NN/br-f19/140	0.147106511772246	0.0995917351062412	country	NN	popular_lore	fiction	B2	B	B23	B	country%1:14:00::	B2	B	BB2	B	 a given generation feels must have occurred. 2) As a <font color=green>country</font>  superimposes its cultural and political attitudes on others, it searches	4	1	227	25	2	country
country/NN/br-f19/350	0.317758079892103	0.0203180733903151	country	NN	popular_lore	fiction	B4	B	B14	B	country%1:14:00::	B2	B	BB2	B	 Of course, nationalism has really outlived its usefulness in a <font color=green>country</font>  as world oriented as ours, and its continued existence reflects	3	0	218	0	1	country
country/NN/br-f23/1643	0.253943962059216	-0.256629639510109	country	NN	popular_lore	fiction	B2	B	B23	B	country%1:14:00::	B2	B	BB2	B	 first stage of a Communist takeover is to`` neutralize'' a <font color=green>country</font> . The second stage is to retain the nominal classification of	3	1	234	33	2	country
country/NN/br-f23/2055	0.0236213770787266	-0.171965615775534	country	NN	popular_lore	fiction	B2	B	B23	B	country%1:14:00::	B2	B	BB2	B	 are displaying open sympathy for Castroism, and there is no <font color=green>country</font> - save the Dominican Republic whose funeral services we recently arranged	2	0	234	0	3	country
country/NN/br-g01/1421	0.0566882243565009	-0.198801274741323	country	NN	belles_lettres	fiction	B4	B	B14	B	mother_country%1:15:00::	B1	B	B1	B	 the sympathy they felt extended to them by the mother <font color=green>country</font> . And no doubt many people in states like the Carolinas	2	0	227	0	2	country
country/NN/br-g17/2183	-0.0597527973890034	0.160931705739815	country	NN	belles_lettres	fiction	B1	B	B14	B	country%1:15:00::	B1	B	B1	B	 New England as it did in other parts of the <font color=green>country</font> ? Is n't it a bit odd that the three states	3	0	203	0	1	country
country/NN/br-g17/767	0.340397057609317	-0.0107716672197673	country	NN	belles_lettres	fiction	B4	B	B14	B	country%1:14:01::	B	B	BB2	B	 all partial or local legislation''. Who will say that our <font color=green>country</font>  is even now a homogeneous community? that regional peculiarities do	4	1	214	25	1	country
country/NN/br-g18/1249	0.0312780124001441	-0.195041849989045	country	NN	belles_lettres	fiction	B4	B	B14	B	country%1:14:01::;1:15:00::	B	B	BB2	B	 little patience with collective mediocrity. He saw Sweden as a <font color=green>country</font>  of smug and narrow provincialism, indifferent to the heroic spirit	3	0	277	0	4	country
country/NN/br-g18/1754	0.150187891661258	-0.164970917509652	country	NN	belles_lettres	fiction	B4	B	B14	B	country%1:14:01::	B	B	BB2	B	 an invasion of Russia and each brought ruin on the <font color=green>country</font>  that worshipped him. Each is still glorified as a national	3	0	249	0	2	country
country/NN/br-g21/1021	0.134766752424325	0.00769568506116014	country	NN	belles_lettres	fiction	B4	B	B14	B	country%1:15:00::	B1	B	B1	B	 by the time the war ended, liberal leadership in this <font color=green>country</font>  was spiritually Marxist. We will recall that the still confident	3	0	209	0	1	country
country/NN/br-g21/106	0.134766752424325	0.00769568506116014	country	NN	belles_lettres	fiction	B4	B	B14	B	country%1:14:01::	B	B	BB2	B	 relationship that he found between religion and politics in this <font color=green>country</font>  and what happened to it. He points out that from	2	0	209	0	1	country
country/NN/br-g21/15	0.0687499592525709	0.078390112049854	country	NN	belles_lettres	fiction	B4	B	B14	B	country%1:14:01::	B	B	BB2	B	 pointed up the relation between the Protestant movement in this <font color=green>country</font>  and the development of a social religion, which he called	4	1	227	25	2	country
country/NN/br-g21/605	0.134766752424325	0.00769568506116014	country	NN	belles_lettres	fiction	B4	B	B14	B	country%1:14:00::	B2	B	BB2	B	 man? French Egalitarianism had had only nominal influence in this <font color=green>country</font>  before the days of Popularism. The riotous onrush of industrialism	4	0	209	0	1	country
country/NN/br-g21/964	0.0886867755630042	0.0272634781782429	country	NN	belles_lettres	fiction	B4	B	B14	B	country%1:14:01::	B	B	BB2	B	 peace. The long road that had taken liberals in this <font color=green>country</font>  into the social religion of democracy, into a worship of	5	2	224	40	3	country
country/NN/br-g23/17	0.042371483839563	-0.0655277668150971	country	NN	belles_lettres	fiction	B4	B	B14	B	country%1:14:00::	B2	B	BB2	B	 Woodrow Wilson 's administration, a red scare developed in our <font color=green>country</font> . Many Americans reacted irrationally to the challenge of Russia and	5	1	236	20	4	country
country/NN/br-g28/1507	0.152146492284629	-0.480080341326716	country	NN	belles_lettres	fiction	A	A	A	A	back_country%1:15:00::	A	A	A	A	 William Byrd described the Lubberlanders he encountered in the back <font color=green>country</font>  of Virginia and North Carolina. The chief literary antecedents of	3	0	251	0	1	country
country/NN/br-g28/2097	-0.0631743395051148	-0.431464902820338	country	NN	belles_lettres	fiction	A1	A	A	A	country%1:15:00::	B1	B	B1	B	 as a young man prepared to find in the new <font color=green>country</font>  the setting of romantic adventure and idealized beauty. But Thorpe	3	0	253	0	1	country
country/NN/br-g43/348	-0.118370087107873	-0.494363383639488	country	NN	belles_lettres	fiction	A	A	A	A	country_doctor%1:18:00::	A	A	A	A	 most unforgettable character I ever met'' deals with village grocers, <font color=green>country</font>  doctors, favorite if illiterate aunts, and so forth. Scientists often	2	0	238	0	1	country
country/NN/br-h18/1813	0.0983801392892413	-0.0442879793202969	country	NN	miscellaneous	non-fiction	B4	B	B14	B	country%1:14:00::	B2	B	BB2	B	 action can hope to win public support, first in this <font color=green>country</font>  and then abroad? For the policy officer will know that	5	1	239	20	2	country
country/NN/br-h18/1847	0.174889339601388	0.0966268018254174	country	NN	miscellaneous	non-fiction	B3	B	B23	B	country%1:14:01::	B	B	BB2	B	 of policy will be conditioned by the readiness of the <font color=green>country</font>  to sustain it. He is interested in public opinion for	5	3	246	60	3	country
country/NN/br-h18/2087	0.201249091029538	0.19469799960984	country	NN	miscellaneous	non-fiction	B2	B	B23	B	country%1:14:00::	B2	B	BB2	B	 public opinion until the President and the leaders of the <font color=green>country</font>  have gone to the public to explain what is required	3	0	241	0	1	country
country/NN/br-h18/2142	0.16706352282011	-0.253147519940278	country	NN	miscellaneous	non-fiction	B4	B	B14	B	country%1:14:01::	B	B	BB2	B	 Marshall plan, any public-opinion expert would have said that the <font color=green>country</font>  would have accepted such proposals. The problem in the policy	4	1	219	25	2	country
country/NN/br-h18/857	0.368214613080377	0.165636106934504	country	NN	miscellaneous	non-fiction	B1	B	B14	B	country%1:15:00::	B1	B	B1	B	 the representatives of other agencies who are stationed in his <font color=green>country</font> . He is expected to supervise, to encourage, to direct, to	2	0	295	0	1	country
country/NN/br-j37/1184	0.276252430068058	-0.166328585006988	country	NN	learned	non-fiction	B1	B	B14	B	country%1:15:00::	B1	B	B1	B	 communication and understanding in the more remote areas of the <font color=green>country</font> , but it also served to minimize the national political value	3	1	260	33	2	country
country/NN/br-j37/958	0.305764313253132	0.127684138037362	country	NN	learned	non-fiction	B2	B	B23	B	country%1:14:00::	B2	B	BB2	B	 a developing country and evaluating their results. In the new <font color=green>country</font>  the electoral process is considered as a means of resolving	4	1	232	25	2	country
country/NN/br-j38/1233	0.176275335634964	0.0145832012058757	country	NN	learned	non-fiction	B1	B	B14	B	country%1:14:00::	B2	B	BB2	B	 inherent in the system of local school districts in this <font color=green>country</font> . Planning of vocational education programs and courses is oriented to	3	0	227	0	2	country
country/NN/br-j56/1063	-0.122009862352707	-0.136056454135856	country	NN	learned	non-fiction	A	A	A	A	country_club%1:14:00::	A	A	A	A	 had come into vogue, but also to witness the Ekwanok <font color=green>Country</font>  Club tournaments. New Yorkers were kept informed of scores by	2	1	260	50	2	Country
country/NN/br-j58/690	-0.200930678494979	-0.201751855381368	country	NN	learned	non-fiction	B4	B	B14	B	country%1:14:00::	B2	B	BB2	B	 commuted to imprisonment, it would be well- well for the <font color=green>country</font>  and for Virginia''. Despite the excitement being caused by the	1	0	227	0	3	country
country/NN/br-k03/1240	-0.409957580487061	-0.235470316941028	country	NN	fiction_gral	fiction	A	A	A	A	country%5:00:01:rural:00	A	A	A	A	 sit in the back seat of cars along a dark <font color=green>country</font>  lane. No, they must look the other way and climb	5	0	202	0	1	country
country/NN/br-k03/444	0.121860358476933	-0.122931969170287	country	NN	fiction_gral	fiction	A	A	A	A	country%5:00:01:rural:00	A	A	A	A	 or his own sentry. He was a wiry, inscrutable, silent <font color=green>country</font>  boy from the red clay of rural Alabama, and he	4	2	258	50	3	country
country/NN/br-k08/558	0.00612208631638843	-0.276196647969516	country	NN	fiction_gral	fiction	A	A	A	A	country%1:15:00::	B1	B	B1	B	 one day, while on a week 's visit to the <font color=green>country</font>  home of a retired Swiss jeweler, Rousseau amused the company	3	1	232	33	3	country
country/NN/br-k08/973	-0.304029450636319	-0.299150231086764	country	NN	fiction_gral	fiction	A	A	A	A	country%1:15:01::	A	A	A	A	 just for this once, for this one weekend in the <font color=green>country</font> , he would make a little piece out of his melodies	3	1	310	33	1	country
country/NN/br-k17/1981	-0.279729503029662	0.114701726458416	country	NN	fiction_gral	fiction	B4	B	B14	B	country%1:15:00::	B1	B	B1	B	 I 've lost faith, Styka. I used to love this <font color=green>country</font>  and believe that someday we 'd win our battle for	2	1	247	50	2	country
country/NN/br-k23/1336	-0.455234054323249	-0.0117080223776144	country	NN	fiction_gral	fiction	A1	A	A	A	country%1:15:01::	A	A	A	A	 wheel. They rarely spoke. Abel sat and regarded the farm <font color=green>country</font>  which, spreading out from both sides of the road, rolled	3	0	230	0	1	country
country/NN/br-k25/869	0.261789462801129	-0.200429989383874	country	NN	fiction_gral	fiction	B1	B	B14	B	country%1:15:00::	B1	B	B1	B	 shawl over her head, which she had bought in that <font color=green>country</font>  during one of their trips abroad, and handed him a	4	1	268	25	1	country
country/NN/br-l11/1246	-0.204340457316077	-0.162161792546669	country	NN	fiction_mystery	fiction	A	A	A	A	country%1:15:01::	A	A	A	A	 a manner Esquire might suggest for the outdoor man 's <font color=green>country</font>  weekend. Dark gray sports jacket, lighter gray slacks, pink flannel	2	2	231	100	5	country
country/NN/br-n09/1051	0.436274869629102	0.118078342588314	country	NN	fiction_adventure	fiction	A	A	A	A	country%1:15:01::	A	A	A	A	 distant derrick of the wildcat- a test well in unexplored <font color=green>country</font> . And even with her limited knowledge of such things, she	2	0	256	0	2	country
country/NN/br-n09/492	0.061835113641064	-0.0560992421743636	country	NN	fiction_adventure	fiction	B1	B	B14	B	country%1:15:00::	B1	B	B1	B	 gun- a strange ommission for a peace officer in this <font color=green>country</font> . Never, he 'd once told Joyce, had he encountered any	3	0	216	0	2	country
country/NN/br-n11/2133	-0.0372077527542001	-0.363469222414233	country	NN	fiction_adventure	fiction	A1	A	A	A	country%1:15:02::	A1	A	A	A	 to frighten three rustling homesteaders out of the Upper Laramie <font color=green>country</font>  in a single week.`` My reputation 's my stock in	3	0	304	0	2	country
country/NN/br-p12/2090	-0.0507466909321708	-0.296849211672341	country	NN	fiction_romance	fiction	B1	B	B14	B	country%1:15:00::	B1	B	B1	B	 him she had met a nice man from his adopted <font color=green>country</font> . And Sam thanked her, and hoped he might meet her	2	0	208	0	1	country
country/NN/br-r08/1810	0.0269165933323507	-0.0267140305023046	country	NN	humor	fiction	B4	B	B14	B	country%1:15:00::	B1	B	B1	B	 seems to be staging a well deserved comeback. In this <font color=green>country</font> , the two guiding lights are, without doubt, Felix Fing and	2	0	214	0	4	country
country/NNS/br-b13/1273	-0.0262292727038931	-0.132973872117923	country	NNS	press_editorial	press	B1	B	B14	B	country%1:15:00::	B1	B	B1	B	 desire to visit the`` smaller, less traveled and relatively inexpensive <font color=green>countries</font> '', and is now prepared to teach modern Greek and Portuguese	4	1	269	25	3	countries
country/NNS/br-f14/1851	0.0420593964519316	-0.00836631205254869	country	NNS	popular_lore	fiction	B1	B	B14	B	country%1:15:00::	B1	B	B1	B	 of the Jews in Germany and later in the occupied <font color=green>countries</font>  contributed to terrorizing the populations, splitting apart individuals and groups	4	2	263	50	5	countries
country/NNS/br-f14/2054	0.0787456586701842	-0.100159119756293	country	NNS	popular_lore	fiction	B	B	B14	B	country%1:14:00::	B2	B	BB2	B	 to post before the world the contrasting fates of the <font color=green>countries</font>  in which the Final Solution was aided by native Jew	4	2	252	50	4	countries
country/NNS/br-f14/2151	0.316431632590824	0.0507918610271093	country	NNS	popular_lore	fiction	B1	B	B14	B	country%1:14:00::	B2	B	BB2	B	 Was n't this meaning of Eichmann 's experience in various <font color=green>countries</font>  worth highlighting? As the first collective confrontation of the Nazi	3	0	325	0	2	countries
country/NNS/br-f15/1446	0.0186781112903857	0.111080099900667	country	NNS	popular_lore	fiction	B4	B	B14	B	country%1:14:00::	B2	B	BB2	B	 This was generally reflected in the civil laws of Christian <font color=green>countries</font> . Today, the Roman Catholic and Orthodox Churches stand virtually alone	4	1	251	25	5	countries
country/NNS/br-f15/290	0.122713816505994	-0.0532579320842827	country	NNS	popular_lore	fiction	B3	B	B23	B	country%1:14:00::	B2	B	BB2	B	 including birth-control information and material in foreign aid to underdeveloped <font color=green>countries</font> . Where it is not actually erupting, it rumbles and smolders	3	2	339	67	3	countries
country/NNS/br-f23/2029	0.0595085929474431	-0.148232631938058	country	NNS	popular_lore	fiction	B2	B	B23	B	country%1:14:00::	B2	B	BB2	B	 a Soviet bridgehead ninety miles off our coast. In some <font color=green>countries</font>  the trend has gone further than others: Mexico, Panama, and	4	2	274	50	3	countries
country/NNS/br-g12/2313	0.131564114435658	-0.0480686598919481	country	NNS	belles_lettres	fiction	B4	B	B14	B	country%1:14:00::	B2	B	BB2	B	 the technological and economic revolutions now going on in the <font color=green>countries</font>  of Asia and Africa, and also of course on how	5	4	321	80	4	countries
country/NNS/br-g18/2235	-0.0160146854478637	-0.0713457899945981	country	NNS	belles_lettres	fiction	B	B	B14	B	country%1:14:01::	B	B	BB2	B	 a perfect introduction to Swedish history for readers of other <font color=green>countries</font> . Some of the earlier episodes have touches of the supernatural	3	0	256	0	4	countries
country/NNS/br-h09/1266	0.075216916203224	-0.0151414697485535	country	NNS	miscellaneous	non-fiction	B1	B	B14	B	country%1:14:00::	B2	B	BB2	B	 expended in cooperation with public or private agencies in foreign <font color=green>countries</font>  in the development of processes useful to the program in	5	3	243	60	5	countries
country/NNS/br-h13/1532	0.0449562109874133	-0.0438168835717663	country	NNS	miscellaneous	non-fiction	B2	B	B23	B	country%1:14:00::	B2	B	BB2	B	 years the United States had been trying to get these <font color=green>countries</font>  to exclude Castro 's representative from secret military talks. But	5	4	240	80	6	countries
country/NNS/br-h13/2195	0.444723240090948	-0.19917815311779	country	NNS	miscellaneous	non-fiction	B2	B	B23	B	country%1:14:00::	B2	B	BB2	B	 without discrimination. Once these conditions of international law are met, <font color=green>countries</font>  that try to run to blockade do so at their	4	1	326	25	1	countries
country/NNS/br-h13/2315	0.0930923576591343	-0.14070471679928	country	NNS	miscellaneous	non-fiction	B3	B	B23	B	country%1:14:00::	B2	B	BB2	B	 coming from Russia and Czechoslovakia. Shipments of arms from Western <font color=green>countries</font>  could similarly be seized as contraband. In a total blockade	5	1	273	20	3	countries
country/NNS/br-h21/1267	0.084665205690725	-0.0400915910040113	country	NNS	miscellaneous	non-fiction	B1	B	B14	B	country%1:14:00::	B2	B	BB2	B	 a rider which limits competitive bidding by firms in other <font color=green>countries</font>  on certain military supply items. As I have repeatedly stated	2	1	285	50	7	countries
country/NNS/br-j10/1243	0.201343275333877	0.0977456764025272	country	NNS	learned	non-fiction	B2	B	B23	B	european_country%1:15:00::	B1	B	B1	B	 the`` cuckoo bumblebee'' as it is called in some European <font color=green>countries</font> . Female individuals of Psithyrus look deceptively like the workers and	2	0	297	0	2	countries
country/NNS/br-j22/1309	0.157548785515964	-0.101634631740373	country	NNS	learned	non-fiction	B3	B	B23	B	country%1:14:00::	B2	B	BB2	B	 At a third stage in the modernization process are such <font color=green>countries</font>  as India, Brazil, the Philippines, and Taiwan, which are ready	6	2	357	33	3	countries
country/NNS/br-j22/1375	-0.190059556130905	-0.444895703007903	country	NNS	learned	non-fiction	B3	B	B23	B	country%1:14:00::	B2	B	BB2	B	 in the program to wider and wider groups. But these <font color=green>countries</font>  have made big strides toward developing the necessary human and	4	1	340	25	1	countries
country/NNS/br-j22/1437	0.115876940409554	-0.00383393724410669	country	NNS	learned	non-fiction	B3	B	B23	B	country%1:14:00::	B2	B	BB2	B	 economies. On the economic front, the first priority of these <font color=green>countries</font>  is to mobilize a vastly increased volume of resources. Several	4	3	274	75	4	countries
country/NNS/br-j22/1464	0.150677358146232	0.0195906238458861	country	NNS	learned	non-fiction	B3	B	B23	B	country%1:14:00::	B2	B	BB2	B	 carried out if self-sustaining growth is to be achieved. These <font color=green>countries</font>  must formulate a comprehensive, long-term program covering the objectives of	4	1	300	25	5	countries
country/NNS/br-j22/171	-0.00315181447748909	-0.0615456314002324	country	NNS	learned	non-fiction	B2	B	B23	B	country%1:14:00::	B2	B	BB2	B	 and dangerous consequences of social change which have troubled other <font color=green>countries</font>  passing through this stage can be escaped. The United States	4	1	259	25	5	countries
country/NNS/br-j22/194	0.0537932266983329	-0.0173749964486399	country	NNS	learned	non-fiction	B2	B	B23	B	country%1:14:00::	B2	B	BB2	B	 help by communicating a genuine concern with the problems these <font color=green>countries</font>  face and a readiness to provide technical and other appropriate	3	2	267	67	7	countries
country/NNS/br-j22/1968	0.0292700017682461	-0.0363495868966044	country	NNS	learned	non-fiction	B4	B	B14	B	country%1:14:00::	B2	B	BB2	B	 to take seriously their claims to being democratic and free <font color=green>countries</font> ; we also have, in consequence, the duty to appraise realistically	2	1	242	50	4	countries
country/NNS/br-j22/2116	-0.10673164473231	-0.253848296859279	country	NNS	learned	non-fiction	B3	B	B23	B	country%1:14:00::	B2	B	BB2	B	 generate. It follows that any effective policy toward the underdeveloped <font color=green>countries</font>  must have a realistically long working horizon. It must be	3	0	280	0	2	countries
country/NNS/br-j22/257	0.243815453232998	-0.0319793356918561	country	NNS	learned	non-fiction	B3	B	B23	B	country%1:14:00::	B2	B	BB2	B	 and the lack of cohesion and stability which characterize these <font color=green>countries</font>  may make them particularly prone to diversions and external adventures	2	0	333	0	4	countries
country/NNS/br-j22/347	0.170374309321427	-0.0564735042791156	country	NNS	learned	non-fiction	B2	B	B23	B	country%1:14:00::	B2	B	BB2	B	 world scene. When necessary, we should make it clear that <font color=green>countries</font>  which choose to derive marginal advantages from the cold war	5	3	279	60	4	countries
country/NNS/br-j22/397	0.149871990188499	-0.0356541316119153	country	NNS	learned	non-fiction	B3	B	B23	B	country%1:14:00::	B2	B	BB2	B	 As a nation, we feel an obligation to assist other <font color=green>countries</font>  in their development; but this obligation pertains only to countries	2	2	353	100	4	countries
country/NNS/br-j22/408	0.134249967580864	-0.0253328985024053	country	NNS	learned	non-fiction	B2	B	B23	B	country%1:14:00::	B2	B	BB2	B	 countries in their development; but this obligation pertains only to <font color=green>countries</font>  which are honestly seeking to become responsible members of a	4	3	299	75	3	countries
country/NNS/br-j22/429	0.366987269643949	0.234785355319928	country	NNS	learned	non-fiction	B2	B	B23	B	country%1:14:00::	B2	B	BB2	B	 a stable and forward-moving world community. When we look at <font color=green>countries</font>  like Iran, Iraq, Pakistan, and Burma, where substantial progress has	8	1	294	12	1	countries
country/NNS/br-j22/474	0.152187285538622	-0.0242550259711683	country	NNS	learned	non-fiction	B2	B	B23	B	country%1:14:00::	B2	B	BB2	B	 of centralized government exist, we find a second category of <font color=green>countries</font>  with a different set of problems and hence different priorities	4	1	269	25	3	countries
country/NNS/br-j22/603	0.168377226610335	-0.0323566211726401	country	NNS	learned	non-fiction	B2	B	B23	B	country%1:14:00::	B2	B	BB2	B	 achieve the national goals of modernization already symbolically accepted. Most <font color=green>countries</font>  in this second category share the difficulty of having many	3	2	328	67	4	countries
country/NNS/br-j22/892	0.0946618313437146	-0.0164206504528272	country	NNS	learned	non-fiction	B2	B	B23	B	country%1:14:00::	B2	B	BB2	B	 performance can we provide telling assistance. With respect to those <font color=green>countries</font>  whose leaders prefer to live with their illusions, we can	2	2	250	100	4	countries
country/NNS/br-j22/929	0.161563544837269	-0.0191901999038047	country	NNS	learned	non-fiction	B3	B	B23	B	country%1:14:00::	B2	B	BB2	B	 clear for all to see. Our technical assistance to these <font color=green>countries</font>  should place special emphasis on inducing the central governments to	4	2	248	50	3	countries
country/NNS/br-j37/1682	0.159820375073764	0.0131173286650312	country	NNS	learned	non-fiction	B2	B	B23	B	country%1:14:00::	B2	B	BB2	B	 solutions devised in the electoral experiences of the rapidly changing <font color=green>countries</font>  are often of comparative value and essential to evaluating election	4	2	302	50	6	countries
