id	model.x	model.y	lemma	pos	sensekey	marisense	mbroad	wnbroad	mari2	mari3	wn2	wn3	wnsense	text
church/NNS/br-d02/548	0.398257723149906	0.0337980778175725	church	NNS	church%1:14:00::	B	B	B	AB	AB	AB	AB	B	 observed to characterize the preaching and teaching of the American <font color=green>churches</font> . In the absence of a truly adequate conceptuality in which
church/NNS/br-d03/1011	0.033433855619636	0.318729958701543	church	NNS	church%1:06:00::	D	D	D	CDE	DE	CDE	DE	D	 often, the sale of 764 chapels''. Most of these former <font color=green>churches</font>  are now used as warehouses, but`` neither Anglicans nor Nonconformists
church/NNS/br-d03/1027	-0.0298629767030676	-0.0433098842225299	church	NNS	church%1:06:00::	D	D	D	CDE	DE	CDE	DE	D	 as warehouses, but`` neither Anglicans nor Nonconformists object to selling <font color=green>churches</font>  to Roman Catholics'', and have done so. While it must
church/NNS/br-d03/1051	0.0593960090623624	0.005868818503662	church	NNS	church%1:06:00::	D	D	D	CDE	DE	CDE	DE	D	 be said that these same Protestants have built some new <font color=green>churches</font>  during this period, and that religious population shifts have emptied
church/NNS/br-d03/1063	0.0560463189641752	0.0159137761945965	church	NNS	church%1:06:00::	C	C	D	CDE	C	CDE	DE	D	 during this period, and that religious population shifts have emptied <font color=green>churches</font> , a principal reason for this phenomenon of redundancy is that
church/NNS/br-d03/110	-0.0255222033700942	0.0461362803758293	church	NNS	church%1:14:00::	C	C	B	CDE	C	AB	AB	B	 was enthusiastically devoted to prayer and discussion by the various <font color=green>churches</font> . Many people seem hopeful, yet it is difficult to predict
church/NNS/br-d03/1472	-0.155243350631941	-0.00105686825495875	church	NNS	church%1:06:00::	E	E	D	CDE	DE	CDE	DE	D	 thy Son''. A hymn often to be heard in Catholic <font color=green>churches</font>  is`` Faith of our Fathers'', which glories in England 's
church/NNS/br-d03/1884	-0.0146491714153694	0.0228055301832329	church	NNS	church%1:14:00::	B	B	B	AB	AB	AB	AB	B	 at least of equal stature in England with the Protestant <font color=green>churches</font> . On successive Sundays during October, 1960, Paul Ferris( a non-Catholic
church/NNS/br-d03/313	0.00884780506907414	-0.00446494099532322	church	NNS	anglican_church%1:14:00::	B	B	B	AB	AB	AB	AB	B2	 saying and writing and implying about the Roman and Anglican <font color=green>Churches</font>  and about the present religious state of England. Since the
church/NNS/br-d03/35	-0.0350790669279537	0.00319804688641155	church	NNS	anglican_church%1:14:00::	B	B	B	AB	AB	AB	AB	B2	 efforts of only unauthorized individuals of the Roman and Anglican <font color=green>Churches</font> , and urging a communion of prayer unacceptable to Rome, this
church/NNS/br-d03/779	-0.00397243368789069	-0.0487220001072556	church	NNS	church%1:06:00::	D	D	D	CDE	DE	CDE	DE	D	 less than ten. From many sides come remarks that Protestant <font color=green>churches</font>  are badly attended and the large medieval cathedrals look all
church/NNS/br-d03/849	0.0439819108144468	0.0777731498893432	church	NNS	church%1:06:00::	C	C	D	CDE	C	CDE	DE	D	 admit the great falling off in effective membership in their <font color=green>churches</font> . According to a newspaper report of the 1961 statistics of
church/NNS/br-d03/929	-0.0549615525847885	-0.270200756410322	church	NNS	church%1:06:00::	C	C	D	CDE	C	CDE	DE	D	 the Manchester Guardian of last November, entitled`` Fate of Redundant <font color=green>Churches</font> '', states than an Archbishops' Commission`` reported last month that in
church/NNS/br-d03/952	-0.0439850755541578	0.00997934334773685	church	NNS	church%1:06:00::	C	C	D	CDE	C	CDE	DE	D	 that in the Church of England alone there are 790 <font color=green>churches</font>  which are redundant now, or will be in 20 years
church/NNS/br-f15/1245	0.0237965056882118	0.0121689894800218	church	NNS	church%1:14:00::	B	B	B	AB	AB	AB	AB	B	 Consider what happened during World War 1,, when the Protestant <font color=green>churches</font>  united to push the Prohibition law through Congress. Many of
church/NNS/br-f15/1425	-0.00836826155976969	-0.162681326218052	church	NNS	christian_church%1:14:00::	B	B	B	AB	AB	AB	AB	B	 turn of the century, contraception was condemned by all Christian <font color=green>churches</font>  as immoral, unnatural and contrary to divine law. This was
church/NNS/br-f15/1455	0.00415649083320183	-0.0456156668982589	church	NNS	orthodox_church%1:14:00::	B	B	B	AB	AB	AB	AB	B1	 laws of Christian countries. Today, the Roman Catholic and Orthodox <font color=green>Churches</font>  stand virtually alone in holding that conviction. The various Lambeth
church/NNS/br-f15/1720	0.029426895148662	0.0530597548223373	church	NNS	group%1:03:00::	B	B	C	AB	AB	CDE	C	C	 28 members of a committee of the Federal Council of <font color=green>Churches</font>  ratified artificial methods of birth control.`` As to the necessity
church/NNS/br-f15/1887	0.0260635105833188	0.0230917966932103	church	NNS	group%1:03:00::	B	B	C	AB	AB	CDE	C	C	 1961, by the general board of the National Council of <font color=green>Churches</font> , the largest Protestant organization in the US. The board approved
church/NNS/br-f15/1944	-0.0219376912234084	-0.322271435808635	church	NNS	church%1:14:00::	B	B	B	AB	AB	AB	AB	B	 of contraceptives. The general board declared:`` Most of the Protestant <font color=green>churches</font>  hold contraception and periodic continence to be morally right when
church/NNS/br-f15/1998	-0.0411978849624634	-0.148553010323349	church	NNS	christian_church%1:14:00::	B	B	B	AB	AB	AB	AB	B	 of conception''. An action once universally condemned by all Christian <font color=green>churches</font>  and forbidden by the civil law is now not only
church/NNS/br-f15/821	0.00921360398811013	-0.0177782043457964	church	NNS	orthodox_catholic_church%1:14:00::	B	B	B	AB	AB	AB	AB	B1	 the exception of the Roman Catholic and the Orthodox Catholic <font color=green>Churches</font> , most churches make no moral distinction between rhythm and mechanical
church/NNS/br-f15/824	0.0101814692374049	-0.0120067930075992	church	NNS	church%1:14:00::	B	B	B	AB	AB	AB	AB	B	 of the Roman Catholic and the Orthodox Catholic Churches, most <font color=green>churches</font>  make no moral distinction between rhythm and mechanical or chemical
church/NNS/br-f44/1106	0.116043917768565	0.0885595584310039	church	NNS	church%1:14:00::	C	C	B	CDE	C	AB	AB	B	 who will strengthen the social class nucleus of the congregation. <font color=green>Churches</font>  can be strengthened through this process of co-optation so long
church/NNS/br-f44/1189	0.0351425565527865	0.0319114238027907	church	NNS	church%1:14:00::	C	C	B	CDE	C	AB	AB	B	 and publicity in reaching new members. The proclamation of the <font color=green>churches</font>  is almost totally confined to pastoral contacts by the clergy
church/NNS/br-f44/124	0.154243568934856	0.173827967285753	church	NNS	church%1:14:00::	C	C	B	CDE	C	AB	AB	B	 inner city blight account for the decline of central city <font color=green>churches</font> . Central cities reveal two adverse features for the major denominations
church/NNS/br-f44/1262	0.112720238099135	0.0722764833822085	church	NNS	church%1:14:00::	C	C	B	CDE	C	AB	AB	B	 will account for a major share of recruitment by the <font color=green>churches</font> , making it quite evident that the extension of economic integration
church/NNS/br-f44/1427	0.0619277340532736	0.0409258162792112	church	NNS	church%1:14:00::	C	C	B	CDE	C	AB	AB	B	 for more than a single generation. The fact that metropolitan <font color=green>churches</font>  of the major denominations have moved approximately every generation for
church/NNS/br-f44/1475	0.0396564741530773	-0.0147804590530954	church	NNS	church%1:06:00::	D	D	D	CDE	DE	CDE	DE	D	 in religious life, when one recalls the number of city <font color=green>churches</font>  which deteriorated beyond repair before being abandoned, raises fundamental questions
church/NNS/br-f44/1683	0.0375593361204448	0.0496395185924904	church	NNS	church%1:14:00::	C	C	B	CDE	C	AB	AB	B	 hopelessly unstable environment. More than creatures of metropolitan forces, the <font color=green>churches</font>  have taken the lead in counteracting the interdependence of metropolitan
church/NNS/br-f44/1802	0.0596845667173721	0.033149748253737	church	NNS	church%1:14:00::	D	D	B	CDE	DE	AB	AB	B	 fight their way into the lower middle-class suburbs, and the <font color=green>churches</font>  will experience the same decay and rebuilding cycle which has
church/NNS/br-f44/1918	0.0341144533349675	-0.00869462477953944	church	NNS	church%1:14:00::	C	C	B	CDE	C	AB	AB	B	 of middle-class culture could lead to various projections for the <font color=green>churches</font> . It could be argued that any fellowship which centers in
church/NNS/br-f44/2015	0.0320620799928938	0.244267276216692	church	NNS	church%1:14:00::	C	C	B	CDE	C	AB	AB	B	 next chapter to the style of association in the denominational <font color=green>churches</font> ; this style is characteristically an expression of the communal style
church/NNS/br-f44/2181	-0.0440553917084488	0.211998039958995	church	NNS	church%1:14:00::	C	C	B	CDE	C	AB	AB	B	 have fashioned the iron cage of conformity which imprisons the <font color=green>churches</font>  in their suburban captivity. The perplexing question still remains as
church/NNS/br-f44/2201	0.0666462808913259	0.135445723405946	church	NNS	church%1:14:00::	C	C	B	CDE	C	AB	AB	B	 remains as to why the middle classes turn to the <font color=green>churches</font>  as a vehicle of social identity when their clubs and
church/NNS/br-f44/343	0.0485672087568873	0.0587454020476115	church	NNS	church%1:14:00::	C	C	B	CDE	C	AB	AB	B	 moreover, residential mobility is so high in metropolitan areas that <font color=green>churches</font>  have to recruit constantly in their core stratum in order
church/NNS/br-f44/868	-0.0465891838697534	0.0670959146685542	church	NNS	church%1:14:00::	C	C	B	CDE	C	AB	AB	B	 and congregational outreach have not been carefully studied in the <font color=green>churches</font> ; one study in Pittsburgh, however, has illuminated the situation. In
church/NNS/br-f44/890	0.0068526722185125	0.0743832965909803	church	NNS	church%1:14:00::	C	C	B	CDE	C	AB	AB	B	 the situation. In a sample of new members of Pittsburgh <font color=green>churches</font> , almost 60 per cent were recruited by initial`` contacts with
church/NNS/br-k01/769	-0.224854003751256	-0.0207120451159618	church	NNS	church%1:06:00::	D	D	D	CDE	DE	CDE	DE	D	 It was a Negro section of peeling row houses, store-front <font color=green>churches</font>  and ragged children. Rachel had to bend toward Scotty and
church/NNS/br-k04/2307	-0.0780336357803977	-0.00935344612105318	church	NNS	church%1:06:00::	B	B	D	AB	AB	CDE	DE	D	 his career in the Methodist church, if not in all <font color=green>churches</font> .
church/NNS/br-k06/1925	-0.408079336013277	-0.0779938371328344	church	NNS	church%1:06:00::	D	D	D	CDE	DE	CDE	DE	D	 them open. Lightning might strike the steeples of the other <font color=green>churches</font> ; not of Drew Church. A flash illumined the trees as
country/NN/br-b20/308	0.114465877365687	0.313264897030481	country	NN	country%1:15:00::	B4	B	B	B	B14	B	B1	B1	 that of diplomatic policy''. Morrison points out that since our <font color=green>country</font>  is more urbanized than the Soviet Union or Red China
country/NN/br-c01/621	-0.0353958151358849	0.418453713421748	country	NN	country%1:15:00::	B1	B	B	B	B14	B	B1	B1	 extraordinary, considers the finest house of its kind in the <font color=green>country</font> - and of course he does n't weep at the capacity
country/NN/br-c01/944	-0.245438413055665	0.221579689461776	country	NN	country%1:15:00::	B1	B	B	B	B14	B	B1	B1	 bookers, cancellation of one of the richest bookings in the <font color=green>country</font> . Will somebody please reopen the Auditorium? Paintings and drawings by
country/NN/br-d03/1509	-0.217981389147111	-0.207059711282277	country	NN	country%1:14:01::	B4	B	B	B	B14	B	BB2	B	 Faith of our Fathers: Mary 's prayers/ Shall win our <font color=green>country</font>  back to thee''. The English saints are widely venerated, quite
country/NN/br-d03/249	-0.0219376912234084	-0.322271435808635	country	NN	country%1:14:01::	B4	B	B	B	B14	B	BB2	B	 century literature of England, I knew only a Protestant dominated <font color=green>country</font> . Since arriving here, however, I have formed a far different
country/NN/br-e30/1177	0.186586210079878	0.214245085499663	country	NN	country%1:15:00::	B1	B	B	B	B14	B	B1	B1	 What 's your profit margin? In what section of the <font color=green>country</font>  are you located? Are you in a rural or urban
country/NN/br-f03/2248	-0.252245936235293	-0.341413527376292	country	NN	country%1:15:01::	A	A	A	A	A	A	A	A	 the convention, Depew was seated on the porch of a <font color=green>country</font>  home on the Hudson, gazing at the opposite shore.
country/NN/br-f13/1645	0.186586210079878	0.214245085499663	country	NN	country%1:15:01::	A	A	A	A	A	A	A	A	 a neighborhood of well-kept homes. There are slums in the <font color=green>country</font>  as well as in the city. Few rural areas are
country/NN/br-f15/2048	0.131558005463585	-0.253147504646346	country	NN	country%1:14:00::	B1	B	B	B	B14	B	BB2	B2	 translated into action by the majority of people in this <font color=green>country</font> . Repeated polls have disclosed that most married couples are now
country/NN/br-f15/664	0.407336903207073	-0.221845849946133	country	NN	country%1:14:00::	B	B	B	B	B14	B	BB2	B2	 necessities of life, the degree of population density of a <font color=green>country</font>  and the shortage of housing facilities may legitimately be taken
country/NN/br-f18/2329	0.062908376010721	-0.439358774949559	country	NN	country%1:15:00::	B1	B	B	B	B14	B	B1	B1	 have been satisfied to have staid at home when my <font color=green>country</font>  is invaded by a thievin foe By a set of
country/NN/br-f23/1643	0.242895244025735	-0.391800440311923	country	NN	country%1:14:00::	B2	B	B	B	B23	B	BB2	B2	 first stage of a Communist takeover is to`` neutralize'' a <font color=green>country</font> . The second stage is to retain the nominal classification of
country/NN/br-g18/1249	0.0968369375013557	-0.190896144287301	country	NN	country%1:14:01::;1:15:00::	B4	B	B	B	B14	B	BB2	B	 little patience with collective mediocrity. He saw Sweden as a <font color=green>country</font>  of smug and narrow provincialism, indifferent to the heroic spirit
country/NN/br-g18/1754	0.433156820712142	-0.12118050245108	country	NN	country%1:14:01::	B4	B	B	B	B14	B	BB2	B	 an invasion of Russia and each brought ruin on the <font color=green>country</font>  that worshipped him. Each is still glorified as a national
country/NN/br-g23/17	0.114465877365687	0.313264897030481	country	NN	country%1:14:00::	B4	B	B	B	B14	B	BB2	B2	 Woodrow Wilson 's administration, a red scare developed in our <font color=green>country</font> . Many Americans reacted irrationally to the challenge of Russia and
country/NN/br-g28/1507	0.149427150182148	0.449280815844333	country	NN	back_country%1:15:00::	A	A	A	A	A	A	A	A	 William Byrd described the Lubberlanders he encountered in the back <font color=green>country</font>  of Virginia and North Carolina. The chief literary antecedents of
country/NN/br-g28/2097	0.102765680529833	-0.424203161479282	country	NN	country%1:15:00::	A1	A	B	A	A	B	B1	B1	 as a young man prepared to find in the new <font color=green>country</font>  the setting of romantic adventure and idealized beauty. But Thorpe
country/NN/br-h18/1813	0.238969386035121	0.209283211657538	country	NN	country%1:14:00::	B4	B	B	B	B14	B	BB2	B2	 action can hope to win public support, first in this <font color=green>country</font>  and then abroad? For the policy officer will know that
country/NN/br-h18/1847	0.43377039491628	-0.0453424432323157	country	NN	country%1:14:01::	B3	B	B	B	B23	B	BB2	B	 of policy will be conditioned by the readiness of the <font color=green>country</font>  to sustain it. He is interested in public opinion for
country/NN/br-h18/857	0.151450005144928	0.29453743031881	country	NN	country%1:15:00::	B1	B	B	B	B14	B	B1	B1	 the representatives of other agencies who are stationed in his <font color=green>country</font> . He is expected to supervise, to encourage, to direct, to
country/NN/br-j37/1184	0.273683682278925	0.310828836505798	country	NN	country%1:15:00::	B1	B	B	B	B14	B	B1	B1	 communication and understanding in the more remote areas of the <font color=green>country</font> , but it also served to minimize the national political value
country/NN/br-j37/958	0.426932494281894	0.0809137953756878	country	NN	country%1:14:00::	B2	B	B	B	B23	B	BB2	B2	 a developing country and evaluating their results. In the new <font color=green>country</font>  the electoral process is considered as a means of resolving
country/NN/br-j56/1063	-0.178107300605878	0.224448073172609	country	NN	country_club%1:14:00::	A	A	A	A	A	A	A	A	 had come into vogue, but also to witness the Ekwanok <font color=green>Country</font>  Club tournaments. New Yorkers were kept informed of scores by
country/NN/br-k03/444	0.103210276229235	0.159387857932411	country	NN	country%5:00:01:rural:00	A	A	A	A	A	A	A	A	 or his own sentry. He was a wiry, inscrutable, silent <font color=green>country</font>  boy from the red clay of rural Alabama, and he
country/NN/br-k08/558	0.0427006017741646	0.455559281580521	country	NN	country%1:15:00::	A	A	B	A	A	B	B1	B1	 one day, while on a week 's visit to the <font color=green>country</font>  home of a retired Swiss jeweler, Rousseau amused the company
country/NN/br-k08/973	-0.231017060105477	0.300074661878865	country	NN	country%1:15:01::	A	A	A	A	A	A	A	A	 just for this once, for this one weekend in the <font color=green>country</font> , he would make a little piece out of his melodies
country/NN/br-k17/1981	-0.328994192980428	-0.375404559260944	country	NN	country%1:15:00::	B4	B	B	B	B14	B	B1	B1	 I 've lost faith, Styka. I used to love this <font color=green>country</font>  and believe that someday we 'd win our battle for
country/NN/br-k25/869	0.238969386035121	0.209283211657538	country	NN	country%1:15:00::	B1	B	B	B	B14	B	B1	B1	 shawl over her head, which she had bought in that <font color=green>country</font>  during one of their trips abroad, and handed him a
country/NN/br-l11/1246	-0.231017060105477	0.300074661878865	country	NN	country%1:15:01::	A	A	A	A	A	A	A	A	 a manner Esquire might suggest for the outdoor man 's <font color=green>country</font>  weekend. Dark gray sports jacket, lighter gray slacks, pink flannel
country/NN/br-n09/1051	0.373174533701366	0.336606030035358	country	NN	country%1:15:01::	A	A	A	A	A	A	A	A	 distant derrick of the wildcat- a test well in unexplored <font color=green>country</font> . And even with her limited knowledge of such things, she
country/NN/br-n11/2133	-0.118117764148585	-0.321577835846849	country	NN	country%1:15:02::	A1	A	A	A	A	A	A	A1	 to frighten three rustling homesteaders out of the Upper Laramie <font color=green>country</font>  in a single week.`` My reputation 's my stock in
country/NNS/br-b13/1273	0.295504660298748	-0.3575392695258	country	NNS	country%1:15:00::	B1	B	B	B	B14	B	B1	B1	 desire to visit the`` smaller, less traveled and relatively inexpensive <font color=green>countries</font> '', and is now prepared to teach modern Greek and Portuguese
country/NNS/br-f14/1851	0.124788576646984	0.0182883413644371	country	NNS	country%1:15:00::	B1	B	B	B	B14	B	B1	B1	 of the Jews in Germany and later in the occupied <font color=green>countries</font>  contributed to terrorizing the populations, splitting apart individuals and groups
country/NNS/br-f14/2054	0.154586110949294	-0.185903321453691	country	NNS	country%1:14:00::	B	B	B	B	B14	B	BB2	B2	 to post before the world the contrasting fates of the <font color=green>countries</font>  in which the Final Solution was aided by native Jew
country/NNS/br-f14/2151	0.271454492202888	-0.0852873744893848	country	NNS	country%1:14:00::	B1	B	B	B	B14	B	BB2	B2	 Was n't this meaning of Eichmann 's experience in various <font color=green>countries</font>  worth highlighting? As the first collective confrontation of the Nazi
country/NNS/br-f15/1446	-0.0376308649313783	-0.0899101399444357	country	NNS	country%1:14:00::	B4	B	B	B	B14	B	BB2	B2	 This was generally reflected in the civil laws of Christian <font color=green>countries</font> . Today, the Roman Catholic and Orthodox Churches stand virtually alone
country/NNS/br-f15/290	0.138773722066386	0.0461462249614032	country	NNS	country%1:14:00::	B3	B	B	B	B23	B	BB2	B2	 including birth-control information and material in foreign aid to underdeveloped <font color=green>countries</font> . Where it is not actually erupting, it rumbles and smolders
country/NNS/br-f23/2029	0.0551569167038149	0.258731514215239	country	NNS	country%1:14:00::	B2	B	B	B	B23	B	BB2	B2	 a Soviet bridgehead ninety miles off our coast. In some <font color=green>countries</font>  the trend has gone further than others: Mexico, Panama, and
country/NNS/br-g12/2313	0.236065219516093	0.0449084216994882	country	NNS	country%1:14:00::	B4	B	B	B	B14	B	BB2	B2	 the technological and economic revolutions now going on in the <font color=green>countries</font>  of Asia and Africa, and also of course on how
country/NNS/br-g18/2235	0.194689810801096	-0.100378922887661	country	NNS	country%1:14:01::	B	B	B	B	B14	B	BB2	B	 a perfect introduction to Swedish history for readers of other <font color=green>countries</font> . Some of the earlier episodes have touches of the supernatural
country/NNS/br-h09/1266	0.180836650337207	0.091595559006406	country	NNS	country%1:14:00::	B1	B	B	B	B14	B	BB2	B2	 expended in cooperation with public or private agencies in foreign <font color=green>countries</font>  in the development of processes useful to the program in
country/NNS/br-h13/1532	0.174443882163916	-0.122754449536057	country	NNS	country%1:14:00::	B2	B	B	B	B23	B	BB2	B2	 years the United States had been trying to get these <font color=green>countries</font>  to exclude Castro 's representative from secret military talks. But
country/NNS/br-h13/2195	0.42829955253465	-0.0895449877803984	country	NNS	country%1:14:00::	B2	B	B	B	B23	B	BB2	B2	 without discrimination. Once these conditions of international law are met, <font color=green>countries</font>  that try to run to blockade do so at their
country/NNS/br-h13/2315	0.170294505714507	0.0159764752244859	country	NNS	country%1:14:00::	B3	B	B	B	B23	B	BB2	B2	 coming from Russia and Czechoslovakia. Shipments of arms from Western <font color=green>countries</font>  could similarly be seized as contraband. In a total blockade
country/NNS/br-h21/1267	0.140533002900489	0.0231064324317464	country	NNS	country%1:14:00::	B1	B	B	B	B14	B	BB2	B2	 a rider which limits competitive bidding by firms in other <font color=green>countries</font>  on certain military supply items. As I have repeatedly stated
country/NNS/br-j10/1243	0.173960019616141	0.0426250109798555	country	NNS	european_country%1:15:00::	B2	B	B	B	B23	B	B1	B1	 the`` cuckoo bumblebee'' as it is called in some European <font color=green>countries</font> . Female individuals of Psithyrus look deceptively like the workers and
country/NNS/br-j22/1309	0.269005251072043	0.0445199395358216	country	NNS	country%1:14:00::	B3	B	B	B	B23	B	BB2	B2	 At a third stage in the modernization process are such <font color=green>countries</font>  as India, Brazil, the Philippines, and Taiwan, which are ready
country/NNS/br-j22/1375	0.432542910179751	0.161819069780636	country	NNS	country%1:14:00::	B3	B	B	B	B23	B	BB2	B2	 in the program to wider and wider groups. But these <font color=green>countries</font>  have made big strides toward developing the necessary human and
country/NNS/br-j22/1437	0.222039802966673	0.0575009424857792	country	NNS	country%1:14:00::	B3	B	B	B	B23	B	BB2	B2	 economies. On the economic front, the first priority of these <font color=green>countries</font>  is to mobilize a vastly increased volume of resources. Several
country/NNS/br-j22/1464	0.186179168676067	0.0569308041575518	country	NNS	country%1:14:00::	B3	B	B	B	B23	B	BB2	B2	 carried out if self-sustaining growth is to be achieved. These <font color=green>countries</font>  must formulate a comprehensive, long-term program covering the objectives of
country/NNS/br-j22/171	0.173733614164889	-0.193225853583468	country	NNS	country%1:14:00::	B2	B	B	B	B23	B	BB2	B2	 and dangerous consequences of social change which have troubled other <font color=green>countries</font>  passing through this stage can be escaped. The United States
country/NNS/br-j22/194	0.21634080212179	-0.046803425731874	country	NNS	country%1:14:00::	B2	B	B	B	B23	B	BB2	B2	 help by communicating a genuine concern with the problems these <font color=green>countries</font>  face and a readiness to provide technical and other appropriate
country/NNS/br-j22/1968	0.340409499453412	-0.159210980169911	country	NNS	country%1:14:00::	B4	B	B	B	B14	B	BB2	B2	 to take seriously their claims to being democratic and free <font color=green>countries</font> ; we also have, in consequence, the duty to appraise realistically
country/NNS/br-j22/2116	-0.0650262058725404	0.257223646079445	country	NNS	country%1:14:00::	B3	B	B	B	B23	B	BB2	B2	 generate. It follows that any effective policy toward the underdeveloped <font color=green>countries</font>  must have a realistically long working horizon. It must be
country/NNS/br-j22/257	0.215861365838833	-0.00610529921079224	country	NNS	country%1:14:00::	B3	B	B	B	B23	B	BB2	B2	 and the lack of cohesion and stability which characterize these <font color=green>countries</font>  may make them particularly prone to diversions and external adventures
