id	model.x	model.y	lemma	wf	pos	genre	broad_genre	marisense	mbroad	mari3	mari2	sensekey	wnsense	wnbroad	wn3	wn2	text	cues	cues_with_weight	mean_weight_x100	wcratio_x100	weighted_cw	new_pos	new_broad_genre
state/NN/br-a14/1611	0.260068712117342	-0.285351261690197	state	States	NN	press_reportage	press	A5	A	AB	ABC	Z	Z	Z	Z	Z	 is Ray Ainsley, who achieved a 19 in the United <font color=green>States</font>  Open. Their secondary hero is another pro, Willie Chisholm, who	1	0	89	0	4	NNPS	press
state/NN/br-a16/2394	-0.160494142090177	0.200572641360797	state	state	NN	press_reportage	press	A2	A	AB	ABC	Z	Z	Z	Z	Z	 start lessons, too, pronto. A cheer here for Francis Lorenz, <font color=green>state</font>  treasurer, who will meet with the probate advisory board of	3	1	72	33	3	NN	press
state/NN/br-a16/589	-0.217446580253195	0.102939304789704	state	States	NN	press_reportage	press	A5	A	AB	ABC	Z	Z	Z	Z	Z	 club will fete George E. Barnes, president of the United <font color=green>States</font>  Lawn Tennis association, at a cocktail party and buffet supper	1	0	99	0	4	NNPS	press
state/NN/br-a19/1618	-0.0650611279327298	0.121749654674904	state	State	NN	press_reportage	press	C	C	C	ABC	Z	Z	Z	Z	Z	 L. Simpkins, his administrative assistant, as Maryland 's Secretary of <font color=green>State</font> . Mr. Simpkins will move into the post being vacated by	3	3	161	100	6	NNP	press
state/NN/br-a19/871	-0.0803329015822944	0.0781930522022084	state	State	NN	press_reportage	press	A3	A	AB	ABC	Z	Z	Z	Z	Z	 the school boards in the State do not do so. <font color=green>State</font>  Senator Joseph A. Bertorelli( D., First Baltimore) had a stroke	2	1	76	50	5	NNP	press
state/NN/br-a20/1595	-0.0672546020821873	0.0390298323752712	state	States	NN	press_reportage	press	A5	A	AB	ABC	Z	Z	Z	Z	Z	 grievances''.`` In the same five year period that the United <font color=green>States</font>  says they[ the detectives] were engaged in this conspiracy'', Sokol	1	0	81	0	5	NNPS	press
state/NN/br-a20/1653	-0.189981029810565	0.148754538100219	state	States	NN	press_reportage	press	A5	A	AB	ABC	Z	Z	Z	Z	Z	 mayor 's medal''. In opening, D. Arthur Connelly, assistant United <font color=green>States</font>  attorney, read the indictment, but made no comments. Attorneys for	1	0	135	0	8	NNPS	press
state/NN/br-a20/22	-0.0119919992689631	-0.250454150941275	state	States	NN	press_reportage	press	A5	A	AB	ABC	Z	Z	Z	Z	Z	 submarine, the Dreadnought, and, by implication, of the entire United <font color=green>States</font>  navy 's still-building nuclear sub fleet, were stolen by a	1	0	117	0	4	NNPS	press
state/NN/br-a20/55	0.0143480202297724	-0.0620264498852024	state	States	NN	press_reportage	press	A5	A	AB	ABC	Z	Z	Z	Z	Z	 The Dreadnought was built on designs supplied by the United <font color=green>States</font>  in 1959 and was launched last year. It is a	1	0	98	0	5	NNPS	press
state/NN/br-a20/89	0.017356807774651	-0.421063763592157	state	States	NN	press_reportage	press	A5	A	AB	ABC	Z	Z	Z	Z	Z	 It has a hull patterned on that of the United <font color=green>States</font>  navy 's Nautilus, the world 's first atomic submarine. Its	1	0	109	0	4	NNPS	press
state/NN/br-a20/903	0.131391739387116	0.0121178068355968	state	States	NN	press_reportage	press	A5	A	AB	ABC	Z	Z	Z	Z	Z	 Britain that had been imposed after Fuchs blabbed. The United <font color=green>States</font>  offered to supply a complete set of propelling equipment like	1	0	62	0	5	NNPS	press
state/NN/br-a21/1761	0.100173877938451	0.0430417153444686	state	States	NN	press_reportage	press	A5	A	AB	ABC	Z	Z	Z	Z	Z	 made after a cabinet decision was to request the United <font color=green>States</font>  to establish a full-fledged military assistance group instead of the	3	2	102	67	7	NNPS	press
state/NN/br-a21/2151	0.0448372879450609	-0.253194958858982	state	state	NN	press_reportage	press	B	B	AB	ABC	Z	Z	Z	Z	Z	 concentration camps in Siberia as political prisoners of the Soviet <font color=green>state</font> , few emerge in the West to tell about it. M.	2	1	82	50	6	NN	press
state/NN/br-a22/102	0.014043944043564	0.00410496567463403	state	state	NN	press_reportage	press	A3	A	AB	ABC	Z	Z	Z	Z	Z	 Negroes. The statement explained that under the Georgia Constitution and <font color=green>state</font>  law, tax-exempt status is granted to educational institutions only if	3	2	72	67	9	NN	press
state/NN/br-a22/1928	-0.0625881224707279	-0.416154233526951	state	state	NN	press_reportage	press	A2	A	AB	ABC	Z	Z	Z	Z	Z	 acres infested by the ants, according to W. E. Blasingame <font color=green>state</font>  entomologist. Low-flying planes will spread a granular-type chemical, heptachlor, over	1	0	183	0	3	NN	press
state/NN/br-a22/23	0.0265907275485248	0.0337522808547984	state	state	NN	press_reportage	press	A	A	AB	ABC	Z	Z	Z	Z	Z	 to accept students of any race as soon as the <font color=green>state</font>  's tax laws made such a step possible.`` Emory University	2	2	109	100	6	NN	press
state/NN/br-a22/299	-0.00308875948101195	-0.0662375864470783	state	state	NN	press_reportage	press	A1	A	AB	ABC	Z	Z	Z	Z	Z	 but their tax-exempt status never has been challenged by the <font color=green>state</font> . Emory is affiliated with the Methodist Church. Some church leaders	3	2	45	67	6	NN	press
state/NN/br-a22/81	-0.0744311108177214	0.0580768344930034	state	state	NN	press_reportage	press	A3	A	AB	ABC	Z	Z	Z	Z	Z	 man Emory board at its annual meeting Friday noted that <font color=green>state</font>  taxing requirements at present are a roadblock to accepting Negroes	2	2	93	100	9	NN	press
state/NN/br-a23/1578	-0.0867327738938923	0.112242714156707	state	States	NN	press_reportage	press	A5	A	AB	ABC	Z	Z	Z	Z	Z	 over the 4500 other Junior Achievement companies in the United <font color=green>States</font>  and Canada. The award is the first such honor in	1	0	81	0	7	NNPS	press
state/NN/br-a23/32	0.0209229885039311	0.0423917025414506	state	state	NN	press_reportage	press	A1	A	AB	ABC	Z	Z	Z	Z	Z	 to handle an unusually high summer month 's need, the <font color=green>state</font>  public welfare commission was told Friday. It is the only	3	3	105	100	8	NN	press
state/NN/br-a23/47	-0.0428764515340289	0.0410869728935053	state	state	NN	press_reportage	press	A4	A	AB	ABC	Z	Z	Z	Z	Z	 was told Friday. It is the only county in the <font color=green>state</font>  so far this month reporting a possible shortage in GA	1	1	69	100	7	NN	press
state/NN/br-a23/505	0.0743711454024423	0.0215708739473887	state	state	NN	press_reportage	press	A3	A	AB	ABC	Z	Z	Z	Z	Z	 completed, he said, and added Field 's long service in <font color=green>state</font>  government and welfare employ gave him familiarity with the welfare	2	2	171	100	5	NN	press
state/NN/br-a23/69	0.0936827831389487	0.183638740606392	state	state	NN	press_reportage	press	A1	A	AB	ABC	Z	Z	Z	Z	Z	 category, for which emergency allotment can be given by the <font color=green>state</font>  if necessary. William Smythe, director of field service, told the	2	1	102	50	6	NN	press
state/NN/br-a24/1016	-0.00430103931730903	0.0571327471140525	state	state	NN	press_reportage	press	A3	A	AB	ABC	Z	Z	Z	Z	Z	 could not be reached for comment. In its ruling, the <font color=green>state</font>  Board of Education upheld Dr. Michael F. Walsh, state commissioner	3	2	146	67	8	NN	press
state/NN/br-a24/1026	-0.00808305285578887	0.0598066280134125	state	state	NN	press_reportage	press	A2	A	AB	ABC	Z	Z	Z	Z	Z	 the state Board of Education upheld Dr. Michael F. Walsh, <font color=green>state</font>  commissioner of education, who had ruled previously that the Warwick	3	3	146	100	9	NN	press
state/NN/br-a24/1090	-0.0181669320564732	0.0795212228348614	state	state	NN	press_reportage	press	A1	A	AB	ABC	Z	Z	Z	Z	Z	 Rosella Lovett of Cranston were awarded$ 55000 damages from the <font color=green>state</font>  in Superior Court yesterday for industrial property which they owned	4	2	116	50	6	NN	press
state/NN/br-a24/1180	0.0255045405189956	0.148066805890522	state	state	NN	press_reportage	press	A1	A	AB	ABC	Z	Z	Z	Z	Z	 and a valuation of$ 52500 placed on it by the <font color=green>state</font>  's expert. The property included a one-story brick manufacturing building	1	0	98	0	6	NN	press
state/NN/br-a24/1213	-0.223301765770912	0.154933797549169	state	state	NN	press_reportage	press	A1	A	AB	ABC	Z	Z	Z	Z	Z	 the owners. Atty. Gen. J. Joseph Nugent appeared for the <font color=green>state</font> . Santa 's lieutenants in charge of the Journal-Bulletin Santa Claus	3	0	103	0	6	NN	press
state/NN/br-a24/706	-0.011917684061091	-0.0155909859572385	state	state	NN	press_reportage	press	A3	A	AB	ABC	Z	Z	Z	Z	Z	 the firm 's 25 workers joined before striking, said the <font color=green>state</font>  Labor Relations Board has been asked to set up an	3	1	86	33	7	NN	press
state/NN/br-a24/942	-0.019494756800501	0.099654269084326	state	state	NN	press_reportage	press	A3	A	AB	ABC	Z	Z	Z	Z	Z	 of a coordinator of audio-visual education may go to the <font color=green>state</font>  Supreme Court, it appeared last night. Two members of the	2	1	150	50	4	NN	press
state/NN/br-a24/972	-0.0327949667821661	0.112503887107959	state	state	NN	press_reportage	press	A3	A	AB	ABC	Z	Z	Z	Z	Z	 they probably would vote to appeal a ruling by the <font color=green>state</font>  Board of Education, which said yesterday that the school committee	4	3	115	75	7	NN	press
state/NN/br-a25/1208	0.0397338219394838	-0.0561498453585733	state	state	NN	press_reportage	press	D	D	D	D	Z	Z	Z	Z	Z	 such grisly surprise attack. The only way out of this <font color=green>state</font>  of affairs is agreement to abolish nuclear weapons; otherwise no	2	1	71	50	8	NN	press
state/NN/br-a28/1391	0.0598015196368906	0.172645934042208	state	state	NN	press_reportage	press	A3	A	AB	ABC	Z	Z	Z	Z	Z	 the benefit received. A rule on the Federal deductibility of <font color=green>state</font>  taxes is contested. A realty corporation in Louisiana owed no	3	2	94	67	8	NN	press
state/NN/br-a28/1454	0.0310011561421342	0.106561447633297	state	state	NN	press_reportage	press	A3	A	AB	ABC	Z	Z	Z	Z	Z	 corporation, in filing its final Federal income return, claimed the <font color=green>state</font>  tax payment as a deductible expense, as permitted under U.	3	2	113	67	8	NN	press
state/NN/br-a28/2021	0.00640780735981442	0.0216342605529443	state	state	NN	press_reportage	press	A	A	AB	ABC	Z	Z	Z	Z	Z	 to be absorbed in the higher area tax. The Washington <font color=green>state</font>  supreme court ruled that the state 's occupation tax applied	4	4	166	100	10	NN	press
state/NN/br-a28/2027	0.00633242443567184	0.0224686870065365	state	state	NN	press_reportage	press	A	A	AB	ABC	Z	Z	Z	Z	Z	 area tax. The Washington state supreme court ruled that the <font color=green>state</font>  's occupation tax applied to sales, made at cost to	6	5	162	83	11	NN	press
state/NN/br-a28/2062	0.0617584650129995	0.11098328568393	state	state	NN	press_reportage	press	A	A	AB	ABC	Z	Z	Z	Z	Z	 certain supplies without divulging the identity of the parent. The <font color=green>state</font>  's occupation tax is computed on gross sales. The court	4	3	122	75	9	NN	press
state/NN/br-a29/831	-0.143352940226116	0.151271477853793	state	state	NN	press_reportage	press	A3	A	AB	ABC	Z	Z	Z	Z	Z	 trustees of the Dallas Museum of Fine Arts. She is <font color=green>state</font>  chairman for the New Mexico Tuberculosis and Cancer Associations. Both	3	0	95	0	6	NN	press
state/NN/br-a33/1770	-0.0369525459846602	0.298736121320903	state	States	NN	press_reportage	press	A5	A	AB	ABC	Z	Z	Z	Z	Z	 Accepted Scottish Rite for the Southern Jurisdiction of the United <font color=green>States</font> . The opening session of the 5- day session will begin	1	0	170	0	5	NNPS	press
state/NN/br-a33/719	-0.112230189304886	-0.0743930826527362	state	States	NN	press_reportage	press	A5	A	AB	ABC	Z	Z	Z	Z	Z	 being done in dozens of schools stretching across the United <font color=green>States</font> - schools where devoted teachers are studying with interested young men	1	0	67	0	8	NNPS	press
state/NN/br-a33/830	0.17784187881685	-0.0938388522488429	state	States	NN	press_reportage	press	A5	A	AB	ABC	Z	Z	Z	Z	Z	 and their work is being duplicated all across the United <font color=green>States</font> .`` This is a great national cultural asset, and therefore it	1	0	38	0	4	NNPS	press
state/NN/br-a34/673	0.249624266794899	0.0430668234469057	state	States	NN	press_reportage	press	A5	A	AB	ABC	Z	Z	Z	Z	Z	 it unnecessary. He wanted time, too, to review the United <font color=green>States</font> ' global commitments and to test both the policies he had	1	0	170	0	4	NNPS	press
state/NN/br-a35/1027	0.144572779570567	-0.0729433881163117	state	state	NN	press_reportage	press	A2	A	AB	ABC	Z	Z	Z	Z	Z	 be acclimatized to the democratic processes of the secular or <font color=green>state</font>  university. And while no one expects total democracy on the	3	3	124	100	7	NN	press
state/NN/br-a36/316	0.0459276660198568	0.0231810688353023	state	States	NN	press_reportage	press	A5	A	AB	ABC	Z	Z	Z	Z	Z	 by the new workers. The company has billed the United <font color=green>States</font>  Government for$ 7500000 of these expenses under the Defense Department	1	0	115	0	6	NNPS	press
state/NN/br-a37/13	-0.0358786406136311	0.137205660890032	state	State	NN	press_reportage	press	C	C	C	ABC	Z	Z	Z	Z	Z	 a closed-door session on Capitol Hill last week, Secretary of <font color=green>State</font>  Christian Herter made his final report to the Senate Foreign	1	1	156	100	5	NNP	press
state/NN/br-a37/215	0.511371145690824	-0.017591338036346	state	States	NN	press_reportage	press	A5	A	AB	ABC	Z	Z	Z	Z	Z	 relations immediately.`` There is a limit to what the United <font color=green>States</font>  in self-respect can endure'', said the President.`` That limit has	1	0	104	0	2	NNPS	press
state/NN/br-a37/614	0.0903931131824686	-0.306627539293482	state	state	NN	press_reportage	press	B	B	AB	ABC	Z	Z	Z	Z	Z	 demands and agreed to the setting up of a Communist <font color=green>state</font> , North Viet Nam- which then, predictably, became a base for	2	0	143	0	5	NN	press
state/NN/br-a37/643	0.0913638012287393	-0.106491470018583	state	State	NN	press_reportage	press	C	C	C	ABC	Z	Z	Z	Z	Z	 neighboring South Viet Nam and Laos. The late Secretary of <font color=green>State</font>  John Foster Dulles considered the 1954 Geneva agreement a specimen	1	1	167	100	8	NNP	press
state/NN/br-a37/815	0.00117102850517018	-0.10052545583748	state	state	NN	press_reportage	press	D	D	D	D	Z	Z	Z	Z	Z	 Kennedy, and got a cool acknowledgment in reply. Considering the <font color=green>state</font>  of the whole world, the cold war 's three exposed	2	1	59	50	6	NN	press
state/NN/br-a40/1438	-0.456868368126178	0.0942149612760119	state	state	NN	press_reportage	press	B	B	AB	ABC	Z	Z	Z	Z	Z	 Beyeler arranged to sell$ 1500000 worth of Klees to the <font color=green>state</font>  of North Rhine-Westphalia, which will house them in a museum	3	1	55	33	3	NN	press
state/NN/br-a40/1776	-0.292327098964247	-0.185474429113157	state	state	NN	press_reportage	press	A2	A	AB	ABC	Z	Z	Z	Z	Z	 apply again. Charlayne was`` tentatively'' admitted for next fall, after <font color=green>state</font>  investigators questioned her white roommate at Wayne State. But Holmes	1	1	101	100	3	NN	press
state/NN/br-a40/1996	-0.0685947027087604	-0.311431745726452	state	state	NN	press_reportage	press	A1	A	AB	ABC	Z	Z	Z	Z	Z	 had it not been for their race and color''. The <font color=green>state</font>  will appeal- but few think it will actually try to	1	1	109	100	3	NN	press
state/NN/br-a41/564	0.0761815679651638	0.0152901626214882	state	States	NN	press_reportage	press	A5	A	AB	ABC	Z	Z	Z	Z	Z	 companies producing agricultural products were lumped together, with the United <font color=green>States</font>  government as a heavy partner''. Had they been truly ruthless	1	0	112	0	5	NNPS	press
state/NN/br-a42/1772	-0.178423393347521	-0.250698098317096	state	state	NN	press_reportage	press	A3	A	AB	ABC	Z	Z	Z	Z	Z	 on charges of kidnapping and transporting a stolen plane across <font color=green>state</font>  lines.( Bearden reportedly hoped to peddle the plane to Castro	2	0	95	0	4	NN	press
state/NN/br-a44/251	0.0879603075644909	0.0161812266592831	state	state	NN	press_reportage	press	A3	A	AB	ABC	Z	Z	Z	Z	Z	 co-operative movement has begun to grow, under the wing of <font color=green>state</font>  governments, whereby, with the financial help of the state, libraries	2	1	130	50	5	NN	press
state/NN/br-a44/262	0.0961237776406433	0.0268561194600469	state	state	NN	press_reportage	press	A1	A	AB	ABC	Z	Z	Z	Z	Z	 of state governments, whereby, with the financial help of the <font color=green>state</font> , libraries share their book resources on a county-wide or regional	6	4	125	67	6	NN	press
state/NN/br-a44/311	0.144864129369614	-0.00566220336279074	state	state	NN	press_reportage	press	A4	A	AB	ABC	Z	Z	Z	Z	Z	 for others to follow. Because it is so large a <font color=green>state</font> , with marked contrasts in population density, the organization of the	3	2	83	67	4	NN	press
state/NN/br-a44/442	0.0571438661956981	0.0556086517492977	state	state	NN	press_reportage	press	A1	A	AB	ABC	Z	Z	Z	Z	Z	 systems financed by county governments with matching funds from the <font color=green>state</font> . It was a step in the right direction, but it	3	3	120	100	8	NN	press
state/NN/br-a44/675	-0.102341964533416	-0.118851634209367	state	state	NN	press_reportage	press	A4	A	AB	ABC	Z	Z	Z	Z	Z	 day, not too distant, when all the libraries in the <font color=green>state</font>  will belong to a co-op. To set up a co-operative	2	1	116	50	4	NN	press
state/NN/br-a44/764	0.10530545566531	0.140884599591402	state	state	NN	press_reportage	press	A3	A	AB	ABC	Z	Z	Z	Z	Z	 resources of a given area for maximum efficiency. The basic <font color=green>state</font>  grant is thirty cents for each person served, and there	2	1	103	50	7	NN	press
state/NN/br-a44/829	-0.0169136404647912	0.00727655964179386	state	state	NN	press_reportage	press	A1	A	AB	ABC	Z	Z	Z	Z	Z	 of New York City, the system is credited by the <font color=green>state</font>  with serving one million persons, a figure that has doubled	3	3	60	100	7	NN	press
state/NN/br-b01/1030	-0.0953451155446857	0.204516811346835	state	state	NN	press_editorial	press	C	C	C	ABC	Z	Z	Z	Z	Z	 rapidly. Touring Africa, the new U. S. assistant secretary of <font color=green>state</font>  observed`` Africa should be for the Africans'' and the British	1	1	132	100	6	NN	press
state/NN/br-b01/1074	0.088234829457766	-0.0611364478214964	state	state	NN	press_editorial	press	A	A	AB	ABC	Z	Z	Z	Z	Z	 American imperialists, go home''. Chin up, Soapy. Confidence in the <font color=green>state</font>  's economic future is reflected in the Georgia Power Company	3	2	75	67	7	NN	press
state/NN/br-b01/115	0.0446631758254213	0.0102548163884432	state	state	NN	press_editorial	press	A	A	AB	ABC	Z	Z	Z	Z	Z	 and ways to finance them have become musts if the <font color=green>state</font>  in the next few years is to avoid crisis-to-crisis government	4	3	98	75	6	NN	press
state/NN/br-b01/1195	0.0473119797396495	0.114958138315458	state	state	NN	press_editorial	press	A1	A	AB	ABC	Z	Z	Z	Z	Z	 additional half-million dollars Gov. Vandiver allocated last year from the <font color=green>state</font>  surplus. Either way it sounds like a sizable hunk of	3	2	98	67	5	NN	press
state/NN/br-b01/1719	0.280012005172385	0.226065008187513	state	States	NN	press_editorial	press	A5	A	AB	ABC	Z	Z	Z	Z	Z	 his displeasure. He maintained amply financed lobbies in the United <font color=green>States</font>  and elsewhere which sycophantically chanted his praise, and his influence	1	0	121	0	3	NNPS	press
state/NN/br-b01/1749	-0.0692195244465912	0.0370002982250992	state	States	NN	press_editorial	press	A5	A	AB	ABC	Z	Z	Z	Z	Z	 year or so the profession of friendship with the United <font color=green>States</font>  had been an article of faith with Trujillo, and altogether	1	0	54	0	4	NNPS	press
state/NN/br-b01/1813	0.00917832909746136	-0.00446558462158946	state	States	NN	press_editorial	press	A5	A	AB	ABC	Z	Z	Z	Z	Z	 been cited for numerous aggressions in the Caribbean, the United <font color=green>States</font>  and many other members of the Organization of American States	1	0	110	0	7	NNPS	press
state/NN/br-b01/1823	0.0121766387030178	-0.00372427622795982	state	States	NN	press_editorial	press	B	B	AB	ABC	Z	Z	Z	Z	Z	 States and many other members of the Organization of American <font color=green>States</font>  broke diplomatic relations with him. Thereupon followed a demonstration that	3	3	105	100	8	NNPS	press
state/NN/br-b01/199	0.0313760715962289	0.00957462816653841	state	state	NN	press_editorial	press	A1	A	AB	ABC	Z	Z	Z	Z	Z	 teacher pensions, the ban on drag racing, acceptance by the <font color=green>state</font>  of responsibility for maintenance of state roads in municipalities at	5	4	126	80	7	NN	press
state/NN/br-b01/205	0.0363796208264955	0.0198497837348159	state	state	NN	press_editorial	press	A2	A	AB	ABC	Z	Z	Z	Z	Z	 racing, acceptance by the state of responsibility for maintenance of <font color=green>state</font>  roads in municipalities at the same rate as outside city	3	2	118	67	7	NN	press
state/NN/br-b01/288	0.0733221164417705	0.100833248544138	state	state	NN	press_editorial	press	A4	A	AB	ABC	Z	Z	Z	Z	Z	 question and its companion issue of attracting industry to the <font color=green>state</font> . The legislature expended most of its time on the schools	3	3	128	100	5	NN	press
state/NN/br-b01/329	-0.118461527651033	-0.0878082003907811	state	state	NN	press_editorial	press	A	A	AB	ABC	Z	Z	Z	Z	Z	 past have made Georgia look like anything but`` the empire <font color=green>state</font>  of the South''. We congratulate the entire membership on its	2	2	106	100	3	NN	press
state/NN/br-b01/614	0.0846694741685886	0.197356958444907	state	state	NN	press_editorial	press	A3	A	AB	ABC	Z	Z	Z	Z	Z	 Commission. Coupling its own budget of$ 83750 with a$ 30000 <font color=green>state</font>  grant authorized by Gov. Vandiver, the group expects to sign	3	2	173	67	5	NN	press
state/NN/br-b01/862	0.0653527540638487	-0.0766858140046991	state	State	NN	press_editorial	press	C	C	C	ABC	Z	Z	Z	Z	Z	 American military forces to fight conventional wars too, Secretary of <font color=green>State</font>  Rusk junks bluff and nuclear brinkmanship and builds more muscle	1	1	123	100	7	NNP	press
state/NN/br-b02/1239	-0.290576154909985	-0.11883282190735	state	state	NN	press_editorial	press	A2	A	AB	ABC	Z	Z	Z	Z	Z	 left an impression of quiet competence in his more protected <font color=green>state</font>  post. As Mayor, Mr. Levitt might turn out to be	2	1	84	50	5	NN	press
state/NN/br-b02/1715	0.139810603059212	-0.378149599657954	state	States	NN	press_editorial	press	A5	A	AB	ABC	Z	Z	Z	Z	Z	 2000 tough Viet Minh guerrilla fighters. But for the United <font color=green>States</font>  and its SEATO allies to attempt to shore up a	1	0	152	0	4	NNPS	press
state/NN/br-b02/1892	0.0438683352954973	-0.0310434289993338	state	State	NN	press_editorial	press	C	C	C	ABC	Z	Z	Z	Z	Z	 concept that for six years it bypassed as unreasonable. The <font color=green>State</font>  Department tacitly rejected the neutral Laos idea after the Geneva	1	1	116	100	7	NNP	press
state/NN/br-b02/1928	-0.0805969138845222	-0.0915406754930251	state	States	NN	press_editorial	press	A5	A	AB	ABC	Z	Z	Z	Z	Z	 neutral Premier Souvanna Phouma. But since last fall the United <font color=green>States</font>  has been moving toward a pro-neutralist position and now is	1	0	44	0	3	NNPS	press
state/NN/br-b02/2120	0.0100989345970787	0.0841731601093041	state	state	NN	press_editorial	press	A1	A	AB	ABC	Z	Z	Z	Z	Z	 federal funds. This year 's Senate measure would provide each <font color=green>state</font>  and the District of Columbia with$ 1000000 to be used	3	3	172	100	7	NN	press
state/NN/br-b02/2137	0.0763277114454516	0.051373142901817	state	state	NN	press_editorial	press	A3	A	AB	ABC	Z	Z	Z	Z	Z	 Columbia with$ 1000000 to be used in support of private, <font color=green>state</font> , or municipal ETV efforts. The funds would be used for	3	3	83	100	5	NN	press
state/NN/br-b02/272	0.00648991290276008	-0.201758318517321	state	States	NN	press_editorial	press	A5	A	AB	ABC	Z	Z	Z	Z	Z	 governments appears in notes which Britain, France, and the United <font color=green>States</font>  sent to Moscow after the latter 's gratuitous protest over	1	0	90	0	7	NNPS	press
state/NN/br-b02/901	0.122990700097765	0.0635301951083203	state	state	NN	press_editorial	press	A3	A	AB	ABC	Z	Z	Z	Z	Z	 specific prohibition. Why, then, with these voluntary barricades and some <font color=green>state</font>  laws barring liquor ads, is it necessary to seek congressional	3	1	100	33	6	NN	press
state/NN/br-b03/1650	-0.0899776953143818	-0.106885213165012	state	States	NN	press_editorial	press	A5	A	AB	ABC	Z	Z	Z	Z	Z	 six and a half times bigger than anything the United <font color=green>States</font>  has triggered experimentally- would certainly produce a bigger bang, and	1	0	83	0	2	NNPS	press
state/NN/br-b03/1880	-0.0972880880706125	-0.268027718753718	state	States	NN	press_editorial	press	A5	A	AB	ABC	Z	Z	Z	Z	Z	 Clock Shadow. The plane was sent back to the United <font color=green>States</font> , for a change, but Castro kept the crazy gunman, who	1	0	90	0	5	NNPS	press
state/NN/br-b03/1942	-0.386560351708467	-0.104274793864561	state	States	NN	press_editorial	press	A5	A	AB	ABC	Z	Z	Z	Z	Z	 by reading two secret American documents purloined from the United <font color=green>States</font>  embassy at Caracas, Venezuela. The contents were highly embarrassing to	1	0	70	0	2	NNPS	press
state/NN/br-b04/1971	0.040115722499039	0.00606255244153976	state	state	NN	press_editorial	press	A4	A	AB	ABC	Z	Z	Z	Z	Z	 commissions, boards and councils and other public agencies in this <font color=green>state</font>  exist to aid in the conduct of the people 's	5	3	84	60	10	NN	press
