id	model.x	model.y	lemma	wf	pos	genre	broad_genre	marisense	mbroad	mari3	mari2	sensekey	wnsense	wnbroad	wn3	wn2	text	cues	cues_with_weight	mean_weight_x100	wcratio_x100	weighted_cw	new_pos	new_broad_genre
state/NN/br-b04/2010	0.0611968009443893	-0.00611803796586414	state	state	NN	press_editorial	press	A4	A	AB	ABC	Z	Z	Z	Z	Z	 that their deliberations be conducted openly.`` The people of this <font color=green>state</font>  do not yield their sovereignty to the agencies that serve	3	2	90	67	8	NN	press
state/NN/br-b04/640	0.0980951249313751	0.0902961783773914	state	state	NN	press_editorial	press	A3	A	AB	ABC	Z	Z	Z	Z	Z	 consistently. So have the people 's elected spokesmen at the <font color=green>state</font>  and federal levels. Interama, as it rises, will be a	3	2	178	67	3	NN	press
state/NN/br-b04/697	0.215783573289524	-0.0469699020744569	state	States	NN	press_editorial	press	A5	A	AB	ABC	Z	Z	Z	Z	Z	 impressive 689- page compilation issued last week by the United <font color=green>States</font>  Commission on Civil Rights. Much happened in this field during	1	0	80	0	5	NNPS	press
state/NN/br-b04/715	-0.0648936095946459	0.0704539091935785	state	state	NN	press_editorial	press	A3	A	AB	ABC	Z	Z	Z	Z	Z	 happened in this field during the past 12 months. Each <font color=green>state</font>  advisory committee documented its own activity. Some accounts are quite	3	1	52	33	6	NN	press
state/NN/br-b04/830	0.0638778045007931	0.0402576336778227	state	state	NN	press_editorial	press	A3	A	AB	ABC	Z	Z	Z	Z	Z	 progressed in a sound and equitable program at both the <font color=green>state</font>  and local levels in its efforts to review and assess	3	3	126	100	7	NN	press
state/NN/br-b05/1334	-0.197097976466279	-0.123903316508691	state	state	NN	press_editorial	press	C	C	C	ABC	Z	Z	Z	Z	Z	 secretary 's neck may be spared. Cambodia 's chief of <font color=green>state</font> , who has been accused of harboring Communist marauders and otherwise	1	1	100	100	6	NN	press
state/NN/br-b05/142	0.0149897876978272	-0.168866057715242	state	States	NN	press_editorial	press	B	B	AB	ABC	Z	Z	Z	Z	Z	 responsive to Castro in Cuba. Within the Organization of American <font color=green>States</font> , there may be some criticism of this unilateral American intervention	4	3	115	75	6	NNPS	press
state/NN/br-b05/1875	-0.0371095152971335	-0.424175414968211	state	state	NN	press_editorial	press	A4	A	AB	ABC	Z	Z	Z	Z	Z	 herons, is threatened, but the battlefront extends far beyond our <font color=green>state</font> . Against the dramatic fight being waged for preservation of 30	3	0	48	0	4	NN	press
state/NN/br-b05/2071	-0.0110743964540614	0.00370818771825037	state	state	NN	press_editorial	press	A1	A	AB	ABC	Z	Z	Z	Z	Z	 has tagged the sanctuary as the kind of place the <font color=green>state</font>  hopes to include in its program to double its park	3	2	63	67	6	NN	press
state/NN/br-b05/268	0.227433888722801	0.271042918366206	state	States	NN	press_editorial	press	A5	A	AB	ABC	Z	Z	Z	Z	Z	 move with the speed and effectiveness demonstrated by the United <font color=green>States</font> . Those watching the growing rivalry between craft unions and industrial	1	0	72	0	5	NNPS	press
state/NN/br-b05/556	0.119486725024243	0.244569724735345	state	States	NN	press_editorial	press	A5	A	AB	ABC	Z	Z	Z	Z	Z	 Secretary Freeman 's claim that the high estate of United <font color=green>States</font>  agriculture is the`` strongest deterrent'' to the spread of communism	1	0	99	0	5	NNPS	press
state/NN/br-b05/804	-0.0169910756707073	0.018150965660945	state	State	NN	press_editorial	press	C	C	C	ABC	Z	Z	Z	Z	Z	 by Sen. Jackson of Washington has been going over the <font color=green>State</font>  Department and has reached some predictable conclusions. The department needs	1	1	100	100	9	NNP	press
state/NN/br-b06/1801	-0.0878400949180382	-0.201422132609786	state	States	NN	press_editorial	press	A5	A	AB	ABC	Z	Z	Z	Z	Z	 to an announcement that he will not recommend dispatching United <font color=green>States</font>  troops to bolster the Vietnamese Army. Gen. Taylor will report	1	0	89	0	4	NNPS	press
state/NN/br-b06/1981	0.0957140222445072	-0.169071428375825	state	States	NN	press_editorial	press	A5	A	AB	ABC	Z	Z	Z	Z	Z	 likely to happen, however, should prompt the sending of United <font color=green>States</font>  soldiers for other than instructional missions. The Indochina struggle was	1	0	96	0	5	NNPS	press
state/NN/br-b06/201	0.0183946658728759	-0.00346851394143004	state	state	NN	press_editorial	press	A	A	AB	ABC	Z	Z	Z	Z	Z	 impartial professional analysis of Missouri 's economy. He says the <font color=green>state</font> , in order to proceed with economic development, must develop an	3	3	68	100	8	NN	press
state/NN/br-b06/2054	0.0616656007620586	-0.0515098524677233	state	States	NN	press_editorial	press	A5	A	AB	ABC	Z	Z	Z	Z	Z	 that President Ngo Dinh Diem apparently does not want United <font color=green>States</font>  troops. He may want additional technical help, and this should	1	0	80	0	5	NNPS	press
state/NN/br-b06/2079	0.120900034804091	-0.0141553148597628	state	States	NN	press_editorial	press	A5	A	AB	ABC	Z	Z	Z	Z	Z	 be forthcoming. South Viet Nam has received$ 1450000000 in United <font color=green>States</font>  aid since 1954 and the rate of assistance has been	1	0	115	0	9	NNPS	press
state/NN/br-b06/2150	-0.190610144737256	-0.000429592750374622	state	States	NN	press_editorial	press	A5	A	AB	ABC	Z	Z	Z	Z	Z	 and that they will not lead to involving the United <font color=green>States</font>  in an Asian morass. Gov. John M. Dalton, himself a	1	0	52	0	3	NNPS	press
state/NN/br-b06/285	0.087313548205109	-0.014528592953218	state	state	NN	press_editorial	press	A	A	AB	ABC	Z	Z	Z	Z	Z	 conference. The University can make a valuable contribution to the <font color=green>state</font>  's economic development through such a study. In Southern Illinois	4	2	69	50	4	NN	press
state/NN/br-b07/1229	0.0190039604782022	-0.0152814462430202	state	States	NN	press_editorial	press	A5	A	AB	ABC	Z	Z	Z	Z	Z	 men of Latin America yesterday on behalf of the United <font color=green>States</font>  Government. He felt able to end on a note of	1	0	117	0	8	NNPS	press
state/NN/br-b07/2016	0.00174827419973221	0.00659874675519555	state	state	NN	press_editorial	press	D	D	D	D	Z	Z	Z	Z	Z	 doing his greatest service with his straightforward report on the <font color=green>state</font>  of the public schools. A fascinating letter has just reached	1	0	78	0	6	NN	press
state/NN/br-b07/202	0.204452287826308	-0.00175458649297745	state	States	NN	press_editorial	press	A5	A	AB	ABC	Z	Z	Z	Z	Z	 on`` as wide a geographical basis as possible''. The United <font color=green>States</font>  and its allies have had no objection to this. What	1	0	115	0	5	NNPS	press
state/NN/br-b07/293	-0.0965676927632182	0.183089073354405	state	States	NN	press_editorial	press	A5	A	AB	ABC	Z	Z	Z	Z	Z	 the nature of his relationship with them. Although the United <font color=green>States</font>  and the U. S. S. R. have been arguing whether	1	0	52	0	4	NNPS	press
state/NN/br-b07/452	0.353709570616837	-0.132276222342832	state	States	NN	press_editorial	press	A5	A	AB	ABC	Z	Z	Z	Z	Z	 instructions. This is the root issue for which the United <font color=green>States</font>  should stand. We should not become confused or let our	1	0	118	0	3	NNPS	press
state/NN/br-b08/1529	0.391725940036094	-0.179640917568819	state	state	NN	press_editorial	press	D	D	D	D	Z	Z	Z	Z	Z	 any secret recipe for certainty. In the fevered, intoxicating, breathless <font color=green>state</font>  of being in love the usual signposts that guide you	4	0	101	0	4	NN	press
state/NN/br-b11/1043	0.0573634235166678	-0.189888725345196	state	States	NN	press_editorial	press	A5	A	AB	ABC	Z	Z	Z	Z	Z	 played up artificially because it is needed by the United <font color=green>States</font>  to justify its arms drive''. The Soviet news agency TASS	1	0	92	0	4	NNPS	press
state/NN/br-b11/1246	0.0657079299926414	-0.0312888364892715	state	States	NN	press_editorial	press	A5	A	AB	ABC	Z	Z	Z	Z	Z	 the most vital domestic and foreign problems confronting the United <font color=green>States</font> . In fact, the world heard nothing but sabre-rattling, the same	1	0	64	0	7	NNPS	press
state/NN/br-b11/1305	0.0308132888287925	-0.0396683330354861	state	States	NN	press_editorial	press	A5	A	AB	ABC	Z	Z	Z	Z	Z	 to solve the internal and external problems besetting the United <font color=green>States</font>  and its NATO partners. Washington apparently decided to use an	1	0	95	0	10	NNPS	press
state/NN/br-b11/1370	0.004833724616393	-0.144662884317965	state	States	NN	press_editorial	press	A5	A	AB	ABC	Z	Z	Z	Z	Z	 U. S. President has shown once again that the United <font color=green>States</font>  needs the fanning of the West Berlin crisis to justify	1	0	78	0	4	NNPS	press
state/NN/br-b11/177	0.127528507753857	0.213853253699629	state	state	NN	press_editorial	press	A	A	AB	ABC	Z	Z	Z	Z	Z	 for a whole series of lesser candidate-picking conventions in the <font color=green>state</font>  's 38 new Congressional districts. At the head of the	4	1	146	25	5	NN	press
state/NN/br-b11/299	-0.0161251355503408	-0.131528283809993	state	state	NN	press_editorial	press	A3	A	AB	ABC	Z	Z	Z	Z	Z	 of any consequence belongs to the CDC. Moreover, the entire <font color=green>state</font>  Democratic hierarchy, from Gov. Brown on down to the county	4	2	96	50	5	NN	press
state/NN/br-b11/754	-0.0461782397087744	0.114337993026882	state	state	NN	press_editorial	press	A3	A	AB	ABC	Z	Z	Z	Z	Z	 CDC 's broad appeal. State Sen. Dick Richards will keynote; <font color=green>state</font>  and county committeemen, CDC directors and representatives, members of 16	2	1	120	50	8	NN	press
state/NN/br-b11/910	0.0290133868551505	-0.129755258812022	state	States	NN	press_editorial	press	A5	A	AB	ABC	Z	Z	Z	Z	Z	 's latest warning to the Communist world that the United <font color=green>States</font>  will build up its military strength to meet any challenge	1	0	82	0	7	NNPS	press
state/NN/br-b12/55	-0.0681764386929498	0.229678241539227	state	state	NN	press_editorial	press	A3	A	AB	ABC	Z	Z	Z	Z	Z	 34- hour week, all holidays off and fringe benefits including <font color=green>state</font>  contributions toward lawyers' fees. Some day we might see a	3	2	95	67	6	NN	press
state/NN/br-b12/673	0.00503645710662892	0.0673726204142933	state	States	NN	press_editorial	press	A5	A	AB	ABC	Z	Z	Z	Z	Z	 man who was instrumental in opening relations between the United <font color=green>States</font>  and Korea, Frederick T. Frelinghuysen, secretary of state in the	1	0	210	0	5	NNPS	press
state/NN/br-b12/683	-0.00131981747637794	0.0434156803738646	state	state	NN	press_editorial	press	C	C	C	ABC	Z	Z	Z	Z	Z	 the United States and Korea, Frederick T. Frelinghuysen, secretary of <font color=green>state</font>  in the administration of Chester A. Arthur. In addition Rep.	2	2	165	100	9	NN	press
state/NN/br-b12/706	-0.0028623639038811	0.0117751419908933	state	State	NN	press_editorial	press	C	C	C	ABC	Z	Z	Z	Z	Z	 's brother Harry was on the Korean desk of the <font color=green>State</font>  Department in World War 2,. Next year is the 80	1	1	76	100	6	NNP	press
state/NN/br-b12/732	0.0483842461269644	-0.368211077990337	state	States	NN	press_editorial	press	A5	A	AB	ABC	Z	Z	Z	Z	Z	 the signing of the treaty between Korea and the United <font color=green>States</font>  and experts in Seoul are trying to find the correspondence	1	0	169	0	4	NNPS	press
state/NN/br-b12/751	-0.0986780183647303	0.260018637090367	state	state	NN	press_editorial	press	C	C	C	ABC	Z	Z	Z	Z	Z	 find the correspondence between Frederick Frelinghuysen, who was secretary of <font color=green>state</font>  in 1883 and 1884, and Gen. Lucius Foote, who was	1	1	233	100	3	NN	press
state/NN/br-b14/1694	-0.0506182100091663	-0.0184854223199531	state	state	NN	press_editorial	press	A1	A	AB	ABC	Z	Z	Z	Z	Z	 Legislature go toward setting up a self-insurance system for the <font color=green>state</font>  in the midst of a governor 's race``? How unpartisan	3	3	94	100	8	NN	press
state/NN/br-b14/2011	-0.318486741937134	0.0627388667899353	state	state	NN	press_editorial	press	A4	A	AB	ABC	Z	Z	Z	Z	Z	 such a good one. Why not have them travel the <font color=green>state</font>  in November debating? It would present a forum for them	3	1	83	33	2	NN	press
state/NN/br-b14/2124	0.0431203176224358	0.0633580678795242	state	state	NN	press_editorial	press	B	B	AB	ABC	Z	Z	Z	Z	Z	 tour of debates, it can provide a service to the <font color=green>state</font> . But the Legislature should be granted the opportunity to complete	3	2	105	67	5	NN	press
state/NN/br-b15/2065	0.0272712209949255	0.0788772142475925	state	state	NN	press_editorial	press	A2	A	AB	ABC	Z	Z	Z	Z	Z	 hospitalization. The public should understand that whether they support a <font color=green>state</font>  hospital or a VA hospital, the tax dollar has to	4	4	112	100	6	NN	press
state/NN/br-b15/2108	0.0172317063865874	0.0597661900767199	state	state	NN	press_editorial	press	A2	A	AB	ABC	Z	Z	Z	Z	Z	 VA hospital or the tax dollar is spent for the <font color=green>state</font>  hospital. An adequate system of VA hospitals is better equipped	2	3	107	150	9	NN	press
state/NN/br-b15/2128	0.409508435241746	0.106996692131876	state	state	NN	press_editorial	press	A2	A	AB	ABC	Z	Z	Z	Z	Z	 better equipped to care for the veterans than any 50 <font color=green>state</font>  hospitals. It seems that open season upon veterans' hospitalization is	2	3	168	150	4	NN	press
state/NN/br-b15/2280	0.0766793986467879	0.0841460789366077	state	state	NN	press_editorial	press	A1	A	AB	ABC	Z	Z	Z	Z	Z	 they supported the Eisenhower administration which will cost a small <font color=green>state</font>  like ours approximately five million dollars( matched incidentally by a	4	1	84	25	6	NN	press
state/NN/br-b16/1030	-0.155813655213439	-0.033608880827821	state	state	NN	press_editorial	press	A3	A	AB	ABC	Z	Z	Z	Z	Z	 a member for more than 40 years, on the recent <font color=green>state</font>  convention. I regret that Bertha Madeira[ today 's`` Voice''] obtained	1	0	119	0	4	NN	press
state/NN/br-b16/117	-0.194334507229557	0.168449336742263	state	States	NN	press_editorial	press	A5	A	AB	ABC	Z	Z	Z	Z	Z	 our prestige and morale? If the President of the United <font color=green>States</font>  really feels he won himself a`` lousy job'', then heaven	1	0	97	0	5	NNPS	press
state/NN/br-b16/1654	-0.0203322049187637	0.236005444018348	state	States	NN	press_editorial	press	A5	A	AB	ABC	Z	Z	Z	Z	Z	 burden on du Pont stockholders, in connection with the United <font color=green>States</font>  Supreme court ruling that du Pont must divest itself of	1	0	196	0	4	NNPS	press
state/NN/br-b17/1171	-0.252250165060595	-0.0191128043349807	state	State	NN	press_editorial	press	A3	A	AB	ABC	Z	Z	Z	Z	Z	 of the men in the toll booths on the Garden <font color=green>State</font>  Parkway. Recently I traveled the parkway from East Orange to	2	1	72	50	4	NNP	press
state/NN/br-b17/201	0.118437935478174	0.114943694643853	state	States	NN	press_editorial	press	A5	A	AB	ABC	Z	Z	Z	Z	Z	 nurses or city employes- but as citizens of the United <font color=green>States</font> . Sir- I read of a man who felt he should	1	0	131	0	3	NNPS	press
state/NN/br-b17/476	0.0340608575774329	-0.104085669932945	state	States	NN	press_editorial	press	A5	A	AB	ABC	Z	Z	Z	Z	Z	 a separate political entity. It is high time the United <font color=green>States</font>  began to realize that the God-given rights of men set	1	0	99	0	5	NNPS	press
state/NN/br-b17/565	0.339050185803737	-0.0774821652083581	state	States	NN	press_editorial	press	A5	A	AB	ABC	Z	Z	Z	Z	Z	 natural standards, they were justified in doing so. The United <font color=green>States</font>  and the U. N. denounce their own principles when they	1	0	43	0	3	NNPS	press
state/NN/br-b18/1111	0.153043734355779	0.0408114240995059	state	States	NN	press_editorial	press	A5	A	AB	ABC	Z	Z	Z	Z	Z	 the Connally amendment- an act which could expose the United <font color=green>States</font>  to no practical risk yet would put an end to	1	0	125	0	5	NNPS	press
state/NN/br-b18/1518	0.0275191977748194	-0.0158492704126077	state	state	NN	press_editorial	press	A3	A	AB	ABC	Z	Z	Z	Z	Z	 week, to the school. There is no charge and no <font color=green>state</font>  aid. Kiwanis, American Legion and other groups donate small sums	3	3	95	100	6	NN	press
state/NN/br-b18/35	0.0679459917879128	-0.147123180226616	state	States	NN	press_editorial	press	A5	A	AB	ABC	Z	Z	Z	Z	Z	 make conventional warfare of the past a nullity. The United <font color=green>States</font>  and Soviet Russia have enough nuclear weapons to destroy all	1	0	107	0	8	NNPS	press
state/NN/br-b18/457	0.181057250698874	-0.3143060591788	state	States	NN	press_editorial	press	A5	A	AB	ABC	Z	Z	Z	Z	Z	 be guaranteed by the Big Four powers and the United <font color=green>States</font> ? A united Germany, freed of militarism, might be the first	1	0	110	0	5	NNPS	press
state/NN/br-b18/898	0.0044858370213223	0.0759809667807483	state	States	NN	press_editorial	press	A5	A	AB	ABC	Z	Z	Z	Z	Z	 Court of Justice. The Connally amendment says that the United <font color=green>States</font> , rather than the court, shall determine whether a matter is	1	0	152	0	6	NNPS	press
state/NN/br-b18/919	0.00222218163772741	0.128738202129377	state	States	NN	press_editorial	press	A5	A	AB	ABC	Z	Z	Z	Z	Z	 matter is essentially within the domestic jurisdiction of the United <font color=green>States</font>  in a case before the World Court to which the	1	0	122	0	7	NNPS	press
state/NN/br-b18/931	-0.00768029799896302	0.0446538864739326	state	States	NN	press_editorial	press	A5	A	AB	ABC	Z	Z	Z	Z	Z	 a case before the World Court to which the United <font color=green>States</font>  is a party. If the case is thus determined by	1	0	78	0	7	NNPS	press
state/NN/br-b18/976	-0.0270690500879667	0.04318729413269	state	States	NN	press_editorial	press	A5	A	AB	ABC	Z	Z	Z	Z	Z	 to the other party to a dispute with the United <font color=green>States</font> , it also prevents us from using the court effectively. Yet	1	0	62	0	6	NNPS	press
state/NN/br-b19/530	-0.218126092656321	-0.292868437576399	state	States	NN	press_editorial	press	A5	A	AB	ABC	Z	Z	Z	Z	Z	 new boss of British Guiana, was educated in the United <font color=green>States</font>  is no reason to think he is n't a Red	1	0	108	0	3	NNPS	press
state/NN/br-b20/1056	0.012727642345721	0.106128311119666	state	State	NN	press_editorial	press	C	C	C	ABC	state_department%1:14:00::	C1	C	C	ABC	 which will bring down the wall and reunite the city. <font color=green>State</font>  Department officials refusing to show their passes at the boundary	2	2	118	100	5	NNP	press
state/NN/br-b20/358	0.050516087253912	-0.0117822298930607	state	States	NN	press_editorial	press	A5	A	AB	ABC	united_states%1:14:00::	A52	A	AB	ABC	 seek a discontinuity in the arms policy of the United <font color=green>States</font>  is the least risky path our government can take. His	1	0	92	0	6	NNPS	press
state/NN/br-b20/64	0.0247111134778619	-0.207701133218494	state	States	NN	press_editorial	press	A5	A	AB	ABC	united_states%1:14:00::	A52	A	AB	ABC	 what we are getting. The biggest nuclear device the United <font color=green>States</font>  has exploded measured some 15 megatons, although our B-52s are	1	0	81	0	6	NNPS	press
state/NN/br-b21/1367	0.0460941877894979	-0.0873608663321272	state	States	NN	press_editorial	press	A5	A	AB	ABC	Z	Z	Z	Z	Z	 risk of health damage to some people in the United <font color=green>States</font> ''. Then it added:`` It is not possible to determine how	1	0	86	0	5	NNPS	press
state/NN/br-b21/152	-0.0599895875939943	0.141101272402934	state	States	NN	press_editorial	press	A5	A	AB	ABC	Z	Z	Z	Z	Z	 for the hanging of every railroad president in the United <font color=green>States</font> . But by comparison with the railroad, the motor car is	1	0	141	0	5	NNPS	press
state/NN/br-b21/308	-0.207627028210688	-0.050356927456929	state	state	NN	press_editorial	press	A2	A	AB	ABC	Z	Z	Z	Z	Z	 butchery be the signal for the arrest of the 50 <font color=green>state</font>  highway commissioners. Then let the whole lot be hanged in	2	2	91	100	7	NN	press
state/NN/br-b21/398	-0.223604056325079	-0.358976321713171	state	States	NN	press_editorial	press	A5	A	AB	ABC	Z	Z	Z	Z	Z	 African nations as yet not quite convinced that the United <font color=green>States</font>  is thoroughly civilized. The band should play the Rogues' March	1	0	48	0	3	NNPS	press
state/NN/br-b21/944	0.00289243636889157	-0.0682596985097773	state	States	NN	press_editorial	press	A5	A	AB	ABC	Z	Z	Z	Z	Z	 human race. But the guilt is shared by the United <font color=green>States</font> , Britain and France, the other members of the atomic club	1	0	89	0	8	NNPS	press
state/NN/br-b22/1259	-0.00323222875949298	0.0859612889143655	state	State	NN	press_editorial	press	C	C	C	ABC	Z	Z	Z	Z	Z	 stand. The public appeal by the new Vatican Secretary of <font color=green>State</font> , Cardinal Cicognani, for renewed efforts toward Eastern and Western reunion	3	2	132	67	6	NNP	press
state/NN/br-b22/213	-0.0466780819996584	-0.0478628242500683	state	States	NN	press_editorial	press	A5	A	AB	ABC	Z	Z	Z	Z	Z	 would prove viable has been shaken. Once again, the United <font color=green>States</font>  must choose. And once again, the choices are much the	1	0	31	0	2	NNPS	press
state/NN/br-b22/537	0.204986994924229	0.0717048196813205	state	States	NN	press_editorial	press	A5	A	AB	ABC	Z	Z	Z	Z	Z	 world opinion, he argued that the responsibility of the United <font color=green>States</font>  is`` to do, confidently and firmly, not what is popular	1	0	120	0	3	NNPS	press
state/NN/br-b22/97	-0.222626530521737	-0.521164069853091	state	States	NN	press_editorial	press	A5	A	AB	ABC	Z	Z	Z	Z	Z	 obvious- during the mid to late' 50 's- the United <font color=green>States</font>  appeared to have three choices. It could have unilaterally abandoned	1	0	73	0	2	NNPS	press
state/NN/br-b23/1010	0.0319988401664774	-0.00949881261539501	state	state	NN	press_editorial	press	B	B	AB	ABC	Z	Z	Z	Z	Z	 is Tibet. Tibet has historically served China as a buffer <font color=green>state</font> . A friendly state, sometimes only semi-independent, but never hostile. China	5	1	138	20	6	NN	press
state/NN/br-b23/1014	0.0569878699807311	-0.0166381308376152	state	state	NN	press_editorial	press	B	B	AB	ABC	Z	Z	Z	Z	Z	 has historically served China as a buffer state. A friendly <font color=green>state</font> , sometimes only semi-independent, but never hostile. China never tried to	4	2	154	50	6	NN	press
state/NN/br-b23/1096	0.30832558197267	-0.189731586117353	state	state	NN	press_editorial	press	D	D	D	D	Z	Z	Z	Z	Z	 military, are doing much to keep China in a heightening <font color=green>state</font>  of tension. The imposition of yet another pressure, a strong	3	1	31	33	2	NN	press
state/NN/br-b23/1580	0.0795776367483201	-0.0609006940327163	state	States	NN	press_editorial	press	A5	A	AB	ABC	Z	Z	Z	Z	Z	 had gone shockingly wrong with American foreign policy. The United <font color=green>States</font>  was engaged in a military attack on a peaceful, orderly	1	0	105	0	6	NNPS	press
state/NN/br-b24/1716	0.24331753030975	-0.302462293767689	state	state	NN	press_editorial	press	D	D	D	D	Z	Z	Z	Z	Z	 Oskar Kokoschka, is widely known in the U. S.. This <font color=green>state</font>  of unawareness may not last much longer. For ten years	2	1	57	50	3	NN	press
state/NN/br-b24/2301	-0.417683976415719	-0.258140843899976	state	state	NN	press_editorial	press	D	D	D	D	Z	Z	Z	Z	Z	 most was the female body, which he painted in every <font color=green>state</font> - naked, half-dressed, muffled to the ears, sitting primly in a	5	2	86	40	4	NN	press
state/NN/br-b25/1008	0.10086635853607	-0.187248797968136	state	state	NN	press_editorial	press	D	D	D	D	Z	Z	Z	Z	Z	 line of peaceful coexistence, reducing this concept merely to the <font color=green>state</font>  of peace or rather, the absence of war at a	3	2	96	67	4	NN	press
state/NN/br-b25/1961	0.107421073138787	-0.130654612592237	state	States	NN	press_editorial	press	A5	A	AB	ABC	Z	Z	Z	Z	Z	 this is a serious business. They feel that the United <font color=green>States</font>  is engaged in a life-and-death struggle with communism for survival	1	0	67	0	6	NNPS	press
state/NN/br-b25/404	0.304790788777252	0.00552622483329214	state	state	NN	press_editorial	press	A2	A	AB	ABC	Z	Z	Z	Z	Z	 system and replace it by uniformly wage-earning sovkhozes, i. e., <font color=green>state</font>  farms( which were, moreover, to be progressively`` urbanized'')? As we	3	0	91	0	3	NN	press
state/NN/br-b25/497	0.26060692446795	0.132645691518728	state	state	NN	press_editorial	press	A2	A	AB	ABC	Z	Z	Z	Z	Z	 let the latter be turned into something increasingly like a <font color=green>state</font>  farm. If one follows the reports of the Congress, one	2	0	77	0	3	NN	press
state/NN/br-b25/593	0.137330556535831	-0.0557329295481913	state	state	NN	press_editorial	press	C	C	C	ABC	Z	Z	Z	Z	Z	 other'' 50 per cent of the nation from that`` welfare <font color=green>state</font> '' which the Soviet Union so greatly prides itself on being	4	2	121	50	6	NN	press
state/NN/br-b25/842	0.309748150431284	0.137631237169098	state	state	NN	press_editorial	press	C	C	C	ABC	Z	Z	Z	Z	Z	 against all the more popular features of the Khrushchev`` welfare <font color=green>state</font> ''. The trouble with all these doctrinal quarrels is that we	3	2	141	67	3	NN	press
state/NN/br-b26/846	0.189611650781971	-0.145618971852447	state	States	NN	press_editorial	press	A5	A	AB	ABC	Z	Z	Z	Z	Z	 to this dilemma is not the incorporation of the United <font color=green>States</font>  into an Atlantic Community or`` economic empire'', but merely what	1	0	84	0	4	NNPS	press
state/NN/br-b27/1479	-0.265740191282297	0.217043298117882	state	States	NN	press_editorial	press	A5	A	AB	ABC	Z	Z	Z	Z	Z	 and its teaching. Four of us here in the United <font color=green>States</font>  attended, first as students, then as instructors, almost every one	1	0	53	0	2	NNPS	press
