id	model.x	model.y	lemma	pos	genre	broad_genre	marisense	mbroad	mari3	mari2	sensekey	wnsense	wnbroad	wn3	wn2	text	cues	cues_with_weight	mean_weight	weighted.cues_ratio	weighted_cw
state/NN/br-h04/127	0.0259678686939402	0.0406451597989984	state	NN	miscellaneous	non-fiction	A2	A	AB	ABC	Z	Z	Z	Z	Z	 mile. Purchase of state vehicles is handled similarly to all <font color=green>state</font>  purchases. Unit prices to the state are considerably lower than	4	4	1.51333315061421	1	9
state/NN/br-h04/1288	0.00734105857937475	-0.041015859297758	state	NN	miscellaneous	non-fiction	A4	A	AB	ABC	Z	Z	Z	Z	Z	 headquarter facilities in Providence and other garages located throughout the <font color=green>state</font> . It was organizationally the responsibility of the Department of Public	3	1	1.1873544493288	0.333333333333333	5
state/NN/br-h04/134	0.0114375483248599	0.0158904664739995	state	NN	miscellaneous	non-fiction	A1	A	AB	ABC	Z	Z	Z	Z	Z	 handled similarly to all state purchases. Unit prices to the <font color=green>state</font>  are considerably lower than to the general public because of	5	4	1.43018632261518	0.8	7
state/NN/br-h04/1348	0.0111846585021747	0.0186683215354717	state	NN	miscellaneous	non-fiction	A3	A	AB	ABC	Z	Z	Z	Z	Z	 established as the central staff and auxiliary department of the <font color=green>state</font>  government. The management of state-owned vehicles since that time has	2	2	1.52742809573842	1	8
state/NN/br-h04/151	0.0385085693183634	0.00426171989098998	state	NN	miscellaneous	non-fiction	A3	A	AB	ABC	Z	Z	Z	Z	Z	 general public because of quantity purchases and no payment of <font color=green>state</font>  sales or federal excise taxes. The legislature 's role in	5	4	1.48969902850675	0.8	9
state/NN/br-h04/1854	0.0794965551365688	0.124507323605124	state	NN	miscellaneous	non-fiction	A2	A	AB	ABC	Z	Z	Z	Z	Z	 in excess of 10000 miles annually is more economical by <font color=green>state</font>  car than by payment of allowances for use of personally-owned	3	2	1.27782596574781	0.666666666666667	8
state/NN/br-h04/1904	0.0334157007588693	0.0664030433199252	state	NN	miscellaneous	non-fiction	A2	A	AB	ABC	Z	Z	Z	Z	Z	 travel per year. Table 2 shows operating cost data of <font color=green>state</font>  vehicles selected at random. One matter of concern to the	1	0	1.10948499832982	0	8
state/NN/br-h04/192	0.0217568339212142	0.0325863717815315	state	NN	miscellaneous	non-fiction	A2	A	AB	ABC	Z	Z	Z	Z	Z	 meaningful policies governing the purchase, assignment, use and management of <font color=green>state</font>  vehicles have been shaped by the state 's administrative officers	4	4	1.62226021463289	1	11
state/NN/br-h04/199	0.0199081020319495	0.024857750019691	state	NN	miscellaneous	non-fiction	A1	A	AB	ABC	Z	Z	Z	Z	Z	 and management of state vehicles have been shaped by the <font color=green>state</font>  's administrative officers. Meaningful policies include:( a) kinds of cars	3	2	1.45606167965192	0.666666666666667	10
state/NN/br-h04/2004	-0.0054967789875457	0.182487534273564	state	NN	miscellaneous	non-fiction	A1	A	AB	ABC	Z	Z	Z	Z	Z	 in the same manner as all other purchases of the <font color=green>state</font> . Requests are made by the motor pool along with any	2	0	1.0765689865442	0	3
state/NN/br-h04/2064	0.0085303239505977	0.0773802482176625	state	NN	miscellaneous	non-fiction	A2	A	AB	ABC	Z	Z	Z	Z	Z	 are made to the lowest responsible bidders. Unit prices for <font color=green>state</font>  vehicles are invariably lower than to the general public. The	4	4	1.21755928417844	1	7
state/NN/br-h04/2084	0.0252015152919304	0.246635843697238	state	NN	miscellaneous	non-fiction	A1	A	AB	ABC	Z	Z	Z	Z	Z	 to the general public. The reasons are obvious:( 1) the <font color=green>state</font>  is buying in quantity, and( 2) it has no federal	2	1	0.517819194549976	0.5	4
state/NN/br-h04/21	0.0207809480785315	0.00791051401097876	state	NN	miscellaneous	non-fiction	A2	A	AB	ABC	Z	Z	Z	Z	Z	 on business dates back over forty years. At least one <font color=green>state</font>  vehicle was in existence in 1917. The state presently owns	3	2	1.18590227843392	0.666666666666667	8
state/NN/br-h04/2100	0.0486994211189373	-0.00097749926062983	state	NN	miscellaneous	non-fiction	A3	A	AB	ABC	Z	Z	Z	Z	Z	 in quantity, and( 2) it has no federal excise or <font color=green>state</font>  sales tax to pay. Until 1958 the state was also	4	3	1.71789874700739	0.75	5
state/NN/br-h04/2109	0.0403653297554144	-0.00474721437519992	state	NN	miscellaneous	non-fiction	A1	A	AB	ABC	Z	Z	Z	Z	Z	 excise or state sales tax to pay. Until 1958 the <font color=green>state</font>  was also entitled to a special type of manufacturers' discount	4	3	1.03997809625954	0.75	7
state/NN/br-h04/2134	0.0445219084047625	0.0807986157880115	state	NN	miscellaneous	non-fiction	A2	A	AB	ABC	Z	Z	Z	Z	Z	 dealers. In that ownership of all vehicles rests with the <font color=green>state</font>  motor pool, cars are paid for with funds appropriated to	4	3	1.5155843401769	0.75	9
state/NN/br-h04/215	0.0116303749684308	0.106600200701158	state	NN	miscellaneous	non-fiction	A1	A	AB	ABC	Z	Z	Z	Z	Z	 administrative officers. Meaningful policies include:( a) kinds of cars the <font color=green>state</font>  should own,( b) when cars should be traded,( c) the	5	2	1.44239045106328	0.4	6
state/NN/br-h04/2213	0.0117871181399242	0.055802856898979	state	NN	miscellaneous	non-fiction	A2	A	AB	ABC	Z	Z	Z	Z	Z	 administrative policies governing the purchase, assignment, use, and management of <font color=green>state</font>  vehicles. The legislature 's role in policy determination in this	5	5	1.43300893831198	1	10
state/NN/br-h04/2265	-0.000655003091935772	-0.0988360962794494	state	NN	miscellaneous	non-fiction	B	B	AB	ABC	Z	Z	Z	Z	Z	 to the judgment of the chief administrative officer of the <font color=green>state</font> - the Director of Administration.	3	2	0.952635198381184	0.666666666666667	4
state/NN/br-h04/267	0.0302447111408565	0.133461385831748	state	NN	miscellaneous	non-fiction	A2	A	AB	ABC	Z	Z	Z	Z	Z	 taking cars home, and( f) need for liability insurance on <font color=green>state</font>  automobiles. A review of these policies indicates: The state purchases	3	1	1.8454254641229	0.333333333333333	6
state/NN/br-h04/278	0.030921656197562	0.131368241534283	state	NN	miscellaneous	non-fiction	A1	A	AB	ABC	Z	Z	Z	Z	Z	 on state automobiles. A review of these policies indicates: The <font color=green>state</font>  purchases and assigns grades of cars according to need and	2	2	1.98786999565878	1	6
state/NN/br-h04/30	0.035984209787259	0.0493498385531492	state	NN	miscellaneous	non-fiction	A1	A	AB	ABC	Z	Z	Z	Z	Z	 least one state vehicle was in existence in 1917. The <font color=green>state</font>  presently owns 389 passenger vehicles in comparison to approximately 200	2	2	1.55972993937898	1	9
state/NN/br-h04/354	0.0603652997832657	0.0836825978983511	state	NN	miscellaneous	non-fiction	A2	A	AB	ABC	Z	Z	Z	Z	Z	 efforts have been made to replace high mileage allowances with <font color=green>state</font>  automobiles. It is reasonably economical for the state to have	4	4	1.60876470471506	1	10
state/NN/br-h04/363	0.0343075159835126	0.0791400926565681	state	NN	miscellaneous	non-fiction	A1	A	AB	ABC	Z	Z	Z	Z	Z	 allowances with state automobiles. It is reasonably economical for the <font color=green>state</font>  to have drivers garage state cars at their homes. The	3	3	2.01175834837106	1	9
state/NN/br-h04/368	0.0133451396278497	0.0483014213360432	state	NN	miscellaneous	non-fiction	A2	A	AB	ABC	Z	Z	Z	Z	Z	 is reasonably economical for the state to have drivers garage <font color=green>state</font>  cars at their homes. The state has recently undertaken liability	3	3	1.71090453464802	1	11
state/NN/br-h04/375	0.0236959458278299	0.0419933770662992	state	NN	miscellaneous	non-fiction	A1	A	AB	ABC	Z	Z	Z	Z	Z	 to have drivers garage state cars at their homes. The <font color=green>state</font>  has recently undertaken liability insurance for drivers of state cars	4	4	1.72601598936148	1	12
state/NN/br-h04/384	0.0271997941987438	0.0290434407722495	state	NN	miscellaneous	non-fiction	A2	A	AB	ABC	Z	Z	Z	Z	Z	 The state has recently undertaken liability insurance for drivers of <font color=green>state</font>  cars. A survey of practices and/ or policies in other	4	3	1.60277036281335	0.75	10
state/NN/br-h04/403	0.0212224190148227	0.0139786374174614	state	NN	miscellaneous	non-fiction	A2	A	AB	ABC	Z	Z	Z	Z	Z	 or policies in other states concerning assignment and use of <font color=green>state</font>  automobiles reveals several points for comparison with Rhode Island 's	3	3	1.55558006372294	1	12
state/NN/br-h04/425	0.0465464510955416	0.0511186043731498	state	NN	miscellaneous	non-fiction	A2	A	AB	ABC	Z	Z	Z	Z	Z	 practices. Forty-seven states assign or provide vehicles for employees on <font color=green>state</font>  business. Two other states provide vehicles, but only with legislative	4	6	1.2849672418568	1.5	10
state/NN/br-h04/491	0.057336607450542	0.0574677533300408	state	NN	miscellaneous	non-fiction	A2	A	AB	ABC	Z	Z	Z	Z	Z	 vehicles. Nineteen states report laws, policies or regulations for assigning <font color=green>state</font>  vehicles in lieu of paying mileage allowances. Of these states	4	4	2.07356217790372	1	10
state/NN/br-h04/528	0.10758144742576	0.144575645224001	state	NN	miscellaneous	non-fiction	A2	A	AB	ABC	Z	Z	Z	Z	Z	 for allowances) is 13200 miles per year. Mileage allowances for <font color=green>state</font>  employees are of two types:( a) actual mileage and( b	2	3	1.56271737969303	1.5	9
state/NN/br-h04/563	0.0287735005313332	0.0667088359726861	state	NN	miscellaneous	non-fiction	A2	A	AB	ABC	Z	Z	Z	Z	Z	 reimbursements allowed employees for the use of personally-owned vehicles on <font color=green>state</font>  business at the rate of .07 per mile. Fixed monthly	6	4	1.08060037235786	0.666666666666667	8
state/NN/br-h04/602	0.0310076609572159	-0.029806232555569	state	NN	miscellaneous	non-fiction	A1	A	AB	ABC	Z	Z	Z	Z	Z	 by conditions and restrictions set forth in detail in the <font color=green>state</font>  's Travel Regulations. Rhode Island 's reimburseable rate of .07	3	0	1.10668322975928	0	9
state/NN/br-h04/681	0.100019861592517	0.178994429257313	state	NN	miscellaneous	non-fiction	A1	A	AB	ABC	Z	Z	Z	Z	Z	 mileage allowances are well-administered and not unduly expensive for the <font color=green>state</font> . The travel regulations, requirements and procedures governing reimbursement are controlled	5	3	1.75645719833795	0.6	8
state/NN/br-h04/745	0.10452541753498	0.163070828222849	state	NN	miscellaneous	non-fiction	A1	A	AB	ABC	Z	Z	Z	Z	Z	 payments over$ 50 per month are more expensive to the <font color=green>state</font>  than the assignment of state-owned vehicles. Travel allowances, including subsistence	4	4	1.74194594864638	1	8
state/NN/br-h04/780	0.085641343475461	0.0759328980081663	state	NN	miscellaneous	non-fiction	A2	A	AB	ABC	Z	Z	Z	Z	Z	 favorably with other states' allowances. With few exceptions travelers on <font color=green>state</font>  business are allowed actual travel expenses and$ 15 per day	4	4	1.3207633810274	1	9
state/NN/br-h04/821	0.0577848346369329	-0.0107161729177479	state	NN	miscellaneous	non-fiction	A1	A	AB	ABC	Z	Z	Z	Z	Z	 is difficult to pinpoint the time of origin of the <font color=green>state</font>  purchasing automobiles for use of employees in Rhode Island. Few	4	3	1.62187961416562	0.75	7
state/NN/br-h04/861	0.0232482038477761	0.145058300803696	state	NN	miscellaneous	non-fiction	A2	A	AB	ABC	Z	Z	Z	Z	Z	 The Registry of Motor Vehicles indicates that at least one <font color=green>state</font>  automobile was registered as far back as 1917. It should	3	2	1.28480795141995	0.666666666666667	7
state/NN/br-h04/882	0.0636257121854849	0.191616553564142	state	NN	miscellaneous	non-fiction	A1	A	AB	ABC	Z	Z	Z	Z	Z	 should be enough to say that the practice of the <font color=green>state</font>  buying automobiles is at least forty years old. The best	2	2	0.891887618849657	1	5
state/NN/br-h04/901	-0.049615659252641	0.0938683023585826	state	NN	miscellaneous	non-fiction	A1	A	AB	ABC	Z	Z	Z	Z	Z	 old. The best reason that can be advanced for the <font color=green>state</font>  adopting the practice was the advent of expanded highway construction	3	3	0.826430561450616	1	6
state/NN/br-h04/952	-0.00176849090981588	0.0691556285479189	state	NN	miscellaneous	non-fiction	A2	A	AB	ABC	Z	Z	Z	Z	Z	 personal hardship for such employees, and the matter of providing <font color=green>state</font>  transportation was felt perfectly justifiable. Once the principle was established	2	2	1.18196150192433	1	6
state/NN/br-h05/1130	0.0371572416089389	-0.012824326228562	state	NN	miscellaneous	non-fiction	A2	A	AB	ABC	Z	Z	Z	Z	Z	 centralizing all aspects of property tax administration in a single <font color=green>state</font>  agency professionally organized and equipped for the job''. The resulting	4	4	1.44047160406038	1	6
state/NN/br-h05/130	-0.0446448451013447	0.00209521980245598	state	NN	miscellaneous	non-fiction	A1	A	AB	ABC	Z	Z	Z	Z	Z	 there has come into being a situation in which the <font color=green>state</font>  must raise all of its own revenues and, in addition	2	2	0.409595990836083	1	7
state/NN/br-h05/156	0.0508788824343882	-0.035459206509309	state	NN	miscellaneous	non-fiction	A1	A	AB	ABC	Z	Z	Z	Z	Z	 assistance to its local governments. This financial assistance from the <font color=green>state</font>  has become necessary because the local governments themselves found the	3	5	1.9015389926218	1.66666666666667	9
state/NN/br-h05/2126	-0.0326080746453835	-0.0659844970488203	state	NN	miscellaneous	non-fiction	A3	A	AB	ABC	Z	Z	Z	Z	Z	 the Coast Guard prior to the recent passage of the <font color=green>state</font>  boating law. Only a few more than 10000 boats had	1	1	1.21616150137454	1	5
state/NN/br-h05/219	0.0408964848601702	-0.00269190657674821	state	NN	miscellaneous	non-fiction	A3	A	AB	ABC	Z	Z	Z	Z	Z	 adoption accompanied the introduction of a sales tax at the <font color=green>state</font>  level. Notwithstanding state aid, the local governments are continuing to	6	5	1.68507669503754	0.833333333333333	8
state/NN/br-h05/223	0.034215890420766	-0.00439622836931435	state	NN	miscellaneous	non-fiction	A3	A	AB	ABC	Z	Z	Z	Z	Z	 introduction of a sales tax at the state level. Notwithstanding <font color=green>state</font>  aid, the local governments are continuing to seek additional revenue	4	3	1.46241500218079	0.75	9
state/NN/br-h05/31	0.0325791861605406	-0.00255760067198407	state	NN	miscellaneous	non-fiction	A3	A	AB	ABC	Z	Z	Z	Z	Z	 own operations and a part of the cost of the <font color=green>state</font>  government as well. For many years a state tax on	4	3	1.15671004999234	0.75	6
state/NN/br-h05/40	0.0217156638396899	-0.00674828391312446	state	NN	miscellaneous	non-fiction	A3	A	AB	ABC	Z	Z	Z	Z	Z	 of the state government as well. For many years a <font color=green>state</font>  tax on cities and towns was paid by the several	3	3	1.40940323255423	1	8
state/NN/br-h05/497	0.154910644353708	-0.15528641299968	state	NN	miscellaneous	non-fiction	A4	A	AB	ABC	Z	Z	Z	Z	Z	 taxation of all personal property, belonging to inhabitants of the <font color=green>state</font> , both tangible and intangible, and the tangible personal property of	3	2	1.45535871647647	0.666666666666667	6
state/NN/br-h05/513	0.0214726826979845	0.0992939402290232	state	NN	miscellaneous	non-fiction	A4	A	AB	ABC	Z	Z	Z	Z	Z	 intangible, and the tangible personal property of non-residents in this <font color=green>state</font> . In defining personal property, it specifically mentions`` all ships or	2	2	0.992740766791571	1	10
state/NN/br-h05/54	0.0387888836375447	-0.00642932126389683	state	NN	miscellaneous	non-fiction	A1	A	AB	ABC	Z	Z	Z	Z	Z	 and towns was paid by the several municipalities to the <font color=green>state</font>  from the proceeds of the general property tax. This tax	4	3	1.35917985413118	0.75	6
state/NN/br-h05/90	0.0593744701681207	-0.0732068536987918	state	NN	miscellaneous	non-fiction	A1	A	AB	ABC	Z	Z	Z	Z	Z	 new and expanded services have placed financial burdens on the <font color=green>state</font>  which could not have been foreseen in earlier years. At	3	1	0.410118669400353	0.333333333333333	6
state/NN/br-h05/976	-0.0499165683639702	0.0337861867679601	state	NN	miscellaneous	non-fiction	A3	A	AB	ABC	Z	Z	Z	Z	Z	 This condition will undoubtedly continue until such time as a <font color=green>state</font>  uniform system of evaluation is established, or through mutual agreement	3	3	0.711516982607867	1	9
state/NN/br-h06/1102	-0.0579418779916918	0.0543840514938993	state	NN	miscellaneous	non-fiction	A5	A	AB	ABC	Z	Z	Z	Z	Z	 Its purpose was to find ways of offsetting the United <font color=green>States</font> ' declining balance of trade for 1958 and 1959. Approximately 100	1	0	1.21964268369285	0	4
state/NN/br-h06/1634	-0.0482397818706281	0.0242281076931583	state	NN	miscellaneous	non-fiction	A3	A	AB	ABC	Z	Z	Z	Z	Z	 priority will be given to the preparation of a meaningful <font color=green>state</font>  guide plan to serve as a background for all other	2	2	1.3711649875518	1	8
state/NN/br-h06/1649	-0.0317102684795594	-0.00290399090112518	state	NN	miscellaneous	non-fiction	A4	A	AB	ABC	Z	Z	Z	Z	Z	 as a background for all other planning activities in the <font color=green>state</font> . Recognizing the truth of the statement by the Institute of	3	3	0.936560097918608	1	6
state/NN/br-h06/1678	0.0272334244673843	-0.0167863038641477	state	NN	miscellaneous	non-fiction	A3	A	AB	ABC	Z	Z	Z	Z	Z	 that`` Metropolian Planning( in Rhode Island) means, or should mean, <font color=green>state</font>  planning'', the state guide plan will take into account the	2	1	1.58416586010107	0.5	8
state/NN/br-h06/1683	0.00357837644225328	0.000466580183521148	state	NN	miscellaneous	non-fiction	A3	A	AB	ABC	Z	Z	Z	Z	Z	 in Rhode Island) means, or should mean, state planning'', the <font color=green>state</font>  guide plan will take into account the metropolitan nature of	3	2	1.26327667421553	0.666666666666667	9
state/NN/br-h06/1766	-0.00452102558709949	0.0172245536889898	state	NN	miscellaneous	non-fiction	A4	A	AB	ABC	Z	Z	Z	Z	Z	 cost basis, technical planning assistance to those communities in the <font color=green>state</font>  unable to maintain their own planning staff. The planning division	3	5	1.2399235014965	1.66666666666667	11
state/NN/br-h06/1798	0.0320357446835211	-0.00742413577707205	state	NN	miscellaneous	non-fiction	A1	A	AB	ABC	Z	Z	Z	Z	Z	 all levels of government; among the operating departments of the <font color=green>state</font> ; between the cities and towns of the state; and on	5	5	1.81076370049104	1	6
state/NN/br-h06/1807	0.0443605157739196	0.00161862287208815	state	NN	miscellaneous	non-fiction	A4	A	AB	ABC	Z	Z	Z	Z	Z	 of the state; between the cities and towns of the <font color=green>state</font> ; and on a regional basis between the six New England	3	3	1.15891878595704	1	5
state/NN/br-h06/1829	0.0117119264921037	-0.00597892549135778	state	NN	miscellaneous	non-fiction	A	A	AB	ABC	Z	Z	Z	Z	Z	 England states. On the basis that all citizens of the <font color=green>state</font>  are entitled to benefit equally in the development of its	4	3	1.31339119477838	0.75	7
state/NN/br-h06/1870	0.00619635851500485	0.00359636222841329	state	NN	miscellaneous	non-fiction	A3	A	AB	ABC	Z	Z	Z	Z	Z	 regardless of arbitrary political boundaries, within the framework of the <font color=green>state</font>  plan. The state development budget will reflect the capital needs	3	3	1.46648495936203	1	8
state/NN/br-h06/1874	0.0124304041854302	0.00351485419826538	state	NN	miscellaneous	non-fiction	A3	A	AB	ABC	Z	Z	Z	Z	Z	 political boundaries, within the framework of the state plan. The <font color=green>state</font>  development budget will reflect the capital needs of all the	3	3	1.47080903558335	1	7
state/NN/br-h06/1885	-0.00557240541020669	0.0250781198582646	state	NN	miscellaneous	non-fiction	A2	A	AB	ABC	Z	Z	Z	Z	Z	 development budget will reflect the capital needs of all the <font color=green>state</font>  agencies and the priority of the projects in the budget	2	3	1.66277719880591	1.5	9
state/NN/br-h06/1901	0.0115248893192736	0.0022710631236763	state	NN	miscellaneous	non-fiction	A3	A	AB	ABC	Z	Z	Z	Z	Z	 the projects in the budget will be based on the <font color=green>state</font>  plan. In preparing the state guide plan, particular attention will	4	5	1.6223455156859	1.25	9
state/NN/br-h06/1907	0.000170916268592437	0.00489224249296236	state	NN	miscellaneous	non-fiction	A3	A	AB	ABC	Z	Z	Z	Z	Z	 will be based on the state plan. In preparing the <font color=green>state</font>  guide plan, particular attention will be given means of strengthening	2	3	1.34354560281381	1.5	9
state/NN/br-h06/1923	-0.0278903269306874	0.0195867230875999	state	NN	miscellaneous	non-fiction	A	A	AB	ABC	Z	Z	Z	Z	Z	 will be given means of strengthening the economy of the <font color=green>state</font>  through the development of industry and recreation. Functionally the planning	4	4	0.661276494454846	1	6
state/NN/br-h06/1942	0.00767573481023465	-0.00150664803381497	state	NN	miscellaneous	non-fiction	A3	A	AB	ABC	Z	Z	Z	Z	Z	 recreation. Functionally the planning division carries out four activities: long-range <font color=green>state</font>  planning, current state planning, local planning assistance; and the preparation	2	5	1.64836461753452	2.5	12
state/NN/br-h06/1946	0.00858580444846956	2.96448064439015e-05	state	NN	miscellaneous	non-fiction	A3	A	AB	ABC	Z	Z	Z	Z	Z	 planning division carries out four activities: long-range state planning, current <font color=green>state</font>  planning, local planning assistance; and the preparation of the state	4	7	1.6299169448957	1.75	12
state/NN/br-h06/1958	-0.00709596803557453	-0.00276314860512437	state	NN	miscellaneous	non-fiction	A3	A	AB	ABC	Z	Z	Z	Z	Z	 state planning, local planning assistance; and the preparation of the <font color=green>state</font>  development budget. The planning division has embarked on the most	6	8	1.54229383369672	1.33333333333333	11
state/NN/br-h06/1973	-0.0274471835770698	-0.00429026140128583	state	NN	miscellaneous	non-fiction	A3	A	AB	ABC	Z	Z	Z	Z	Z	 planning division has embarked on the most complete and comprehensive <font color=green>state</font>  planning program in the nation. The long range aspects of	3	4	1.04765984062887	1.33333333333333	10
state/NN/br-h06/2105	-0.0245098776909646	-0.00905335278832784	state	NN	miscellaneous	non-fiction	A3	A	AB	ABC	Z	Z	Z	Z	Z	 taken by the planning division to implement the long range <font color=green>state</font>  plan has been to prepare two series of base maps	3	2	1.330597703842	0.666666666666667	6
state/NN/br-h06/2149	-0.0375716051757324	0.222117234713177	state	NN	miscellaneous	non-fiction	A4	A	AB	ABC	Z	Z	Z	Z	Z	 scale of 1 inch to 2000 feet, covering the entire <font color=green>state</font> . With these maps completed, the inventory phase of the plan	3	2	1.12757843639012	0.666666666666667	5
state/NN/br-h06/2205	-0.0193340851516017	0.0863141650128439	state	NN	miscellaneous	non-fiction	A3	A	AB	ABC	Z	Z	Z	Z	Z	 July 1, 1960 to complete the inventory phase of the <font color=green>state</font>  planning program. this phase consists of four items: urban land	2	2	1.1010870906302	1	7
state/NN/br-h06/2318	0.0625214723887226	-0.0551672528012138	state	NN	miscellaneous	non-fiction	A4	A	AB	ABC	Z	Z	Z	Z	Z	 Rhode Island and identifies all agricultural land uses in the <font color=green>state</font>  by type of use. The mapping of important physical features	2	0	1.62337902646899	0	6
state/NN/br-h06/248	0.0758954467856019	-0.106344461691412	state	NN	miscellaneous	non-fiction	A	A	AB	ABC	Z	Z	Z	Z	Z	 in a Rhode Island location. They are conscious of this <font color=green>state</font>  's new feeling of optimism and assurance and are definitely	1	0	0.916849128387877	0	8
state/NN/br-h06/805	0.0279975449487563	-0.157641858196739	state	NN	miscellaneous	non-fiction	A4	A	AB	ABC	Z	Z	Z	Z	Z	 Plant Location. The direct mail campaign consisted of 3 intra <font color=green>state</font>  mailings of 1680 letters each and 6 out-of-state directed to	3	1	0.936522803644314	0.333333333333333	5
state/NN/br-h06/870	-0.0944888019618058	-0.0219615041208187	state	NN	miscellaneous	non-fiction	A5	A	AB	ABC	Z	Z	Z	Z	Z	 and nineteen were received from 35 of our 50 United <font color=green>States</font>  and 11 came from foreign countries. New York led in	1	0	0.661105310179388	0	4
state/NN/br-h07/1010	0.0632196043105535	-0.0375124310838802	state	NN	miscellaneous	non-fiction	A4	A	AB	ABC	Z	Z	Z	Z	Z	 sums of money to the several local governments in this <font color=green>state</font>  as indicated below: It has been said that when local	4	4	1.09914796376595	1	8
state/NN/br-h07/1050	0.0778230190146953	0.0163388647250555	state	NN	miscellaneous	non-fiction	A3	A	AB	ABC	Z	Z	Z	Z	Z	 year was no great handicap; but with the growth of <font color=green>state</font>  and federal fiscal aid, the emphasis on equalization, and the	3	3	1.44915537300797	1	4
state/NN/br-h07/118	0.0111813772280204	0.150119810109038	state	NN	miscellaneous	non-fiction	A3	A	AB	ABC	Z	Z	Z	Z	Z	 do not have to submit any financial statements to the <font color=green>state</font>  Bureau of Audits. It is not an exaggeration to say	3	2	0.678362155777839	0.666666666666667	4
state/NN/br-h07/1285	0.133245197839413	-0.09635232548753	state	NN	miscellaneous	non-fiction	A4	A	AB	ABC	Z	Z	Z	Z	Z	 city. Fortunately, there are no cities or towns in the <font color=green>state</font> , with one or two possible exceptions that are in too	2	2	1.35178764841941	1	5
state/NN/br-h07/132	0.0492050758662848	-0.00349781380031205	state	NN	miscellaneous	non-fiction	A3	A	AB	ABC	Z	Z	Z	Z	Z	 Audits. It is not an exaggeration to say that the <font color=green>state</font>  government has little or no fiscal control over these units	3	3	1.1363785369431	1	4
