id	model.x	model.y	lemma	pos	genre	broad_genre	marisense	mbroad	mari3	mari2	sensekey	wnsense	wnbroad	wn3	wn2	text	cues	cues_with_weight	mean_weight_x100	wcratio_x100	weighted_cw	wf
church/NN/br-a01/2073	-0.241840286074496	0.065070489526262	church	NN	press_reportage	press	E	E	DE	CDE	church%1:04:00::	E	E	DE	CDE	 said.`` Being at the polls was just like being at <font color=green>church</font> . I did n't smell a drop of liquor, and we	1	0	95	0	9	church
church/NN/br-d01/1628	-0.0302632773589744	-0.160766316904961	church	NN	religion	non-fiction	B	B	AB	AB	church%1:14:00::	B	B	AB	AB	 age to whip men into a surrender to a particular <font color=green>church</font>  or church-state''. Apparently he does not intend that those who	3	2	145	67	7	church
church/NN/br-d02/1641	0.212789503230479	-0.034818970691336	church	NN	religion	non-fiction	B	B	AB	AB	church%1:14:00::	B	B	AB	AB	 concerned to stand squarely within the tradition of the apostolic <font color=green>church</font> , they have exhibited no willingness whatever to sacrifice their modernity	2	1	236	50	4	church
church/NN/br-d02/706	0.00147774905685303	0.0713992313865128	church	NN	religion	non-fiction	A	A	AB	AB	church%1:14:00::	B	B	AB	AB	 there tends to be an almost complete indifference to the <font color=green>church</font>  and its traditional message of sin and grace. To be	4	4	169	100	9	church
church/NN/br-d02/786	0.0517728435276775	-0.277967512900389	church	NN	religion	non-fiction	A	A	AB	AB	church%1:14:00::	B	B	AB	AB	 longer afford the luxury of such smug indignation? Can the <font color=green>church</font>  risk assuming that the`` folly'' of men is as dear	3	0	189	0	5	church
church/NN/br-d02/877	0.139284703931268	0.132749510144955	church	NN	religion	non-fiction	A	A	AB	AB	church%1:14:00::	B	B	AB	AB	 precarious? There is an ancient and venerable tradition in the <font color=green>church</font> ( which derives, however, from the heritage of the Greeks rather	4	3	168	75	5	church
church/NN/br-d02/923	0.050135327650835	-0.0836603537843147	church	NN	religion	non-fiction	A	A	AB	AB	church%1:14:00::	B	B	AB	AB	 for accomplishing his work in the world. by analogy, the <font color=green>church</font>  also has been regarded as entirely independent of the`` world	3	2	114	67	7	church
church/NN/br-d02/949	-0.0924930521768011	0.125298351225661	church	NN	religion	non-fiction	A	A	AB	AB	church%1:14:00::	B	B	AB	AB	 of requiring nothing from it in order to be the <font color=green>church</font> . But, as Scripture everywhere reminds us, God does have need	2	1	121	50	6	church
church/NN/br-d02/969	-0.0550731100242882	0.116525169337773	church	NN	religion	non-fiction	A	A	AB	AB	church%1:14:00::	B	B	AB	AB	 us, God does have need of his creatures, and the <font color=green>church</font> , a fortiori, can ill afford to do without the talents	4	3	150	75	5	church
church/NN/br-d03/1080	0.136012298852398	0.0198791840840928	church	NN	religion	non-fiction	E	E	DE	CDE	church%1:04:00::	E	E	DE	CDE	 phenomenon of redundancy is that fewer Protestants are going to <font color=green>church</font> . It should be admitted, too, that there is a good	2	2	130	100	7	church
church/NN/br-d03/1342	0.00691056599403493	0.0146911675854131	church	NN	religion	non-fiction	E	E	DE	CDE	church%1:06:00::	D	D	DE	CDE	 my experience to find as many men as women in <font color=green>church</font> , and to hear almost everyone in church congregations reciting the	5	2	205	40	7	church
church/NN/br-d03/1350	0.010193178457532	0.0206425444134636	church	NN	religion	non-fiction	E	E	DE	CDE	church%1:06:00::	D	D	DE	CDE	 as women in church, and to hear almost everyone in <font color=green>church</font>  congregations reciting the Latin prayers and responses at Mass. They	5	4	239	80	10	church
church/NN/br-d03/1871	0.0749228702158715	0.0671014641443427	church	NN	religion	non-fiction	B	B	AB	AB	catholic_church%1:14:00::	B1	B	AB	AB	 the Sunday Observer implies a kindly recognition that the Catholic <font color=green>Church</font>  is now at least of equal stature in England with	2	2	211	100	10	Church
church/NN/br-d03/1909	0.0764557290627783	0.104239096710077	church	NN	religion	non-fiction	B	B	AB	AB	church_of_england%1:14:00::	B2	B	AB	AB	 non-Catholic) wrote articles in the Observer depicting clergymen of the <font color=green>Church</font>  of England, the Church of Rome and the Nonconformist Church	6	2	246	33	5	Church
church/NN/br-d03/2097	0.0158103848579734	0.0239726198715062	church	NN	religion	non-fiction	A	A	AB	AB	church%1:14:00::	B	B	AB	AB	 Canterbury. The good feeling which exists between these two important <font color=green>church</font>  figures is now well known in England. The Holy Sacrifice	4	2	123	50	9	church
church/NN/br-d03/2336	0.0624642216856634	0.0466739284308722	church	NN	religion	non-fiction	D	D	DE	CDE	catholic_church%1:14:00::	B1	B	AB	AB	 a votive Mass offered for Christian unity at a Catholic <font color=green>church</font>  in Slough during the Church Unity Octave.	2	1	261	50	7	church
church/NN/br-d03/2341	0.090218209587616	0.0625127198114783	church	NN	religion	non-fiction	A	A	AB	AB	church%1:14:00::	B	B	AB	AB	 Christian unity at a Catholic church in Slough during the <font color=green>Church</font>  Unity Octave.	2	1	317	50	5	Church
church/NN/br-d03/721	0.0763766653700773	0.270482400624635	church	NN	religion	non-fiction	B	B	AB	AB	church%1:06:00::	D	D	DE	CDE	 crowds going in and out of the Birmingham Oratory( Catholic) <font color=green>Church</font>  on Sunday mornings. She found this a marvel because, as	1	0	279	0	3	Church
church/NN/br-d03/862	0.0415682939620242	0.0243642573147272	church	NN	religion	non-fiction	B	B	AB	AB	church_of_england%1:14:00::	B2	B	AB	AB	 to a newspaper report of the 1961 statistics of the <font color=green>Church</font>  of England, the`` total of confirmed members is 9748000, but	3	2	184	67	7	Church
church/NN/br-d03/883	0.32027007692714	-0.00376666983887338	church	NN	religion	non-fiction	C	C	C	CDE	church_roll%1:10:00::	C	C	C	CDE	 is 9748000, but only 2887671 are registered on the parochial <font color=green>church</font>  rolls'', and`` over 27 million people in England are baptized	4	3	198	75	4	church
church/NN/br-d03/899	0.107523044540358	0.18244109338719	church	NN	religion	non-fiction	B	B	AB	AB	church_of_england%1:14:00::	B2	B	AB	AB	 over 27 million people in England are baptized into the <font color=green>Church</font>  of England, but roughly only a tenth of them continue	3	2	219	67	4	Church
church/NN/br-d03/945	0.0547322097087669	0.0217739645814236	church	NN	religion	non-fiction	B	B	AB	AB	church_of_england%1:14:00::	B2	B	AB	AB	 than an Archbishops' Commission`` reported last month that in the <font color=green>Church</font>  of England alone there are 790 churches which are redundant	1	0	127	0	8	Church
church/NN/br-d04/56	-0.0370547637982113	0.10389449709036	church	NN	religion	non-fiction	A	A	AB	AB	church_father%1:18:00::	A	A	AB	AB	 Jesus Christ the unique and the universal concur. Perhaps no <font color=green>church</font>  father saw this concurrence of the unique and the universal	4	6	211	150	7	church
church/NN/br-f15/713	0.125072022830529	0.0703761933033759	church	NN	popular_lore	fiction	B	B	AB	AB	roman_catholic_church%1:14:00::	B1	B	AB	AB	 permit birth control only for medical reasons. The Roman Catholic <font color=green>Church</font> , however, sanctions a much more liberal policy on family planning	5	4	124	80	11	Church
church/NN/br-f15/754	0.144267425755701	0.0686912323851848	church	NN	popular_lore	fiction	B	B	AB	AB	roman_catholic_church%1:14:00::	B1	B	AB	AB	 disagree over the methods to be used. The Roman Catholic <font color=green>Church</font>  sanctions only abstention or the rhythm method, also known as	1	0	213	0	7	Church
church/NN/br-f15/776	0.0556706341916517	-0.0561738360682171	church	NN	popular_lore	fiction	A	A	AB	AB	roman_catholic_church%1:14:00::	B1	B	AB	AB	 as the use of the infertile or safe period. The <font color=green>Church</font>  considers this to be the method provided by nature and	3	3	111	100	8	Church
church/NN/br-f15/862	-0.030905396669444	0.0120590496802193	church	NN	popular_lore	fiction	A	A	AB	AB	roman_catholic_church%1:14:00::	B1	B	AB	AB	 there seems little chance of agreement. The grounds for the <font color=green>Church</font>  's position are Scriptural( Old Testament), the teachings of the	3	1	78	33	8	Church
church/NN/br-f15/882	0.0533069157253536	-0.0692899703319358	church	NN	popular_lore	fiction	A	A	AB	AB	roman_catholic_church%1:14:00::	B1	B	AB	AB	 the teachings of the fathers and doctors of the early <font color=green>Church</font> , the unbroken tradition of nineteen centuries, the decisions of the	4	3	166	75	5	Church
church/NN/br-f44/1076	0.100610164899871	-0.0438508137043339	church	NN	popular_lore	fiction	C	C	C	CDE	church%1:14:00::	B	B	AB	AB	 and economic level of the congregation; the mission of the <font color=green>church</font>  is actually a process of informal co-optation; the lay ministry	5	2	157	40	8	church
church/NN/br-f44/1122	0.0288220459039875	-0.0483307998861528	church	NN	popular_lore	fiction	D	D	DE	CDE	church%1:14:00::	B	B	AB	AB	 process of co-optation so long as the environs of the <font color=green>church</font>  provide a sufficient pool of people who can fit the	1	0	122	0	6	church
church/NN/br-f44/1285	0.0927136278188626	-0.0298981051683927	church	NN	popular_lore	fiction	C	C	C	CDE	church%1:14:00::	B	B	AB	AB	 co-optation is the principal form of mission in the contemporary <font color=green>church</font> ; economic integration and co-optation are the two methods by which	3	2	149	67	8	church
church/NN/br-f44/1618	0.116939755999983	-0.0654688979761896	church	NN	popular_lore	fiction	C	C	C	CDE	church%1:14:00::	B	B	AB	AB	 in the metropolis. It now becomes evident that the denominational <font color=green>church</font>  is intimately involved with the economy of middle-class culture, for	5	3	175	60	6	church
church/NN/br-f44/2150	0.0386109893197725	-0.0262438332394792	church	NN	popular_lore	fiction	C	C	C	CDE	church%1:14:00::	B	B	AB	AB	 will occupy our attention under the rubric of the organization <font color=green>church</font> . An understanding of the new role of residential association in	3	3	146	100	8	church
church/NN/br-f44/368	0.0156856799654509	-0.0200122560176291	church	NN	popular_lore	fiction	C	C	C	CDE	church%1:14:00::	B	B	AB	AB	 they can lose higher- and lower status members from the <font color=green>church</font>  without collapsing, but they need adequate recruits for the core	3	2	153	67	8	church
church/NN/br-f44/647	0.0376014500179382	0.0508355774657366	church	NN	popular_lore	fiction	A	A	AB	AB	church%1:14:00::	B	B	AB	AB	 denominations. There is much talk in theological circles about the`` <font color=green>Church</font>  as Mission'' and the`` Church 's Mission''; theologians have been	4	4	245	100	7	Church
church/NN/br-f44/654	0.0331448760368117	0.0370200888942263	church	NN	popular_lore	fiction	A	A	AB	AB	church%1:14:00::	B	B	AB	AB	 in theological circles about the`` Church as Mission'' and the`` <font color=green>Church</font>  's Mission''; theologians have been stressing the fact that the	4	2	230	50	5	Church
church/NN/br-f44/667	0.0087052051381631	-0.0568082941314168	church	NN	popular_lore	fiction	A	A	AB	AB	church%1:14:00::	B	B	AB	AB	 's Mission''; theologians have been stressing the fact that the <font color=green>Church</font>  does not exist for its own sake but as a	4	2	121	50	5	Church
church/NN/br-f44/924	0.0797199515066667	-0.0201513557263421	church	NN	popular_lore	fiction	C	C	C	CDE	church%1:14:00::	B	B	AB	AB	 with friendly members the`` contacts with an organization of the <font color=green>church</font> ''( 11.2 per cent of the cases), then a substantial two	3	3	181	100	6	church
church/NN/br-f44/986	0.00184246395780904	-0.00539393007017301	church	NN	popular_lore	fiction	C	C	C	CDE	church%1:14:00::	B	B	AB	AB	 people; the new people respond in kind by joining the <font color=green>church</font> . Missionary outreach by friendly contact looks somewhat different when one	4	2	132	50	12	church
church/NN/br-g12/1271	0.312990940366448	0.182048166394112	church	NN	belles_lettres	fiction	D	D	DE	CDE	church%1:06:00::	D	D	DE	CDE	 and gestured toward the Madeleine. The classical lines of the <font color=green>church</font>  which Napoleon thought of as a Temple of Glory, dominated	5	2	271	40	3	church
church/NN/br-g12/1807	-0.104062516881465	0.29746574476117	church	NN	belles_lettres	fiction	D	D	DE	CDE	church%1:06:00::	D	D	DE	CDE	 not attractive, but it is deeper. When you pass a <font color=green>church</font>  on an Irish bus, all the hands flurry in the	2	2	111	100	4	church
church/NN/br-g12/544	-0.207686123985028	0.024768031333281	church	NN	belles_lettres	fiction	D	D	DE	CDE	church%1:06:00::	D	D	DE	CDE	 the Madeleine and across to a sidewalk cafe opposite that <font color=green>church</font> . The conversation that ensued may have been engrossing but it	4	3	188	75	6	church
church/NN/br-h17/1199	0.0242200506845124	-0.104834154019821	church	NN	miscellaneous	non-fiction	C	C	C	CDE	church%1:14:00::	B	B	AB	AB	 because of his willingness to kill in defense of his <font color=green>church</font>  and home. Upon administrative approval of the reclassification, he was	2	1	175	50	6	church
church/NN/br-h17/1434	0.0561073002707934	-0.0367689826987096	church	NN	miscellaneous	non-fiction	C	C	C	CDE	church%1:14:00::	B	B	AB	AB	 preaching and from 20 to 25 hours per month to <font color=green>church</font>  activities. His claim was therefore`` so highly exaggerated'', the Department	1	1	133	100	8	church
church/NN/br-j23/1105	0.0635153600528223	-0.0214794396652074	church	NN	learned	non-fiction	C	C	C	CDE	church_member%1:18:00::	C	C	C	CDE	 which is reflective of our common religion. Even the non <font color=green>church</font>  members- the freewheelers, marginal religionists and so on- have the	2	2	119	100	6	church
church/NN/br-j57/2237	-0.017389584922233	0.111553976549692	church	NN	learned	non-fiction	A	A	AB	AB	church_father%1:18:00::	A	A	AB	AB	 which reached Christianity by the way of Stoicism through the <font color=green>Church</font>  Fathers of Late Antiquity.	3	2	157	67	4	Church
church/NN/br-j57/958	-0.0289760722247666	0.0207925998556532	church	NN	learned	non-fiction	A	A	AB	AB	church_father%1:18:00::	A	A	AB	AB	 all possessions. This conception was taken up by the early <font color=green>Church</font>  Fathers and by canon lawyers and theologians in the Middle	5	3	145	60	7	Church
church/NN/br-j58/1496	0.00249160014014939	-0.0873995961620662	church	NN	learned	non-fiction	D	D	DE	CDE	church_bell%1:06:00::	D	D	DE	CDE	 In many Northern towns and cities meetings were held and <font color=green>church</font>  bells were tolled. Such was not the case in Rhode	4	2	94	50	9	church
church/NN/br-k04/1076	-0.0212965938645672	-0.00729343856868892	church	NN	fiction_gral	fiction	D	D	DE	CDE	church%1:06:00::	D	D	DE	CDE	 There were two liquor saloons not very far from the <font color=green>church</font> , one white, that is conducted for white people with a	4	3	129	75	11	church
church/NN/br-k04/1117	-0.271793887851625	-0.0766391146868884	church	NN	fiction_gral	fiction	D	D	DE	CDE	church%1:06:00::	D	D	DE	CDE	 of gambling in both. On the other side of the <font color=green>church</font>  was a quiet, well-kept house with shutters and recently painted	4	0	170	0	4	church
church/NN/br-k04/1145	-0.0703780409171433	-0.222146440821425	church	NN	fiction_gral	fiction	C	C	C	CDE	church%1:14:00::	B	B	AB	AB	 it. It was called Kent House. The deacon of the <font color=green>church</font> , Carlson, was its janitor. One of the leading members of	3	0	102	0	5	church
church/NN/br-k04/1353	-0.0408076632703309	-0.0571533963666545	church	NN	fiction_gral	fiction	D	D	DE	CDE	church%1:06:00::	D	D	DE	CDE	 tract of land, and it occurred to him that the <font color=green>church</font>  and the better Negro homes might gradually be moved to	3	3	96	100	7	church
church/NN/br-k04/1419	-0.0226055839379003	-0.0322139713158986	church	NN	fiction_gral	fiction	C	C	C	CDE	church%1:06:00::	D	D	DE	CDE	 stress, and that was that the contribution to the general <font color=green>church</font>  expenses, the dollar money, had been seriously falling behind in	3	3	125	100	10	church
church/NN/br-k04/1433	-0.0307572545275822	-0.0121293375107941	church	NN	fiction_gral	fiction	C	C	C	CDE	church%1:06:00::	D	D	DE	CDE	 the dollar money, had been seriously falling behind in this <font color=green>church</font> , and that must be looked after immediately. In fact, he	1	1	85	100	12	church
church/NN/br-k04/1485	0.0284296486539639	0.0176356842350469	church	NN	fiction_gral	fiction	C	C	C	CDE	church%1:06:00::	D	D	DE	CDE	 that clear as this was, they must have a better <font color=green>church</font> , a more business-like conduct of the church organization, and an	2	1	191	50	6	church
church/NN/br-k04/1493	0.0262210122663318	0.00859416154820658	church	NN	fiction_gral	fiction	C	C	C	CDE	church%1:14:00::	B	B	AB	AB	 have a better church, a more business-like conduct of the <font color=green>church</font>  organization, and an effort to get this religious center out	4	3	173	75	8	church
church/NN/br-k04/1514	0.0848605288534296	-0.0525512607906702	church	NN	fiction_gral	fiction	C	C	C	CDE	church%1:14:00::	B	B	AB	AB	 out of its rut of wild worship into a modern <font color=green>church</font>  organization. He emphasized to the Presiding Elder the plan of	5	3	200	60	6	church
church/NN/br-k04/1530	-0.0480712281209418	-0.0252456418780047	church	NN	fiction_gral	fiction	D	D	DE	CDE	church%1:06:00::	D	D	DE	CDE	 the Presiding Elder the plan of giving up the old <font color=green>church</font>  and moving across the river. The Presiding Elder was sure	5	3	86	60	5	church
church/NN/br-k04/1578	-0.0342889215982801	-0.0196155180278103	church	NN	fiction_gral	fiction	D	D	DE	CDE	church%1:06:00::	D	D	DE	CDE	 impossible. The bank which held the mortgage on the old <font color=green>church</font>  declared that the interest was considerably in arrears, and the	2	1	118	50	6	church
church/NN/br-k04/1634	-0.0704645313154439	-0.0934941181765063	church	NN	fiction_gral	fiction	D	D	DE	CDE	church%1:06:00::	D	D	DE	CDE	 to colored folk. When it was proposed to rebuild the <font color=green>church</font> , Wilson found that the terms for a new mortgage were	2	0	141	0	6	church
church/NN/br-k04/1685	0.085521111736802	-0.152132232219483	church	NN	fiction_gral	fiction	D	D	DE	CDE	church%1:06:00::	D	D	DE	CDE	 made to his Deacon Board, he met unanimous opposition. The <font color=green>church</font>  certainly would not be removed. The very proposition was sacrilege	3	1	120	33	7	church
church/NN/br-k04/1807	-0.0859110358837431	-0.0580803887717883	church	NN	fiction_gral	fiction	D	D	DE	CDE	church%1:06:00::	D	D	DE	CDE	 of money that has been invested by whites around that <font color=green>church</font> ? Tenements, stores, saloons, some gambling, I hope not too much	5	2	157	40	6	church
church/NN/br-k04/1874	-0.118997938366774	-0.093985572172558	church	NN	fiction_gral	fiction	D	D	DE	CDE	church%1:06:00::	D	D	DE	CDE	 were you I would just plan to repair the old <font color=green>church</font>  so it would last for five or ten years. By	3	3	104	100	7	church
church/NN/br-k04/2301	0.0478989262820328	0.00855901633656361	church	NN	fiction_gral	fiction	B	B	AB	AB	methodist_church%1:14:00::	B2	B	AB	AB	 mean practically the end of his career in the Methodist <font color=green>church</font> , if not in all churches.	3	1	133	33	6	church
church/NN/br-k04/356	-0.0654180966403583	-0.0351010070906878	church	NN	fiction_gral	fiction	C	C	C	CDE	church%1:06:00::	D	D	DE	CDE	 with the whites, especially the rich who partly supported the <font color=green>church</font> . The Deacon Board, headed by a black man named Carlson	7	4	156	57	7	church
church/NN/br-k04/397	0.104924211793939	-0.00801113571159284	church	NN	fiction_gral	fiction	C	C	C	CDE	church%1:06:00::	D	D	DE	CDE	 support of the Amen corner. The characteristic thing about this <font color=green>church</font>  was its Amen corner and the weekly religious orgy. A	4	4	181	100	6	church
church/NN/br-k04/828	-0.0168628341803246	-0.00339219680649369	church	NN	fiction_gral	fiction	C	C	C	CDE	church%1:14:00::	B	B	AB	AB	 the home of one of the old members of the <font color=green>church</font> , a woman named Catt who, as Wilson afterward found, was	2	2	146	100	7	church
church/NN/br-k04/877	-0.00851904588251548	-0.123544245604231	church	NN	fiction_gral	fiction	C	C	C	CDE	church%1:14:00::	B	B	AB	AB	 never married, conducting a spotless home and devoted to her <font color=green>church</font> , but a perpetual dissenter and born critic. She soared over	2	1	214	50	5	church
church/NN/br-k04/923	-0.0731913094112291	-0.0601417506243126	church	NN	fiction_gral	fiction	D	D	DE	CDE	church%1:06:00::	D	D	DE	CDE	 which she was chief repository. Then Wilson looked over the <font color=green>church</font>  and studied its condition. The salary of the pastor had	3	3	139	100	8	church
church/NN/br-k04/975	-0.172599288881124	-0.10874398217459	church	NN	fiction_gral	fiction	D	D	DE	CDE	church%1:06:00::	D	D	DE	CDE	 he mentioned this to the Deacons they said nothing. The <font color=green>church</font>  itself must be repaired. It was dirty and neglected. It	3	2	112	67	7	church
church/NN/br-k06/1056	-0.0660894299785453	0.0353952412168881	church	NN	fiction_gral	fiction	D	D	DE	CDE	church%1:06:00::	D	D	DE	CDE	 northward to Brooklyn, below Point Peter, he could see the <font color=green>church</font>  spire wherever he looked back. Sometimes they went south and	5	2	115	40	6	church
church/NN/br-k06/1389	-0.146676052336249	-0.04660048173531	church	NN	fiction_gral	fiction	D	D	DE	CDE	church%1:06:00::	D	D	DE	CDE	 with its peaked lance. Stevie was constantly slipping into the <font color=green>church</font> . He pulled with all his strength at the heavy, brass	3	2	109	67	6	church
church/NN/br-k06/1473	-0.185770633281727	0.0339976967788522	church	NN	fiction_gral	fiction	D	D	DE	CDE	church%1:06:00::	D	D	DE	CDE	 hands tucked under his coattails, and staring into the dark <font color=green>church</font> . The figure was wreathed in an extraordinary luminescence. The boy	3	2	104	67	5	church
church/NN/br-k06/528	-0.208493976382944	0.00790551620516364	church	NN	fiction_gral	fiction	D	D	DE	CDE	church%1:06:00::	D	D	DE	CDE	 his head out. There was the slate roof of the <font color=green>church</font> ; ivy climbed the red brick walls like a green scaled	5	3	152	60	7	church
church/NN/br-k06/571	-0.257271296632564	0.156369133829715	church	NN	fiction_gral	fiction	D	D	DE	CDE	church%1:06:00::	D	D	DE	CDE	 cupboards.`` There 's a tower and a steeple on the <font color=green>church</font>  a million feet high. And the loudest clock in the	3	2	160	67	5	church
church/NN/br-k06/659	-0.252919680694242	-0.171768547497765	church	NN	fiction_gral	fiction	D	D	DE	CDE	church%1:06:00::	D	D	DE	CDE	 Street to Orange Square. The steeple leaned backward, while the <font color=green>church</font>  advanced like a headless creature in a long, shapeless coat	5	0	225	0	3	church
church/NN/br-k06/852	-0.186475924968925	0.17112425208769	church	NN	fiction_gral	fiction	D	D	DE	CDE	church%1:06:00::	D	D	DE	CDE	 Church with its high steeple and clock. There was no <font color=green>church</font>  like Drew Church, no preacher like Papa, who was intimate	3	2	181	67	5	church
church/NN/br-k10/1423	0.0218669679331626	-0.0426720496327201	church	NN	fiction_gral	fiction	A	A	AB	AB	church%1:14:00::	B	B	AB	AB	 economics, and social issues that are no concern of the <font color=green>Church</font> ''? And John 's reply was always the same:`` Anything that	5	1	117	20	8	Church
church/NN/br-k10/1445	-0.0768334060384451	-0.163019641404695	church	NN	fiction_gral	fiction	A	A	AB	AB	church%1:14:00::	B	B	AB	AB	 same:`` Anything that affects souls is the concern of the <font color=green>Church</font> ! We will have righteousness''! Tears burned behind his eyes as	3	2	150	67	7	Church
church/NN/br-k10/1802	0.0118824289137201	0.135794976973037	church	NN	fiction_gral	fiction	B	B	AB	AB	church_of_rome%1:14:00::	B1	B	AB	AB	 Geneva, saying that he had been a bishop of the <font color=green>Church</font>  of Rome and had been persecuted in Paris for his	2	1	91	50	7	Church
church/NN/br-k10/205	-0.115360854202631	0.179367006549829	church	NN	fiction_gral	fiction	A	A	AB	AB	church%1:14:00::	B	B	AB	AB	 that the couple would have to be punished if the <font color=green>Church</font>  was to be respected.`` I have told you before, and	2	1	95	50	6	Church
church/NN/br-k10/257	-0.074220901156511	0.0604723503540266	church	NN	fiction_gral	fiction	A	A	AB	AB	church%1:14:00::	B	B	AB	AB	 is the answer the ungodly will always make when the <font color=green>Church</font>  points its fingers at their sins. I say to you	3	2	107	67	7	Church
church/NN/br-k10/271	-0.090113428776214	-0.142517105034713	church	NN	fiction_gral	fiction	A	A	AB	AB	church%1:14:00::	B	B	AB	AB	 fingers at their sins. I say to you that the <font color=green>Church</font>  will ever decry evil''! John 's reply was like a	3	2	157	67	7	Church
church/NN/br-k10/561	-0.0475395728223492	-0.00721275115932333	church	NN	fiction_gral	fiction	A	A	AB	AB	church%1:14:00::	B	B	AB	AB	 weeks before, in early November, without being reconciled to the <font color=green>Church</font> . The canons, in a body, had tried to force him	3	1	100	33	4	Church
church/NN/br-k10/588	-0.0229251029314106	0.138262952541964	church	NN	fiction_gral	fiction	A	A	AB	AB	church%1:14:00::	B	B	AB	AB	 to let them give him the last rites of the <font color=green>Church</font> , but he had died still proclaiming salvation by faith. Burial	3	2	155	67	8	Church
church/NN/br-k10/967	-0.106307923925058	0.0103377545381311	church	NN	fiction_gral	fiction	D	D	DE	CDE	church%1:06:00::	D	D	DE	CDE	 all the time. Quickening his steps, John entered the vast <font color=green>church</font>  and climbed the tower steps to the bells. Underneath the	6	6	167	100	8	church
