id	model.x	model.y	lemma	pos	genre	broad_genre	marisense	mbroad	mari3	mari2	sensekey	wnsense	wnbroad	wn3	wn2	text	cues	cues_with_weight	mean_weight_x100	wcratio_x100	weighted_cw	wf	new_pos	new_broad_genre
state/NN/br-h24/512	0.120363621640692	0.0489712650650938	state	NN	miscellaneous	non-fiction	A5	A	AB	ABC	united_states%1:15:00::	A51	A	AB	ABC	 returns are due April 16, 1962. However, if their United <font color=green>States</font>  income is not subject to the withholding of tax on	1	0	201	0	4	States	NNPS	technical
state/NN/br-j03/1194	0.0285651066054914	-0.11524558699322	state	NN	learned	non-fiction	D	D	D	D	state%1:03:00::	D1	D	D	D	 equilibrium( referred to by some as thermostatics) to the steady <font color=green>state</font> . This can be justified thermodynamically in this case, and this	3	1	164	33	4	state	NN	essays
state/NN/br-j03/2180	0.0226558313591692	-0.450901548643654	state	NN	learned	non-fiction	D	D	D	D	state%1:03:00::	D1	D	D	D	 which states that** f, where \q is the probability that <font color=green>state</font> ( i.e., volume for an ideal gas) could be reached by	3	0	133	0	1	state	NN	essays
state/NN/br-j03/353	0.125311570604168	-0.381212592156918	state	NN	learned	non-fiction	D	D	D	D	state%1:03:00::	D1	D	D	D	 the tape was run for over 1 hr., a steady <font color=green>state</font>  was not reached, and it was concluded that the reason	2	1	196	50	1	state	NN	essays
state/NN/br-j03/577	0.138294903510622	-0.333886336125704	state	NN	learned	non-fiction	D	D	D	D	state%1:03:00::	D1	D	D	D	 fluid measured from the top of the block, and steady <font color=green>states</font>  were apparently reached with these fluids. It is presumed that	3	1	161	33	2	states	NNS	essays
state/NN/br-j07/1320	0.20921592057425	-0.430758895891257	state	NN	learned	non-fiction	A5	A	AB	ABC	united_states%1:15:00::	A51	A	AB	ABC	 cause a deviation from a linear relationship. In the United <font color=green>States</font> , most of the sensors are calibrated by dropping small spheres	1	0	142	0	1	States	NNPS	essays
state/NN/br-j07/414	0.131578680894769	-0.233657473193097	state	NN	learned	non-fiction	D	D	D	D	state%1:03:00::	D1	D	D	D	 the material spiraling into the sun, maintaining a fairly steady <font color=green>state</font> . Asteroidal collisions are also thought to contribute material. It is	3	1	177	33	2	state	NN	essays
state/NN/br-j10/14	-0.281797659092552	-0.208251772597858	state	NN	learned	non-fiction	D	D	D	D	state%1:03:00::	D1	D	D	D	 the honeybee, practically all bees and bumblebees hibernate in a <font color=green>state</font>  of torpor. Occasionally, you may come across one or two	2	0	114	0	2	state	NN	essays
state/NN/br-j10/1969	-0.0889962648424713	-0.345033216468254	state	NN	learned	non-fiction	A5	A	AB	ABC	united_states%1:15:00::	A51	A	AB	ABC	 found in tremendous numbers in certain parts of the United <font color=green>States</font>  west of the Great Plains, for example, in Utah and	1	0	146	0	1	States	NNPS	essays
state/NN/br-j10/1988	-0.00864445714563716	0.0903737224578778	state	NN	learned	non-fiction	A5	A	AB	ABC	united_states%1:15:00::	A51	A	AB	ABC	 for example, in Utah and central Washington. In the United <font color=green>States</font>  Department of Agriculture 's Yearbook of Agriculture, 1952, which is	1	0	181	0	4	States	NNPS	essays
state/NN/br-j10/543	-0.0881639958195315	-0.0609078412647076	state	NN	learned	non-fiction	A5	A	AB	ABC	united_states%1:15:00::	A51	A	AB	ABC	 Bombus; there must be several dozen species in the United <font color=green>States</font>  alone. If you really insist on knowing their names, an	1	0	114	0	2	States	NNPS	essays
state/NN/br-j11/799	1.78520936335061e-05	-0.293256690217284	state	NN	learned	non-fiction	A5	A	AB	ABC	united_states%1:15:00::	A51	A	AB	ABC	 summary of the habits of the snakes of the United <font color=green>States</font> , could supply data on the maturing period for only three	1	0	129	0	2	States	NNPS	essays
state/NN/br-j11/916	-0.242921324777771	0.272072750097699	state	NN	learned	non-fiction	A5	A	AB	ABC	united_states%1:15:00::	A51	A	AB	ABC	 three. Other herpetologists have ascertained that in the northern United <font color=green>States</font>  the prairie rattlesnake may not give first birth until it	1	0	170	0	1	States	NNPS	essays
state/NN/br-j17/1109	-0.011353564021781	-0.355738723225068	state	NN	learned	non-fiction	D	D	D	D	state%1:03:00::	D1	D	D	D	 balance, but for the sake of correlating autonomic and clinical <font color=green>states</font> , and of studying the effect of certain therapeutic procedures on	5	2	151	40	3	states	NNS	essays
state/NN/br-j17/1231	-0.0174197625682357	-0.206472534325358	state	NN	learned	non-fiction	D	D	D	D	state%1:03:00::	D1	D	D	D	 persons by drugs. The fundamental differences between physiological and pathological <font color=green>states</font>  of parasympathetic( and also of sympathetic) dominance remain to be	5	3	167	60	5	states	NNS	essays
state/NN/br-j17/1283	0.026385285820611	-0.229830242928444	state	NN	learned	non-fiction	D	D	D	D	state%1:03:00::	D1	D	D	D	 its balance lead also to qualitative alterations in reactivity. A <font color=green>state</font>  of parasympathetic`` tuning'' of the hypothalamus induced experimentally causes not	6	2	149	33	3	state	NN	essays
state/NN/br-j17/1330	-0.00500497742652072	-0.187219406905065	state	NN	learned	non-fiction	D	D	D	D	state%1:03:00::	D1	D	D	D	 a stimulus acting sympathetically under control conditions elicits in this <font color=green>state</font>  of tuning a parasympathetic response! Furthermore, conditioned reactions are fundamentally	4	3	156	75	4	state	NN	essays
state/NN/br-j17/1500	-0.0067585684812947	-0.137691563573382	state	NN	learned	non-fiction	D	D	D	D	state%1:03:00::	D1	D	D	D	 altering the hypothalamic balance alter conditioned reactions;( 3) in a <font color=green>state</font>  of depression, the positive conditioned stimulus may fail to elicit	4	3	158	75	7	state	NN	essays
state/NN/br-j17/1558	-0.0130664603922726	-0.144320589193889	state	NN	learned	non-fiction	D	D	D	D	state%1:03:00::	D1	D	D	D	 fundamental alterations in conditioned reactions occur in a variety of <font color=green>states</font>  in which the hypothalamic balance has been altered by physiological	4	3	165	75	7	states	NNS	essays
state/NN/br-j17/1626	-0.00623733207276236	-0.201453971458429	state	NN	learned	non-fiction	D	D	D	D	emotional_state%1:26:00::	D1	D	D	D	 just mentioned which alter the hypothalamic balance would influence emotional <font color=green>state</font>  and behavior but that emotion itself would act likewise. We	4	1	157	25	5	state	NN	essays
state/NN/br-j17/2022	-0.0318633864707037	-0.190337500555645	state	NN	learned	non-fiction	D	D	D	D	state%1:03:00::	D1	D	D	D	 a functional antagonism exists between an aggressive attitude and a <font color=green>state</font>  of anxiety. Although in both emotions sympathetic symptoms are present	3	1	137	33	6	state	NN	essays
state/NN/br-j17/2076	-0.0194260014631354	-0.194371121230998	state	NN	learned	non-fiction	D	D	D	D	emotional_state%1:26:00::	D1	D	D	D	 and the Mecholyl test. The psychological incompatibility of these emotional <font color=green>states</font>  seems to be reflected in, or based on, this marked	2	2	181	100	3	states	NNS	essays
state/NN/br-j17/2207	0.0387975864674391	-0.315985517630668	state	NN	learned	non-fiction	D	D	D	D	state%1:03:00::	D1	D	D	D	 for major changes in behavior seen in various moods and <font color=green>states</font>  of emotions in man and beast under physiological circumstances, in	4	2	191	50	2	states	NNS	essays
state/NN/br-j17/2256	-0.00529149705472063	-0.150534811445323	state	NN	learned	non-fiction	D	D	D	D	state%1:03:00::	D1	D	D	D	 neurotic and psychotic disorders and the parallelism observed between autonomic <font color=green>states</font>  and psychological behavior in several instances, it is further suggested	3	2	161	67	4	states	NNS	essays
state/NN/br-j17/504	0.041033723784041	-0.277961724679464	state	NN	learned	non-fiction	D	D	D	D	state%1:03:00::	D1	D	D	D	 level, the lessened hypothalamic cortical discharges lead to a diminished <font color=green>state</font>  of activity in the cortex with consequent reduction in the	4	1	149	25	2	state	NN	essays
state/NN/br-j17/574	0.0110745235339458	-0.227141760309472	state	NN	learned	non-fiction	D	D	D	D	state%1:03:00::	D1	D	D	D	 these pathological conditions, we should remember that changes in the <font color=green>state</font>  of the hypothalamus within physiological limits distinguish sleep from wakefulness	5	2	188	40	3	state	NN	essays
state/NN/br-j17/891	-0.0202773953959439	-0.178459209775295	state	NN	learned	non-fiction	D	D	D	D	emotional_state%1:26:00::	D1	D	D	D	 direction causes excitatory effects and, eventually, maniclike changes. The emotional <font color=green>states</font>  produced by drugs influence the cortical potentials in a characteristic	5	2	132	40	4	states	NNS	essays
state/NN/br-j22/1281	0.0317310153480982	-0.0392982455411545	state	NN	learned	non-fiction	A5	A	AB	ABC	united_states%1:14:00::	A52	A	AB	ABC	 By holding out prospects for external capital assistance, the United <font color=green>States</font>  can provide strong incentives to prepare for the concerted economic	1	0	160	0	4	States	NNPS	essays
state/NN/br-j22/182	-0.16696656302191	-0.0934135083915945	state	NN	learned	non-fiction	A5	A	AB	ABC	united_states%1:15:00::	A51	A	AB	ABC	 countries passing through this stage can be escaped. The United <font color=green>States</font>  can help by communicating a genuine concern with the problems	1	0	110	0	2	States	NNPS	essays
state/NN/br-j22/976	0.069458184851232	0.0419393385435815	state	NN	learned	non-fiction	A3	A	AB	ABC	state%1:15:01::	A	A	AB	ABC	 the governments to develop their own technical assistance to communities, <font color=green>state</font>  and provincial governments, rural communities, and other smaller groups, making	3	4	202	133	5	state	NN	essays
state/NN/br-j23/1025	-0.0977191701960535	-0.153798464911605	state	NN	learned	non-fiction	A5	A	AB	ABC	united_states%1:15:00::	A51	A	AB	ABC	 reaffirms, and maintains the fundamental values. Even in the united <font color=green>states</font> , with its freedom of religious belief and worship and its	1	0	134	0	3	states	NNS	essays
state/NN/br-j23/1206	-0.248767093580435	-0.170335578601318	state	NN	learned	non-fiction	D	D	D	D	state%1:03:00::	D1	D	D	D	 marriage as a sacrament, much law-breaking as sinful, occasionally the <font color=green>state</font>  as a divine instrument. It places certain values at least	4	1	129	25	2	state	NN	essays
state/NN/br-j23/1793	-0.323104190498542	-0.0537296798037738	state	NN	learned	non-fiction	A5	A	AB	ABC	united_states%1:15:00::	A51	A	AB	ABC	 at many secular semi-public and public occasions in the United <font color=green>States</font> ; and it is evidenced in the prayers offered, in the	1	0	180	0	3	States	NNPS	essays
state/NN/br-j23/786	-0.0757547251978229	-0.0800874796207572	state	NN	learned	non-fiction	D	D	D	D	state%1:03:00::	D1	D	D	D	 a principle of compensation, mainly in a promised perfect future <font color=green>state</font> . The belief in immortality, where held, functions as a redress	2	0	138	0	6	state	NN	essays
state/NN/br-j29/2105	-0.227254538999354	-0.402882721154128	state	NN	learned	non-fiction	D	D	D	D	state%1:03:00::	D1	D	D	D	 able to achieve because he is aroused to an energetic <font color=green>state</font>  without becoming confused or panicked. Sarason et al. present evidence	4	1	204	25	1	state	NN	essays
state/NN/br-j34/732	0.125394056125939	-0.195374480975415	state	NN	learned	non-fiction	D	D	D	D	emotional_state%1:26:00::	D1	D	D	D	 differences from one speaker to another, or from one emotional <font color=green>state</font>  to another, may far exceed the small differences between tones	1	1	167	100	2	state	NN	essays
state/NN/br-j38/1125	0.0151880611775458	-0.0117314026655875	state	NN	learned	non-fiction	A1	A	AB	ABC	state%1:14:01::	B	B	AB	ABC	 which make it an asset to industrial development efforts. Few <font color=green>states</font>  make effective use of their existing vocational education programs or	5	3	145	60	4	states	NNS	essays
state/NN/br-j38/1149	0.0391809095447613	0.00284441603126896	state	NN	learned	non-fiction	A1	A	AB	ABC	state%1:14:01::	B	B	AB	ABC	 the purpose of attracting new industry. The opportunity exists for <font color=green>states</font>  to reserve some of their vocational education funds to apply	4	2	147	50	6	states	NNS	essays
state/NN/br-j38/1549	0.0288499361085463	0.0217373058627915	state	NN	learned	non-fiction	A1	A	AB	ABC	state%1:14:01::	B	B	AB	ABC	 the Federal government but from an exchange of experiences among <font color=green>states</font> . State and local agencies in the vocational education field must	6	3	173	50	6	states	NNS	essays
state/NN/br-j38/1818	0.0672657089963291	0.0454688126265688	state	NN	learned	non-fiction	A3	A	AB	ABC	state_government%1:14:00::	C2	C	C	ABC	 unless a new industry is in sight and requests it. <font color=green>State</font>  governments have been taking the lead in establishing area vocational	2	1	195	50	3	State	NNP	essays
state/NN/br-j38/1888	0.0287319636643996	0.00482482408135433	state	NN	learned	non-fiction	A1	A	AB	ABC	state%1:14:01::	B	B	AB	ABC	 for the vocational education, it could be argued that the <font color=green>state</font>  should not have to bear the cost of vocational training	3	3	161	100	6	state	NN	essays
state/NN/br-j38/1905	0.0680510886055432	0.0195697820132016	state	NN	learned	non-fiction	A4	A	AB	ABC	state%1:15:01::	A	A	AB	ABC	 cost of vocational training which would benefit employers in other <font color=green>states</font> . However, if Federal funds are used, it would be entirely	3	2	173	67	6	states	NNS	essays
state/NN/br-j38/249	0.0835328731094414	0.0695707216068713	state	NN	learned	non-fiction	A1	A	AB	ABC	state%1:14:01::	B	B	AB	ABC	 control remain primarily with the local school districts. Even the <font color=green>states</font>  remain primarily in an assisting role, providing leadership and teacher	4	2	204	50	3	states	NNS	essays
state/NN/br-j38/276	0.0150215903486396	0.0178135746258739	state	NN	learned	non-fiction	A3	A	AB	ABC	state%1:14:01::	B	B	AB	ABC	 is limited to half of the total expenditure, and the <font color=green>state</font>  or local districts must pay at least half. The state	3	2	138	67	6	state	NN	essays
state/NN/br-j38/287	0.0280979656197619	0.0367592273512467	state	NN	learned	non-fiction	A1	A	AB	ABC	state%1:14:01::	B	B	AB	ABC	 state or local districts must pay at least half. The <font color=green>state</font>  may decide to encourage local programs by paying half of	4	3	137	75	7	state	NN	essays
state/NN/br-j38/303	0.0285994750665834	0.0197016693355321	state	NN	learned	non-fiction	A1	A	AB	ABC	state%1:14:01::	B	B	AB	ABC	 local programs by paying half of the cost, or the <font color=green>state</font>  may require the local district to bear this half or	4	4	132	100	8	state	NN	essays
state/NN/br-j38/326	0.0670451679717046	0.0133504608350336	state	NN	learned	non-fiction	A3	A	AB	ABC	state_government%1:14:00::	C2	C	C	ABC	 some part of it. Throughout the history of the program, <font color=green>state</font>  government expenditures in the aggregate have usually matched or exceeded	3	2	157	67	4	state	NN	essays
state/NN/br-j38/353	0.0544242565120381	0.0208665945907231	state	NN	learned	non-fiction	A3	A	AB	ABC	state_government%1:14:00::	C2	C	C	ABC	 districts all together have spent more than either Federal or <font color=green>state</font>  governments. Today, Federal funds account for only one-fifth of the	3	4	216	133	6	state	NN	essays
state/NN/br-j38/388	0.0435343219676073	-0.00922366496905848	state	NN	learned	non-fiction	A1	A	AB	ABC	state%1:14:01::	B	B	AB	ABC	 matching fund principle has been in initially encouraging the poorest <font color=green>states</font>  and school districts to spend enough to obtain their full	3	2	169	67	7	states	NNS	essays
state/NN/br-j38/687	-0.0366834227607932	0.19158137613244	state	NN	learned	non-fiction	A4	A	AB	ABC	state%1:15:01::	A	A	AB	ABC	 it provides the essential groundwork for developing skills. In most <font color=green>states</font> , trade and industrial training is provided in a minority of	4	0	149	0	2	states	NNS	essays
state/NN/br-j38/769	0.0201958523612876	0.0227677039356127	state	NN	learned	non-fiction	A1	A	AB	ABC	state%1:14:01::	B	B	AB	ABC	 For a number of years Kentucky, Louisiana and several other <font color=green>states</font>  have been building state sponsored vocational education schools that serve	5	4	176	80	7	states	NNS	essays
state/NN/br-j38/773	0.0210602706688942	0.0211825532533499	state	NN	learned	non-fiction	A1	A	AB	ABC	state%1:14:01::	B	B	AB	ABC	 years Kentucky, Louisiana and several other states have been building <font color=green>state</font>  sponsored vocational education schools that serve nearby school districts in	4	2	186	50	8	state	NN	essays
state/NN/br-j42/1014	-0.244454643945798	-0.0965587390199952	state	NN	learned	non-fiction	C	C	C	ABC	state%1:14:00::	B1	B	AB	ABC	 occurred. It reached its ultimate philosophical statement in notions of`` <font color=green>state</font>  will'' put forward by the Germans, especially by Hegel, although	4	3	150	75	4	state	NN	essays
state/NN/br-j42/1082	-0.0357737771004438	-0.0226836966505275	state	NN	learned	non-fiction	C	C	C	ABC	state%1:14:00::	B1	B	AB	ABC	 community this reduced law to Jellinek 's auto limitation. A <font color=green>state</font> , the highest form of human organization in fact and theory	4	2	121	50	3	state	NN	essays
state/NN/br-j42/1184	-0.0371889287914063	-0.122464798864432	state	NN	learned	non-fiction	B	B	AB	ABC	state%1:14:00::	B1	B	AB	ABC	 except that willed by, acknowledged by, or consented to by <font color=green>states</font> . Hidden behind Hegelian abstractions were more practical reasons for a	3	0	121	0	3	states	NNS	essays
state/NN/br-j42/2015	0.168779343755418	0.34498618070543	state	NN	learned	non-fiction	B	B	AB	ABC	state%1:14:00::	B1	B	AB	ABC	 arrangement. It is not surprising that the international obligations of <font color=green>states</font>  were also viewed in terms of contract. In fact, some	3	1	108	33	1	states	NNS	essays
state/NN/br-j42/2212	0.0584996507516073	0.106476092005947	state	NN	learned	non-fiction	B	B	AB	ABC	state%1:14:00::	B1	B	AB	ABC	 proper, or, as it is often called, public international law. <font color=green>States</font>  were free to enact, within broad though( perhaps) determinate limits	5	2	124	40	2	States	NNPS	essays
state/NN/br-j42/301	-0.154844563576588	-0.160083645275658	state	NN	learned	non-fiction	B	B	AB	ABC	state%1:14:00::	B1	B	AB	ABC	 doctrine applicable among the great nations and the smaller European <font color=green>states</font>  did not really comfortably fit less developed and less powerful	4	1	174	25	3	states	NNS	essays
state/NN/br-j42/339	-0.180199731845366	-0.0176057493678504	state	NN	learned	non-fiction	A5	A	AB	ABC	united_states%1:15:00::	A51	A	AB	ABC	 in Latin America by the special interest of the United <font color=green>States</font>  as expressed in the Monroe Doctrine, itself from the outset	1	0	178	0	4	States	NNPS	essays
state/NN/br-j42/635	-0.0553935642076544	-0.0887708537225626	state	NN	learned	non-fiction	B	B	AB	ABC	state%1:14:00::	B1	B	AB	ABC	 law if they were to join this community as sovereign <font color=green>states</font> . Hall, for example, was quite explicit on this point when	2	1	196	50	3	states	NNS	essays
state/NN/br-j42/652	-0.147518635107248	-0.171300100204653	state	NN	learned	non-fiction	B	B	AB	ABC	state%1:14:00::	B1	B	AB	ABC	 example, was quite explicit on this point when he said`` <font color=green>states</font>  outside European civilization must formally enter into the circle of	2	1	184	50	3	states	NNS	essays
state/NN/br-j42/777	0.00112161728200223	-0.07156574516643	state	NN	learned	non-fiction	B	B	AB	ABC	state%1:14:00::	B1	B	AB	ABC	 of Justice into particular rules governing the relations of sovereign <font color=green>states</font> . The difference is important, for although the older law of	2	1	191	50	4	states	NNS	essays
state/NN/br-j42/879	-0.0598490413408192	-0.0744201480367274	state	NN	learned	non-fiction	C	C	C	ABC	state%1:14:00::	B1	B	AB	ABC	 entirely and confined itself to rules limiting the exercise of <font color=green>state</font>  power for reasons essentially unconnected with justice or morality save	4	1	132	25	4	state	NN	essays
state/NN/br-j42/964	0.014935814646839	-0.0204224431919141	state	NN	learned	non-fiction	C	C	C	ABC	state%1:14:00::	B1	B	AB	ABC	 was the growing nationalism and the tendency to regard the <font color=green>state</font> , and the individual 's identification with the state, as transcending	4	2	143	50	4	state	NN	essays
state/NN/br-j42/973	0.0467391087172518	0.00159499656153065	state	NN	learned	non-fiction	C	C	C	ABC	state%1:14:00::	B1	B	AB	ABC	 regard the state, and the individual 's identification with the <font color=green>state</font> , as transcending other ties of social solidarity. National identification was	3	1	140	33	3	state	NN	essays
state/NN/br-j56/249	0.0741219477443606	0.023271165245245	state	NN	learned	non-fiction	A3	A	AB	ABC	state%1:15:01::	A	A	AB	ABC	 1958 town meeting directed town authorities to seek federal and <font color=green>state</font>  funds with which to conduct a preliminary survey of a	3	2	164	67	4	state	NN	essays
state/NN/br-j58/146	-0.0983425634546569	0.225834552856073	state	NN	learned	non-fiction	A4	A	AB	ABC	state%1:15:01::	A	A	AB	ABC	 principles that they do not interfere with slavery in the <font color=green>states</font> ''. The two major newspapers in Providence continued, throughout the crisis	3	1	147	33	3	states	NNS	essays
state/NN/br-j58/1974	0.0352607954229773	0.158243751590385	state	NN	learned	non-fiction	B	B	AB	ABC	state%1:15:01::	A	A	AB	ABC	 recalled that in Rhode Island a party opposed to the <font color=green>state</font>  's condemnation of a man( Thomas W. Dorr) proclaimed the	1	0	156	0	3	state	NN	essays
state/NN/br-j58/1987	-0.0750667453135561	0.0155955995924605	state	NN	learned	non-fiction	A1	A	AB	ABC	state%1:15:01::	A	A	AB	ABC	 's condemnation of a man( Thomas W. Dorr) proclaimed the <font color=green>state</font>  's action as a violation of the law of the	4	2	137	50	3	state	NN	essays
state/NN/br-j58/320	-0.164058648747322	0.0852878667935207	state	NN	learned	non-fiction	A1	A	AB	ABC	state%1:15:01::	A	A	AB	ABC	 1859, John Brown was found guilty of treason against the <font color=green>state</font>  of Virginia, inciting slave rebellion, and murder. For these crimes	1	1	168	100	5	state	NN	essays
state/NN/br-j58/34	-0.0239286636349045	0.33392960029148	state	NN	learned	non-fiction	A4	A	AB	ABC	state%1:15:01::	A	A	AB	ABC	 the Declaration of Independence. During the Brown trial, however, the <font color=green>state</font>  's most powerful Democratic newspaper, the Providence Daily Post, stated	2	0	117	0	1	state	NN	essays
state/NN/br-j58/369	-0.0603211862955743	0.044837344472073	state	NN	learned	non-fiction	A4	A	AB	ABC	state%1:15:01::	A	A	AB	ABC	 editors, and clergymen heaped accusations of murder on the Southern <font color=green>states</font> , particularly Virginia. Although Rhode Islanders were preparing for the state	3	2	158	67	5	states	NNS	essays
state/NN/br-j58/381	-0.0433881877527264	0.0524516121830231	state	NN	learned	non-fiction	A3	A	AB	ABC	state%1:15:01::	A	A	AB	ABC	 states, particularly Virginia. Although Rhode Islanders were preparing for the <font color=green>state</font>  elections, they watched John Brown 's trial with extreme interest	3	1	157	33	4	state	NN	essays
state/NN/br-j58/515	-0.0136608811518567	0.0947500113708976	state	NN	learned	non-fiction	A4	A	AB	ABC	state%1:15:01::	A	A	AB	ABC	 and butchered her citizens''. In the eastern section of the <font color=green>state</font>  the newspapers' reaction to Brown 's trial and sentence were	3	3	189	100	4	state	NN	essays
state/NN/br-j58/717	0.0197825213002554	0.0438751236117707	state	NN	learned	non-fiction	A3	A	AB	ABC	state%1:15:01::	A	A	AB	ABC	 of John Brown, Rhode Islanders turned their attention to the <font color=green>state</font>  elections. The state had elected Republican candidates in the past	5	3	172	60	5	state	NN	essays
state/NN/br-j58/721	0.0228590871994258	0.050406554310655	state	NN	learned	non-fiction	A	A	AB	ABC	state%1:15:01::	A	A	AB	ABC	 Rhode Islanders turned their attention to the state elections. The <font color=green>state</font>  had elected Republican candidates in the past two years. There	3	3	166	100	4	state	NN	essays
state/NN/br-j58/746	-0.0681673269199414	0.21431260961836	state	NN	learned	non-fiction	A4	A	AB	ABC	state%1:15:01::	A	A	AB	ABC	 as to the control the Republican party exercised throughout the <font color=green>state</font> . If it failed on occasion to elect its candidates for	5	2	168	40	3	state	NN	essays
state/NN/br-j58/759	-0.0044195746584743	0.237325459416348	state	NN	learned	non-fiction	A3	A	AB	ABC	state%1:15:01::	A	A	AB	ABC	 it failed on occasion to elect its candidates for general <font color=green>state</font>  offices by majorities, the failure was due to a lingering	4	3	168	75	3	state	NN	essays
state/NN/br-j58/840	0.0532285213498438	0.127614356514574	state	NN	learned	non-fiction	A4	A	AB	ABC	state%1:15:01::	A	A	AB	ABC	 Congressional offices from the eastern and western sections of the <font color=green>state</font> . During the month of November hardly a day passed when	2	2	182	100	4	state	NN	essays
state/NN/br-j58/87	0.0494294069487519	0.0273207000336055	state	NN	learned	non-fiction	A3	A	AB	ABC	state_government%1:14:00::	C2	C	C	ABC	 the liberation of the slaves but also the overthrow of <font color=green>state</font>  and federal governments. The Providence Daily Journal answered the Daily	2	2	202	100	4	state	NN	essays
