id	model.x	model.y	lemma	pos	sensekey	marisense	mbroad	wnbroad	mari2	mari3	wn2	wn3	wnsense	text
church/NN/br-a16/453	-0.0822930716464201	-0.210210284176696	church	NN	Z	D	D	Z	CDE	DE	Z	Z	Z	 a small one at noon tomorrow in St. Bernadine 's <font color=green>church</font> , Forest Park. A small reception will follow in the Oak
church/NN/br-a17/2228	-0.105002791569366	-0.0325186968815677	church	NN	Z	D	D	Z	CDE	DE	Z	Z	Z	 Burgher Jr. seated guests. A reception was held at the <font color=green>church</font> . The First Christian Church of Pampa was the setting for
church/NN/br-a17/2233	-0.0988107123384454	-0.0290561568813894	church	NN	Z	D	D	Z	CDE	DE	Z	Z	Z	 A reception was held at the church. The First Christian <font color=green>Church</font>  of Pampa was the setting for the wedding last Sunday
church/NN/br-a21/677	-0.240517539886308	-0.00655521998338809	church	NN	Z	D	D	Z	CDE	DE	Z	Z	Z	 for 10 a. m. tomorrow in St. Anne 's Catholic <font color=green>Church</font> , 31978 Mound, in Warren. The mother and daughter, who will
church/NN/br-a22/1283	-0.17882916704218	-0.14295956604015	church	NN	Z	C	C	Z	CDE	C	Z	Z	Z	 painter. He was a member of the Oakland City Methodist <font color=green>Church</font>  and a native of Atlanta. Funeral services will be at
church/NN/br-a22/307	-0.14305912198313	-0.0488094327609084	church	NN	Z	B	B	Z	AB	AB	Z	Z	Z	 challenged by the state. Emory is affiliated with the Methodist <font color=green>Church</font> . Some church leaders, both clerical and lay, have criticized the
church/NN/br-a22/310	-0.14305912198313	-0.0488094327609084	church	NN	Z	A	A	Z	AB	AB	Z	Z	Z	 the state. Emory is affiliated with the Methodist Church. Some <font color=green>church</font>  leaders, both clerical and lay, have criticized the university for
church/NN/br-a31/1842	-0.502207980728588	0.0698986352193253	church	NN	Z	D	D	Z	CDE	DE	Z	Z	Z	 planned for 10: 50 a. m. Sunday at First Christian <font color=green>Church</font> . It will be the second time the assistant manager of
church/NN/br-a31/2112	-0.14305912198313	-0.0488094327609084	church	NN	Z	D	D	Z	CDE	DE	Z	Z	Z	 and program at 6 p. m. Sunday at Trinity Methodist <font color=green>Church</font> . He is the sexton of the church. A family worship
church/NN/br-a31/2120	-0.129576587496863	9.23413108876111e-05	church	NN	Z	D	D	Z	CDE	DE	Z	Z	Z	 at Trinity Methodist Church. He is the sexton of the <font color=green>church</font> . A family worship service will follow the program at 7
church/NN/br-b08/1866	-0.110115175283813	-0.00410038625809856	church	NN	Z	D	D	Z	CDE	DE	Z	Z	Z	 wrote after almost a decade of service to this majestic <font color=green>church</font> .`` Such a church needs vigor and vitality in its rector
church/NN/br-b08/1871	-0.110115175283813	-0.00410038625809856	church	NN	Z	C	C	Z	CDE	C	Z	Z	Z	 a decade of service to this majestic church.`` Such a <font color=green>church</font>  needs vigor and vitality in its rector and one man
church/NN/br-b12/2115	-0.277189211751592	0.180276596355408	church	NN	Z	A	A	Z	AB	AB	Z	Z	Z	 and Greek and other ancient writings, some by the early <font color=green>church</font>  fathers, in themselves called for a restudy of the Bible
church/NN/br-b12/2217	-0.14305912198313	-0.0488094327609084	church	NN	Z	B	B	Z	AB	AB	Z	Z	Z	 of a joint committee made up of representatives of the <font color=green>Church</font>  of England, Church of Scotland, Methodist Church, Congregational Union, Baptist
church/NN/br-b12/2226	-0.156773293543799	-0.0615088408694925	church	NN	Z	B	B	Z	AB	AB	Z	Z	Z	 representatives of the Church of England, Church of Scotland, Methodist <font color=green>Church</font> , Congregational Union, Baptist Union, Presbyterian Church of England, Churches in
church/NN/br-b12/2235	-0.156773293543799	-0.0615088408694925	church	NN	Z	B	B	Z	AB	AB	Z	Z	Z	 Church of Scotland, Methodist Church, Congregational Union, Baptist Union, Presbyterian <font color=green>Church</font>  of England, Churches in Wales, Churches in Ireland, Society of
church/NN/br-b15/1190	-0.288180610778746	-0.143224079309974	church	NN	Z	C	C	Z	CDE	C	Z	Z	Z	 El; Rev. DeWitt Clemens, pastor of the Mathewson Street Methodist <font color=green>Church</font> ; Mr. Felix Miranda, of the Imperial Knife Co.; and to
church/NN/br-d01/1628	-0.22849604316338	0.217083630196922	church	NN	church%1:14:00::	B	B	B	AB	AB	AB	AB	B	 age to whip men into a surrender to a particular <font color=green>church</font>  or church-state''. Apparently he does not intend that those who
church/NN/br-d02/1641	0.0494555516616395	0.234998506702045	church	NN	church%1:14:00::	B	B	B	AB	AB	AB	AB	B	 concerned to stand squarely within the tradition of the apostolic <font color=green>church</font> , they have exhibited no willingness whatever to sacrifice their modernity
church/NN/br-d02/706	-0.107069014456853	0.283676888199798	church	NN	church%1:14:00::	A	A	B	AB	AB	AB	AB	B	 there tends to be an almost complete indifference to the <font color=green>church</font>  and its traditional message of sin and grace. To be
church/NN/br-d02/923	-0.244741170844964	0.279608424873563	church	NN	church%1:14:00::	A	A	B	AB	AB	AB	AB	B	 for accomplishing his work in the world. by analogy, the <font color=green>church</font>  also has been regarded as entirely independent of the`` world
church/NN/br-d03/1342	-0.160748124233404	-0.0414914071540241	church	NN	church%1:06:00::	E	E	D	CDE	DE	CDE	DE	D	 my experience to find as many men as women in <font color=green>church</font> , and to hear almost everyone in church congregations reciting the
church/NN/br-d03/1350	-0.138068308259984	-0.0304405757064917	church	NN	church%1:06:00::	E	E	D	CDE	DE	CDE	DE	D	 as women in church, and to hear almost everyone in <font color=green>church</font>  congregations reciting the Latin prayers and responses at Mass. They
church/NN/br-d03/1871	-0.130772009537366	0.0204175115309806	church	NN	catholic_church%1:14:00::	B	B	B	AB	AB	AB	AB	B1	 the Sunday Observer implies a kindly recognition that the Catholic <font color=green>Church</font>  is now at least of equal stature in England with
church/NN/br-d03/1909	-0.213867970106054	0.103979396412161	church	NN	church_of_england%1:14:00::	B	B	B	AB	AB	AB	AB	B2	 non-Catholic) wrote articles in the Observer depicting clergymen of the <font color=green>Church</font>  of England, the Church of Rome and the Nonconformist Church
church/NN/br-d03/2336	-0.123196038600747	-0.0234035627118783	church	NN	catholic_church%1:14:00::	D	D	B	CDE	DE	AB	AB	B1	 a votive Mass offered for Christian unity at a Catholic <font color=green>church</font>  in Slough during the Church Unity Octave.
church/NN/br-d03/2341	-0.123196038600747	-0.0234035627118783	church	NN	church%1:14:00::	A	A	B	AB	AB	AB	AB	B	 Christian unity at a Catholic church in Slough during the <font color=green>Church</font>  Unity Octave.
church/NN/br-d03/721	-0.0457048990943838	-0.0807570369748976	church	NN	church%1:06:00::	B	B	D	AB	AB	CDE	DE	D	 crowds going in and out of the Birmingham Oratory( Catholic) <font color=green>Church</font>  on Sunday mornings. She found this a marvel because, as
church/NN/br-d05/1163	-0.180641090041791	0.345342666265551	church	NN	Z	B	B	Z	AB	AB	Z	Z	Z	 Parker as the ultra-liberal minister within the pale of a <font color=green>church</font>  which had proclaimed itself the repository of liberality poses a
church/NN/br-d06/2174	-0.242615986637064	-0.122745859032824	church	NN	Z	C	C	Z	CDE	C	Z	Z	Z	 spiritually. No amount of religious ceremonies or even joining a <font color=green>church</font>  will relieve the gnawing of your`` inner'' space. Why? Because
church/NN/br-d09/1044	-0.14305912198313	-0.0488094327609084	church	NN	Z	C	C	Z	CDE	C	Z	Z	Z	 such topics as:`` What Christ Means to Me'',`` What the <font color=green>Church</font>  Means to Me'',`` Why Join the Church'',`` The Duties of
church/NN/br-d09/1054	-0.14305912198313	-0.0488094327609084	church	NN	Z	C	C	Z	CDE	C	Z	Z	Z	 Me'',`` What the Church Means to Me'',`` Why Join the <font color=green>Church</font> '',`` The Duties of Church Members'', etc.. Assign a series of
church/NN/br-d09/1061	-0.14305912198313	-0.0488094327609084	church	NN	Z	C	C	Z	CDE	C	Z	Z	Z	 Means to Me'',`` Why Join the Church'',`` The Duties of <font color=green>Church</font>  Members'', etc.. Assign a series of catechism questions to be
church/NN/br-d09/2026	-0.00417244796971576	0.254762752815359	church	NN	Z	C	C	Z	CDE	C	Z	Z	Z	 planned and carefully developed. The entire membership of the local <font color=green>church</font>  must be alerted to their part in this dynamic process
church/NN/br-d09/2040	-0.00417244796971679	0.254762752815359	church	NN	Z	C	C	Z	CDE	C	Z	Z	Z	 alerted to their part in this dynamic process. If the <font color=green>church</font>  has followed the plan of cultivation of prospects and carried
church/NN/br-d09/724	-0.106532504199978	-0.0362662254860804	church	NN	Z	C	C	Z	CDE	C	Z	Z	Z	 as well as the program and activities of the local <font color=green>church</font> . The lay leadership of the church may be invited to
church/NN/br-d09/731	-0.0616770514460477	-0.000733265532208567	church	NN	Z	C	C	Z	CDE	C	Z	Z	Z	 activities of the local church. The lay leadership of the <font color=green>church</font>  may be invited to speak on the various phases of
church/NN/br-d09/742	-0.0407058339913303	0.00396150793674906	church	NN	Z	C	C	Z	CDE	C	Z	Z	Z	 may be invited to speak on the various phases of <font color=green>church</font>  life, service opportunities, the church school, missions, men 's work
church/NN/br-d09/749	-0.0509536435812238	0.0115803052657701	church	NN	Z	C	C	Z	CDE	C	Z	Z	Z	 on the various phases of church life, service opportunities, the <font color=green>church</font>  school, missions, men 's work, women 's work, youth program
church/NN/br-d10/1913	-0.201800218041001	-0.0215797509825447	church	NN	Z	A	A	Z	AB	AB	Z	Z	Z	 impressive Roman Catholic defense of the practical autonomy of both <font color=green>church</font>  and state. The failure at that time of the Puerto
church/NN/br-d10/2166	-0.135919849293399	-0.0127365533023569	church	NN	Z	B	B	Z	AB	AB	Z	Z	Z	 the Christian claim is of considerable significance. The Roman Catholic <font color=green>Church</font>  has excommunicated one of its priests, Father Feeney, for insisting
church/NN/br-d10/2187	-0.317875845052105	0.130427136032316	church	NN	Z	A	A	Z	AB	AB	Z	Z	Z	 for insisting that there is no salvation outside the visible <font color=green>church</font> . In mentioning this under`` salvation reconsidered'' I do not mean
church/NN/br-d14/209	-0.283131786036355	0.083502470190075	church	NN	Z	A	A	Z	AB	AB	Z	Z	Z	 of churches. Presumably those who did not have a formal <font color=green>church</font>  connexion had also felt the influence of Christianity to a
church/NN/br-d14/234	-0.283131786139207	0.0835024702228549	church	NN	Z	C	C	Z	CDE	C	Z	Z	Z	 extent. Many of them had once been members of a <font color=green>church</font>  or at least had been given instruction in Christianity but
church/NN/br-d14/410	-0.139175246640061	0.227070800402929	church	NN	Z	A	A	Z	AB	AB	Z	Z	Z	 be absurd. For instance, we cannot know whether even for <font color=green>church</font>  members the degree of conformity to Christian standards of morality
church/NN/br-d14/428	-0.139175246640061	0.227070800402929	church	NN	Z	C	C	Z	CDE	C	Z	Z	Z	 standards of morality increased or declined as the proportion of <font color=green>church</font>  members in the population rose. The temptation is to say
church/NN/br-d14/726	-0.201800218041001	-0.0215797509825447	church	NN	Z	B	B	Z	AB	AB	Z	Z	Z	 stock. By the end of the century the Roman Catholic <font color=green>Church</font>  was beginning to make itself felt, mainly through such institutions
church/NN/br-d16/1644	-0.242615986637061	-0.122745859032829	church	NN	Z	A	A	Z	AB	AB	Z	Z	Z	 and zealously keep all the sacraments and ceremonies of the <font color=green>church</font> ; you may have the final and extreme unction but if
church/NN/br-d16/1947	-0.317875845212324	0.130427136288765	church	NN	Z	A	A	Z	AB	AB	Z	Z	Z	 Him. You can ignore His Book, the Bible, and His <font color=green>church</font> . You can laugh at His blood-bought salvation, curse His followers
church/NN/br-d16/220	-0.231257377640276	0.0062536639630497	church	NN	Z	B	B	Z	AB	AB	Z	Z	Z	 a short reading of the Holy Scriptures''. Since the Catholic <font color=green>Church</font>  expresses such desire that the Sacred Scriptures be read, the
church/NN/br-f15/713	-0.201800218041001	-0.0215797509825447	church	NN	roman_catholic_church%1:14:00::	B	B	B	AB	AB	AB	AB	B1	 permit birth control only for medical reasons. The Roman Catholic <font color=green>Church</font> , however, sanctions a much more liberal policy on family planning
church/NN/br-f15/754	-0.201800218041001	-0.0215797509825447	church	NN	roman_catholic_church%1:14:00::	B	B	B	AB	AB	AB	AB	B1	 disagree over the methods to be used. The Roman Catholic <font color=green>Church</font>  sanctions only abstention or the rhythm method, also known as
church/NN/br-f44/1076	-0.088631477667825	-0.0808523088803696	church	NN	church%1:14:00::	C	C	B	CDE	C	AB	AB	B	 and economic level of the congregation; the mission of the <font color=green>church</font>  is actually a process of informal co-optation; the lay ministry
church/NN/br-f44/1285	-0.088631477667825	-0.0808523088803696	church	NN	church%1:14:00::	C	C	B	CDE	C	AB	AB	B	 co-optation is the principal form of mission in the contemporary <font color=green>church</font> ; economic integration and co-optation are the two methods by which
church/NN/br-f44/647	-0.0704458602331505	-0.0217922149469107	church	NN	church%1:14:00::	A	A	B	AB	AB	AB	AB	B	 denominations. There is much talk in theological circles about the`` <font color=green>Church</font>  as Mission'' and the`` Church 's Mission''; theologians have been
church/NN/br-f44/654	-0.0704458602331505	-0.0217922149469107	church	NN	church%1:14:00::	A	A	B	AB	AB	AB	AB	B	 in theological circles about the`` Church as Mission'' and the`` <font color=green>Church</font>  's Mission''; theologians have been stressing the fact that the
church/NN/br-g12/1271	-0.229160711714617	-0.193748978688369	church	NN	church%1:06:00::	D	D	D	CDE	DE	CDE	DE	D	 and gestured toward the Madeleine. The classical lines of the <font color=green>church</font>  which Napoleon thought of as a Temple of Glory, dominated
church/NN/br-h17/1199	0.0494555516616395	0.234998506702045	church	NN	church%1:14:00::	C	C	B	CDE	C	AB	AB	B	 because of his willingness to kill in defense of his <font color=green>church</font>  and home. Upon administrative approval of the reclassification, he was
church/NN/br-j57/2237	-0.283131786138268	0.0835024702225558	church	NN	church_father%1:18:00::	A	A	A	AB	AB	AB	AB	A	 which reached Christianity by the way of Stoicism through the <font color=green>Church</font>  Fathers of Late Antiquity.
church/NN/br-k04/1117	0.0682646884111326	-0.266146721004553	church	NN	church%1:06:00::	D	D	D	CDE	DE	CDE	DE	D	 of gambling in both. On the other side of the <font color=green>church</font>  was a quiet, well-kept house with shutters and recently painted
church/NN/br-k04/1485	-0.067726233570095	0.00428259584047042	church	NN	church%1:06:00::	C	C	D	CDE	C	CDE	DE	D	 that clear as this was, they must have a better <font color=green>church</font> , a more business-like conduct of the church organization, and an
church/NN/br-k04/1493	-0.067726233570095	0.00428259584047042	church	NN	church%1:14:00::	C	C	B	CDE	C	AB	AB	B	 have a better church, a more business-like conduct of the <font color=green>church</font>  organization, and an effort to get this religious center out
church/NN/br-k04/1514	-0.258332690369461	0.103891222613382	church	NN	church%1:14:00::	C	C	B	CDE	C	AB	AB	B	 out of its rut of wild worship into a modern <font color=green>church</font>  organization. He emphasized to the Presiding Elder the plan of
church/NN/br-k04/1807	0.0682646884111022	-0.266146721004559	church	NN	church%1:06:00::	D	D	D	CDE	DE	CDE	DE	D	 of money that has been invested by whites around that <font color=green>church</font> ? Tenements, stores, saloons, some gambling, I hope not too much
church/NN/br-k04/923	-0.288180610793543	-0.143224079317176	church	NN	church%1:06:00::	D	D	D	CDE	DE	CDE	DE	D	 which she was chief repository. Then Wilson looked over the <font color=green>church</font>  and studied its condition. The salary of the pastor had
church/NN/br-k06/571	-0.141224382654005	-0.215829010279421	church	NN	church%1:06:00::	D	D	D	CDE	DE	CDE	DE	D	 cupboards.`` There 's a tower and a steeple on the <font color=green>church</font>  a million feet high. And the loudest clock in the
church/NN/br-k06/852	-0.304956767808747	-0.170116655831951	church	NN	church%1:06:00::	D	D	D	CDE	DE	CDE	DE	D	 Church with its high steeple and clock. There was no <font color=green>church</font>  like Drew Church, no preacher like Papa, who was intimate
church/NN/br-k10/1423	-0.169143205804991	0.108860509309076	church	NN	church%1:14:00::	A	A	B	AB	AB	AB	AB	B	 economics, and social issues that are no concern of the <font color=green>Church</font> ''? And John 's reply was always the same:`` Anything that
church/NN/br-k10/1445	-0.266263879633056	-0.226260971564393	church	NN	church%1:14:00::	A	A	B	AB	AB	AB	AB	B	 same:`` Anything that affects souls is the concern of the <font color=green>Church</font> ! We will have righteousness''! Tears burned behind his eyes as
church/NN/br-k10/271	-0.16914320580498	0.108860509309092	church	NN	church%1:14:00::	A	A	B	AB	AB	AB	AB	B	 fingers at their sins. I say to you that the <font color=green>Church</font>  will ever decry evil''! John 's reply was like a
church/NN/br-k10/588	-0.195421249555138	0.14646235620383	church	NN	church%1:14:00::	A	A	B	AB	AB	AB	AB	B	 to let them give him the last rites of the <font color=green>Church</font> , but he had died still proclaiming salvation by faith. Burial
church/NN/br-k10/967	-0.141224382654005	-0.215829010279421	church	NN	church%1:06:00::	D	D	D	CDE	DE	CDE	DE	D	 all the time. Quickening his steps, John entered the vast <font color=green>church</font>  and climbed the tower steps to the bells. Underneath the
church/NN/br-k13/533	-0.329308538308108	-0.0798283906270482	church	NN	church%1:06:00::	D	D	D	CDE	DE	CDE	DE	D	 Harold indicated the photograph on the wall and asked what <font color=green>church</font>  the stone sculpture was in. Eugene told him and he
church/NN/br-k15/188	-0.142042184520315	-0.142778047165209	church	NN	church%1:06:00::	D	D	D	CDE	DE	CDE	DE	D	 They held the funeral the next morning from the crossroads <font color=green>church</font>  and buried the little box in the quiet family plot
church/NN/br-k16/1431	-0.105405923175033	-0.316873183334415	church	NN	church%1:06:00::	D	D	D	CDE	DE	CDE	DE	D	 thickets. Along Wappinger Creek in Dutchess County, past the white <font color=green>church</font>  at Fishkill, past Verplanck 's Point on the east bank
church/NN/br-l08/1824	-0.112416590310162	-0.149516058338635	church	NN	church%1:04:00::	E	E	E	CDE	DE	CDE	DE	E	 did n't feel good on Sunday, could n't go to <font color=green>church</font> - there 'd be a little argument, but she could be
church/NN/br-m01/265	-0.258332690369458	0.103891222613388	church	NN	church%1:14:00::	Z	Z	B	Z	Z	AB	AB	B	 was no Martian concept to match it- unless one took`` <font color=green>church</font> '' and`` worship'' and`` God'' and`` congregation'' and many other words
church/NN/br-p01/1161	-0.0872429336529675	-0.256029803665583	church	NN	church%1:06:00::	D	D	D	CDE	DE	CDE	DE	D	 hill, rising with the hill to the top where the <font color=green>church</font>  was and beyond that to the cemetery. Only paved alleyways
church/NN/br-p01/21	-0.141224382654005	-0.215829010279421	church	NN	church_tower%1:06:00::	D	D	D	CDE	DE	CDE	DE	D	 them he could have been the broken bell in the <font color=green>church</font>  tower which rang before and after Mass, and at noon
church/NN/br-p01/222	-0.113502460445538	-0.0854518439442779	church	NN	church%1:04:00::	E	E	E	CDE	DE	CDE	DE	E	 from its elders. Youth obeyed when commanded. It went to <font color=green>church</font>  on Sunday and one Saturday a month went to confession
church/NN/br-p04/2406	-0.0872429335165979	-0.256029803711985	church	NN	Z	D	D	Z	CDE	DE	Z	Z	Z	 sky. She felt mindless, walking, and almost easy until the <font color=green>church</font>  spire told her she was near the cemetery, and she
church/NN/br-p04/983	-0.0872429335165899	-0.256029803711988	church	NN	Z	D	D	Z	CDE	DE	Z	Z	Z	 beyond the door. To a Blackwell, there was only one <font color=green>church</font> . The cemetery slumbered just behind it, and the way lay
church/NN/br-p12/1014	-0.0493973998028079	-0.346753870217446	church	NN	church%1:06:00::	D	D	D	CDE	DE	CDE	DE	D	 Then they took a taxi to Trastevere.`` There 's a <font color=green>church</font>  you should see'', she said. And when they stood by
church/NN/br-p12/1260	-0.14305912198313	-0.0488094327609084	church	NN	church%1:04:00::	E	E	E	CDE	DE	CDE	DE	E	 snuggled against him, he wondered if she ever went to <font color=green>church</font> . Why did he want her to go to church? he
church/NN/br-p12/1270	-0.14305912198313	-0.0488094327609084	church	NN	church%1:04:00::	E	E	E	CDE	DE	CDE	DE	E	 to church. Why did he want her to go to <font color=green>church</font> ? he wondered. Probably because it was a place where she
church/NN/br-p12/1433	-0.240517539886308	-0.00655521998338809	church	NN	church%1:04:00::	C	C	E	CDE	C	CDE	DE	E	 woman though, she would take only what she needed from <font color=green>church</font> . It was too bad he was n't a Catholic himself
church/NNP/br-a17/2134	-0.141005019086725	-0.087377303925558	church	NNP	Z	D	D	Z	CDE	DE	Z	Z	Z	 at the ceremony in Slaughter Chapel of the First Baptist <font color=green>Church</font> . Dan Beam presented music and the bride was given in
church/NNP/br-a18/760	-0.0797578236685955	-0.113274952487345	church	NNP	Z	C	C	Z	CDE	C	Z	Z	Z	 the party. The women 's committee of St. David 's <font color=green>Church</font>  will hold its annual pre-Fair pink parade, a dessert bridge
church/NNP/br-a31/2143	0.0318682675537588	0.0606257128920428	church	NNP	Z	C	C	Z	CDE	C	Z	Z	Z	 7: 45 p. m.. The outstanding family of Central Nazarene <font color=green>Church</font>  will be picked by ballot from among eight families during
church/NNP/br-a35/810	0.0463534055240081	0.185958968878416	church	NNP	Z	A	A	Z	AB	AB	Z	Z	Z	 deserves closer scrutiny. For while the past needs of the <font color=green>Church</font>  in this country may have been adequately met by collegiate
church/NNP/br-b08/1804	-0.0520110961803004	-0.0605638031388004	church	NNP	Z	C	C	Z	CDE	C	Z	Z	Z	 his letter of resignation as rector of St. Luke 's <font color=green>Church</font>  in Atlanta. It was the cry of not just one
church/NNP/br-b12/2221	-0.0244036047496418	-0.0193486087652162	church	NNP	Z	B	B	Z	AB	AB	Z	Z	Z	 committee made up of representatives of the Church of England, <font color=green>Church</font>  of Scotland, Methodist Church, Congregational Union, Baptist Union, Presbyterian Church
church/NNP/br-b16/1946	-0.0108719233994685	-0.0741008889406007	church	NNP	Z	Z	Z	Z	Z	Z	Z	Z	Z	 Dirksen and Sen. Douglas. But when you write to Congresswoman <font color=green>Church</font> , bless her heart, your letter is answered fully and completely
church/NNP/br-b22/1077	-0.053351418028005	0.0286401732085622	church	NNP	Z	A	A	Z	AB	AB	Z	Z	Z	 that Pope John sees the renewal and purification of the <font color=green>Church</font>  as an absolutely necessary step toward Christian unity. Far from
church/NNP/br-b22/1102	0.0295773439774444	0.0715672527052436	church	NNP	Z	A	A	Z	AB	AB	Z	Z	Z	 to the ecumenical task, the Pontiff believes that a revivified <font color=green>Church</font>  is required in order that the whole world may see
church/NNP/br-b22/1154	-0.0665082939079347	0.121276425781458	church	NNP	Z	A	A	Z	AB	AB	Z	Z	Z	 be to remove as far as possible whatever in the <font color=green>Church</font>  today stands in the way of unity. Secondly, a whole
church/NNP/br-b22/1193	-0.0677353962713461	0.0516391700291342	church	NNP	Z	A	A	Z	AB	AB	Z	Z	Z	 unity is still very much alive and growing within the <font color=green>Church</font> . The establishment, by the Holy Father, of a permanent Secretariat
church/NNP/br-b22/1245	-0.0186140972280589	0.0986596050342425	church	NNP	Z	B	B	Z	AB	AB	Z	Z	Z	 Churches assembly in New Delhi as`` official'' observers reverses the <font color=green>Church</font>  's earlier stand. The public appeal by the new Vatican
church/NNP/br-b22/1318	-0.06519355371503	0.0167112349952465	church	NNP	Z	B	B	Z	AB	AB	Z	Z	Z	 as directly as anyone the new spirit that pervades the <font color=green>Church</font>  's stance toward the Protestant and Orthodox Churches. Noting all
church/NNP/br-d03/1914	-0.0499527491232757	-0.015800797983263	church	NNP	group%1:03:00::	B	B	C	AB	AB	CDE	C	C	 the Observer depicting clergymen of the Church of England, the <font color=green>Church</font>  of Rome and the Nonconformist Church. The Catholic priest, though
church/NNP/br-d03/1920	-0.058971997856456	-0.0212232063515369	church	NNP	group%1:03:00::	B	B	C	AB	AB	CDE	C	C	 Church of England, the Church of Rome and the Nonconformist <font color=green>Church</font> . The Catholic priest, though somewhat superficially drawn, easily came out
church/NNP/br-d03/2022	-0.0656726032594828	-0.0115190778009954	church	NNP	group%1:03:00::	B	B	C	AB	AB	CDE	C	C	 comments were equally made by an Anglican parson, a Free <font color=green>Church</font>  minister and a Catholic priest. Catholic priests have frequently appeared
church/NNP/br-d03/91	-0.0173919261991605	0.0383966876225915	church	NNP	group%1:03:00::	A	A	C	AB	AB	CDE	C	C	 the religious sphere so popularly discussed as Christian unity. The <font color=green>Church</font>  Unity Octave, January 18- 25, was enthusiastically devoted to prayer
