id	model.x	model.y	lemma	wf	pos	genre	broad_genre	marisense	mbroad	mari3	mari2	sensekey	wnsense	wnbroad	wn3	wn2	text	cues	cues_with_weight	mean_weight_x100	wcratio_x100	weighted_cw	new_pos	new_broad_genre
state/NNS/br-g02/66	0.142212191956354	0.0673557428089845	state	states	NNS	belles_lettres	fiction	B	B	AB	ABC	Z	Z	Z	Z	Z	 territorial borders. Outside those limits it asserted, as against other <font color=green>states</font> , a position of sovereign equality, and, as against the`` inferior	4	2	412	50	4	NNS	fiction
state/NNS/br-g08/986	-0.0781129934464635	0.229257377426728	state	states	NNS	belles_lettres	fiction	A4	A	AB	ABC	Z	Z	Z	Z	Z	 's evidence, such as the fact that only three Southern <font color=green>states</font> ( South Carolina, Alabama and Mississippi) still openly defy integration, would	5	2	352	40	4	NNS	fiction
state/NNS/br-g10/1053	0.00504058794562602	0.0459361169633379	state	states	NNS	belles_lettres	fiction	B	B	AB	ABC	Z	Z	Z	Z	Z	 in making their government the people were acting through their <font color=green>states</font> , whereas the Preamble of 1787- 89 expressed, as clearly as	4	1	207	25	2	NNS	fiction
state/NNS/br-g10/1304	0.124174319788302	0.0317769620591684	state	states	NNS	belles_lettres	fiction	B	B	AB	ABC	Z	Z	Z	Z	Z	 on the concept that it was composed primarily of sovereign <font color=green>states</font> . If the Union conceded this to them, the same right	2	1	373	50	5	NNS	fiction
state/NNS/br-g10/1341	0.0411476738228034	-0.0337765873092558	state	states	NNS	belles_lettres	fiction	A	A	AB	ABC	Z	Z	Z	Z	Z	 This would destroy the federal balance between it and the <font color=green>states</font> , and in the end sacrifice to the sovereignty of the	3	3	295	100	4	NNS	fiction
state/NNS/br-g10/1353	0.0710433861057082	0.0158436212453446	state	states	NNS	belles_lettres	fiction	A	A	AB	ABC	Z	Z	Z	Z	Z	 and in the end sacrifice to the sovereignty of the <font color=green>states</font>  all the liberty the citizens had gained by their Union	3	3	322	100	4	NNS	fiction
state/NNS/br-g10/1401	0.253168827419737	0.0466339944312156	state	states	NNS	belles_lettres	fiction	B	B	AB	ABC	Z	Z	Z	Z	Z	 that should continue to live, or an association of sovereign <font color=green>states</font>  that must fall prey either to`` anarchy or despotism''. Much	4	1	542	25	1	NNS	fiction
state/NNS/br-g10/1482	0.0565160583217361	0.176449887202656	state	states	NNS	belles_lettres	fiction	A	A	AB	ABC	Z	Z	Z	Z	Z	 no such change in the rights the Constitution gave the <font color=green>states</font> . After the war began, he long refused to permit emancipation	3	1	348	33	2	NNS	fiction
state/NNS/br-g10/1587	0.0633406376693603	0.0303361946904766	state	states	NNS	belles_lettres	fiction	B	B	AB	ABC	Z	Z	Z	Z	Z	 the free''. What Lincoln could not concede was that the <font color=green>states</font>  rather than the people were sovereign in the Union. He	4	3	344	75	5	NNS	fiction
state/NNS/br-g10/1634	0.0593883229533157	-0.00417163469305096	state	states	NNS	belles_lettres	fiction	A	A	AB	ABC	Z	Z	Z	Z	Z	 fact that the Americans who upheld the sovereignty of their <font color=green>states</font>  did this in order to keep many of their people	3	3	316	100	4	NNS	fiction
state/NNS/br-g10/1726	0.0784815401226598	0.0880867014808515	state	states	NNS	belles_lettres	fiction	C	C	C	ABC	Z	Z	Z	Z	Z	 two concepts of the sovereign rights of men and of <font color=green>states</font> . On their decisive battlefield Lincoln did not distinguish between them	3	2	382	67	6	NNS	fiction
state/NNS/br-g10/2060	0.0845597795009699	0.0296183790702021	state	states	NNS	belles_lettres	fiction	B	B	AB	ABC	Z	Z	Z	Z	Z	 in the end to all associations composed primarily of sovereign <font color=green>states</font> , and to the liberties of their people. But the fact	3	3	348	100	5	NNS	fiction
state/NNS/br-g10/2267	0.0418202522549774	0.0356616764249119	state	states	NNS	belles_lettres	fiction	A	A	AB	ABC	Z	Z	Z	Z	Z	 encroachment by the Union on the powers reserved to their <font color=green>states</font>  have continued ever since to safeguard all Americans against freedom	6	4	312	67	5	NNS	fiction
state/NNS/br-g10/341	0.0538897199969347	0.0211700306666118	state	states	NNS	belles_lettres	fiction	B	B	AB	ABC	Z	Z	Z	Z	Z	 Constitution was a compact made by the people of sovereign <font color=green>states</font> , who therefore retained the right to secede from it. This	4	3	334	75	6	NNS	fiction
state/NNS/br-g10/418	0.0143759110004373	0.00372177082219682	state	states	NNS	belles_lettres	fiction	B	B	AB	ABC	Z	Z	Z	Z	Z	 that it was a compact among sovereign citizens rather than <font color=green>states</font> , and that therefore the states had no right to secede	3	2	330	67	6	NNS	fiction
state/NNS/br-g10/424	0.0277175170879293	0.00405542575580212	state	states	NNS	belles_lettres	fiction	B	B	AB	ABC	Z	Z	Z	Z	Z	 among sovereign citizens rather than states, and that therefore the <font color=green>states</font>  had no right to secede, though the citizens could. Writing	4	5	350	125	8	NNS	fiction
state/NNS/br-m03/1076	0.106141229721353	-0.0470196133889636	state	states	NNS	fiction_science	fiction	B	B	AB	ABC	Z	Z	Z	Z	Z	 present world hegemony of the United Nations; suspicion between member <font color=green>states</font>  still existed, but it was of about the same low	3	0	282	0	2	NNS	fiction
