id	model.x	model.y	lemma	pos	genre	marisense	mbroad	mari3	mari2	sensekey	wnsense	wnbroad	wn3	wn2	text
church/NN/br-a01/2073	-0.155677757625385	-0.216261858087858	church	NN	press_reportage	E	E	DE	CDE	church%1:04:00::	E	E	DE	CDE	 said.`` Being at the polls was just like being at <font color=green>church</font> . I did n't smell a drop of liquor, and we
church/NN/br-a07/1303	0.0321301725743981	-0.0913342958503422	church	NN	press_reportage	A	A	AB	AB	Z	Z	Z	Z	Z	 Africa, the Middle East and Latin America. Interviews with several <font color=green>church</font>  leaders have disclosed that this development has raised the question
church/NN/br-a07/1325	0.225444803568595	-0.0109890716036557	church	NN	press_reportage	A	A	AB	AB	Z	Z	Z	Z	Z	 the Peace Corps will be able to prevent confusion for <font color=green>church</font>  and state over methods, means and goals. There are a
church/NN/br-a07/1487	0.211834479810596	-0.162393460624136	church	NN	press_reportage	A	A	AB	AB	Z	Z	Z	Z	Z	 projects and still preserve the constitutional requirement on separation of <font color=green>church</font>  and state? R. Sargent Shriver Jr., director of the corps
church/NN/br-a10/1754	0.206496205183119	-0.0362987184247619	church	NN	press_reportage	A	A	AB	AB	Z	Z	Z	Z	Z	 one out of three Americans has vital contact with the <font color=green>church</font> . This means that more than 100 million have no vital
church/NN/br-a10/1769	0.106867750770423	0.0294165195389237	church	NN	press_reportage	A	A	AB	AB	Z	Z	Z	Z	Z	 more than 100 million have no vital touch with the <font color=green>church</font>  or religious life'', he told delegates Friday. Talking of the
church/NN/br-a10/1940	0.288717077877441	-0.00841285284673618	church	NN	press_reportage	A	A	AB	AB	Z	Z	Z	Z	Z	 this would necessitate some changes in methods, he said.`` The <font color=green>church</font>  's ability to change her methods is going to determine
church/NN/br-a16/453	-0.174987096217411	0.00809538181114136	church	NN	press_reportage	D	D	DE	CDE	Z	Z	Z	Z	Z	 a small one at noon tomorrow in St. Bernadine 's <font color=green>church</font> , Forest Park. A small reception will follow in the Oak
church/NN/br-a17/1636	-0.16658344278126	-0.0339030464767632	church	NN	press_reportage	D	D	DE	CDE	Z	Z	Z	Z	Z	 Gay, who were married Saturday at the Munger Place Methodist <font color=green>Church</font> . Parents of the bride are Mr. and Mrs. Ferris M.
church/NN/br-a17/1770	-0.194674889425504	-0.098220885509829	church	NN	press_reportage	D	D	DE	CDE	Z	Z	Z	Z	Z	 College of Technology, in the chapel of the First Presbyterian <font color=green>Church</font>  of Houston. The bride, daughter of Rhodes Semmes Baker Jr.
church/NN/br-a17/2228	-0.0483710381179393	0.0264525993193061	church	NN	press_reportage	D	D	DE	CDE	Z	Z	Z	Z	Z	 Burgher Jr. seated guests. A reception was held at the <font color=green>church</font> . The First Christian Church of Pampa was the setting for
church/NN/br-a17/2233	-0.0517192549586165	0.0403008171677156	church	NN	press_reportage	D	D	DE	CDE	Z	Z	Z	Z	Z	 A reception was held at the church. The First Christian <font color=green>Church</font>  of Pampa was the setting for the wedding last Sunday
church/NN/br-a21/677	-0.058162596659412	0.12991463933296	church	NN	press_reportage	D	D	DE	CDE	Z	Z	Z	Z	Z	 for 10 a. m. tomorrow in St. Anne 's Catholic <font color=green>Church</font> , 31978 Mound, in Warren. The mother and daughter, who will
church/NN/br-a22/1206	-0.374759278612822	0.246548710415297	church	NN	press_reportage	B	B	AB	AB	Z	Z	Z	Z	Z	 World War 1,. He was a member of the Baptist <font color=green>church</font> . Survivors include two brothers, C. E. Killingsworth, Atlanta, and John
church/NN/br-a22/1283	-0.253813676384881	0.0341138124842566	church	NN	press_reportage	C	C	C	CDE	Z	Z	Z	Z	Z	 painter. He was a member of the Oakland City Methodist <font color=green>Church</font>  and a native of Atlanta. Funeral services will be at
church/NN/br-a22/307	-0.0176957724305438	0.0325573462461822	church	NN	press_reportage	B	B	AB	AB	Z	Z	Z	Z	Z	 challenged by the state. Emory is affiliated with the Methodist <font color=green>Church</font> . Some church leaders, both clerical and lay, have criticized the
church/NN/br-a22/310	-0.00934642976242376	0.0285574159803045	church	NN	press_reportage	A	A	AB	AB	Z	Z	Z	Z	Z	 the state. Emory is affiliated with the Methodist Church. Some <font color=green>church</font>  leaders, both clerical and lay, have criticized the university for
church/NN/br-a31/1395	-0.280835486453914	0.0109460994440227	church	NN	press_reportage	D	D	DE	CDE	Z	Z	Z	Z	Z	 from 4 to 8 p. m. Sunday at First Presbyterian <font color=green>Church</font> . At that time the second half of the Christian Youth
church/NN/br-a31/1842	-0.18911069738755	0.20626422495361	church	NN	press_reportage	D	D	DE	CDE	Z	Z	Z	Z	Z	 planned for 10: 50 a. m. Sunday at First Christian <font color=green>Church</font> . It will be the second time the assistant manager of
church/NN/br-a31/2087	-0.14331883241919	0.0558835980855488	church	NN	press_reportage	D	D	DE	CDE	Z	Z	Z	Z	Z	 Family'' at 7: 30 p. m. Sunday at Christ Lutheran <font color=green>Church</font> . Mr. and Mrs. George Treadwell will be honored at a
church/NN/br-a31/2112	-0.065619648722519	0.0355913424398479	church	NN	press_reportage	D	D	DE	CDE	Z	Z	Z	Z	Z	 and program at 6 p. m. Sunday at Trinity Methodist <font color=green>Church</font> . He is the sexton of the church. A family worship
church/NN/br-a31/2120	-0.0164122625644777	0.0679221972337082	church	NN	press_reportage	D	D	DE	CDE	Z	Z	Z	Z	Z	 at Trinity Methodist Church. He is the sexton of the <font color=green>church</font> . A family worship service will follow the program at 7
church/NN/br-a31/2172	-0.123889254511453	0.198725499155203	church	NN	press_reportage	C	C	C	CDE	Z	Z	Z	Z	Z	 service marking National Family Week. Every family of Riviera Presbyterian <font color=green>Church</font>  has been asked to read the Bible and pray together
church/NN/br-a31/2212	-0.275936677054112	0.328276765920749	church	NN	press_reportage	C	C	C	CDE	Z	Z	Z	Z	Z	 participate. To start the week of special programs at the <font color=green>church</font> , the Rev. John D. Henderson will preach on`` A Successful
church/NN/br-a31/2280	-0.156502040709915	-0.0339148194819932	church	NN	press_reportage	C	C	C	CDE	Z	Z	Z	Z	Z	 held at 6: 15 p. m. Monday and the annual <font color=green>church</font>  picnic at 4 p. m. next Saturday. The week will
church/NN/br-b08/1866	-0.0365823817944036	0.0507092167495701	church	NN	press_editorial	D	D	DE	CDE	Z	Z	Z	Z	Z	 wrote after almost a decade of service to this majestic <font color=green>church</font> .`` Such a church needs vigor and vitality in its rector
church/NN/br-b08/1871	-0.0435026100624667	0.0684146796259902	church	NN	press_editorial	C	C	C	CDE	Z	Z	Z	Z	Z	 a decade of service to this majestic church.`` Such a <font color=green>church</font>  needs vigor and vitality in its rector and one man
church/NN/br-b08/1912	0.0804604164189037	-0.0943398486418808	church	NN	press_editorial	C	C	C	CDE	Z	Z	Z	Z	Z	 stay`` beyond the time that his leadership should benefit'' his <font color=green>church</font> , he wrote,`` for he becomes ordinary''. And so the young
church/NN/br-b08/2245	-0.024783337957007	-0.435102206504112	church	NN	press_editorial	E	E	DE	CDE	Z	Z	Z	Z	Z	 them to bestow saintliness upon us in return for ostentatious <font color=green>church</font>  attendance and a few bucks a week, American cash. If
church/NN/br-b12/2009	0.0162151867296332	0.29730995836113	church	NN	press_editorial	A	A	AB	AB	Z	Z	Z	Z	Z	 new version retains, however, the old phrase`` angel of the <font color=green>church</font> '' which Biblical scholars have previously interpreted as meaning bishop. This
church/NN/br-b12/2115	-0.00300345391976757	0.329224954810064	church	NN	press_editorial	A	A	AB	AB	Z	Z	Z	Z	Z	 and Greek and other ancient writings, some by the early <font color=green>church</font>  fathers, in themselves called for a restudy of the Bible
church/NN/br-b12/2217	-0.0200278246984714	0.0258274087285968	church	NN	press_editorial	B	B	AB	AB	Z	Z	Z	Z	Z	 of a joint committee made up of representatives of the <font color=green>Church</font>  of England, Church of Scotland, Methodist Church, Congregational Union, Baptist
church/NN/br-b12/2226	-0.0139922414891832	0.0508473999785793	church	NN	press_editorial	B	B	AB	AB	Z	Z	Z	Z	Z	 representatives of the Church of England, Church of Scotland, Methodist <font color=green>Church</font> , Congregational Union, Baptist Union, Presbyterian Church of England, Churches in
church/NN/br-b12/2235	0.00370486230164042	0.0385149109916031	church	NN	press_editorial	B	B	AB	AB	Z	Z	Z	Z	Z	 Church of Scotland, Methodist Church, Congregational Union, Baptist Union, Presbyterian <font color=green>Church</font>  of England, Churches in Wales, Churches in Ireland, Society of
church/NN/br-b15/1190	-0.301329599515844	-0.211039894305504	church	NN	press_editorial	C	C	C	CDE	Z	Z	Z	Z	Z	 El; Rev. DeWitt Clemens, pastor of the Mathewson Street Methodist <font color=green>Church</font> ; Mr. Felix Miranda, of the Imperial Knife Co.; and to
church/NN/br-b18/1829	-0.269011962338781	-0.298727936762254	church	NN	press_editorial	C	C	C	CDE	Z	Z	Z	Z	Z	 the Women 's Association of the Trumbull Ave. United Presbyterian <font color=green>Church</font> , considerable use was made of material from The Detroit News
church/NN/br-b24/1259	0.0926604749290531	-0.173612956840842	church	NN	press_editorial	C	C	C	CDE	Z	Z	Z	Z	Z	 or less native. Sometimes they get their initial experience in <font color=green>church</font>  haflis, conducted by Lebanese and Syrians in the U. S.
church/NN/br-d01/1628	-0.0683211848594364	-0.405318556121386	church	NN	religion	B	B	AB	AB	church%1:14:00::	B	B	AB	AB	 age to whip men into a surrender to a particular <font color=green>church</font>  or church-state''. Apparently he does not intend that those who
church/NN/br-d02/1641	0.09592610103641	0.186674664633988	church	NN	religion	B	B	AB	AB	church%1:14:00::	B	B	AB	AB	 concerned to stand squarely within the tradition of the apostolic <font color=green>church</font> , they have exhibited no willingness whatever to sacrifice their modernity
church/NN/br-d02/706	-0.0742571419292689	0.194694754903171	church	NN	religion	A	A	AB	AB	church%1:14:00::	B	B	AB	AB	 there tends to be an almost complete indifference to the <font color=green>church</font>  and its traditional message of sin and grace. To be
church/NN/br-d02/786	-0.0362732916438909	-0.262718390318994	church	NN	religion	A	A	AB	AB	church%1:14:00::	B	B	AB	AB	 longer afford the luxury of such smug indignation? Can the <font color=green>church</font>  risk assuming that the`` folly'' of men is as dear
church/NN/br-d02/877	0.000386310320960194	0.171947869269402	church	NN	religion	A	A	AB	AB	church%1:14:00::	B	B	AB	AB	 precarious? There is an ancient and venerable tradition in the <font color=green>church</font> ( which derives, however, from the heritage of the Greeks rather
church/NN/br-d02/923	0.457339383214965	-0.149078934152508	church	NN	religion	A	A	AB	AB	church%1:14:00::	B	B	AB	AB	 for accomplishing his work in the world. by analogy, the <font color=green>church</font>  also has been regarded as entirely independent of the`` world
church/NN/br-d02/949	0.494084353044917	-0.129763307977107	church	NN	religion	A	A	AB	AB	church%1:14:00::	B	B	AB	AB	 of requiring nothing from it in order to be the <font color=green>church</font> . But, as Scripture everywhere reminds us, God does have need
church/NN/br-d02/969	0.044656496023959	-0.259491275323265	church	NN	religion	A	A	AB	AB	church%1:14:00::	B	B	AB	AB	 us, God does have need of his creatures, and the <font color=green>church</font> , a fortiori, can ill afford to do without the talents
church/NN/br-d03/1080	0.172128747765574	0.197408278430377	church	NN	religion	E	E	DE	CDE	church%1:04:00::	E	E	DE	CDE	 phenomenon of redundancy is that fewer Protestants are going to <font color=green>church</font> . It should be admitted, too, that there is a good
church/NN/br-d03/1342	-0.0184190953594441	0.0458425990154776	church	NN	religion	E	E	DE	CDE	church%1:06:00::	D	D	DE	CDE	 my experience to find as many men as women in <font color=green>church</font> , and to hear almost everyone in church congregations reciting the
church/NN/br-d03/1350	-0.0115494987343761	0.0323824671796764	church	NN	religion	E	E	DE	CDE	church%1:06:00::	D	D	DE	CDE	 as women in church, and to hear almost everyone in <font color=green>church</font>  congregations reciting the Latin prayers and responses at Mass. They
church/NN/br-d03/1871	0.00230839276661803	0.086678832001307	church	NN	religion	B	B	AB	AB	catholic_church%1:14:00::	B1	B	AB	AB	 the Sunday Observer implies a kindly recognition that the Catholic <font color=green>Church</font>  is now at least of equal stature in England with
church/NN/br-d03/1909	-0.0336975030966161	0.0850437020057802	church	NN	religion	B	B	AB	AB	church_of_england%1:14:00::	B2	B	AB	AB	 non-Catholic) wrote articles in the Observer depicting clergymen of the <font color=green>Church</font>  of England, the Church of Rome and the Nonconformist Church
church/NN/br-d03/2097	-0.0216915868330469	0.128602431996624	church	NN	religion	A	A	AB	AB	church%1:14:00::	B	B	AB	AB	 Canterbury. The good feeling which exists between these two important <font color=green>church</font>  figures is now well known in England. The Holy Sacrifice
church/NN/br-d03/2336	0.0100612011256548	0.0567100724912902	church	NN	religion	D	D	DE	CDE	catholic_church%1:14:00::	B1	B	AB	AB	 a votive Mass offered for Christian unity at a Catholic <font color=green>church</font>  in Slough during the Church Unity Octave.
church/NN/br-d03/2341	0.00962736958535281	0.0672480711842679	church	NN	religion	A	A	AB	AB	church%1:14:00::	B	B	AB	AB	 Christian unity at a Catholic church in Slough during the <font color=green>Church</font>  Unity Octave.
church/NN/br-d03/721	-0.1446202936373	0.0914291475238763	church	NN	religion	B	B	AB	AB	church%1:06:00::	D	D	DE	CDE	 crowds going in and out of the Birmingham Oratory( Catholic) <font color=green>Church</font>  on Sunday mornings. She found this a marvel because, as
church/NN/br-d03/862	0.00680248505902177	0.00750265046041557	church	NN	religion	B	B	AB	AB	church_of_england%1:14:00::	B2	B	AB	AB	 to a newspaper report of the 1961 statistics of the <font color=green>Church</font>  of England, the`` total of confirmed members is 9748000, but
church/NN/br-d03/883	0.195346128593056	0.193291332980827	church	NN	religion	C	C	C	CDE	church_roll%1:10:00::	C	C	C	CDE	 is 9748000, but only 2887671 are registered on the parochial <font color=green>church</font>  rolls'', and`` over 27 million people in England are baptized
church/NN/br-d03/899	-0.0383362086794099	0.157661836056098	church	NN	religion	B	B	AB	AB	church_of_england%1:14:00::	B2	B	AB	AB	 over 27 million people in England are baptized into the <font color=green>Church</font>  of England, but roughly only a tenth of them continue
church/NN/br-d03/945	0.0252853827583594	0.0720045669020429	church	NN	religion	B	B	AB	AB	church_of_england%1:14:00::	B2	B	AB	AB	 than an Archbishops' Commission`` reported last month that in the <font color=green>Church</font>  of England alone there are 790 churches which are redundant
church/NN/br-d04/56	-0.0246522203905928	0.194310501496683	church	NN	religion	A	A	AB	AB	church_father%1:18:00::	A	A	AB	AB	 Jesus Christ the unique and the universal concur. Perhaps no <font color=green>church</font>  father saw this concurrence of the unique and the universal
church/NN/br-d05/1163	0.0535797817588088	-0.316273613952216	church	NN	religion	B	B	AB	AB	Z	Z	Z	Z	Z	 Parker as the ultra-liberal minister within the pale of a <font color=green>church</font>  which had proclaimed itself the repository of liberality poses a
church/NN/br-d06/2048	0.331939353071645	-0.225791400507834	church	NN	religion	E	E	DE	CDE	Z	Z	Z	Z	Z	 not one of the 70000000 Americans who do not attend <font color=green>church</font> , but who feel that various forms of recreation are more
church/NN/br-d06/2174	0.0290245185127028	0.023076095714793	church	NN	religion	C	C	C	CDE	Z	Z	Z	Z	Z	 spiritually. No amount of religious ceremonies or even joining a <font color=green>church</font>  will relieve the gnawing of your`` inner'' space. Why? Because
church/NN/br-d07/1408	0.229205798571563	0.0947485909501185	church	NN	religion	D	D	DE	CDE	Z	Z	Z	Z	Z	 then jumped; she was fatally injured. The entrance to a <font color=green>church</font>  has been walled up, so that the congregation, most of
church/NN/br-d07/216	-0.289688309481929	0.10834322155832	church	NN	religion	C	C	C	CDE	Z	Z	Z	Z	Z	 of the most wholesome things you could schedule in your <font color=green>church</font>  would thus be a group confessional where people could admit
church/NN/br-d09/1044	-0.0329254678790508	0.0342693023976906	church	NN	religion	C	C	C	CDE	Z	Z	Z	Z	Z	 such topics as:`` What Christ Means to Me'',`` What the <font color=green>Church</font>  Means to Me'',`` Why Join the Church'',`` The Duties of
church/NN/br-d09/1054	-0.00528274356624638	0.00748990490603444	church	NN	religion	C	C	C	CDE	Z	Z	Z	Z	Z	 Me'',`` What the Church Means to Me'',`` Why Join the <font color=green>Church</font> '',`` The Duties of Church Members'', etc.. Assign a series of
church/NN/br-d09/1061	-0.00528274356624638	0.00748990490603444	church	NN	religion	C	C	C	CDE	Z	Z	Z	Z	Z	 Means to Me'',`` Why Join the Church'',`` The Duties of <font color=green>Church</font>  Members'', etc.. Assign a series of catechism questions to be
church/NN/br-d09/1260	0.209087882236274	-0.109267337338145	church	NN	religion	C	C	C	CDE	Z	Z	Z	Z	Z	 provides a natural transition into the life of the local <font color=green>church</font>  and its organizations. The total process of evangelism reaches the
church/NN/br-d09/1619	0.0310478223881807	-0.0522722525774103	church	NN	religion	C	C	C	CDE	Z	Z	Z	Z	Z	 the group of new members to be put in the <font color=green>church</font>  paper or placed on the bulletin board. Have a fellowship
church/NN/br-d09/1641	-0.0332396280876602	-0.0396292035857156	church	NN	religion	C	C	C	CDE	Z	Z	Z	Z	Z	 fellowship luncheon or dinner with new members as guests. The <font color=green>church</font>  is`` the family of God''. The members of the`` family
church/NN/br-d09/1829	0.0489582445118432	-0.00660384508977544	church	NN	religion	C	C	C	CDE	Z	Z	Z	Z	Z	 during the same period there were 1080062 additions. Another major <font color=green>church</font>  body had 4499608 members and twenty years later its membership
church/NN/br-d09/2026	0.186504782648945	0.000994782633115237	church	NN	religion	C	C	C	CDE	Z	Z	Z	Z	Z	 planned and carefully developed. The entire membership of the local <font color=green>church</font>  must be alerted to their part in this dynamic process
church/NN/br-d09/2040	0.316421846638802	-0.11579713444865	church	NN	religion	C	C	C	CDE	Z	Z	Z	Z	Z	 alerted to their part in this dynamic process. If the <font color=green>church</font>  has followed the plan of cultivation of prospects and carried
church/NN/br-d09/2084	0.315073166630915	0.174292112917429	church	NN	religion	A	A	AB	AB	Z	Z	Z	Z	Z	 under way. Those who enter the front door of the <font color=green>church</font>  intelligently and with Christian dedication will not so easily step
church/NN/br-d09/2174	0.0466784596537579	-0.0406113146412576	church	NN	religion	C	C	C	CDE	Z	Z	Z	Z	Z	 members. The new members justifiably expect some things from their <font color=green>church</font>  family:
church/NN/br-d09/724	0.000279422290059077	0.0142263730590925	church	NN	religion	C	C	C	CDE	Z	Z	Z	Z	Z	 as well as the program and activities of the local <font color=green>church</font> . The lay leadership of the church may be invited to
church/NN/br-d09/731	-0.0103498198706367	0.017495637414478	church	NN	religion	C	C	C	CDE	Z	Z	Z	Z	Z	 activities of the local church. The lay leadership of the <font color=green>church</font>  may be invited to speak on the various phases of
church/NN/br-d09/742	-0.00585667941091136	0.0165562363239975	church	NN	religion	C	C	C	CDE	Z	Z	Z	Z	Z	 may be invited to speak on the various phases of <font color=green>church</font>  life, service opportunities, the church school, missions, men 's work
church/NN/br-d09/749	-0.0122231359192498	0.0146410002592632	church	NN	religion	C	C	C	CDE	Z	Z	Z	Z	Z	 on the various phases of church life, service opportunities, the <font color=green>church</font>  school, missions, men 's work, women 's work, youth program
church/NN/br-d09/775	0.236431749428842	-0.083313975442799	church	NN	religion	C	C	C	CDE	Z	Z	Z	Z	Z	 youth program, social activities, and finances. The budget of the <font color=green>church</font>  may be presented and pledges solicited at this session. An
church/NN/br-d09/837	0.0370913756216038	-0.0250642239710183	church	NN	religion	C	C	C	CDE	Z	Z	Z	Z	Z	 facilities and refreshments. The social time gives an opportunity for <font color=green>church</font>  leaders to become acquainted with the new members. In conducting
church/NN/br-d09/935	0.164897609188124	-0.295451937629578	church	NN	religion	A	A	AB	AB	Z	Z	Z	Z	Z	 dramatization- for example, in discussing the Lord 's Supper or <font color=green>church</font>  symbolism. Use audio-visual aids. Some excellent filmstrips with recordings and
church/NN/br-d10/1913	0.0447162517273035	0.203756583914034	church	NN	religion	A	A	AB	AB	Z	Z	Z	Z	Z	 impressive Roman Catholic defense of the practical autonomy of both <font color=green>church</font>  and state. The failure at that time of the Puerto
church/NN/br-d10/2166	0.028358367321781	0.180793027482144	church	NN	religion	B	B	AB	AB	Z	Z	Z	Z	Z	 the Christian claim is of considerable significance. The Roman Catholic <font color=green>Church</font>  has excommunicated one of its priests, Father Feeney, for insisting
church/NN/br-d10/2187	-0.0622578652374736	0.281422128092505	church	NN	religion	A	A	AB	AB	Z	Z	Z	Z	Z	 for insisting that there is no salvation outside the visible <font color=green>church</font> . In mentioning this under`` salvation reconsidered'' I do not mean
church/NN/br-d12/1462	-0.0497943462559729	0.153976623267568	church	NN	religion	A	A	AB	AB	Z	Z	Z	Z	Z	 is discussed must surely be raised. The role of both <font color=green>church</font>  and university as sources of information and settings within which
church/NN/br-d12/233	0.0836606014019568	0.09874705058249	church	NN	religion	A	A	AB	AB	Z	Z	Z	Z	Z	 social change? What social, ethical and theological insights can the <font color=green>church</font>  and university help him bring to bear upon his situation
church/NN/br-d12/976	0.0181590196521753	-0.0163797937768294	church	NN	religion	C	C	C	CDE	Z	Z	Z	Z	Z	 social and professional organizations, as citizens and civic leaders, as <font color=green>church</font>  laymen, as university alumni, as newspaper readers, etc.. From such
church/NN/br-d14/209	0.0476192317670433	0.0695726339280492	church	NN	religion	A	A	AB	AB	Z	Z	Z	Z	Z	 of churches. Presumably those who did not have a formal <font color=green>church</font>  connexion had also felt the influence of Christianity to a
church/NN/br-d14/234	0.0328552494161083	0.0176865923892265	church	NN	religion	C	C	C	CDE	Z	Z	Z	Z	Z	 extent. Many of them had once been members of a <font color=green>church</font>  or at least had been given instruction in Christianity but
church/NN/br-d14/410	0.0645296313537493	-0.00830828629600208	church	NN	religion	A	A	AB	AB	Z	Z	Z	Z	Z	 be absurd. For instance, we cannot know whether even for <font color=green>church</font>  members the degree of conformity to Christian standards of morality
church/NN/br-d14/428	0.0413037652282053	-0.0155747102593682	church	NN	religion	C	C	C	CDE	Z	Z	Z	Z	Z	 standards of morality increased or declined as the proportion of <font color=green>church</font>  members in the population rose. The temptation is to say
church/NN/br-d14/446	0.0557096973967711	-0.0177188528779833	church	NN	religion	C	C	C	CDE	Z	Z	Z	Z	Z	 The temptation is to say that, as the percentage of <font color=green>church</font>  members mounted, the degree of discipline exercised by the churches
church/NN/br-d14/557	0.136783453172155	-0.0500608392137985	church	NN	religion	A	A	AB	AB	Z	Z	Z	Z	Z	 If guilty, the offender might be excluded from membership. As <font color=green>church</font>  membership burgeoned, such measures faded into desuetude. But whether this
church/NN/br-d14/726	0.0375424206477711	0.169017678135299	church	NN	religion	B	B	AB	AB	Z	Z	Z	Z	Z	 stock. By the end of the century the Roman Catholic <font color=green>Church</font>  was beginning to make itself felt, mainly through such institutions
church/NN/br-d16/1602	0.136693251703907	0.103611854001339	church	NN	religion	C	C	C	CDE	Z	Z	Z	Z	Z	 1: 12, 13. You may be very religious, a good <font color=green>church</font>  member, an upright, honest and sincere person; you may be
church/NN/br-d16/1644	0.00936255270993388	0.443503315227874	church	NN	religion	A	A	AB	AB	Z	Z	Z	Z	Z	 and zealously keep all the sacraments and ceremonies of the <font color=green>church</font> ; you may have the final and extreme unction but if
church/NN/br-d16/1947	-0.0926413292522812	0.194089567952086	church	NN	religion	A	A	AB	AB	Z	Z	Z	Z	Z	 Him. You can ignore His Book, the Bible, and His <font color=green>church</font> . You can laugh at His blood-bought salvation, curse His followers
church/NN/br-d16/220	0.016962639133423	0.142991232499641	church	NN	religion	B	B	AB	AB	Z	Z	Z	Z	Z	 a short reading of the Holy Scriptures''. Since the Catholic <font color=green>Church</font>  expresses such desire that the Sacred Scriptures be read, the
church/NN/br-d17/1073	-0.446911527537075	0.196119260489414	church	NN	religion	C	C	C	CDE	Z	Z	Z	Z	Z	 different, and something important: Ruth Peale, her wide experience in <font color=green>church</font>  work; Sidney Fields, years of experience as a New York
