id	model.x	model.y	lemma	pos	genre	broad_genre	marisense	mbroad	mari3	mari2	sensekey	wnsense	wnbroad	wn3	wn2	text	cues	cues_with_weight	mean_weight_x100	wcratio_x100	weighted_cw	wf
church/NN/br-k13/533	-0.149355240233163	0.0261674279608119	church	NN	fiction_gral	fiction	D	D	DE	CDE	church%1:06:00::	D	D	DE	CDE	 Harold indicated the photograph on the wall and asked what <font color=green>church</font>  the stone sculpture was in. Eugene told him and he	3	3	129	100	11	church
church/NN/br-k14/1114	-0.0420734914420619	-0.0409708568370288	church	NN	fiction_gral	fiction	A	A	AB	AB	church%1:14:00::	B	B	AB	AB	 not want my people to get in trouble with the <font color=green>Church</font> ''.`` I am working for the Cardinal of San Dionigi. I'm	3	2	73	67	4	Church
church/NN/br-k14/826	-0.11099115984832	-0.261160200392685	church	NN	fiction_gral	fiction	D	D	DE	CDE	church%1:06:00::	D	D	DE	CDE	 Jewish section was in Trastevere, near the Tiber at the <font color=green>church</font>  of San Francesco a Ripa. The colony had been small	4	1	93	25	6	church
church/NN/br-k15/188	-0.0655761733160587	0.0147290733473671	church	NN	fiction_gral	fiction	D	D	DE	CDE	church%1:06:00::	D	D	DE	CDE	 They held the funeral the next morning from the crossroads <font color=green>church</font>  and buried the little box in the quiet family plot	6	6	194	100	10	church
church/NN/br-k16/1431	-0.175910556541018	-0.0251682433055704	church	NN	fiction_gral	fiction	D	D	DE	CDE	church%1:06:00::	D	D	DE	CDE	 thickets. Along Wappinger Creek in Dutchess County, past the white <font color=green>church</font>  at Fishkill, past Verplanck 's Point on the east bank	6	5	174	83	5	church
church/NN/br-k16/2285	-0.0798634267632011	0.0193590464353121	church	NN	fiction_gral	fiction	E	E	DE	CDE	church_service%1:04:00::	E	E	DE	CDE	 him out of some dim corner of memory from a <font color=green>church</font>  service when he was a boy- yes, in a white	1	1	151	100	6	church
church/NN/br-k16/2298	-0.141496956407969	-0.00901313085119484	church	NN	fiction_gral	fiction	D	D	DE	CDE	church%1:06:00::	D	D	DE	CDE	 service when he was a boy- yes, in a white <font color=green>church</font>  with a thin spur steeple in the patriarchal Hudson Valley	5	3	99	60	5	church
church/NN/br-k19/168	-0.0371951194244115	-0.000595732719265535	church	NN	fiction_gral	fiction	A	A	AB	AB	church%1:14:00::	B	B	AB	AB	 for a more exalted office in the hierarchy of the <font color=green>church</font> - his ambitions for the bishopry had died very early in	5	1	63	20	6	church
church/NN/br-k19/213	0.0118967482815684	-0.164177424808677	church	NN	fiction_gral	fiction	A	A	AB	AB	church%1:14:00::	B	B	AB	AB	 of this desire was due to his devotion to the <font color=green>church</font>  and how much was his own ego, demanding to be	1	1	121	100	8	church
church/NN/br-k25/81	0.00647225518293404	-0.0968167846041143	church	NN	fiction_gral	fiction	D	D	DE	CDE	church%1:06:00::	D	D	DE	CDE	 whether a private residence in his Pennsylvania county or a <font color=green>church</font>  in Brazil, without it being obvious that he had done	3	2	109	67	7	church
church/NN/br-l08/1824	-0.0582603762855114	0.0476091818484991	church	NN	fiction_mystery	fiction	E	E	DE	CDE	church%1:04:00::	E	E	DE	CDE	 did n't feel good on Sunday, could n't go to <font color=green>church</font> - there 'd be a little argument, but she could be	3	2	105	67	7	church
church/NN/br-l08/2109	-0.000788414328666651	-0.0192460853814254	church	NN	fiction_mystery	fiction	C	C	C	CDE	church%1:06:00::	D	D	DE	CDE	 with foreign sounding names, the ones went to the same <font color=green>church</font>  and- Different place, different job, different people, she 'd be	2	2	96	100	11	church
church/NN/br-m01/1682	-0.0172250032467864	-0.091739096123582	church	NN	fiction_science	fiction	A	A	AB	AB	church%1:14:00::	B	B	AB	AB	 indicted for price-cutting. Fosterite bishops, after secret conclave, announced the <font color=green>Church</font>  's second Major Miracle: Supreme Bishop Digby had been translated	5	1	117	20	5	Church
church/NN/br-m01/2360	-0.0149278097281767	-0.00578099474710761	church	NN	fiction_science	fiction	E	E	DE	CDE	church%1:04:00::	E	E	DE	CDE	 continued most of the week following that ill-starred trip to <font color=green>church</font> , during which period Mike stayed in his room and usually	1	1	126	100	7	church
church/NN/br-p01/1161	-0.158877641223192	0.0668029831399183	church	NN	fiction_romance	fiction	D	D	DE	CDE	church%1:06:00::	D	D	DE	CDE	 hill, rising with the hill to the top where the <font color=green>church</font>  was and beyond that to the cemetery. Only paved alleyways	7	6	157	86	9	church
church/NN/br-p01/21	-0.198604330286846	0.113613140823619	church	NN	fiction_romance	fiction	D	D	DE	CDE	church_tower%1:06:00::	D	D	DE	CDE	 them he could have been the broken bell in the <font color=green>church</font>  tower which rang before and after Mass, and at noon	4	3	200	75	6	church
church/NN/br-p01/222	-0.0261610319356424	0.0745556185490356	church	NN	fiction_romance	fiction	E	E	DE	CDE	church%1:04:00::	E	E	DE	CDE	 from its elders. Youth obeyed when commanded. It went to <font color=green>church</font>  on Sunday and one Saturday a month went to confession	5	5	211	100	9	church
church/NN/br-p01/829	-0.161854156006544	-0.0727507379765855	church	NN	fiction_romance	fiction	D	D	DE	CDE	church%1:06:00::	D	D	DE	CDE	 to Drexel Street and his back in opposition to the <font color=green>church</font>  behind him. For all he saw or cared to see	5	3	136	60	6	church
church/NN/br-p09/150	-0.0115735126060454	0.186689259457314	church	NN	fiction_romance	fiction	D	D	DE	CDE	church%1:06:00::	D	D	DE	CDE	 all right. Wednesday nights after youth fellowship. Out of the <font color=green>church</font>  and into his big car, it tooling over the road	4	1	173	25	5	church
church/NN/br-p12/1014	-0.647745348851948	0.0823772071874389	church	NN	fiction_romance	fiction	D	D	DE	CDE	church%1:06:00::	D	D	DE	CDE	 Then they took a taxi to Trastevere.`` There 's a <font color=green>church</font>  you should see'', she said. And when they stood by	3	1	166	33	2	church
church/NN/br-p12/1063	-0.133442159776668	0.0383698229402453	church	NN	fiction_romance	fiction	D	D	DE	CDE	church%1:06:00::	D	D	DE	CDE	 with Alberto. He let her tell him all about the <font color=green>church</font> . Then they had dinner. All evening she was eloquent and	1	0	89	0	5	church
church/NN/br-p12/1102	-0.160464572648788	0.0479722795830915	church	NN	fiction_romance	fiction	D	D	DE	CDE	church_bell%1:06:00::	D	D	DE	CDE	 in the morning when he woke up at ten the <font color=green>church</font>  bells were ringing. He had never heard so many bells	2	1	120	50	7	church
church/NN/br-p12/1141	-0.165687324248501	0.012787992856325	church	NN	fiction_romance	fiction	D	D	DE	CDE	church%1:06:00::	D	D	DE	CDE	 when he had looked up at the obelisk and the <font color=green>church</font>  at the top of the Spanish Steps. It was a	3	1	72	33	5	church
church/NN/br-p12/1260	-0.0136521512018339	0.0346076313387028	church	NN	fiction_romance	fiction	E	E	DE	CDE	church%1:04:00::	E	E	DE	CDE	 snuggled against him, he wondered if she ever went to <font color=green>church</font> . Why did he want her to go to church? he	2	1	116	50	7	church
church/NN/br-p12/1270	-0.0133362466357412	0.0317720079961588	church	NN	fiction_romance	fiction	E	E	DE	CDE	church%1:04:00::	E	E	DE	CDE	 to church. Why did he want her to go to <font color=green>church</font> ? he wondered. Probably because it was a place where she	2	2	96	100	8	church
church/NN/br-p12/1309	-0.0686853560174409	-0.00928693224263366	church	NN	fiction_romance	fiction	E	E	DE	CDE	church%1:04:00::	E	E	DE	CDE	 It was too bad he had no feeling himself for <font color=green>church</font> . Not his poor mother 's fault. She would have been	2	2	112	100	5	church
church/NN/br-p12/1433	0.107779905474561	0.0830307847454145	church	NN	fiction_romance	fiction	C	C	C	CDE	church%1:04:00::	E	E	DE	CDE	 woman though, she would take only what she needed from <font color=green>church</font> . It was too bad he was n't a Catholic himself	3	2	120	67	7	church
church/NN/br-p12/1559	-0.103355811088886	-0.00109854949838348	church	NN	fiction_romance	fiction	E	E	DE	CDE	church%1:04:00::	E	E	DE	CDE	 girl like Carla if she got up and went to <font color=green>church</font> . A half hour later he got her up to go	1	0	78	0	8	church
church/NN/br-r05/1163	-0.00370986541961328	-0.051544456652688	church	NN	humor	fiction	C	C	C	CDE	church%1:06:00::	D	D	DE	CDE	 While Henry Morgan was escorting Miss Vera Green from the <font color=green>church</font>  social last Saturday night, a savage dog attacked them and	3	2	159	67	7	church
church/NNP/br-d03/1914	0.0677303102158876	0.0997706904998531	church	NNP	religion	non-fiction	B	B	AB	AB	group%1:03:00::	C	C	C	CDE	 the Observer depicting clergymen of the Church of England, the <font color=green>Church</font>  of Rome and the Nonconformist Church. The Catholic priest, though	5	2	413	40	6	Church
church/NNP/br-d03/1920	0.0751713263051821	0.110847481491175	church	NNP	religion	non-fiction	B	B	AB	AB	group%1:03:00::	C	C	C	CDE	 Church of England, the Church of Rome and the Nonconformist <font color=green>Church</font> . The Catholic priest, though somewhat superficially drawn, easily came out	5	3	384	60	6	Church
church/NNP/br-d03/2022	0.105906013362891	0.167020522971802	church	NNP	religion	non-fiction	B	B	AB	AB	group%1:03:00::	C	C	C	CDE	 comments were equally made by an Anglican parson, a Free <font color=green>Church</font>  minister and a Catholic priest. Catholic priests have frequently appeared	3	2	417	67	7	Church
church/NNP/br-d03/91	0.0904112514025788	0.013223116660363	church	NNP	religion	non-fiction	A	A	AB	AB	group%1:03:00::	C	C	C	CDE	 the religious sphere so popularly discussed as Christian unity. The <font color=green>Church</font>  Unity Octave, January 18- 25, was enthusiastically devoted to prayer	5	3	241	60	8	Church
church/NNP/br-j57/304	0.0472026121029408	0.106816565886657	church	NNP	learned	non-fiction	B	B	AB	AB	group%1:03:00::	C	C	C	CDE	 Indeed, it is even surprising in the Canon of Christ <font color=green>Church</font>  and Regius Professor of Ecclesiastical History, who fathered this most	3	1	237	33	6	Church
church/NNP/br-k04/233	-0.0836107514762465	-0.037407077492253	church	NNP	fiction_gral	fiction	D	D	DE	CDE	group%1:03:00::	C	C	C	CDE	 of this crowded region was the Allen African Methodist Episcopal <font color=green>Church</font> . It was an old and dirty wooden structure, sadly in	4	4	193	100	11	Church
church/NNP/br-k06/1930	0.15310942929143	0.0550907022256171	church	NNP	fiction_gral	fiction	D	D	DE	CDE	group%1:03:00::	C	C	C	CDE	 strike the steeples of the other churches; not of Drew <font color=green>Church</font> . A flash illumined the trees as a crooked bolt twigged	2	1	252	50	4	Church
church/NNP/br-k06/698	-0.00986261944091221	0.00569756331976189	church	NNP	fiction_gral	fiction	D	D	DE	CDE	group%1:03:00::	C	C	C	CDE	 the foothills, was the city of God. The Dutch Reformed <font color=green>Church</font> , with two steeples and its own school was on Main	4	2	108	50	6	Church
church/NNP/br-k06/714	-0.0104469573685158	0.0630191742398384	church	NNP	fiction_gral	fiction	D	D	DE	CDE	group%1:03:00::	C	C	C	CDE	 and its own school was on Main Street; the Episcopal <font color=green>Church</font>  was one block down Sussex Street; the Catholic Saint Mary's	4	2	183	50	7	Church
church/NNP/br-k06/726	-0.0038105788618621	0.130050802976432	church	NNP	fiction_gral	fiction	D	D	DE	CDE	group%1:03:00::	C	C	C	CDE	 was one block down Sussex Street; the Catholic Saint Mary's <font color=green>Church</font> , with an even taller steeple and a cross on top	5	1	291	20	5	Church
church/NNP/br-k06/841	-0.0653208701677827	0.0879656326829758	church	NNP	fiction_gral	fiction	D	D	DE	CDE	group%1:03:00::	C	C	C	CDE	 became familiar with God, who resided chiefly in Drew Centennial <font color=green>Church</font>  with its high steeple and clock. There was no church	3	2	259	67	6	Church
church/NNP/br-k06/855	-0.0638024526414725	0.123787550397444	church	NNP	fiction_gral	fiction	D	D	DE	CDE	group%1:03:00::	C	C	C	CDE	 high steeple and clock. There was no church like Drew <font color=green>Church</font> , no preacher like Papa, who was intimate with Him, and	2	1	277	50	7	Church
church/NNP/br-k10/1229	-0.0594436802140217	-0.0755271682409549	church	NNP	fiction_gral	fiction	B	B	AB	AB	group%1:03:00::	C	C	C	CDE	 smashing images and tearing down symbols sacred to the Old <font color=green>Church</font> . John found it difficult, but he held him in check	4	3	289	75	9	Church
church/NNS/br-d02/548	0.0958887399725264	-0.0700801131060319	church	NNS	religion	non-fiction	B	B	AB	AB	church%1:14:00::	B	B	AB	AB	 observed to characterize the preaching and teaching of the American <font color=green>churches</font> . In the absence of a truly adequate conceptuality in which	3	1	235	33	7	churches
church/NNS/br-d03/1011	0.0979596399889198	-0.199573700397024	church	NNS	religion	non-fiction	D	D	DE	CDE	church%1:06:00::	D	D	DE	CDE	 often, the sale of 764 chapels''. Most of these former <font color=green>churches</font>  are now used as warehouses, but`` neither Anglicans nor Nonconformists	3	1	121	33	4	churches
church/NNS/br-d03/1027	0.149266200916783	0.0978440587250748	church	NNS	religion	non-fiction	D	D	DE	CDE	church%1:06:00::	D	D	DE	CDE	 as warehouses, but`` neither Anglicans nor Nonconformists object to selling <font color=green>churches</font>  to Roman Catholics'', and have done so. While it must	2	1	261	50	5	churches
church/NNS/br-d03/1051	0.0555917833247401	-0.0104080474035107	church	NNS	religion	non-fiction	D	D	DE	CDE	church%1:06:00::	D	D	DE	CDE	 be said that these same Protestants have built some new <font color=green>churches</font>  during this period, and that religious population shifts have emptied	4	4	219	100	8	churches
church/NNS/br-d03/1063	0.0747231913565249	-0.0243388978328522	church	NNS	religion	non-fiction	C	C	C	CDE	church%1:06:00::	D	D	DE	CDE	 during this period, and that religious population shifts have emptied <font color=green>churches</font> , a principal reason for this phenomenon of redundancy is that	5	4	260	80	8	churches
church/NNS/br-d03/110	0.0290066355481495	-0.00473931562119303	church	NNS	religion	non-fiction	C	C	C	CDE	church%1:14:00::	B	B	AB	AB	 was enthusiastically devoted to prayer and discussion by the various <font color=green>churches</font> . Many people seem hopeful, yet it is difficult to predict	5	5	188	100	9	churches
church/NNS/br-d03/1472	0.0726887072333071	0.119381281493825	church	NNS	religion	non-fiction	E	E	DE	CDE	church%1:06:00::	D	D	DE	CDE	 thy Son''. A hymn often to be heard in Catholic <font color=green>churches</font>  is`` Faith of our Fathers'', which glories in England 's	3	2	152	67	4	churches
church/NNS/br-d03/1884	0.0727599175713043	0.0463873506644698	church	NNS	religion	non-fiction	B	B	AB	AB	church%1:14:00::	B	B	AB	AB	 at least of equal stature in England with the Protestant <font color=green>churches</font> . On successive Sundays during October, 1960, Paul Ferris( a non-Catholic	2	2	245	100	8	churches
church/NNS/br-d03/313	0.0690218374380759	0.0311853991500331	church	NNS	religion	non-fiction	B	B	AB	AB	anglican_church%1:14:00::	B2	B	AB	AB	 saying and writing and implying about the Roman and Anglican <font color=green>Churches</font>  and about the present religious state of England. Since the	5	4	177	80	7	Churches
church/NNS/br-d03/35	0.0684367186518553	0.0472712043960772	church	NNS	religion	non-fiction	B	B	AB	AB	anglican_church%1:14:00::	B2	B	AB	AB	 efforts of only unauthorized individuals of the Roman and Anglican <font color=green>Churches</font> , and urging a communion of prayer unacceptable to Rome, this	5	3	266	60	7	Churches
church/NNS/br-d03/779	0.0690229444298449	0.0554212190059667	church	NNS	religion	non-fiction	D	D	DE	CDE	church%1:06:00::	D	D	DE	CDE	 less than ten. From many sides come remarks that Protestant <font color=green>churches</font>  are badly attended and the large medieval cathedrals look all	4	3	245	75	8	churches
church/NNS/br-d03/849	0.046524838207642	-0.00510786455104311	church	NNS	religion	non-fiction	C	C	C	CDE	church%1:06:00::	D	D	DE	CDE	 admit the great falling off in effective membership in their <font color=green>churches</font> . According to a newspaper report of the 1961 statistics of	2	2	222	100	8	churches
church/NNS/br-d03/929	0.07082863873633	-0.125366399533889	church	NNS	religion	non-fiction	C	C	C	CDE	church%1:06:00::	D	D	DE	CDE	 the Manchester Guardian of last November, entitled`` Fate of Redundant <font color=green>Churches</font> '', states than an Archbishops' Commission`` reported last month that in	2	0	238	0	6	Churches
church/NNS/br-d03/952	0.0224193451388937	0.0433528395752671	church	NNS	religion	non-fiction	C	C	C	CDE	church%1:06:00::	D	D	DE	CDE	 that in the Church of England alone there are 790 <font color=green>churches</font>  which are redundant now, or will be in 20 years	3	2	209	67	4	churches
church/NNS/br-d03/971	0.0405379477312461	-0.181130444634752	church	NNS	religion	non-fiction	D	D	DE	CDE	church%1:06:00::	D	D	DE	CDE	 will be in 20 years' time. A further 260 Anglican <font color=green>churches</font>  have been demolished since 1948''. And in the last five	1	0	107	0	1	churches
church/NNS/br-f15/1245	0.0815264597826161	0.0259532907292772	church	NNS	popular_lore	fiction	B	B	AB	AB	church%1:14:00::	B	B	AB	AB	 Consider what happened during World War 1,, when the Protestant <font color=green>churches</font>  united to push the Prohibition law through Congress. Many of	2	2	280	100	8	churches
church/NNS/br-f15/1425	0.181543531699283	0.022301986175302	church	NNS	popular_lore	fiction	B	B	AB	AB	christian_church%1:14:00::	B	B	AB	AB	 turn of the century, contraception was condemned by all Christian <font color=green>churches</font>  as immoral, unnatural and contrary to divine law. This was	5	1	319	20	5	churches
church/NNS/br-f15/1455	0.0442619669891679	0.0200855818934717	church	NNS	popular_lore	fiction	B	B	AB	AB	orthodox_church%1:14:00::	B1	B	AB	AB	 laws of Christian countries. Today, the Roman Catholic and Orthodox <font color=green>Churches</font>  stand virtually alone in holding that conviction. The various Lambeth	5	5	260	100	12	Churches
church/NNS/br-f15/1720	0.0521221281986378	-0.0102798892614348	church	NNS	popular_lore	fiction	B	B	AB	AB	group%1:03:00::	C	C	C	CDE	 28 members of a committee of the Federal Council of <font color=green>Churches</font>  ratified artificial methods of birth control.`` As to the necessity	4	2	242	50	7	Churches
church/NNS/br-f15/1887	0.0635786146752479	-0.000450482506919954	church	NNS	popular_lore	fiction	B	B	AB	AB	group%1:03:00::	C	C	C	CDE	 1961, by the general board of the National Council of <font color=green>Churches</font> , the largest Protestant organization in the US. The board approved	3	3	237	100	6	Churches
church/NNS/br-f15/1944	0.0175277284680952	-0.0275159655631747	church	NNS	popular_lore	fiction	B	B	AB	AB	church%1:14:00::	B	B	AB	AB	 of contraceptives. The general board declared:`` Most of the Protestant <font color=green>churches</font>  hold contraception and periodic continence to be morally right when	4	3	185	75	7	churches
church/NNS/br-f15/1998	0.0862225041227102	-0.000335460014681215	church	NNS	popular_lore	fiction	B	B	AB	AB	christian_church%1:14:00::	B	B	AB	AB	 of conception''. An action once universally condemned by all Christian <font color=green>churches</font>  and forbidden by the civil law is now not only	2	2	207	100	9	churches
church/NNS/br-f15/821	0.113377826942704	0.0411196563705318	church	NNS	popular_lore	fiction	B	B	AB	AB	orthodox_catholic_church%1:14:00::	B1	B	AB	AB	 the exception of the Roman Catholic and the Orthodox Catholic <font color=green>Churches</font> , most churches make no moral distinction between rhythm and mechanical	6	6	359	100	10	Churches
church/NNS/br-f15/824	0.11715422351393	0.0407525511828818	church	NNS	popular_lore	fiction	B	B	AB	AB	church%1:14:00::	B	B	AB	AB	 of the Roman Catholic and the Orthodox Catholic Churches, most <font color=green>churches</font>  make no moral distinction between rhythm and mechanical or chemical	5	6	362	120	11	churches
church/NNS/br-f44/1106	0.122365581388089	-0.050760918778939	church	NNS	popular_lore	fiction	C	C	C	CDE	church%1:14:00::	B	B	AB	AB	 who will strengthen the social class nucleus of the congregation. <font color=green>Churches</font>  can be strengthened through this process of co-optation so long	5	4	251	80	6	Churches
church/NNS/br-f44/1189	0.0381223507380672	-0.0226731562308139	church	NNS	popular_lore	fiction	C	C	C	CDE	church%1:14:00::	B	B	AB	AB	 and publicity in reaching new members. The proclamation of the <font color=green>churches</font>  is almost totally confined to pastoral contacts by the clergy	7	5	249	71	8	churches
church/NNS/br-f44/124	0.0383646189495701	-0.0412976100124554	church	NNS	popular_lore	fiction	C	C	C	CDE	church%1:14:00::	B	B	AB	AB	 inner city blight account for the decline of central city <font color=green>churches</font> . Central cities reveal two adverse features for the major denominations	4	4	221	100	10	churches
church/NNS/br-f44/1262	0.055842596540526	-0.0442675791637709	church	NNS	popular_lore	fiction	C	C	C	CDE	church%1:14:00::	B	B	AB	AB	 will account for a major share of recruitment by the <font color=green>churches</font> , making it quite evident that the extension of economic integration	2	0	188	0	8	churches
church/NNS/br-f44/1427	0.0612037585435933	-0.0387398428819427	church	NNS	popular_lore	fiction	C	C	C	CDE	church%1:14:00::	B	B	AB	AB	 for more than a single generation. The fact that metropolitan <font color=green>churches</font>  of the major denominations have moved approximately every generation for	4	4	243	100	10	churches
church/NNS/br-f44/1475	0.0208837670697807	-0.0130747768746851	church	NNS	popular_lore	fiction	D	D	DE	CDE	church%1:06:00::	D	D	DE	CDE	 in religious life, when one recalls the number of city <font color=green>churches</font>  which deteriorated beyond repair before being abandoned, raises fundamental questions	4	3	186	75	9	churches
church/NNS/br-f44/1683	0.140705510806171	-0.110809195429595	church	NNS	popular_lore	fiction	C	C	C	CDE	church%1:14:00::	B	B	AB	AB	 hopelessly unstable environment. More than creatures of metropolitan forces, the <font color=green>churches</font>  have taken the lead in counteracting the interdependence of metropolitan	2	2	265	100	7	churches
church/NNS/br-f44/1802	0.199729956505828	-0.100834638880287	church	NNS	popular_lore	fiction	D	D	DE	CDE	church%1:14:00::	B	B	AB	AB	 fight their way into the lower middle-class suburbs, and the <font color=green>churches</font>  will experience the same decay and rebuilding cycle which has	3	2	303	67	7	churches
church/NNS/br-f44/1918	0.104127121111201	-0.0302197770533365	church	NNS	popular_lore	fiction	C	C	C	CDE	church%1:14:00::	B	B	AB	AB	 of middle-class culture could lead to various projections for the <font color=green>churches</font> . It could be argued that any fellowship which centers in	3	3	270	100	6	churches
church/NNS/br-f44/2015	0.107153632239172	-0.0888138585655994	church	NNS	popular_lore	fiction	C	C	C	CDE	church%1:14:00::	B	B	AB	AB	 next chapter to the style of association in the denominational <font color=green>churches</font> ; this style is characteristically an expression of the communal style	3	1	229	33	5	churches
church/NNS/br-f44/2181	-0.0195597344251579	-0.0828255089820904	church	NNS	popular_lore	fiction	C	C	C	CDE	church%1:14:00::	B	B	AB	AB	 have fashioned the iron cage of conformity which imprisons the <font color=green>churches</font>  in their suburban captivity. The perplexing question still remains as	2	1	192	50	5	churches
church/NNS/br-f44/2201	0.0486268884241009	-0.0462478319430265	church	NNS	popular_lore	fiction	C	C	C	CDE	church%1:14:00::	B	B	AB	AB	 remains as to why the middle classes turn to the <font color=green>churches</font>  as a vehicle of social identity when their clubs and	5	5	217	100	8	churches
church/NNS/br-f44/343	0.133859562281595	-0.0669460710425068	church	NNS	popular_lore	fiction	C	C	C	CDE	church%1:14:00::	B	B	AB	AB	 moreover, residential mobility is so high in metropolitan areas that <font color=green>churches</font>  have to recruit constantly in their core stratum in order	5	3	235	60	8	churches
church/NNS/br-f44/868	0.121457441601932	-0.0362225185962154	church	NNS	popular_lore	fiction	C	C	C	CDE	church%1:14:00::	B	B	AB	AB	 and congregational outreach have not been carefully studied in the <font color=green>churches</font> ; one study in Pittsburgh, however, has illuminated the situation. In	2	1	238	50	7	churches
church/NNS/br-f44/890	0.0296546896934944	-0.00912249655500811	church	NNS	popular_lore	fiction	C	C	C	CDE	church%1:14:00::	B	B	AB	AB	 the situation. In a sample of new members of Pittsburgh <font color=green>churches</font> , almost 60 per cent were recruited by initial`` contacts with	3	2	228	67	9	churches
church/NNS/br-k01/769	-0.211853347039067	-0.0257873348964535	church	NNS	fiction_gral	fiction	D	D	DE	CDE	church%1:06:00::	D	D	DE	CDE	 It was a Negro section of peeling row houses, store-front <font color=green>churches</font>  and ragged children. Rachel had to bend toward Scotty and	2	1	190	50	5	churches
church/NNS/br-k04/2307	0.055030468413259	0.0970646026558969	church	NNS	fiction_gral	fiction	B	B	AB	AB	church%1:06:00::	D	D	DE	CDE	 his career in the Methodist church, if not in all <font color=green>churches</font> .	2	0	247	0	2	churches
church/NNS/br-k06/1925	-0.197989361540412	-0.205099517362042	church	NNS	fiction_gral	fiction	D	D	DE	CDE	church%1:06:00::	D	D	DE	CDE	 them open. Lightning might strike the steeples of the other <font color=green>churches</font> ; not of Drew Church. A flash illumined the trees as	2	0	222	0	5	churches
