id	model.x	model.y	lemma	pos	sensekey	marisense	mbroad	wnbroad	mari2	mari3	wn2	wn3	wnsense	text
church/NNS/br-f44/868	-0.0113385554874236	-0.18819770750447	church	NNS	church%1:14:00::	C	C	B	CDE	C	AB	AB	B	 and congregational outreach have not been carefully studied in the <font color=green>churches</font> ; one study in Pittsburgh, however, has illuminated the situation. In
church/NNS/br-f44/890	0.0501086018984504	-0.189121222393264	church	NNS	church%1:14:00::	C	C	B	CDE	C	AB	AB	B	 the situation. In a sample of new members of Pittsburgh <font color=green>churches</font> , almost 60 per cent were recruited by initial`` contacts with
church/NNS/br-k06/1925	-0.173000345472781	-0.210491929214814	church	NNS	church%1:06:00::	D	D	D	CDE	DE	CDE	DE	D	 them open. Lightning might strike the steeples of the other <font color=green>churches</font> ; not of Drew Church. A flash illumined the trees as
state/JJ/br-d12/2233	-0.0145973337168658	-0.013412859256192	state	JJ	Z	Z	Z	Z	Z	Z	Z	Z	Z	 the narrow sense of skillfulness in meeting a client 's <font color=green>stated</font>  needs as already noted? Our faculty and students pressed this
state/JJ/br-e21/1143	-0.00588443200168864	-0.0101178027612005	state	JJ	state%5:00:02:public:00	A2	A	A	ABC	AB	ABC	AB	A2	 which the area is blessed. Just as the national and <font color=green>state</font>  parks place emphasis on features which are of national or
state/JJ/br-e21/1154	0.00118966324739606	-0.00433314034770503	state	JJ	state%5:00:01:public:00	A3	A	A	ABC	AB	ABC	AB	A2	 parks place emphasis on features which are of national or <font color=green>state</font>  significance, counties should seek out these features which are distinctive
state/JJ/br-e31/1555	-0.0234009194581936	-0.0417638270902034	state	JJ	state%5:00:02:public:00	A2	A	A	ABC	AB	ABC	AB	A2	 to make their cooking easy and their sleeping comfortable. Harassed <font color=green>state</font>  park officials often have more campers than they know what
state/JJ/br-e31/651	0.023711684897828	0.00834657782099599	state	JJ	state%5:00:02:public:00	A3	A	A	ABC	AB	ABC	AB	A2	 the shooting development program have proudly participated in over 53 <font color=green>state</font>  and regional workshops, at which hundreds of school administrators, teachers
state/JJ/br-g17/2159	-0.0370808989496475	0.00906910575405834	state	JJ	state%5:00:02:public:00	A2	A	A	ABC	AB	ABC	AB	A2	 is involved. How did it happen, for example, that the <font color=green>state</font>  university, that great symbol of American democracy, failed to flourish
state/JJ/br-g17/2327	0.00309177181677247	0.00388824923275245	state	JJ	state%5:00:02:public:00	A2	A	A	ABC	AB	ABC	AB	A2	 been the very last of the forty-eight to establish a <font color=green>state</font>  university? The state universities of Maine, New Hampshire, And Vermont
state/JJ/br-g17/2331	0.00382289217094171	-0.013186259591054	state	JJ	state%5:00:02:public:00	A2	A	A	ABC	AB	ABC	AB	A2	 last of the forty-eight to establish a state university? The <font color=green>state</font>  universities of Maine, New Hampshire, And Vermont are older and
state/JJ/br-g23/486	-0.0251895708466512	-0.0271066055127064	state	JJ	state%5:00:02:public:00	A2	A	A	ABC	AB	ABC	AB	A2	 The writer took a class of college students to the <font color=green>state</font>  hospital for the mentally ill in St. Joseph, Missouri. An
state/JJ/br-h11/1931	0.0141232240275799	0.0166566385546773	state	JJ	solid-state%5:00:02:solid:01	D	D	D	D	D	D	D	D2	 addition to the basic programs in wavelength standards, spectroscopy, solid <font color=green>state</font>  physics, interactions of the free electron and atomic constants which
state/JJ/br-h11/1986	0.0090299693174422	0.0140680533425398	state	JJ	solid-state%5:00:02:solid:01	D	D	D	D	D	D	D	D2	 the far infrared, the application of infrared techniques to solid <font color=green>state</font>  studies, and increased emphasis on high resolution instrumentation. Two data
state/JJ/br-h14/1724	0.0817935906525542	0.0322589472666731	state	JJ	state%5:00:02:public:00	A3	A	A	ABC	AB	ABC	AB	A2	 in order to provide matching for the minimum( base) allotment, <font color=green>State</font>  funds had to equal 1954 State funds. Prior to and
state/JJ/br-h14/1730	0.103891676097254	0.0400358035297241	state	JJ	state%5:00:02:public:00	A3	A	A	ABC	AB	ABC	AB	A2	 the minimum( base) allotment, State funds had to equal 1954 <font color=green>State</font>  funds. Prior to and since 1960 the rest of the
state/JJ/br-h14/1763	0.0438863408294204	0.0256098091915006	state	JJ	state%5:00:02:public:00	A3	A	A	ABC	AB	ABC	AB	A2	 fiscal capacity of the State, with a pivot of 40% <font color=green>State</font> ( or 60% Federal) participation in total program costs. The percentage
state/JJ/br-h14/1868	0.0395211716536107	0.022056924788156	state	JJ	state%5:00:02:public:00	A3	A	A	ABC	AB	ABC	AB	A2	 will be matched on the basis of a 40% pivot <font color=green>State</font>  share, with maximum and minimum State shares of 50% and
state/JJ/br-h14/1875	0.0579313204608527	0.0275310961673738	state	JJ	state%5:00:02:public:00	A3	A	A	ABC	AB	ABC	AB	A2	 of a 40% pivot State share, with maximum and minimum <font color=green>State</font>  shares of 50% and 30%, respectively. The pre 1960 rate
state/JJ/br-h14/1997	0.0226703376759277	0.00930343855095985	state	JJ	state%5:00:02:public:00	A3	A	A	ABC	AB	ABC	AB	A2	 rates. The method used for computing the respective Federal and <font color=green>State</font>  shares in total program costs is specifically set forth in
state/JJ/br-h14/332	0.0276100778322611	0.0208561051667091	state	JJ	state%5:00:02:public:00	A3	A	A	ABC	AB	ABC	AB	A2	 grants to the States on the basis of population, matching <font color=green>State</font>  expenditures on a 50 - 50 basis. Under P. L.
state/JJ/br-h14/360	0.163297815068547	0.0751964614296921	state	JJ	state%5:00:02:public:00	A3	A	A	ABC	AB	ABC	AB	A2	 Congress, the Federal Government assumed responsibility for 100% of necessary <font color=green>State</font>  expenditures in connection with administration and the counseling and placement
state/JJ/br-h14/533	0.0548621113891466	0.00300236547894344	state	JJ	state%5:00:02:public:00	A3	A	A	ABC	AB	ABC	AB	A2	 the authorizations, appropriations, allotment base, Federal grants to States and <font color=green>State</font>  matching funds for this part of the grant program. In
state/JJ/br-h14/747	0.0441972244699987	0.0242213591014149	state	JJ	state%5:00:02:public:00	A3	A	A	ABC	AB	ABC	AB	A2	 State. The provisions are also designed to avoid disruption in <font color=green>State</font>  programs already in operation, which might otherwise result from the
state/JJ/br-h15/1500	0.0163152628748243	0.00552769792143827	state	JJ	state%5:00:02:public:00	A3	A	A	ABC	AB	ABC	AB	A2	 gather its own information and will receive broad information from <font color=green>State</font>  and Federal sources. It will tell you as soon as
state/JJ/br-j38/1551	0.0318382175607353	0.0273824773869441	state	JJ	state%5:00:02:public:00	A3	A	A	ABC	AB	ABC	AB	A2	 Federal government but from an exchange of experiences among states. <font color=green>State</font>  and local agencies in the vocational education field must be
state/JJ/br-j38/1590	0.0280400304982028	0.01784267465521	state	JJ	state%5:00:02:public:00	A3	A	A	ABC	AB	ABC	AB	A2	 Federal effort to provide research and information to help guide <font color=green>state</font>  education departments and local school boards in existing programs. A
state/JJ/br-j38/1871	0.0384986078599023	0.0237988960311059	state	JJ	state%5:00:02:public:00	A3	A	A	ABC	AB	ABC	AB	A2	 for training to meet national skilled manpower needs. If only <font color=green>state</font>  funds were used to pay for the vocational education, it
state/JJ/br-j38/441	0.0227061033115383	0.0205536202416324	state	JJ	state%5:00:02:public:00	A3	A	A	ABC	AB	ABC	AB	A2	 enrolled in courses organized under two special programs administered by <font color=green>state</font>  and local school authorities:( 1) Vocational Education for National Defense
state/JJ/br-j38/86	0.0268817244040355	0.0167094586247266	state	JJ	state%5:00:02:public:00	A1	A	A	ABC	AB	ABC	AB	A2	 appropriation of$ 7 million to support, on a matching basis, <font color=green>state</font>  administered programs of vocational education in agriculture, trades, industrial skills
state/JJ/br-l14/977	0.0301356054333943	-0.0390968794033786	state	JJ	state%5:00:02:public:00	A2	A	A	ABC	AB	ABC	AB	A2	 modern, large, on five acres. Must have cost plenty. The <font color=green>State</font>  cops would check from time to time; pass word when
state/JJ/br-p02/136	-0.0395642377486163	-0.0733294186329748	state	JJ	Z	Z	Z	Z	Z	Z	Z	Z	Z	 dry and comfortable and fed huge amounts of food at <font color=green>stated</font>  intervals and be carried to where she could watch activity
state/NN/br-a23/69	0.473130372658176	-0.047540945466967	state	NN	Z	A1	A	Z	ABC	AB	Z	Z	Z	 category, for which emergency allotment can be given by the <font color=green>state</font>  if necessary. William Smythe, director of field service, told the
state/NN/br-a33/1770	0.136992511163158	0.157595002131475	state	NN	Z	A5	A	Z	ABC	AB	Z	Z	Z	 Accepted Scottish Rite for the Southern Jurisdiction of the United <font color=green>States</font> . The opening session of the 5- day session will begin
state/NN/br-b02/2120	0.0255307911163508	-0.13247049621417	state	NN	Z	A1	A	Z	ABC	AB	Z	Z	Z	 federal funds. This year 's Senate measure would provide each <font color=green>state</font>  and the District of Columbia with$ 1000000 to be used
state/NN/br-b18/919	0.136992511163158	0.157595002131475	state	NN	Z	A5	A	Z	ABC	AB	Z	Z	Z	 matter is essentially within the domestic jurisdiction of the United <font color=green>States</font>  in a case before the World Court to which the
state/NN/br-d10/1915	0.090579650181634	-0.157230701752553	state	NN	Z	C	C	Z	ABC	C	Z	Z	Z	 Catholic defense of the practical autonomy of both church and <font color=green>state</font> . The failure at that time of the Puerto Rican bishops
state/NN/br-h09/172	0.0255307911163508	-0.13247049621417	state	NN	united_states%1:15:00::	A5	A	A	ABC	AB	ABC	AB	A51	 other mineralized or chemically charged water, and the term' United <font color=green>States</font> ' extends to and includes the District of Columbia, the Commonwealth
state/NN/br-h09/1765	0.098215943311645	-0.158842562492247	state	NN	state%1:14:01::	Z	Z	B	Z	Z	ABC	AB	B	 of this Act. As used in this section- the term`` <font color=green>State</font> '' includes the Commonwealth of Puerto Rico and any possession of
state/NN/br-h09/1779	0.098215943311645	-0.158842562492247	state	NN	united_states%1:14:00::	A5	A	A	ABC	AB	ABC	AB	A52	 Commonwealth of Puerto Rico and any possession of the United <font color=green>States</font> ; and the term`` commerce'' means commerce between any State and
state/NN/br-h09/197	0.136873509915209	-0.245821667195639	state	NN	united_states%1:14:00::	A5	A	A	ABC	AB	ABC	AB	A52	 Puerto Rico, and the territories and possessions of the United <font color=green>States</font> . In order to accomplish the purposes of this Act, the
state/NN/br-h12/1291	0.136992511163158	0.157595002131475	state	NN	united_states%1:15:00::	A5	A	A	ABC	AB	ABC	AB	A51	 appointed by a court of competent jurisdiction in the United <font color=green>States</font>  and has not been discharged prior to the date of
state/NN/br-h12/1345	0.136992511163158	0.157595002131475	state	NN	united_states%1:15:00::	A5	A	A	ABC	AB	ABC	AB	A51	 appointed by a court of competent jurisdiction in the United <font color=green>States</font> , makes an assignment of the claim, or any part thereof
state/NN/br-h12/468	0.136992511163158	0.157595002131475	state	NN	united_states%1:15:00::	A5	A	A	ABC	AB	ABC	AB	A51	 as to any claims of the Government of the United <font color=green>States</font>  with respect to which the Commission has jurisdiction under this
state/NN/br-h14/1016	0.34988812774099	0.16718878297742	state	NN	state%1:15:01::	A	A	A	ABC	AB	ABC	AB	A	 which bears the same ratio to 50% as the particular <font color=green>State</font>  's average per capita income bears to the average per
state/NN/br-h14/1049	0.184650327184758	-0.0328955050155041	state	NN	state%1:15:01::	A	A	A	ABC	AB	ABC	AB	A	 in item 3 above by the result obtained for each <font color=green>State</font>  in item 1 above.) Determine the particular State 's`` allotment
state/NN/br-h14/1059	0.199917736764326	-0.0187364525415817	state	NN	state%1:15:01::	A	A	A	ABC	AB	ABC	AB	A	 for each State in item 1 above.) Determine the particular <font color=green>State</font>  's`` allotment percentage''. By law this is 75% for the
state/NN/br-h14/1123	0.199917736764326	-0.0187364525415817	state	NN	state%1:15:01::	A	A	A	ABC	AB	ABC	AB	A	 the result obtained in item 4 above; except that no <font color=green>State</font>  shall have an allotment percentage less than 33- 1 3
state/NN/br-h14/1159	0.472483380132101	-0.0474933676706352	state	NN	state%1:15:01::	A	A	A	ABC	AB	ABC	AB	A	 particular State is less or more than these extremes, the <font color=green>State</font>  's allotment percentage must be raised or lowered to the
state/NN/br-h14/1175	0.473142643123043	-0.0475413400682175	state	NN	state%1:15:01::	A	A	A	ABC	AB	ABC	AB	A	 be raised or lowered to the appropriate extreme. Square each <font color=green>State</font>  's allotment percentage. Determine each State 's population.( See Source
state/NN/br-h14/1182	0.473113481981487	-0.0475404263923848	state	NN	state%1:15:01::	A	A	A	ABC	AB	ABC	AB	A	 appropriate extreme. Square each State 's allotment percentage. Determine each <font color=green>State</font>  's population.( See Source of Data, below for population data
state/NN/br-h14/1209	0.473132569012441	-0.0475410178250196	state	NN	state%1:15:01::	A	A	A	ABC	AB	ABC	AB	A	 be used in this step.) Multiply the population of each <font color=green>State</font>  by the square of its allotment percentage.( Multiply result obtained
state/NN/br-h14/1251	0.184650327184758	-0.0328955050155041	state	NN	state%1:15:01::	A	A	A	ABC	AB	ABC	AB	A	 the products obtained in item 8 above, for all the <font color=green>States</font> .( For each State, make all computations set forth in items
state/NN/br-h14/1278	0.184650327184758	-0.0328955050155041	state	NN	state%1:15:01::	A	A	A	ABC	AB	ABC	AB	A	 8 above, and then add the results obtained for each <font color=green>State</font>  in item 8.) Determine the ratio that the amount being
state/NN/br-h14/1323	0.199917736764326	-0.0187364525415817	state	NN	state%1:15:01::	A	A	A	ABC	AB	ABC	AB	A	 the result obtained in item 9 above.) Determine the particular <font color=green>State</font>  's unadjusted allotment for the particular fiscal year.( Multiply the
state/NN/br-h14/1336	0.199917736764326	-0.0187364525415817	state	NN	state%1:15:01::	A	A	A	ABC	AB	ABC	AB	A	 's unadjusted allotment for the particular fiscal year.( Multiply the <font color=green>State</font>  product in item 8 above by the result obtained in
state/NN/br-h14/1356	0.199917736764326	-0.0187364525415817	state	NN	state%1:15:01::	A	A	A	ABC	AB	ABC	AB	A	 result obtained in item 10 above.) Determine if the particular <font color=green>State</font>  's unadjusted allotment( result obtained in item 11 above) is
state/NN/br-h14/1389	0.473128767812695	-0.047540891857203	state	NN	state%1:15:01::	A	A	A	ABC	AB	ABC	AB	A	 so lower its unadjusted allotment to its maximum allotment.( Each <font color=green>State</font>  's unadjusted allotment for any fiscal year, which exceeds its
state/NN/br-h14/1444	0.199917736764326	-0.0187364525415817	state	NN	state%1:15:01::	A	A	A	ABC	AB	ABC	AB	A	 by the amount of the excess.) Determine if the particular <font color=green>State</font>  's unadjusted allotment( result obtained in item 11 above) is
state/NN/br-h14/1485	0.473122295737231	-0.0475406743620886	state	NN	state%1:15:01::	A	A	A	ABC	AB	ABC	AB	A	 to its minimum allotment. Regardless of its unadjusted allotment, each <font color=green>State</font>  is guaranteed by law a minimum allotment each year equal
state/NN/br-h14/1552	0.47314246757986	-0.0475413344915539	state	NN	state%1:15:01::	A	A	A	ABC	AB	ABC	AB	A	 increase the unadjusted allotments to the specified minimum in those <font color=green>States</font>  where the unadjusted allotment is less than the minimum allotment
state/NN/br-h14/1595	0.47314264384159	-0.0475413400388967	state	NN	state%1:15:01::	A	A	A	ABC	AB	ABC	AB	A	 their maximums, with adjustments to prevent the allotment of any <font color=green>State</font>  from thereby exceeding its maximum. For the States which maintain
state/NN/br-h14/1897	0.47312513439504	-0.0475407695534983	state	NN	state%1:15:01::	A	A	A	ABC	AB	ABC	AB	A	 pre 1960 rate of Federal participation with respect to any <font color=green>State</font>  's base allotment, as well as the adjusted rate in
state/NN/br-h14/2014	0.0255307911163508	-0.13247049621417	state	NN	state%1:15:01::	Z	Z	A	Z	Z	ABC	AB	A	 costs is specifically set forth in the Act. The term`` <font color=green>State</font> '' means the several States, the District of Columbia, the Virgin
state/NN/br-h14/2019	0.0255307911163508	-0.13247049621417	state	NN	state%1:15:01::	A	A	A	ABC	AB	ABC	AB	A	 forth in the Act. The term`` State'' means the several <font color=green>States</font> , the District of Columbia, the Virgin Islands, Guam and Puerto
state/NN/br-h14/2039	0.024738342231631	-0.0630278332292607	state	NN	united_states%1:15:00::	A5	A	A	ABC	AB	ABC	AB	A51	 the Virgin Islands, Guam and Puerto Rico; the term`` United <font color=green>States</font> '' includes the several States and the District of Columbia and
state/NN/br-h14/2044	0.0255307911163508	-0.13247049621417	state	NN	state%1:15:01::	A	A	A	ABC	AB	ABC	AB	A	 and Puerto Rico; the term`` United States'' includes the several <font color=green>States</font>  and the District of Columbia and excludes the Virgin Islands
state/NN/br-h14/2082	0.100440787537481	-0.143725824465229	state	NN	state%1:15:01::	A	A	A	ABC	AB	ABC	AB	A	 The following steps are employed in the calculations: For each <font color=green>State</font> ( except the Virgin Islands, Guam, Puerto Rico, and, prior to
state/NN/br-h14/2143	0.349888124664799	0.167188781665485	state	NN	united_states%1:15:00::	A5	A	A	ABC	AB	ABC	AB	A51	 above.) Determine the average per capita income for the United <font color=green>States</font>  for the last three years.( The same amount used in
state/NN/br-h14/2182	0.200855543031318	0.0186325790261672	state	NN	united_states%1:15:00::	A5	A	A	ABC	AB	ABC	AB	A51	 40% to the average per capita income of the United <font color=green>States</font> .( Divide 40 by the amount used in item 2 above
state/NN/br-h14/2200	0.0800385197505457	-0.0372695956739987	state	NN	state%1:15:01::	A	A	A	ABC	AB	ABC	AB	A	 the amount used in item 2 above.) Determine for each <font color=green>State</font> ( except the Virgin Islands, Guam, Puerto Rico, and, prior to
state/NN/br-h14/2236	0.349888124521345	0.167188781604305	state	NN	state%1:15:01::	A	A	A	ABC	AB	ABC	AB	A	 which bears the same ratio to 40% as the particular <font color=green>State</font>  's average per capita income bears to the average per
state/NN/br-h14/2252	0.200855543031318	0.0186325790261672	state	NN	united_states%1:15:00::	A5	A	A	ABC	AB	ABC	AB	A51	 bears to the average per capita income of the United <font color=green>States</font> .( Multiply the result obtained in item 3 above by the
state/NN/br-h14/2269	0.184650327184758	-0.0328955050155041	state	NN	state%1:15:01::	A	A	A	ABC	AB	ABC	AB	A	 in item 3 above by the amount used for each <font color=green>State</font>  in item 1 above.) Determine the particular State 's`` Federal
state/NN/br-h14/2279	0.184650327184758	-0.0328955050155041	state	NN	state%1:15:01::	A	A	A	ABC	AB	ABC	AB	A	 for each State in item 1 above.) Determine the particular <font color=green>State</font>  's`` Federal Share''. By law this is 70% for the
state/NN/br-h14/2344	0.184650327184758	-0.0328955050155041	state	NN	state%1:15:01::	A	A	A	ABC	AB	ABC	AB	A	 the result obtained in item 4 above; except that no <font color=green>State</font>  shall have a Federal share less than 50% nor more
state/NN/br-h14/531	0.473138645673923	-0.0475412140773325	state	NN	state%1:15:01::	A1	A	A	ABC	AB	ABC	AB	A	 selected years, the authorizations, appropriations, allotment base, Federal grants to <font color=green>States</font>  and State matching funds for this part of the grant
state/NN/br-h14/643	0.473142426190553	-0.0475413333002886	state	NN	state%1:15:01::	A	A	A	ABC	AB	ABC	AB	A	 base'' allotment, and a`` ceiling'' or maximum allotment, for each <font color=green>State</font> . It stipulates, in addition, that all amounts remaining as a
state/NN/br-h14/721	0.349888123498623	0.167188781168133	state	NN	state%1:15:01::	A	A	A	ABC	AB	ABC	AB	A	 to needed services regardless of whether he resides in a <font color=green>State</font>  with a low or high per capita income or a
state/NN/br-h14/736	0.349888124698885	0.167188781680022	state	NN	state%1:15:01::	A	A	A	ABC	AB	ABC	AB	A	 high per capita income or a sparsely or thickly populated <font color=green>State</font> . The provisions are also designed to avoid disruption in State
state/NN/br-h14/789	0.0255307911163508	-0.13247049621417	state	NN	state%1:15:01::	Z	Z	A	Z	Z	ABC	AB	A	 allotments is specifically set forth in the Act. The term`` <font color=green>State</font> '' means the several States, the District of Columbia, the Virgin
state/NN/br-h14/794	0.0255307911163508	-0.13247049621417	state	NN	state%1:15:01::	A	A	A	ABC	AB	ABC	AB	A	 forth in the Act. The term`` State'' means the several <font color=green>States</font> , the District of Columbia, the Virgin Islands, Guam and Puerto
state/NN/br-h14/814	0.024738342231631	-0.0630278332292607	state	NN	united_states%1:15:00::	A5	A	A	ABC	AB	ABC	AB	A51	 the Virgin Islands, Guam and Puerto Rico; the term`` United <font color=green>States</font> '' includes the several States and the District of Columbia, and
state/NN/br-h14/819	0.0255307911163508	-0.13247049621417	state	NN	state%1:15:01::	A	A	A	ABC	AB	ABC	AB	A	 and Puerto Rico; the term`` United States'' includes the several <font color=green>States</font>  and the District of Columbia, and excludes the Virgin Islands
state/NN/br-h14/857	0.100535930486818	-0.143656460656843	state	NN	state%1:15:01::	A	A	A	ABC	AB	ABC	AB	A	 Hawaii. The following steps are employed in calculations: For each <font color=green>State</font> ( except Puerto Rico, Guam, the Virgin Islands, and, prior to
state/NN/br-h14/981	0.0800385197505457	-0.0372695956739987	state	NN	state%1:15:01::	A	A	A	ABC	AB	ABC	AB	A	 the result obtained in item 2 above.) Determine for each <font color=green>State</font> ( except the Virgin Islands, Guam and Puerto Rico, and, prior
state/NN/br-h24/1030	0.098215943311645	-0.158842562492247	state	NN	united_states%1:15:00::	A5	A	A	ABC	AB	ABC	AB	A51	 States who, on April 15, are not in the United <font color=green>States</font>  or Puerto Rico, are allowed an extension of time until
state/NN/br-h24/1120	0.098215943311645	-0.158842562492247	state	NN	united_states%1:15:00::	A5	A	A	ABC	AB	ABC	AB	A51	 Naval Personnel on duty in Alaska or outside the United <font color=green>States</font>  and Puerto Rico are also allowed this automatic extension of
state/NN/br-h24/1166	0.098215943311645	-0.158842562492247	state	NN	united_states%1:15:00::	A5	A	A	ABC	AB	ABC	AB	A51	 that you were in Alaska or were outside the United <font color=green>States</font>  or Puerto Rico on April 15 or other due date
state/NN/br-h24/1574	0.098215943311645	-0.158842562492247	state	NN	united_states%1:15:00::	A5	A	A	ABC	AB	ABC	AB	A51	 of abode for the tax year is outside the United <font color=green>States</font> ( including Alaska and Hawaii), Puerto Rico, or the Virgin Islands
state/NNP/br-a01/1035	-0.0323334177334621	0.137262148125404	state	NNP	person%1:03:00::	A3	A	C	ABC	AB	ABC	C	C1	 night in Blue Ridge brought enthusiastic responses from the audience. <font color=green>State</font>  Party Chairman James W. Dorsey added that enthusiasm was picking
state/NNP/br-a01/1240	-0.0114948961530914	-0.0395081012275519	state	NNP	group%1:03:00::	A2	A	B	ABC	AB	ABC	AB	B	 system which the party opposes in its platform. Sam Caldwell, <font color=green>State</font>  Highway Department public relations director, resigned Tuesday to work for
state/NNP/br-a01/1412	0.110452102088109	-0.00516856936950505	state	NNP	group%1:03:00::	A2	A	B	ABC	AB	ABC	AB	B	 as his first priority item. Meanwhile, it was learned the <font color=green>State</font>  Highway Department is very near being ready to issue the
state/NNP/br-a01/1928	0.184770251282026	0.171649665529276	state	NNP	group%1:03:00::	A3	A	B	ABC	AB	ABC	AB	B	 event Congress does provide this increase in federal funds'', the <font color=green>State</font>  Board of Education should be directed to`` give priority'' to
state/NNP/br-a01/352	0.168267814741654	0.104483801782626	state	NNP	group%1:03:00::	A3	A	B	ABC	AB	ABC	AB	B	 be effected''. The grand jury took a swipe at the <font color=green>State</font>  Welfare Department 's handling of federal funds granted for child
state/NNP/br-a02/1877	0.00818753270501382	-0.0235337053485354	state	NNP	group%1:03:00::	A2	A	B	ABC	AB	ABC	AB	B	 Okla.. In addition, Dr. Clark has studied at Rhode Island <font color=green>State</font>  College and Massachusetts Institute of Technology. During his college career
state/NNP/br-a02/1952	-0.0112260470390108	-0.16478945434167	state	NNP	group%1:03:00::	A2	A	B	ABC	AB	ABC	AB	B	 associate professor of education at Fort Hays , Kan. , <font color=green>State</font>  College. He has served as a border patrolman and was
state/NNP/br-a02/793	0.136472921423376	0.186610353337174	state	NNP	group%1:03:00::	A3	A	B	ABC	AB	ABC	AB	B	 finally, and sent to the Senate, a bill extending the <font color=green>State</font>  Health Department 's authority to give planning assistance to cities
