id	model.x	model.y	lemma	pos	genre	broad_genre	marisense	mbroad	mari3	mari2	sensekey	wnsense	wnbroad	wn3	wn2	text	cues	cues_with_weight	mean_weight_x100	wcratio_x100	weighted_cw	wf	new_pos	new_broad_genre
state/NN/br-h14/1123	0.139465916914111	-0.0383492002338307	state	NN	miscellaneous	non-fiction	A	A	AB	ABC	state%1:15:01::	A	A	AB	ABC	 the result obtained in item 4 above; except that no <font color=green>State</font>  shall have an allotment percentage less than 33- 1 3	2	2	261	100	5	State	NNP	technical
state/NN/br-h14/1149	0.0491975977747025	-0.00966119068744835	state	NN	miscellaneous	non-fiction	A	A	AB	ABC	state%1:15:01::	A	A	AB	ABC	 more than 75%. If the resulting difference for the particular <font color=green>State</font>  is less or more than these extremes, the State 's	4	2	182	50	2	State	NNP	technical
state/NN/br-h14/1159	0.120866833002801	-0.00662790662389434	state	NN	miscellaneous	non-fiction	A	A	AB	ABC	state%1:15:01::	A	A	AB	ABC	 particular State is less or more than these extremes, the <font color=green>State</font>  's allotment percentage must be raised or lowered to the	4	2	240	50	4	State	NNP	technical
state/NN/br-h14/1175	0.0829955412035732	-0.0158335543106294	state	NN	miscellaneous	non-fiction	A	A	AB	ABC	state%1:15:01::	A	A	AB	ABC	 be raised or lowered to the appropriate extreme. Square each <font color=green>State</font>  's allotment percentage. Determine each State 's population.( See Source	4	3	207	75	7	State	NNP	technical
state/NN/br-h14/1182	0.0832328429688704	-0.0121487317832309	state	NN	miscellaneous	non-fiction	A	A	AB	ABC	state%1:15:01::	A	A	AB	ABC	 appropriate extreme. Square each State 's allotment percentage. Determine each <font color=green>State</font>  's population.( See Source of Data, below for population data	4	3	206	75	6	State	NNP	technical
state/NN/br-h14/1209	0.167282276427337	-0.0349520063515752	state	NN	miscellaneous	non-fiction	A	A	AB	ABC	state%1:15:01::	A	A	AB	ABC	 be used in this step.) Multiply the population of each <font color=green>State</font>  by the square of its allotment percentage.( Multiply result obtained	3	3	226	100	5	State	NNP	technical
state/NN/br-h14/1251	0.0552955419534377	-0.0233146909486771	state	NN	miscellaneous	non-fiction	A	A	AB	ABC	state%1:15:01::	A	A	AB	ABC	 the products obtained in item 8 above, for all the <font color=green>States</font> .( For each State, make all computations set forth in items	2	1	201	50	5	States	NNPS	technical
state/NN/br-h14/1256	0.0392379775454744	-0.0188589346593622	state	NN	miscellaneous	non-fiction	A	A	AB	ABC	state%1:15:01::	A	A	AB	ABC	 in item 8 above, for all the States.( For each <font color=green>State</font> , make all computations set forth in items 1 to 8	1	1	167	100	4	State	NNP	technical
state/NN/br-h14/1278	0.118603195253685	-0.0585163000435527	state	NN	miscellaneous	non-fiction	A	A	AB	ABC	state%1:15:01::	A	A	AB	ABC	 8 above, and then add the results obtained for each <font color=green>State</font>  in item 8.) Determine the ratio that the amount being	1	0	222	0	5	State	NNP	technical
state/NN/br-h14/1302	0.287259688335367	0.111326811726188	state	NN	miscellaneous	non-fiction	A	A	AB	ABC	state%1:15:01::	A	A	AB	ABC	 is to the sum of the products for all the <font color=green>States</font> .( Divide the amount being allotted by the result obtained in	3	0	133	0	1	States	NNPS	technical
state/NN/br-h14/1323	0.0795975389905711	-0.0308699588194424	state	NN	miscellaneous	non-fiction	A	A	AB	ABC	state%1:15:01::	A	A	AB	ABC	 the result obtained in item 9 above.) Determine the particular <font color=green>State</font>  's unadjusted allotment for the particular fiscal year.( Multiply the	4	3	224	75	8	State	NNP	technical
state/NN/br-h14/1336	0.0940548980311183	-0.0368715808181572	state	NN	miscellaneous	non-fiction	A	A	AB	ABC	state%1:15:01::	A	A	AB	ABC	 's unadjusted allotment for the particular fiscal year.( Multiply the <font color=green>State</font>  product in item 8 above by the result obtained in	4	2	237	50	7	State	NNP	technical
state/NN/br-h14/1356	0.0930326230926535	-0.039821821565167	state	NN	miscellaneous	non-fiction	A	A	AB	ABC	state%1:15:01::	A	A	AB	ABC	 result obtained in item 10 above.) Determine if the particular <font color=green>State</font>  's unadjusted allotment( result obtained in item 11 above) is	4	2	236	50	9	State	NNP	technical
state/NN/br-h14/1389	0.163611968099828	-0.0183095287787014	state	NN	miscellaneous	non-fiction	A	A	AB	ABC	state%1:15:01::	A	A	AB	ABC	 so lower its unadjusted allotment to its maximum allotment.( Each <font color=green>State</font>  's unadjusted allotment for any fiscal year, which exceeds its	5	5	266	100	5	State	NNP	technical
state/NN/br-h14/1444	0.0930326230926535	-0.039821821565167	state	NN	miscellaneous	non-fiction	A	A	AB	ABC	state%1:15:01::	A	A	AB	ABC	 by the amount of the excess.) Determine if the particular <font color=green>State</font>  's unadjusted allotment( result obtained in item 11 above) is	4	2	234	50	6	State	NNP	technical
state/NN/br-h14/1485	0.0971746359544166	-0.0292865870213873	state	NN	miscellaneous	non-fiction	A	A	AB	ABC	state%1:15:01::	A	A	AB	ABC	 to its minimum allotment. Regardless of its unadjusted allotment, each <font color=green>State</font>  is guaranteed by law a minimum allotment each year equal	4	6	206	150	9	State	NNP	technical
state/NN/br-h14/1521	0.158157508243848	0.00241717913849799	state	NN	miscellaneous	non-fiction	A	A	AB	ABC	state%1:15:01::	A	A	AB	ABC	 percentage of 5.4865771 which brings total 1954 allotments to all <font color=green>States</font>  up to$ 23000000. The funds recouped by reductions in item	3	2	216	67	2	States	NNPS	technical
state/NN/br-h14/1552	0.221220845388608	-0.0188598046796561	state	NN	miscellaneous	non-fiction	A	A	AB	ABC	state%1:15:01::	A	A	AB	ABC	 increase the unadjusted allotments to the specified minimum in those <font color=green>States</font>  where the unadjusted allotment is less than the minimum allotment	3	2	236	67	4	States	NNPS	technical
state/NN/br-h14/1579	0.354390866976713	-0.126621334472969	state	NN	miscellaneous	non-fiction	A	A	AB	ABC	state%1:15:01::	A	A	AB	ABC	 above); and second, to increase uniformly the allotments to those <font color=green>States</font>  whose allotments are below their maximums, with adjustments to prevent	3	1	170	33	1	States	NNPS	technical
state/NN/br-h14/1595	0.095454650674397	-0.00170068540531309	state	NN	miscellaneous	non-fiction	A	A	AB	ABC	state%1:15:01::	A	A	AB	ABC	 their maximums, with adjustments to prevent the allotment of any <font color=green>State</font>  from thereby exceeding its maximum. For the States which maintain	4	4	199	100	5	State	NNP	technical
state/NN/br-h14/1604	0.0350619523060396	0.00410139623941659	state	NN	miscellaneous	non-fiction	A	A	AB	ABC	state%1:15:01::	A	A	AB	ABC	 of any State from thereby exceeding its maximum. For the <font color=green>States</font>  which maintain two separate agencies- one for the vocational rehabilitation	3	2	169	67	6	States	NNPS	technical
state/NN/br-h14/1755	0.12499754928248	-0.0206540604964207	state	NN	miscellaneous	non-fiction	A	A	AB	ABC	state%1:15:01::	A	A	AB	ABC	 matched at rates related to the fiscal capacity of the <font color=green>State</font> , with a pivot of 40% State( or 60% Federal) participation	5	1	182	20	3	State	NNP	technical
state/NN/br-h14/1786	0.0405224914516367	0.00113221328323336	state	NN	miscellaneous	non-fiction	A1	A	AB	ABC	state%1:15:01::	A	A	AB	ABC	 The percentage of Federal participation in such costs for any <font color=green>State</font>  is referred to in the law as that State 's	4	4	168	100	7	State	NNP	technical
state/NN/br-h14/1795	0.0385966854041952	0.00624437337636865	state	NN	miscellaneous	non-fiction	A	A	AB	ABC	state%1:15:01::	A	A	AB	ABC	 any State is referred to in the law as that <font color=green>State</font>  's`` Federal share''. For purposes of this explanation, this percentage	5	3	164	60	6	State	NNP	technical
state/NN/br-h14/1815	0.0943276295610168	-0.00923266316152788	state	NN	miscellaneous	non-fiction	A	A	AB	ABC	state%1:15:01::	A	A	AB	ABC	 of this explanation, this percentage is referred to as the <font color=green>States</font> `` unadjusted Federal share''. Beginning in 1960, the matching requirements for	5	3	212	60	4	States	NNPS	technical
state/NN/br-h14/1897	0.118257418382306	-0.000724201318205484	state	NN	miscellaneous	non-fiction	A	A	AB	ABC	state%1:15:01::	A	A	AB	ABC	 pre 1960 rate of Federal participation with respect to any <font color=green>State</font>  's base allotment, as well as the adjusted rate in	5	3	207	60	4	State	NNP	technical
state/NN/br-h14/1924	0.0983857157527007	0.00991885307561436	state	NN	miscellaneous	non-fiction	A	A	AB	ABC	state%1:15:01::	A	A	AB	ABC	 1960- 1962 period, is designated by the statute as that <font color=green>State</font>  's`` adjusted Federal Share''. The provisions for determining a State	4	2	201	50	4	State	NNP	technical
state/NN/br-h14/1937	0.0692529052675696	-0.0097669414580815	state	NN	miscellaneous	non-fiction	A	A	AB	ABC	state%1:15:01::	A	A	AB	ABC	 State 's`` adjusted Federal Share''. The provisions for determining a <font color=green>State</font>  's unadjusted Federal share are designed to reflect the varying	4	3	208	75	8	State	NNP	technical
state/NN/br-h14/1952	0.047169395413167	-0.0146870369997631	state	NN	miscellaneous	non-fiction	A	A	AB	ABC	state%1:15:01::	A	A	AB	ABC	 are designed to reflect the varying financial resources among the <font color=green>States</font> . The purpose of the adjusted Federal share relating to the	6	1	174	17	7	States	NNPS	technical
state/NN/br-h14/198	0.281515663498496	-0.125139081171691	state	NN	miscellaneous	non-fiction	A	A	AB	ABC	state%1:15:01::	A	A	AB	ABC	 backlog of an estimated two million disabled. To assist the <font color=green>States</font> , therefore, in rehabilitating handicapped individuals,`` so that they may prepare	2	1	239	50	1	States	NNPS	technical
state/NN/br-h14/2019	0.0666919496340225	0.012150039441156	state	NN	miscellaneous	non-fiction	A	A	AB	ABC	state%1:15:01::	A	A	AB	ABC	 forth in the Act. The term`` State'' means the several <font color=green>States</font> , the District of Columbia, the Virgin Islands, Guam and Puerto	4	1	216	25	8	States	NNPS	technical
state/NN/br-h14/2039	0.124589191233995	0.0208876656911843	state	NN	miscellaneous	non-fiction	A5	A	AB	ABC	united_states%1:15:00::	A51	A	AB	ABC	 the Virgin Islands, Guam and Puerto Rico; the term`` United <font color=green>States</font> '' includes the several States and the District of Columbia and	1	0	255	0	9	States	NNPS	technical
state/NN/br-h14/2044	0.0753585567210399	0.00811869242417744	state	NN	miscellaneous	non-fiction	A	A	AB	ABC	state%1:15:01::	A	A	AB	ABC	 and Puerto Rico; the term`` United States'' includes the several <font color=green>States</font>  and the District of Columbia and excludes the Virgin Islands	2	1	227	50	8	States	NNPS	technical
state/NN/br-h14/2082	0.368994935663705	0.0147024468504468	state	NN	miscellaneous	non-fiction	A	A	AB	ABC	state%1:15:01::	A	A	AB	ABC	 The following steps are employed in the calculations: For each <font color=green>State</font> ( except the Virgin Islands, Guam, Puerto Rico, and, prior to	3	1	308	33	5	State	NNP	technical
state/NN/br-h14/2143	0.195222241776425	-0.0247512074681771	state	NN	miscellaneous	non-fiction	A5	A	AB	ABC	united_states%1:15:00::	A51	A	AB	ABC	 above.) Determine the average per capita income for the United <font color=green>States</font>  for the last three years.( The same amount used in	1	0	218	0	5	States	NNPS	technical
state/NN/br-h14/2182	0.221597368508544	-0.0248544243405087	state	NN	miscellaneous	non-fiction	A5	A	AB	ABC	united_states%1:15:00::	A51	A	AB	ABC	 40% to the average per capita income of the United <font color=green>States</font> .( Divide 40 by the amount used in item 2 above	1	0	250	0	5	States	NNPS	technical
state/NN/br-h14/2200	0.206546226575699	-0.0217651517739323	state	NN	miscellaneous	non-fiction	A	A	AB	ABC	state%1:15:01::	A	A	AB	ABC	 the amount used in item 2 above.) Determine for each <font color=green>State</font> ( except the Virgin Islands, Guam, Puerto Rico, and, prior to	3	1	282	33	8	State	NNP	technical
state/NN/br-h14/2236	0.150473565633297	-0.0431328228041984	state	NN	miscellaneous	non-fiction	A	A	AB	ABC	state%1:15:01::	A	A	AB	ABC	 which bears the same ratio to 40% as the particular <font color=green>State</font>  's average per capita income bears to the average per	4	3	217	75	10	State	NNP	technical
state/NN/br-h14/2252	0.133042473801332	-0.0397655949937887	state	NN	miscellaneous	non-fiction	A5	A	AB	ABC	united_states%1:15:00::	A51	A	AB	ABC	 bears to the average per capita income of the United <font color=green>States</font> .( Multiply the result obtained in item 3 above by the	1	0	227	0	9	States	NNPS	technical
state/NN/br-h14/2269	0.0610494012588798	-0.0262719243806737	state	NN	miscellaneous	non-fiction	A	A	AB	ABC	state%1:15:01::	A	A	AB	ABC	 in item 3 above by the amount used for each <font color=green>State</font>  in item 1 above.) Determine the particular State 's`` Federal	2	1	235	50	7	State	NNP	technical
state/NN/br-h14/2279	0.0343829784234868	-0.00905850619331259	state	NN	miscellaneous	non-fiction	A	A	AB	ABC	state%1:15:01::	A	A	AB	ABC	 for each State in item 1 above.) Determine the particular <font color=green>State</font>  's`` Federal Share''. By law this is 70% for the	3	1	193	33	9	State	NNP	technical
state/NN/br-h14/2323	0.118371590532675	-0.018058482549485	state	NN	miscellaneous	non-fiction	A	A	AB	ABC	state%1:15:01::	A	A	AB	ABC	 in effect prior to fiscal year 1962.) In all other <font color=green>States</font>  it is the difference obtained by subtracting from 100 the	1	0	177	0	3	States	NNPS	technical
state/NN/br-h14/2344	0.079289740833145	-0.0188793115793348	state	NN	miscellaneous	non-fiction	A	A	AB	ABC	state%1:15:01::	A	A	AB	ABC	 the result obtained in item 4 above; except that no <font color=green>State</font>  shall have a Federal share less than 50% nor more	2	2	228	100	5	State	NNP	technical
state/NN/br-h14/2367	0.0491975977747025	-0.00966119068744835	state	NN	miscellaneous	non-fiction	A	A	AB	ABC	state%1:15:01::	A	A	AB	ABC	 more than 70%. If the resulting difference for the particular <font color=green>State</font>  is less or more than these extremes, the State 's	3	1	182	33	2	State	NNP	technical
state/NN/br-h14/2377	0.0663954799363602	0.0083902019060569	state	NN	miscellaneous	non-fiction	A	A	AB	ABC	state%1:15:01::	A	A	AB	ABC	 particular State is less or more than these extremes, the <font color=green>State</font>  's Federal share must be raised or lowered to the	4	2	198	50	4	State	NNP	technical
state/NN/br-h14/30	0.0871787207801022	0.0407031298301655	state	NN	miscellaneous	non-fiction	A	A	AB	ABC	state%1:15:01::	A	A	AB	ABC	 of the vocational rehabilitation program has been to assist the <font color=green>States</font> , by means of grants-in-aid, to return disabled men and women	2	1	178	50	4	States	NNPS	technical
state/NN/br-h14/324	0.0577047537799682	0.00333276977684498	state	NN	miscellaneous	non-fiction	A1	A	AB	ABC	state%1:15:01::	A	A	AB	ABC	 existed until 1943, the Federal Government made grants to the <font color=green>States</font>  on the basis of population, matching State expenditures on a	5	4	172	80	6	States	NNPS	technical
state/NN/br-h14/531	0.111640798640916	0.015346430021953	state	NN	miscellaneous	non-fiction	A1	A	AB	ABC	state%1:15:01::	A	A	AB	ABC	 selected years, the authorizations, appropriations, allotment base, Federal grants to <font color=green>States</font>  and State matching funds for this part of the grant	4	4	245	100	6	States	NNPS	technical
state/NN/br-h14/549	0.0873222748422808	0.0197646237906396	state	NN	miscellaneous	non-fiction	A1	A	AB	ABC	state%1:15:01::	A	A	AB	ABC	 part of the grant program. In order to assist the <font color=green>States</font>  in maintaining basic vocational rehabilitation services, Section 2 of the	3	2	195	67	6	States	NNPS	technical
state/NN/br-h14/567	0.0901679802584516	0.0465482467272497	state	NN	miscellaneous	non-fiction	A	A	AB	ABC	state%1:15:01::	A	A	AB	ABC	 Section 2 of the amended Act provides that allotments to <font color=green>States</font>  for support of such services be based on( 1) need	3	1	140	33	2	States	NNPS	technical
state/NN/br-h14/585	0.108877808432736	-0.0357377667864314	state	NN	miscellaneous	non-fiction	A	A	AB	ABC	state%1:15:01::	A	A	AB	ABC	 services be based on( 1) need, as measured by a <font color=green>State</font>  's population, and( 2) fiscal capacity, as measured by its	4	2	155	50	2	State	NNP	technical
state/NN/br-h14/643	0.217523656387988	-0.0371986586238635	state	NN	miscellaneous	non-fiction	A	A	AB	ABC	state%1:15:01::	A	A	AB	ABC	 base'' allotment, and a`` ceiling'' or maximum allotment, for each <font color=green>State</font> . It stipulates, in addition, that all amounts remaining as a	3	3	227	100	4	State	NNP	technical
state/NN/br-h14/679	0.276658736161129	0.0843830085277026	state	NN	miscellaneous	non-fiction	A	A	AB	ABC	state%1:15:01::	A	A	AB	ABC	 not used for insuring the`` floor'', be redistributed to those <font color=green>States</font>  still below their maximums. These provisions are designed to reflect	3	1	249	33	1	States	NNPS	technical
state/NN/br-h14/699	0.0746186927681442	-0.127152454684096	state	NN	miscellaneous	non-fiction	A	A	AB	ABC	state%1:15:01::	A	A	AB	ABC	 to reflect the differences in wealth and population among the <font color=green>States</font> , with the objective that a vocationally handicapped person have access	3	2	147	67	3	States	NNPS	technical
state/NN/br-h14/721	0.259680268653424	-0.0167502822940818	state	NN	miscellaneous	non-fiction	A	A	AB	ABC	state%1:15:01::	A	A	AB	ABC	 to needed services regardless of whether he resides in a <font color=green>State</font>  with a low or high per capita income or a	4	1	225	25	4	State	NNP	technical
state/NN/br-h14/736	0.226745872812271	0.000244762096137552	state	NN	miscellaneous	non-fiction	A	A	AB	ABC	state%1:15:01::	A	A	AB	ABC	 high per capita income or a sparsely or thickly populated <font color=green>State</font> . The provisions are also designed to avoid disruption in State	3	1	254	33	4	State	NNP	technical
state/NN/br-h14/794	0.0666919496340225	0.012150039441156	state	NN	miscellaneous	non-fiction	A	A	AB	ABC	state%1:15:01::	A	A	AB	ABC	 forth in the Act. The term`` State'' means the several <font color=green>States</font> , the District of Columbia, the Virgin Islands, Guam and Puerto	3	0	216	0	8	States	NNPS	technical
state/NN/br-h14/814	0.124589191233995	0.0208876656911843	state	NN	miscellaneous	non-fiction	A5	A	AB	ABC	united_states%1:15:00::	A51	A	AB	ABC	 the Virgin Islands, Guam and Puerto Rico; the term`` United <font color=green>States</font> '' includes the several States and the District of Columbia, and	1	0	255	0	9	States	NNPS	technical
state/NN/br-h14/819	0.0610779583141573	0.00752804547758578	state	NN	miscellaneous	non-fiction	A	A	AB	ABC	state%1:15:01::	A	A	AB	ABC	 and Puerto Rico; the term`` United States'' includes the several <font color=green>States</font>  and the District of Columbia, and excludes the Virgin Islands	3	1	222	33	7	States	NNPS	technical
state/NN/br-h14/857	0.368994935663705	0.0147024468504468	state	NN	miscellaneous	non-fiction	A	A	AB	ABC	state%1:15:01::	A	A	AB	ABC	 Hawaii. The following steps are employed in calculations: For each <font color=green>State</font> ( except Puerto Rico, Guam, the Virgin Islands, and, prior to	4	1	308	25	5	State	NNP	technical
state/NN/br-h14/981	0.173932854967875	-0.0255578542598198	state	NN	miscellaneous	non-fiction	A	A	AB	ABC	state%1:15:01::	A	A	AB	ABC	 the result obtained in item 2 above.) Determine for each <font color=green>State</font> ( except the Virgin Islands, Guam and Puerto Rico, and, prior	3	1	269	33	9	State	NNP	technical
state/NN/br-h17/670	-0.165997382515504	0.242225759010354	state	NN	miscellaneous	non-fiction	A5	A	AB	ABC	united_states%1:14:00::	A52	A	AB	ABC	 petitioner. Daniel M. Friedman argued the cause for the United <font color=green>States</font> . On the brief were Solicitor General Rankin, Assistant Attorney General	1	0	163	0	3	States	NNPS	technical
state/NN/br-h18/132	-0.00773257278024527	0.0639748453395384	state	NN	miscellaneous	non-fiction	C	C	C	ABC	department_of_state%1:14:00::	C1	C	C	ABC	 our situation. It is the concern of the Department of <font color=green>State</font>  that the American people are safe and secure- defense is	1	1	146	100	4	State	NNP	technical
state/NN/br-h18/1462	0.309850866778216	-0.282169891176638	state	NN	miscellaneous	non-fiction	A5	A	AB	ABC	united_states%1:14:00::	A52	A	AB	ABC	 of policy, well established precedents, the commitments of the United <font color=green>States</font>  under international charters and treaties, basic statutes, and well understood	1	0	216	0	1	States	NNPS	technical
state/NN/br-h18/163	-0.00432515217840135	0.0646116368962028	state	NN	miscellaneous	non-fiction	C	C	C	ABC	department_of_state%1:14:00::	C1	C	C	ABC	 Defense. It is also the concern of the Department of <font color=green>State</font>  that our trading relationships with the rest of the world	3	2	142	67	3	State	NNP	technical
state/NN/br-h18/2007	0.000293652989995898	0.0920575466167332	state	NN	miscellaneous	non-fiction	C	C	C	ABC	department_of_state%1:14:00::	C1	C	C	ABC	 this point by saying,`` You fellows in the Department of <font color=green>State</font>  do n't know much about domestic politics''. This is an	1	1	155	100	3	State	NNP	technical
state/NN/br-h18/22	-0.150189328011423	0.382622457774999	state	NN	miscellaneous	non-fiction	A5	A	AB	ABC	united_states%1:14:00::	A52	A	AB	ABC	 to make a few suggestions: What we in the United <font color=green>States</font>  do or do not do will make a very large	1	0	106	0	1	States	NNPS	technical
state/NN/br-h18/705	0.116982004575585	0.098070660020696	state	NN	miscellaneous	non-fiction	A5	A	AB	ABC	united_states%1:15:00::	A51	A	AB	ABC	 our Capital, can be easily be directed against the United <font color=green>States</font>  and all that it stands for. Dozens of seemingly small	1	0	140	0	3	States	NNPS	technical
state/NN/br-h18/791	-0.0118769238315824	0.0279860693053471	state	NN	miscellaneous	non-fiction	C	C	C	ABC	department_of_state%1:14:00::	C1	C	C	ABC	 who can do something about them. If the Department of <font color=green>State</font>  is to take primary responsibility for foreign policy in Washington	1	1	165	100	4	State	NNP	technical
state/NN/br-h21/1002	0.0826251153619233	0.164453759278671	state	NN	miscellaneous	non-fiction	A	A	AB	ABC	state%1:15:01::	A	A	AB	ABC	 Federal Aviation Agency. The growing communications needs of this new <font color=green>State</font>  can best be met, as they have in other States	5	1	174	20	2	State	NNP	technical
state/NN/br-h21/1013	-0.0201968997669846	-0.111000166933815	state	NN	miscellaneous	non-fiction	A4	A	AB	ABC	state%1:15:01::	A	A	AB	ABC	 State can best be met, as they have in other <font color=green>States</font> , through the operation and development of such facilities by private	4	1	130	25	2	States	NNPS	technical
state/NN/br-h24/1018	0.122736918692054	0.134907090295284	state	NN	miscellaneous	non-fiction	A5	A	AB	ABC	united_states%1:15:00::	A51	A	AB	ABC	 also Interest on Unpaid Taxes, below. Citizens of the United <font color=green>States</font>  who, on April 15, are not in the United States	1	0	198	0	3	States	NNPS	technical
state/NN/br-h24/1030	0.300409987842761	0.0517485672881228	state	NN	miscellaneous	non-fiction	A5	A	AB	ABC	united_states%1:15:00::	A51	A	AB	ABC	 States who, on April 15, are not in the United <font color=green>States</font>  or Puerto Rico, are allowed an extension of time until	1	0	265	0	4	States	NNPS	technical
state/NN/br-h24/1120	0.318594345032688	0.025258898598272	state	NN	miscellaneous	non-fiction	A5	A	AB	ABC	united_states%1:15:00::	A51	A	AB	ABC	 Naval Personnel on duty in Alaska or outside the United <font color=green>States</font>  and Puerto Rico are also allowed this automatic extension of	1	0	253	0	4	States	NNPS	technical
state/NN/br-h24/1166	0.30062784585572	0.0455355742894699	state	NN	miscellaneous	non-fiction	A5	A	AB	ABC	united_states%1:15:00::	A51	A	AB	ABC	 that you were in Alaska or were outside the United <font color=green>States</font>  or Puerto Rico on April 15 or other due date	1	0	291	0	4	States	NNPS	technical
state/NN/br-h24/1574	0.229846909113644	0.0358558420643726	state	NN	miscellaneous	non-fiction	A5	A	AB	ABC	united_states%1:15:00::	A51	A	AB	ABC	 of abode for the tax year is outside the United <font color=green>States</font> ( including Alaska and Hawaii), Puerto Rico, or the Virgin Islands	1	0	243	0	5	States	NNPS	technical
state/NN/br-h24/1608	0.137144165997154	0.143289310441659	state	NN	miscellaneous	non-fiction	A5	A	AB	ABC	united_states%1:15:00::	A51	A	AB	ABC	 of business in any internal revenue district in the United <font color=green>States</font> , you should file your return with the Office of International	1	0	161	0	2	States	NNPS	technical
state/NN/br-h24/471	0.0595831439078915	0.0865683541622714	state	NN	miscellaneous	non-fiction	A5	A	AB	ABC	united_states%1:15:00::	A51	A	AB	ABC	 in Canada or Mexico who earn wages in the United <font color=green>States</font>  may be subject to withholding of tax on their wages	3	2	192	67	4	States	NNPS	technical
state/NN/br-h24/493	0.0445763984017874	0.0353016547955382	state	NN	miscellaneous	non-fiction	A5	A	AB	ABC	united_states%1:15:00::	A51	A	AB	ABC	 the same as if they were citizens of the United <font color=green>States</font> . Their United States tax returns are due April 16, 1962	1	0	181	0	5	States	NNPS	technical
state/NN/br-h24/497	0.0445763984017874	0.0353016547955382	state	NN	miscellaneous	non-fiction	A5	A	AB	ABC	united_states%1:15:00::	A51	A	AB	ABC	 if they were citizens of the United States. Their United <font color=green>States</font>  tax returns are due April 16, 1962. However, if their	1	0	181	0	5	States	NNPS	technical
