id	model.x	model.y	lemma	pos	genre	marisense	mbroad	mari3	mari2	sensekey	wnsense	wnbroad	wn3	wn2	text
church/NN/br-e13/272	0.13801605801264	0.340018178497421	church	NN	skill_and_hobbies	B	B	AB	AB	Z	Z	Z	Z	Z	 shifted religions- although the Patriarch, or Pope, of the Orthodox <font color=green>Church</font>  continued to live there, and still does- and became the
church/NN/br-f15/713	0.0447162517273035	0.203756583914034	church	NN	popular_lore	B	B	AB	AB	roman_catholic_church%1:14:00::	B1	B	AB	AB	 permit birth control only for medical reasons. The Roman Catholic <font color=green>Church</font> , however, sanctions a much more liberal policy on family planning
church/NN/br-f15/754	0.0505137698217771	0.116246975026842	church	NN	popular_lore	B	B	AB	AB	roman_catholic_church%1:14:00::	B1	B	AB	AB	 disagree over the methods to be used. The Roman Catholic <font color=green>Church</font>  sanctions only abstention or the rhythm method, also known as
church/NN/br-f15/776	0.391455087007856	-0.246346810705203	church	NN	popular_lore	A	A	AB	AB	roman_catholic_church%1:14:00::	B1	B	AB	AB	 as the use of the infertile or safe period. The <font color=green>Church</font>  considers this to be the method provided by nature and
church/NN/br-f15/862	-0.105140245407449	0.379092289687649	church	NN	popular_lore	A	A	AB	AB	roman_catholic_church%1:14:00::	B1	B	AB	AB	 there seems little chance of agreement. The grounds for the <font color=green>Church</font>  's position are Scriptural( Old Testament), the teachings of the
church/NN/br-f15/882	0.124972832267661	0.280619887467241	church	NN	popular_lore	A	A	AB	AB	roman_catholic_church%1:14:00::	B1	B	AB	AB	 the teachings of the fathers and doctors of the early <font color=green>Church</font> , the unbroken tradition of nineteen centuries, the decisions of the
church/NN/br-f44/1076	0.136766176314256	0.0414219556860417	church	NN	popular_lore	C	C	C	CDE	church%1:14:00::	B	B	AB	AB	 and economic level of the congregation; the mission of the <font color=green>church</font>  is actually a process of informal co-optation; the lay ministry
church/NN/br-f44/1285	0.158598075007068	0.0360082814138046	church	NN	popular_lore	C	C	C	CDE	church%1:14:00::	B	B	AB	AB	 co-optation is the principal form of mission in the contemporary <font color=green>church</font> ; economic integration and co-optation are the two methods by which
church/NN/br-f44/1618	0.218781998802119	0.072923151513885	church	NN	popular_lore	C	C	C	CDE	church%1:14:00::	B	B	AB	AB	 in the metropolis. It now becomes evident that the denominational <font color=green>church</font>  is intimately involved with the economy of middle-class culture, for
church/NN/br-f44/2150	0.139228142321972	-0.0739358200030112	church	NN	popular_lore	C	C	C	CDE	church%1:14:00::	B	B	AB	AB	 will occupy our attention under the rubric of the organization <font color=green>church</font> . An understanding of the new role of residential association in
church/NN/br-f44/368	-0.00348492118937502	-0.0506931147334475	church	NN	popular_lore	C	C	C	CDE	church%1:14:00::	B	B	AB	AB	 they can lose higher- and lower status members from the <font color=green>church</font>  without collapsing, but they need adequate recruits for the core
church/NN/br-f44/647	-0.00611759999582099	0.0491050937845568	church	NN	popular_lore	A	A	AB	AB	church%1:14:00::	B	B	AB	AB	 denominations. There is much talk in theological circles about the`` <font color=green>Church</font>  as Mission'' and the`` Church 's Mission''; theologians have been
church/NN/br-f44/654	-0.0255372058423143	0.055150779224144	church	NN	popular_lore	A	A	AB	AB	church%1:14:00::	B	B	AB	AB	 in theological circles about the`` Church as Mission'' and the`` <font color=green>Church</font>  's Mission''; theologians have been stressing the fact that the
church/NN/br-f44/667	-0.473634955997292	-0.0384101425608082	church	NN	popular_lore	A	A	AB	AB	church%1:14:00::	B	B	AB	AB	 's Mission''; theologians have been stressing the fact that the <font color=green>Church</font>  does not exist for its own sake but as a
church/NN/br-f44/924	0.0507819453232453	-0.000589781268734393	church	NN	popular_lore	C	C	C	CDE	church%1:14:00::	B	B	AB	AB	 with friendly members the`` contacts with an organization of the <font color=green>church</font> ''( 11.2 per cent of the cases), then a substantial two
church/NN/br-f44/986	0.0259776526292562	-0.0642248617338128	church	NN	popular_lore	C	C	C	CDE	church%1:14:00::	B	B	AB	AB	 people; the new people respond in kind by joining the <font color=green>church</font> . Missionary outreach by friendly contact looks somewhat different when one
church/NN/br-g12/1271	-0.0842858749786148	0.260901285548172	church	NN	belles_lettres	D	D	DE	CDE	church%1:06:00::	D	D	DE	CDE	 and gestured toward the Madeleine. The classical lines of the <font color=green>church</font>  which Napoleon thought of as a Temple of Glory, dominated
church/NN/br-g12/1807	-0.211865854090594	0.308065624147257	church	NN	belles_lettres	D	D	DE	CDE	church%1:06:00::	D	D	DE	CDE	 not attractive, but it is deeper. When you pass a <font color=green>church</font>  on an Irish bus, all the hands flurry in the
church/NN/br-g12/544	-0.306099302158586	-0.134567338305866	church	NN	belles_lettres	D	D	DE	CDE	church%1:06:00::	D	D	DE	CDE	 the Madeleine and across to a sidewalk cafe opposite that <font color=green>church</font> . The conversation that ensued may have been engrossing but it
church/NN/br-h17/1199	0.274689925790058	0.34812204407013	church	NN	miscellaneous	C	C	C	CDE	church%1:14:00::	B	B	AB	AB	 because of his willingness to kill in defense of his <font color=green>church</font>  and home. Upon administrative approval of the reclassification, he was
church/NN/br-h17/1434	0.204966290563145	-0.0529627409734095	church	NN	miscellaneous	C	C	C	CDE	church%1:14:00::	B	B	AB	AB	 preaching and from 20 to 25 hours per month to <font color=green>church</font>  activities. His claim was therefore`` so highly exaggerated'', the Department
church/NN/br-j23/1105	0.052482533581117	-0.0289556253283697	church	NN	learned	C	C	C	CDE	church_member%1:18:00::	C	C	C	CDE	 which is reflective of our common religion. Even the non <font color=green>church</font>  members- the freewheelers, marginal religionists and so on- have the
church/NN/br-j57/2237	0.0905676521904056	0.311603563597557	church	NN	learned	A	A	AB	AB	church_father%1:18:00::	A	A	AB	AB	 which reached Christianity by the way of Stoicism through the <font color=green>Church</font>  Fathers of Late Antiquity.
church/NN/br-j57/958	0.193345815186279	0.256935550739759	church	NN	learned	A	A	AB	AB	church_father%1:18:00::	A	A	AB	AB	 all possessions. This conception was taken up by the early <font color=green>Church</font>  Fathers and by canon lawyers and theologians in the Middle
church/NN/br-j58/1496	0.109172978809062	-0.247579752977765	church	NN	learned	D	D	DE	CDE	church_bell%1:06:00::	D	D	DE	CDE	 In many Northern towns and cities meetings were held and <font color=green>church</font>  bells were tolled. Such was not the case in Rhode
church/NN/br-k04/1076	-0.0404378634939804	-0.127002801457326	church	NN	fiction_gral	D	D	DE	CDE	church%1:06:00::	D	D	DE	CDE	 There were two liquor saloons not very far from the <font color=green>church</font> , one white, that is conducted for white people with a
church/NN/br-k04/1117	-0.246008384003089	-0.199895046511958	church	NN	fiction_gral	D	D	DE	CDE	church%1:06:00::	D	D	DE	CDE	 of gambling in both. On the other side of the <font color=green>church</font>  was a quiet, well-kept house with shutters and recently painted
church/NN/br-k04/1145	-0.233666769936129	-0.412336671398885	church	NN	fiction_gral	C	C	C	CDE	church%1:14:00::	B	B	AB	AB	 it. It was called Kent House. The deacon of the <font color=green>church</font> , Carlson, was its janitor. One of the leading members of
church/NN/br-k04/1419	-0.0165250128345889	-0.235655910062894	church	NN	fiction_gral	C	C	C	CDE	church%1:06:00::	D	D	DE	CDE	 stress, and that was that the contribution to the general <font color=green>church</font>  expenses, the dollar money, had been seriously falling behind in
church/NN/br-k04/1433	-0.0165250128345889	-0.235655910062894	church	NN	fiction_gral	C	C	C	CDE	church%1:06:00::	D	D	DE	CDE	 the dollar money, had been seriously falling behind in this <font color=green>church</font> , and that must be looked after immediately. In fact, he
church/NN/br-k04/1485	-0.0022279419026579	0.0258536434194239	church	NN	fiction_gral	C	C	C	CDE	church%1:06:00::	D	D	DE	CDE	 that clear as this was, they must have a better <font color=green>church</font> , a more business-like conduct of the church organization, and an
church/NN/br-k04/1493	0.0155632849609583	0.027687695907	church	NN	fiction_gral	C	C	C	CDE	church%1:14:00::	B	B	AB	AB	 have a better church, a more business-like conduct of the <font color=green>church</font>  organization, and an effort to get this religious center out
church/NN/br-k04/1514	0.124965395918299	0.0149843218969019	church	NN	fiction_gral	C	C	C	CDE	church%1:14:00::	B	B	AB	AB	 out of its rut of wild worship into a modern <font color=green>church</font>  organization. He emphasized to the Presiding Elder the plan of
church/NN/br-k04/1634	-0.130706568638634	-0.184710114460508	church	NN	fiction_gral	D	D	DE	CDE	church%1:06:00::	D	D	DE	CDE	 to colored folk. When it was proposed to rebuild the <font color=green>church</font> , Wilson found that the terms for a new mortgage were
church/NN/br-k04/1685	0.204982273142899	-0.197002727005193	church	NN	fiction_gral	D	D	DE	CDE	church%1:06:00::	D	D	DE	CDE	 made to his Deacon Board, he met unanimous opposition. The <font color=green>church</font>  certainly would not be removed. The very proposition was sacrilege
church/NN/br-k04/1807	-0.184834155936121	-0.194858819961802	church	NN	fiction_gral	D	D	DE	CDE	church%1:06:00::	D	D	DE	CDE	 of money that has been invested by whites around that <font color=green>church</font> ? Tenements, stores, saloons, some gambling, I hope not too much
church/NN/br-k04/1874	-0.129195136075381	-0.295947688202429	church	NN	fiction_gral	D	D	DE	CDE	church%1:06:00::	D	D	DE	CDE	 were you I would just plan to repair the old <font color=green>church</font>  so it would last for five or ten years. By
church/NN/br-k04/2301	0.105874919837446	0.0817517716679399	church	NN	fiction_gral	B	B	AB	AB	methodist_church%1:14:00::	B2	B	AB	AB	 mean practically the end of his career in the Methodist <font color=green>church</font> , if not in all churches.
church/NN/br-k04/356	-0.128636819672041	-0.144831111005207	church	NN	fiction_gral	C	C	C	CDE	church%1:06:00::	D	D	DE	CDE	 with the whites, especially the rich who partly supported the <font color=green>church</font> . The Deacon Board, headed by a black man named Carlson
church/NN/br-k04/397	0.0384061011027615	0.0513962491285355	church	NN	fiction_gral	C	C	C	CDE	church%1:06:00::	D	D	DE	CDE	 support of the Amen corner. The characteristic thing about this <font color=green>church</font>  was its Amen corner and the weekly religious orgy. A
church/NN/br-k04/828	-0.0139314037583766	-0.0390973074672224	church	NN	fiction_gral	C	C	C	CDE	church%1:14:00::	B	B	AB	AB	 the home of one of the old members of the <font color=green>church</font> , a woman named Catt who, as Wilson afterward found, was
church/NN/br-k04/877	-0.0610925882181492	-0.0796057951808775	church	NN	fiction_gral	C	C	C	CDE	church%1:14:00::	B	B	AB	AB	 never married, conducting a spotless home and devoted to her <font color=green>church</font> , but a perpetual dissenter and born critic. She soared over
church/NN/br-k04/923	-0.130759507624789	-0.119088166433863	church	NN	fiction_gral	D	D	DE	CDE	church%1:06:00::	D	D	DE	CDE	 which she was chief repository. Then Wilson looked over the <font color=green>church</font>  and studied its condition. The salary of the pastor had
church/NN/br-k04/975	-0.257916964294999	-0.246611996857672	church	NN	fiction_gral	D	D	DE	CDE	church%1:06:00::	D	D	DE	CDE	 he mentioned this to the Deacons they said nothing. The <font color=green>church</font>  itself must be repaired. It was dirty and neglected. It
church/NN/br-k06/1056	-0.311579412072993	0.252713940139361	church	NN	fiction_gral	D	D	DE	CDE	church%1:06:00::	D	D	DE	CDE	 northward to Brooklyn, below Point Peter, he could see the <font color=green>church</font>  spire wherever he looked back. Sometimes they went south and
church/NN/br-k06/1473	-0.110629324830134	-0.40369500125463	church	NN	fiction_gral	D	D	DE	CDE	church%1:06:00::	D	D	DE	CDE	 hands tucked under his coattails, and staring into the dark <font color=green>church</font> . The figure was wreathed in an extraordinary luminescence. The boy
church/NN/br-k06/528	-0.315441015936237	-0.174614863379674	church	NN	fiction_gral	D	D	DE	CDE	church%1:06:00::	D	D	DE	CDE	 his head out. There was the slate roof of the <font color=green>church</font> ; ivy climbed the red brick walls like a green scaled
church/NN/br-k06/571	-0.329850971490518	-0.0359673834552761	church	NN	fiction_gral	D	D	DE	CDE	church%1:06:00::	D	D	DE	CDE	 cupboards.`` There 's a tower and a steeple on the <font color=green>church</font>  a million feet high. And the loudest clock in the
church/NN/br-k06/659	0.00709937852750777	-0.322682718013057	church	NN	fiction_gral	D	D	DE	CDE	church%1:06:00::	D	D	DE	CDE	 Street to Orange Square. The steeple leaned backward, while the <font color=green>church</font>  advanced like a headless creature in a long, shapeless coat
church/NN/br-k06/852	-0.250340664516643	0.075728573955756	church	NN	fiction_gral	D	D	DE	CDE	church%1:06:00::	D	D	DE	CDE	 Church with its high steeple and clock. There was no <font color=green>church</font>  like Drew Church, no preacher like Papa, who was intimate
church/NN/br-k10/1423	-0.130152852383856	-0.433741282200381	church	NN	fiction_gral	A	A	AB	AB	church%1:14:00::	B	B	AB	AB	 economics, and social issues that are no concern of the <font color=green>Church</font> ''? And John 's reply was always the same:`` Anything that
church/NN/br-k10/1445	-0.281716349409644	0.282835602763944	church	NN	fiction_gral	A	A	AB	AB	church%1:14:00::	B	B	AB	AB	 same:`` Anything that affects souls is the concern of the <font color=green>Church</font> ! We will have righteousness''! Tears burned behind his eyes as
church/NN/br-k10/1802	-0.107235933297573	0.280338786967673	church	NN	fiction_gral	B	B	AB	AB	church_of_rome%1:14:00::	B1	B	AB	AB	 Geneva, saying that he had been a bishop of the <font color=green>Church</font>  of Rome and had been persecuted in Paris for his
church/NN/br-k10/205	0.45404974086407	-0.00756159038274762	church	NN	fiction_gral	A	A	AB	AB	church%1:14:00::	B	B	AB	AB	 that the couple would have to be punished if the <font color=green>Church</font>  was to be respected.`` I have told you before, and
church/NN/br-k10/257	-0.0623754668517007	0.359151336598962	church	NN	fiction_gral	A	A	AB	AB	church%1:14:00::	B	B	AB	AB	 is the answer the ungodly will always make when the <font color=green>Church</font>  points its fingers at their sins. I say to you
church/NN/br-k10/271	-0.16657918096274	0.203733224351414	church	NN	fiction_gral	A	A	AB	AB	church%1:14:00::	B	B	AB	AB	 fingers at their sins. I say to you that the <font color=green>Church</font>  will ever decry evil''! John 's reply was like a
church/NN/br-k10/588	-0.154658830315566	0.181157756630628	church	NN	fiction_gral	A	A	AB	AB	church%1:14:00::	B	B	AB	AB	 to let them give him the last rites of the <font color=green>Church</font> , but he had died still proclaiming salvation by faith. Burial
church/NN/br-k10/967	-0.347778414097155	-0.0950344453109851	church	NN	fiction_gral	D	D	DE	CDE	church%1:06:00::	D	D	DE	CDE	 all the time. Quickening his steps, John entered the vast <font color=green>church</font>  and climbed the tower steps to the bells. Underneath the
church/NN/br-k13/533	-0.252094358549984	-0.0712078805768574	church	NN	fiction_gral	D	D	DE	CDE	church%1:06:00::	D	D	DE	CDE	 Harold indicated the photograph on the wall and asked what <font color=green>church</font>  the stone sculpture was in. Eugene told him and he
church/NN/br-k14/826	-0.257224910185786	-0.387768024036181	church	NN	fiction_gral	D	D	DE	CDE	church%1:06:00::	D	D	DE	CDE	 Jewish section was in Trastevere, near the Tiber at the <font color=green>church</font>  of San Francesco a Ripa. The colony had been small
church/NN/br-k15/188	-0.194122224562373	-0.0216594664358513	church	NN	fiction_gral	D	D	DE	CDE	church%1:06:00::	D	D	DE	CDE	 They held the funeral the next morning from the crossroads <font color=green>church</font>  and buried the little box in the quiet family plot
church/NN/br-k16/1431	-0.460487637363734	-0.177109624960079	church	NN	fiction_gral	D	D	DE	CDE	church%1:06:00::	D	D	DE	CDE	 thickets. Along Wappinger Creek in Dutchess County, past the white <font color=green>church</font>  at Fishkill, past Verplanck 's Point on the east bank
church/NN/br-k16/2285	-0.301149018458527	-0.0933726544074133	church	NN	fiction_gral	E	E	DE	CDE	church_service%1:04:00::	E	E	DE	CDE	 him out of some dim corner of memory from a <font color=green>church</font>  service when he was a boy- yes, in a white
church/NN/br-k19/213	0.182879309878333	0.134941905785578	church	NN	fiction_gral	A	A	AB	AB	church%1:14:00::	B	B	AB	AB	 of this desire was due to his devotion to the <font color=green>church</font>  and how much was his own ego, demanding to be
church/NN/br-k25/81	0.404890479762043	0.0441035386199026	church	NN	fiction_gral	D	D	DE	CDE	church%1:06:00::	D	D	DE	CDE	 whether a private residence in his Pennsylvania county or a <font color=green>church</font>  in Brazil, without it being obvious that he had done
church/NN/br-l08/1824	-0.305344605226255	0.141718706608755	church	NN	fiction_mystery	E	E	DE	CDE	church%1:04:00::	E	E	DE	CDE	 did n't feel good on Sunday, could n't go to <font color=green>church</font> - there 'd be a little argument, but she could be
church/NN/br-l08/2109	0.411108184653742	0.0910214633303366	church	NN	fiction_mystery	C	C	C	CDE	church%1:06:00::	D	D	DE	CDE	 with foreign sounding names, the ones went to the same <font color=green>church</font>  and- Different place, different job, different people, she 'd be
church/NN/br-m01/2360	0.150561665549259	-0.429244872914263	church	NN	fiction_science	E	E	DE	CDE	church%1:04:00::	E	E	DE	CDE	 continued most of the week following that ill-starred trip to <font color=green>church</font> , during which period Mike stayed in his room and usually
church/NN/br-m01/265	0.277986501229032	0.197769793544123	church	NN	fiction_science	Z	Z	Z	Z	church%1:14:00::	B	B	AB	AB	 was no Martian concept to match it- unless one took`` <font color=green>church</font> '' and`` worship'' and`` God'' and`` congregation'' and many other words
church/NN/br-p01/1161	-0.370650948760831	-0.0131493148377614	church	NN	fiction_romance	D	D	DE	CDE	church%1:06:00::	D	D	DE	CDE	 hill, rising with the hill to the top where the <font color=green>church</font>  was and beyond that to the cemetery. Only paved alleyways
church/NN/br-p01/21	-0.210192476312009	-0.0132553371487351	church	NN	fiction_romance	D	D	DE	CDE	church_tower%1:06:00::	D	D	DE	CDE	 them he could have been the broken bell in the <font color=green>church</font>  tower which rang before and after Mass, and at noon
church/NN/br-p01/222	-0.0862316826823469	0.00342701389741101	church	NN	fiction_romance	E	E	DE	CDE	church%1:04:00::	E	E	DE	CDE	 from its elders. Youth obeyed when commanded. It went to <font color=green>church</font>  on Sunday and one Saturday a month went to confession
church/NN/br-p01/829	-0.14133159717958	-0.224829348577617	church	NN	fiction_romance	D	D	DE	CDE	church%1:06:00::	D	D	DE	CDE	 to Drexel Street and his back in opposition to the <font color=green>church</font>  behind him. For all he saw or cared to see
church/NN/br-p04/2406	-0.462871306974627	0.0222836774765115	church	NN	fiction_romance	D	D	DE	CDE	Z	Z	Z	Z	Z	 sky. She felt mindless, walking, and almost easy until the <font color=green>church</font>  spire told her she was near the cemetery, and she
church/NN/br-p04/2429	-0.333069779163694	-0.15167649071141	church	NN	fiction_romance	D	D	DE	CDE	Z	Z	Z	Z	Z	 caught herself wondering what she would say to Doaty. Both <font color=green>church</font>  and graveyard were smaller than she remembered them( how many
church/NN/br-p04/983	-0.462871306974629	0.0222836774765115	church	NN	fiction_romance	D	D	DE	CDE	Z	Z	Z	Z	Z	 beyond the door. To a Blackwell, there was only one <font color=green>church</font> . The cemetery slumbered just behind it, and the way lay
church/NN/br-p06/425	-0.187058539058007	0.06883681682035	church	NN	fiction_romance	C	C	C	CDE	Z	Z	Z	Z	Z	 yellow moons.`` How do you do''? she said, semi-professionally.`` Our <font color=green>church</font>  is sponsoring a group of very courageous women up in
church/NN/br-p09/150	-0.0873603872111833	-0.0147856656723759	church	NN	fiction_romance	D	D	DE	CDE	church%1:06:00::	D	D	DE	CDE	 all right. Wednesday nights after youth fellowship. Out of the <font color=green>church</font>  and into his big car, it tooling over the road
church/NN/br-p12/1014	-0.398469050433419	-0.347651078624993	church	NN	fiction_romance	D	D	DE	CDE	church%1:06:00::	D	D	DE	CDE	 Then they took a taxi to Trastevere.`` There 's a <font color=green>church</font>  you should see'', she said. And when they stood by
church/NN/br-p12/1102	-0.372732550008155	0.0503460454360433	church	NN	fiction_romance	D	D	DE	CDE	church_bell%1:06:00::	D	D	DE	CDE	 in the morning when he woke up at ten the <font color=green>church</font>  bells were ringing. He had never heard so many bells
church/NN/br-p12/1260	-0.0555367517277729	0.0409198617358205	church	NN	fiction_romance	E	E	DE	CDE	church%1:04:00::	E	E	DE	CDE	 snuggled against him, he wondered if she ever went to <font color=green>church</font> . Why did he want her to go to church? he
church/NN/br-p12/1270	-0.0555367517277729	0.0409198617358205	church	NN	fiction_romance	E	E	DE	CDE	church%1:04:00::	E	E	DE	CDE	 to church. Why did he want her to go to <font color=green>church</font> ? he wondered. Probably because it was a place where she
church/NN/br-p12/1433	0.0496846353828126	0.244437672272787	church	NN	fiction_romance	C	C	C	CDE	church%1:04:00::	E	E	DE	CDE	 woman though, she would take only what she needed from <font color=green>church</font> . It was too bad he was n't a Catholic himself
church/NN/br-p12/1559	-0.411492799643547	0.190876171163053	church	NN	fiction_romance	E	E	DE	CDE	church%1:04:00::	E	E	DE	CDE	 girl like Carla if she got up and went to <font color=green>church</font> . A half hour later he got her up to go
church/NN/br-r05/1163	-0.228025523980392	-0.0891681414603198	church	NN	fiction_humor	C	C	C	CDE	church%1:06:00::	D	D	DE	CDE	 While Henry Morgan was escorting Miss Vera Green from the <font color=green>church</font>  social last Saturday night, a savage dog attacked them and
church/NNP/br-a17/2134	-0.320253782810355	0.0769028516089647	church	NNP	press_reportage	D	D	DE	CDE	Z	Z	Z	Z	Z	 at the ceremony in Slaughter Chapel of the First Baptist <font color=green>Church</font> . Dan Beam presented music and the bride was given in
church/NNP/br-a18/760	-0.0629255208190347	-0.0383662437761738	church	NNP	press_reportage	C	C	C	CDE	Z	Z	Z	Z	Z	 the party. The women 's committee of St. David 's <font color=green>Church</font>  will hold its annual pre-Fair pink parade, a dessert bridge
church/NNP/br-a31/2143	-0.0886068838601088	-0.0363152599918474	church	NNP	press_reportage	C	C	C	CDE	Z	Z	Z	Z	Z	 7: 45 p. m.. The outstanding family of Central Nazarene <font color=green>Church</font>  will be picked by ballot from among eight families during
church/NNP/br-a35/810	0.086800683861135	-0.197852778598011	church	NNP	press_reportage	A	A	AB	AB	Z	Z	Z	Z	Z	 deserves closer scrutiny. For while the past needs of the <font color=green>Church</font>  in this country may have been adequately met by collegiate
church/NNP/br-b08/1804	-0.156051868210042	0.00110948771144074	church	NNP	press_editorial	C	C	C	CDE	Z	Z	Z	Z	Z	 his letter of resignation as rector of St. Luke 's <font color=green>Church</font>  in Atlanta. It was the cry of not just one
church/NNP/br-b12/2221	-0.00558634203528592	0.0415984426898312	church	NNP	press_editorial	B	B	AB	AB	Z	Z	Z	Z	Z	 committee made up of representatives of the Church of England, <font color=green>Church</font>  of Scotland, Methodist Church, Congregational Union, Baptist Union, Presbyterian Church
church/NNP/br-b16/1946	-0.0983775650697281	-0.0361812098007526	church	NNP	press_editorial	Z	Z	Z	Z	Z	Z	Z	Z	Z	 Dirksen and Sen. Douglas. But when you write to Congresswoman <font color=green>Church</font> , bless her heart, your letter is answered fully and completely
church/NNP/br-b22/1005	0.0555257262574879	-0.0623685894781086	church	NNP	press_editorial	A	A	AB	AB	Z	Z	Z	Z	Z	 concern itself directly only with the internal affairs of the <font color=green>Church</font> . As it has turned out, however, the excessive enthusiasm in
church/NNP/br-b22/1077	0.107257306226741	0.153519241794601	church	NNP	press_editorial	A	A	AB	AB	Z	Z	Z	Z	Z	 that Pope John sees the renewal and purification of the <font color=green>Church</font>  as an absolutely necessary step toward Christian unity. Far from
church/NNP/br-b22/1102	0.12302516826767	-0.153091913374598	church	NNP	press_editorial	A	A	AB	AB	Z	Z	Z	Z	Z	 to the ecumenical task, the Pontiff believes that a revivified <font color=green>Church</font>  is required in order that the whole world may see
church/NNP/br-b22/1154	0.129954351094939	0.11016426268446	church	NNP	press_editorial	A	A	AB	AB	Z	Z	Z	Z	Z	 be to remove as far as possible whatever in the <font color=green>Church</font>  today stands in the way of unity. Secondly, a whole
church/NNP/br-b22/1193	0.0761149512672713	0.0501415021723074	church	NNP	press_editorial	A	A	AB	AB	Z	Z	Z	Z	Z	 unity is still very much alive and growing within the <font color=green>Church</font> . The establishment, by the Holy Father, of a permanent Secretariat
