id	model.x	model.y	lemma	pos	genre	broad_genre	marisense	mbroad	mari3	mari2	sensekey	wnsense	wnbroad	wn3	wn2	text	cues	cues_with_weight	mean_weight_x100	wcratio_x100	weighted_cw	wf
church/NN/br-k25/81	0.38151758967892	0.138466763626309	church	NN	fiction_gral	fiction	D	D	DE	CDE	church%1:06:00::	D	D	DE	CDE	 whether a private residence in his Pennsylvania county or a <font color=green>church</font>  in Brazil, without it being obvious that he had done	3	1	223	33	1	church
church/NN/br-l08/1824	-0.27747697018818	0.254716580390574	church	NN	fiction_mystery	fiction	E	E	DE	CDE	church%1:04:00::	E	E	DE	CDE	 did n't feel good on Sunday, could n't go to <font color=green>church</font> - there 'd be a little argument, but she could be	3	1	307	33	1	church
church/NN/br-l08/2109	0.270854068413452	0.323516160979363	church	NN	fiction_mystery	fiction	C	C	C	CDE	church%1:06:00::	D	D	DE	CDE	 with foreign sounding names, the ones went to the same <font color=green>church</font>  and- Different place, different job, different people, she 'd be	2	0	246	0	1	church
church/NN/br-m01/2360	0.105535481537736	-0.427812797001118	church	NN	fiction_science	fiction	E	E	DE	CDE	church%1:04:00::	E	E	DE	CDE	 continued most of the week following that ill-starred trip to <font color=green>church</font> , during which period Mike stayed in his room and usually	1	0	227	0	1	church
church/NN/br-p01/1161	-0.349070463092842	0.0805806653136391	church	NN	fiction_romance	fiction	D	D	DE	CDE	church%1:06:00::	D	D	DE	CDE	 hill, rising with the hill to the top where the <font color=green>church</font>  was and beyond that to the cemetery. Only paved alleyways	7	2	323	29	2	church
church/NN/br-p01/21	-0.19145621862588	-0.000382432351555247	church	NN	fiction_romance	fiction	D	D	DE	CDE	church_tower%1:06:00::	D	D	DE	CDE	 them he could have been the broken bell in the <font color=green>church</font>  tower which rang before and after Mass, and at noon	4	3	281	75	4	church
church/NN/br-p01/222	-0.0862657600956296	0.029600006350326	church	NN	fiction_romance	fiction	E	E	DE	CDE	church%1:04:00::	E	E	DE	CDE	 from its elders. Youth obeyed when commanded. It went to <font color=green>church</font>  on Sunday and one Saturday a month went to confession	5	3	266	60	6	church
church/NN/br-p01/829	-0.160940614884819	0.248892185128287	church	NN	fiction_romance	fiction	D	D	DE	CDE	church%1:06:00::	D	D	DE	CDE	 to Drexel Street and his back in opposition to the <font color=green>church</font>  behind him. For all he saw or cared to see	5	1	268	20	2	church
church/NN/br-p09/150	-0.114480131543825	0.0463651931547929	church	NN	fiction_romance	fiction	D	D	DE	CDE	church%1:06:00::	D	D	DE	CDE	 all right. Wednesday nights after youth fellowship. Out of the <font color=green>church</font>  and into his big car, it tooling over the road	4	0	221	0	3	church
church/NN/br-p12/1014	-0.526288747108995	-0.10852006264831	church	NN	fiction_romance	fiction	D	D	DE	CDE	church%1:06:00::	D	D	DE	CDE	 Then they took a taxi to Trastevere.`` There 's a <font color=green>church</font>  you should see'', she said. And when they stood by	3	1	316	33	1	church
church/NN/br-p12/1102	-0.377017073804618	0.0295953998104875	church	NN	fiction_romance	fiction	D	D	DE	CDE	church_bell%1:06:00::	D	D	DE	CDE	 in the morning when he woke up at ten the <font color=green>church</font>  bells were ringing. He had never heard so many bells	2	1	254	50	2	church
church/NN/br-p12/1260	-0.0718358717724887	0.0616380819743927	church	NN	fiction_romance	fiction	E	E	DE	CDE	church%1:04:00::	E	E	DE	CDE	 snuggled against him, he wondered if she ever went to <font color=green>church</font> . Why did he want her to go to church? he	2	0	278	0	2	church
church/NN/br-p12/1270	-0.0718358717724887	0.0616380819743927	church	NN	fiction_romance	fiction	E	E	DE	CDE	church%1:04:00::	E	E	DE	CDE	 to church. Why did he want her to go to <font color=green>church</font> ? he wondered. Probably because it was a place where she	2	0	278	0	2	church
church/NN/br-p12/1433	0.0105940680659407	0.292728288843877	church	NN	fiction_romance	fiction	C	C	C	CDE	church%1:04:00::	E	E	DE	CDE	 woman though, she would take only what she needed from <font color=green>church</font> . It was too bad he was n't a Catholic himself	3	1	438	33	1	church
church/NN/br-p12/1559	-0.466393297876106	0.0879200579214079	church	NN	fiction_romance	fiction	E	E	DE	CDE	church%1:04:00::	E	E	DE	CDE	 girl like Carla if she got up and went to <font color=green>church</font> . A half hour later he got her up to go	1	0	268	0	1	church
church/NN/br-r05/1163	-0.236742692457049	-0.103663572894213	church	NN	humor	fiction	C	C	C	CDE	church%1:06:00::	D	D	DE	CDE	 While Henry Morgan was escorting Miss Vera Green from the <font color=green>church</font>  social last Saturday night, a savage dog attacked them and	3	1	276	33	2	church
church/NNP/br-d03/1914	-0.0428439990249703	0.0705554088650832	church	NNP	religion	non-fiction	B	B	AB	AB	group%1:03:00::	C	C	C	CDE	 the Observer depicting clergymen of the Church of England, the <font color=green>Church</font>  of Rome and the Nonconformist Church. The Catholic priest, though	5	2	413	40	6	Church
church/NNP/br-d03/1920	-0.0338534004935558	0.0642111193805037	church	NNP	religion	non-fiction	B	B	AB	AB	group%1:03:00::	C	C	C	CDE	 Church of England, the Church of Rome and the Nonconformist <font color=green>Church</font> . The Catholic priest, though somewhat superficially drawn, easily came out	5	3	384	60	6	Church
church/NNP/br-d03/2022	-0.0362400740892819	0.117794899349879	church	NNP	religion	non-fiction	B	B	AB	AB	group%1:03:00::	C	C	C	CDE	 comments were equally made by an Anglican parson, a Free <font color=green>Church</font>  minister and a Catholic priest. Catholic priests have frequently appeared	3	2	417	67	7	Church
church/NNP/br-d03/91	0.0398590555957226	0.0328254205848807	church	NNP	religion	non-fiction	A	A	AB	AB	group%1:03:00::	C	C	C	CDE	 the religious sphere so popularly discussed as Christian unity. The <font color=green>Church</font>  Unity Octave, January 18- 25, was enthusiastically devoted to prayer	5	2	329	40	5	Church
church/NNP/br-j57/304	-0.00238739532035425	0.00729079797604863	church	NNP	learned	non-fiction	B	B	AB	AB	group%1:03:00::	C	C	C	CDE	 Indeed, it is even surprising in the Canon of Christ <font color=green>Church</font>  and Regius Professor of Ecclesiastical History, who fathered this most	3	1	332	33	4	Church
church/NNP/br-k04/233	-0.0528627855832741	-0.0470961208844817	church	NNP	fiction_gral	fiction	D	D	DE	CDE	group%1:03:00::	C	C	C	CDE	 of this crowded region was the Allen African Methodist Episcopal <font color=green>Church</font> . It was an old and dirty wooden structure, sadly in	4	3	314	75	6	Church
church/NNP/br-k06/1930	-0.0664533183450172	0.0527300519511718	church	NNP	fiction_gral	fiction	D	D	DE	CDE	group%1:03:00::	C	C	C	CDE	 strike the steeples of the other churches; not of Drew <font color=green>Church</font> . A flash illumined the trees as a crooked bolt twigged	2	1	326	50	3	Church
church/NNP/br-k06/698	-0.208926722780763	0.154822024214871	church	NNP	fiction_gral	fiction	D	D	DE	CDE	group%1:03:00::	C	C	C	CDE	 the foothills, was the city of God. The Dutch Reformed <font color=green>Church</font> , with two steeples and its own school was on Main	4	0	259	0	1	Church
church/NNP/br-k06/714	-0.102366492092139	0.17705925803021	church	NNP	fiction_gral	fiction	D	D	DE	CDE	group%1:03:00::	C	C	C	CDE	 and its own school was on Main Street; the Episcopal <font color=green>Church</font>  was one block down Sussex Street; the Catholic Saint Mary's	4	1	416	25	2	Church
church/NNP/br-k06/726	-0.0948877002674564	0.136722497104089	church	NNP	fiction_gral	fiction	D	D	DE	CDE	group%1:03:00::	C	C	C	CDE	 was one block down Sussex Street; the Catholic Saint Mary's <font color=green>Church</font> , with an even taller steeple and a cross on top	5	1	410	20	3	Church
church/NNP/br-k06/841	-0.119601976060393	0.03474163838283	church	NNP	fiction_gral	fiction	D	D	DE	CDE	group%1:03:00::	C	C	C	CDE	 became familiar with God, who resided chiefly in Drew Centennial <font color=green>Church</font>  with its high steeple and clock. There was no church	3	1	343	33	4	Church
church/NNP/br-k06/855	-0.115026432617461	0.0411334380375064	church	NNP	fiction_gral	fiction	D	D	DE	CDE	group%1:03:00::	C	C	C	CDE	 high steeple and clock. There was no church like Drew <font color=green>Church</font> , no preacher like Papa, who was intimate with Him, and	2	1	376	50	5	Church
church/NNP/br-k10/1229	-0.0892316782799861	-0.0606362415616655	church	NNP	fiction_gral	fiction	B	B	AB	AB	group%1:03:00::	C	C	C	CDE	 smashing images and tearing down symbols sacred to the Old <font color=green>Church</font> . John found it difficult, but he held him in check	4	3	361	75	6	Church
church/NNS/br-d02/548	0.0919185869850826	0.0151561336434742	church	NNS	religion	non-fiction	B	B	AB	AB	church%1:14:00::	B	B	AB	AB	 observed to characterize the preaching and teaching of the American <font color=green>churches</font> . In the absence of a truly adequate conceptuality in which	3	1	263	33	5	churches
church/NNS/br-d03/1011	0.358624529614156	-0.0628118806787874	church	NNS	religion	non-fiction	D	D	DE	CDE	church%1:06:00::	D	D	DE	CDE	 often, the sale of 764 chapels''. Most of these former <font color=green>churches</font>  are now used as warehouses, but`` neither Anglicans nor Nonconformists	3	0	260	0	1	churches
church/NNS/br-d03/1027	-0.00721395944788814	0.180754760403541	church	NNS	religion	non-fiction	D	D	DE	CDE	church%1:06:00::	D	D	DE	CDE	 as warehouses, but`` neither Anglicans nor Nonconformists object to selling <font color=green>churches</font>  to Roman Catholics'', and have done so. While it must	2	0	352	0	3	churches
church/NNS/br-d03/1051	0.0687997829248868	0.0581899305788886	church	NNS	religion	non-fiction	D	D	DE	CDE	church%1:06:00::	D	D	DE	CDE	 be said that these same Protestants have built some new <font color=green>churches</font>  during this period, and that religious population shifts have emptied	4	2	315	50	4	churches
church/NNS/br-d03/1063	0.0569105541289209	0.0311708863477972	church	NNS	religion	non-fiction	C	C	C	CDE	church%1:06:00::	D	D	DE	CDE	 during this period, and that religious population shifts have emptied <font color=green>churches</font> , a principal reason for this phenomenon of redundancy is that	5	4	301	80	6	churches
church/NNS/br-d03/110	0.0184291446854914	0.0156261708004014	church	NNS	religion	non-fiction	C	C	C	CDE	church%1:14:00::	B	B	AB	AB	 was enthusiastically devoted to prayer and discussion by the various <font color=green>churches</font> . Many people seem hopeful, yet it is difficult to predict	5	4	282	80	5	churches
church/NNS/br-d03/1472	-0.0933171808310942	0.306376335144453	church	NNS	religion	non-fiction	E	E	DE	CDE	church%1:06:00::	D	D	DE	CDE	 thy Son''. A hymn often to be heard in Catholic <font color=green>churches</font>  is`` Faith of our Fathers'', which glories in England 's	3	1	302	33	1	churches
church/NNS/br-d03/1884	-0.00416250201351272	0.0361005139262178	church	NNS	religion	non-fiction	B	B	AB	AB	church%1:14:00::	B	B	AB	AB	 at least of equal stature in England with the Protestant <font color=green>churches</font> . On successive Sundays during October, 1960, Paul Ferris( a non-Catholic	2	2	313	100	6	churches
church/NNS/br-d03/313	0.0135441737724293	0.0710588252474993	church	NNS	religion	non-fiction	B	B	AB	AB	anglican_church%1:14:00::	B2	B	AB	AB	 saying and writing and implying about the Roman and Anglican <font color=green>Churches</font>  and about the present religious state of England. Since the	5	3	348	60	3	Churches
church/NNS/br-d03/35	-0.00525660178414147	0.0479380160095804	church	NNS	religion	non-fiction	B	B	AB	AB	anglican_church%1:14:00::	B2	B	AB	AB	 efforts of only unauthorized individuals of the Roman and Anglican <font color=green>Churches</font> , and urging a communion of prayer unacceptable to Rome, this	5	3	335	60	5	Churches
church/NNS/br-d03/779	-0.00160082394907837	0.0888457324055805	church	NNS	religion	non-fiction	D	D	DE	CDE	church%1:06:00::	D	D	DE	CDE	 less than ten. From many sides come remarks that Protestant <font color=green>churches</font>  are badly attended and the large medieval cathedrals look all	4	2	324	50	5	churches
church/NNS/br-d03/849	0.0219621068036419	0.0104642665404014	church	NNS	religion	non-fiction	C	C	C	CDE	church%1:06:00::	D	D	DE	CDE	 admit the great falling off in effective membership in their <font color=green>churches</font> . According to a newspaper report of the 1961 statistics of	2	2	268	100	6	churches
church/NNS/br-d03/929	0.00384775041930302	-0.0884540415820567	church	NNS	religion	non-fiction	C	C	C	CDE	church%1:06:00::	D	D	DE	CDE	 the Manchester Guardian of last November, entitled`` Fate of Redundant <font color=green>Churches</font> '', states than an Archbishops' Commission`` reported last month that in	2	0	282	0	4	Churches
church/NNS/br-d03/952	-0.0251587211438488	0.0331528557493832	church	NNS	religion	non-fiction	C	C	C	CDE	church%1:06:00::	D	D	DE	CDE	 that in the Church of England alone there are 790 <font color=green>churches</font>  which are redundant now, or will be in 20 years	3	2	262	67	3	churches
church/NNS/br-f15/1245	0.0397075377926257	0.0918456524632839	church	NNS	popular_lore	fiction	B	B	AB	AB	church%1:14:00::	B	B	AB	AB	 Consider what happened during World War 1,, when the Protestant <font color=green>churches</font>  united to push the Prohibition law through Congress. Many of	2	2	350	100	5	churches
church/NNS/br-f15/1425	-0.0169929373203279	0.292613002025685	church	NNS	popular_lore	fiction	B	B	AB	AB	christian_church%1:14:00::	B	B	AB	AB	 turn of the century, contraception was condemned by all Christian <font color=green>churches</font>  as immoral, unnatural and contrary to divine law. This was	5	0	407	0	3	churches
church/NNS/br-f15/1455	0.0136976813479968	0.0508324272294787	church	NNS	popular_lore	fiction	B	B	AB	AB	orthodox_church%1:14:00::	B1	B	AB	AB	 laws of Christian countries. Today, the Roman Catholic and Orthodox <font color=green>Churches</font>  stand virtually alone in holding that conviction. The various Lambeth	5	5	335	100	8	Churches
church/NNS/br-f15/1720	0.0266362100345883	0.0218197452331193	church	NNS	popular_lore	fiction	B	B	AB	AB	group%1:03:00::	C	C	C	CDE	 28 members of a committee of the Federal Council of <font color=green>Churches</font>  ratified artificial methods of birth control.`` As to the necessity	4	2	276	50	5	Churches
church/NNS/br-f15/1887	0.0560213138448123	0.0621225868800263	church	NNS	popular_lore	fiction	B	B	AB	AB	group%1:03:00::	C	C	C	CDE	 1961, by the general board of the National Council of <font color=green>Churches</font> , the largest Protestant organization in the US. The board approved	3	2	315	67	3	Churches
church/NNS/br-f15/1944	0.0634854882111654	0.0681235313865079	church	NNS	popular_lore	fiction	B	B	AB	AB	church%1:14:00::	B	B	AB	AB	 of contraceptives. The general board declared:`` Most of the Protestant <font color=green>churches</font>  hold contraception and periodic continence to be morally right when	4	1	275	25	3	churches
church/NNS/br-f15/1998	-0.0327163755192227	0.287250169658554	church	NNS	popular_lore	fiction	B	B	AB	AB	christian_church%1:14:00::	B	B	AB	AB	 of conception''. An action once universally condemned by all Christian <font color=green>churches</font>  and forbidden by the civil law is now not only	2	2	405	100	3	churches
church/NNS/br-f15/821	0.013560023983024	0.0772302506189312	church	NNS	popular_lore	fiction	B	B	AB	AB	orthodox_catholic_church%1:14:00::	B1	B	AB	AB	 the exception of the Roman Catholic and the Orthodox Catholic <font color=green>Churches</font> , most churches make no moral distinction between rhythm and mechanical	6	6	393	100	9	Churches
church/NNS/br-f15/824	0.0159522060613472	0.0762441557205071	church	NNS	popular_lore	fiction	B	B	AB	AB	church%1:14:00::	B	B	AB	AB	 of the Roman Catholic and the Orthodox Catholic Churches, most <font color=green>churches</font>  make no moral distinction between rhythm and mechanical or chemical	5	6	393	120	10	churches
church/NNS/br-f44/1106	0.1743066041408	0.138301772891049	church	NNS	popular_lore	fiction	C	C	C	CDE	church%1:14:00::	B	B	AB	AB	 who will strengthen the social class nucleus of the congregation. <font color=green>Churches</font>  can be strengthened through this process of co-optation so long	5	2	344	40	3	Churches
church/NNS/br-f44/1189	0.0433187936518051	0.0545024783828963	church	NNS	popular_lore	fiction	C	C	C	CDE	church%1:14:00::	B	B	AB	AB	 and publicity in reaching new members. The proclamation of the <font color=green>churches</font>  is almost totally confined to pastoral contacts by the clergy	7	3	322	43	5	churches
church/NNS/br-f44/124	0.0616659270768781	0.00740443498560949	church	NNS	popular_lore	fiction	C	C	C	CDE	church%1:14:00::	B	B	AB	AB	 inner city blight account for the decline of central city <font color=green>churches</font> . Central cities reveal two adverse features for the major denominations	4	2	259	50	6	churches
church/NNS/br-f44/1262	0.0883072666788059	0.00859692393694244	church	NNS	popular_lore	fiction	C	C	C	CDE	church%1:14:00::	B	B	AB	AB	 will account for a major share of recruitment by the <font color=green>churches</font> , making it quite evident that the extension of economic integration	2	0	261	0	4	churches
church/NNS/br-f44/1427	0.0746394849959397	0.0346622652678313	church	NNS	popular_lore	fiction	C	C	C	CDE	church%1:14:00::	B	B	AB	AB	 for more than a single generation. The fact that metropolitan <font color=green>churches</font>  of the major denominations have moved approximately every generation for	4	3	330	75	6	churches
church/NNS/br-f44/1475	0.0359329044035082	0.053923904933106	church	NNS	popular_lore	fiction	D	D	DE	CDE	church%1:06:00::	D	D	DE	CDE	 in religious life, when one recalls the number of city <font color=green>churches</font>  which deteriorated beyond repair before being abandoned, raises fundamental questions	4	2	297	50	4	churches
church/NNS/br-f44/1683	0.0529759532747205	0.0960441483572486	church	NNS	popular_lore	fiction	C	C	C	CDE	church%1:14:00::	B	B	AB	AB	 hopelessly unstable environment. More than creatures of metropolitan forces, the <font color=green>churches</font>  have taken the lead in counteracting the interdependence of metropolitan	2	2	350	100	5	churches
church/NNS/br-f44/1802	0.0910876798364075	0.131459821416127	church	NNS	popular_lore	fiction	D	D	DE	CDE	church%1:14:00::	B	B	AB	AB	 fight their way into the lower middle-class suburbs, and the <font color=green>churches</font>  will experience the same decay and rebuilding cycle which has	3	2	343	67	6	churches
church/NNS/br-f44/1918	0.0342984285438383	0.0469151897353741	church	NNS	popular_lore	fiction	C	C	C	CDE	church%1:14:00::	B	B	AB	AB	 of middle-class culture could lead to various projections for the <font color=green>churches</font> . It could be argued that any fellowship which centers in	3	3	305	100	5	churches
church/NNS/br-f44/2015	0.0201344889772138	-0.00701226082810515	church	NNS	popular_lore	fiction	C	C	C	CDE	church%1:14:00::	B	B	AB	AB	 next chapter to the style of association in the denominational <font color=green>churches</font> ; this style is characteristically an expression of the communal style	3	0	245	0	4	churches
church/NNS/br-f44/2181	0.00909861479074626	-0.0640410860742534	church	NNS	popular_lore	fiction	C	C	C	CDE	church%1:14:00::	B	B	AB	AB	 have fashioned the iron cage of conformity which imprisons the <font color=green>churches</font>  in their suburban captivity. The perplexing question still remains as	2	1	258	50	3	churches
church/NNS/br-f44/2201	0.0418000605668158	0.00599652520161499	church	NNS	popular_lore	fiction	C	C	C	CDE	church%1:14:00::	B	B	AB	AB	 remains as to why the middle classes turn to the <font color=green>churches</font>  as a vehicle of social identity when their clubs and	5	3	270	60	5	churches
church/NNS/br-f44/343	0.0798218985379656	0.0857307924131799	church	NNS	popular_lore	fiction	C	C	C	CDE	church%1:14:00::	B	B	AB	AB	 moreover, residential mobility is so high in metropolitan areas that <font color=green>churches</font>  have to recruit constantly in their core stratum in order	5	3	334	60	5	churches
church/NNS/br-f44/868	-0.0846005039986227	0.0859616034515168	church	NNS	popular_lore	fiction	C	C	C	CDE	church%1:14:00::	B	B	AB	AB	 and congregational outreach have not been carefully studied in the <font color=green>churches</font> ; one study in Pittsburgh, however, has illuminated the situation. In	2	1	349	50	4	churches
church/NNS/br-f44/890	0.0265286150193164	0.0698022234011497	church	NNS	popular_lore	fiction	C	C	C	CDE	church%1:14:00::	B	B	AB	AB	 the situation. In a sample of new members of Pittsburgh <font color=green>churches</font> , almost 60 per cent were recruited by initial`` contacts with	3	2	326	67	4	churches
church/NNS/br-k01/769	-0.267697926427541	-0.0211067658733711	church	NNS	fiction_gral	fiction	D	D	DE	CDE	church%1:06:00::	D	D	DE	CDE	 It was a Negro section of peeling row houses, store-front <font color=green>churches</font>  and ragged children. Rachel had to bend toward Scotty and	2	0	266	0	3	churches
church/NNS/br-k04/2307	-0.0529599683344008	0.0689703587973428	church	NNS	fiction_gral	fiction	B	B	AB	AB	church%1:06:00::	D	D	DE	CDE	 his career in the Methodist church, if not in all <font color=green>churches</font> .	2	0	247	0	2	churches
church/NNS/br-k06/1925	-0.420752231684499	-0.214425838177721	church	NNS	fiction_gral	fiction	D	D	DE	CDE	church%1:06:00::	D	D	DE	CDE	 them open. Lightning might strike the steeples of the other <font color=green>churches</font> ; not of Drew Church. A flash illumined the trees as	2	0	378	0	2	churches
country/NN/br-b20/2202	0.0670566340594403	-0.377671392115889	country	NN	press_editorial	press	B2	B	B23	B	country%1:14:00::	B2	B	BB2	B	 more serious should the cold war mount in frenzy. The <font color=green>country</font>  is committed to the doctrine of security by military means	5	0	248	0	1	country
country/NN/br-b20/308	0.109955720520899	-0.185745678997582	country	NN	press_editorial	press	B4	B	B14	B	country%1:15:00::	B1	B	B1	B	 that of diplomatic policy''. Morrison points out that since our <font color=green>country</font>  is more urbanized than the Soviet Union or Red China	5	2	234	40	3	country
country/NN/br-c01/2379	0.0835045790479864	-0.00198860852649881	country	NN	press_reviews	press	B	B	B14	B	country%1:14:00::	B2	B	BB2	B	 in this last of the Russian films to reach this <font color=green>country</font>  in the program of joint cultural exchange. Also on the	4	2	213	50	3	country
country/NN/br-c01/621	-0.19552481360243	-0.279399364622287	country	NN	press_reviews	press	B1	B	B14	B	country%1:15:00::	B1	B	B1	B	 extraordinary, considers the finest house of its kind in the <font color=green>country</font> - and of course he does n't weep at the capacity	3	0	251	0	2	country
country/NN/br-c01/944	-0.158016741111337	-0.34611958589935	country	NN	press_reviews	press	B1	B	B14	B	country%1:15:00::	B1	B	B1	B	 bookers, cancellation of one of the richest bookings in the <font color=green>country</font> . Will somebody please reopen the Auditorium? Paintings and drawings by	2	0	274	0	2	country
country/NN/br-c02/2222	0.0670566340594403	-0.377671392115889	country	NN	press_reviews	press	B4	B	B14	B	country%1:14:00::	B2	B	BB2	B	 storylines too. He intimated that they were n't doing the <font color=green>country</font>  much good in the Cold War. And to an industry	2	0	248	0	1	country
country/NN/br-c02/2265	0.0078943112702761	-0.460766408951304	country	NN	press_reviews	press	B4	B	B14	B	country%1:14:00::	B2	B	BB2	B	 globe'', he said,`` the major source of impressions about this <font color=green>country</font>  are in the movies they meet. Would we want a	1	0	201	0	1	country
country/NN/br-d03/1224	0.00113450307332729	0.124366256992018	country	NN	religion	non-fiction	B4	B	B14	B	country%1:14:01::	B	B	BB2	B	 seems no longer very meaningful to call England a`` Protestant <font color=green>country</font> ''. One of the ironies of the present crusade for Christian	2	2	224	100	2	country
country/NN/br-d03/1509	-0.126709615804699	0.405155673809338	country	NN	religion	non-fiction	B4	B	B14	B	country%1:14:01::	B	B	BB2	B	 Faith of our Fathers: Mary 's prayers/ Shall win our <font color=green>country</font>  back to thee''. The English saints are widely venerated, quite	3	1	284	33	1	country
country/NN/br-d03/249	-0.0430915896777251	0.136938337706021	country	NN	religion	non-fiction	B4	B	B14	B	country%1:14:01::	B	B	BB2	B	 century literature of England, I knew only a Protestant dominated <font color=green>country</font> . Since arriving here, however, I have formed a far different	3	2	236	67	2	country
country/NN/br-e30/1177	0.221268378956488	-0.0689101027440776	country	NN	skill_and_hobbies	non-fiction	B1	B	B14	B	country%1:15:00::	B1	B	B1	B	 What 's your profit margin? In what section of the <font color=green>country</font>  are you located? Are you in a rural or urban	4	1	230	25	2	country
country/NN/br-e31/1795	0.30693803184805	-0.323696166080979	country	NN	skill_and_hobbies	non-fiction	B4	B	B14	B	country%1:15:00::;1:14:00::	B1	B	B1	B	 and( 6) more education. The more people learn about their <font color=green>country</font> , the more they want to learn. Camping is family fun	3	0	245	0	1	country
country/NN/br-e31/1819	0.0750459937283214	-0.185408084264335	country	NN	skill_and_hobbies	non-fiction	B1	B	B14	B	country%1:15:00::	B1	B	B1	B	 and it is helping more Americans see more of the <font color=green>country</font>  than they ever saw before. But make no mistake about	2	1	212	50	1	country
country/NN/br-f03/2248	-0.190159666255297	-0.106347067091384	country	NN	popular_lore	fiction	A	A	A	A	country%1:15:01::	A	A	A	A	 the convention, Depew was seated on the porch of a <font color=green>country</font>  home on the Hudson, gazing at the opposite shore.	4	2	237	50	4	country
