id	model.x	model.y	lemma	pos	genre	broad_genre	marisense	mbroad	mari3	mari2	sensekey	wnsense	wnbroad	wn3	wn2	text	cues	cues_with_weight	mean_weight	weighted.cues_ratio	weighted_cw
state/JJ/br-d12/2233	-0.0538522586089674	5.02743201751335e-05	state	JJ	religion	non-fiction	Z	Z	Z	Z	Z	Z	Z	Z	Z	 the narrow sense of skillfulness in meeting a client 's <font color=green>stated</font>  needs as already noted? Our faculty and students pressed this	1	0	2.84152213376052	0	10
state/JJ/br-e21/1143	-0.0539047951001491	-0.00991830996501044	state	JJ	skill_and_hobbies	non-fiction	A2	A	AB	ABC	state%5:00:02:public:00	A2	A	AB	ABC	 which the area is blessed. Just as the national and <font color=green>state</font>  parks place emphasis on features which are of national or	3	4	2.30939426343514	1.33333333333333	10
state/JJ/br-e21/1154	-0.0390571655148031	-0.0120407336419819	state	JJ	skill_and_hobbies	non-fiction	A3	A	AB	ABC	state%5:00:01:public:00	A2	A	AB	ABC	 parks place emphasis on features which are of national or <font color=green>state</font>  significance, counties should seek out these features which are distinctive	3	3	3.43744495266179	1	9
state/JJ/br-e31/1555	-0.137002272659584	-0.00797010174003866	state	JJ	skill_and_hobbies	non-fiction	A2	A	AB	ABC	state%5:00:02:public:00	A2	A	AB	ABC	 to make their cooking easy and their sleeping comfortable. Harassed <font color=green>state</font>  park officials often have more campers than they know what	2	2	2.44457211339315	1	10
state/JJ/br-e31/651	-0.01845576077839	-0.0182381455961325	state	JJ	skill_and_hobbies	non-fiction	A3	A	AB	ABC	state%5:00:02:public:00	A2	A	AB	ABC	 the shooting development program have proudly participated in over 53 <font color=green>state</font>  and regional workshops, at which hundreds of school administrators, teachers	3	3	2.94669411233993	1	6
state/JJ/br-h11/1931	-0.0544239093027092	0.025302893740453	state	JJ	miscellaneous	non-fiction	D	D	D	D	solid-state%5:00:02:solid:01	D2	D	D	D	 addition to the basic programs in wavelength standards, spectroscopy, solid <font color=green>state</font>  physics, interactions of the free electron and atomic constants which	3	2	3.38602522535893	0.666666666666667	8
state/JJ/br-h11/1986	-0.0658015143600441	0.0517510056493532	state	JJ	miscellaneous	non-fiction	D	D	D	D	solid-state%5:00:02:solid:01	D2	D	D	D	 the far infrared, the application of infrared techniques to solid <font color=green>state</font>  studies, and increased emphasis on high resolution instrumentation. Two data	3	2	3.49457022178682	0.666666666666667	11
state/JJ/br-h14/1724	0.115518820492813	0.0559095175633072	state	JJ	miscellaneous	non-fiction	A3	A	AB	ABC	state%5:00:02:public:00	A2	A	AB	ABC	 in order to provide matching for the minimum( base) allotment, <font color=green>State</font>  funds had to equal 1954 State funds. Prior to and	3	4	4.0030597824457	1.33333333333333	10
state/JJ/br-h14/1730	0.13552336491215	0.0581089639975966	state	JJ	miscellaneous	non-fiction	A3	A	AB	ABC	state%5:00:02:public:00	A2	A	AB	ABC	 the minimum( base) allotment, State funds had to equal 1954 <font color=green>State</font>  funds. Prior to and since 1960 the rest of the	4	4	3.99017407417567	1	9
state/JJ/br-h14/1763	0.034316779876862	0.0107548257356854	state	JJ	miscellaneous	non-fiction	A3	A	AB	ABC	state%5:00:02:public:00	A2	A	AB	ABC	 fiscal capacity of the State, with a pivot of 40% <font color=green>State</font> ( or 60% Federal) participation in total program costs. The percentage	2	2	3.14188581861423	1	5
state/JJ/br-h14/1868	0.0878432189475995	0.0683827106386418	state	JJ	miscellaneous	non-fiction	A3	A	AB	ABC	state%5:00:02:public:00	A2	A	AB	ABC	 will be matched on the basis of a 40% pivot <font color=green>State</font>  share, with maximum and minimum State shares of 50% and	5	4	4.41434226286398	0.8	7
state/JJ/br-h14/1875	0.119224040636279	0.101155016453769	state	JJ	miscellaneous	non-fiction	A3	A	AB	ABC	state%5:00:02:public:00	A2	A	AB	ABC	 of a 40% pivot State share, with maximum and minimum <font color=green>State</font>  shares of 50% and 30%, respectively. The pre 1960 rate	3	3	4.50432098789146	1	6
state/JJ/br-h14/1997	0.0151449123959809	0.0211473347841079	state	JJ	miscellaneous	non-fiction	A3	A	AB	ABC	state%5:00:02:public:00	A2	A	AB	ABC	 rates. The method used for computing the respective Federal and <font color=green>State</font>  shares in total program costs is specifically set forth in	4	4	2.87952873924899	1	13
state/JJ/br-h14/332	0.0395198431736367	0.0299259894085039	state	JJ	miscellaneous	non-fiction	A3	A	AB	ABC	state%5:00:02:public:00	A2	A	AB	ABC	 grants to the States on the basis of population, matching <font color=green>State</font>  expenditures on a 50 - 50 basis. Under P. L.	3	1	3.30234800621801	0.333333333333333	7
state/JJ/br-h14/360	-0.00290156977949363	0.0176309458638118	state	JJ	miscellaneous	non-fiction	A3	A	AB	ABC	state%5:00:02:public:00	A2	A	AB	ABC	 Congress, the Federal Government assumed responsibility for 100% of necessary <font color=green>State</font>  expenditures in connection with administration and the counseling and placement	4	3	2.96698824905736	0.75	7
state/JJ/br-h14/533	0.053427096047218	0.0134088697947012	state	JJ	miscellaneous	non-fiction	A3	A	AB	ABC	state%5:00:02:public:00	A2	A	AB	ABC	 the authorizations, appropriations, allotment base, Federal grants to States and <font color=green>State</font>  matching funds for this part of the grant program. In	6	5	3.52490073342175	0.833333333333333	9
state/JJ/br-h14/747	-0.00651606065421256	0.00907712794874214	state	JJ	miscellaneous	non-fiction	A3	A	AB	ABC	state%5:00:02:public:00	A2	A	AB	ABC	 State. The provisions are also designed to avoid disruption in <font color=green>State</font>  programs already in operation, which might otherwise result from the	2	2	2.55764163205873	1	10
state/JJ/br-h15/1500	-0.00393507492061727	0.00877357130227188	state	JJ	miscellaneous	non-fiction	A3	A	AB	ABC	state%5:00:02:public:00	A2	A	AB	ABC	 gather its own information and will receive broad information from <font color=green>State</font>  and Federal sources. It will tell you as soon as	2	2	2.55282536061483	1	9
state/JJ/br-j38/1551	0.00411110263847377	-0.0048615068489932	state	JJ	learned	non-fiction	A3	A	AB	ABC	state%5:00:02:public:00	A2	A	AB	ABC	 Federal government but from an exchange of experiences among states. <font color=green>State</font>  and local agencies in the vocational education field must be	4	3	2.70093203139216	0.75	9
state/JJ/br-j38/1590	-0.00167341980654074	-0.00196587329300974	state	JJ	learned	non-fiction	A3	A	AB	ABC	state%5:00:02:public:00	A2	A	AB	ABC	 Federal effort to provide research and information to help guide <font color=green>state</font>  education departments and local school boards in existing programs. A	5	5	2.89640318542722	1	14
state/JJ/br-j38/1871	0.00114970377823739	-0.00324568511390006	state	JJ	learned	non-fiction	A3	A	AB	ABC	state%5:00:02:public:00	A2	A	AB	ABC	 for training to meet national skilled manpower needs. If only <font color=green>state</font>  funds were used to pay for the vocational education, it	3	3	2.38946096437992	1	12
state/JJ/br-j38/441	-0.0019358762859303	-0.0236442147438871	state	JJ	learned	non-fiction	A3	A	AB	ABC	state%5:00:02:public:00	A2	A	AB	ABC	 enrolled in courses organized under two special programs administered by <font color=green>state</font>  and local school authorities:( 1) Vocational Education for National Defense	4	4	3.26604935784987	1	10
state/JJ/br-j38/86	0.00528993272066644	0.0215411240133054	state	JJ	learned	non-fiction	A1	A	AB	ABC	state%5:00:02:public:00	A2	A	AB	ABC	 appropriation of$ 7 million to support, on a matching basis, <font color=green>state</font>  administered programs of vocational education in agriculture, trades, industrial skills	4	3	3.88326786687343	0.75	8
state/NN/br-d03/319	-0.123833791825768	-0.19619440540545	state	NN	religion	non-fiction	D	D	D	D	state%1:03:00::	D1	D	D	D	 the Roman and Anglican Churches and about the present religious <font color=green>state</font>  of England. Since the Protestant clergy for the most part	2	0	0.553138319414864	0	5
state/NN/br-d04/1145	-0.134092215397848	0.0221473078473567	state	NN	religion	non-fiction	D	D	D	D	state%1:03:00::	D1	D	D	D	 and the whole human race''. Because he interprets the primitive <font color=green>state</font>  of man as one of mere potentiality or capacity and	3	1	0.89846270731298	0.333333333333333	5
state/NN/br-d04/1599	-0.169257156440409	-0.0821693289727965	state	NN	religion	non-fiction	D	D	D	D	state%1:03:00::	D1	D	D	D	 interminable and irremediable. But He set a bound to his[ <font color=green>state</font>  of] sin, by interposing death, and thus causing sin to	3	1	0.527849102573275	0.333333333333333	3
state/NN/br-d04/2174	-0.215392058688531	0.00970638344907953	state	NN	religion	non-fiction	D	D	D	D	state%1:03:00::	D1	D	D	D	 existence itself is a form of punishment rather than the <font color=green>state</font>  into which man is put by the will of the	3	1	0.954485642513022	0.333333333333333	4
state/NN/br-d06/1779	0.125645831211072	-0.171998194901761	state	NN	religion	non-fiction	A5	A	AB	ABC	Z	Z	Z	Z	Z	 paid yearly to the 80000 full-time fortune-tellers in the United <font color=green>States</font>  by fearful mankind who want to`` know'' what the future	1	0	1.26873670703339	0	4
state/NN/br-d07/925	-0.0587984914856058	-0.183208544564175	state	NN	religion	non-fiction	A5	A	AB	ABC	Z	Z	Z	Z	Z	 the same effect on Communists. The President of the United <font color=green>States</font>  has said:`` We will never negotiate out of fear, and	1	0	0.995427007540518	0	4
state/NN/br-d10/1157	-0.0166265685342606	-0.297178927906159	state	NN	religion	non-fiction	B	B	AB	ABC	Z	Z	Z	Z	Z	 many Buddhists argue that Buddhism ought to be the official <font color=green>state</font>  religion. In 1960 Ceylon nationalized its sectarian- preponderantly Christian- schools	4	1	1.52776536834854	0.25	2
state/NN/br-d10/1318	-0.0337026311431138	-0.206419243173524	state	NN	religion	non-fiction	A5	A	AB	ABC	Z	Z	Z	Z	Z	 funds to contract for them. After returning to the United <font color=green>States</font>  and raising the money, he discovered on getting back to	1	0	1.34073155732032	0	3
state/NN/br-d10/1528	-0.244300981959268	-0.0661307213511039	state	NN	religion	non-fiction	A1	A	AB	ABC	Z	Z	Z	Z	Z	 by progressive disaffection with claims to divine sanction for the <font color=green>state</font> , whatever its political form. The American Constitution was historic at	4	1	1.15979300666471	0.25	3
state/NN/br-d10/1630	-0.0515159231227337	-0.102761552890643	state	NN	religion	non-fiction	B	B	AB	ABC	Z	Z	Z	Z	Z	 enactment. Pakistan was created in 1947 expressly as a Muslim <font color=green>state</font> , but when the army took over eleven years later it	2	0	0.469647057866289	0	3
state/NN/br-d10/1699	-0.153626773416871	-0.468437421843394	state	NN	religion	non-fiction	B	B	AB	ABC	Z	Z	Z	Z	Z	 Adams reports the Pakistanis as asking,`` in demanding an Islamic <font color=green>state</font>  and society if no one, not even the doctors of	3	1	0.881004573705378	0.333333333333333	2
state/NN/br-d10/1727	-0.143527158447308	-0.0121653719478907	state	NN	religion	non-fiction	C	C	C	ABC	Z	Z	Z	Z	Z	 say clearly and succinctly what the nature of such a <font color=green>state</font>  and society is''? The current regime of President Mohammad Ayub	3	3	0.738589765427278	1	5
state/NN/br-d10/1915	0.18749749344133	0.00970220427611141	state	NN	religion	non-fiction	C	C	C	ABC	Z	Z	Z	Z	Z	 Catholic defense of the practical autonomy of both church and <font color=green>state</font> . The failure at that time of the Puerto Rican bishops	2	1	1.13724086171414	0.5	6
state/NN/br-d13/292	-0.549570083262525	0.00980616700200444	state	NN	religion	non-fiction	A5	A	AB	ABC	Z	Z	Z	Z	Z	 is enough TNT to fill the tower of the Empire <font color=green>State</font>  Building; and with the availability of bombs of that size	2	0	1.20415325978971	0	2
state/NN/br-d13/606	-0.103817589513897	0.270771066747548	state	NN	religion	non-fiction	A5	A	AB	ABC	Z	Z	Z	Z	Z	 lights and run all the factories in the entire United <font color=green>States</font>  for some days. And think, if we all knew this	1	0	1.09204495713369	0	3
state/NN/br-d13/922	-0.0568359521722553	-0.0634822641841446	state	NN	religion	non-fiction	A4	A	AB	ABC	Z	Z	Z	Z	Z	 rate, so I decided to take another measure- the whole <font color=green>state</font>  of Pennsylvania. Imagine that there is a blizzard over Pennsylvania	2	2	1.05475836111097	1	4
state/NN/br-d13/950	-0.335046214511108	0.0328824397325622	state	NN	religion	non-fiction	A4	A	AB	ABC	Z	Z	Z	Z	Z	 snowing snow, it snows peas; so we get the whole <font color=green>state</font>  covered with peas, about four feet deep. You can imagine	2	2	1.24193065558374	1	4
state/NN/br-d14/1176	-0.0938952733013747	-0.067341333883395	state	NN	religion	non-fiction	A5	A	AB	ABC	Z	Z	Z	Z	Z	 least in part, from the Protestant heritage of the United <font color=green>States</font>  and built into the foundations of the nation, it is	1	0	0.627324023938446	0	5
state/NN/br-d14/13	-0.133203341600821	-0.0901473136534846	state	NN	religion	non-fiction	A5	A	AB	ABC	Z	Z	Z	Z	Z	 extent and in what ways did Christianity affect the United <font color=green>States</font>  of America in the nineteenth century? How far and in	1	0	0.734582099785473	0	5
state/NN/br-d14/853	-0.404937709144501	-0.158026921702904	state	NN	religion	non-fiction	A5	A	AB	ABC	Z	Z	Z	Z	Z	 on the Evangelical revivals. The great seal of the United <font color=green>States</font>  was obviously inspired by the Christian faith. Here was what	1	0	0.765123935525487	0	3
state/NN/br-d15/1409	-0.19916731119183	0.0384480340775327	state	NN	religion	non-fiction	D	D	D	D	Z	Z	Z	Z	Z	 words, or any other manifestations that belong to the normal <font color=green>state</font>  of consciousness are considered only the surface of experience. The	4	1	0.990419325471124	0.25	3
state/NN/br-d17/1749	-0.40812815598655	-0.289293926443396	state	NN	religion	non-fiction	A5	A	AB	ABC	Z	Z	Z	Z	Z	 three brothers and I were taken often to the United <font color=green>States</font> `` to visit relatives'' while my father stayed on to fight	1	0	0.738881085846879	0	2
state/NN/br-e02/1595	-0.11402084758411	0.258865535488601	state	NN	skill_and_hobbies	non-fiction	A5	A	AB	ABC	united_states%1:15:00::	A51	A	AB	ABC	 made it possible to ship avocado anywhere in the United <font color=green>States</font> . It has a great many assets to recommend it and	1	0	1.00166738444645	0	4
state/NN/br-e02/1889	-0.34410117460857	0.377470700070085	state	NN	skill_and_hobbies	non-fiction	D	D	D	D	state%1:03:00::	D1	D	D	D	 temperature at which it lapses into a sort of dormant <font color=green>state</font> . This cooling does not change the avocado in any way	3	0	0.671481248740126	0	4
state/NN/br-e03/2056	-0.305715364935225	0.176319205333722	state	NN	skill_and_hobbies	non-fiction	A5	A	AB	ABC	Z	Z	Z	Z	Z	 a missile to come all the way from the United <font color=green>States</font>  with the chance that the target, if it were mobile	1	0	0.15071479915772	0	3
state/NN/br-e05/1327	-0.0178838158290103	-0.254649843240958	state	NN	skill_and_hobbies	non-fiction	A5	A	AB	ABC	Z	Z	Z	Z	Z	 who has placed in the Junior Classes in both United <font color=green>States</font>  and Canada. Karen Marcmann, age 16, Trapp, Penna., showing a	1	0	0.74271618053655	0	5
state/NN/br-e06/115	0.109968097235007	0.223874162655177	state	NN	skill_and_hobbies	non-fiction	A4	A	AB	ABC	Z	Z	Z	Z	Z	 from sea to shining sea. Boats are operated in every <font color=green>state</font>  in the Union, with the heaviest concentrations along both coasts	3	0	0.633755619785848	0	4
state/NN/br-e06/1425	-0.0684608647653068	-0.127524174000409	state	NN	skill_and_hobbies	non-fiction	A	A	AB	ABC	Z	Z	Z	Z	Z	 restriction on boating. Laws on boating vary according to the <font color=green>state</font>  in which the craft is to be used and according	3	1	1.34749013238705	0.333333333333333	10
state/NN/br-e06/1446	-0.181675082693166	0.325093662429245	state	NN	skill_and_hobbies	non-fiction	A4	A	AB	ABC	Z	Z	Z	Z	Z	 according to its horsepower. What may be acceptable in one <font color=green>state</font>  may be strictly prohibited across the boundary line. The main	4	2	1.35052093327828	0.5	3
state/NN/br-e06/1473	0.179187885361895	-0.138151657979225	state	NN	skill_and_hobbies	non-fiction	A	A	AB	ABC	Z	Z	Z	Z	Z	 the boat is numbered according to the regulations of the <font color=green>state</font>  in which the boat will be principally used. If your	2	2	1.09146638824625	1	6
state/NN/br-e06/1485	0.137548889489192	0.114235848652451	state	NN	skill_and_hobbies	non-fiction	A	A	AB	ABC	Z	Z	Z	Z	Z	 in which the boat will be principally used. If your <font color=green>state</font>  has no provisions for the numbering of pleasure boats, you	2	2	0.871944743881252	1	6
state/NN/br-e06/1922	-0.026073858457392	0.332142937757865	state	NN	skill_and_hobbies	non-fiction	A5	A	AB	ABC	Z	Z	Z	Z	Z	 It is important to note the work of the United <font color=green>States</font>  Power Squadrons and the U. S. Coast Guard Auxiliary. Each	1	0	0.418695016685576	0	1
state/NN/br-e06/2225	-0.230989420054619	0.0728150894012187	state	NN	skill_and_hobbies	non-fiction	A5	A	AB	ABC	Z	Z	Z	Z	Z	 commercially and municipally operated marinas and boatyards in the United <font color=green>States</font> , the majority of which are equipped to handle outboard boats	1	0	0.941572016591884	0	2
state/NN/br-e06/38	-0.178043475091308	-0.0486177219657261	state	NN	skill_and_hobbies	non-fiction	A5	A	AB	ABC	Z	Z	Z	Z	Z	 the sole concern of fishermen, rich people, and the United <font color=green>States</font>  Navy. Today the recreational boating scene is awash with heartening	1	0	1.41178591586464	0	3
state/NN/br-e06/72	0.133580502273443	0.265478300479267	state	NN	skill_and_hobbies	non-fiction	A5	A	AB	ABC	Z	Z	Z	Z	Z	 more than 8000000 recreational boats in use in the United <font color=green>States</font>  with almost 10000000 the prediction for within the next decade	1	0	0.735317918090291	0	3
state/NN/br-e12/1033	-0.0347559560946097	-0.141187852586083	state	NN	skill_and_hobbies	non-fiction	A	A	AB	ABC	Z	Z	Z	Z	Z	 adventure are the Luray Caverns, lit by photofloodlights. The great <font color=green>state</font>  of Texas offers metropolitan attractions such as the Dallas Fair	3	3	0.900656788397012	1	5
state/NN/br-e12/2292	-0.158375558594929	-0.256435331592131	state	NN	skill_and_hobbies	non-fiction	A5	A	AB	ABC	Z	Z	Z	Z	Z	 Grand Canyon, probably the most famous landmark of the United <font color=green>States</font> , can be the highpoint of your Western vacation.	1	0	0.320097199577278	0	3
state/NN/br-e12/750	-0.0957580088432752	-0.274404114429683	state	NN	skill_and_hobbies	non-fiction	A5	A	AB	ABC	Z	Z	Z	Z	Z	 f will do for bright, frontal sunlight. The Southern United <font color=green>States</font> , extending from Florida in the east to Texas in the	1	0	0.908675545126994	0	5
state/NN/br-e12/827	-0.0126802029089601	-0.0560498015875842	state	NN	skill_and_hobbies	non-fiction	A	A	AB	ABC	Z	Z	Z	Z	Z	 special interest this anniversary year of the war between the <font color=green>states</font>  are the many Civil War battlefields where, likely as not	2	0	0.842099487260045	0	6
state/NN/br-e12/887	-0.0810335220788653	-0.0890562901456828	state	NN	skill_and_hobbies	non-fiction	A5	A	AB	ABC	Z	Z	Z	Z	Z	 Fredericksburg, Virginia. Florida provides tropical scenes unequalled in the United <font color=green>States</font> . At Cypress Gardens special bleachers are set up for photographers	1	0	1.09902790112102	0	6
state/NN/br-e15/1831	-0.0844513950689973	-0.219651807442731	state	NN	skill_and_hobbies	non-fiction	D	D	D	D	Z	Z	Z	Z	Z	 cut pieces on plaster board to dry to firm leather-hard <font color=green>state</font> . Score side edges of base; join sides and base with	2	1	0.784765414594263	0.5	8
state/NN/br-e16/457	-0.203939238935603	0.464039798380486	state	NN	skill_and_hobbies	non-fiction	D	D	D	D	Z	Z	Z	Z	Z	 framing in Hotei is one-inch mahogany which, in the dressed <font color=green>state</font>  you buy it, is about the 13 16- inch thickness	2	1	0.927528201417613	0.5	2
state/NN/br-e19/762	-0.251630214622965	-0.166990326108757	state	NN	skill_and_hobbies	non-fiction	A2	A	AB	ABC	Z	Z	Z	Z	Z	 they had quadrupled. Had we taken a lien on a <font color=green>state</font>  park? Not at all. We had merely been discovered by	1	1	0.400511821238429	1	3
state/NN/br-e22/2361	0.00340387788490285	-0.143547492170777	state	NN	skill_and_hobbies	non-fiction	A5	A	AB	ABC	united_states%1:15:00::	A51	A	AB	ABC	 indeed in the musical history of the entire eastern United <font color=green>States</font> . On that date the Musicians Emergency Fund, organized to furnish	1	0	1.0916910769532	0	7
state/NN/br-e22/71	-0.162802946525848	-0.20178418179865	state	NN	skill_and_hobbies	non-fiction	A5	A	AB	ABC	united_states_of_america%1:15:00::	A51	A	AB	ABC	 Republics. The Serge Prokofieff whom we knew in the United <font color=green>States</font>  of America was gay, witty, mercurial, full of pranks and	1	0	1.21689084113629	0	2
state/NN/br-e27/125	-0.0864126331912183	0.196747051157334	state	NN	skill_and_hobbies	non-fiction	A1	A	AB	ABC	state%1:15:01::	A	A	AB	ABC	 minerals. The drug 's chemical name is listed, since most <font color=green>states</font>  require feed processors to use this name instead of the	2	1	0.571966740745641	0.5	9
state/NN/br-e27/173	-0.0331113247113275	0.0303676378403131	state	NN	skill_and_hobbies	non-fiction	A3	A	AB	ABC	state%1:15:01::	A	A	AB	ABC	 drug is being marketed under one trade name only or <font color=green>state</font>  regulatory organizations have approved its use on the feed tag	3	2	0.732944864202084	0.666666666666667	9
state/NN/br-e31/250	-0.00593838263465616	0.218387910530979	state	NN	skill_and_hobbies	non-fiction	A4	A	AB	ABC	state%1:15:01::	A	A	AB	ABC	 game bags are possible and legal in more than 40 <font color=green>states</font> , on shooting preserves( one of the newer phases of modern	3	1	0.547922149952002	0.333333333333333	4
state/NN/br-h02/1137	-0.0509618327513154	0.139009213949283	state	NN	miscellaneous	non-fiction	A5	A	AB	ABC	Z	Z	Z	Z	Z	 it is politically essential in the long run. The United <font color=green>States</font>  can use its aid as an incentive to self-help by	1	0	0.756391322863968	0	7
state/NN/br-h02/1996	-0.0566529789421755	0.0811930178198347	state	NN	miscellaneous	non-fiction	A5	A	AB	ABC	Z	Z	Z	Z	Z	 to be persuaded to adopt a long-term approach, the United <font color=green>States</font> , as the principal supplier of external aid, must be prepared	1	0	0.9892660038016	0	6
state/NN/br-h03/102	-0.0835472195167787	-0.105273411129645	state	NN	miscellaneous	non-fiction	A5	A	AB	ABC	Z	Z	Z	Z	Z	 years not only for this body but for the United <font color=green>States</font>  of America and the free world. You remember the words	1	0	0.622129907377701	0	4
state/NN/br-h03/1478	-0.0888192146883715	-0.00213032601134727	state	NN	miscellaneous	non-fiction	A5	A	AB	ABC	Z	Z	Z	Z	Z	 years to come for this is an influence the United <font color=green>States</font>  and the whole world can ill afford to lose. All	1	0	0.742935485287967	0	6
state/NN/br-h03/1886	0.158378449017934	-0.323264010611522	state	NN	miscellaneous	non-fiction	A5	A	AB	ABC	Z	Z	Z	Z	Z	 the House of Representatives in the Congress of the United <font color=green>States</font> . Others may speak of Speaker Rayburn' S uniquely long and	1	0	0.971325350136361	0	2
state/NN/br-h03/305	-0.204841523352905	-0.0313422269869824	state	NN	miscellaneous	non-fiction	A5	A	AB	ABC	Z	Z	Z	Z	Z	 the beloved Speaker of all the people of the United <font color=green>States</font> . For the dignity, the influence, and the power of the	1	0	1.08991559444986	0	4
state/NN/br-h04/1044	0.0755370093669037	0.111860374017871	state	NN	miscellaneous	non-fiction	A2	A	AB	ABC	Z	Z	Z	Z	Z	 and in almost the same proportion to the increase of <font color=green>state</font>  employees. In the past twenty years the ratio of state-owned	2	1	1.01606474921946	0.5	7
state/NN/br-h04/1058	0.0501294790836016	0.100169902302115	state	NN	miscellaneous	non-fiction	A2	A	AB	ABC	Z	Z	Z	Z	Z	 the past twenty years the ratio of state-owned automobiles per <font color=green>state</font>  employees has varied from 1 to 22 then to 1	2	2	1.40920788559483	1	9
state/NN/br-h04/1129	0.0128382237234168	0.109527389818386	state	NN	miscellaneous	non-fiction	A2	A	AB	ABC	Z	Z	Z	Z	Z	 obscured, subsequent developments concerning the assignment, use, and management of <font color=green>state</font>  automobiles can be related more clearly. Prior to 1942, automobiles	3	3	1.29636095716673	1	8
state/NN/br-h04/120	0.0349068677054927	0.0414510068927503	state	NN	miscellaneous	non-fiction	A2	A	AB	ABC	Z	Z	Z	Z	Z	 in 1959 for an average .027 per mile. Purchase of <font color=green>state</font>  vehicles is handled similarly to all state purchases. Unit prices	3	2	1.44813939119663	0.666666666666667	8
state/NN/br-h04/1221	-0.0161371481584359	0.207261924686519	state	NN	miscellaneous	non-fiction	A1	A	AB	ABC	Z	Z	Z	Z	Z	 at war. Gasoline and automobile tires were rationed commodities. The <font color=green>state</font>  was confronted with transportation problems similar to those of the	3	3	1.13264417659904	1	5
state/NN/br-h04/1243	-0.0287465416574838	0.0754679827697493	state	NN	miscellaneous	non-fiction	A2	A	AB	ABC	Z	Z	Z	Z	Z	 individual. It met these problems by the creation of the <font color=green>state</font>  automobile maintenance unit( more popularly called the motor pool), a	3	3	1.01069280516457	1	9
state/NN/br-h04/1266	-0.0163301816972768	0.104257250106378	state	NN	miscellaneous	non-fiction	A2	A	AB	ABC	Z	Z	Z	Z	Z	 a centralized operation for the maintenance and control of all <font color=green>state</font>  transportation. The motor pool then, as now, had headquarter facilities	4	3	1.11305091702052	0.75	6
