id	model.x	model.y	lemma	pos	genre	broad_genre	marisense	mbroad	mari3	mari2	sensekey	wnsense	wnbroad	wn3	wn2	text	cues	cues_with_weight	mean_weight_x100	wcratio_x100	weighted_cw	wf
church/NN/br-a01/2073	-0.20543520532006	-0.12897608522964	church	NN	press_reportage	press	E	E	DE	CDE	church%1:04:00::	E	E	DE	CDE	 said.`` Being at the polls was just like being at <font color=green>church</font> . I did n't smell a drop of liquor, and we	1	0	230	0	3	church
church/NN/br-d01/1628	-0.268792160475085	-0.302221997193616	church	NN	religion	non-fiction	B	B	AB	AB	church%1:14:00::	B	B	AB	AB	 age to whip men into a surrender to a particular <font color=green>church</font>  or church-state''. Apparently he does not intend that those who	3	1	284	33	2	church
church/NN/br-d02/1641	0.0461948104291281	0.158154192769394	church	NN	religion	non-fiction	B	B	AB	AB	church%1:14:00::	B	B	AB	AB	 concerned to stand squarely within the tradition of the apostolic <font color=green>church</font> , they have exhibited no willingness whatever to sacrifice their modernity	2	1	284	50	3	church
church/NN/br-d02/706	-0.125861257578234	0.107234886105263	church	NN	religion	non-fiction	A	A	AB	AB	church%1:14:00::	B	B	AB	AB	 there tends to be an almost complete indifference to the <font color=green>church</font>  and its traditional message of sin and grace. To be	4	2	260	50	4	church
church/NN/br-d02/786	-0.0378318098910932	-0.207214284501279	church	NN	religion	non-fiction	A	A	AB	AB	church%1:14:00::	B	B	AB	AB	 longer afford the luxury of such smug indignation? Can the <font color=green>church</font>  risk assuming that the`` folly'' of men is as dear	3	0	280	0	3	church
church/NN/br-d02/877	-0.0247777902481807	0.151199893926576	church	NN	religion	non-fiction	A	A	AB	AB	church%1:14:00::	B	B	AB	AB	 precarious? There is an ancient and venerable tradition in the <font color=green>church</font> ( which derives, however, from the heritage of the Greeks rather	4	3	256	75	3	church
church/NN/br-d02/923	0.259754610963829	0.425067393313958	church	NN	religion	non-fiction	A	A	AB	AB	church%1:14:00::	B	B	AB	AB	 for accomplishing his work in the world. by analogy, the <font color=green>church</font>  also has been regarded as entirely independent of the`` world	3	0	314	0	1	church
church/NN/br-d02/949	-0.347667608072144	-0.369311765414048	church	NN	religion	non-fiction	A	A	AB	AB	church%1:14:00::	B	B	AB	AB	 of requiring nothing from it in order to be the <font color=green>church</font> . But, as Scripture everywhere reminds us, God does have need	2	0	299	0	1	church
church/NN/br-d02/969	-0.19990172188966	0.0651471537654181	church	NN	religion	non-fiction	A	A	AB	AB	church%1:14:00::	B	B	AB	AB	 us, God does have need of his creatures, and the <font color=green>church</font> , a fortiori, can ill afford to do without the talents	4	2	262	50	2	church
church/NN/br-d03/1080	0.0454402219441649	0.239471419159466	church	NN	religion	non-fiction	E	E	DE	CDE	church%1:04:00::	E	E	DE	CDE	 phenomenon of redundancy is that fewer Protestants are going to <font color=green>church</font> . It should be admitted, too, that there is a good	2	1	228	50	2	church
church/NN/br-d03/1342	-0.0317446070639078	0.069775569383945	church	NN	religion	non-fiction	E	E	DE	CDE	church%1:06:00::	D	D	DE	CDE	 my experience to find as many men as women in <font color=green>church</font> , and to hear almost everyone in church congregations reciting the	5	2	295	40	3	church
church/NN/br-d03/1350	-0.0188136478505156	0.0385603901465025	church	NN	religion	non-fiction	E	E	DE	CDE	church%1:06:00::	D	D	DE	CDE	 as women in church, and to hear almost everyone in <font color=green>church</font>  congregations reciting the Latin prayers and responses at Mass. They	5	4	282	80	7	church
church/NN/br-d03/1871	-0.0243302851154563	0.0843250658323622	church	NN	religion	non-fiction	B	B	AB	AB	catholic_church%1:14:00::	B1	B	AB	AB	 the Sunday Observer implies a kindly recognition that the Catholic <font color=green>Church</font>  is now at least of equal stature in England with	2	2	310	100	6	Church
church/NN/br-d03/1909	-0.0523668495907027	0.0749753473022548	church	NN	religion	non-fiction	B	B	AB	AB	church_of_england%1:14:00::	B2	B	AB	AB	 non-Catholic) wrote articles in the Observer depicting clergymen of the <font color=green>Church</font>  of England, the Church of Rome and the Nonconformist Church	6	2	286	33	4	Church
church/NN/br-d03/2097	-0.0308563643322603	0.104217745292639	church	NN	religion	non-fiction	A	A	AB	AB	church%1:14:00::	B	B	AB	AB	 Canterbury. The good feeling which exists between these two important <font color=green>church</font>  figures is now well known in England. The Holy Sacrifice	4	0	248	0	2	church
church/NN/br-d03/2336	-0.00106822997277898	0.0609237309932943	church	NN	religion	non-fiction	D	D	DE	CDE	catholic_church%1:14:00::	B1	B	AB	AB	 a votive Mass offered for Christian unity at a Catholic <font color=green>church</font>  in Slough during the Church Unity Octave.	2	1	299	50	6	church
church/NN/br-d03/2341	-0.00544819150952666	0.0774487406748779	church	NN	religion	non-fiction	A	A	AB	AB	church%1:14:00::	B	B	AB	AB	 Christian unity at a Catholic church in Slough during the <font color=green>Church</font>  Unity Octave.	2	1	317	50	5	Church
church/NN/br-d03/721	-0.130942375460759	0.16205094633171	church	NN	religion	non-fiction	B	B	AB	AB	church%1:06:00::	D	D	DE	CDE	 crowds going in and out of the Birmingham Oratory( Catholic) <font color=green>Church</font>  on Sunday mornings. She found this a marvel because, as	1	0	279	0	3	Church
church/NN/br-d03/862	0.00283617522394029	0.026396886856441	church	NN	religion	non-fiction	B	B	AB	AB	church_of_england%1:14:00::	B2	B	AB	AB	 to a newspaper report of the 1961 statistics of the <font color=green>Church</font>  of England, the`` total of confirmed members is 9748000, but	3	2	258	67	4	Church
church/NN/br-d03/883	-0.0427421396328006	0.255901902370232	church	NN	religion	non-fiction	C	C	C	CDE	church_roll%1:10:00::	C	C	C	CDE	 is 9748000, but only 2887671 are registered on the parochial <font color=green>church</font>  rolls'', and`` over 27 million people in England are baptized	4	3	255	75	3	church
church/NN/br-d03/899	-0.0619031994793591	0.130266846307558	church	NN	religion	non-fiction	B	B	AB	AB	church_of_england%1:14:00::	B2	B	AB	AB	 over 27 million people in England are baptized into the <font color=green>Church</font>  of England, but roughly only a tenth of them continue	3	2	282	67	3	Church
church/NN/br-d03/945	8.23753498259794e-07	0.094829049063381	church	NN	religion	non-fiction	B	B	AB	AB	church_of_england%1:14:00::	B2	B	AB	AB	 than an Archbishops' Commission`` reported last month that in the <font color=green>Church</font>  of England alone there are 790 churches which are redundant	1	0	272	0	2	Church
church/NN/br-d04/56	0.0670646687689875	0.161204988332546	church	NN	religion	non-fiction	A	A	AB	AB	church_father%1:18:00::	A	A	AB	AB	 Jesus Christ the unique and the universal concur. Perhaps no <font color=green>church</font>  father saw this concurrence of the unique and the universal	4	5	247	125	5	church
church/NN/br-f15/713	0.00365887961827169	0.238917908501785	church	NN	popular_lore	fiction	B	B	AB	AB	roman_catholic_church%1:14:00::	B1	B	AB	AB	 permit birth control only for medical reasons. The Roman Catholic <font color=green>Church</font> , however, sanctions a much more liberal policy on family planning	5	2	387	40	2	Church
church/NN/br-f15/754	0.0217378434125354	0.137441917999122	church	NN	popular_lore	fiction	B	B	AB	AB	roman_catholic_church%1:14:00::	B1	B	AB	AB	 disagree over the methods to be used. The Roman Catholic <font color=green>Church</font>  sanctions only abstention or the rhythm method, also known as	1	0	321	0	4	Church
church/NN/br-f15/776	0.32786583239595	0.319517072954296	church	NN	popular_lore	fiction	A	A	AB	AB	roman_catholic_church%1:14:00::	B1	B	AB	AB	 as the use of the infertile or safe period. The <font color=green>Church</font>  considers this to be the method provided by nature and	3	1	277	33	1	Church
church/NN/br-f15/862	-0.0517966471257899	0.406824795541594	church	NN	popular_lore	fiction	A	A	AB	AB	roman_catholic_church%1:14:00::	B1	B	AB	AB	 there seems little chance of agreement. The grounds for the <font color=green>Church</font>  's position are Scriptural( Old Testament), the teachings of the	3	1	238	33	1	Church
church/NN/br-f15/882	0.0801420991055964	0.270331223269112	church	NN	popular_lore	fiction	A	A	AB	AB	roman_catholic_church%1:14:00::	B1	B	AB	AB	 the teachings of the fathers and doctors of the early <font color=green>Church</font> , the unbroken tradition of nineteen centuries, the decisions of the	4	1	248	25	1	Church
church/NN/br-f44/1076	0.0674470173988487	0.121027548384539	church	NN	popular_lore	fiction	C	C	C	CDE	church%1:14:00::	B	B	AB	AB	 and economic level of the congregation; the mission of the <font color=green>church</font>  is actually a process of informal co-optation; the lay ministry	5	2	288	40	3	church
church/NN/br-f44/1285	0.0899305830025239	0.0925420681840206	church	NN	popular_lore	fiction	C	C	C	CDE	church%1:14:00::	B	B	AB	AB	 co-optation is the principal form of mission in the contemporary <font color=green>church</font> ; economic integration and co-optation are the two methods by which	3	1	289	33	2	church
church/NN/br-f44/1618	0.123628233921233	0.179966437314742	church	NN	popular_lore	fiction	C	C	C	CDE	church%1:14:00::	B	B	AB	AB	 in the metropolis. It now becomes evident that the denominational <font color=green>church</font>  is intimately involved with the economy of middle-class culture, for	5	1	231	20	2	church
church/NN/br-f44/2150	0.104228470870024	0.0792175576337674	church	NN	popular_lore	fiction	C	C	C	CDE	church%1:14:00::	B	B	AB	AB	 will occupy our attention under the rubric of the organization <font color=green>church</font> . An understanding of the new role of residential association in	3	1	226	33	2	church
church/NN/br-f44/368	-0.035746365702166	0.0281590470151528	church	NN	popular_lore	fiction	C	C	C	CDE	church%1:14:00::	B	B	AB	AB	 they can lose higher- and lower status members from the <font color=green>church</font>  without collapsing, but they need adequate recruits for the core	3	1	282	33	2	church
church/NN/br-f44/647	-0.024433129465696	0.050610119022167	church	NN	popular_lore	fiction	A	A	AB	AB	church%1:14:00::	B	B	AB	AB	 denominations. There is much talk in theological circles about the`` <font color=green>Church</font>  as Mission'' and the`` Church 's Mission''; theologians have been	4	4	299	100	5	Church
church/NN/br-f44/654	-0.0379691320634611	0.073070223422785	church	NN	popular_lore	fiction	A	A	AB	AB	church%1:14:00::	B	B	AB	AB	 in theological circles about the`` Church as Mission'' and the`` <font color=green>Church</font>  's Mission''; theologians have been stressing the fact that the	4	2	329	50	3	Church
church/NN/br-f44/667	-0.429760896483439	0.212567196867314	church	NN	popular_lore	fiction	A	A	AB	AB	church%1:14:00::	B	B	AB	AB	 's Mission''; theologians have been stressing the fact that the <font color=green>Church</font>  does not exist for its own sake but as a	4	1	253	25	1	Church
church/NN/br-f44/924	0.0383175824268378	0.0405725846733657	church	NN	popular_lore	fiction	C	C	C	CDE	church%1:14:00::	B	B	AB	AB	 with friendly members the`` contacts with an organization of the <font color=green>church</font> ''( 11.2 per cent of the cases), then a substantial two	3	3	249	100	4	church
church/NN/br-f44/986	-0.036033877489628	0.00287461686505749	church	NN	popular_lore	fiction	C	C	C	CDE	church%1:14:00::	B	B	AB	AB	 people; the new people respond in kind by joining the <font color=green>church</font> . Missionary outreach by friendly contact looks somewhat different when one	4	2	228	50	3	church
church/NN/br-g12/1271	-0.182093661164106	0.182088259198587	church	NN	belles_lettres	fiction	D	D	DE	CDE	church%1:06:00::	D	D	DE	CDE	 and gestured toward the Madeleine. The classical lines of the <font color=green>church</font>  which Napoleon thought of as a Temple of Glory, dominated	5	2	271	40	3	church
church/NN/br-g12/1807	-0.214754615283872	0.312691799201184	church	NN	belles_lettres	fiction	D	D	DE	CDE	church%1:06:00::	D	D	DE	CDE	 not attractive, but it is deeper. When you pass a <font color=green>church</font>  on an Irish bus, all the hands flurry in the	2	0	226	0	1	church
church/NN/br-g12/544	-0.325079593162239	-0.108362347412176	church	NN	belles_lettres	fiction	D	D	DE	CDE	church%1:06:00::	D	D	DE	CDE	 the Madeleine and across to a sidewalk cafe opposite that <font color=green>church</font> . The conversation that ensued may have been engrossing but it	4	2	241	50	3	church
church/NN/br-h17/1199	0.19410129167616	-0.372795432764178	church	NN	miscellaneous	non-fiction	C	C	C	CDE	church%1:14:00::	B	B	AB	AB	 because of his willingness to kill in defense of his <font color=green>church</font>  and home. Upon administrative approval of the reclassification, he was	2	0	366	0	1	church
church/NN/br-h17/1434	0.162365962639314	0.0632633479058208	church	NN	miscellaneous	non-fiction	C	C	C	CDE	church%1:14:00::	B	B	AB	AB	 preaching and from 20 to 25 hours per month to <font color=green>church</font>  activities. His claim was therefore`` so highly exaggerated'', the Department	1	1	244	100	2	church
church/NN/br-j23/1105	0.0649733467302206	0.0498895151712732	church	NN	learned	non-fiction	C	C	C	CDE	church_member%1:18:00::	C	C	C	CDE	 which is reflective of our common religion. Even the non <font color=green>church</font>  members- the freewheelers, marginal religionists and so on- have the	2	1	252	50	2	church
church/NN/br-j57/2237	0.0700018206836443	0.322604882218346	church	NN	learned	non-fiction	A	A	AB	AB	church_father%1:18:00::	A	A	AB	AB	 which reached Christianity by the way of Stoicism through the <font color=green>Church</font>  Fathers of Late Antiquity.	3	1	306	33	1	Church
church/NN/br-j57/958	0.0476361189018743	0.313676819725524	church	NN	learned	non-fiction	A	A	AB	AB	church_father%1:18:00::	A	A	AB	AB	 all possessions. This conception was taken up by the early <font color=green>Church</font>  Fathers and by canon lawyers and theologians in the Middle	5	1	246	20	2	Church
church/NN/br-j58/1496	0.168935428271206	-0.160136690819173	church	NN	learned	non-fiction	D	D	DE	CDE	church_bell%1:06:00::	D	D	DE	CDE	 In many Northern towns and cities meetings were held and <font color=green>church</font>  bells were tolled. Such was not the case in Rhode	4	0	216	0	2	church
church/NN/br-k04/1076	-0.0394398803473436	-0.0671982732630056	church	NN	fiction_gral	fiction	D	D	DE	CDE	church%1:06:00::	D	D	DE	CDE	 There were two liquor saloons not very far from the <font color=green>church</font> , one white, that is conducted for white people with a	4	1	231	25	3	church
church/NN/br-k04/1117	-0.303438717055595	-0.0309419052851408	church	NN	fiction_gral	fiction	D	D	DE	CDE	church%1:06:00::	D	D	DE	CDE	 of gambling in both. On the other side of the <font color=green>church</font>  was a quiet, well-kept house with shutters and recently painted	4	0	292	0	2	church
church/NN/br-k04/1145	-0.252333983603809	-0.400714003637305	church	NN	fiction_gral	fiction	C	C	C	CDE	church%1:14:00::	B	B	AB	AB	 it. It was called Kent House. The deacon of the <font color=green>church</font> , Carlson, was its janitor. One of the leading members of	3	0	273	0	1	church
church/NN/br-k04/1419	-0.063913493137232	-0.15244714122666	church	NN	fiction_gral	fiction	C	C	C	CDE	church%1:06:00::	D	D	DE	CDE	 stress, and that was that the contribution to the general <font color=green>church</font>  expenses, the dollar money, had been seriously falling behind in	3	0	240	0	2	church
church/NN/br-k04/1433	-0.063913493137232	-0.15244714122666	church	NN	fiction_gral	fiction	C	C	C	CDE	church%1:06:00::	D	D	DE	CDE	 the dollar money, had been seriously falling behind in this <font color=green>church</font> , and that must be looked after immediately. In fact, he	1	0	240	0	2	church
church/NN/br-k04/1485	-0.0063205759668127	0.0527273974413721	church	NN	fiction_gral	fiction	C	C	C	CDE	church%1:06:00::	D	D	DE	CDE	 that clear as this was, they must have a better <font color=green>church</font> , a more business-like conduct of the church organization, and an	2	1	301	50	3	church
church/NN/br-k04/1493	0.00680506098026192	0.0449851739076405	church	NN	fiction_gral	fiction	C	C	C	CDE	church%1:14:00::	B	B	AB	AB	 have a better church, a more business-like conduct of the <font color=green>church</font>  organization, and an effort to get this religious center out	4	2	277	50	4	church
church/NN/br-k04/1514	0.0891581990121192	0.0697942604973135	church	NN	fiction_gral	fiction	C	C	C	CDE	church%1:14:00::	B	B	AB	AB	 out of its rut of wild worship into a modern <font color=green>church</font>  organization. He emphasized to the Presiding Elder the plan of	5	2	271	40	3	church
church/NN/br-k04/1634	-0.146568559411757	-0.09636740535266	church	NN	fiction_gral	fiction	D	D	DE	CDE	church%1:06:00::	D	D	DE	CDE	 to colored folk. When it was proposed to rebuild the <font color=green>church</font> , Wilson found that the terms for a new mortgage were	2	0	226	0	2	church
church/NN/br-k04/1685	0.21871800147084	0.200402436255644	church	NN	fiction_gral	fiction	D	D	DE	CDE	church%1:06:00::	D	D	DE	CDE	 made to his Deacon Board, he met unanimous opposition. The <font color=green>church</font>  certainly would not be removed. The very proposition was sacrilege	3	0	272	0	2	church
church/NN/br-k04/1807	-0.226557379170557	-0.0666230272219562	church	NN	fiction_gral	fiction	D	D	DE	CDE	church%1:06:00::	D	D	DE	CDE	 of money that has been invested by whites around that <font color=green>church</font> ? Tenements, stores, saloons, some gambling, I hope not too much	5	1	290	20	2	church
church/NN/br-k04/1874	-0.306939165160623	0.124019548092353	church	NN	fiction_gral	fiction	D	D	DE	CDE	church%1:06:00::	D	D	DE	CDE	 were you I would just plan to repair the old <font color=green>church</font>  so it would last for five or ten years. By	3	2	243	67	2	church
church/NN/br-k04/2301	0.0476549429881273	0.181655957499857	church	NN	fiction_gral	fiction	B	B	AB	AB	methodist_church%1:14:00::	B2	B	AB	AB	 mean practically the end of his career in the Methodist <font color=green>church</font> , if not in all churches.	3	1	251	33	1	church
church/NN/br-k04/356	-0.130534696042075	-0.0527311138092141	church	NN	fiction_gral	fiction	C	C	C	CDE	church%1:06:00::	D	D	DE	CDE	 with the whites, especially the rich who partly supported the <font color=green>church</font> . The Deacon Board, headed by a black man named Carlson	7	2	221	29	3	church
church/NN/br-k04/397	-0.0241908484817642	0.0268695941351326	church	NN	fiction_gral	fiction	C	C	C	CDE	church%1:06:00::	D	D	DE	CDE	 support of the Amen corner. The characteristic thing about this <font color=green>church</font>  was its Amen corner and the weekly religious orgy. A	4	4	219	100	4	church
church/NN/br-k04/828	-0.0284680545532983	0.00908090065016089	church	NN	fiction_gral	fiction	C	C	C	CDE	church%1:14:00::	B	B	AB	AB	 the home of one of the old members of the <font color=green>church</font> , a woman named Catt who, as Wilson afterward found, was	2	1	253	50	2	church
church/NN/br-k04/877	-0.0472463652852636	-0.0351577256836345	church	NN	fiction_gral	fiction	C	C	C	CDE	church%1:14:00::	B	B	AB	AB	 never married, conducting a spotless home and devoted to her <font color=green>church</font> , but a perpetual dissenter and born critic. She soared over	2	1	237	50	4	church
church/NN/br-k04/923	-0.157629952653581	-0.0470979503965259	church	NN	fiction_gral	fiction	D	D	DE	CDE	church%1:06:00::	D	D	DE	CDE	 which she was chief repository. Then Wilson looked over the <font color=green>church</font>  and studied its condition. The salary of the pastor had	3	1	259	33	3	church
church/NN/br-k04/975	-0.337394445721698	-0.128879448901974	church	NN	fiction_gral	fiction	D	D	DE	CDE	church%1:06:00::	D	D	DE	CDE	 he mentioned this to the Deacons they said nothing. The <font color=green>church</font>  itself must be repaired. It was dirty and neglected. It	3	2	258	67	2	church
church/NN/br-k06/1056	-0.307964809832961	0.296354516321654	church	NN	fiction_gral	fiction	D	D	DE	CDE	church%1:06:00::	D	D	DE	CDE	 northward to Brooklyn, below Point Peter, he could see the <font color=green>church</font>  spire wherever he looked back. Sometimes they went south and	5	0	211	0	1	church
church/NN/br-k06/1473	-0.324639347613853	-0.209855540224193	church	NN	fiction_gral	fiction	D	D	DE	CDE	church%1:06:00::	D	D	DE	CDE	 hands tucked under his coattails, and staring into the dark <font color=green>church</font> . The figure was wreathed in an extraordinary luminescence. The boy	3	0	217	0	1	church
church/NN/br-k06/528	-0.325402598293074	-0.091341505448036	church	NN	fiction_gral	fiction	D	D	DE	CDE	church%1:06:00::	D	D	DE	CDE	 his head out. There was the slate roof of the <font color=green>church</font> ; ivy climbed the red brick walls like a green scaled	5	1	263	20	2	church
church/NN/br-k06/571	-0.359038406465237	0.00543986749129242	church	NN	fiction_gral	fiction	D	D	DE	CDE	church%1:06:00::	D	D	DE	CDE	 cupboards.`` There 's a tower and a steeple on the <font color=green>church</font>  a million feet high. And the loudest clock in the	3	2	354	67	2	church
church/NN/br-k06/659	-0.148621547065095	-0.218462538724214	church	NN	fiction_gral	fiction	D	D	DE	CDE	church%1:06:00::	D	D	DE	CDE	 Street to Orange Square. The steeple leaned backward, while the <font color=green>church</font>  advanced like a headless creature in a long, shapeless coat	5	0	245	0	2	church
church/NN/br-k06/852	-0.291763276240702	0.0488402038682997	church	NN	fiction_gral	fiction	D	D	DE	CDE	church%1:06:00::	D	D	DE	CDE	 Church with its high steeple and clock. There was no <font color=green>church</font>  like Drew Church, no preacher like Papa, who was intimate	3	1	274	33	3	church
church/NN/br-k10/1423	-0.318325773758179	0.35158967688595	church	NN	fiction_gral	fiction	A	A	AB	AB	church%1:14:00::	B	B	AB	AB	 economics, and social issues that are no concern of the <font color=green>Church</font> ''? And John 's reply was always the same:`` Anything that	5	0	333	0	1	Church
church/NN/br-k10/1445	-0.352628775613826	0.208817329663254	church	NN	fiction_gral	fiction	A	A	AB	AB	church%1:14:00::	B	B	AB	AB	 same:`` Anything that affects souls is the concern of the <font color=green>Church</font> ! We will have righteousness''! Tears burned behind his eyes as	3	1	292	33	2	Church
church/NN/br-k10/1802	-0.158665336319262	0.27970086672012	church	NN	fiction_gral	fiction	B	B	AB	AB	church_of_rome%1:14:00::	B1	B	AB	AB	 Geneva, saying that he had been a bishop of the <font color=green>Church</font>  of Rome and had been persecuted in Paris for his	2	1	283	50	1	Church
church/NN/br-k10/205	0.230584349053138	-0.354474625123724	church	NN	fiction_gral	fiction	A	A	AB	AB	church%1:14:00::	B	B	AB	AB	 that the couple would have to be punished if the <font color=green>Church</font>  was to be respected.`` I have told you before, and	2	1	265	50	1	Church
church/NN/br-k10/257	-0.120804937137312	0.34081373662425	church	NN	fiction_gral	fiction	A	A	AB	AB	church%1:14:00::	B	B	AB	AB	 is the answer the ungodly will always make when the <font color=green>Church</font>  points its fingers at their sins. I say to you	3	1	274	33	1	Church
church/NN/br-k10/271	-0.195149177124548	0.128457336949479	church	NN	fiction_gral	fiction	A	A	AB	AB	church%1:14:00::	B	B	AB	AB	 fingers at their sins. I say to you that the <font color=green>Church</font>  will ever decry evil''! John 's reply was like a	3	2	297	67	3	Church
church/NN/br-k10/588	-0.14328540551026	0.198282273600108	church	NN	fiction_gral	fiction	A	A	AB	AB	church%1:14:00::	B	B	AB	AB	 to let them give him the last rites of the <font color=green>Church</font> , but he had died still proclaiming salvation by faith. Burial	3	1	315	33	3	Church
church/NN/br-k10/967	-0.356714311226425	-0.0446573951844287	church	NN	fiction_gral	fiction	D	D	DE	CDE	church%1:06:00::	D	D	DE	CDE	 all the time. Quickening his steps, John entered the vast <font color=green>church</font>  and climbed the tower steps to the bells. Underneath the	6	2	324	33	2	church
church/NN/br-k13/533	-0.248205956817419	-0.00800586005259442	church	NN	fiction_gral	fiction	D	D	DE	CDE	church%1:06:00::	D	D	DE	CDE	 Harold indicated the photograph on the wall and asked what <font color=green>church</font>  the stone sculpture was in. Eugene told him and he	3	2	244	67	4	church
church/NN/br-k14/826	-0.0205483613703309	-0.451691543557967	church	NN	fiction_gral	fiction	D	D	DE	CDE	church%1:06:00::	D	D	DE	CDE	 Jewish section was in Trastevere, near the Tiber at the <font color=green>church</font>  of San Francesco a Ripa. The colony had been small	4	0	261	0	1	church
church/NN/br-k15/188	-0.17396696453127	-0.0249008031162629	church	NN	fiction_gral	fiction	D	D	DE	CDE	church%1:06:00::	D	D	DE	CDE	 They held the funeral the next morning from the crossroads <font color=green>church</font>  and buried the little box in the quiet family plot	6	4	265	67	5	church
church/NN/br-k16/1431	-0.503504053500396	-0.0518803457007334	church	NN	fiction_gral	fiction	D	D	DE	CDE	church%1:06:00::	D	D	DE	CDE	 thickets. Along Wappinger Creek in Dutchess County, past the white <font color=green>church</font>  at Fishkill, past Verplanck 's Point on the east bank	6	1	309	17	1	church
church/NN/br-k16/2285	-0.293785406964007	-0.00827829935732741	church	NN	fiction_gral	fiction	E	E	DE	CDE	church_service%1:04:00::	E	E	DE	CDE	 him out of some dim corner of memory from a <font color=green>church</font>  service when he was a boy- yes, in a white	1	0	244	0	2	church
church/NN/br-k19/213	-0.0554219637721671	-0.0991936780517671	church	NN	fiction_gral	fiction	A	A	AB	AB	church%1:14:00::	B	B	AB	AB	 of this desire was due to his devotion to the <font color=green>church</font>  and how much was his own ego, demanding to be	1	1	250	100	3	church
