id	model.x	model.y	lemma	pos	sensekey	marisense	mbroad	wnbroad	mari2	mari3	wn2	wn3	wnsense	text
church/NN/br-a01/2073	-0.139073563598229	0.34740626144679	church	NN	church%1:04:00::	E	E	E	CDE	DE	CDE	DE	E	 said.`` Being at the polls was just like being at <font color=green>church</font> . I did n't smell a drop of liquor, and we
church/NN/br-d01/1628	-0.285533032365807	-0.15559579187754	church	NN	church%1:14:00::	B	B	B	AB	AB	AB	AB	B	 age to whip men into a surrender to a particular <font color=green>church</font>  or church-state''. Apparently he does not intend that those who
church/NN/br-d02/1641	0.132276921178868	-0.364232840770759	church	NN	church%1:14:00::	B	B	B	AB	AB	AB	AB	B	 concerned to stand squarely within the tradition of the apostolic <font color=green>church</font> , they have exhibited no willingness whatever to sacrifice their modernity
church/NN/br-d02/706	0.00949932829618448	-0.244378879444016	church	NN	church%1:14:00::	A	A	B	AB	AB	AB	AB	B	 there tends to be an almost complete indifference to the <font color=green>church</font>  and its traditional message of sin and grace. To be
church/NN/br-d02/786	-0.240883444820947	-0.166990189423895	church	NN	church%1:14:00::	A	A	B	AB	AB	AB	AB	B	 longer afford the luxury of such smug indignation? Can the <font color=green>church</font>  risk assuming that the`` folly'' of men is as dear
church/NN/br-d02/877	-0.281315783055632	-0.0779473146382183	church	NN	church%1:14:00::	A	A	B	AB	AB	AB	AB	B	 precarious? There is an ancient and venerable tradition in the <font color=green>church</font> ( which derives, however, from the heritage of the Greeks rather
church/NN/br-d02/923	0.261474756748082	-0.335789854397975	church	NN	church%1:14:00::	A	A	B	AB	AB	AB	AB	B	 for accomplishing his work in the world. by analogy, the <font color=green>church</font>  also has been regarded as entirely independent of the`` world
church/NN/br-d02/949	-0.175270478405475	0.445100993303046	church	NN	church%1:14:00::	A	A	B	AB	AB	AB	AB	B	 of requiring nothing from it in order to be the <font color=green>church</font> . But, as Scripture everywhere reminds us, God does have need
church/NN/br-d02/969	-0.172601987085776	-0.276891406399874	church	NN	church%1:14:00::	A	A	B	AB	AB	AB	AB	B	 us, God does have need of his creatures, and the <font color=green>church</font> , a fortiori, can ill afford to do without the talents
church/NN/br-d03/1080	-0.0745757117757851	0.169503048092946	church	NN	church%1:04:00::	E	E	E	CDE	DE	CDE	DE	E	 phenomenon of redundancy is that fewer Protestants are going to <font color=green>church</font> . It should be admitted, too, that there is a good
church/NN/br-d03/1342	-0.0431477912128367	-0.0115086274726233	church	NN	church%1:06:00::	E	E	D	CDE	DE	CDE	DE	D	 my experience to find as many men as women in <font color=green>church</font> , and to hear almost everyone in church congregations reciting the
church/NN/br-d03/1350	-0.0178491344440102	-0.0174356396732117	church	NN	church%1:06:00::	E	E	D	CDE	DE	CDE	DE	D	 as women in church, and to hear almost everyone in <font color=green>church</font>  congregations reciting the Latin prayers and responses at Mass. They
church/NN/br-d03/1871	-0.035287645103158	-0.0322560260769406	church	NN	catholic_church%1:14:00::	B	B	B	AB	AB	AB	AB	B1	 the Sunday Observer implies a kindly recognition that the Catholic <font color=green>Church</font>  is now at least of equal stature in England with
church/NN/br-d03/1909	-0.05783864696366	0.0124375474815989	church	NN	church_of_england%1:14:00::	B	B	B	AB	AB	AB	AB	B2	 non-Catholic) wrote articles in the Observer depicting clergymen of the <font color=green>Church</font>  of England, the Church of Rome and the Nonconformist Church
church/NN/br-d03/2097	-0.0821993635375827	0.0417922587589616	church	NN	church%1:14:00::	A	A	B	AB	AB	AB	AB	B	 Canterbury. The good feeling which exists between these two important <font color=green>church</font>  figures is now well known in England. The Holy Sacrifice
church/NN/br-d03/2336	-0.0261497613559751	-0.0152271018940756	church	NN	catholic_church%1:14:00::	D	D	B	CDE	DE	AB	AB	B1	 a votive Mass offered for Christian unity at a Catholic <font color=green>church</font>  in Slough during the Church Unity Octave.
church/NN/br-d03/2341	-0.0261497613559751	-0.0152271018940756	church	NN	church%1:14:00::	A	A	B	AB	AB	AB	AB	B	 Christian unity at a Catholic church in Slough during the <font color=green>Church</font>  Unity Octave.
church/NN/br-d03/721	-0.205667913244961	0.0629659786697439	church	NN	church%1:06:00::	B	B	D	AB	AB	CDE	DE	D	 crowds going in and out of the Birmingham Oratory( Catholic) <font color=green>Church</font>  on Sunday mornings. She found this a marvel because, as
church/NN/br-d03/862	-0.00380518535983671	0.0388838076613778	church	NN	church_of_england%1:14:00::	B	B	B	AB	AB	AB	AB	B2	 to a newspaper report of the 1961 statistics of the <font color=green>Church</font>  of England, the`` total of confirmed members is 9748000, but
church/NN/br-d03/883	-0.217420519650093	0.128849012678287	church	NN	church_roll%1:10:00::	C	C	C	CDE	C	CDE	C	C	 is 9748000, but only 2887671 are registered on the parochial <font color=green>church</font>  rolls'', and`` over 27 million people in England are baptized
church/NN/br-d03/899	-0.0740883443094037	0.0252344416389693	church	NN	church_of_england%1:14:00::	B	B	B	AB	AB	AB	AB	B2	 over 27 million people in England are baptized into the <font color=green>Church</font>  of England, but roughly only a tenth of them continue
church/NN/br-d03/945	-0.0192933440448113	0.0269806587057881	church	NN	church_of_england%1:14:00::	B	B	B	AB	AB	AB	AB	B2	 than an Archbishops' Commission`` reported last month that in the <font color=green>Church</font>  of England alone there are 790 churches which are redundant
church/NN/br-d04/56	0.274724767372502	-0.246483751414895	church	NN	church_father%1:18:00::	A	A	A	AB	AB	AB	AB	A	 Jesus Christ the unique and the universal concur. Perhaps no <font color=green>church</font>  father saw this concurrence of the unique and the universal
church/NN/br-f15/713	-0.0575824756646918	-0.0653505174765944	church	NN	roman_catholic_church%1:14:00::	B	B	B	AB	AB	AB	AB	B1	 permit birth control only for medical reasons. The Roman Catholic <font color=green>Church</font> , however, sanctions a much more liberal policy on family planning
church/NN/br-f15/754	-0.00457315248323121	-0.0168661855250977	church	NN	roman_catholic_church%1:14:00::	B	B	B	AB	AB	AB	AB	B1	 disagree over the methods to be used. The Roman Catholic <font color=green>Church</font>  sanctions only abstention or the rhythm method, also known as
church/NN/br-f15/776	-0.0353958151358849	0.418453713421748	church	NN	roman_catholic_church%1:14:00::	A	A	B	AB	AB	AB	AB	B1	 as the use of the infertile or safe period. The <font color=green>Church</font>  considers this to be the method provided by nature and
church/NN/br-f44/1076	0.05951869465539	-0.00312384957033513	church	NN	church%1:14:00::	C	C	B	CDE	C	AB	AB	B	 and economic level of the congregation; the mission of the <font color=green>church</font>  is actually a process of informal co-optation; the lay ministry
church/NN/br-f44/1285	0.0690675398038503	0.00329541665186183	church	NN	church%1:14:00::	C	C	B	CDE	C	AB	AB	B	 co-optation is the principal form of mission in the contemporary <font color=green>church</font> ; economic integration and co-optation are the two methods by which
church/NN/br-f44/1618	0.00381611499143161	0.266950120785442	church	NN	church%1:14:00::	C	C	B	CDE	C	AB	AB	B	 in the metropolis. It now becomes evident that the denominational <font color=green>church</font>  is intimately involved with the economy of middle-class culture, for
church/NN/br-f44/2150	0.122159790580468	0.0787611945258356	church	NN	church%1:14:00::	C	C	B	CDE	C	AB	AB	B	 will occupy our attention under the rubric of the organization <font color=green>church</font> . An understanding of the new role of residential association in
church/NN/br-f44/368	0.0013833391557704	0.0755218667337837	church	NN	church%1:14:00::	C	C	B	CDE	C	AB	AB	B	 they can lose higher- and lower status members from the <font color=green>church</font>  without collapsing, but they need adequate recruits for the core
church/NN/br-f44/647	-0.0178994993096073	-0.0157927232359096	church	NN	church%1:14:00::	A	A	B	AB	AB	AB	AB	B	 denominations. There is much talk in theological circles about the`` <font color=green>Church</font>  as Mission'' and the`` Church 's Mission''; theologians have been
church/NN/br-f44/654	-0.0366591749339011	-0.0110957134814444	church	NN	church%1:14:00::	A	A	B	AB	AB	AB	AB	B	 in theological circles about the`` Church as Mission'' and the`` <font color=green>Church</font>  's Mission''; theologians have been stressing the fact that the
church/NN/br-f44/667	-0.327912065232675	-0.29073710587497	church	NN	church%1:14:00::	A	A	B	AB	AB	AB	AB	B	 's Mission''; theologians have been stressing the fact that the <font color=green>Church</font>  does not exist for its own sake but as a
church/NN/br-f44/924	0.0410676915602544	0.0433660117847547	church	NN	church%1:14:00::	C	C	B	CDE	C	AB	AB	B	 with friendly members the`` contacts with an organization of the <font color=green>church</font> ''( 11.2 per cent of the cases), then a substantial two
church/NN/br-g12/1271	-0.138641606256559	-0.24164965592181	church	NN	church%1:06:00::	D	D	D	CDE	DE	CDE	DE	D	 and gestured toward the Madeleine. The classical lines of the <font color=green>church</font>  which Napoleon thought of as a Temple of Glory, dominated
church/NN/br-g12/544	-0.342666276626807	0.135873155852051	church	NN	church%1:06:00::	D	D	D	CDE	DE	CDE	DE	D	 the Madeleine and across to a sidewalk cafe opposite that <font color=green>church</font> . The conversation that ensued may have been engrossing but it
church/NN/br-h17/1199	0.132276921178868	-0.364232840770759	church	NN	church%1:14:00::	C	C	B	CDE	C	AB	AB	B	 because of his willingness to kill in defense of his <font color=green>church</font>  and home. Upon administrative approval of the reclassification, he was
church/NN/br-h17/1434	0.289609948443178	-0.201805779860496	church	NN	church%1:14:00::	C	C	B	CDE	C	AB	AB	B	 preaching and from 20 to 25 hours per month to <font color=green>church</font>  activities. His claim was therefore`` so highly exaggerated'', the Department
church/NN/br-j23/1105	0.0191498070916672	0.0841745825079178	church	NN	church_member%1:18:00::	C	C	C	CDE	C	CDE	C	C	 which is reflective of our common religion. Even the non <font color=green>church</font>  members- the freewheelers, marginal religionists and so on- have the
church/NN/br-j57/2237	0.0430137030085531	-0.233807992712082	church	NN	church_father%1:18:00::	A	A	A	AB	AB	AB	AB	A	 which reached Christianity by the way of Stoicism through the <font color=green>Church</font>  Fathers of Late Antiquity.
church/NN/br-j57/958	-0.344873506477871	0.245758781246489	church	NN	church_father%1:18:00::	A	A	A	AB	AB	AB	AB	A	 all possessions. This conception was taken up by the early <font color=green>Church</font>  Fathers and by canon lawyers and theologians in the Middle
church/NN/br-k04/1076	-0.139073563598229	0.34740626144679	church	NN	church%1:06:00::	D	D	D	CDE	DE	CDE	DE	D	 There were two liquor saloons not very far from the <font color=green>church</font> , one white, that is conducted for white people with a
church/NN/br-k04/1117	-0.400309214976314	0.186481214687583	church	NN	church%1:06:00::	D	D	D	CDE	DE	CDE	DE	D	 of gambling in both. On the other side of the <font color=green>church</font>  was a quiet, well-kept house with shutters and recently painted
church/NN/br-k04/1145	-0.194289630184962	-0.387021142398284	church	NN	church%1:14:00::	C	C	B	CDE	C	AB	AB	B	 it. It was called Kent House. The deacon of the <font color=green>church</font> , Carlson, was its janitor. One of the leading members of
church/NN/br-k04/1485	-0.00443899888498925	0.00402495662660902	church	NN	church%1:06:00::	C	C	D	CDE	C	CDE	DE	D	 that clear as this was, they must have a better <font color=green>church</font> , a more business-like conduct of the church organization, and an
church/NN/br-k04/1493	-0.00443899888498925	0.00402495662660902	church	NN	church%1:14:00::	C	C	B	CDE	C	AB	AB	B	 have a better church, a more business-like conduct of the <font color=green>church</font>  organization, and an effort to get this religious center out
church/NN/br-k04/1514	0.0957884241497753	-0.00373636460074552	church	NN	church%1:14:00::	C	C	B	CDE	C	AB	AB	B	 out of its rut of wild worship into a modern <font color=green>church</font>  organization. He emphasized to the Presiding Elder the plan of
church/NN/br-k04/1685	0.298421372436653	-0.306748801671042	church	NN	church%1:06:00::	D	D	D	CDE	DE	CDE	DE	D	 made to his Deacon Board, he met unanimous opposition. The <font color=green>church</font>  certainly would not be removed. The very proposition was sacrilege
church/NN/br-k04/1807	-0.400309214976314	0.186481214687583	church	NN	church%1:06:00::	D	D	D	CDE	DE	CDE	DE	D	 of money that has been invested by whites around that <font color=green>church</font> ? Tenements, stores, saloons, some gambling, I hope not too much
church/NN/br-k04/1874	-0.244541678975519	0.329753267137123	church	NN	church%1:06:00::	D	D	D	CDE	DE	CDE	DE	D	 were you I would just plan to repair the old <font color=green>church</font>  so it would last for five or ten years. By
church/NN/br-k04/2301	-0.0186791054559019	0.0537337311114756	church	NN	methodist_church%1:14:00::	B	B	B	AB	AB	AB	AB	B2	 mean practically the end of his career in the Methodist <font color=green>church</font> , if not in all churches.
church/NN/br-k04/397	-0.20022123126548	0.359276076198368	church	NN	church%1:06:00::	C	C	D	CDE	C	CDE	DE	D	 support of the Amen corner. The characteristic thing about this <font color=green>church</font>  was its Amen corner and the weekly religious orgy. A
church/NN/br-k04/828	0.0191498070916672	0.0841745825079178	church	NN	church%1:14:00::	C	C	B	CDE	C	AB	AB	B	 the home of one of the old members of the <font color=green>church</font> , a woman named Catt who, as Wilson afterward found, was
church/NN/br-k04/877	-0.0480401424689485	-0.369025033054228	church	NN	church%1:14:00::	C	C	B	CDE	C	AB	AB	B	 never married, conducting a spotless home and devoted to her <font color=green>church</font> , but a perpetual dissenter and born critic. She soared over
church/NN/br-k04/923	-0.329667175704492	-0.133476698186302	church	NN	church%1:06:00::	D	D	D	CDE	DE	CDE	DE	D	 which she was chief repository. Then Wilson looked over the <font color=green>church</font>  and studied its condition. The salary of the pastor had
church/NN/br-k04/975	-0.298044356212578	-0.314158041172614	church	NN	church%1:06:00::	D	D	D	CDE	DE	CDE	DE	D	 he mentioned this to the Deacons they said nothing. The <font color=green>church</font>  itself must be repaired. It was dirty and neglected. It
church/NN/br-k06/528	-0.320414874403425	0.319776056978939	church	NN	church%1:06:00::	D	D	D	CDE	DE	CDE	DE	D	 his head out. There was the slate roof of the <font color=green>church</font> ; ivy climbed the red brick walls like a green scaled
church/NN/br-k06/571	-0.287592192034943	-0.0240492597259131	church	NN	church%1:06:00::	D	D	D	CDE	DE	CDE	DE	D	 cupboards.`` There 's a tower and a steeple on the <font color=green>church</font>  a million feet high. And the loudest clock in the
church/NN/br-k06/659	-0.151477337361859	-0.415281002070969	church	NN	church%1:06:00::	D	D	D	CDE	DE	CDE	DE	D	 Street to Orange Square. The steeple leaned backward, while the <font color=green>church</font>  advanced like a headless creature in a long, shapeless coat
church/NN/br-k06/852	-0.236093227896254	-0.0858452986478772	church	NN	church%1:06:00::	D	D	D	CDE	DE	CDE	DE	D	 Church with its high steeple and clock. There was no <font color=green>church</font>  like Drew Church, no preacher like Papa, who was intimate
church/NN/br-k10/1423	-0.0803141235498224	-0.401826481486227	church	NN	church%1:14:00::	A	A	B	AB	AB	AB	AB	B	 economics, and social issues that are no concern of the <font color=green>Church</font> ''? And John 's reply was always the same:`` Anything that
church/NN/br-k10/1445	-0.232217778335192	-0.257877972548249	church	NN	church%1:14:00::	A	A	B	AB	AB	AB	AB	B	 same:`` Anything that affects souls is the concern of the <font color=green>Church</font> ! We will have righteousness''! Tears burned behind his eyes as
church/NN/br-k10/1802	-0.179104385972264	0.0988358268628874	church	NN	church_of_rome%1:14:00::	B	B	B	AB	AB	AB	AB	B1	 Geneva, saying that he had been a bishop of the <font color=green>Church</font>  of Rome and had been persecuted in Paris for his
church/NN/br-k10/205	0.177937472124567	-0.358461822505192	church	NN	church%1:14:00::	A	A	B	AB	AB	AB	AB	B	 that the couple would have to be punished if the <font color=green>Church</font>  was to be respected.`` I have told you before, and
church/NN/br-k10/257	0.0410068473641215	-0.284967886035945	church	NN	church%1:14:00::	A	A	B	AB	AB	AB	AB	B	 is the answer the ungodly will always make when the <font color=green>Church</font>  points its fingers at their sins. I say to you
church/NN/br-k10/271	-0.0269253790958348	-0.196604899871397	church	NN	church%1:14:00::	A	A	B	AB	AB	AB	AB	B	 fingers at their sins. I say to you that the <font color=green>Church</font>  will ever decry evil''! John 's reply was like a
church/NN/br-k10/588	-0.0904161591331676	-0.138654567115842	church	NN	church%1:14:00::	A	A	B	AB	AB	AB	AB	B	 to let them give him the last rites of the <font color=green>Church</font> , but he had died still proclaiming salvation by faith. Burial
church/NN/br-k10/967	-0.433427173824384	-0.022765516595705	church	NN	church%1:06:00::	D	D	D	CDE	DE	CDE	DE	D	 all the time. Quickening his steps, John entered the vast <font color=green>church</font>  and climbed the tower steps to the bells. Underneath the
church/NN/br-k13/533	-0.406044376773517	0.0901210386608573	church	NN	church%1:06:00::	D	D	D	CDE	DE	CDE	DE	D	 Harold indicated the photograph on the wall and asked what <font color=green>church</font>  the stone sculpture was in. Eugene told him and he
church/NN/br-k14/826	0.0373173268711108	0.406059935068165	church	NN	church%1:06:00::	D	D	D	CDE	DE	CDE	DE	D	 Jewish section was in Trastevere, near the Tiber at the <font color=green>church</font>  of San Francesco a Ripa. The colony had been small
church/NN/br-k15/188	-0.258223636221107	0.0292929244986204	church	NN	church%1:06:00::	D	D	D	CDE	DE	CDE	DE	D	 They held the funeral the next morning from the crossroads <font color=green>church</font>  and buried the little box in the quiet family plot
church/NN/br-k16/1431	-0.429025978151479	-0.135969896889783	church	NN	church%1:06:00::	D	D	D	CDE	DE	CDE	DE	D	 thickets. Along Wappinger Creek in Dutchess County, past the white <font color=green>church</font>  at Fishkill, past Verplanck 's Point on the east bank
church/NN/br-k16/2285	-0.399116558820592	-0.195679781172423	church	NN	church_service%1:04:00::	E	E	E	CDE	DE	CDE	DE	E	 him out of some dim corner of memory from a <font color=green>church</font>  service when he was a boy- yes, in a white
church/NN/br-k19/213	0.26740761665734	0.352582092143969	church	NN	church%1:14:00::	A	A	B	AB	AB	AB	AB	B	 of this desire was due to his devotion to the <font color=green>church</font>  and how much was his own ego, demanding to be
church/NN/br-l08/1824	-0.265472768814888	0.0925733676878301	church	NN	church%1:04:00::	E	E	E	CDE	DE	CDE	DE	E	 did n't feel good on Sunday, could n't go to <font color=green>church</font> - there 'd be a little argument, but she could be
church/NN/br-m01/265	0.221252096912064	-0.133796801146842	church	NN	church%1:14:00::	Z	Z	B	Z	Z	AB	AB	B	 was no Martian concept to match it- unless one took`` <font color=green>church</font> '' and`` worship'' and`` God'' and`` congregation'' and many other words
church/NN/br-p01/1161	-0.412992077679023	0.0516771516169126	church	NN	church%1:06:00::	D	D	D	CDE	DE	CDE	DE	D	 hill, rising with the hill to the top where the <font color=green>church</font>  was and beyond that to the cemetery. Only paved alleyways
church/NN/br-p01/21	-0.327068754753317	-0.00582421587856668	church	NN	church_tower%1:06:00::	D	D	D	CDE	DE	CDE	DE	D	 them he could have been the broken bell in the <font color=green>church</font>  tower which rang before and after Mass, and at noon
church/NN/br-p01/222	-0.123184637259209	0.0315182937041878	church	NN	church%1:04:00::	E	E	E	CDE	DE	CDE	DE	E	 from its elders. Youth obeyed when commanded. It went to <font color=green>church</font>  on Sunday and one Saturday a month went to confession
church/NN/br-p01/829	-0.473655212927202	0.00612975104416504	church	NN	church%1:06:00::	D	D	D	CDE	DE	CDE	DE	D	 to Drexel Street and his back in opposition to the <font color=green>church</font>  behind him. For all he saw or cared to see
church/NN/br-p12/1014	-0.487983587921684	0.146776164657279	church	NN	church%1:06:00::	D	D	D	CDE	DE	CDE	DE	D	 Then they took a taxi to Trastevere.`` There 's a <font color=green>church</font>  you should see'', she said. And when they stood by
church/NN/br-p12/1102	-0.392019156255043	-0.0288355780099694	church	NN	church_bell%1:06:00::	D	D	D	CDE	DE	CDE	DE	D	 in the morning when he woke up at ten the <font color=green>church</font>  bells were ringing. He had never heard so many bells
church/NN/br-p12/1260	-0.0780336357803977	-0.00935344612105318	church	NN	church%1:04:00::	E	E	E	CDE	DE	CDE	DE	E	 snuggled against him, he wondered if she ever went to <font color=green>church</font> . Why did he want her to go to church? he
church/NN/br-p12/1270	-0.0780336357803977	-0.00935344612105318	church	NN	church%1:04:00::	E	E	E	CDE	DE	CDE	DE	E	 to church. Why did he want her to go to <font color=green>church</font> ? he wondered. Probably because it was a place where she
church/NN/br-p12/1433	-0.0867433506325403	-0.084920878312126	church	NN	church%1:04:00::	C	C	E	CDE	C	CDE	DE	E	 woman though, she would take only what she needed from <font color=green>church</font> . It was too bad he was n't a Catholic himself
church/NN/br-p12/1559	-0.355510645466799	-0.219967470860917	church	NN	church%1:04:00::	E	E	E	CDE	DE	CDE	DE	E	 girl like Carla if she got up and went to <font color=green>church</font> . A half hour later he got her up to go
church/NN/br-r05/1163	-0.169872779336758	0.15530773839712	church	NN	church%1:06:00::	C	C	D	CDE	C	CDE	DE	D	 While Henry Morgan was escorting Miss Vera Green from the <font color=green>church</font>  social last Saturday night, a savage dog attacked them and
church/NNP/br-d03/1914	-0.0446408419609862	0.00429858871168744	church	NNP	group%1:03:00::	B	B	C	AB	AB	CDE	C	C	 the Observer depicting clergymen of the Church of England, the <font color=green>Church</font>  of Rome and the Nonconformist Church. The Catholic priest, though
church/NNP/br-d03/1920	-0.0476407197048627	0.0168459283257175	church	NNP	group%1:03:00::	B	B	C	AB	AB	CDE	C	C	 Church of England, the Church of Rome and the Nonconformist <font color=green>Church</font> . The Catholic priest, though somewhat superficially drawn, easily came out
church/NNP/br-d03/2022	-0.0641453854958994	-0.0150328131658715	church	NNP	group%1:03:00::	B	B	C	AB	AB	CDE	C	C	 comments were equally made by an Anglican parson, a Free <font color=green>Church</font>  minister and a Catholic priest. Catholic priests have frequently appeared
church/NNP/br-d03/91	0.0452816055038032	-0.0310552096323515	church	NNP	group%1:03:00::	A	A	C	AB	AB	CDE	C	C	 the religious sphere so popularly discussed as Christian unity. The <font color=green>Church</font>  Unity Octave, January 18- 25, was enthusiastically devoted to prayer
church/NNP/br-j57/304	0.0207071479422666	-0.0477091849317655	church	NNP	group%1:03:00::	B	B	C	AB	AB	CDE	C	C	 Indeed, it is even surprising in the Canon of Christ <font color=green>Church</font>  and Regius Professor of Ecclesiastical History, who fathered this most
church/NNP/br-k04/233	-0.144846720096551	0.0953618306416742	church	NNP	group%1:03:00::	D	D	C	CDE	DE	CDE	C	C	 of this crowded region was the Allen African Methodist Episcopal <font color=green>Church</font> . It was an old and dirty wooden structure, sadly in
church/NNP/br-k06/1930	-0.0522819977099979	0.0560833821974603	church	NNP	group%1:03:00::	D	D	C	CDE	DE	CDE	C	C	 strike the steeples of the other churches; not of Drew <font color=green>Church</font> . A flash illumined the trees as a crooked bolt twigged
church/NNP/br-k06/698	-0.0882725138425693	-0.185222098408495	church	NNP	group%1:03:00::	D	D	C	CDE	DE	CDE	C	C	 the foothills, was the city of God. The Dutch Reformed <font color=green>Church</font> , with two steeples and its own school was on Main
church/NNP/br-k06/714	-0.117488949543725	0.0263299195645418	church	NNP	group%1:03:00::	D	D	C	CDE	DE	CDE	C	C	 and its own school was on Main Street; the Episcopal <font color=green>Church</font>  was one block down Sussex Street; the Catholic Saint Mary's
church/NNP/br-k06/726	-0.100145280885441	0.0156519407404322	church	NNP	group%1:03:00::	D	D	C	CDE	DE	CDE	C	C	 was one block down Sussex Street; the Catholic Saint Mary's <font color=green>Church</font> , with an even taller steeple and a cross on top
church/NNP/br-k06/841	-0.0735469510124042	-0.058886435732211	church	NNP	group%1:03:00::	D	D	C	CDE	DE	CDE	C	C	 became familiar with God, who resided chiefly in Drew Centennial <font color=green>Church</font>  with its high steeple and clock. There was no church
church/NNP/br-k06/855	-0.0868785995827725	-0.0328337930231301	church	NNP	group%1:03:00::	D	D	C	CDE	DE	CDE	C	C	 high steeple and clock. There was no church like Drew <font color=green>Church</font> , no preacher like Papa, who was intimate with Him, and
church/NNP/br-k10/1229	0.0161277166303179	-0.100476642728399	church	NNP	group%1:03:00::	B	B	C	AB	AB	CDE	C	C	 smashing images and tearing down symbols sacred to the Old <font color=green>Church</font> . John found it difficult, but he held him in check
