id	model.x	model.y	lemma	pos	sensekey	marisense	mbroad	wnbroad	mari2	mari3	wn2	wn3	wnsense	text
state/NNP/br-a06/128	0.0259787916481817	-0.0162742678103211	state	NNP	Z	A3	A	Z	ABC	AB	Z	Z	Z	 500 women in Trenton Monday at a forum of the <font color=green>State</font>  Federation of Women 's Clubs. Hughes said Monday,`` It is
state/NNP/br-a06/422	0.186034583155776	-0.145758093083188	state	NNP	Z	A2	A	Z	ABC	AB	Z	Z	Z	 launched into what the issues should be in the campaign. <font color=green>State</font>  aid to schools, the continuance of railroad passenger service, the
state/NNP/br-a07/149	0.0613562156920856	-0.0353483904534886	state	NNP	Z	A2	A	Z	ABC	AB	Z	Z	Z	 Democratic district and county leaders are reported trying to induce <font color=green>State</font>  Controller Arthur Levitt of Brooklyn to oppose Mr. Wagner for
state/NNP/br-a10/979	-0.0485305115501524	-0.185285761537978	state	NNP	Z	A3	A	Z	ABC	AB	Z	Z	Z	 Circuit Judge. He will attend a meeting of the Republican <font color=green>State</font>  Central Committee Saturday in Portland and see the Washington-Oregon football
state/NNP/br-a12/156	-0.0603725175562726	-0.201417324451099	state	NNP	group%1:03:00::	A5	A	B	ABC	AB	ABC	AB	B	 last Saturday night in the 41- 8 slaughter of Washington <font color=green>State</font> . Moritz is listed on the Longhorn roster as a right
state/NNP/br-a12/1811	0.0543181492562653	-0.141605549131715	state	NNP	group%1:03:00::	A	A	B	ABC	AB	ABC	AB	B	 M. C. Reynolds and Warren Rabb. Rabb, the former Louisiana <font color=green>State</font>  field general, came off the bench for his debut with
state/NNP/br-a12/821	0.10481003926683	-0.19878793796042	state	NNP	group%1:03:00::	A5	A	B	ABC	AB	ABC	AB	B	 bench. Wingback Jack Collins injured a knee in the Washington <font color=green>State</font>  game but insists he 'll be ready for Oklahoma. Last
state/NNP/br-a14/1200	-0.0561846133963855	-0.230069904869815	state	NNP	Z	A5	A	Z	ABC	AB	Z	Z	Z	 the past twelve months. He won the Masters, the United <font color=green>States</font>  Open and a record$ 80738 in prize money. He was
state/NNP/br-a15/1617	0.0692255503784276	0.199074226746048	state	NNP	group%1:03:00::	A2	A	B	ABC	AB	ABC	AB	B	 baseball history, as the Blue and White beat Southeast Missouri <font color=green>State</font>  College, 5- 1, at Crystal City. The victory was the
state/NNP/br-a17/1758	0.0546138687347582	0.0476919392270674	state	NNP	Z	A2	A	Z	ABC	AB	Z	Z	Z	 Saturday to Elvis Leonard Mason, an honor graduate of Lamar <font color=green>State</font>  College of Technology, in the chapel of the First Presbyterian
state/NNP/br-a17/2060	-0.0793120217349988	-0.150259517332198	state	NNP	Z	A2	A	Z	ABC	AB	Z	Z	Z	 Miss Shirley Joan Meredith, a former student of North Texas <font color=green>State</font>  University, was married Saturday to Larry W. Mills, who has
state/NNP/br-a17/2075	-0.0485305115501524	-0.185285761537978	state	NNP	Z	A2	A	Z	ABC	AB	Z	Z	Z	 married Saturday to Larry W. Mills, who has attended Arlington <font color=green>State</font>  College. They will live at 2705 Fitzhugh after a wedding
state/NNP/br-a18/1949	0.0568140398934755	-0.128854024972219	state	NNP	Z	Z	Z	Z	Z	Z	Z	Z	Z	 will be hosts this Tuesday evening at dinner at the <font color=green>State</font>  st. home of the Walkers honoring Mrs. McConnell 's debutante
state/NNP/br-a19/1333	-0.225869299877164	0.0578934070607497	state	NNP	Z	A2	A	Z	ABC	AB	Z	Z	Z	 their Chesapeake Bay-front home, has been sent to Spring Grove <font color=green>State</font>  Hospital for detention. The victims were H. Malone Dresbach, 47
state/NNP/br-a19/775	0.024511790745397	-0.202117868288444	state	NNP	Z	A3	A	Z	ABC	AB	Z	Z	Z	 board member said later, that Dr. Thomas G. Pullen, Jr., <font color=green>State</font>  superintendent of schools, told Dr. Jenkins and a number of
state/NNP/br-a21/242	-0.0794392367814593	0.230165402278222	state	NNP	Z	A2	A	Z	ABC	AB	Z	Z	Z	 being questioned about several fires in the Westphalia area by <font color=green>State</font>  Police. He also admitted killing Mrs. Hengesbach. However, the confession
state/NNP/br-a22/2193	-0.0237317399153333	-0.280719855418407	state	NNP	Z	A3	A	Z	ABC	AB	Z	Z	Z	 two of them in a fiery crash near Snellville, the <font color=green>State</font>  Patrol said Sunday. The latest death reported was that of
state/NNP/br-a22/538	0.0645875594426539	0.0035349928706525	state	NNP	Z	A	A	Z	ABC	AB	Z	Z	Z	 other hand, Emory University derives its corporate existence from the <font color=green>State</font>  of Georgia.`` When and if it can do so without
state/NNP/br-a23/1258	0.140189430756911	-0.17873967782856	state	NNP	Z	A2	A	Z	ABC	AB	Z	Z	Z	 and entertainment for functions throughout the Northwest. These included Oregon <font color=green>State</font>  Fair, for which he had been booked on and off
state/NNP/br-a23/1535	0.00797602495336749	-0.107989616953595	state	NNP	Z	A2	A	Z	ABC	AB	Z	Z	Z	 the Year'' in national competition completed this week at Ohio <font color=green>State</font>  University, Columbus, Ohio. Tim Larson, a junior at Wilson High
state/NNP/br-a26/1076	-0.00394056659862536	-0.288180069802987	state	NNP	Z	A2	A	Z	ABC	AB	Z	Z	Z	 year history. The exhibition of cotton ginning machinery at the <font color=green>State</font>  Fair grounds is valued at more than a million dollars
state/NNP/br-a28/1967	0.0354945823844351	-0.02562934727049	state	NNP	Z	A3	A	Z	ABC	AB	Z	Z	Z	 could be ruled taxable to them in the year made. <font color=green>State</font>  Briefs: Voters in four counties containing and bordering Denver authorized
state/NNP/br-a30/456	-0.264150448934469	-0.339135324472152	state	NNP	Z	A2	A	Z	ABC	AB	Z	Z	Z	 Angeles. He started practice in 1917, and served on the <font color=green>State</font>  Board of Medical Examiners. Giving up the violin opened a
state/NNP/br-a37/260	0.2358219706377	0.229972220868783	state	NNP	Z	C	C	Z	ABC	C	Z	Z	Z	 new Administration with the breakoff decision. Kennedy, through Secretary-designate of <font color=green>State</font>  Dean Rusk, declined. He thus kept his hands free for
state/NNP/br-a40/1784	0.0827385361173771	0.0928784709738284	state	NNP	Z	A5	A	Z	ABC	AB	Z	Z	Z	 fall, after state investigators questioned her white roommate at Wayne <font color=green>State</font> . But Holmes was rejected again`` on the basis of his
state/NNP/br-a43/155	0.111915088255148	0.00205439696728072	state	NNP	Z	A3	A	Z	ABC	AB	Z	Z	Z	 the prices of these tax-exempt bonds. Other tax-exempt bonds of <font color=green>State</font>  and local governments hit a price peak on February 21
state/NNP/br-a43/66	0.227876603268195	0.117980052470941	state	NNP	Z	A3	A	Z	ABC	AB	Z	Z	Z	 Things are looking up these days for many of the <font color=green>State</font>  turnpikes on which investors depend for income from their toll-road
state/NNP/br-a43/728	0.0847924909795187	-0.0663668601213496	state	NNP	Z	A3	A	Z	ABC	AB	Z	Z	Z	 to prove what they can do. The 187- mile Illinois <font color=green>State</font>  Toll Highway, for example, was not opened over its entire
state/NNP/br-a44/1069	0.126580583726972	-0.195207476835959	state	NNP	Z	A2	A	Z	ABC	AB	Z	Z	Z	 requests every day. It is connected by teletype with the <font color=green>State</font>  Library in Albany, which will supply any book to a
state/NNP/br-a44/346	0.183429427134041	-0.122897799025515	state	NNP	Z	A5	A	Z	ABC	AB	Z	Z	Z	 At one extreme are the systems of upper New York <font color=green>State</font> , where libraries in two or more counties combine to serve
state/NNP/br-a44/650	0.048782455633133	0.0834554052111145	state	NNP	Z	A5	A	Z	ABC	AB	Z	Z	Z	 nearly 95 per cent of the population of New York <font color=green>State</font>  now has access to a system, and enthusiastic librarians foresee
state/NNP/br-b02/1148	0.0452098966442474	-0.108050337752179	state	NNP	Z	A2	A	Z	ABC	AB	Z	Z	Z	 is finding it awkward to campaign against his own record. <font color=green>State</font>  Controller Arthur Levitt, on the other hand, cannot effectively deny
state/NNP/br-b04/1446	0.0533057714600359	0.359574855946711	state	NNP	Z	A2	A	Z	ABC	AB	Z	Z	Z	 to get gulled. According to The Chicago Tribune News Service, <font color=green>State</font>  Atty. Gen. Stanley Mosk of California has devised a series
state/NNP/br-b11/747	-0.0751585748152409	-0.189875708216047	state	NNP	Z	A3	A	Z	ABC	AB	Z	Z	Z	 Memorial Bldg., which graphically illustrates the CDC 's broad appeal. <font color=green>State</font>  Sen. Dick Richards will keynote; state and county committeemen, CDC
state/NNP/br-b12/283	-0.0861454554418829	-0.186320615409975	state	NNP	Z	A3	A	Z	ABC	AB	Z	Z	Z	 when accompanied by a prisoners' committee with powers of veto. <font color=green>State</font>  and federal approval of right to walk out at any
state/NNP/br-b14/1767	0.00508862334569211	-0.0394476032924058	state	NNP	Z	A3	A	Z	ABC	AB	Z	Z	Z	 and Lt. Gov. Byrd accepted the invitations of the Georgia <font color=green>State</font>  Chamber of Commerce to join the tour next November, the
state/NNP/br-b14/1827	-0.00544060922973189	-0.0293397713443924	state	NNP	Z	A3	A	Z	ABC	AB	Z	Z	Z	 opportunity, when the bravado comments are cast aside. The Georgia <font color=green>State</font>  Chamber of Commerce tried to guard against the danger of
state/NNP/br-b14/1845	-0.00965079867678085	0.100048972681727	state	NNP	Z	A3	A	Z	ABC	AB	Z	Z	Z	 against the danger of eliminating potential candidates. It wanted the <font color=green>State</font>  Democratic Executive Committee to pick the`` serious candidates''. But State
state/NNP/br-b14/1858	0.0335699277265618	-0.0279165135566006	state	NNP	Z	A3	A	Z	ABC	AB	Z	Z	Z	 State Democratic Executive Committee to pick the`` serious candidates''. But <font color=green>State</font>  Party Chairman James Gray of Albany said no, and he
state/NNP/br-b15/365	-0.00921632332324144	-0.0207243877320493	state	NNP	Z	A2	A	Z	ABC	AB	Z	Z	Z	 grow. Mr. Richard Preston, executive director of the New Hampshire <font color=green>State</font>  Planning and Development Commission, in his remarks to the Governors
state/NNP/br-b25/264	-0.0890395411897365	0.25953086930318	state	NNP	Z	A	A	Z	ABC	AB	Z	Z	Z	 the dictatorship of the proletariat by an`` All People 's <font color=green>State</font> '', and also of having laid down the lines for a
state/NNP/br-c02/2186	-0.0252631967618674	-0.0732119912852362	state	NNP	group%1:03:00::	A5	A	B	ABC	AB	ABC	AB	B	 Earlier this month Edward R. Murrow, director of the United <font color=green>States</font>  Information Agency, came to Hollywood and had dinner with more
state/NNP/br-d10/139	-0.0660761391841128	0.104663682960299	state	NNP	Z	B	B	Z	ABC	AB	Z	Z	Z	 attending the partition of India and the establishment of the <font color=green>State</font>  of Israel are simply recent grim evidences of the hostility
state/NNP/br-d10/1491	-0.0425552395670354	0.0672679103706534	state	NNP	Z	B	B	Z	ABC	AB	Z	Z	Z	 between Hindus and Muslims; neither has the establishment of the <font color=green>State</font>  of Israel fostered harmony between Muslims and Jews. I turn
state/NNP/br-d13/2056	0.0267251723508086	-0.0296780638012685	state	NNP	Z	A	A	Z	ABC	AB	Z	Z	Z	 universe is music. The Island of Nantucket, part of the <font color=green>State</font>  of Massachusetts, lies about thirty-one miles southeast of its mother
state/NNP/br-d13/2068	0.0267251723508086	-0.0296780638012685	state	NNP	Z	A	A	Z	ABC	AB	Z	Z	Z	 of Massachusetts, lies about thirty-one miles southeast of its mother <font color=green>State</font> . Some of the Island is sand and is not suitable
state/NNP/br-e31/292	0.0991357410381742	0.242441437010171	state	NNP	group%1:03:00::	A3	A	B	ABC	AB	ABC	AB	B	 harvested on 1500 commercial and private shooting preserves, and on <font color=green>State</font>  Game Commission controlled upland game areas during the 1960- 61
state/NNP/br-f04/1665	-0.126115787760162	-0.170501480663478	state	NNP	Z	A5	A	Z	ABC	AB	Z	Z	Z	 Following a talk by Mr. Clark at the New York <font color=green>State</font>  Natural Food Associates Convention, a man from the audience offered
state/NNP/br-f14/1306	0.270905982244252	-0.34789297873079	state	NNP	person%1:03:00::	C	C	C	ABC	C	ABC	C	C1	 German state, including the Reich Minister of the Interior, the <font color=green>State</font>  Secretary in charge of the Four Year Plan, the Reich
state/NNP/br-g02/719	0.0404439838133101	0.0436161325046628	state	NNP	Z	B	B	Z	ABC	AB	Z	Z	Z	 Ratified in the Republican Party victory in 1952, the Positive <font color=green>State</font>  is now evidenced by political campaigns being waged not on
state/NNP/br-g06/699	-0.00486429235912789	-0.109731633783238	state	NNP	Z	B	B	Z	ABC	AB	Z	Z	Z	 his tenure he also fulfilled guest engagements at the Berlin <font color=green>State</font>  Opera. Two years later he became director of the Frankfurt
state/NNP/br-g10/357	0.0867361709820978	0.242959593721698	state	NNP	Z	A	A	Z	ABC	AB	Z	Z	Z	 the right to secede from it. This right of the <font color=green>State</font> , its upholders contended, was essential to maintain the federal balance
state/NNP/br-h03/1055	0.132371955757712	0.111176849600374	state	NNP	Z	A	A	Z	ABC	AB	Z	Z	Z	 our loyalty as legislators to our community, our district, our <font color=green>State</font> . And, if we follow the Rayburn pattern, as consciously or
state/NNP/br-h03/945	-0.205983079012309	0.23612121075619	state	NNP	Z	A	A	Z	ABC	AB	Z	Z	Z	 needs, the aspirations, the interests of my district and my <font color=green>State</font> . What Sam Rayburn 's life proves to us all is
state/NNP/br-h04/1565	0.272044755242423	0.0531711964761006	state	NNP	Z	A2	A	Z	ABC	AB	Z	Z	Z	 assignment, and replacement of all vehicles.( Note: So far as <font color=green>State</font>  Police cars are concerned, only their replacement is under this
state/NNP/br-h05/1032	0.131115496744182	0.327280622474537	state	NNP	Z	A1	A	Z	ABC	AB	Z	Z	Z	 facing up to this problem would be to have the <font color=green>State</font>  take over full responsibility for assessing all taxable property. An
state/NNP/br-h05/1048	0.06816674255299	0.19556878273725	state	NNP	Z	A1	A	Z	ABC	AB	Z	Z	Z	 for assessing all taxable property. An adequately staffed and equipped <font color=green>State</font>  assessing office could apply uniform methods and standards which would
state/NNP/br-h05/1070	0.228225600455805	0.275085664168682	state	NNP	Z	A4	A	Z	ABC	AB	Z	Z	Z	 far toward producing equitable assessments on all properties throughout the <font color=green>State</font> . A single statewide assessing unit would eliminate the differences and
state/NNP/br-h06/1208	0.00299527075176519	-0.0472859308995514	state	NNP	Z	A2	A	Z	ABC	AB	Z	Z	Z	 of Commerce. Richard Preston, executive director of the New Hampshire <font color=green>State</font>  Planning and Development Commission, and Edwin C. Kepler of General
state/NNP/br-h06/1496	0.00696817833687042	-0.127843716781725	state	NNP	Z	A	A	Z	ABC	AB	Z	Z	Z	 Planning Division is to plan for the future of the <font color=green>State</font>  of Rhode Island. The activities of the Planning Division are
state/NNP/br-h08/1124	-0.0300988333855102	-0.0792034120588386	state	NNP	Z	A	A	Z	ABC	AB	Z	Z	Z	 therefore, do I, John A. Notte, Jr., Governor of the <font color=green>State</font>  of Rhode Island and Providence Plantations, proclaim the week of
state/NNP/br-h08/1197	0.125453159505401	-0.0775753000188506	state	NNP	Z	A	A	Z	ABC	AB	Z	Z	Z	 hereunto set my hand and caused the seal of the <font color=green>State</font>  to be affixed this 11 th day of June, in
state/NNP/br-h08/1355	-0.0168109095697669	-0.0455642758523557	state	NNP	Z	A	A	Z	ABC	AB	Z	Z	Z	 therefore, do I, John A. Notte, Jr., Governor of the <font color=green>State</font>  of Rhode Island and Providence Plantations, proclaim Tuesday, October 24
state/NNP/br-h08/1428	0.125453159505401	-0.0775753000188506	state	NNP	Z	A	A	Z	ABC	AB	Z	Z	Z	 hereunto set my hand and caused the seal of the <font color=green>State</font>  to be affixed this 5 th day of July, in
state/NNP/br-h08/1580	-0.00578171492334639	-0.0281039374335562	state	NNP	Z	A2	A	Z	ABC	AB	Z	Z	Z	 the middle of the acts or in the intermissions. The <font color=green>State</font>  Ballet of Rhode Island, the first incorporated group, was formed
state/NNP/br-h08/1623	-0.04639501671591	0.102752214984531	state	NNP	Z	A	A	Z	ABC	AB	Z	Z	Z	 ballet performances, to contribute to the cultural life of the <font color=green>State</font> , and to provide opportunity for gifted dance students who, for
state/NNP/br-h08/1673	-0.0300988333855102	-0.0792034120588386	state	NNP	Z	A	A	Z	ABC	AB	Z	Z	Z	 therefore, do I, John A. Notte, Jr., Governor of the <font color=green>State</font>  of Rhode Island and Providence Plantations, proclaim the week of
state/NNP/br-h08/1694	0.00392864892807459	-0.0410564878938419	state	NNP	Z	A2	A	Z	ABC	AB	Z	Z	Z	 proclaim the week of Monday, November 13, 1961, as the <font color=green>State</font>  Ballet of Rhode Island Week, requesting all Rhode Islanders to
state/NNP/br-h08/1722	-0.0288367482347004	0.125209546665588	state	NNP	Z	A	A	Z	ABC	AB	Z	Z	Z	 event which should contribute to the cultural life of the <font color=green>State</font> . In testimony whereof, I have hereunto set my hand and
state/NNP/br-h08/1740	0.125453159505401	-0.0775753000188506	state	NNP	Z	A	A	Z	ABC	AB	Z	Z	Z	 hereunto set my hand and caused the seal of the <font color=green>State</font>  to be affixed this 23 d day of October, in
state/NNP/br-h08/193	-0.0300988333855102	-0.0792034120588386	state	NNP	Z	A	A	Z	ABC	AB	Z	Z	Z	 therefore, do I, John A. Notte, Jr., Governor of the <font color=green>State</font>  of Rhode Island and Providence Plantations, proclaim the week of
state/NNP/br-h08/2129	-0.0300988333855102	-0.0792034120588386	state	NNP	Z	A	A	Z	ABC	AB	Z	Z	Z	 therefore, do I, John A. Notte, Jr., Governor of the <font color=green>State</font>  of Rhode Island and Providence Plantations, proclaim Thursday, November 23
state/NNP/br-h08/2215	0.0173891634448588	-0.032386436256185	state	NNP	Z	A	A	Z	ABC	AB	Z	Z	Z	 hereunto set my hand and caused the seal of the <font color=green>State</font>  to be affixed this 21 st day of November, in
state/NNP/br-h08/293	0.125453159505401	-0.0775753000188506	state	NNP	Z	A	A	Z	ABC	AB	Z	Z	Z	 hereunto set my hand and caused the seal of the <font color=green>State</font>  to be affixed this 21 st day of April, in
state/NNP/br-h08/547	-0.0259345819980164	-0.0547719304287065	state	NNP	Z	A	A	Z	ABC	AB	Z	Z	Z	 therefore, do i, John A. Notte, Jr., Governor of the <font color=green>State</font>  of Rhode Island and Providence Plantations, proclaim Saturday, May 20
state/NNP/br-h08/608	0.125453159505401	-0.0775753000188506	state	NNP	Z	A	A	Z	ABC	AB	Z	Z	Z	 hereunto set my hand and caused the seal of the <font color=green>State</font>  to be affixed this 17 th day of May, in
state/NNP/br-h08/79	-0.030484805851496	-0.167814941599025	state	NNP	Z	A4	A	Z	ABC	AB	Z	Z	Z	 this fact is being commemorated with several exhibits throughout the <font color=green>State</font> , but most of all paying tribute to the first Rhode
state/NNP/br-h08/823	-0.0171135826876296	-0.0454912227163431	state	NNP	Z	A	A	Z	ABC	AB	Z	Z	Z	 therefore, do I, John A. Notte, Jr., Governor of the <font color=green>State</font>  of Rhode Island and Providence Plantations, proclaim Monday, May 22
state/NNP/br-h08/888	0.125453159505401	-0.0775753000188506	state	NNP	Z	A	A	Z	ABC	AB	Z	Z	Z	 hereunto set my hand and caused the seal of the <font color=green>State</font>  to be affixed this 20 th day of April, in
state/NNP/br-j14/2120	-0.03817360667248	0.184972214522757	state	NNP	group%1:03:00::	A5	A	B	ABC	AB	ABC	AB	B	 methods used to obtain them. The introduction of the United <font color=green>States</font>  Pharmacopoeia reference standard in 1952 and the redefinition and equating
state/NNP/br-k15/1529	0.0499431825364655	-0.0143588323286069	state	NNP	group%1:03:00::	A3	A	B	ABC	AB	ABC	AB	B	 the U.S. Army. In spite of the fact that the <font color=green>state</font>  legislature voted us neutral, John Hunt Morgan is openly flying
state/NNP/br-l01/1520	0.0235953779572649	-0.0715440790028203	state	NNP	Z	A2	A	Z	ABC	AB	Z	Z	Z	 the state of Illinois knew that I was entering Hanover <font color=green>State</font>  Hospital under an assumed name, or why. It was unlikely
state/NNPS/br-d08/142	-0.0232492684841869	0.00724764590688093	state	NNPS	Z	B	B	Z	ABC	AB	Z	Z	Z	 only a longed-for ideal in the time of the Warring <font color=green>States</font> , was finally realized by the establishment of a Chinese Empire
state/NNPS/br-f02/8	-0.168168935892685	-0.153253401413888	state	NNPS	Z	A5	A	Z	ABC	AB	Z	Z	Z	 She was just another freighter from the <font color=green>States</font> , and she seemed as commonplace as her name. She was
state/NNPS/br-g07/2287	-0.051026603613359	-0.000381437020808073	state	NNPS	Z	A	A	Z	ABC	AB	Z	Z	Z	 death, Madison expressed the wish`` that the Union of the <font color=green>States</font>  be cherished and perpetuated. Let the open enemy to it
state/NNPS/br-g10/1157	-0.015846400671433	0.0142263440125266	state	NNPS	Z	A5	A	Z	ABC	AB	Z	Z	Z	 United States of America''.`` We the people of the Confederate <font color=green>States</font> , each state acting in its sovereign and independent character, in
state/NNPS/br-g10/1255	-0.060567297608543	0.0308837799500791	state	NNPS	Z	A	A	Z	ABC	AB	Z	Z	Z	 of the Nineteenth century was fought. But though the Southern <font color=green>States</font> , when drafting a constitution to unite themselves, narrowed the difference
state/NNPS/br-g10/1505	0.0563626685176596	-0.0695565342770545	state	NNPS	Z	A	A	Z	ABC	AB	Z	Z	Z	 of the slaves by Union action even in the Border <font color=green>States</font>  that stayed with the Union. He issued his Emancipation Proclamation
state/NNPS/br-g10/1942	0.00161231411494128	0.0551752668777237	state	NNPS	Z	A	A	Z	ABC	AB	Z	Z	Z	 the balance between the powers they had delegated to the <font color=green>States</font>  and to their Union. They differed in the balance they
state/NNPS/br-g10/2221	-0.0234337358799662	0.0457687841009179	state	NNPS	Z	A	A	Z	ABC	AB	Z	Z	Z	 from the ballot to the bullet. Yet though the Southern <font color=green>States</font>  lost the worst errors in their case, they did not
state/NNPS/br-g10/305	-0.00803091539829704	0.0462756836976901	state	NNPS	Z	A	A	Z	ABC	AB	Z	Z	Z	 this subject. The difference came down to this: The Southern <font color=green>States</font>  insisted that the United States was, in last analysis, what
state/NNPS/br-g10/325	-0.0227721914175833	0.0230308465607286	state	NNPS	Z	A	A	Z	ABC	AB	Z	Z	Z	 in last analysis, what its name implied- a Union of <font color=green>States</font> . To their leaders the Constitution was a compact made by
state/NNPS/br-g10/568	0.00628848085803143	0.0495090036445441	state	NNPS	Z	A1	A	Z	ABC	AB	Z	Z	Z	 the base alloy of hypocrisy''.[ His emphasis] When the Southern <font color=green>States</font>  exercised their`` right to secede'', they formed what they officially
state/NNPS/br-h04/440	0.0232394419993797	0.00329452894754072	state	NNPS	Z	A1	A	Z	ABC	AB	Z	Z	Z	 Two other states provide vehicles, but only with legislative approval. <font color=green>States</font>  which provide automobiles for employees assign them variously to the
state/NNPS/br-l03/126	0.00285041212501661	-0.0721103093198744	state	NNPS	Z	A5	A	Z	ABC	AB	Z	Z	Z	 on duty, too''.`` A night policeman just like in the <font color=green>States</font> . You know''?`` Canada does n't have much of this here
state/NNPS/br-l03/1478	-0.07184761426906	-0.0736164078466648	state	NNPS	Z	A5	A	Z	ABC	AB	Z	Z	Z	 a poor dumb Canadian or a smart aleck from the <font color=green>States</font> ''? Vince lifted his hand as if to strike, but his
state/NNPS/br-p05/410	-0.0165490583676374	0.00380015303383976	state	NNPS	Z	A5	A	Z	ABC	AB	Z	Z	Z	 marriage counselor- sometimes the Navy sent people back to the <font color=green>States</font>  to preserve a marriage- but mental health as a rule
state/NNS/br-a03/1391	0.142137640437277	0.050706283312299	state	NNS	Z	A1	A	Z	ABC	AB	Z	Z	Z	 that Congress last year passed a law providing grants to <font color=green>states</font>  to help pay medical bills of the needy aged. He
state/NNS/br-a03/1809	0.240515592566505	0.0797060723520108	state	NNS	Z	A1	A	Z	ABC	AB	Z	Z	Z	 another 10 million dollar`` initial'' appropriation for`` stimulatory grants'' to <font color=green>states</font>  to improve nursing homes. He further proposed grants of an
state/NNS/br-a03/1877	0.160618543374871	0.0515089718815005	state	NNS	Z	A1	A	Z	ABC	AB	Z	Z	Z	 President said he will ask Congress to increase grants to <font color=green>states</font>  for vocational rehabilitation. He did not say by how much
state/NNS/br-a04/2052	0.0896850729541583	0.0376741224874659	state	NNS	Z	A1	A	Z	ABC	AB	Z	Z	Z	 through the enactment of legislation to provide federal grants to <font color=green>states</font>  for specified efforts in combating this disturbing crime trend. The
state/NNS/br-a04/2103	0.0295579886833908	0.0455289171347798	state	NNS	Z	A1	A	Z	ABC	AB	Z	Z	Z	 the development of a program of federal leadership to assist <font color=green>states</font>  and local communities in their efforts to cope with the
state/NNS/br-a06/1820	0.0498841615580215	0.010844136631543	state	NNS	Z	A4	A	Z	ABC	AB	Z	Z	Z	 and a stop to the piracy of industry by Southern <font color=green>states</font> , and a strong fight against discrimination in business and industry
state/NNS/br-a08/246	-0.104114104423827	-0.144836901978443	state	NNS	Z	A	A	Z	ABC	AB	Z	Z	Z	 route. Pennsylvania Avenue, named for one of the original 13 <font color=green>states</font> , perhaps is not the most impressive street in the District
state/NNS/br-a08/597	0.00661429525375263	-0.00691041882075763	state	NNS	Z	A	A	Z	ABC	AB	Z	Z	Z	 will include the representations of Massachusetts and Texas, the respective <font color=green>states</font>  of the President and of Vice-President L. B. Johnson. Then
