id	model.x	model.y	lemma	pos	genre	broad_genre	marisense	mbroad	mari3	mari2	sensekey	wnsense	wnbroad	wn3	wn2	text	cues	cues_with_weight	mean_weight_x100	wcratio_x100	weighted_cw	wf	new_pos	new_broad_genre
state/JJ/br-e21/1143	-0.0197534861406235	-0.0238264926630452	state	JJ	skill_and_hobbies	non-fiction	A2	A	AB	ABC	state%5:00:02:public:00	A2	A	AB	ABC	 which the area is blessed. Just as the national and <font color=green>state</font>  parks place emphasis on features which are of national or	3	4	315	133	7	state	JJ	technical
state/JJ/br-e21/1154	-0.0148377110671741	-0.011872812072458	state	JJ	skill_and_hobbies	non-fiction	A3	A	AB	ABC	state%5:00:01:public:00	A2	A	AB	ABC	 parks place emphasis on features which are of national or <font color=green>state</font>  significance, counties should seek out these features which are distinctive	3	3	344	100	9	state	JJ	technical
state/JJ/br-e31/1555	-0.0946066978837261	-0.0288522774692047	state	JJ	skill_and_hobbies	non-fiction	A2	A	AB	ABC	state%5:00:02:public:00	A2	A	AB	ABC	 to make their cooking easy and their sleeping comfortable. Harassed <font color=green>state</font>  park officials often have more campers than they know what	2	2	332	100	7	state	JJ	technical
state/JJ/br-e31/651	-0.0032370616158252	0.0121446550630049	state	JJ	skill_and_hobbies	non-fiction	A3	A	AB	ABC	state%5:00:02:public:00	A2	A	AB	ABC	 the shooting development program have proudly participated in over 53 <font color=green>state</font>  and regional workshops, at which hundreds of school administrators, teachers	3	3	295	100	6	state	JJ	technical
state/JJ/br-g17/2159	-0.0404868765665766	-0.0140947515234614	state	JJ	belles_lettres	fiction	A2	A	AB	ABC	state%5:00:02:public:00	A2	A	AB	ABC	 is involved. How did it happen, for example, that the <font color=green>state</font>  university, that great symbol of American democracy, failed to flourish	3	3	256	100	9	state	JJ	fiction
state/JJ/br-g17/2327	0.000220289832969512	-0.01890451114336	state	JJ	belles_lettres	fiction	A2	A	AB	ABC	state%5:00:02:public:00	A2	A	AB	ABC	 been the very last of the forty-eight to establish a <font color=green>state</font>  university? The state universities of Maine, New Hampshire, And Vermont	4	1	403	25	5	state	JJ	fiction
state/JJ/br-g17/2331	0.00995119754678535	-0.018059806464311	state	JJ	belles_lettres	fiction	A2	A	AB	ABC	state%5:00:02:public:00	A2	A	AB	ABC	 last of the forty-eight to establish a state university? The <font color=green>state</font>  universities of Maine, New Hampshire, And Vermont are older and	4	2	427	50	5	state	JJ	fiction
state/JJ/br-g23/486	-0.0498559004979266	0.0270254754633177	state	JJ	belles_lettres	fiction	A2	A	AB	ABC	state%5:00:02:public:00	A2	A	AB	ABC	 The writer took a class of college students to the <font color=green>state</font>  hospital for the mentally ill in St. Joseph, Missouri. An	2	2	331	100	9	state	JJ	fiction
state/JJ/br-h11/1931	-0.00679760807704761	-0.0368719001066419	state	JJ	miscellaneous	non-fiction	D	D	D	D	solid-state%5:00:02:solid:01	D2	D	D	D	 addition to the basic programs in wavelength standards, spectroscopy, solid <font color=green>state</font>  physics, interactions of the free electron and atomic constants which	3	2	339	67	8	state	JJ	technical
state/JJ/br-h11/1986	0.0013803400491851	-0.0533754645685288	state	JJ	miscellaneous	non-fiction	D	D	D	D	solid-state%5:00:02:solid:01	D2	D	D	D	 the far infrared, the application of infrared techniques to solid <font color=green>state</font>  studies, and increased emphasis on high resolution instrumentation. Two data	3	2	349	67	11	state	JJ	technical
state/JJ/br-h14/1724	0.111087895794704	-0.00497052640177768	state	JJ	miscellaneous	non-fiction	A3	A	AB	ABC	state%5:00:02:public:00	A2	A	AB	ABC	 in order to provide matching for the minimum( base) allotment, <font color=green>State</font>  funds had to equal 1954 State funds. Prior to and	3	4	440	133	9	State	JJ	technical
state/JJ/br-h14/1730	0.122552482744945	-0.00216101650418576	state	JJ	miscellaneous	non-fiction	A3	A	AB	ABC	state%5:00:02:public:00	A2	A	AB	ABC	 the minimum( base) allotment, State funds had to equal 1954 <font color=green>State</font>  funds. Prior to and since 1960 the rest of the	4	4	444	100	8	State	JJ	technical
state/JJ/br-h14/1763	0.0430593759876	0.00758760950786293	state	JJ	miscellaneous	non-fiction	A3	A	AB	ABC	state%5:00:02:public:00	A2	A	AB	ABC	 fiscal capacity of the State, with a pivot of 40% <font color=green>State</font> ( or 60% Federal) participation in total program costs. The percentage	2	2	314	100	5	State	JJ	technical
state/JJ/br-h14/1868	0.0854076211494291	-0.0306593506843565	state	JJ	miscellaneous	non-fiction	A3	A	AB	ABC	state%5:00:02:public:00	A2	A	AB	ABC	 will be matched on the basis of a 40% pivot <font color=green>State</font>  share, with maximum and minimum State shares of 50% and	5	4	441	80	7	State	JJ	technical
state/JJ/br-h14/1875	0.112149640267646	-0.0457662225803808	state	JJ	miscellaneous	non-fiction	A3	A	AB	ABC	state%5:00:02:public:00	A2	A	AB	ABC	 of a 40% pivot State share, with maximum and minimum <font color=green>State</font>  shares of 50% and 30%, respectively. The pre 1960 rate	3	3	450	100	6	State	JJ	technical
state/JJ/br-h14/1997	0.0316155595874745	-0.0102232156167481	state	JJ	miscellaneous	non-fiction	A3	A	AB	ABC	state%5:00:02:public:00	A2	A	AB	ABC	 rates. The method used for computing the respective Federal and <font color=green>State</font>  shares in total program costs is specifically set forth in	4	4	311	100	12	State	JJ	technical
state/JJ/br-h14/332	0.0464636370682707	-0.012192670456842	state	JJ	miscellaneous	non-fiction	A3	A	AB	ABC	state%5:00:02:public:00	A2	A	AB	ABC	 grants to the States on the basis of population, matching <font color=green>State</font>  expenditures on a 50 - 50 basis. Under P. L.	3	1	330	33	7	State	JJ	technical
state/JJ/br-h14/360	0.0136957702833282	-0.00550836652533943	state	JJ	miscellaneous	non-fiction	A3	A	AB	ABC	state%5:00:02:public:00	A2	A	AB	ABC	 Congress, the Federal Government assumed responsibility for 100% of necessary <font color=green>State</font>  expenditures in connection with administration and the counseling and placement	4	3	297	75	7	State	JJ	technical
state/JJ/br-h14/533	0.0569436202103354	0.0145321479035819	state	JJ	miscellaneous	non-fiction	A3	A	AB	ABC	state%5:00:02:public:00	A2	A	AB	ABC	 the authorizations, appropriations, allotment base, Federal grants to States and <font color=green>State</font>  matching funds for this part of the grant program. In	6	5	352	83	9	State	JJ	technical
state/JJ/br-h14/747	0.0107695676420209	-0.00538254537906948	state	JJ	miscellaneous	non-fiction	A3	A	AB	ABC	state%5:00:02:public:00	A2	A	AB	ABC	 State. The provisions are also designed to avoid disruption in <font color=green>State</font>  programs already in operation, which might otherwise result from the	2	2	279	100	9	State	JJ	technical
state/JJ/br-h15/1500	0.0232682431550059	-0.0131839084792558	state	JJ	miscellaneous	non-fiction	A3	A	AB	ABC	state%5:00:02:public:00	A2	A	AB	ABC	 gather its own information and will receive broad information from <font color=green>State</font>  and Federal sources. It will tell you as soon as	2	2	301	100	7	State	JJ	technical
state/JJ/br-j38/1551	0.0123527313224431	0.00673169237713799	state	JJ	learned	non-fiction	A3	A	AB	ABC	state%5:00:02:public:00	A2	A	AB	ABC	 Federal government but from an exchange of experiences among states. <font color=green>State</font>  and local agencies in the vocational education field must be	4	3	270	75	9	State	JJ	essays
state/JJ/br-j38/1590	0.00855913637827863	0.00499511809314356	state	JJ	learned	non-fiction	A3	A	AB	ABC	state%5:00:02:public:00	A2	A	AB	ABC	 Federal effort to provide research and information to help guide <font color=green>state</font>  education departments and local school boards in existing programs. A	5	5	290	100	14	state	JJ	essays
state/JJ/br-j38/1871	0.0176171854059274	0.0108738821708491	state	JJ	learned	non-fiction	A3	A	AB	ABC	state%5:00:02:public:00	A2	A	AB	ABC	 for training to meet national skilled manpower needs. If only <font color=green>state</font>  funds were used to pay for the vocational education, it	3	3	279	100	10	state	JJ	essays
state/JJ/br-j38/441	0.00812745681726374	0.0172556744932748	state	JJ	learned	non-fiction	A3	A	AB	ABC	state%5:00:02:public:00	A2	A	AB	ABC	 enrolled in courses organized under two special programs administered by <font color=green>state</font>  and local school authorities:( 1) Vocational Education for National Defense	4	4	327	100	10	state	JJ	essays
state/JJ/br-j38/86	0.0334562079953551	-0.000101882964908656	state	JJ	learned	non-fiction	A1	A	AB	ABC	state%5:00:02:public:00	A2	A	AB	ABC	 appropriation of$ 7 million to support, on a matching basis, <font color=green>state</font>  administered programs of vocational education in agriculture, trades, industrial skills	4	3	388	75	8	state	JJ	essays
state/JJ/br-l14/977	-0.0672867480194911	-0.0150487114545513	state	JJ	fiction_mystery	fiction	A2	A	AB	ABC	state%5:00:02:public:00	A2	A	AB	ABC	 modern, large, on five acres. Must have cost plenty. The <font color=green>State</font>  cops would check from time to time; pass word when	1	1	276	100	10	State	JJ	fiction
state/NN/br-a01/1015	-0.0175237133810322	0.22038031074526	state	NN	press_reportage	press	A3	A	AB	ABC	state%1:14:01::	B	B	AB	ABC	 governor 's race, a top official said Wednesday. Robert Snodgrass, <font color=green>state</font>  GOP chairman, said a meeting held Tuesday night in Blue	3	1	147	33	2	state	NN	press
state/NN/br-a01/1165	-0.060952691542712	0.0146401376446205	state	NN	press_reportage	press	A3	A	AB	ABC	state%1:14:00::	B1	B	AB	ABC	 largest hurdle the Republicans would have to face is a <font color=green>state</font>  law which says that before making a first race, one	2	2	142	100	3	state	NN	press
state/NN/br-a01/1440	-0.109631613722693	0.128541704357889	state	NN	press_reportage	press	A3	A	AB	ABC	state%1:14:00::	B1	B	AB	ABC	 highway reconstruction bonds. The bond issue will go to the <font color=green>state</font>  courts for a friendly test suit to test the validity	2	1	174	50	2	state	NN	press
state/NN/br-a01/1835	0.180837268779146	0.0723758493920136	state	NN	press_reportage	press	A3	A	AB	ABC	state%1:14:00::	B1	B	AB	ABC	 education, provided that such funds be received and expended'' as <font color=green>state</font>  funds. Barber, who is in his 13th year as a	3	2	180	67	2	state	NN	press
state/NN/br-a01/413	0.00936664086612123	0.100671392973695	state	NN	press_reportage	press	A4	A	AB	ABC	state%1:15:01::	A	A	AB	ABC	 through the welfare departments of all the counties in the <font color=green>state</font>  with the exception of Fulton County, which receives none of	2	2	173	100	5	state	NN	press
state/NN/br-a02/1165	-0.0619970522051434	0.0695011207652687	state	NN	press_reportage	press	A2	A	AB	ABC	state%1:15:01::	A	A	AB	ABC	 attorney general and chief justice of the Texas Supreme Court. <font color=green>State</font>  representatives decided Thursday against taking a poll on what kind	3	2	163	67	6	State	NNP	press
state/NN/br-a02/1454	0.083957143878599	-0.0452012286414045	state	NN	press_reportage	press	A1	A	AB	ABC	state%1:14:01::	B	B	AB	ABC	 would increase from$ 5000000 to$ 15000000 the maximum loan the <font color=green>state</font>  could make to a local water project. Cotten construed this	3	0	133	0	2	state	NN	press
state/NN/br-a02/165	-0.123516162964036	0.210841444648175	state	NN	press_reportage	press	A1	A	AB	ABC	state%1:14:01::	B	B	AB	ABC	 the books`` since Texas was a republic''. It permits the <font color=green>state</font>  to take over bank accounts, stocks and other personal property	4	1	120	25	2	state	NN	press
state/NN/br-a02/2003	0.0935674859898157	0.0411646742455254	state	NN	press_reportage	press	A3	A	AB	ABC	state%1:14:01::	B	B	AB	ABC	 62 session upon the recommendation of Supt. Chester O. Strickland. <font color=green>State</font>  and federal legislation against racial discrimination in employment was called	2	1	208	50	3	State	NNP	press
state/NN/br-a02/214	0.00632085010581883	0.0285341163458092	state	NN	press_reportage	press	A2	A	AB	ABC	state_treasurer%1:18:00::	A2	A	AB	ABC	 companies and other corporations to report such property to the <font color=green>state</font>  treasurer. The escheat law cannot be enforced now because it	3	1	134	33	4	state	NN	press
state/NN/br-a02/470	0.0337225067190155	0.0831182466164773	state	NN	press_reportage	press	A1	A	AB	ABC	state%1:14:00::	B1	B	AB	ABC	 in the scholastic age at a reduced cost to the <font color=green>state</font> . There was no debate as the Senate passed the bill	3	3	151	100	4	state	NN	press
state/NN/br-a02/620	-0.129144297005185	0.270850543476115	state	NN	press_reportage	press	A2	A	AB	ABC	state%1:15:01::	A	A	AB	ABC	 saving them from coming to Austin to live in the <font color=green>state</font>  deaf school. Dallas may get to hear a debate on	3	1	144	33	2	state	NN	press
state/NN/br-b20/1056	-0.00400101738611128	0.100498903045275	state	NN	press_editorial	press	C	C	C	ABC	state_department%1:14:00::	C1	C	C	ABC	 which will bring down the wall and reunite the city. <font color=green>State</font>  Department officials refusing to show their passes at the boundary	2	2	168	100	3	State	NNP	press
state/NN/br-b20/358	-0.0317342577064457	0.0782372418770983	state	NN	press_editorial	press	A5	A	AB	ABC	united_states%1:14:00::	A52	A	AB	ABC	 seek a discontinuity in the arms policy of the United <font color=green>States</font>  is the least risky path our government can take. His	1	0	174	0	2	States	NNPS	press
state/NN/br-b20/64	0.329686151165895	-0.393035001434861	state	NN	press_editorial	press	A5	A	AB	ABC	united_states%1:14:00::	A52	A	AB	ABC	 what we are getting. The biggest nuclear device the United <font color=green>States</font>  has exploded measured some 15 megatons, although our B-52s are	1	0	171	0	1	States	NNPS	press
state/NN/br-c01/1164	-0.08585682488128	-0.0882373955642824	state	NN	press_reviews	press	C	C	C	ABC	welfare_state%1:14:00::	B	B	AB	ABC	 we should take from these pages is that the welfare <font color=green>state</font>  in England still allows wild scope for all kinds of	1	1	166	100	4	state	NN	press
state/NN/br-d03/319	-0.234302572164293	-0.235784325626918	state	NN	religion	non-fiction	D	D	D	D	state%1:03:00::	D1	D	D	D	 the Roman and Anglican Churches and about the present religious <font color=green>state</font>  of England. Since the Protestant clergy for the most part	2	0	101	0	1	state	NN	essays
state/NN/br-d04/1145	-0.248549531040062	0.0746220582790896	state	NN	religion	non-fiction	D	D	D	D	state%1:03:00::	D1	D	D	D	 and the whole human race''. Because he interprets the primitive <font color=green>state</font>  of man as one of mere potentiality or capacity and	3	0	133	0	1	state	NN	essays
state/NN/br-d04/1599	0.0267161055065368	-0.174839932251649	state	NN	religion	non-fiction	D	D	D	D	state%1:03:00::	D1	D	D	D	 interminable and irremediable. But He set a bound to his[ <font color=green>state</font>  of] sin, by interposing death, and thus causing sin to	3	0	119	0	1	state	NN	essays
state/NN/br-d04/2174	-0.1326812414788	-0.11914297108661	state	NN	religion	non-fiction	D	D	D	D	state%1:03:00::	D1	D	D	D	 existence itself is a form of punishment rather than the <font color=green>state</font>  into which man is put by the will of the	3	1	119	33	3	state	NN	essays
state/NN/br-e02/1595	-0.374486381659594	-0.333839057360301	state	NN	skill_and_hobbies	non-fiction	A5	A	AB	ABC	united_states%1:15:00::	A51	A	AB	ABC	 made it possible to ship avocado anywhere in the United <font color=green>States</font> . It has a great many assets to recommend it and	1	0	220	0	1	States	NNPS	technical
state/NN/br-e02/1889	-0.374486381659594	-0.333839057360301	state	NN	skill_and_hobbies	non-fiction	D	D	D	D	state%1:03:00::	D1	D	D	D	 temperature at which it lapses into a sort of dormant <font color=green>state</font> . This cooling does not change the avocado in any way	3	0	220	0	1	state	NN	technical
state/NN/br-e22/2361	-0.044123474290447	0.136944147108043	state	NN	skill_and_hobbies	non-fiction	A5	A	AB	ABC	united_states%1:15:00::	A51	A	AB	ABC	 indeed in the musical history of the entire eastern United <font color=green>States</font> . On that date the Musicians Emergency Fund, organized to furnish	1	0	152	0	4	States	NNPS	technical
state/NN/br-e22/71	-0.181587327416628	0.0501196893507373	state	NN	skill_and_hobbies	non-fiction	A5	A	AB	ABC	united_states_of_america%1:15:00::	A51	A	AB	ABC	 Republics. The Serge Prokofieff whom we knew in the United <font color=green>States</font>  of America was gay, witty, mercurial, full of pranks and	1	0	157	0	1	States	NNPS	technical
state/NN/br-e27/125	0.196272034482059	-0.3013788632159	state	NN	skill_and_hobbies	non-fiction	A1	A	AB	ABC	state%1:15:01::	A	A	AB	ABC	 minerals. The drug 's chemical name is listed, since most <font color=green>states</font>  require feed processors to use this name instead of the	2	0	136	0	2	states	NNS	technical
state/NN/br-e27/173	-0.0110586255512898	-0.0696184681975268	state	NN	skill_and_hobbies	non-fiction	A3	A	AB	ABC	state%1:15:01::	A	A	AB	ABC	 drug is being marketed under one trade name only or <font color=green>state</font>  regulatory organizations have approved its use on the feed tag	3	1	126	33	3	state	NN	technical
state/NN/br-f03/1319	-0.137239913600915	-0.338366780442235	state	NN	popular_lore	fiction	D	D	D	D	state_of_matter%1:26:00::	D2	D	D	D	 the coexistence of the infinite number of universal, apparently momentary <font color=green>states</font>  of matter, successive one after another in consciousness, but permanent	2	0	135	0	2	states	NNS	essays
state/NN/br-f14/1295	0.0346941297702515	0.268866840453007	state	NN	popular_lore	fiction	B	B	AB	ABC	state%1:14:00::	B1	B	AB	ABC	 was attended by representatives of major organs of the German <font color=green>state</font> , including the Reich Minister of the Interior, the State Secretary	4	1	178	25	2	state	NN	essays
state/NN/br-f14/457	-0.398342377083209	0.0518135546928144	state	NN	popular_lore	fiction	A5	A	AB	ABC	united_states%1:15:00::	A51	A	AB	ABC	 and the tightening of Stalin 's dictatorship; in the United <font color=green>States</font>  the initiation of militant anti Communism, with the repentant ex	1	0	156	0	2	States	NNPS	essays
state/NN/br-f15/701	-0.030829935168264	-0.0133104753410328	state	NN	popular_lore	fiction	A1	A	AB	ABC	state%1:15:01::	A	A	AB	ABC	 considered by non-Catholics in family planning. The laws of many <font color=green>states</font>  permit birth control only for medical reasons. The Roman Catholic	2	1	173	50	3	states	NNS	essays
state/NN/br-f17/1114	-0.0141803497676667	0.112058951593729	state	NN	popular_lore	fiction	A5	A	AB	ABC	united_states%1:14:00::	A52	A	AB	ABC	 presence of a colony on the Red prompted the United <font color=green>State</font>  War Department in 1819 to send Lieutenant-Colonel Henry Leavenworth from	1	0	164	0	3	State	NNP	essays
state/NN/br-f17/1144	-0.0741730421252438	0.132352097579353	state	NN	popular_lore	fiction	A5	A	AB	ABC	united_states%1:15:00::	A51	A	AB	ABC	 of Prairie du Chien, until then the most advanced United <font color=green>States</font>  post. In September 1822 two companies of infantry arrived at	1	0	147	0	3	States	NNPS	essays
state/NN/br-f17/1330	-0.0802675756565103	-0.178405744431026	state	NN	popular_lore	fiction	A5	A	AB	ABC	united_states%1:15:00::	A51	A	AB	ABC	 and disappointed Swiss who turned their eyes toward the United <font color=green>States</font> . Observing their distressing condition, Colonel Snelling allowed these half starved	1	0	183	0	3	States	NNPS	essays
state/NN/br-f17/1627	-0.0561107169097445	-0.00384088946849411	state	NN	popular_lore	fiction	A5	A	AB	ABC	united_states%1:15:00::	A51	A	AB	ABC	 Swiss also decided to cast their lot with the United <font color=green>States</font> , and in 1823 several families paid guides to take them	1	0	149	0	4	States	NNPS	essays
state/NN/br-f17/1774	-0.196595253137115	0.183181625104829	state	NN	popular_lore	fiction	A5	A	AB	ABC	united_states%1:15:00::	A51	A	AB	ABC	 as Vevay, Indiana, a notable Swiss center in the United <font color=green>States</font> . In 1837, 157 Red River people with more than 200	2	1	177	50	3	States	NNPS	essays
state/NN/br-f17/548	-0.00599205048013911	0.0301918022767696	state	NN	popular_lore	fiction	A5	A	AB	ABC	united_states%1:15:00::	A51	A	AB	ABC	 of Congress forced the foreign firm out of the United <font color=green>States</font> , its British born employees, now become American citizens- Joseph Rolette	1	0	186	0	4	States	NNPS	essays
state/NN/br-f17/743	-0.132712823470431	0.111959502226842	state	NN	popular_lore	fiction	A5	A	AB	ABC	united_states%1:15:00::	A51	A	AB	ABC	 return to the Atlantic coast by way of the United <font color=green>States</font> . In September 1817 at Fort Daer( Pembina) Dickson met the	1	0	147	0	3	States	NNPS	essays
state/NN/br-f17/794	-0.0502886246571299	0.162074313840068	state	NN	popular_lore	fiction	A5	A	AB	ABC	united_states%1:15:00::	A51	A	AB	ABC	 route through Illinois territory to Indiana and the eastern United <font color=green>States</font>  was the best route for goods from England to reach	1	0	178	0	5	States	NNPS	essays
state/NN/br-f17/811	-0.0597837059913947	0.249826498315338	state	NN	popular_lore	fiction	A5	A	AB	ABC	united_states%1:15:00::	A51	A	AB	ABC	 from England to reach Red River and that the United <font color=green>States</font>  was a better source of supply for many goods than	1	0	166	0	2	States	NNPS	essays
state/NN/br-f17/844	-0.0196735884942453	0.0502629553426822	state	NN	popular_lore	fiction	C	C	C	ABC	secretary_of_state%1:18:01::	C1	C	C	ABC	 on December 22 wrote to John Quincy Adams, Secretary of <font color=green>State</font>  at Washington, inquiring about laws covering trade with`` Missouri and	2	2	150	100	6	State	NNP	essays
state/NN/br-f19/1831	-0.188061742096668	-0.129408657315115	state	NN	popular_lore	fiction	A5	A	AB	ABC	united_states%1:15:00::	A51	A	AB	ABC	 of the hundred odd folklore courses given in the United <font color=green>States</font>  survive on sentiment and nationalism alone. If one wishes to	1	0	155	0	3	States	NNPS	essays
state/NN/br-f19/231	0.018684738855906	0.154457998050124	state	NN	popular_lore	fiction	A5	A	AB	ABC	united_states%1:15:00::	A51	A	AB	ABC	 pine, and they can be applied again to the United <font color=green>States</font>  in more recent years. The popularity of local color literature	1	0	165	0	2	States	NNPS	essays
state/NN/br-f19/373	-0.275111988790595	-0.152189149306335	state	NN	popular_lore	fiction	A5	A	AB	ABC	united_states%1:15:00::	A51	A	AB	ABC	 of the major culture lags of the twentieth century United <font color=green>States</font> . Yet nationalism has lost few of its charms for the	1	0	182	0	1	States	NNPS	essays
state/NN/br-f19/619	-0.205817497939629	0.00911160942841032	state	NN	popular_lore	fiction	A	A	AB	ABC	state%1:15:01::	A	A	AB	ABC	 symbol of honesty and the father image of the uniting <font color=green>States</font> . Abraham Lincoln emerged as an incarnation of the national Constitution	4	2	124	50	3	States	NNPS	essays
state/NN/br-f20/1147	-0.310034342440322	0.259622458226516	state	NN	popular_lore	fiction	D	D	D	D	state%1:03:00::	D1	D	D	D	 guest list is in itself a little parable of the <font color=green>state</font>  of American civic life at this time. It included the	2	0	104	0	1	state	NN	essays
state/NN/br-f22/661	-0.409547216000944	0.256683930188034	state	NN	popular_lore	fiction	A5	A	AB	ABC	united_states%1:15:00::	A51	A	AB	ABC	 the best troop in the best regiment in the United <font color=green>States</font>  Army. He fed the captain bits of history about the	1	0	103	0	1	States	NNPS	essays
state/NN/br-f23/1235	-0.0769603444157339	-0.0268036860368302	state	NN	popular_lore	fiction	A5	A	AB	ABC	united_states%1:15:00::	A51	A	AB	ABC	 it. The evidence suggests that foreign peoples believe the United <font color=green>States</font>  is weaker than the Soviet Union, and is bound to	1	0	153	0	4	States	NNPS	essays
state/NN/br-f23/129	0.0170933199016615	-0.113161707872644	state	NN	popular_lore	fiction	A5	A	AB	ABC	united_states%1:15:00::	A51	A	AB	ABC	 these conditions be enjoyed by the people of the United <font color=green>States</font> . I speak of`` the largest possible measure'' because any person	1	0	136	0	2	States	NNPS	essays
state/NN/br-f23/1705	0.110280072280295	-0.111455033826965	state	NN	popular_lore	fiction	A5	A	AB	ABC	united_states%1:15:00::	A51	A	AB	ABC	 isolation and capture, not of Ghana, but of the United <font color=green>States</font> - and this purpose may be served very well by countries	1	0	104	0	1	States	NNPS	essays
state/NN/br-f23/773	-0.186792852564011	-0.0750344611364901	state	NN	popular_lore	fiction	A5	A	AB	ABC	united_states%1:15:00::	A51	A	AB	ABC	 over-all American strength with over-all Soviet strength finds the United <font color=green>States</font>  not only superior, but so superior both in present weapons	1	0	145	0	5	States	NNPS	essays
state/NN/br-f24/1198	-0.113957363417923	0.175060928547611	state	NN	popular_lore	fiction	A5	A	AB	ABC	united_states%1:15:00::	A51	A	AB	ABC	 of Paradise. He had attended three universities in the United <font color=green>States</font> . But he had never seen the mountainous half of his	1	0	146	0	2	States	NNPS	essays
state/NN/br-f24/525	-0.165781381591454	0.0609928171561576	state	NN	popular_lore	fiction	D	D	D	D	state%1:03:00::	D1	D	D	D	 11, 1960). And now, in March, all Laos suffered a <font color=green>state</font>  of siege. The Pathet Lao forces held two northern provinces	1	0	165	0	3	state	NN	essays
state/NN/br-f33/1948	-0.389183234528942	-0.153212546704049	state	NN	popular_lore	fiction	A5	A	AB	ABC	united_states%1:15:00::	A51	A	AB	ABC	 get in. In a far distant part of the United <font color=green>States</font> , I was talking to an instructor about a boy who	1	0	120	0	1	States	NNPS	essays
