id	model.x	model.y	lemma	wf	pos	genre	broad_genre	marisense	mbroad	mari3	mari2	sensekey	wnsense	wnbroad	wn3	wn2	text	cues	cues_with_weight	mean_weight_x100	wcratio_x100	weighted_cw	new_pos	new_broad_genre
state/JJ/br-g17/2159	-0.02420940143229	-0.0191032098950933	state	state	JJ	belles_lettres	fiction	A2	A	AB	ABC	state%5:00:02:public:00	A2	A	AB	ABC	 is involved. How did it happen, for example, that the <font color=green>state</font>  university, that great symbol of American democracy, failed to flourish	3	3	313	100	6	JJ	fiction
state/JJ/br-g17/2327	-0.0401925991213144	-0.0662678488545254	state	state	JJ	belles_lettres	fiction	A2	A	AB	ABC	state%5:00:02:public:00	A2	A	AB	ABC	 been the very last of the forty-eight to establish a <font color=green>state</font>  university? The state universities of Maine, New Hampshire, And Vermont	4	1	403	25	5	JJ	fiction
state/JJ/br-g17/2331	-0.0527137586110953	-0.0613624811595198	state	state	JJ	belles_lettres	fiction	A2	A	AB	ABC	state%5:00:02:public:00	A2	A	AB	ABC	 last of the forty-eight to establish a state university? The <font color=green>state</font>  universities of Maine, New Hampshire, And Vermont are older and	4	2	427	50	5	JJ	fiction
state/JJ/br-g23/486	-0.0589706041985959	-0.0269254995594149	state	state	JJ	belles_lettres	fiction	A2	A	AB	ABC	state%5:00:02:public:00	A2	A	AB	ABC	 The writer took a class of college students to the <font color=green>state</font>  hospital for the mentally ill in St. Joseph, Missouri. An	2	2	331	100	9	JJ	fiction
state/JJ/br-l14/977	-0.113356866209225	-0.012630107742601	state	State	JJ	fiction_mystery	fiction	A2	A	AB	ABC	state%5:00:02:public:00	A2	A	AB	ABC	 modern, large, on five acres. Must have cost plenty. The <font color=green>State</font>  cops would check from time to time; pass word when	1	1	340	100	6	JJ	fiction
state/NN/br-f05/813	-0.494027908550666	-0.0247078553102135	state	state	NN	popular_lore	fiction	A4	A	AB	ABC	Z	Z	Z	Z	Z	 to a brand-new airplane, aimed at putting their city and <font color=green>state</font>  on the flying map. The ship was a Waco biplane	2	1	204	50	1	NN	essays
state/NN/br-f11/162	0.0845349865567461	-0.349864696995729	state	States	NN	popular_lore	fiction	A5	A	AB	ABC	Z	Z	Z	Z	Z	 no special case.`` The majority of children in the United <font color=green>States</font>  could benefit by some form of orthodontic treatment'', says Dr.	1	0	216	0	1	NNPS	essays
state/NN/br-f12/263	0.0679347901940479	0.430281984497924	state	state	NN	popular_lore	fiction	D	D	D	D	Z	Z	Z	Z	Z	 this experiment are in a waking or only slightly dissociated <font color=green>state</font> , so that the sitter can make comments, ask and answer	3	0	218	0	1	NN	essays
state/NN/br-f14/1295	0.175501226029386	-0.294971595917571	state	state	NN	popular_lore	fiction	B	B	AB	ABC	state%1:14:00::	B1	B	AB	ABC	 was attended by representatives of major organs of the German <font color=green>state</font> , including the Reich Minister of the Interior, the State Secretary	4	0	215	0	1	NN	essays
state/NN/br-f15/701	-0.118321998542188	-0.23185205718292	state	states	NN	popular_lore	fiction	A1	A	AB	ABC	state%1:15:01::	A	A	AB	ABC	 considered by non-Catholics in family planning. The laws of many <font color=green>states</font>  permit birth control only for medical reasons. The Roman Catholic	2	0	225	0	1	NNS	essays
state/NN/br-f17/1114	-0.0921953274227418	-0.172156985287168	state	State	NN	popular_lore	fiction	A5	A	AB	ABC	united_states%1:14:00::	A52	A	AB	ABC	 presence of a colony on the Red prompted the United <font color=green>State</font>  War Department in 1819 to send Lieutenant-Colonel Henry Leavenworth from	1	0	211	0	1	NNP	essays
state/NN/br-f17/1330	0.447291030557916	-0.0819093588146161	state	States	NN	popular_lore	fiction	A5	A	AB	ABC	united_states%1:15:00::	A51	A	AB	ABC	 and disappointed Swiss who turned their eyes toward the United <font color=green>States</font> . Observing their distressing condition, Colonel Snelling allowed these half starved	1	0	248	0	1	NNPS	essays
state/NN/br-f17/1627	0.447291030557923	-0.0819093588146174	state	States	NN	popular_lore	fiction	A5	A	AB	ABC	united_states%1:15:00::	A51	A	AB	ABC	 Swiss also decided to cast their lot with the United <font color=green>States</font> , and in 1823 several families paid guides to take them	1	0	248	0	1	NNPS	essays
state/NN/br-f17/1774	0.447291030557931	-0.0819093588146188	state	States	NN	popular_lore	fiction	A5	A	AB	ABC	united_states%1:15:00::	A51	A	AB	ABC	 as Vevay, Indiana, a notable Swiss center in the United <font color=green>States</font> . In 1837, 157 Red River people with more than 200	2	1	248	50	1	NNPS	essays
state/NN/br-f17/548	-0.324134689255291	-0.0601308386176987	state	States	NN	popular_lore	fiction	A5	A	AB	ABC	united_states%1:15:00::	A51	A	AB	ABC	 of Congress forced the foreign firm out of the United <font color=green>States</font> , its British born employees, now become American citizens- Joseph Rolette	1	0	220	0	1	NNPS	essays
state/NN/br-f17/794	-0.212203887025347	-0.34982289336059	state	States	NN	popular_lore	fiction	A5	A	AB	ABC	united_states%1:15:00::	A51	A	AB	ABC	 route through Illinois territory to Indiana and the eastern United <font color=green>States</font>  was the best route for goods from England to reach	1	0	259	0	1	NNPS	essays
state/NN/br-f17/844	-0.231485456233944	-0.105074559956111	state	State	NN	popular_lore	fiction	C	C	C	ABC	secretary_of_state%1:18:01::	C1	C	C	ABC	 on December 22 wrote to John Quincy Adams, Secretary of <font color=green>State</font>  at Washington, inquiring about laws covering trade with`` Missouri and	2	1	261	50	1	NNP	essays
state/NN/br-f19/231	0.212185781067299	0.439671937474666	state	States	NN	popular_lore	fiction	A5	A	AB	ABC	united_states%1:15:00::	A51	A	AB	ABC	 pine, and they can be applied again to the United <font color=green>States</font>  in more recent years. The popularity of local color literature	1	0	212	0	1	NNPS	essays
state/NN/br-f23/1235	0.257752181651279	0.171936307258701	state	States	NN	popular_lore	fiction	A5	A	AB	ABC	united_states%1:15:00::	A51	A	AB	ABC	 it. The evidence suggests that foreign peoples believe the United <font color=green>States</font>  is weaker than the Soviet Union, and is bound to	1	0	233	0	1	NNPS	essays
state/NN/br-g01/1187	-0.359171213806904	0.0907705932614732	state	states	NN	belles_lettres	fiction	A	A	AB	ABC	state%1:15:01::	A	A	AB	ABC	 traditional way of life persists much more in the older <font color=green>states</font>  than in the new ones. Probably a larger percentage of	5	0	252	0	1	NNS	fiction
state/NN/br-g01/1276	-0.221073892127271	0.388084696371968	state	states	NN	belles_lettres	fiction	A4	A	AB	ABC	state%1:15:01::	A	A	AB	ABC	 of course, important minority enclaves. The long settled areas of <font color=green>states</font>  like Virginia and South Carolina developed the ante-bellum culture to	4	0	240	0	1	NNS	fiction
state/NN/br-g01/26	0.0714709493115201	-0.230121689393347	state	state	NN	belles_lettres	fiction	C	C	C	ABC	welfare_state%1:14:00::	B	B	AB	ABC	 also led the nation in the direction of a welfare <font color=green>state</font> . And both in their objectives of non-discrimination and of social	4	1	283	25	1	NN	fiction
state/NN/br-g01/454	-0.0347840464796689	0.144534713479384	state	states	NN	belles_lettres	fiction	A1	A	AB	ABC	state%1:15:01::	A	A	AB	ABC	 to coerce an uncooperative Congress or Supreme Court. As for <font color=green>states</font> ' rights, they have never counted in the thinking of my	4	1	219	25	2	NNS	fiction
state/NN/br-g02/1113	0.0714709493115201	-0.230121689393347	state	States	NN	belles_lettres	fiction	A5	A	AB	ABC	Z	Z	Z	Z	Z	 individual welfare is a concept not limited to the United <font color=green>States</font>  or even to the Western nations. A measure of its	1	0	283	0	1	NNPS	fiction
state/NN/br-g02/1335	0.0714709493115201	-0.230121689393347	state	states	NN	belles_lettres	fiction	C	C	C	ABC	Z	Z	Z	Z	Z	 better or for worse, we all now live in welfare <font color=green>states</font> , the organizing principle of which is collective responsibility for individual	4	1	283	25	1	NNS	fiction
state/NN/br-g02/1630	0.437834901106286	0.0657929857328406	state	state	NN	belles_lettres	fiction	C	C	C	ABC	Z	Z	Z	Z	Z	 is the political principle that epitomizes and glorifies the territorial <font color=green>state</font>  as the characteristic type of socal structure. But it is	5	1	285	20	1	NN	fiction
state/NN/br-g02/1874	0.305264090099954	-0.326543956850909	state	state	NN	belles_lettres	fiction	C	C	C	ABC	Z	Z	Z	Z	Z	 that the viability and usefulness of nationalism and the territorial <font color=green>state</font>  are rapidly dissipating at precisely the time that the nation-state	3	1	285	33	1	NN	fiction
state/NN/br-g02/381	0.0845349865567461	-0.349864696995729	state	States	NN	belles_lettres	fiction	A5	A	AB	ABC	Z	Z	Z	Z	Z	 in motivation, however much other nations( e. g., the United <font color=green>States</font> ) may have incidentally benefited. At the same time, all suggestions	1	0	216	0	1	NNPS	fiction
state/NN/br-g02/411	0.111235890513081	-0.181874630445688	state	state	NN	belles_lettres	fiction	C	C	C	ABC	Z	Z	Z	Z	Z	 existed for the welfare of the people within the territorial <font color=green>state</font>  was strongly resisted. Social Darwinism was able to stave off	4	2	284	50	2	NN	fiction
state/NN/br-g02/681	0.0714709493115201	-0.230121689393347	state	state	NN	belles_lettres	fiction	C	C	C	ABC	Z	Z	Z	Z	Z	 the many facets of the American version of the welfare <font color=green>state</font>  have become part of the conventional wisdom. A national consensus	3	1	283	33	1	NN	fiction
state/NN/br-g07/2122	-0.245396604464686	0.32737887572507	state	state	NN	belles_lettres	fiction	A	A	AB	ABC	Z	Z	Z	Z	Z	 former and Jefferson and Madison upholding the latter position. The <font color=green>state</font>  's rights position was formulated by Jefferson and Madison in	5	2	218	40	2	NN	fiction
state/NN/br-g07/2238	-0.150140924297062	0.300722214512101	state	state	NN	belles_lettres	fiction	A	A	AB	ABC	Z	Z	Z	Z	Z	 in 1832, the South Carolina nullifiers adopted the principle of <font color=green>state</font>  interposition which Madison had advanced in his old Virginia Resolve	4	0	229	0	2	NN	fiction
state/NN/br-g07/690	-0.295159429388705	0.225761038829146	state	state	NN	belles_lettres	fiction	A1	A	AB	ABC	Z	Z	Z	Z	Z	 of pre-Revolutionary radical ideology, wrote the constitution of his home <font color=green>state</font>  of Massachusetts, negotiated, with Franklin and Jay, the peace with	4	1	217	25	1	NN	fiction
state/NN/br-g07/853	-0.231485456233944	-0.105074559956111	state	State	NN	belles_lettres	fiction	C	C	C	ABC	Z	Z	Z	Z	Z	 party in American history, and, as Jefferson 's Secretary of <font color=green>State</font>  and his successor in the Presidency, guided the nation through	1	1	261	100	1	NNP	fiction
state/NN/br-g10/1160	0.193659497331981	0.116717408145492	state	state	NN	belles_lettres	fiction	A1	A	AB	ABC	Z	Z	Z	Z	Z	 of America''.`` We the people of the Confederate States, each <font color=green>state</font>  acting in its sovereign and independent character, in order to	4	2	233	50	2	NN	fiction
state/NN/br-g10/1216	0.238374327907537	0.304292483645222	state	States	NN	belles_lettres	fiction	A5	A	AB	ABC	Z	Z	Z	Z	Z	 God- do ordain and establish this Constitution for the Confederate <font color=green>States</font>  of America''. One is tempted to say that, on the	3	1	240	33	1	NNPS	fiction
state/NN/br-g10/1323	0.299897172638734	0.112755162858893	state	state	NN	belles_lettres	fiction	A1	A	AB	ABC	Z	Z	Z	Z	Z	 them, the same right must be conceded to each remaining <font color=green>state</font>  whenever it saw fit to secede: This would destroy the	1	1	254	100	1	NN	fiction
state/NN/br-g10/1790	0.368250215825448	-0.280098895795189	state	State	NN	belles_lettres	fiction	C	C	C	ABC	Z	Z	Z	Z	Z	 Inaugural. To my knowledge, Lincoln remains the only Head of <font color=green>State</font>  and Commander-in-Chief who, while fighting a fearful war whose issue	3	0	230	0	1	NNP	fiction
state/NN/br-g10/586	0.238374327907531	0.304292483645215	state	States	NN	belles_lettres	fiction	A5	A	AB	ABC	Z	Z	Z	Z	Z	 to secede'', they formed what they officially styled`` The Confederate <font color=green>States</font>  of America''. Dictionaries, as we have seen, still cite this	2	1	240	50	1	NNPS	fiction
state/NN/br-g10/688	-0.0312937290452236	-0.247378738778461	state	state	NN	belles_lettres	fiction	A3	A	AB	ABC	Z	Z	Z	Z	Z	 substantially the same division of power between the central and <font color=green>state</font>  governments, and among the executive, legislative and judicial branches. Many	4	1	271	25	1	NN	fiction
state/NN/br-g10/731	0.299897172638734	0.112755162858893	state	state	NN	belles_lettres	fiction	A1	A	AB	ABC	Z	Z	Z	Z	Z	 Constitution was that the former recognized the right of each <font color=green>state</font>  to secede. But though each of its members had asserted	3	1	254	33	1	NN	fiction
state/NN/br-g10/773	0.168063590327799	0.00137727692372331	state	state	NN	belles_lettres	fiction	A1	A	AB	ABC	Z	Z	Z	Z	Z	 month before hostilities began- included no explicit provision authorizing a <font color=green>state</font>  to secede. Its drafters discussed this vital point but left	3	2	234	67	3	NN	fiction
state/NN/br-g17/2194	-0.253900967264584	0.19218561384135	state	states	NN	belles_lettres	fiction	A	A	AB	ABC	state%1:15:01::	A	A	AB	ABC	 country? Is n't it a bit odd that the three <font color=green>states</font>  of Southern New England( Massachusetts, Connecticut, and Rhode Island) have	4	2	219	50	2	NNS	fiction
state/NN/br-g17/2210	-0.253900967264584	0.19218561384135	state	state	NN	belles_lettres	fiction	A2	A	AB	ABC	state%1:15:01::	A	A	AB	ABC	 Southern New England( Massachusetts, Connecticut, and Rhode Island) have had <font color=green>state</font>  institutions of university status only in the very recent past	5	2	219	40	2	NN	fiction
state/NN/br-g19/545	-0.0113632352405398	-0.460010369269855	state	States	NN	belles_lettres	fiction	A5	A	AB	ABC	united_states%1:15:00::	A51	A	AB	ABC	 of the giant corporations in Western Europe and the United <font color=green>States</font>  dates from the period 1880- 1900. Now, although the roots	1	0	257	0	1	NNPS	fiction
state/NN/br-g21/2184	-0.0275454435004992	0.46886708904217	state	state	NN	belles_lettres	fiction	D	D	D	D	state%1:03:00::	D1	D	D	D	 to you an uncertain and uneasy, not to say confused, <font color=green>state</font>  of the public mind? What is the common man 's	4	1	204	25	1	NN	fiction
state/NN/br-g21/244	0.211200791204943	-0.212194718858168	state	States	NN	belles_lettres	fiction	A5	A	AB	ABC	united_states%1:14:00::	A52	A	AB	ABC	 to be the duty of the destiny of the United <font color=green>States</font>  to assist in the creation of a better world by	1	0	239	0	1	NNPS	fiction
state/NN/br-g22/594	-0.0921953274227418	-0.172156985287168	state	State	NN	belles_lettres	fiction	C	C	C	ABC	state_department%1:14:00::	C1	C	C	ABC	 of`` The Soviet Cultural Offensive'', he says,`` Long before the <font color=green>State</font>  Department organized its bureaucracy into an East-West Contacts Staff in	2	1	211	50	1	NNP	fiction
state/NN/br-g22/643	-0.0921953274227418	-0.172156985287168	state	State	NN	belles_lettres	fiction	C	C	C	ABC	state_department%1:14:00::	C1	C	C	ABC	 when the enterprising promoters of' Porgy and Bess' overrode the <font color=green>State</font>  Department to carry the contemporary' cultural warfare' behind the enemy	1	1	211	100	1	NNP	fiction
state/NN/br-k03/2239	0.472923089111147	-0.0227807865338228	state	state	NN	fiction_gral	fiction	A4	A	AB	ABC	state%1:15:01::	A	A	AB	ABC	 've got a quarter of a million Germans in my <font color=green>state</font> , and those krautheads tune in on Father Werther every night	2	0	203	0	1	NN	fiction
state/NN/br-k03/2311	0.0382446312999975	0.415824328282587	state	state	NN	fiction_gral	fiction	A4	A	AB	ABC	state%1:15:01::	A	A	AB	ABC	 he says,' Look here, there 's a mill in my <font color=green>state</font>  employs five thousand people making uniforms for the Navy.	3	1	201	33	1	NN	fiction
state/NN/br-k05/60	-0.231485456233944	-0.105074559956111	state	State	NN	fiction_gral	fiction	C	C	C	ABC	secretary_of_state%1:18:00::	C1	C	C	ABC	 he was delivering a prescription from Dr. Verdi. Secretary of <font color=green>State</font>  Seward was a sick man. The idea had come from	1	0	261	0	1	NNP	fiction
state/NN/br-k10/1990	0.186096946454933	0.047532835910678	state	state	NN	fiction_gral	fiction	B	B	AB	ABC	state%1:14:01::	B	B	AB	ABC	 or unleavened bread are inconsequential. Geneva must remain a sovereign <font color=green>state</font> . We will not yield to the demands of Bern''! The	3	2	246	67	2	NN	fiction
state/NN/br-l16/552	-0.0921953274227418	-0.172156985287168	state	State	NN	fiction_mystery	fiction	C	C	C	ABC	state_department%1:14:00::	C1	C	C	ABC	 Leigh. If you want to spend another day in the <font color=green>State</font>  Department- another day- you get in there and tell that	1	1	211	100	1	NNP	fiction
state/NN/br-m03/1014	0.257752181651279	0.171936307258701	state	States	NN	fiction_science	fiction	A5	A	AB	ABC	Z	Z	Z	Z	Z	 agreements, for instance, had been unreassuringly dismal; but the United <font color=green>States</font>  and the Union of Soviet Socialist Republics nevertheless did eventually	1	0	233	0	1	NNPS	fiction
state/NN/br-p05/1180	-0.311459857933873	-0.353744660887978	state	states	NN	fiction_romance	fiction	B	B	AB	ABC	Z	Z	Z	Z	Z	 Orient in their faces; there are beauties from the Balkan <font color=green>states</font>  who are similarly endowed, and- back in the blessed United	1	0	225	0	1	NNS	fiction
state/NN/br-p05/1193	-0.312597825620693	-0.352571127226774	state	States	NN	fiction_romance	fiction	A5	A	AB	ABC	Z	Z	Z	Z	Z	 who are similarly endowed, and- back in the blessed United <font color=green>States</font> - they were regarded simply as pretty women. Now, having been	1	0	225	0	1	NNPS	fiction
state/NNP/br-f04/1665	-0.0960923328831322	0.0108066495523327	state	State	NNP	popular_lore	fiction	A5	A	AB	ABC	Z	Z	Z	Z	Z	 Following a talk by Mr. Clark at the New York <font color=green>State</font>  Natural Food Associates Convention, a man from the audience offered	2	1	254	50	5	NNP	essays
state/NNP/br-f05/1004	-0.164084994482359	0.0358967895740648	state	State	NNP	popular_lore	fiction	A3	A	AB	ABC	Z	Z	Z	Z	Z	 set his plane down on Towne field back of the <font color=green>State</font>  House when the wind was right, and used Wilson flat	2	0	232	0	2	NNP	essays
state/NNP/br-f05/568	-0.084566670148678	-0.0140465865743921	state	State	NNP	popular_lore	fiction	A3	A	AB	ABC	Z	Z	Z	Z	Z	 the flood. Though the makeshift airports were ready, the York <font color=green>State</font>  Guard flyers proved unable to keep any kind of mail	2	1	229	50	4	NNP	essays
state/NNP/br-f14/1306	-0.462430392286672	-0.167800118621561	state	State	NNP	popular_lore	fiction	C	C	C	ABC	person%1:03:00::	C1	C	C	ABC	 German state, including the Reich Minister of the Interior, the <font color=green>State</font>  Secretary in charge of the Four Year Plan, the Reich	4	0	310	0	1	NNP	essays
state/NNP/br-f24/1708	-0.014895195229178	-0.107917109934451	state	States	NNP	popular_lore	fiction	A5	A	AB	ABC	group%1:03:00::	B	B	AB	ABC	 Economics, headed the rural development division of USOM, the United <font color=green>States</font>  Operations Mission administering U. S. aid.`` What you see are	3	0	232	0	3	NNPS	essays
state/NNP/br-g02/719	-0.0807577938162605	0.0827203985848949	state	State	NNP	belles_lettres	fiction	B	B	AB	ABC	Z	Z	Z	Z	Z	 Ratified in the Republican Party victory in 1952, the Positive <font color=green>State</font>  is now evidenced by political campaigns being waged not on	4	2	291	50	5	NNP	fiction
state/NNP/br-g06/699	-0.192695075452311	0.000595600304542283	state	State	NNP	belles_lettres	fiction	B	B	AB	ABC	Z	Z	Z	Z	Z	 his tenure he also fulfilled guest engagements at the Berlin <font color=green>State</font>  Opera. Two years later he became director of the Frankfurt	3	1	262	33	3	NNP	fiction
state/NNP/br-g07/30	-0.153894438656545	-0.319225179553928	state	State	NNP	belles_lettres	fiction	A5	A	AB	ABC	Z	Z	Z	Z	Z	 That test, as President Kennedy forthrightly depicted it in his <font color=green>State</font>  of the Union message, will determine`` whether a nation organized	2	0	209	0	1	NNP	fiction
state/NNP/br-g10/357	0.25071648341048	0.072547698200381	state	State	NNP	belles_lettres	fiction	A	A	AB	ABC	Z	Z	Z	Z	Z	 the right to secede from it. This right of the <font color=green>State</font> , its upholders contended, was essential to maintain the federal balance	4	0	345	0	2	NNP	fiction
state/NNP/br-k03/1304	-0.498522378038835	0.207785726727936	state	State	NNP	fiction_gral	fiction	A2	A	AB	ABC	group%1:03:00::	B	B	AB	ABC	 a pharmacist. And so he had, so he had. At <font color=green>State</font>  College, he had no time to walk among the violets	1	0	300	0	1	NNP	fiction
state/NNP/br-k03/485	-0.122185229472544	0.484593225052668	state	States	NNP	fiction_gral	fiction	A5	A	AB	ABC	location%1:03:00::	A	A	AB	ABC	 I heard of some that tried it back in the <font color=green>States</font> , and he 'd knock them clear across the room. There	1	0	254	0	1	NNPS	fiction
state/NNP/br-k15/1529	-0.0407803755073195	0.0279611209551742	state	state	NNP	fiction_gral	fiction	A3	A	AB	ABC	group%1:03:00::	B	B	AB	ABC	 the U.S. Army. In spite of the fact that the <font color=green>state</font>  legislature voted us neutral, John Hunt Morgan is openly flying	5	4	255	80	6	NN	fiction
state/NNP/br-l01/1520	-0.133815920891028	-0.0852697614736667	state	State	NNP	fiction_mystery	fiction	A2	A	AB	ABC	Z	Z	Z	Z	Z	 the state of Illinois knew that I was entering Hanover <font color=green>State</font>  Hospital under an assumed name, or why. It was unlikely	1	1	286	100	4	NNP	fiction
state/NNPS/br-f02/8	-0.123621294814522	0.0550927378866304	state	States	NNPS	popular_lore	fiction	A5	A	AB	ABC	Z	Z	Z	Z	Z	 She was just another freighter from the <font color=green>States</font> , and she seemed as commonplace as her name. She was	1	0	275	0	3	NNPS	essays
state/NNPS/br-g07/2287	-0.0563810373806889	0.0693426389804853	state	States	NNPS	belles_lettres	fiction	A	A	AB	ABC	Z	Z	Z	Z	Z	 death, Madison expressed the wish`` that the Union of the <font color=green>States</font>  be cherished and perpetuated. Let the open enemy to it	1	0	414	0	7	NNPS	fiction
state/NNPS/br-g10/1157	0.0206707730237491	0.00184842513875077	state	States	NNPS	belles_lettres	fiction	A5	A	AB	ABC	Z	Z	Z	Z	Z	 United States of America''.`` We the people of the Confederate <font color=green>States</font> , each state acting in its sovereign and independent character, in	1	1	359	100	9	NNPS	fiction
state/NNPS/br-g10/1255	0.035091174505298	0.0694986153296549	state	States	NNPS	belles_lettres	fiction	A	A	AB	ABC	Z	Z	Z	Z	Z	 of the Nineteenth century was fought. But though the Southern <font color=green>States</font> , when drafting a constitution to unite themselves, narrowed the difference	3	1	406	33	3	NNPS	fiction
state/NNPS/br-g10/1505	-0.0627678945759321	-0.0382830049822364	state	States	NNPS	belles_lettres	fiction	A	A	AB	ABC	Z	Z	Z	Z	Z	 of the slaves by Union action even in the Border <font color=green>States</font>  that stayed with the Union. He issued his Emancipation Proclamation	3	0	341	0	3	NNPS	fiction
state/NNPS/br-g10/1942	0.0228662671720996	0.105849431290789	state	States	NNPS	belles_lettres	fiction	A	A	AB	ABC	Z	Z	Z	Z	Z	 the balance between the powers they had delegated to the <font color=green>States</font>  and to their Union. They differed in the balance they	3	2	474	67	4	NNPS	fiction
state/NNPS/br-g10/2221	-0.0798834512508671	0.0375253886612591	state	States	NNPS	belles_lettres	fiction	A	A	AB	ABC	Z	Z	Z	Z	Z	 from the ballot to the bullet. Yet though the Southern <font color=green>States</font>  lost the worst errors in their case, they did not	1	0	397	0	6	NNPS	fiction
state/NNPS/br-g10/305	-0.04944610858878	-0.00932760333816332	state	States	NNPS	belles_lettres	fiction	A	A	AB	ABC	Z	Z	Z	Z	Z	 this subject. The difference came down to this: The Southern <font color=green>States</font>  insisted that the United States was, in last analysis, what	2	0	337	0	5	NNPS	fiction
state/NNPS/br-g10/325	-0.0514102000559499	0.00818567683021357	state	States	NNPS	belles_lettres	fiction	A	A	AB	ABC	Z	Z	Z	Z	Z	 in last analysis, what its name implied- a Union of <font color=green>States</font> . To their leaders the Constitution was a compact made by	2	0	422	0	4	NNPS	fiction
state/NNPS/br-g10/568	0.0303810101048192	0.024907069851955	state	States	NNPS	belles_lettres	fiction	A1	A	AB	ABC	Z	Z	Z	Z	Z	 the base alloy of hypocrisy''.[ His emphasis] When the Southern <font color=green>States</font>  exercised their`` right to secede'', they formed what they officially	2	1	419	50	5	NNPS	fiction
state/NNPS/br-l03/126	-0.104333803951054	0.0491744243051297	state	States	NNPS	fiction_mystery	fiction	A5	A	AB	ABC	Z	Z	Z	Z	Z	 on duty, too''.`` A night policeman just like in the <font color=green>States</font> . You know''?`` Canada does n't have much of this here	1	1	344	100	5	NNPS	fiction
state/NNPS/br-l03/1478	-0.130253884337301	0.130689222852349	state	States	NNPS	fiction_mystery	fiction	A5	A	AB	ABC	Z	Z	Z	Z	Z	 a poor dumb Canadian or a smart aleck from the <font color=green>States</font> ''? Vince lifted his hand as if to strike, but his	2	0	438	0	6	NNPS	fiction
state/NNPS/br-p05/410	-0.0214286448312331	-0.0454039526120279	state	States	NNPS	fiction_romance	fiction	A5	A	AB	ABC	Z	Z	Z	Z	Z	 marriage counselor- sometimes the Navy sent people back to the <font color=green>States</font>  to preserve a marriage- but mental health as a rule	1	0	370	0	8	NNPS	fiction
state/NNS/br-g02/1031	-0.0109203237666778	-0.0272435298139834	state	states	NNS	belles_lettres	fiction	A	A	AB	ABC	Z	Z	Z	Z	Z	 nation-wide taxation rather than by a levy only on those <font color=green>states</font>  afflicted with manpower surplus. The American people have indeed come	5	2	285	40	4	NNS	fiction
