id	model.x	model.y	lemma	wf	pos	genre	broad_genre	marisense	mbroad	mari3	mari2	sensekey	wnsense	wnbroad	wn3	wn2	text	cues	cues_with_weight	mean_weight_x100	wcratio_x100	weighted_cw	new_pos	new_broad_genre
state/NN/br-a01/1015	-0.104083625471611	0.0780007944703492	state	state	NN	press_reportage	press	A3	A	AB	ABC	state%1:14:01::	B	B	AB	ABC	 governor 's race, a top official said Wednesday. Robert Snodgrass, <font color=green>state</font>  GOP chairman, said a meeting held Tuesday night in Blue	3	1	73	33	7	NN	press
state/NN/br-a01/1049	-0.132675370384176	-0.254960868689574	state	state	NN	press_reportage	press	A3	A	AB	ABC	state%1:15:01::	A	A	AB	ABC	 W. Dorsey added that enthusiasm was picking up for a <font color=green>state</font>  rally to be held Sept. 8 in Savannah at which	2	0	52	0	3	NN	press
state/NN/br-a01/1165	-0.0274392988144519	-0.018412780759525	state	state	NN	press_reportage	press	A3	A	AB	ABC	state%1:14:00::	B1	B	AB	ABC	 largest hurdle the Republicans would have to face is a <font color=green>state</font>  law which says that before making a first race, one	2	2	124	100	4	NN	press
state/NN/br-a01/1440	-0.0435872076021984	0.0884401141316453	state	state	NN	press_reportage	press	A3	A	AB	ABC	state%1:14:00::	B1	B	AB	ABC	 highway reconstruction bonds. The bond issue will go to the <font color=green>state</font>  courts for a friendly test suit to test the validity	2	2	100	100	7	NN	press
state/NN/br-a01/1835	0.049971139714186	0.171799657442156	state	state	NN	press_reportage	press	A3	A	AB	ABC	state%1:14:00::	B1	B	AB	ABC	 education, provided that such funds be received and expended'' as <font color=green>state</font>  funds. Barber, who is in his 13th year as a	3	3	109	100	4	NN	press
state/NN/br-a01/413	0.17074510024344	0.105130742425358	state	state	NN	press_reportage	press	A4	A	AB	ABC	state%1:15:01::	A	A	AB	ABC	 through the welfare departments of all the counties in the <font color=green>state</font>  with the exception of Fulton County, which receives none of	2	2	173	100	5	NN	press
state/NN/br-a02/1165	-0.0472304866859053	0.0620561077529941	state	State	NN	press_reportage	press	A2	A	AB	ABC	state%1:15:01::	A	A	AB	ABC	 attorney general and chief justice of the Texas Supreme Court. <font color=green>State</font>  representatives decided Thursday against taking a poll on what kind	3	2	140	67	8	NNP	press
state/NN/br-a02/1454	0.065331491913375	0.129502825705703	state	state	NN	press_reportage	press	A1	A	AB	ABC	state%1:14:01::	B	B	AB	ABC	 would increase from$ 5000000 to$ 15000000 the maximum loan the <font color=green>state</font>  could make to a local water project. Cotten construed this	3	2	82	67	4	NN	press
state/NN/br-a02/165	-0.0209178062888717	-0.0146039124699816	state	state	NN	press_reportage	press	A1	A	AB	ABC	state%1:14:01::	B	B	AB	ABC	 the books`` since Texas was a republic''. It permits the <font color=green>state</font>  to take over bank accounts, stocks and other personal property	4	1	87	25	5	NN	press
state/NN/br-a02/2003	0.0393665817463812	0.108412915746985	state	State	NN	press_reportage	press	A3	A	AB	ABC	state%1:14:01::	B	B	AB	ABC	 62 session upon the recommendation of Supt. Chester O. Strickland. <font color=green>State</font>  and federal legislation against racial discrimination in employment was called	2	2	116	100	8	NNP	press
state/NN/br-a02/214	0.0298073900096575	0.0259185256785293	state	state	NN	press_reportage	press	A2	A	AB	ABC	state_treasurer%1:18:00::	A2	A	AB	ABC	 companies and other corporations to report such property to the <font color=green>state</font>  treasurer. The escheat law cannot be enforced now because it	3	2	101	67	7	NN	press
state/NN/br-a02/470	0.107250625366779	0.154408883713104	state	state	NN	press_reportage	press	A1	A	AB	ABC	state%1:14:00::	B1	B	AB	ABC	 in the scholastic age at a reduced cost to the <font color=green>state</font> . There was no debate as the Senate passed the bill	3	3	121	100	5	NN	press
state/NN/br-a02/620	-0.0354168824560259	0.195589426413434	state	state	NN	press_reportage	press	A2	A	AB	ABC	state%1:15:01::	A	A	AB	ABC	 saving them from coming to Austin to live in the <font color=green>state</font>  deaf school. Dallas may get to hear a debate on	3	3	85	100	5	NN	press
state/NN/br-a03/507	-0.0684061985238534	-0.0644757347641656	state	state	NN	press_reportage	press	A1	A	AB	ABC	Z	Z	Z	Z	Z	 cases. In the two other cases he ruled that the <font color=green>state</font>  had been`` unable to make a case''. Contempt proceedings originally	3	1	66	33	6	NN	press
state/NN/br-a04/1377	0.0324929293546267	-0.173531904463794	state	States	NN	press_reportage	press	A5	A	AB	ABC	Z	Z	Z	Z	Z	 of Cuba by exile groups''. It recommends that the United <font color=green>States</font> `` seek instead to detach the Castro regime from the Communist	1	0	106	0	5	NNPS	press
state/NN/br-a04/1730	0.095167170701693	-0.252114869348557	state	States	NN	press_reportage	press	A5	A	AB	ABC	Z	Z	Z	Z	Z	 gave sufficient provocation at any one time for the United <font color=green>States</font>  to want to risk a limited or an all-out war	1	0	85	0	3	NNPS	press
state/NN/br-a04/1805	0.106832251999423	-0.0577143250171579	state	States	NN	press_reportage	press	A5	A	AB	ABC	Z	Z	Z	Z	Z	 of a neutralized Laos. The pro-Western government, which the United <font color=green>States</font>  had helped in a revolt against the Souvanna Phouma`` neutralist	1	0	143	0	4	NNPS	press
state/NN/br-a04/1848	0.149877992393908	-0.0304492779290393	state	States	NN	press_reportage	press	A5	A	AB	ABC	Z	Z	Z	Z	Z	 any more energy displayed after it was clear the United <font color=green>States</font>  would not back the pro-Western government to the hilt. If	1	0	114	0	4	NNPS	press
state/NN/br-a04/1926	-0.15363020946584	-0.00257722177615155	state	States	NN	press_reportage	press	A5	A	AB	ABC	Z	Z	Z	Z	Z	 Relations Committee. He declared on March 25 that the United <font color=green>States</font>  had erred a year and a half ago by`` encouraging	1	0	89	0	4	NNPS	press
state/NN/br-a04/1963	0.283696483608999	0.0686193895321894	state	States	NN	press_reportage	press	A5	A	AB	ABC	Z	Z	Z	Z	Z	 check the rapid growth of juvenile delinquency in the United <font color=green>States</font> . The President is deeply concerned over this problem and its	1	0	87	0	3	NNPS	press
state/NN/br-a04/363	0.000685597378217822	-0.0474105759025242	state	States	NN	press_reportage	press	A5	A	AB	ABC	Z	Z	Z	Z	Z	 balance sheet must be set some disappointment that the United <font color=green>States</font>  leadership has not been as much in evidence as hoped	1	0	77	0	8	NNPS	press
state/NN/br-a04/384	-0.0475106072568424	0.266513148408069	state	State	NN	press_reportage	press	C	C	C	ABC	Z	Z	Z	Z	Z	 hoped for. One diplomat described the tenor of Secretary of <font color=green>State</font>  Dean Rusk 's speeches as`` inconclusive''. But he hastened to	1	1	146	100	3	NNP	press
state/NN/br-a04/403	0.302565869564585	0.0539378832205711	state	States	NN	press_reportage	press	A5	A	AB	ABC	Z	Z	Z	Z	Z	 as`` inconclusive''. But he hastened to add that, if United <font color=green>States</font>  policies were not always clear, despite Mr. Rusk 's analysis	1	0	140	0	2	NNPS	press
state/NN/br-a04/495	0.283142875666923	-0.239666386023275	state	States	NN	press_reportage	press	A5	A	AB	ABC	Z	Z	Z	Z	Z	 days, despite Mr. Rusk 's personal popularity, that the United <font color=green>States</font>  delegation came to Oslo in a somewhat tentative and exploratory	1	0	146	0	3	NNPS	press
state/NN/br-a04/536	-0.0568304050161329	0.175352183923056	state	State	NN	press_reportage	press	C	C	C	ABC	Z	Z	Z	Z	Z	 with detailed application to individual danger spots. The Secretary of <font color=green>State</font>  himself, in his first speech, gave some idea of the	1	1	85	100	7	NNP	press
state/NN/br-a04/558	0.0019072472916506	-0.0418999264027533	state	States	NN	press_reportage	press	A5	A	AB	ABC	Z	Z	Z	Z	Z	 the tremendous march of events inside and outside the United <font color=green>States</font>  that has preoccupied the new administration in the past four	1	0	80	0	8	NNPS	press
state/NN/br-a04/583	0.0276408317452151	0.0136418393111224	state	State	NN	press_reportage	press	C	C	C	ABC	Z	Z	Z	Z	Z	 where the core of NATO is concerned, the Secretary of <font color=green>State</font>  has not only reiterated the United States' profound attachment to	2	0	144	0	7	NNP	press
state/NN/br-a04/590	0.0259225583687593	0.0298430538925178	state	States	NN	press_reportage	press	A5	A	AB	ABC	Z	Z	Z	Z	Z	 the Secretary of State has not only reiterated the United <font color=green>States</font> ' profound attachment to the alliance,`` cornerstone'' of its foreign policy	1	0	161	0	5	NNPS	press
state/NN/br-a04/627	0.0274283128278734	-0.0376912692552014	state	State	NN	press_reportage	press	C	C	C	ABC	Z	Z	Z	Z	Z	 at NATO 's disposal in European waters. The Secretary of <font color=green>State</font>  has also solemnly repeated a warning to the Soviet Union	1	1	145	100	11	NNP	press
state/NN/br-a04/641	0.123215506837517	-0.21353624912856	state	States	NN	press_reportage	press	A5	A	AB	ABC	Z	Z	Z	Z	Z	 repeated a warning to the Soviet Union that the United <font color=green>States</font>  will not stand for another setback in Berlin, an affirmation	1	0	123	0	5	NNPS	press
state/NN/br-a04/891	0.0108941415912109	0.00484606005081028	state	States	NN	press_reportage	press	A5	A	AB	ABC	Z	Z	Z	Z	Z	 in military actions on the ground in Laos. The United <font color=green>States</font> , State Department officials explain, now is mainly interested in setting	1	0	118	0	9	NNPS	press
state/NN/br-a04/893	0.00446251187350098	0.00103692777487862	state	State	NN	press_reportage	press	C	C	C	ABC	Z	Z	Z	Z	Z	 military actions on the ground in Laos. The United States, <font color=green>State</font>  Department officials explain, now is mainly interested in setting up	2	2	120	100	9	NNP	press
state/NN/br-a04/949	0.0705043205598449	-0.167492921467812	state	States	NN	press_reportage	press	A5	A	AB	ABC	Z	Z	Z	Z	Z	 countries attending the Geneva conference to achieve this. The United <font color=green>States</font>  hopes that any future Lao Cabinet would not become Communist	1	0	114	0	6	NNPS	press
state/NN/br-a05/686	-0.0337596408217239	0.103010847526659	state	state	NN	press_reportage	press	A1	A	AB	ABC	Z	Z	Z	Z	Z	 Falls City Council on July 10 and sent to the <font color=green>state</font>  house by Miss Grant. The resolution urges the governor to	3	2	58	67	7	NN	press
state/NN/br-a05/72	0.00559303824136608	0.0114073722628592	state	state	NN	press_reportage	press	A1	A	AB	ABC	Z	Z	Z	Z	Z	 Providence now has no civil defense program. Mr. Hawksley, the <font color=green>state</font>  's general treasurer, has been a part-time CD director in	4	3	73	75	7	NN	press
state/NN/br-a05/842	0.0317400244479559	0.0360374483408738	state	state	NN	press_reportage	press	A2	A	AB	ABC	Z	Z	Z	Z	Z	 time`` with the continuous problem which confronts our local and <font color=green>state</font>  law enforcement officers as a result of the laws regulating	4	3	127	75	8	NN	press
state/NN/br-a05/888	-0.00363975894629329	-0.031731191906581	state	state	NN	press_reportage	press	A2	A	AB	ABC	Z	Z	Z	Z	Z	 there be evidence they are shirking, he has said, the <font color=green>state</font>  police will step into the situation. There has been more	1	0	33	0	5	NN	press
state/NN/br-a05/903	0.0103938931914699	0.0598350663892682	state	state	NN	press_reportage	press	A2	A	AB	ABC	Z	Z	Z	Z	Z	 into the situation. There has been more activity across the <font color=green>state</font>  line in Massachusetts than in Rhode Island in recent weeks	4	1	116	25	7	NN	press
state/NN/br-a05/930	0.092618855539319	0.103549075484862	state	State	NN	press_reportage	press	A5	A	AB	ABC	Z	Z	Z	Z	Z	 Sunday sales laws. The statutes, similar in both the Bay <font color=green>State</font>  and Rhode Island and dating back in some instances to	3	2	180	67	6	NNP	press
state/NN/br-a06/1051	-0.262863377053712	0.183696676857274	state	state	NN	press_reportage	press	A3	A	AB	ABC	Z	Z	Z	Z	Z	 Mrs. Harriet Copeland Greenfield of 330 Woodland Ave., Westfield, as <font color=green>state</font>  chairman of the Republican Women for Jones Committee. Mrs. Greenfield	3	1	145	33	2	NN	press
state/NN/br-a06/1108	0.037256861033136	0.270326777682783	state	state	NN	press_reportage	press	A4	A	AB	ABC	Z	Z	Z	Z	Z	 an end to paper ballots in those counties in the <font color=green>state</font>  which still use them. The proposal, Sheets said, represents part	2	1	117	50	4	NN	press
state/NN/br-a06/1152	0.0415399612659001	0.0360933594698364	state	state	NN	press_reportage	press	A3	A	AB	ABC	Z	Z	Z	Z	Z	 service word''. Sheets said that his proposed law would offer <font color=green>state</font>  financing aid for the purchase of voting machines, enabling counties	5	5	111	100	10	NN	press
state/NN/br-a06/1193	0.136947953877852	0.0873308559537241	state	state	NN	press_reportage	press	A4	A	AB	ABC	Z	Z	Z	Z	Z	 would ask for exclusive use of voting machines in the <font color=green>state</font>  by January, 1964. Although he pointed out that mandatory legislation	3	2	110	67	5	NN	press
state/NN/br-a06/1356	-0.00967887526519005	0.0309547853317849	state	state	NN	press_reportage	press	A2	A	AB	ABC	Z	Z	Z	Z	Z	 a lawyer. Jim Sheeran fits that description''. William J. Seidel, <font color=green>state</font>  fire warden in the Department of Conservation and Economic Development	5	2	82	40	7	NN	press
state/NN/br-a06/1398	0.014214360633661	0.0237263231524782	state	state	NN	press_reportage	press	A4	A	AB	ABC	Z	Z	Z	Z	Z	 a reduction in the number of forest fires in the <font color=green>state</font> . Seidel joined the department in 1925 as a division fire	3	3	114	100	8	NN	press
state/NN/br-a06/1439	-0.0553831166073313	0.0779343513925699	state	state	NN	press_reportage	press	A2	A	AB	ABC	Z	Z	Z	Z	Z	 with private lumber companies. In October 1944, he was appointed <font color=green>state</font>  warden and chief of the Forest Fire Section. Under his	3	2	128	67	8	NN	press
state/NN/br-a06/1454	0.0978398425191129	0.0788920989795134	state	state	NN	press_reportage	press	A2	A	AB	ABC	Z	Z	Z	Z	Z	 chief of the Forest Fire Section. Under his supervision, the <font color=green>state</font>  fire-fighting agency developed such techniques as plowing of fire lines	1	1	136	100	8	NN	press
state/NN/br-a06/1529	-0.00985754013314077	0.0389362472860969	state	State	NN	press_reportage	press	A3	A	AB	ABC	Z	Z	Z	Z	Z	 fire prevention program in co-operation with the Red Cross and <font color=green>State</font>  Department of Education. Richard J. Hughes made his Morris County	3	3	99	100	12	NNP	press
state/NN/br-a06/1566	-0.0218244702078367	0.0377323654829065	state	state	NN	press_reportage	press	A4	A	AB	ABC	Z	Z	Z	Z	Z	 pledge`` to carry the issues to every corner of the <font color=green>state</font> ''. He promised nearly 200 Democratic county committee members at the	2	1	86	50	7	NN	press
state/NN/br-a06/1859	0.119828705507384	0.039717334725574	state	state	NN	press_reportage	press	A1	A	AB	ABC	Z	Z	Z	Z	Z	 Superior Court judge said.`` To prevent hoodlums from infiltrating the <font color=green>state</font>  as they did in the Republican administration in the early	3	1	110	33	3	NN	press
state/NN/br-a06/1973	0.155393617113027	0.160495613608611	state	state	NN	press_reportage	press	A1	A	AB	ABC	Z	Z	Z	Z	Z	 provide$ 45 million for purchase of open land by the <font color=green>state</font> . The other$ 15 million is to be alloted to municipalities	4	1	89	25	3	NN	press
state/NN/br-a06/198	-0.0082941018166031	-0.104425786263431	state	state	NN	press_reportage	press	A	A	AB	ABC	Z	Z	Z	Z	Z	 to sell the tattered remains to the people of the <font color=green>state</font> ''. Sunday he had added,`` We can love Eisenhower the man	1	1	51	100	3	NN	press
state/NN/br-a06/2014	0.00906842033248909	0.0138372900231801	state	state	NN	press_reportage	press	A	A	AB	ABC	Z	Z	Z	Z	Z	 to conquer space- but to conserve it'', pointing out the <font color=green>state</font>  population has increased 125000 each year since 1950. He said	3	2	64	67	4	NN	press
state/NN/br-a06/2189	0.00285427607623225	0.0160653108335435	state	state	NN	press_reportage	press	A2	A	AB	ABC	Z	Z	Z	Z	Z	 carved wooden elephants, complete with ivory tusks, to remember the <font color=green>state</font>  committee by. There may be other 1961 state committee retirements	1	2	107	200	8	NN	press
state/NN/br-a06/2198	0.00952737211057629	0.0221697648994357	state	state	NN	press_reportage	press	A2	A	AB	ABC	Z	Z	Z	Z	Z	 remember the state committee by. There may be other 1961 <font color=green>state</font>  committee retirements come April 18, but they will be leaving	1	2	131	200	5	NN	press
state/NN/br-a06/362	0.159512103713792	-0.0846838027495422	state	state	NN	press_reportage	press	A3	A	AB	ABC	Z	Z	Z	Z	Z	 campaign'', he said,`` because the primary is being waged on <font color=green>state</font>  issues and I will not be forced into re arguing	3	2	50	67	5	NN	press
state/NN/br-a06/466	0.0409607735549613	0.0739005976646698	state	state	NN	press_reportage	press	A4	A	AB	ABC	Z	Z	Z	Z	Z	 industry. Mitchell decried the high rate of unemployment in the <font color=green>state</font>  and said the Meyner administration and the Republican-controlled State Senate	4	2	110	50	6	NN	press
state/NN/br-a06/507	0.0861218210468672	0.110532670166458	state	state	NN	press_reportage	press	A4	A	AB	ABC	Z	Z	Z	Z	Z	 Co. plant, he said industry will not come into this <font color=green>state</font>  until there is tax reform.`` But I am not in	4	3	117	75	3	NN	press
state/NN/br-a06/525	0.0418858470704536	0.102235224015349	state	state	NN	press_reportage	press	A3	A	AB	ABC	Z	Z	Z	Z	Z	 But I am not in favor of a sales or <font color=green>state</font>  income tax at this time'', Mitchell said. Jones, unhappy that	2	2	154	100	5	NN	press
state/NN/br-a06/615	-0.0255538765390189	-0.0707524694366674	state	state	NN	press_reportage	press	A1	A	AB	ABC	Z	Z	Z	Z	Z	 you can n't have it both ways'', Jones said. The <font color=green>state</font>  is now faced with the immediate question of raising new	1	0	81	0	6	NN	press
state/NN/br-a06/740	-0.0318665393251242	-0.0172993457135418	state	States	NN	press_reportage	press	A5	A	AB	ABC	Z	Z	Z	Z	Z	 overwhelmingly by the American people as president of the United <font color=green>States</font> , and who has been the symbol to the world of	3	1	83	33	5	NNPS	press
state/NN/br-a06/854	-0.163433833915179	0.100047354397959	state	state	NN	press_reportage	press	A3	A	AB	ABC	Z	Z	Z	Z	Z	 ahead of his GOP opponents for the gubernatorial nomination. Sandman, <font color=green>state</font>  campaign chairman for Jones, was addressing a meeting in the	3	2	105	67	4	NN	press
state/NN/br-a06/897	-0.0321958533347907	0.0722659002389237	state	state	NN	press_reportage	press	A4	A	AB	ABC	Z	Z	Z	Z	Z	 reports from workers on a local level all over the <font color=green>state</font>  indicate that Jones will be chosen the Republican Party 's	4	2	133	50	6	NN	press
state/NN/br-a07/1327	0.0837660618354327	-0.0931849061964724	state	state	NN	press_reportage	press	C	C	C	ABC	Z	Z	Z	Z	Z	 Corps will be able to prevent confusion for church and <font color=green>state</font>  over methods, means and goals. There are a number of	3	3	60	100	6	NN	press
state/NN/br-a07/1489	-0.0687761065292959	0.110947747643973	state	state	NN	press_reportage	press	C	C	C	ABC	Z	Z	Z	Z	Z	 still preserve the constitutional requirement on separation of church and <font color=green>state</font> ? R. Sargent Shriver Jr., director of the corps, is certain	4	3	78	75	7	NN	press
state/NN/br-a07/2077	0.182800037272866	-0.464902893186026	state	States	NN	press_reportage	press	A5	A	AB	ABC	Z	Z	Z	Z	Z	 one was overly optimistic. W. Averell Harriman of the United <font color=green>States</font> , Malcolm MacDonald of Britain, Maurice Couve de Murville, France 's	1	0	193	0	1	NNPS	press
state/NN/br-a07/592	-0.273294063563628	-0.218418755366692	state	state	NN	press_reportage	press	A4	A	AB	ABC	Z	Z	Z	Z	Z	 the visitor from the airport remarks that politicians in the <font color=green>state</font>  are`` all the same''.`` It 's' See Joe, see Jim	2	1	80	50	6	NN	press
state/NN/br-a07/689	0.0166833370838203	-0.026527395354448	state	state	NN	press_reportage	press	A4	A	AB	ABC	Z	Z	Z	Z	Z	 Corruption is hardly a recent development in the city and <font color=green>state</font>  that were widely identified as the locale of Edwin O	3	1	91	33	8	NN	press
state/NN/br-a07/751	0.0197726564478145	-0.000888813683825591	state	state	NN	press_reportage	press	A3	A	AB	ABC	Z	Z	Z	Z	Z	 construction of highways and other public works has brought on <font color=green>state</font>  and Federal investigations. And the election of President Kennedy has	5	2	84	40	6	NN	press
state/NN/br-a07/773	-0.0492449719912682	-0.0781007968514907	state	state	NN	press_reportage	press	A4	A	AB	ABC	Z	Z	Z	Z	Z	 attracted new attention to the ethical climate of his home <font color=green>state</font> . A reader of the Boston newspapers can hardly escape the	3	1	81	33	10	NN	press
state/NN/br-a07/811	-0.0142844887238419	0.0357516922302873	state	state	NN	press_reportage	press	A3	A	AB	ABC	Z	Z	Z	Z	Z	 life. Day after day some new episode is reported. The <font color=green>state</font>  Public Works Department is accused of having spent$ 8555 to	4	3	81	75	9	NN	press
state/NN/br-a07/829	-0.0299830552586595	0.0490239070628132	state	state	NN	press_reportage	press	A2	A	AB	ABC	Z	Z	Z	Z	Z	 having spent$ 8555 to build a private beach for a <font color=green>state</font>  judge on his waterfront property. An assistant attorney general is	4	4	123	100	9	NN	press
state/NN/br-a08/1073	0.0512222568947189	0.222100856725189	state	state	NN	press_reportage	press	A	A	AB	ABC	Z	Z	Z	Z	Z	 a session is the highly sensitive problem of cutting the <font color=green>state</font>  's congressional districts from six to five to eliminate one	3	2	130	67	5	NN	press
state/NN/br-a08/1399	0.06151432902998	0.0149973900364449	state	state	NN	press_reportage	press	A3	A	AB	ABC	Z	Z	Z	Z	Z	 way shortly to another vexing issue- that of finances in <font color=green>state</font>  government. The transition from segregation to finances might already be	2	1	138	50	4	NN	press
state/NN/br-a08/1424	0.0404022819330676	0.0809341045255398	state	state	NN	press_reportage	press	A3	A	AB	ABC	Z	Z	Z	Z	Z	 in the form of an administration proposal to hike the <font color=green>state</font>  sales tax from 2 per cent to 3 per cent	3	3	103	100	6	NN	press
state/NN/br-a08/2052	0.00941752461884177	0.186124819468911	state	state	NN	press_reportage	press	A3	A	AB	ABC	Z	Z	Z	Z	Z	 steps to trim spending at the spring session of the <font color=green>state</font>  Legislature. This might be done to arouse those who have	2	2	146	100	6	NN	press
state/NN/br-a08/285	0.137508412807522	0.00566975747515315	state	States	NN	press_reportage	press	A5	A	AB	ABC	Z	Z	Z	Z	Z	 Within view of the avenue are some of the United <font color=green>States</font>  government 's tremendous buildings, plus shrines and monuments. Of course	1	0	180	0	3	NNPS	press
state/NN/br-a08/428	-0.0647040958436431	-0.180914452723031	state	States	NN	press_reportage	press	A	A	AB	ABC	Z	Z	Z	Z	Z	 avenue which saw marching soldiers from the War Between the <font color=green>States</font>  returning in 1865 is the National Archives building where hundreds	4	3	127	75	5	NNPS	press
state/NN/br-a08/744	0.0277937731466912	-0.0603946798157514	state	state	NN	press_reportage	press	A	A	AB	ABC	Z	Z	Z	Z	Z	 the past is worth very much in gazing into the <font color=green>state</font>  's immediate political future. This is largely because of the	3	2	44	67	6	NN	press
state/NN/br-a08/766	0.151463480868305	0.0593566619090243	state	state	NN	press_reportage	press	A3	A	AB	ABC	Z	Z	Z	Z	Z	 unpredictability of the man who operates the helm of the <font color=green>state</font>  government and is the elected leader of its two million	4	2	172	50	2	NN	press
state/NN/br-a10/111	-0.0371292586549129	0.078004059819205	state	state	NN	press_reportage	press	C	C	C	ABC	Z	Z	Z	Z	Z	 than aiding them economically, E. M. Martin, assistant secretary of <font color=green>state</font>  for economic affairs told members of the World Affairs Council	3	3	134	100	8	NN	press
state/NN/br-a10/161	0.0504140516552132	-0.0565078646163793	state	States	NN	press_reportage	press	A5	A	AB	ABC	Z	Z	Z	Z	Z	 Multnomah Hotel. He told some 350 persons that the United <font color=green>States</font> ' challenge was to help countries build their own societies their	1	0	67	0	7	NNPS	press
state/NN/br-a10/1800	-0.37132459902627	-0.333003559606653	state	States	NN	press_reportage	press	A5	A	AB	ABC	Z	Z	Z	Z	Z	 12000 babies born daily) with an immigrant entering the United <font color=green>States</font>  every 1- 1 2 minutes, he said`` our organization has	1	0	108	0	3	NNPS	press
state/NN/br-a10/334	0.00608156682266217	-0.0348109944001493	state	States	NN	press_reportage	press	A5	A	AB	ABC	Z	Z	Z	Z	Z	 build'', he said. By leaving our doors open the United <font color=green>States</font>  gives other peoples the opportunity to see us and to	1	0	71	0	4	NNPS	press
state/NN/br-a10/379	0.0537359607942511	0.0344572847475881	state	States	NN	press_reportage	press	A5	A	AB	ABC	Z	Z	Z	Z	Z	 patient'', the assistant secretary said. Economically, Martin said, the United <font color=green>States</font>  could best help foreign countries by helping them help themselves	1	0	96	0	7	NNPS	press
state/NN/br-a10/416	0.13378622774728	-0.114296495105228	state	States	NN	press_reportage	press	A5	A	AB	ABC	Z	Z	Z	Z	Z	 are able to work with the people themselves. The United <font color=green>States</font>  must plan to absorb the exported goods of the country	1	0	106	0	4	NNPS	press
state/NN/br-a10/916	-0.0352258663847925	-0.00228956101359321	state	state	NN	press_reportage	press	B	B	AB	ABC	Z	Z	Z	Z	Z	 to hold a public United Nations Day reception in the <font color=green>state</font>  capitol on Tuesday. His schedule calls for a noon speech	2	0	68	0	7	NN	press
