id	model.x	model.y	lemma	pos	genre	marisense	mbroad	mari3	mari2	sensekey	wnsense	wnbroad	wn3	wn2	text	newPos	newBroadGenre	cues	cuesWithWeight	meanWeight	weightedCuesRatio	weightedCW	wf	broadGenre	wordform	msOct	mcuesOct	mcommOct	determiner	premodifier	postmodifier	building	definiteness	dgsense	number	capital	has_posm	prem_adj	prem_place	prem_name	prem_kind	comm	activity	organization	msOct4
church/NNP/br-d09/39	0.148469549488264	0.0540222611701523	church	NNP	religion	A	A	AB	AB	Z	Z	Z	Z	Z	 to achieve Christian stature, it is an indictment of the <font color=green>Church</font> . These fatalities are dramatic evidence of`` halfway evangelism'', a failure	NNP	informative	4	2	2.24	0.5	7	Church	others	Church	a2	indictment of the;evangelism		the	NA	NA	no	yes	A	singular	yes	no	no	no	no	no	no	NA	yes	a
church/NNP/br-d09/515	-0.0214820239266878	0.00966323337468707	church	NNP	religion	A	A	AB	AB	Z	Z	Z	Z	Z	 require more. None should ask less. Those who join the <font color=green>Church</font>  need to be instructed in the faith and the meaning	NNP	informative	3	3	2.56	1	8	Church	others	Church	a2	join;instructed in the faith	Capital letter and definiteness	the	NA	NA	no	yes	A	singular	yes	no	no	no	no	no	no	NA	yes	a
church/NNP/br-d09/544	0.119293121592733	-0.0359356589146636	church	NNP	religion	A	A	AB	AB	Z	Z	Z	Z	Z	 sacred vows. They will have a greater appreciation for the <font color=green>Church</font>  and a deeper devotion to it if membership requires something	NNP	informative	2	1	2.49	0.5	7	Church	others	Church	a2	appreciation for the;deeper devotion to;membership	Capital letter and definiteness	the	NA	NA	no	yes	A	singular	yes	no	no	no	no	no	no	NA	yes	a
church/NNP/br-d09/6	-0.0307963175280874	-0.154728081042533	church	NNP	religion	A	A	AB	AB	Z	Z	Z	Z	Z	 Few persons who join the <font color=green>Church</font>  are insincere. They earnestly desire to do the will of	NNP	informative	2	1	2.22	0.5	5	Church	others	Church	a2	join the		the	NA	NA	no	yes	A	singular	yes	no	no	no	no	no	no	NA	yes	a
church/NNP/br-d09/624	0.0583024043729836	-0.00129359122143353	church	NNP	religion	C	C	C	CDE	Z	Z	Z	Z	Z	 cover four major areas: The Christian Faith History of the <font color=green>Church</font>  Duties of Church Membership The Local Church and Its Program	NNP	informative	4	4	2.84	1	8	Church	others	Church	a2	History of the	Capital letter, but it could be because it’s a title	the	NA	NA	no	yes	A	singular	yes	no	no	no	no	no	no	NA	yes	a
church/NNP/br-d09/627	0.0392871842538859	-0.00172861299030949	church	NNP	religion	C	C	C	CDE	Z	Z	Z	Z	Z	 areas: The Christian Faith History of the Church Duties of <font color=green>Church</font>  Membership The Local Church and Its Program Following each instruction	NNP	informative	4	4	3.38	1	8	Church	others	Church	b	Duties of;Membership	Capital letter, but it could be because it’s a title	NA	NA	NA	no	NA	?	singular	yes	no	no	no	no	no	yes	no	yes	b
church/NNP/br-d09/631	0.0479173345984985	-0.0182808005982448	church	NNP	religion	C	C	C	CDE	Z	Z	Z	Z	Z	 History of the Church Duties of Church Membership The Local <font color=green>Church</font>  and Its Program Following each instruction period a piece of	NNP	informative	4	4	2.83	1	9	Church	others	Church	b	The Local;Its Program		the	local	NA	no	yes	C	singular	yes	no	yes	no	no	no	yes	no	yes	b
church/NNP/br-d14/1311	-0.00545318447140421	0.0363097489021986	church	NNP	religion	B	B	AB	AB	Z	Z	Z	Z	Z	 men and women of New England ancestry also issued the <font color=green>Church</font>  of Jesus Christ of Latter Day Saints, the Seventh Day	NNP	informative	7	3	2.28	0.43	8	Church	others	Church	a2	of Jesus Christ of Latter Day Saints		the	NA	of Jesus Christ of Latter Day Saints	no	yes	B	singular	yes	yes	no	no	no	no	no	NA	yes	a
church/NNP/br-e13/1916	-0.141058614612294	-0.0340803582653065	church	NNP	skill_and_hobbies	D	D	DE	CDE	Z	Z	Z	Z	Z	 a road toward another gate in the distance, past the <font color=green>Church</font>  of St. Irene, completed by Constantine in 330 A. D.	NNP	informative	3	3	2.57	1	5	Church	tech	Church	c1	road;gate;past		the	NA	of St. Irene	yes	yes	D	singular	yes	yes	no	no	no	no	no	no	no	c
church/NNP/br-g02/1539	0.0923899139413803	0.0859754383952375	church	NNP	belles_lettres	A	A	AB	AB	Z	Z	Z	Z	Z	 and influence of such other claimants for loyalty as the <font color=green>Church</font> . The breakup of the Holy Roman Empire and the downfall	NNP	informative	4	2	2.05	0.5	5	Church	others	Church	a2	claimants for loyalty;Holy Roman Empire	Capital letter and definiteness	the	NA	NA	no	yes	A	singular	yes	no	no	no	no	no	no	NA	yes	a
church/NNP/br-j25/691	0.158779394075222	-0.0313551865924432	church	NNP	learned	B	B	AB	AB	Z	Z	Z	Z	Z	 indicators of expected adherence to group norms. However, because of <font color=green>Church</font>  laws, lately more stringently enforced, which forbid the marriage of	NNP	informative	5	4	2.4	0.8	7	Church	tech	Church	a2	laws		none	NA	NA	no	no	B	singular	yes	no	no	no	no	no	no	NA	yes	a
church/NNP/br-j57/304	0.0950303871288329	0.135583539911639	church	NNP	learned	B	B	AB	AB	group%1:03:00::	C	C	C	CDE	 Indeed, it is even surprising in the Canon of Christ <font color=green>Church</font>  and Regius Professor of Ecclesiastical History, who fathered this most	NNP	informative	3	1	2.37	0.33	6	Church	tech	Church	a2	Canon of Christ	definiteness and specifier	the	Canon of Christ	NA	no	yes	?	singular	yes	no	no	no	no	yes	no	NA	yes	a
church/NNP/br-k04/233	-0.112528390546023	-0.0327655575722004	church	NNP	fiction_gral	D	D	DE	CDE	group%1:03:00::	C	C	C	CDE	 of this crowded region was the Allen African Methodist Episcopal <font color=green>Church</font> . It was an old and dirty wooden structure, sadly in	NNP	imaginative	4	4	1.93	1	11	Church	imag	Church	c1	crowded region;Allen African Methodist Episcopal;old and dirty;wooden structure		the	Allen African Methodist Episcopal	NA	yes	yes	D	singular	yes	no	no	no	yes	yes	no	no	no	c
church/NNP/br-k06/1930	0.0876223307588171	0.0432421020293056	church	NNP	fiction_gral	D	D	DE	CDE	group%1:03:00::	C	C	C	CDE	 strike the steeples of the other churches; not of Drew <font color=green>Church</font> . A flash illumined the trees as a crooked bolt twigged	NNP	imaginative	2	1	2.52	0.5	4	Church	imag	Church	c1	steeples;Drew		none	Drew	NA	yes	no	D	singular	yes	no	no	no	yes	no	no	no	no	c
church/NNP/br-k06/698	0.0800127871985518	0.209707409083462	church	NNP	fiction_gral	D	D	DE	CDE	group%1:03:00::	C	C	C	CDE	 the foothills, was the city of God. The Dutch Reformed <font color=green>Church</font> , with two steeples and its own school was on Main	NNP	imaginative	4	2	1.08	0.5	6	Church	imag	Church	c1	The Dutch Reformed;steeples;school;on Main		the	Dutch Reformed	NA	yes	yes	D	singular	yes	no	no	no	no	no	no	no	no	c
church/NNP/br-k06/714	0.0463212433308727	0.151320647015608	church	NNP	fiction_gral	D	D	DE	CDE	group%1:03:00::	C	C	C	CDE	 and its own school was on Main Street; the Episcopal <font color=green>Church</font>  was one block down Sussex Street; the Catholic Saint Mary's	NNP	imaginative	4	2	1.83	0.5	7	Church	imag	Church	c1	Episcopal;Main Street;Sussex Street;block down		the	Episcopal	NA	yes	yes	D	singular	yes	no	no	no	no	yes	no	no	no	c
church/NNP/br-k06/726	0.0432789480527776	0.14099580894456	church	NNP	fiction_gral	D	D	DE	CDE	group%1:03:00::	C	C	C	CDE	 was one block down Sussex Street; the Catholic Saint Mary's <font color=green>Church</font> , with an even taller steeple and a cross on top	NNP	imaginative	5	1	2.91	0.2	5	Church	imag	Church	c1	Sussex Street;the Catholic Saint Mary’s;steeple;cross on top		the	Catholic Saint Mary’s	NA	yes	yes	D	singular	yes	no	no	no	yes	yes	no	no	no	c
church/NNP/br-k06/841	-0.0546073276599313	0.128470166669917	church	NNP	fiction_gral	D	D	DE	CDE	group%1:03:00::	C	C	C	CDE	 became familiar with God, who resided chiefly in Drew Centennial <font color=green>Church</font>  with its high steeple and clock. There was no church	NNP	imaginative	3	2	2.59	0.67	6	Church	imag	Church	c1	resided;steeple;clock		none	Drew Centennial	NA	yes	no	D	singular	yes	no	no	no	yes	no	no	no	no	c
church/NNP/br-k06/855	-0.0332335986296757	0.144080562588158	church	NNP	fiction_gral	D	D	DE	CDE	group%1:03:00::	C	C	C	CDE	 high steeple and clock. There was no church like Drew <font color=green>Church</font> , no preacher like Papa, who was intimate with Him, and	NNP	imaginative	2	1	2.77	0.5	7	Church	imag	Church	c1	steeple;clock;Drew;there was		none	Drew	NA	yes	no	D	singular	yes	no	no	no	yes	no	no	no	no	c
church/NNP/br-k10/1229	-0.0699515511264946	-0.0906489544048233	church	NNP	fiction_gral	B	B	AB	AB	group%1:03:00::	C	C	C	CDE	 smashing images and tearing down symbols sacred to the Old <font color=green>Church</font> . John found it difficult, but he held him in check	NNP	imaginative	4	3	2.89	0.75	9	Church	imag	Church	a1	symbols;sacred to;the Old	capital letter, definiteness, modifier; the modifier is ‘old’, which with all lower case tends to refer to the building	the	Old	NA	no	yes	B	singular	yes	no	no	no	no	yes	no	NA	yes	a
church/NNS/br-a09/1417	-0.0777348535125527	-0.0782992658889532	church	NNS	press_reportage	D	D	DE	CDE	Z	Z	Z	Z	Z	 will feature row houses, garden apartments, four small parks, schools, <font color=green>churches</font> , a shopping center and several small clusters of stores. The	NNS	informative	7	4	2	0.57	8	churches	others	churches	c1	houses;apartments;parks;schools;shopping center;stores	lower case, no definiteness, plurality and contrast to other kinds of buildings	none	NA	NA	yes	no	D	plural	no	no	no	no	no	no	no	no	no	c
church/NNS/br-a10/1674	-0.0857663283802401	0.0381722577987134	church	NNS	press_reportage	D	D	DE	CDE	Z	Z	Z	Z	Z	 need for their forthcoming program,`` Breakthrough'' scheduled to fill the <font color=green>churches</font>  for the next two years. In his opening address Wednesday	NNS	informative	5	4	1.97	0.8	6	churches	others	churches	c3	fill the	clearly the building aspect is active, but the actual filling means having people attend the service	the	NA	NA	yes	yes	D	plural	no	no	no	no	no	no	no	yes	no	c
church/NNS/br-a10/1831	0.238456772574414	0.0278276275021597	church	NNS	press_reportage	C	C	C	CDE	Z	Z	Z	Z	Z	 with this challenge''.`` In 35 years we have opened 7000 <font color=green>churches</font> '', the Rev. Mr. Brandt said, adding that the denomination had	NNS	informative	3	1	1.82	0.33	5	churches	others	churches	b	opened 7000;denomination		number	NA	NA	no	no	C	plural	no	no	no	no	no	no	yes	no	yes	b
church/NNS/br-a10/1863	0.0399518150965811	-0.187792991949535	church	NNS	press_reportage	C	C	C	CDE	Z	Z	Z	Z	Z	 for every 10000 persons.`` In this light we need 1000 <font color=green>churches</font>  in Illinois, where we have 200; 800 in Southern New	NNS	informative	3	3	1.2	1	5	churches	others	churches	b	need;1000;in Illinois;we have		number	NA	NA	no	no	C	plural	no	no	no	no	no	no	yes	no	yes	b
church/NNS/br-a10/1918	0.157432150969245	-0.0698058972555033	church	NNS	press_reportage	C	C	C	CDE	Z	Z	Z	Z	Z	 Brandt suggested the vision of 8000 new Assemblies of God <font color=green>churches</font>  in the next 10 years. To accomplish this would necessitate	NNS	informative	3	2	2.42	0.67	6	churches	others	churches	b	new;Assemblies of God		number	new;Assemblies of God	NA	no	no	C	plural	no	no	yes	no	no	yes	yes	no	yes	b
church/NNS/br-a10/1980	0.0628135847601192	-0.0316756031004642	church	NNS	press_reportage	C	C	C	CDE	Z	Z	Z	Z	Z	 includes: Encouraging by every means, all existing Assemblies of God <font color=green>churches</font>  to start new churches. Engaging mature, experienced men to pioneer	NNS	informative	6	2	2.96	0.33	10	churches	others	churches	b	Assemblies of God;start new churches		all	existing Assemblies of God	NA	no	yes	C	plural	no	no	yes	no	no	yes	yes	no	yes	b
church/NNS/br-a10/1984	0.0725104128254639	-0.0244507895597486	church	NNS	press_reportage	C	C	C	CDE	Z	Z	Z	Z	Z	 means, all existing Assemblies of God churches to start new <font color=green>churches</font> . Engaging mature, experienced men to pioneer or open new churches	NNS	informative	6	4	3.07	0.67	9	churches	others	churches	b	Assemblies of God;start new;pioneer;open new		none	new	NA	no	no	C	plural	no	no	yes	no	no	no	yes	no	yes	b
church/NNS/br-a10/1996	0.0514927695959023	-0.0794602427652663	church	NNS	press_reportage	C	C	C	CDE	Z	Z	Z	Z	Z	 churches. Engaging mature, experienced men to pioneer or open new <font color=green>churches</font>  in strategic population centers. Surrounding pioneer pastors with vocational volunteers	NNS	informative	7	3	3.18	0.43	10	churches	others	churches	b	pioneer;open new;population centers		none	new	NA	no	no	C	plural	no	no	yes	no	no	no	yes	no	yes	b
church/NNS/br-a10/2022	0.0541270754127562	-0.114287246735408	church	NNS	press_reportage	C	C	C	CDE	Z	Z	Z	Z	Z	 will be urged to move into the area of new <font color=green>churches</font>  in the interest of lending their support to the new	NNS	informative	2	3	1.98	1.5	8	churches	others	churches	b	new		none	new;Assemblies of God	NA	no	no	C	plural	no	no	yes	no	no	yes	yes	no	yes	b
church/NNS/br-a10/2051	-0.0793445735659443	-0.0519546406124888	church	NNS	press_reportage	C	C	C	CDE	Z	Z	Z	Z	Z	 to spend from 6- 12 months as apprentices in well-established <font color=green>churches</font> . U. S. Dist. Judge Charles L. Powell denied all motions	NNS	informative	2	0	2.15	0	5	churches	others	churches	b	apprentices		none	well-established	NA	no	no	C	plural	no	no	yes	no	no	no	yes	no	yes	b
church/NNS/br-a31/1594	0.116715688352114	-0.131529273190505	church	NNS	press_reportage	C	C	C	CDE	Z	Z	Z	Z	Z	 than 300 top teenagers and 65 adult advisers from Presbyterian <font color=green>churches</font>  of the area sat enthralled at the four-hour program. This	NNS	informative	4	3	2.16	0.75	6	churches	others	churches	b	Presbyterian;of the area;program;teenagers;adult advisers	modifier and plurality	none	Presbyterian	NA	no	no	C	plural	no	no	no	no	no	yes	yes	no	yes	b
church/NNS/br-a31/1753	-0.0376589673484669	-0.171982476144074	church	NNS	press_reportage	C	C	C	CDE	Z	Z	Z	Z	Z	 Auditorium may be set up soon. And to encourage other <font color=green>churches</font>  to try their own programs, Kern said this Sunday 's	NNS	informative	3	2	1.05	0.67	8	churches	others	churches	b	encourage;own programs		other	NA	NA	no	no	C	plural	no	no	no	no	no	no	yes	no	yes	b
church/NNS/br-a31/1806	-0.03594515624665	0.0045816541043237	church	NNS	press_reportage	D	D	DE	CDE	Z	Z	Z	Z	Z	 special services marking National Christian Family Week in Miami area <font color=green>churches</font>  next week. Of particular meaning to the Charles MacWhorter family	NNS	informative	4	3	1.75	0.75	12	churches	others	churches	c2	Miami area;Chirstian Family Week		none	Miami area	NA	yes	no	D	plural	no	no	no	yes	no	no	yes	no	no	c
church/NNS/br-b04/1480	-0.0417318376921342	-0.0305582332106008	church	NNS	press_editorial	C	C	C	CDE	Z	Z	Z	Z	Z	 his money and his name: Does it assail schools and <font color=green>churches</font>  with blanket accusations? Does it attack other traditional American institutions	NNS	informative	4	3	1.78	0.75	9	churches	others	churches	b	schools	lower case, no definiteness, plurality, contrasted to another organization (schools, which CAN ALSO BE A BUILDING)	none	NA	NA	no	no	C	plural	no	no	no	no	no	no	yes	no	yes	b
church/NNS/br-b12/2239	0.0319798244565659	0.0336392905163864	church	NNS	press_editorial	B	B	AB	AB	Z	Z	Z	Z	Z	 Methodist Church, Congregational Union, Baptist Union, Presbyterian Church of England, <font color=green>Churches</font>  in Wales, Churches in Ireland, Society of Friends, British and	NNPS	informative	7	0	2.74	0	6	Churches	others	Churches	a2	in Wales		the	NA	in Wales	no	yes	B	plural	yes	yes	no	no	no	no	no	NA	yes	a
church/NNS/br-b12/2243	0.0244613975469034	0.0258857634536023	church	NNS	press_editorial	B	B	AB	AB	Z	Z	Z	Z	Z	 Union, Baptist Union, Presbyterian Church of England, Churches in Wales, <font color=green>Churches</font>  in Ireland, Society of Friends, British and Foreign Bible Society	NNPS	informative	2	0	2.71	0	6	Churches	others	Churches	a2	in Ireland		none	NA	in Ireland	no	no	B	plural	yes	yes	no	no	no	no	no	NA	yes	a
church/NNS/br-b22/1233	-0.00907726737687625	-0.0180978549105075	church	NNS	press_editorial	B	B	AB	AB	Z	Z	Z	Z	Z	 of five Catholic theologians to attend the World Council of <font color=green>Churches</font>  assembly in New Delhi as`` official'' observers reverses the Church	NNPS	informative	5	2	2.87	0.4	6	Churches	others	Churches	a2	Catholic theologians;World Council of;assembly		none	NA	NA	no	no	B	plural	yes	no	no	no	no	no	no	NA	yes	a
church/NNS/br-b22/1326	0.154420242110914	0.0953541970447694	church	NNS	press_editorial	B	B	AB	AB	Z	Z	Z	Z	Z	 pervades the Church 's stance toward the Protestant and Orthodox <font color=green>Churches</font> . Noting all the difficulties that stand in the way of	NNPS	informative	2	1	2.71	0.5	5	Churches	others	Churches	a2	Protestant;Orthodox	capital letter, definiteness, plurality	the	Protestant and Orthodox	NA	no	yes	B	plural	yes	no	no	no	no	no	no	NA	yes	a
church/NNS/br-c08/1853	-0.0126563408130914	-0.0370166058970786	church	NNS	press_reviews	C	C	C	CDE	Z	Z	Z	Z	Z	 the early jazz forms and the music of the Negro <font color=green>churches</font> . To help him on this religious aspect of primitive jazz	NNS	informative	4	3	2.09	0.75	8	churches	others	churches	c2	Negro;music;jazz		the	Negro	NA	yes	yes	C	plural	no	no	no	no	no	yes	yes	no	no	c
church/NNS/br-d02/548	0.0148538521595074	-0.0704190416012075	church	NNS	religion	B	B	AB	AB	church%1:14:00::	B	B	AB	AB	 observed to characterize the preaching and teaching of the American <font color=green>churches</font> . In the absence of a truly adequate conceptuality in which	NNS	informative	3	1	2.35	0.33	7	churches	others	churches	b	American;preaching;teaching		the	American	NA	no	yes	B	plural	no	no	yes	no	no	no	yes	no	yes	b
church/NNS/br-d03/1011	-0.102467224147038	-0.131731551021732	church	NNS	religion	D	D	DE	CDE	church%1:06:00::	D	D	DE	CDE	 often, the sale of 764 chapels''. Most of these former <font color=green>churches</font>  are now used as warehouses, but`` neither Anglicans nor Nonconformists	NNS	informative	3	1	1.21	0.33	4	churches	others	churches	c1	former;chapels;warehouses		these	former	NA	yes	yes	D	plural	no	no	yes	no	no	no	no	no	no	c
church/NNS/br-d03/1027	0.0704986378446848	0.0831007180860694	church	NNS	religion	D	D	DE	CDE	church%1:06:00::	D	D	DE	CDE	 as warehouses, but`` neither Anglicans nor Nonconformists object to selling <font color=green>churches</font>  to Roman Catholics'', and have done so. While it must	NNS	informative	2	1	2.61	0.5	5	churches	others	churches	c1	selling;warehouses		none	NA	NA	yes	no	D	plural	no	no	no	no	no	no	no	no	no	c
church/NNS/br-d03/1051	0.0638844791014766	-0.043174570246807	church	NNS	religion	D	D	DE	CDE	church%1:06:00::	D	D	DE	CDE	 be said that these same Protestants have built some new <font color=green>churches</font>  during this period, and that religious population shifts have emptied	NNS	informative	4	4	2.19	1	8	churches	others	churches	c1	Protestants;built;new;emptied		some	new	NA	yes	no	D	plural	no	no	yes	no	no	no	no	no	no	c
church/NNS/br-d03/1063	0.0410764478569083	-0.0719124498888349	church	NNS	religion	C	C	C	CDE	church%1:06:00::	D	D	DE	CDE	 during this period, and that religious population shifts have emptied <font color=green>churches</font> , a principal reason for this phenomenon of redundancy is that	NNS	informative	5	4	2.6	0.8	8	churches	others	churches	c3	religious population shifts;emptied;redundancy		none	NA	NA	yes	no	?	plural	no	no	no	no	no	no	no	yes	no	c
church/NNS/br-d03/110	-0.00488930827222424	0.00901729921628836	church	NNS	religion	C	C	C	CDE	church%1:14:00::	B	B	AB	AB	 was enthusiastically devoted to prayer and discussion by the various <font color=green>churches</font> . Many people seem hopeful, yet it is difficult to predict	NNS	informative	5	5	1.88	1	9	churches	others	churches	a2	devoted to prayer;various		the	various	NA	no	yes	C	plural	no	no	yes	no	no	no	no	NA	yes	a
church/NNS/br-d03/1472	0.0703797459279327	0.12905974620723	church	NNS	religion	E	E	DE	CDE	church%1:06:00::	D	D	DE	CDE	 thy Son''. A hymn often to be heard in Catholic <font color=green>churches</font>  is`` Faith of our Fathers'', which glories in England 's	NNS	informative	3	2	1.52	0.67	4	churches	others	churches	c3	hymn;heard in;Catholic;England		none	Catholic	NA	yes	no	D	plural	no	no	no	no	no	yes	no	yes	no	c
church/NNS/br-d03/1884	0.0257221809573981	0.0346455612128389	church	NNS	religion	B	B	AB	AB	church%1:14:00::	B	B	AB	AB	 at least of equal stature in England with the Protestant <font color=green>churches</font> . On successive Sundays during October, 1960, Paul Ferris( a non-Catholic	NNS	informative	2	2	2.45	1	8	churches	others	churches	b	Protestant	I think this continues another occurrence, in which the Catholic church is compared to the protestant churches	the	Protestant	NA	no	yes	B	plural	no	no	no	no	no	yes	yes	no	yes	b
church/NNS/br-d03/313	0.0602324593776668	0.0663639706372471	church	NNS	religion	B	B	AB	AB	anglican_church%1:14:00::	B2	B	AB	AB	 saying and writing and implying about the Roman and Anglican <font color=green>Churches</font>  and about the present religious state of England. Since the	NNPS	informative	5	4	1.77	0.8	7	Churches	others	Churches	a2	Roman and Anglican;religious state of England	capital letter, definiteness, plurality	the	Roman and Anglican	NA	no	yes	B	plural	yes	no	no	no	no	yes	no	NA	yes	a
church/NNS/br-d03/35	0.0152284975391136	0.0300301303424948	church	NNS	religion	B	B	AB	AB	anglican_church%1:14:00::	B2	B	AB	AB	 efforts of only unauthorized individuals of the Roman and Anglican <font color=green>Churches</font> , and urging a communion of prayer unacceptable to Rome, this	NNPS	informative	5	3	2.66	0.6	7	Churches	others	Churches	a2	Roman;Anglican		the	Roman and Anglican	NA	no	yes	B	plural	yes	no	no	no	no	yes	no	NA	yes	a
church/NNS/br-d03/779	0.0257862450718427	0.0449366874633489	church	NNS	religion	D	D	DE	CDE	church%1:06:00::	D	D	DE	CDE	 less than ten. From many sides come remarks that Protestant <font color=green>churches</font>  are badly attended and the large medieval cathedrals look all	NNS	informative	4	3	2.45	0.75	8	churches	others	churches	c1	badly attended;large medieval cathedrals;Protestant	opposition to cathedrals	none	Protestant	NA	yes	no	D	plural	no	no	no	no	no	yes	no	no	no	c
church/NNS/br-d03/849	0.0141908671874815	-0.011275890962746	church	NNS	religion	C	C	C	CDE	church%1:06:00::	D	D	DE	CDE	 admit the great falling off in effective membership in their <font color=green>churches</font> . According to a newspaper report of the 1961 statistics of	NNS	informative	2	2	2.22	1	8	churches	others	churches	b	effective membership;their		their	NA	NA	no	yes	C	plural	no	no	no	no	no	no	yes	no	yes	b
church/NNS/br-d03/929	-0.0463916450664697	0.00307735817016056	church	NNS	religion	C	C	C	CDE	church%1:06:00::	D	D	DE	CDE	 the Manchester Guardian of last November, entitled`` Fate of Redundant <font color=green>Churches</font> '', states than an Archbishops' Commission`` reported last month that in	NNPS	informative	2	0	2.38	0	6	Churches	others	Churches	c1	Redundant		the	Redundant	NA	yes	yes	D	plural	yes	no	yes	no	no	no	no	no	no	c
church/NNS/br-d03/952	0.0294004432161903	0.105308536491018	church	NNS	religion	C	C	C	CDE	church%1:06:00::	D	D	DE	CDE	 that in the Church of England alone there are 790 <font color=green>churches</font>  which are redundant now, or will be in 20 years	NNS	informative	3	2	2.09	0.67	4	churches	others	churches	c1	there are;redundant		number	NA	NA	yes	no	D	plural	no	no	no	no	no	no	no	no	no	c
church/NNS/br-d03/971	0.667468327530018	-0.0725508581586806	church	NNS	religion	D	D	DE	CDE	church%1:06:00::	D	D	DE	CDE	 will be in 20 years' time. A further 260 Anglican <font color=green>churches</font>  have been demolished since 1948''. And in the last five	NNS	informative	1	0	1.07	0	1	churches	others	churches	c1	Anglican;demolished		number	Anglican	NA	yes	no	D	plural	no	no	no	no	no	yes	no	no	no	c
church/NNS/br-d05/1536	0.183696034725123	-0.109781680873143	church	NNS	religion	C	C	C	CDE	Z	Z	Z	Z	Z	 descended from the founders( among which were still the Unitarian <font color=green>churches</font> ), made explicit from the beginning that the conflict between him	NNS	informative	1	0	1.86	0	5	churches	others	churches	a2	Unitarian		the	Unitarian	NA	no	yes	?	plural	no	no	no	no	no	yes	no	NA	yes	a
church/NNS/br-d05/1935	-0.141158573922673	-0.185392696183178	church	NNS	religion	C	C	C	CDE	Z	Z	Z	Z	Z	 his colleagues know that he intended them:`` Even the Unitarian <font color=green>churches</font>  have caught the malaria, and are worse than those who	NNS	informative	2	0	2.16	0	2	churches	others	churches	b	Unitarian;caught the malaria	only people can catch the malaria, so it must refer to the communities	the	Unitarian	NA	no	yes	C	plural	no	no	no	no	no	yes	yes	no	yes	b
church/NNS/br-d09/1216	0.0908526004823491	-0.0112306302868527	church	NNS	religion	C	C	C	CDE	Z	Z	Z	Z	Z	 membership training, since this is a recent development in many <font color=green>churches</font> . Those coming from other denominations will welcome the opportunity to	NNS	informative	3	2	1.82	0.67	8	churches	others	churches	b	membership training;denominations		many	NA	NA	no	no	C	plural	no	no	no	no	no	no	yes	no	yes	b
church/NNS/br-d09/181	0.0762371700394269	-0.0213369935434344	church	NNS	religion	C	C	C	CDE	Z	Z	Z	Z	Z	 life of the Church. Neglect means spiritual paralysis or death. <font color=green>Churches</font>  that have a carefully planned program of membership preparation and	NNPS	informative	4	3	1.95	0.75	8	Churches	others	Churches	b	that have;planned program;membership		none	NA	NA	no	no	C	plural	yes	no	no	no	no	no	yes	no	yes	b
