id	model.x	model.y	lemma	pos	genre	marisense	mbroad	mari3	mari2	sensekey	wnsense	wnbroad	wn3	wn2	text	newPos	newBroadGenre	cues	cuesWithWeight	meanWeight	weightedCuesRatio	weightedCW	wf	broadGenre	wordform	msOct	mcuesOct	mcommOct	determiner	premodifier	postmodifier	building	definiteness	dgsense	number	capital	has_posm	prem_adj	prem_place	prem_name	prem_kind	comm	activity	organization	msOct4
church/NN/br-d03/883	0.183293103636372	0.112631367502634	church	NN	religion	C	C	C	CDE	church_roll%1:10:00::	C	C	C	CDE	 is 9748000, but only 2887671 are registered on the parochial <font color=green>church</font>  rolls'', and`` over 27 million people in England are baptized	NN	informative	4	3	1.98	0.75	4	church	others	church	b	parochial;rolls;registered		NA	NA	NA	no	NA	C	singular	no	no	no	no	no	no	yes	no	yes	b
church/NN/br-d03/899	0.0902207022465223	0.14152834379715	church	NN	religion	B	B	AB	AB	church_of_england%1:14:00::	B2	B	AB	AB	 over 27 million people in England are baptized into the <font color=green>Church</font>  of England, but roughly only a tenth of them continue	NNP	informative	3	2	2.18	0.67	4	Church	others	Church	a2	baptized into the;of England		the	NA	of England	no	yes	B	singular	yes	yes	no	no	no	no	no	NA	yes	a
church/NN/br-d03/945	0.0353477129920986	0.0178255023628694	church	NN	religion	B	B	AB	AB	church_of_england%1:14:00::	B2	B	AB	AB	 than an Archbishops' Commission`` reported last month that in the <font color=green>Church</font>  of England alone there are 790 churches which are redundant	NNP	informative	1	0	1.27	0	8	Church	others	Church	a2	of England	capital letter, definiteness, modifier	the	NA	of England	no	yes	B	singular	yes	yes	no	no	no	no	no	NA	yes	a
church/NN/br-d04/56	0.154873631626589	0.0494320491320678	church	NN	religion	A	A	AB	AB	church_father%1:18:00::	A	A	AB	AB	 Jesus Christ the unique and the universal concur. Perhaps no <font color=green>church</font>  father saw this concurrence of the unique and the universal	NN	informative	4	6	2.11	1.5	7	church	others	church	a1	father;unique;universal		NA	NA	NA	no	NA	A	singular	no	no	no	no	no	no	no	NA	yes	a
church/NN/br-d05/1163	0.00112899929612804	0.136825179771369	church	NN	religion	B	B	AB	AB	Z	Z	Z	Z	Z	 Parker as the ultra-liberal minister within the pale of a <font color=green>church</font>  which had proclaimed itself the repository of liberality poses a	NN	informative	2	0	1.94	0	5	church	others	church	a2	minister;within the pale of a		a	NA	NA	no	no	?	singular	no	no	no	no	no	no	no	NA	yes	a
church/NN/br-d06/2048	-0.0323529219280264	-0.0163628980838247	church	NN	religion	E	E	DE	CDE	Z	Z	Z	Z	Z	 not one of the 70000000 Americans who do not attend <font color=green>church</font> , but who feel that various forms of recreation are more	NN	informative	1	1	1.37	1	7	church	others	church	c3	attend;Americans		none	NA	NA	yes	no	E	singular	no	no	no	no	no	no	no	yes	no	c
church/NN/br-d06/2174	-0.0535651185096266	-0.0216230401343575	church	NN	religion	C	C	C	CDE	Z	Z	Z	Z	Z	 spiritually. No amount of religious ceremonies or even joining a <font color=green>church</font>  will relieve the gnawing of your`` inner'' space. Why? Because	NN	informative	3	3	1.82	1	7	church	others	church	b	joining a	'religious ceremonies’ might be deceiving for the model	a	NA	NA	no	no	C	singular	no	no	no	no	no	no	yes	no	yes	b
church/NN/br-d07/1408	-0.0373768992363819	0.124939457765008	church	NN	religion	D	D	DE	CDE	Z	Z	Z	Z	Z	 then jumped; she was fatally injured. The entrance to a <font color=green>church</font>  has been walled up, so that the congregation, most of	NN	informative	2	1	1.28	0.5	7	church	others	church	c1	entrance;walled up	the mention of someone jumping and getting injured reinforces the concreteness I think	a	NA	NA	yes	no	D	singular	no	no	no	no	no	no	no	no	no	c
church/NN/br-d07/216	-0.0813708436310077	0.0559648259645369	church	NN	religion	C	C	C	CDE	Z	Z	Z	Z	Z	 of the most wholesome things you could schedule in your <font color=green>church</font>  would thus be a group confessional where people could admit	NN	informative	4	2	1.22	0.5	5	church	others	church	b1	schedule in your;group confessional		your	NA	NA	no	yes	C	singular	no	no	no	no	no	no	yes	yes	no	b
church/NN/br-d09/1054	0.0236866518022969	0.064909111150848	church	NN	religion	C	C	C	CDE	Z	Z	Z	Z	Z	 Me'',`` What the Church Means to Me'',`` Why Join the <font color=green>Church</font> '',`` The Duties of Church Members'', etc.. Assign a series of	NNP	informative	3	3	2.72	1	6	Church	others	Church	a2	join;duties;members	capital letter but could just be the title	the	NA	NA	no	yes	?	singular	yes	no	no	no	no	no	no	NA	yes	a
church/NN/br-d09/1061	0.0086539035177716	0.0412931618855396	church	NN	religion	C	C	C	CDE	Z	Z	Z	Z	Z	 Means to Me'',`` Why Join the Church'',`` The Duties of <font color=green>Church</font>  Members'', etc.. Assign a series of catechism questions to be	NNP	informative	4	3	2.27	0.75	6	Church	others	Church	b	Duties of;Members;catechism		NA	NA	NA	no	NA	C	singular	yes	no	no	no	no	no	yes	no	yes	b
church/NN/br-d09/1260	0.0250392099618599	-0.0827422622493503	church	NN	religion	C	C	C	CDE	Z	Z	Z	Z	Z	 provides a natural transition into the life of the local <font color=green>church</font>  and its organizations. The total process of evangelism reaches the	NN	informative	4	3	1.3	0.75	9	church	others	church	b	life;local;organizations		the	local	NA	no	yes	C	singular	no	no	yes	no	no	no	yes	no	yes	b
church/NN/br-d09/1619	0.211063563078858	-0.0699141049248558	church	NN	religion	C	C	C	CDE	Z	Z	Z	Z	Z	 the group of new members to be put in the <font color=green>church</font>  paper or placed on the bulletin board. Have a fellowship	NN	informative	5	4	1.09	0.8	7	church	others	church	b1	paper;pulletin board;members		NA	NA	NA	no	NA	C	singular	no	no	no	no	no	no	yes	yes	no	b
church/NN/br-d09/1641	-0.0856540034313421	0.0800594620265255	church	NN	religion	C	C	C	CDE	Z	Z	Z	Z	Z	 fellowship luncheon or dinner with new members as guests. The <font color=green>church</font>  is`` the family of God''. The members of the`` family	NN	informative	3	4	1.86	1.33	8	church	others	church	a1	members;family;fellowship	with such concrete terms as luncheon and dinner and members, i would think b, but with ‘family of God’ i would even go for a1	the	NA	NA	no	yes	C	singular	no	no	no	no	no	no	no	NA	yes	a
church/NN/br-d09/1829	0.129250676709917	-0.0207076555207472	church	NN	religion	C	C	C	CDE	Z	Z	Z	Z	Z	 during the same period there were 1080062 additions. Another major <font color=green>church</font>  body had 4499608 members and twenty years later its membership	NN	informative	5	4	1.31	0.8	6	church	others	church	b	body;members;membership		NA	NA	NA	no	NA	?	singular	no	no	no	no	no	no	yes	no	yes	b
church/NN/br-d09/2026	0.110876433665416	-0.0363147416351095	church	NN	religion	C	C	C	CDE	Z	Z	Z	Z	Z	 planned and carefully developed. The entire membership of the local <font color=green>church</font>  must be alerted to their part in this dynamic process	NN	informative	3	3	1.11	1	11	church	others	church	b	membership;local		the	local	NA	no	yes	C	singular	no	no	yes	no	no	no	yes	no	yes	b
church/NN/br-d09/2040	0.155254031378845	-0.0933963968172254	church	NN	religion	C	C	C	CDE	Z	Z	Z	Z	Z	 alerted to their part in this dynamic process. If the <font color=green>church</font>  has followed the plan of cultivation of prospects and carried	NN	informative	3	2	1.24	0.67	9	church	others	church	b	followed the plan		the	NA	NA	no	yes	?	singular	no	no	no	no	no	no	yes	no	yes	b
church/NN/br-d09/2084	-0.105007586277299	-0.0148616868586047	church	NN	religion	A	A	AB	AB	Z	Z	Z	Z	Z	 under way. Those who enter the front door of the <font color=green>church</font>  intelligently and with Christian dedication will not so easily step	NN	informative	2	1	1.32	0.5	6	church	others	church	a2	enter the front door;intelligently;with Christian dedication	organization understood metaphorically as a building	the	NA	NA	no	yes	A	singular	no	no	no	no	no	no	no	NA	yes	a
church/NN/br-d09/2174	0.197803933445704	-0.0212816916506344	church	NN	religion	C	C	C	CDE	Z	Z	Z	Z	Z	 members. The new members justifiably expect some things from their <font color=green>church</font>  family:	NN	informative	3	4	1.47	1.33	6	church	others	church	b	their;family;members		their	NA	NA	no	yes	C	singular	no	no	no	no	no	no	yes	no	yes	b
church/NN/br-d09/724	0.0126914343922759	0.0586383101917224	church	NN	religion	C	C	C	CDE	Z	Z	Z	Z	Z	 as well as the program and activities of the local <font color=green>church</font> . The lay leadership of the church may be invited to	NN	informative	5	4	1.82	0.8	7	church	others	church	b	program and activities of the;local;lay leadership		the	local	NA	no	yes	C	singular	no	no	yes	no	no	no	yes	no	yes	b
church/NN/br-d09/731	0.0117833135466862	0.0678619529408761	church	NN	religion	C	C	C	CDE	Z	Z	Z	Z	Z	 activities of the local church. The lay leadership of the <font color=green>church</font>  may be invited to speak on the various phases of	NN	informative	2	2	2.04	1	8	church	others	church	b	lay leadership;local church		the	NA	NA	no	yes	C	singular	no	no	no	no	no	no	yes	no	yes	b
church/NN/br-d09/742	0.0172051209003346	0.0511217798759802	church	NN	religion	C	C	C	CDE	Z	Z	Z	Z	Z	 may be invited to speak on the various phases of <font color=green>church</font>  life, service opportunities, the church school, missions, men 's work	NN	informative	6	3	2.11	0.5	10	church	others	church	d	phases of;life;service opportunities;missions		NA	NA	NA	no	NA	C	singular	no	no	no	no	no	no	no	NA	no	d
church/NN/br-d09/749	0.00505193358675545	0.0543432235016606	church	NN	religion	C	C	C	CDE	Z	Z	Z	Z	Z	 on the various phases of church life, service opportunities, the <font color=green>church</font>  school, missions, men 's work, women 's work, youth program	NN	informative	9	5	2.15	0.56	9	church	others	church	b	school;missions;men’s work;women’s work;youth program		NA	NA	NA	no	NA	C	singular	no	no	no	no	no	no	yes	no	yes	b
church/NN/br-d09/775	0.0158073593363467	-0.0819262210108397	church	NN	religion	C	C	C	CDE	Z	Z	Z	Z	Z	 youth program, social activities, and finances. The budget of the <font color=green>church</font>  may be presented and pledges solicited at this session. An	NN	informative	5	4	1.31	0.8	6	church	others	church	b	budget;fincances		the	NA	NA	no	yes	C	singular	no	no	no	no	no	no	yes	no	yes	b
church/NN/br-d09/825	-0.0231443547837692	-0.0581306799487853	church	NN	religion	D	D	DE	CDE	Z	Z	Z	Z	Z	 fourth session may be concluded with a tour of the <font color=green>church</font>  facilities and refreshments. The social time gives an opportunity for	NN	informative	4	3	1.5	0.75	8	church	others	church	c1	tour;facilities		NA	NA	NA	yes	NA	D	singular	no	no	no	no	no	no	no	no	no	c
church/NN/br-d09/837	0.0651512096236178	-0.0960773012698425	church	NN	religion	C	C	C	CDE	Z	Z	Z	Z	Z	 facilities and refreshments. The social time gives an opportunity for <font color=green>church</font>  leaders to become acquainted with the new members. In conducting	NN	informative	5	4	1.85	0.8	6	church	others	church	b	social time;learders;members		NA	NA	NA	no	NA	C	singular	no	no	no	no	no	no	yes	no	yes	b
church/NN/br-d09/935	-0.0928293013044771	0.116968461635391	church	NN	religion	A	A	AB	AB	Z	Z	Z	Z	Z	 dramatization- for example, in discussing the Lord 's Supper or <font color=green>church</font>  symbolism. Use audio-visual aids. Some excellent filmstrips with recordings and	NN	informative	3	1	1.59	0.33	6	church	others	church	a1	Lord’s Supper;symbolism		none	NA	NA	no	no	A	singular	no	no	no	no	no	no	no	NA	yes	a
church/NN/br-d10/1913	0.0669446147793939	0.0618737211983467	church	NN	religion	A	A	AB	AB	Z	Z	Z	Z	Z	 impressive Roman Catholic defense of the practical autonomy of both <font color=green>church</font>  and state. The failure at that time of the Puerto	NN	informative	2	0	1.68	0	9	church	others	church	a1	practical autonomy of;state		none	NA	NA	no	no	A	singular	no	no	no	no	no	no	no	NA	yes	a
church/NN/br-d10/2166	0.0710755443839809	0.0656208038781185	church	NN	religion	B	B	AB	AB	Z	Z	Z	Z	Z	 the Christian claim is of considerable significance. The Roman Catholic <font color=green>Church</font>  has excommunicated one of its priests, Father Feeney, for insisting	NNP	informative	6	4	2.06	0.67	8	Church	others	Church	a2	Roman Catholic;excommunicated;priests		the	Roman Catholic	NA	no	yes	B	singular	yes	no	no	no	no	yes	no	NA	yes	a
church/NN/br-d10/2187	0.121026576683702	0.183828305244964	church	NN	religion	A	A	AB	AB	Z	Z	Z	Z	Z	 for insisting that there is no salvation outside the visible <font color=green>church</font> . In mentioning this under`` salvation reconsidered'' I do not mean	NN	informative	1	2	2.33	2	4	church	others	church	a1	salvation;the visible	i suppose it could be a1…	the	visible	NA	no	yes	A	singular	no	no	no	no	no	yes	no	NA	yes	a
church/NN/br-d12/1462	0.0083493502235573	-0.0337339216373147	church	NN	religion	A	A	AB	AB	Z	Z	Z	Z	Z	 is discussed must surely be raised. The role of both <font color=green>church</font>  and university as sources of information and settings within which	NN	informative	3	1	1.41	0.33	7	church	others	church	a1	university;role		none	NA	NA	no	no	A	singular	no	no	no	no	no	no	no	NA	yes	a
church/NN/br-d12/233	0.086907837966331	0.0186913777685629	church	NN	religion	A	A	AB	AB	Z	Z	Z	Z	Z	 social change? What social, ethical and theological insights can the <font color=green>church</font>  and university help him bring to bear upon his situation	NN	informative	5	6	1.89	1.2	8	church	others	church	a1	university;insights		the	NA	NA	no	yes	A	singular	no	no	no	no	no	no	no	NA	yes	a
church/NN/br-d12/976	-0.00410879751890546	-0.0153331567642403	church	NN	religion	C	C	C	CDE	Z	Z	Z	Z	Z	 social and professional organizations, as citizens and civic leaders, as <font color=green>church</font>  laymen, as university alumni, as newspaper readers, etc.. From such	NN	informative	4	3	1.99	0.75	8	church	others	church	a1	laymen		none	NA	NA	no	no	C	singular	no	no	no	no	no	no	no	NA	yes	a
church/NN/br-d14/209	0.051638284304336	0.0234912866598375	church	NN	religion	A	A	AB	AB	Z	Z	Z	Z	Z	 of churches. Presumably those who did not have a formal <font color=green>church</font>  connexion had also felt the influence of Christianity to a	NN	informative	3	3	1.49	1	9	church	others	church	a1	connexion;Christianity		NA	NA	NA	no	NA	A	singular	no	no	no	no	no	no	no	NA	yes	a
church/NN/br-d14/234	0.11355940708777	0.0659144114877415	church	NN	religion	C	C	C	CDE	Z	Z	Z	Z	Z	 extent. Many of them had once been members of a <font color=green>church</font>  or at least had been given instruction in Christianity but	NN	informative	3	3	1.18	1	10	church	others	church	b	members of a;Christianity		a	NA	NA	no	no	C	singular	no	no	no	no	no	no	yes	no	yes	b
church/NN/br-d14/410	0.110281441206393	-0.0920200545839938	church	NN	religion	A	A	AB	AB	Z	Z	Z	Z	Z	 be absurd. For instance, we cannot know whether even for <font color=green>church</font>  members the degree of conformity to Christian standards of morality	NN	informative	5	3	1.9	0.6	6	church	others	church	b	members		NA	NA	NA	no	NA	A	singular	no	no	no	no	no	no	yes	no	yes	b
church/NN/br-d14/428	0.0687317651305054	-0.107674816900263	church	NN	religion	C	C	C	CDE	Z	Z	Z	Z	Z	 standards of morality increased or declined as the proportion of <font color=green>church</font>  members in the population rose. The temptation is to say	NN	informative	2	2	1.72	1	9	church	others	church	b	members;population		NA	NA	NA	no	NA	C	singular	no	no	no	no	no	no	yes	no	yes	b
church/NN/br-d14/446	0.0856745974249151	-0.0659908637792598	church	NN	religion	C	C	C	CDE	Z	Z	Z	Z	Z	 The temptation is to say that, as the percentage of <font color=green>church</font>  members mounted, the degree of discipline exercised by the churches	NN	informative	3	3	1.41	1	9	church	others	church	b	members		none	NA	NA	no	no	C	singular	no	no	no	no	no	no	yes	no	yes	b
church/NN/br-d14/557	0.136370735595192	-0.0673994325871144	church	NN	religion	A	A	AB	AB	Z	Z	Z	Z	Z	 If guilty, the offender might be excluded from membership. As <font color=green>church</font>  membership burgeoned, such measures faded into desuetude. But whether this	NN	informative	2	3	1.97	1.5	5	church	others	church	b	membership		NA	NA	NA	no	NA	A	singular	no	no	no	no	no	no	yes	no	yes	b
church/NN/br-d14/726	0.0880457329744961	0.0972603393028093	church	NN	religion	B	B	AB	AB	Z	Z	Z	Z	Z	 stock. By the end of the century the Roman Catholic <font color=green>Church</font>  was beginning to make itself felt, mainly through such institutions	NNP	informative	3	2	1.72	0.67	7	Church	others	Church	a2	Roman Catholic;institutions		the	Roman Catholic	NA	no	yes	B	singular	yes	no	no	no	no	yes	no	NA	yes	a
church/NN/br-d16/1602	0.0283659387607216	-0.0734405000813351	church	NN	religion	C	C	C	CDE	Z	Z	Z	Z	Z	 1: 12, 13. You may be very religious, a good <font color=green>church</font>  member, an upright, honest and sincere person; you may be	NN	informative	4	3	1.27	0.75	8	church	others	church	b	be very religious;good;member		NA	NA	NA	no	NA	C	singular	no	no	no	no	no	no	yes	no	yes	b
church/NN/br-d16/1644	-0.235039676664217	0.0543436596198561	church	NN	religion	A	A	AB	AB	Z	Z	Z	Z	Z	 and zealously keep all the sacraments and ceremonies of the <font color=green>church</font> ; you may have the final and extreme unction but if	NN	informative	5	1	2.1	0.2	2	church	others	church	a2	keep all the sacraments;ceremonies;extreme unction	with only the left context, it’s church in general, but the final and extreme unction makes it specific	the	NA	NA	no	yes	A	singular	no	no	no	no	no	no	no	NA	yes	a
church/NN/br-d16/1947	0.0166372932379087	0.13565804519874	church	NN	religion	A	A	AB	AB	Z	Z	Z	Z	Z	 Him. You can ignore His Book, the Bible, and His <font color=green>church</font> . You can laugh at His blood-bought salvation, curse His followers	NN	informative	6	2	2.23	0.33	5	church	others	church	a1	His;His Book;the Bible;His followers		His	NA	NA	no	yes	A	singular	no	no	no	no	no	no	no	NA	yes	a
church/NN/br-d16/220	0.0772451214504234	0.0804748904538896	church	NN	religion	B	B	AB	AB	Z	Z	Z	Z	Z	 a short reading of the Holy Scriptures''. Since the Catholic <font color=green>Church</font>  expresses such desire that the Sacred Scriptures be read, the	NNP	informative	4	3	2.34	0.75	8	Church	others	Church	a2	Catholic;expresses;Sacred Scripture	capital letter, definiteness, agent	the	Catholic	NA	no	yes	B	singular	yes	no	no	no	no	yes	no	NA	yes	a
church/NN/br-d17/1073	-0.249613108326253	-0.0552660701815114	church	NN	religion	C	C	C	CDE	Z	Z	Z	Z	Z	 different, and something important: Ruth Peale, her wide experience in <font color=green>church</font>  work; Sidney Fields, years of experience as a New York	NN	informative	2	3	1.03	1.5	7	church	others	church	b	work	it could almost go to b, but ‘church work’ is done as ‘participating in a community’	NA	NA	NA	no	NA	C	singular	no	no	no	no	no	no	yes	no	yes	b
church/NN/br-e13/272	0.17470178245577	0.145002013185434	church	NN	skill_and_hobbies	B	B	AB	AB	Z	Z	Z	Z	Z	 shifted religions- although the Patriarch, or Pope, of the Orthodox <font color=green>Church</font>  continued to live there, and still does- and became the	NNP	informative	3	1	1.26	0.33	4	Church	tech	Church	a2	the Orthodox;Patriarch;Pope		the	orthodox	NA	no	yes	B	singular	yes	no	no	no	no	yes	no	NA	yes	a
church/NN/br-e13/754	0.148838994960567	-0.192515575455997	church	NN	skill_and_hobbies	D	D	DE	CDE	Z	Z	Z	Z	Z	 the first of which was begun by Constantine, this fourth <font color=green>church</font>  was started by Justinian in 532 and completed twenty years	NN	informative	4	4	0.53	1	4	church	tech	church	c1	begun;started;completed;twenty years		this	fourth	NA	yes	yes	D	singular	no	no	yes	no	no	no	no	no	no	c
church/NN/br-f15/713	0.0808781339400183	0.0709051659679418	church	NN	popular_lore	B	B	AB	AB	roman_catholic_church%1:14:00::	B1	B	AB	AB	 permit birth control only for medical reasons. The Roman Catholic <font color=green>Church</font> , however, sanctions a much more liberal policy on family planning	NNP	informative	5	4	1.24	0.8	11	Church	others	Church	a2	the Roman Catholic;sanctions	capital letter, definiteness, agent	the	Roman Catholic	NA	no	yes	B	singular	yes	no	no	no	no	yes	no	NA	yes	a
church/NN/br-f15/754	0.0829917046288199	0.0582591980006827	church	NN	popular_lore	B	B	AB	AB	roman_catholic_church%1:14:00::	B1	B	AB	AB	 disagree over the methods to be used. The Roman Catholic <font color=green>Church</font>  sanctions only abstention or the rhythm method, also known as	NNP	informative	1	0	2.13	0	7	Church	others	Church	a2	The Roman Catholic;sanctions	capital letter, definiteness, agent	the	Roman Catholic	NA	no	yes	B	singular	yes	no	no	no	no	yes	no	NA	yes	a
church/NN/br-f15/776	0.0177729787064746	-0.150655453618919	church	NN	popular_lore	A	A	AB	AB	roman_catholic_church%1:14:00::	B1	B	AB	AB	 as the use of the infertile or safe period. The <font color=green>Church</font>  considers this to be the method provided by nature and	NNP	informative	3	3	1.11	1	8	Church	others	Church	a2	considers	capital letter, definiteness, agent	the	NA	NA	no	yes	A	singular	yes	no	no	no	no	no	no	NA	yes	a
church/NN/br-f15/862	0.0577491848155189	0.150874014794186	church	NN	popular_lore	A	A	AB	AB	roman_catholic_church%1:14:00::	B1	B	AB	AB	 there seems little chance of agreement. The grounds for the <font color=green>Church</font>  's position are Scriptural( Old Testament), the teachings of the	NNP	informative	3	1	0.78	0.33	8	Church	others	Church	a2	's position;Scriptural;teachings	Capital letter and definiteness	the	NA	NA	no	yes	A	singular	yes	no	no	no	no	no	no	NA	yes	a
church/NN/br-f15/882	0.0967327657919633	-0.0598296821067617	church	NN	popular_lore	A	A	AB	AB	roman_catholic_church%1:14:00::	B1	B	AB	AB	 the teachings of the fathers and doctors of the early <font color=green>Church</font> , the unbroken tradition of nineteen centuries, the decisions of the	NNP	informative	4	3	1.66	0.75	5	Church	others	Church	a1	teachings;fathers;doctors of;early		the	early	NA	no	yes	A	singular	yes	no	no	no	no	yes	no	NA	yes	a
church/NN/br-f44/1076	0.0838224189202078	-0.0073153187433454	church	NN	popular_lore	C	C	C	CDE	church%1:14:00::	B	B	AB	AB	 and economic level of the congregation; the mission of the <font color=green>church</font>  is actually a process of informal co-optation; the lay ministry	NN	informative	5	2	1.57	0.4	8	church	others	church	b	the mission of the;co-optation		the	NA	NA	no	yes	C	singular	no	no	no	no	no	no	yes	no	yes	b
church/NN/br-f44/1122	0.0284778560605898	-0.138610278836915	church	NN	popular_lore	D	D	DE	CDE	church%1:14:00::	B	B	AB	AB	 process of co-optation so long as the environs of the <font color=green>church</font>  provide a sufficient pool of people who can fit the	NN	informative	1	0	1.22	0	6	church	others	church	c2	co-optation;environs;people	environs puts the focus on the building, while co-optation and pool of people slide it to the community	the	NA	NA	yes	yes	?	singular	no	no	no	no	no	no	yes	no	no	c
church/NN/br-f44/1285	0.0338190607286464	-0.0108473394835815	church	NN	popular_lore	C	C	C	CDE	church%1:14:00::	B	B	AB	AB	 co-optation is the principal form of mission in the contemporary <font color=green>church</font> ; economic integration and co-optation are the two methods by which	NN	informative	3	2	1.49	0.67	8	church	others	church	b	co-optation;mission;contemporary		the	contemporary	NA	no	yes	?	singular	no	no	yes	no	no	no	yes	no	yes	b
church/NN/br-f44/1618	0.0620400593800255	-0.0617777972732431	church	NN	popular_lore	C	C	C	CDE	church%1:14:00::	B	B	AB	AB	 in the metropolis. It now becomes evident that the denominational <font color=green>church</font>  is intimately involved with the economy of middle-class culture, for	NN	informative	5	3	1.75	0.6	6	church	others	church	b	denominational;economy;middel-class culture		the	denominational	NA	no	yes	C	singular	no	no	no	no	no	yes	yes	no	yes	b
church/NN/br-f44/2150	0.00887260602999677	-0.0424907352602548	church	NN	popular_lore	C	C	C	CDE	church%1:14:00::	B	B	AB	AB	 will occupy our attention under the rubric of the organization <font color=green>church</font> . An understanding of the new role of residential association in	NN	informative	3	3	1.46	1	8	church	others	church	a2	organization;residential association	i’m not sure i understand the compund ‘organization church’	the	organization	NA	no	yes	?	singular	no	no	no	no	no	no	no	NA	yes	a
church/NN/br-f44/368	0.0781259512212849	-0.0978973102475379	church	NN	popular_lore	C	C	C	CDE	church%1:14:00::	B	B	AB	AB	 they can lose higher- and lower status members from the <font color=green>church</font>  without collapsing, but they need adequate recruits for the core	NN	informative	3	2	1.53	0.67	8	church	others	church	b	higher- and lower status;members;recruits		the	NA	NA	no	yes	C	singular	no	no	no	no	no	no	yes	no	yes	b
church/NN/br-f44/647	0.0306800490984845	0.0606838228005089	church	NN	popular_lore	A	A	AB	AB	church%1:14:00::	B	B	AB	AB	 denominations. There is much talk in theological circles about the`` <font color=green>Church</font>  as Mission'' and the`` Church 's Mission''; theologians have been	NNP	informative	4	4	2.45	1	7	Church	others	Church	a1	theological circles;Mission;theologians	Capital letter and definiteness	the	NA	NA	no	yes	A	singular	yes	no	no	no	no	no	no	NA	yes	a
church/NN/br-f44/654	0.0353794318145479	0.0968152245698926	church	NN	popular_lore	A	A	AB	AB	church%1:14:00::	B	B	AB	AB	 in theological circles about the`` Church as Mission'' and the`` <font color=green>Church</font>  's Mission''; theologians have been stressing the fact that the	NNP	informative	4	2	2.3	0.5	5	Church	others	Church	a2	's Mission;theologians	Capital letter and definiteness	the	NA	NA	no	yes	A	singular	yes	no	no	no	no	no	no	NA	yes	a
