id	model.x	model.y	lemma	pos	genre	marisense	mbroad	mari3	mari2	sensekey	wnsense	wnbroad	wn3	wn2	text	newPos	newBroadGenre	cues	cuesWithWeight	meanWeight	weightedCuesRatio	weightedCW	wf	broadGenre
state/NN/br-h14/1389	0.200445713538583	-0.0106672981365157	state	NN	miscellaneous	A	A	AB	ABC	state%1:15:01::	A	A	AB	ABC	 so lower its unadjusted allotment to its maximum allotment.( Each <font color=green>State</font>  's unadjusted allotment for any fiscal year, which exceeds its	NNP	informative	5	5	2.66	1	5	State	tech
state/NN/br-h14/1444	0.104209779760392	-0.0292079494219003	state	NN	miscellaneous	A	A	AB	ABC	state%1:15:01::	A	A	AB	ABC	 by the amount of the excess.) Determine if the particular <font color=green>State</font>  's unadjusted allotment( result obtained in item 11 above) is	NNP	informative	4	2	2.34	0.5	6	State	tech
state/NN/br-h14/1485	0.114958852173486	-0.0210735826913576	state	NN	miscellaneous	A	A	AB	ABC	state%1:15:01::	A	A	AB	ABC	 to its minimum allotment. Regardless of its unadjusted allotment, each <font color=green>State</font>  is guaranteed by law a minimum allotment each year equal	NNP	informative	4	6	2.06	1.5	9	State	tech
state/NN/br-h14/1521	0.174526908852859	-0.00321249859998983	state	NN	miscellaneous	A	A	AB	ABC	state%1:15:01::	A	A	AB	ABC	 percentage of 5.4865771 which brings total 1954 allotments to all <font color=green>States</font>  up to$ 23000000. The funds recouped by reductions in item	NNPS	informative	3	2	2.16	0.67	2	States	tech
state/NN/br-h14/1552	0.261076901058727	-0.0201277786512432	state	NN	miscellaneous	A	A	AB	ABC	state%1:15:01::	A	A	AB	ABC	 increase the unadjusted allotments to the specified minimum in those <font color=green>States</font>  where the unadjusted allotment is less than the minimum allotment	NNPS	informative	3	2	2.36	0.67	4	States	tech
state/NN/br-h14/1579	0.366053857504148	0.115275473133406	state	NN	miscellaneous	A	A	AB	ABC	state%1:15:01::	A	A	AB	ABC	 above); and second, to increase uniformly the allotments to those <font color=green>States</font>  whose allotments are below their maximums, with adjustments to prevent	NNPS	informative	3	1	1.7	0.33	1	States	tech
state/NN/br-h14/1595	0.119201129319097	0.00142006285417173	state	NN	miscellaneous	A	A	AB	ABC	state%1:15:01::	A	A	AB	ABC	 their maximums, with adjustments to prevent the allotment of any <font color=green>State</font>  from thereby exceeding its maximum. For the States which maintain	NNP	informative	4	4	1.99	1	5	State	tech
state/NN/br-h14/1795	0.0495143159481032	-0.00273001705858615	state	NN	miscellaneous	A	A	AB	ABC	state%1:15:01::	A	A	AB	ABC	 any State is referred to in the law as that <font color=green>State</font>  's`` Federal share''. For purposes of this explanation, this percentage	NNP	informative	5	3	1.64	0.6	6	State	tech
state/NN/br-h14/1815	0.105091566951807	-0.00951867929284557	state	NN	miscellaneous	A	A	AB	ABC	state%1:15:01::	A	A	AB	ABC	 of this explanation, this percentage is referred to as the <font color=green>States</font> `` unadjusted Federal share''. Beginning in 1960, the matching requirements for	NNPS	informative	5	3	2.12	0.6	4	States	tech
state/NN/br-h14/1897	0.150351927087046	-0.00700894381454329	state	NN	miscellaneous	A	A	AB	ABC	state%1:15:01::	A	A	AB	ABC	 pre 1960 rate of Federal participation with respect to any <font color=green>State</font>  's base allotment, as well as the adjusted rate in	NNP	informative	5	3	2.07	0.6	4	State	tech
state/NN/br-h14/1937	0.0785847279110255	-0.0107948057123042	state	NN	miscellaneous	A	A	AB	ABC	state%1:15:01::	A	A	AB	ABC	 State 's`` adjusted Federal Share''. The provisions for determining a <font color=green>State</font>  's unadjusted Federal share are designed to reflect the varying	NNP	informative	4	3	2.08	0.75	8	State	tech
state/NN/br-h14/198	0.277510338149784	0.170403409042202	state	NN	miscellaneous	A	A	AB	ABC	state%1:15:01::	A	A	AB	ABC	 backlog of an estimated two million disabled. To assist the <font color=green>States</font> , therefore, in rehabilitating handicapped individuals,`` so that they may prepare	NNPS	informative	2	1	2.39	0.5	1	States	tech
state/NN/br-h14/2019	0.0722497624783509	0.0177427388110963	state	NN	miscellaneous	A	A	AB	ABC	state%1:15:01::	A	A	AB	ABC	 forth in the Act. The term`` State'' means the several <font color=green>States</font> , the District of Columbia, the Virgin Islands, Guam and Puerto	NNPS	informative	4	1	2.16	0.25	8	States	tech
state/NN/br-h14/2039	0.143197965300437	0.0216224975612956	state	NN	miscellaneous	A5	A	AB	ABC	united_states%1:15:00::	A51	A	AB	ABC	 the Virgin Islands, Guam and Puerto Rico; the term`` United <font color=green>States</font> '' includes the several States and the District of Columbia and	NNPS	informative	1	0	2.55	0	9	States	tech
state/NN/br-h14/2044	0.0812504328910658	0.0148596453080953	state	NN	miscellaneous	A	A	AB	ABC	state%1:15:01::	A	A	AB	ABC	 and Puerto Rico; the term`` United States'' includes the several <font color=green>States</font>  and the District of Columbia and excludes the Virgin Islands	NNPS	informative	2	1	2.27	0.5	8	States	tech
state/NN/br-h14/2082	0.389767629403451	0.00526466897800619	state	NN	miscellaneous	A	A	AB	ABC	state%1:15:01::	A	A	AB	ABC	 The following steps are employed in the calculations: For each <font color=green>State</font> ( except the Virgin Islands, Guam, Puerto Rico, and, prior to	NNP	informative	3	1	3.08	0.33	5	State	tech
state/NN/br-h14/2143	0.216263301539105	-0.0126750318228607	state	NN	miscellaneous	A5	A	AB	ABC	united_states%1:15:00::	A51	A	AB	ABC	 above.) Determine the average per capita income for the United <font color=green>States</font>  for the last three years.( The same amount used in	NNPS	informative	1	0	2.18	0	5	States	tech
state/NN/br-h14/2182	0.245991608702879	-0.0120215137854176	state	NN	miscellaneous	A5	A	AB	ABC	united_states%1:15:00::	A51	A	AB	ABC	 40% to the average per capita income of the United <font color=green>States</font> .( Divide 40 by the amount used in item 2 above	NNPS	informative	1	0	2.5	0	5	States	tech
state/NN/br-h14/2200	0.225315652072582	-0.0125983305039484	state	NN	miscellaneous	A	A	AB	ABC	state%1:15:01::	A	A	AB	ABC	 the amount used in item 2 above.) Determine for each <font color=green>State</font> ( except the Virgin Islands, Guam, Puerto Rico, and, prior to	NNP	informative	3	1	2.82	0.33	8	State	tech
state/NN/br-h14/2236	0.163441507793594	-0.0274230540101288	state	NN	miscellaneous	A	A	AB	ABC	state%1:15:01::	A	A	AB	ABC	 which bears the same ratio to 40% as the particular <font color=green>State</font>  's average per capita income bears to the average per	NNP	informative	4	3	2.17	0.75	10	State	tech
state/NN/br-h14/2252	0.14462872734831	-0.0245958887364216	state	NN	miscellaneous	A5	A	AB	ABC	united_states%1:15:00::	A51	A	AB	ABC	 bears to the average per capita income of the United <font color=green>States</font> .( Multiply the result obtained in item 3 above by the	NNPS	informative	1	0	2.27	0	9	States	tech
state/NN/br-h14/2269	0.0705944501665268	-0.017610222663478	state	NN	miscellaneous	A	A	AB	ABC	state%1:15:01::	A	A	AB	ABC	 in item 3 above by the amount used for each <font color=green>State</font>  in item 1 above.) Determine the particular State 's`` Federal	NNP	informative	2	1	2.35	0.5	7	State	tech
state/NN/br-h14/2279	0.0402210539694897	-0.00742306034161506	state	NN	miscellaneous	A	A	AB	ABC	state%1:15:01::	A	A	AB	ABC	 for each State in item 1 above.) Determine the particular <font color=green>State</font>  's`` Federal Share''. By law this is 70% for the	NNP	informative	3	1	1.93	0.33	9	State	tech
state/NN/br-h14/2344	0.0917837560755828	-0.0108822962378235	state	NN	miscellaneous	A	A	AB	ABC	state%1:15:01::	A	A	AB	ABC	 the result obtained in item 4 above; except that no <font color=green>State</font>  shall have a Federal share less than 50% nor more	NNP	informative	2	2	2.28	1	5	State	tech
state/NN/br-h14/2367	0.0704066690606269	-0.00477418558962982	state	NN	miscellaneous	A	A	AB	ABC	state%1:15:01::	A	A	AB	ABC	 more than 70%. If the resulting difference for the particular <font color=green>State</font>  is less or more than these extremes, the State 's	NNP	informative	3	1	1.82	0.33	2	State	tech
state/NN/br-h14/2377	0.0828079445665312	0.0071236230989494	state	NN	miscellaneous	A	A	AB	ABC	state%1:15:01::	A	A	AB	ABC	 particular State is less or more than these extremes, the <font color=green>State</font>  's Federal share must be raised or lowered to the	NNP	informative	4	2	1.98	0.5	4	State	tech
state/NN/br-h14/30	0.10686302468473	0.0376568617359819	state	NN	miscellaneous	A	A	AB	ABC	state%1:15:01::	A	A	AB	ABC	 of the vocational rehabilitation program has been to assist the <font color=green>States</font> , by means of grants-in-aid, to return disabled men and women	NNPS	informative	2	1	1.78	0.5	4	States	tech
state/NN/br-h14/324	0.0830107275094064	0.000173514559774904	state	NN	miscellaneous	A1	A	AB	ABC	state%1:15:01::	A	A	AB	ABC	 existed until 1943, the Federal Government made grants to the <font color=green>States</font>  on the basis of population, matching State expenditures on a	NNPS	informative	5	4	1.72	0.8	6	States	tech
state/NN/br-h14/531	0.147197447568043	0.00822570941776371	state	NN	miscellaneous	A1	A	AB	ABC	state%1:15:01::	A	A	AB	ABC	 selected years, the authorizations, appropriations, allotment base, Federal grants to <font color=green>States</font>  and State matching funds for this part of the grant	NNPS	informative	4	4	2.45	1	6	States	tech
state/NN/br-h14/549	0.113010384627206	0.00829202549379468	state	NN	miscellaneous	A1	A	AB	ABC	state%1:15:01::	A	A	AB	ABC	 part of the grant program. In order to assist the <font color=green>States</font>  in maintaining basic vocational rehabilitation services, Section 2 of the	NNPS	informative	3	2	1.95	0.67	6	States	tech
state/NN/br-h14/567	0.0970995560746051	0.0265668798358913	state	NN	miscellaneous	A	A	AB	ABC	state%1:15:01::	A	A	AB	ABC	 Section 2 of the amended Act provides that allotments to <font color=green>States</font>  for support of such services be based on( 1) need	NNPS	informative	3	1	1.4	0.33	2	States	tech
state/NN/br-h14/585	0.134696827491619	-0.0218981011608269	state	NN	miscellaneous	A	A	AB	ABC	state%1:15:01::	A	A	AB	ABC	 services be based on( 1) need, as measured by a <font color=green>State</font>  's population, and( 2) fiscal capacity, as measured by its	NNP	informative	4	2	1.55	0.5	2	State	tech
state/NN/br-h14/643	0.249049731735825	-0.0269436076010027	state	NN	miscellaneous	A	A	AB	ABC	state%1:15:01::	A	A	AB	ABC	 base'' allotment, and a`` ceiling'' or maximum allotment, for each <font color=green>State</font> . It stipulates, in addition, that all amounts remaining as a	NNP	informative	3	3	2.27	1	4	State	tech
state/NN/br-h14/679	0.315939358432063	-0.00614404202514828	state	NN	miscellaneous	A	A	AB	ABC	state%1:15:01::	A	A	AB	ABC	 not used for insuring the`` floor'', be redistributed to those <font color=green>States</font>  still below their maximums. These provisions are designed to reflect	NNPS	informative	3	1	2.49	0.33	1	States	tech
state/NN/br-h14/699	0.0782881478062716	-0.114272856159491	state	NN	miscellaneous	A	A	AB	ABC	state%1:15:01::	A	A	AB	ABC	 to reflect the differences in wealth and population among the <font color=green>States</font> , with the objective that a vocationally handicapped person have access	NNPS	informative	3	2	1.47	0.67	3	States	tech
state/NN/br-h14/721	0.286409829511979	-0.00940315698565262	state	NN	miscellaneous	A	A	AB	ABC	state%1:15:01::	A	A	AB	ABC	 to needed services regardless of whether he resides in a <font color=green>State</font>  with a low or high per capita income or a	NNP	informative	4	1	2.25	0.25	4	State	tech
state/NN/br-h14/736	0.259506637524646	0.00546492299329275	state	NN	miscellaneous	A	A	AB	ABC	state%1:15:01::	A	A	AB	ABC	 high per capita income or a sparsely or thickly populated <font color=green>State</font> . The provisions are also designed to avoid disruption in State	NNP	informative	3	1	2.54	0.33	4	State	tech
state/NN/br-h14/794	0.0722497624783509	0.0177427388110963	state	NN	miscellaneous	A	A	AB	ABC	state%1:15:01::	A	A	AB	ABC	 forth in the Act. The term`` State'' means the several <font color=green>States</font> , the District of Columbia, the Virgin Islands, Guam and Puerto	NNPS	informative	3	0	2.16	0	8	States	tech
state/NN/br-h14/814	0.143197965300437	0.0216224975612956	state	NN	miscellaneous	A5	A	AB	ABC	united_states%1:15:00::	A51	A	AB	ABC	 the Virgin Islands, Guam and Puerto Rico; the term`` United <font color=green>States</font> '' includes the several States and the District of Columbia, and	NNPS	informative	1	0	2.55	0	9	States	tech
state/NN/br-h14/819	0.0694845944874427	0.0144020393034258	state	NN	miscellaneous	A	A	AB	ABC	state%1:15:01::	A	A	AB	ABC	 and Puerto Rico; the term`` United States'' includes the several <font color=green>States</font>  and the District of Columbia, and excludes the Virgin Islands	NNPS	informative	3	1	2.22	0.33	7	States	tech
state/NN/br-h14/857	0.389767629472349	0.00526466897684963	state	NN	miscellaneous	A	A	AB	ABC	state%1:15:01::	A	A	AB	ABC	 Hawaii. The following steps are employed in calculations: For each <font color=green>State</font> ( except Puerto Rico, Guam, the Virgin Islands, and, prior to	NNP	informative	4	1	3.08	0.25	5	State	tech
state/NN/br-h14/981	0.18968030381728	-0.0149598735611495	state	NN	miscellaneous	A	A	AB	ABC	state%1:15:01::	A	A	AB	ABC	 the result obtained in item 2 above.) Determine for each <font color=green>State</font> ( except the Virgin Islands, Guam and Puerto Rico, and, prior	NNP	informative	3	1	2.69	0.33	9	State	tech
state/NN/br-h17/670	-0.0475041217863058	0.261443845450445	state	NN	miscellaneous	A5	A	AB	ABC	united_states%1:14:00::	A52	A	AB	ABC	 petitioner. Daniel M. Friedman argued the cause for the United <font color=green>States</font> . On the brief were Solicitor General Rankin, Assistant Attorney General	NNPS	informative	1	0	1.63	0	3	States	tech
state/NN/br-h18/132	0.0411217059103657	0.0505091134879741	state	NN	miscellaneous	C	C	C	ABC	department_of_state%1:14:00::	C1	C	C	ABC	 our situation. It is the concern of the Department of <font color=green>State</font>  that the American people are safe and secure- defense is	NNP	informative	1	1	1.46	1	4	State	tech
state/NN/br-h18/1462	0.289720378663108	0.295374879709159	state	NN	miscellaneous	A5	A	AB	ABC	united_states%1:14:00::	A52	A	AB	ABC	 of policy, well established precedents, the commitments of the United <font color=green>States</font>  under international charters and treaties, basic statutes, and well understood	NNPS	informative	1	0	2.16	0	1	States	tech
state/NN/br-h18/163	0.0439493906890658	0.0524570265883249	state	NN	miscellaneous	C	C	C	ABC	department_of_state%1:14:00::	C1	C	C	ABC	 Defense. It is also the concern of the Department of <font color=green>State</font>  that our trading relationships with the rest of the world	NNP	informative	3	2	1.42	0.67	3	State	tech
state/NN/br-h18/2007	0.0658287123914418	0.0779109427492072	state	NN	miscellaneous	C	C	C	ABC	department_of_state%1:14:00::	C1	C	C	ABC	 this point by saying,`` You fellows in the Department of <font color=green>State</font>  do n't know much about domestic politics''. This is an	NNP	informative	1	1	1.55	1	3	State	tech
state/NN/br-h18/22	0.0294332215256934	0.391792539850513	state	NN	miscellaneous	A5	A	AB	ABC	united_states%1:14:00::	A52	A	AB	ABC	 to make a few suggestions: What we in the United <font color=green>States</font>  do or do not do will make a very large	NNPS	informative	1	0	1.06	0	1	States	tech
state/NN/br-h18/705	0.12937660541223	-0.0387170248451707	state	NN	miscellaneous	A5	A	AB	ABC	united_states%1:15:00::	A51	A	AB	ABC	 our Capital, can be easily be directed against the United <font color=green>States</font>  and all that it stands for. Dozens of seemingly small	NNPS	informative	1	0	1.4	0	3	States	tech
state/NN/br-h18/791	0.0268024536993841	0.0195335315820219	state	NN	miscellaneous	C	C	C	ABC	department_of_state%1:14:00::	C1	C	C	ABC	 who can do something about them. If the Department of <font color=green>State</font>  is to take primary responsibility for foreign policy in Washington	NNP	informative	1	1	1.65	1	4	State	tech
state/NN/br-h21/1002	0.156460161963581	-0.089067371709721	state	NN	miscellaneous	A	A	AB	ABC	state%1:15:01::	A	A	AB	ABC	 Federal Aviation Agency. The growing communications needs of this new <font color=green>State</font>  can best be met, as they have in other States	NNP	informative	5	1	1.74	0.2	2	State	tech
state/NN/br-h21/1013	0.0505248681626563	-0.106651001851542	state	NN	miscellaneous	A4	A	AB	ABC	state%1:15:01::	A	A	AB	ABC	 State can best be met, as they have in other <font color=green>States</font> , through the operation and development of such facilities by private	NNPS	informative	4	1	1.3	0.25	2	States	tech
state/NN/br-h24/1018	0.122529266757817	0.117714224785193	state	NN	miscellaneous	A5	A	AB	ABC	united_states%1:15:00::	A51	A	AB	ABC	 also Interest on Unpaid Taxes, below. Citizens of the United <font color=green>States</font>  who, on April 15, are not in the United States	NNPS	informative	1	0	1.98	0	3	States	tech
state/NN/br-h24/1030	0.31903635537759	0.0609096345335587	state	NN	miscellaneous	A5	A	AB	ABC	united_states%1:15:00::	A51	A	AB	ABC	 States who, on April 15, are not in the United <font color=green>States</font>  or Puerto Rico, are allowed an extension of time until	NNPS	informative	1	0	2.65	0	4	States	tech
state/NN/br-h24/1120	0.350292220944721	0.0287089966400722	state	NN	miscellaneous	A5	A	AB	ABC	united_states%1:15:00::	A51	A	AB	ABC	 Naval Personnel on duty in Alaska or outside the United <font color=green>States</font>  and Puerto Rico are also allowed this automatic extension of	NNPS	informative	1	0	2.53	0	4	States	tech
state/NN/br-h24/1166	0.325471477870716	0.0524814897657691	state	NN	miscellaneous	A5	A	AB	ABC	united_states%1:15:00::	A51	A	AB	ABC	 that you were in Alaska or were outside the United <font color=green>States</font>  or Puerto Rico on April 15 or other due date	NNPS	informative	1	0	2.91	0	4	States	tech
state/NN/br-h24/1574	0.264542487202134	0.0377834617636296	state	NN	miscellaneous	A5	A	AB	ABC	united_states%1:15:00::	A51	A	AB	ABC	 of abode for the tax year is outside the United <font color=green>States</font> ( including Alaska and Hawaii), Puerto Rico, or the Virgin Islands	NNPS	informative	1	0	2.43	0	5	States	tech
state/NN/br-h24/1608	0.135075964425936	0.123649017226258	state	NN	miscellaneous	A5	A	AB	ABC	united_states%1:15:00::	A51	A	AB	ABC	 of business in any internal revenue district in the United <font color=green>States</font> , you should file your return with the Office of International	NNPS	informative	1	0	1.61	0	2	States	tech
state/NN/br-h24/471	0.0851425678070392	0.0691071756409091	state	NN	miscellaneous	A5	A	AB	ABC	united_states%1:15:00::	A51	A	AB	ABC	 in Canada or Mexico who earn wages in the United <font color=green>States</font>  may be subject to withholding of tax on their wages	NNPS	informative	3	2	1.92	0.67	4	States	tech
state/NN/br-h24/493	0.0592643286410778	0.0297869550769406	state	NN	miscellaneous	A5	A	AB	ABC	united_states%1:15:00::	A51	A	AB	ABC	 the same as if they were citizens of the United <font color=green>States</font> . Their United States tax returns are due April 16, 1962	NNPS	informative	1	0	1.81	0	5	States	tech
state/NN/br-h24/512	0.130573810647524	0.0490752163381269	state	NN	miscellaneous	A5	A	AB	ABC	united_states%1:15:00::	A51	A	AB	ABC	 returns are due April 16, 1962. However, if their United <font color=green>States</font>  income is not subject to the withholding of tax on	NNPS	informative	1	0	2.01	0	4	States	tech
state/NN/br-j03/2180	0.182866254449488	-0.403194043603629	state	NN	learned	D	D	D	D	state%1:03:00::	D1	D	D	D	 which states that** f, where \q is the probability that <font color=green>state</font> ( i.e., volume for an ideal gas) could be reached by	NN	informative	3	0	1.33	0	1	state	tech
state/NN/br-j03/353	-0.124693709915196	-0.353021260275067	state	NN	learned	D	D	D	D	state%1:03:00::	D1	D	D	D	 the tape was run for over 1 hr., a steady <font color=green>state</font>  was not reached, and it was concluded that the reason	NN	informative	2	1	1.96	0.5	1	state	tech
state/NN/br-j03/577	-0.0457073253765712	-0.333814147846375	state	NN	learned	D	D	D	D	state%1:03:00::	D1	D	D	D	 fluid measured from the top of the block, and steady <font color=green>states</font>  were apparently reached with these fluids. It is presumed that	NNS	informative	3	1	1.62	0.33	2	states	tech
state/NN/br-j07/1320	0.148661267055221	-0.433847464150849	state	NN	learned	A5	A	AB	ABC	united_states%1:15:00::	A51	A	AB	ABC	 cause a deviation from a linear relationship. In the United <font color=green>States</font> , most of the sensors are calibrated by dropping small spheres	NNPS	informative	1	0	1.42	0	1	States	tech
state/NN/br-j07/414	0.0658743101142266	-0.252521252035795	state	NN	learned	D	D	D	D	state%1:03:00::	D1	D	D	D	 the material spiraling into the sun, maintaining a fairly steady <font color=green>state</font> . Asteroidal collisions are also thought to contribute material. It is	NN	informative	3	1	1.78	0.33	2	state	tech
state/NN/br-j10/14	-0.279340694354166	-0.152809666602405	state	NN	learned	D	D	D	D	state%1:03:00::	D1	D	D	D	 the honeybee, practically all bees and bumblebees hibernate in a <font color=green>state</font>  of torpor. Occasionally, you may come across one or two	NN	informative	2	0	1.14	0	2	state	tech
state/NN/br-j10/1969	0.00478047985871369	-0.342550340203519	state	NN	learned	A5	A	AB	ABC	united_states%1:15:00::	A51	A	AB	ABC	 found in tremendous numbers in certain parts of the United <font color=green>States</font>  west of the Great Plains, for example, in Utah and	NNPS	informative	1	0	1.46	0	1	States	tech
state/NN/br-j10/1988	0.0581801530328227	0.0786978534059686	state	NN	learned	A5	A	AB	ABC	united_states%1:15:00::	A51	A	AB	ABC	 for example, in Utah and central Washington. In the United <font color=green>States</font>  Department of Agriculture 's Yearbook of Agriculture, 1952, which is	NNPS	informative	1	0	1.8	0	4	States	tech
state/NN/br-j10/543	-0.0375367468375944	0.0890303520324484	state	NN	learned	A5	A	AB	ABC	united_states%1:15:00::	A51	A	AB	ABC	 Bombus; there must be several dozen species in the United <font color=green>States</font>  alone. If you really insist on knowing their names, an	NNPS	informative	1	0	1.14	0	2	States	tech
state/NN/br-j11/799	0.181903992855093	0.237975302462883	state	NN	learned	A5	A	AB	ABC	united_states%1:15:00::	A51	A	AB	ABC	 summary of the habits of the snakes of the United <font color=green>States</font> , could supply data on the maturing period for only three	NNPS	informative	1	0	1.3	0	2	States	tech
state/NN/br-j11/916	-0.0851461192433762	0.327003756580337	state	NN	learned	A5	A	AB	ABC	united_states%1:15:00::	A51	A	AB	ABC	 three. Other herpetologists have ascertained that in the northern United <font color=green>States</font>  the prairie rattlesnake may not give first birth until it	NNPS	informative	1	0	1.7	0	1	States	tech
state/NN/br-j17/1109	0.101985026795792	-0.33184614516572	state	NN	learned	D	D	D	D	state%1:03:00::	D1	D	D	D	 balance, but for the sake of correlating autonomic and clinical <font color=green>states</font> , and of studying the effect of certain therapeutic procedures on	NNS	informative	5	2	1.51	0.4	3	states	tech
state/NN/br-j17/1231	0.0773393774689313	-0.198002672150388	state	NN	learned	D	D	D	D	state%1:03:00::	D1	D	D	D	 persons by drugs. The fundamental differences between physiological and pathological <font color=green>states</font>  of parasympathetic( and also of sympathetic) dominance remain to be	NNS	informative	5	3	1.67	0.6	5	states	tech
state/NN/br-j17/1283	0.123909645235476	-0.210997299167483	state	NN	learned	D	D	D	D	state%1:03:00::	D1	D	D	D	 its balance lead also to qualitative alterations in reactivity. A <font color=green>state</font>  of parasympathetic`` tuning'' of the hypothalamus induced experimentally causes not	NN	informative	6	2	1.49	0.33	3	state	tech
state/NN/br-j17/1330	0.0592536998089988	-0.176938181395982	state	NN	learned	D	D	D	D	state%1:03:00::	D1	D	D	D	 a stimulus acting sympathetically under control conditions elicits in this <font color=green>state</font>  of tuning a parasympathetic response! Furthermore, conditioned reactions are fundamentally	NN	informative	4	3	1.56	0.75	4	state	tech
state/NN/br-j17/1500	0.044944234849565	-0.123386994693641	state	NN	learned	D	D	D	D	state%1:03:00::	D1	D	D	D	 altering the hypothalamic balance alter conditioned reactions;( 3) in a <font color=green>state</font>  of depression, the positive conditioned stimulus may fail to elicit	NN	informative	4	3	1.59	0.75	7	state	tech
state/NN/br-j17/1558	0.0456310277930668	-0.131318058849749	state	NN	learned	D	D	D	D	state%1:03:00::	D1	D	D	D	 fundamental alterations in conditioned reactions occur in a variety of <font color=green>states</font>  in which the hypothalamic balance has been altered by physiological	NNS	informative	4	3	1.65	0.75	7	states	tech
state/NN/br-j17/1626	0.0622180598229892	-0.188856014038804	state	NN	learned	D	D	D	D	emotional_state%1:26:00::	D1	D	D	D	 just mentioned which alter the hypothalamic balance would influence emotional <font color=green>state</font>  and behavior but that emotion itself would act likewise. We	NN	informative	4	1	1.57	0.25	5	state	tech
state/NN/br-j17/2022	0.0288354785407307	-0.177930426052305	state	NN	learned	D	D	D	D	state%1:03:00::	D1	D	D	D	 a functional antagonism exists between an aggressive attitude and a <font color=green>state</font>  of anxiety. Although in both emotions sympathetic symptoms are present	NN	informative	3	1	1.38	0.33	6	state	tech
state/NN/br-j17/2076	0.0313437055729589	-0.182982575205691	state	NN	learned	D	D	D	D	emotional_state%1:26:00::	D1	D	D	D	 and the Mecholyl test. The psychological incompatibility of these emotional <font color=green>states</font>  seems to be reflected in, or based on, this marked	NNS	informative	2	2	1.81	1	3	states	tech
