id	model.x	model.y	lemma	pos	genre	broadGenre	marisense	mbroad	mari3	mari2	sensekey	wnsense	wnbroad	wn3	wn2	text	newPos	newBroadGenre	cues	cuesWithWeight	meanWeight	weightedCuesRatio	weightedCW	wf
church/NN/br-d01/1628	-0.394964466278457	-0.369619727099194	church	NN	religion	non-fiction	B	B	AB	AB	church%1:14:00::	B	B	AB	AB	 age to whip men into a surrender to a particular <font color=green>church</font>  or church-state''. Apparently he does not intend that those who	NN	informative	3	1	3.1	0.33	1	church
church/NN/br-d02/1641	-0.320884497658704	-0.269280170862689	church	NN	religion	non-fiction	B	B	AB	AB	church%1:14:00::	B	B	AB	AB	 concerned to stand squarely within the tradition of the apostolic <font color=green>church</font> , they have exhibited no willingness whatever to sacrifice their modernity	NN	informative	2	0	3.66	0	1	church
church/NN/br-d02/706	-0.462864047189994	0.0971847878443906	church	NN	religion	non-fiction	A	A	AB	AB	church%1:14:00::	B	B	AB	AB	 there tends to be an almost complete indifference to the <font color=green>church</font>  and its traditional message of sin and grace. To be	NN	informative	4	0	3.12	0	1	church
church/NN/br-d02/923	-0.297859850510782	-0.395027400325743	church	NN	religion	non-fiction	A	A	AB	AB	church%1:14:00::	B	B	AB	AB	 for accomplishing his work in the world. by analogy, the <font color=green>church</font>  also has been regarded as entirely independent of the`` world	NN	informative	3	0	3.14	0	1	church
church/NN/br-d03/1342	-0.202859747715469	0.00542479647283697	church	NN	religion	non-fiction	E	E	DE	CDE	church%1:06:00::	D	D	DE	CDE	 my experience to find as many men as women in <font color=green>church</font> , and to hear almost everyone in church congregations reciting the	NN	informative	5	1	3.4	0.2	2	church
church/NN/br-d03/1350	-0.178967414439501	0.0183413009247336	church	NN	religion	non-fiction	E	E	DE	CDE	church%1:06:00::	D	D	DE	CDE	 as women in church, and to hear almost everyone in <font color=green>church</font>  congregations reciting the Latin prayers and responses at Mass. They	NN	informative	5	3	3.29	0.6	3	church
church/NN/br-d03/1871	-0.21379690222915	-0.0140934548902092	church	NN	religion	non-fiction	B	B	AB	AB	catholic_church%1:14:00::	B1	B	AB	AB	 the Sunday Observer implies a kindly recognition that the Catholic <font color=green>Church</font>  is now at least of equal stature in England with	NNP	informative	2	1	3.9	0.5	2	Church
church/NN/br-d03/1909	-0.390530195445497	-0.0648945701363329	church	NN	religion	non-fiction	B	B	AB	AB	church_of_england%1:14:00::	B2	B	AB	AB	 non-Catholic) wrote articles in the Observer depicting clergymen of the <font color=green>Church</font>  of England, the Church of Rome and the Nonconformist Church	NNP	informative	6	0	3.42	0	1	Church
church/NN/br-d03/2336	-0.16179098001368	0.0147123420763748	church	NN	religion	non-fiction	D	D	DE	CDE	catholic_church%1:14:00::	B1	B	AB	AB	 a votive Mass offered for Christian unity at a Catholic <font color=green>church</font>  in Slough during the Church Unity Octave.	NN	informative	2	0	3.92	0	2	church
church/NN/br-d03/2341	-0.16179098001368	0.0147123420763748	church	NN	religion	non-fiction	A	A	AB	AB	church%1:14:00::	B	B	AB	AB	 Christian unity at a Catholic church in Slough during the <font color=green>Church</font>  Unity Octave.	NNP	informative	2	0	3.92	0	2	Church
church/NN/br-d03/721	-0.168144675550622	0.210644065564701	church	NN	religion	non-fiction	B	B	AB	AB	church%1:06:00::	D	D	DE	CDE	 crowds going in and out of the Birmingham Oratory( Catholic) <font color=green>Church</font>  on Sunday mornings. She found this a marvel because, as	NNP	informative	1	0	3.11	0	2	Church
church/NN/br-f15/713	-0.193155871142192	-0.0022925057239536	church	NN	popular_lore	fiction	B	B	AB	AB	roman_catholic_church%1:14:00::	B1	B	AB	AB	 permit birth control only for medical reasons. The Roman Catholic <font color=green>Church</font> , however, sanctions a much more liberal policy on family planning	NNP	informative	5	2	3.87	0.4	2	Church
church/NN/br-f15/754	-0.193155871142192	-0.0022925057239536	church	NN	popular_lore	fiction	B	B	AB	AB	roman_catholic_church%1:14:00::	B1	B	AB	AB	 disagree over the methods to be used. The Roman Catholic <font color=green>Church</font>  sanctions only abstention or the rhythm method, also known as	NNP	informative	1	0	3.87	0	2	Church
church/NN/br-f44/1076	-0.26830524930915	-0.0925227701508537	church	NN	popular_lore	fiction	C	C	C	CDE	church%1:14:00::	B	B	AB	AB	 and economic level of the congregation; the mission of the <font color=green>church</font>  is actually a process of informal co-optation; the lay ministry	NN	informative	5	1	3.2	0.2	1	church
church/NN/br-f44/1285	-0.26830524930915	-0.0925227701508537	church	NN	popular_lore	fiction	C	C	C	CDE	church%1:14:00::	B	B	AB	AB	 co-optation is the principal form of mission in the contemporary <font color=green>church</font> ; economic integration and co-optation are the two methods by which	NN	informative	3	1	3.2	0.33	1	church
church/NN/br-f44/647	-0.155143958413379	0.00459522677227369	church	NN	popular_lore	fiction	A	A	AB	AB	church%1:14:00::	B	B	AB	AB	 denominations. There is much talk in theological circles about the`` <font color=green>Church</font>  as Mission'' and the`` Church 's Mission''; theologians have been	NNP	informative	4	2	3.29	0.5	3	Church
church/NN/br-f44/654	-0.155143958413379	0.00459522677227369	church	NN	popular_lore	fiction	A	A	AB	AB	church%1:14:00::	B	B	AB	AB	 in theological circles about the`` Church as Mission'' and the`` <font color=green>Church</font>  's Mission''; theologians have been stressing the fact that the	NNP	informative	4	2	3.29	0.5	3	Church
church/NN/br-g12/1271	-0.0250242685598116	0.447227959226921	church	NN	belles_lettres	fiction	D	D	DE	CDE	church%1:06:00::	D	D	DE	CDE	 and gestured toward the Madeleine. The classical lines of the <font color=green>church</font>  which Napoleon thought of as a Temple of Glory, dominated	NN	informative	5	1	3.21	0.2	1	church
church/NN/br-h17/1199	-0.320884497658704	-0.269280170862689	church	NN	miscellaneous	non-fiction	C	C	C	CDE	church%1:14:00::	B	B	AB	AB	 because of his willingness to kill in defense of his <font color=green>church</font>  and home. Upon administrative approval of the reclassification, he was	NN	informative	2	0	3.66	0	1	church
church/NN/br-j57/2237	-0.308890151600486	0.049967710280195	church	NN	learned	non-fiction	A	A	AB	AB	church_father%1:18:00::	A	A	AB	AB	 which reached Christianity by the way of Stoicism through the <font color=green>Church</font>  Fathers of Late Antiquity.	NNP	informative	3	1	3.06	0.33	1	Church
church/NN/br-k04/1117	-0.422602812897736	0.309677652676685	church	NN	fiction_gral	fiction	D	D	DE	CDE	church%1:06:00::	D	D	DE	CDE	 of gambling in both. On the other side of the <font color=green>church</font>  was a quiet, well-kept house with shutters and recently painted	NN	imaginative	4	0	3.66	0	1	church
church/NN/br-k04/1485	-0.166605246693717	0.0318820256004991	church	NN	fiction_gral	fiction	C	C	C	CDE	church%1:06:00::	D	D	DE	CDE	 that clear as this was, they must have a better <font color=green>church</font> , a more business-like conduct of the church organization, and an	NN	imaginative	2	0	3.25	0	2	church
church/NN/br-k04/1493	-0.166605246693717	0.0318820256004991	church	NN	fiction_gral	fiction	C	C	C	CDE	church%1:14:00::	B	B	AB	AB	 have a better church, a more business-like conduct of the <font color=green>church</font>  organization, and an effort to get this religious center out	NN	imaginative	4	0	3.25	0	2	church
church/NN/br-k04/1514	-0.188299806026468	-0.251602781454596	church	NN	fiction_gral	fiction	C	C	C	CDE	church%1:14:00::	B	B	AB	AB	 out of its rut of wild worship into a modern <font color=green>church</font>  organization. He emphasized to the Presiding Elder the plan of	NN	imaginative	5	1	3.58	0.2	1	church
church/NN/br-k04/1807	-0.422602813170416	0.309677652803413	church	NN	fiction_gral	fiction	D	D	DE	CDE	church%1:06:00::	D	D	DE	CDE	 of money that has been invested by whites around that <font color=green>church</font> ? Tenements, stores, saloons, some gambling, I hope not too much	NN	imaginative	5	0	3.66	0	1	church
church/NN/br-k04/923	-0.278362733689454	0.295202575122679	church	NN	fiction_gral	fiction	D	D	DE	CDE	church%1:06:00::	D	D	DE	CDE	 which she was chief repository. Then Wilson looked over the <font color=green>church</font>  and studied its condition. The salary of the pastor had	NN	imaginative	3	1	3.32	0.33	1	church
church/NN/br-k06/571	-0.183667076589997	0.394876246627576	church	NN	fiction_gral	fiction	D	D	DE	CDE	church%1:06:00::	D	D	DE	CDE	 cupboards.`` There 's a tower and a steeple on the <font color=green>church</font>  a million feet high. And the loudest clock in the	NN	imaginative	3	1	4.1	0.33	1	church
church/NN/br-k06/852	-0.314668098716854	0.2974906606844	church	NN	fiction_gral	fiction	D	D	DE	CDE	church%1:06:00::	D	D	DE	CDE	 Church with its high steeple and clock. There was no <font color=green>church</font>  like Drew Church, no preacher like Papa, who was intimate	NN	imaginative	3	0	3.14	0	1	church
church/NN/br-k10/1423	-0.483859766091035	-0.0259492629968363	church	NN	fiction_gral	fiction	A	A	AB	AB	church%1:14:00::	B	B	AB	AB	 economics, and social issues that are no concern of the <font color=green>Church</font> ''? And John 's reply was always the same:`` Anything that	NNP	imaginative	5	0	3.33	0	1	Church
church/NN/br-k10/1445	-0.291915799586034	0.419777011624784	church	NN	fiction_gral	fiction	A	A	AB	AB	church%1:14:00::	B	B	AB	AB	 same:`` Anything that affects souls is the concern of the <font color=green>Church</font> ! We will have righteousness''! Tears burned behind his eyes as	NNP	imaginative	3	0	3.31	0	1	Church
church/NN/br-k10/271	-0.483859763180548	-0.025949261817042	church	NN	fiction_gral	fiction	A	A	AB	AB	church%1:14:00::	B	B	AB	AB	 fingers at their sins. I say to you that the <font color=green>Church</font>  will ever decry evil''! John 's reply was like a	NNP	imaginative	3	0	3.33	0	1	Church
church/NN/br-k10/588	-0.0893118374187654	0.21326274331332	church	NN	fiction_gral	fiction	A	A	AB	AB	church%1:14:00::	B	B	AB	AB	 to let them give him the last rites of the <font color=green>Church</font> , but he had died still proclaiming salvation by faith. Burial	NNP	imaginative	3	1	3.32	0.33	2	Church
church/NN/br-k10/967	-0.183667076589997	0.394876246627576	church	NN	fiction_gral	fiction	D	D	DE	CDE	church%1:06:00::	D	D	DE	CDE	 all the time. Quickening his steps, John entered the vast <font color=green>church</font>  and climbed the tower steps to the bells. Underneath the	NN	imaginative	6	1	4.1	0.17	1	church
church/NN/br-k13/533	-0.469114809022046	0.163261701948546	church	NN	fiction_gral	fiction	D	D	DE	CDE	church%1:06:00::	D	D	DE	CDE	 Harold indicated the photograph on the wall and asked what <font color=green>church</font>  the stone sculpture was in. Eugene told him and he	NN	imaginative	3	1	3.05	0.33	1	church
church/NN/br-k15/188	-0.344476913372588	0.198680046562928	church	NN	fiction_gral	fiction	D	D	DE	CDE	church%1:06:00::	D	D	DE	CDE	 They held the funeral the next morning from the crossroads <font color=green>church</font>  and buried the little box in the quiet family plot	NN	imaginative	6	2	3.1	0.33	2	church
church/NN/br-k16/1431	-0.450946204657597	0.246745109046665	church	NN	fiction_gral	fiction	D	D	DE	CDE	church%1:06:00::	D	D	DE	CDE	 thickets. Along Wappinger Creek in Dutchess County, past the white <font color=green>church</font>  at Fishkill, past Verplanck 's Point on the east bank	NN	imaginative	6	1	3.09	0.17	1	church
church/NN/br-l08/1824	-0.162394454401769	0.268578304200744	church	NN	fiction_mystery	fiction	E	E	DE	CDE	church%1:04:00::	E	E	DE	CDE	 did n't feel good on Sunday, could n't go to <font color=green>church</font> - there 'd be a little argument, but she could be	NN	imaginative	3	1	3.07	0.33	1	church
church/NN/br-p01/1161	-0.351565179951871	0.343800262242897	church	NN	fiction_romance	fiction	D	D	DE	CDE	church%1:06:00::	D	D	DE	CDE	 hill, rising with the hill to the top where the <font color=green>church</font>  was and beyond that to the cemetery. Only paved alleyways	NN	imaginative	7	1	4.09	0.14	1	church
church/NN/br-p01/21	-0.183667076589997	0.394876246627576	church	NN	fiction_romance	fiction	D	D	DE	CDE	church_tower%1:06:00::	D	D	DE	CDE	 them he could have been the broken bell in the <font color=green>church</font>  tower which rang before and after Mass, and at noon	NN	imaginative	4	1	4.1	0.25	1	church
church/NN/br-p01/222	-0.169157794405184	0.201881332061336	church	NN	fiction_romance	fiction	E	E	DE	CDE	church%1:04:00::	E	E	DE	CDE	 from its elders. Youth obeyed when commanded. It went to <font color=green>church</font>  on Sunday and one Saturday a month went to confession	NN	imaginative	5	2	3.06	0.4	2	church
church/NN/br-p12/1014	-0.127387381710944	0.510161617668839	church	NN	fiction_romance	fiction	D	D	DE	CDE	church%1:06:00::	D	D	DE	CDE	 Then they took a taxi to Trastevere.`` There 's a <font color=green>church</font>  you should see'', she said. And when they stood by	NN	imaginative	3	1	3.16	0.33	1	church
church/NN/br-p12/1260	-0.194952360036431	0.0337033721524708	church	NN	fiction_romance	fiction	E	E	DE	CDE	church%1:04:00::	E	E	DE	CDE	 snuggled against him, he wondered if she ever went to <font color=green>church</font> . Why did he want her to go to church? he	NN	imaginative	2	0	3.46	0	1	church
church/NN/br-p12/1270	-0.194952360036431	0.0337033721524708	church	NN	fiction_romance	fiction	E	E	DE	CDE	church%1:04:00::	E	E	DE	CDE	 to church. Why did he want her to go to <font color=green>church</font> ? he wondered. Probably because it was a place where she	NN	imaginative	2	0	3.46	0	1	church
church/NN/br-p12/1433	-0.231794992077267	0.0253661654834815	church	NN	fiction_romance	fiction	C	C	C	CDE	church%1:04:00::	E	E	DE	CDE	 woman though, she would take only what she needed from <font color=green>church</font> . It was too bad he was n't a Catholic himself	NN	imaginative	3	1	4.38	0.33	1	church
church/NNP/br-d03/1914	-0.122540839385986	0.0525471048590848	church	NNP	religion	non-fiction	B	B	AB	AB	group%1:03:00::	C	C	C	CDE	 the Observer depicting clergymen of the Church of England, the <font color=green>Church</font>  of Rome and the Nonconformist Church. The Catholic priest, though	NNP	informative	5	2	4.41	0.4	5	Church
church/NNP/br-d03/1920	-0.124051670850799	0.0730622186968542	church	NNP	religion	non-fiction	B	B	AB	AB	group%1:03:00::	C	C	C	CDE	 Church of England, the Church of Rome and the Nonconformist <font color=green>Church</font> . The Catholic priest, though somewhat superficially drawn, easily came out	NNP	informative	5	3	4.51	0.6	4	Church
church/NNP/br-d03/2022	-0.199263006275279	0.0911012466411343	church	NNP	religion	non-fiction	B	B	AB	AB	group%1:03:00::	C	C	C	CDE	 comments were equally made by an Anglican parson, a Free <font color=green>Church</font>  minister and a Catholic priest. Catholic priests have frequently appeared	NNP	informative	3	2	4.77	0.67	5	Church
church/NNP/br-d03/91	-0.0545931449853001	0.0639125665125836	church	NNP	religion	non-fiction	A	A	AB	AB	group%1:03:00::	C	C	C	CDE	 the religious sphere so popularly discussed as Christian unity. The <font color=green>Church</font>  Unity Octave, January 18- 25, was enthusiastically devoted to prayer	NNP	informative	5	1	3.68	0.2	3	Church
church/NNP/br-j57/304	-0.0567125463108165	0.133728557687433	church	NNP	learned	non-fiction	B	B	AB	AB	group%1:03:00::	C	C	C	CDE	 Indeed, it is even surprising in the Canon of Christ <font color=green>Church</font>  and Regius Professor of Ecclesiastical History, who fathered this most	NNP	informative	3	1	3.5	0.33	3	Church
church/NNP/br-k04/233	-0.0760138998270822	-0.183842801896587	church	NNP	fiction_gral	fiction	D	D	DE	CDE	group%1:03:00::	C	C	C	CDE	 of this crowded region was the Allen African Methodist Episcopal <font color=green>Church</font> . It was an old and dirty wooden structure, sadly in	NNP	imaginative	4	1	3.72	0.25	3	Church
church/NNP/br-k06/1930	-0.162897853904042	-0.0710042223177242	church	NNP	fiction_gral	fiction	D	D	DE	CDE	group%1:03:00::	C	C	C	CDE	 strike the steeples of the other churches; not of Drew <font color=green>Church</font> . A flash illumined the trees as a crooked bolt twigged	NNP	imaginative	2	0	3.7	0	2	Church
church/NNP/br-k06/714	-0.162112411508568	0.103711653492307	church	NNP	fiction_gral	fiction	D	D	DE	CDE	group%1:03:00::	C	C	C	CDE	 and its own school was on Main Street; the Episcopal <font color=green>Church</font>  was one block down Sussex Street; the Catholic Saint Mary's	NNP	imaginative	4	1	4.16	0.25	2	Church
church/NNP/br-k06/726	-0.154066666334922	0.0870005424865304	church	NNP	fiction_gral	fiction	D	D	DE	CDE	group%1:03:00::	C	C	C	CDE	 was one block down Sussex Street; the Catholic Saint Mary's <font color=green>Church</font> , with an even taller steeple and a cross on top	NNP	imaginative	5	1	4.1	0.2	3	Church
church/NNP/br-k06/841	-0.237135029788522	0.192433924844977	church	NNP	fiction_gral	fiction	D	D	DE	CDE	group%1:03:00::	C	C	C	CDE	 became familiar with God, who resided chiefly in Drew Centennial <font color=green>Church</font>  with its high steeple and clock. There was no church	NNP	imaginative	3	1	4.13	0.33	2	Church
church/NNP/br-k06/855	-0.217211915739616	0.180369066441999	church	NNP	fiction_gral	fiction	D	D	DE	CDE	group%1:03:00::	C	C	C	CDE	 high steeple and clock. There was no church like Drew <font color=green>Church</font> , no preacher like Papa, who was intimate with Him, and	NNP	imaginative	2	1	4.02	0.5	4	Church
church/NNP/br-k10/1229	-0.314900795374147	-0.00356763840879897	church	NNP	fiction_gral	fiction	B	B	AB	AB	group%1:03:00::	C	C	C	CDE	 smashing images and tearing down symbols sacred to the Old <font color=green>Church</font> . John found it difficult, but he held him in check	NNP	imaginative	4	3	3.82	0.75	5	Church
church/NNS/br-d02/548	-0.228318400214241	-0.430491771306206	church	NNS	religion	non-fiction	B	B	AB	AB	church%1:14:00::	B	B	AB	AB	 observed to characterize the preaching and teaching of the American <font color=green>churches</font> . In the absence of a truly adequate conceptuality in which	NNS	informative	3	0	3.47	0	1	churches
church/NNS/br-d03/1027	-0.184880564158477	-0.015381535987557	church	NNS	religion	non-fiction	D	D	DE	CDE	church%1:06:00::	D	D	DE	CDE	 as warehouses, but`` neither Anglicans nor Nonconformists object to selling <font color=green>churches</font>  to Roman Catholics'', and have done so. While it must	NNS	informative	2	0	3.95	0	2	churches
church/NNS/br-d03/1051	-0.0470987963776683	-0.171282524616681	church	NNS	religion	non-fiction	D	D	DE	CDE	church%1:06:00::	D	D	DE	CDE	 be said that these same Protestants have built some new <font color=green>churches</font>  during this period, and that religious population shifts have emptied	NNS	informative	4	1	3.44	0.25	2	churches
church/NNS/br-d03/1063	0.0666591311795291	-0.258136139936699	church	NNS	religion	non-fiction	C	C	C	CDE	church%1:06:00::	D	D	DE	CDE	 during this period, and that religious population shifts have emptied <font color=green>churches</font> , a principal reason for this phenomenon of redundancy is that	NNS	informative	5	2	3.7	0.4	2	churches
church/NNS/br-d03/110	-0.103685389773504	0.160742447956618	church	NNS	religion	non-fiction	C	C	C	CDE	church%1:14:00::	B	B	AB	AB	 was enthusiastically devoted to prayer and discussion by the various <font color=green>churches</font> . Many people seem hopeful, yet it is difficult to predict	NNS	informative	5	2	3.45	0.4	2	churches
church/NNS/br-d03/1472	-0.277293145999061	0.108558783609171	church	NNS	religion	non-fiction	E	E	DE	CDE	church%1:06:00::	D	D	DE	CDE	 thy Son''. A hymn often to be heard in Catholic <font color=green>churches</font>  is`` Faith of our Fathers'', which glories in England 's	NNS	informative	3	1	3.02	0.33	1	churches
church/NNS/br-d03/1884	-0.083414229083984	-0.00876179675735513	church	NNS	religion	non-fiction	B	B	AB	AB	church%1:14:00::	B	B	AB	AB	 at least of equal stature in England with the Protestant <font color=green>churches</font> . On successive Sundays during October, 1960, Paul Ferris( a non-Catholic	NNS	informative	2	2	3.53	1	4	churches
church/NNS/br-d03/313	-0.090835305628243	0.0229039656595905	church	NNS	religion	non-fiction	B	B	AB	AB	anglican_church%1:14:00::	B2	B	AB	AB	 saying and writing and implying about the Roman and Anglican <font color=green>Churches</font>  and about the present religious state of England. Since the	NNPS	informative	5	2	3.76	0.4	2	Churches
church/NNS/br-d03/35	-0.0869638729695851	0.0432593177181509	church	NNS	religion	non-fiction	B	B	AB	AB	anglican_church%1:14:00::	B2	B	AB	AB	 efforts of only unauthorized individuals of the Roman and Anglican <font color=green>Churches</font> , and urging a communion of prayer unacceptable to Rome, this	NNPS	informative	5	2	3.81	0.4	3	Churches
church/NNS/br-d03/779	-0.194535663678273	-0.0684378587682581	church	NNS	religion	non-fiction	D	D	DE	CDE	church%1:06:00::	D	D	DE	CDE	 less than ten. From many sides come remarks that Protestant <font color=green>churches</font>  are badly attended and the large medieval cathedrals look all	NNS	informative	4	1	3.99	0.25	2	churches
church/NNS/br-d03/849	-0.0489404540020832	-0.097973658925653	church	NNS	religion	non-fiction	C	C	C	CDE	church%1:06:00::	D	D	DE	CDE	 admit the great falling off in effective membership in their <font color=green>churches</font> . According to a newspaper report of the 1961 statistics of	NNS	informative	2	2	3.5	1	2	churches
church/NNS/br-d03/929	-0.0869978239651488	-0.264316998762557	church	NNS	religion	non-fiction	C	C	C	CDE	church%1:06:00::	D	D	DE	CDE	 the Manchester Guardian of last November, entitled`` Fate of Redundant <font color=green>Churches</font> '', states than an Archbishops' Commission`` reported last month that in	NNPS	informative	2	0	3.35	0	2	Churches
church/NNS/br-d03/952	-0.0815349625494532	0.0801575206141338	church	NNS	religion	non-fiction	C	C	C	CDE	church%1:06:00::	D	D	DE	CDE	 that in the Church of England alone there are 790 <font color=green>churches</font>  which are redundant now, or will be in 20 years	NNS	informative	3	1	3.12	0.33	1	churches
church/NNS/br-f15/1245	-0.135698925818799	-0.0773037909235586	church	NNS	popular_lore	fiction	B	B	AB	AB	church%1:14:00::	B	B	AB	AB	 Consider what happened during World War 1,, when the Protestant <font color=green>churches</font>  united to push the Prohibition law through Congress. Many of	NNS	informative	2	2	3.92	1	3	churches
church/NNS/br-f15/1425	-0.256617543577682	-0.145204897535531	church	NNS	popular_lore	fiction	B	B	AB	AB	christian_church%1:14:00::	B	B	AB	AB	 turn of the century, contraception was condemned by all Christian <font color=green>churches</font>  as immoral, unnatural and contrary to divine law. This was	NNS	informative	5	0	4.07	0	3	churches
church/NNS/br-f15/1455	-0.190901319152122	-0.0232260160033592	church	NNS	popular_lore	fiction	B	B	AB	AB	orthodox_church%1:14:00::	B1	B	AB	AB	 laws of Christian countries. Today, the Roman Catholic and Orthodox <font color=green>Churches</font>  stand virtually alone in holding that conviction. The various Lambeth	NNPS	informative	5	3	4.7	0.6	3	Churches
church/NNS/br-f15/1720	-0.0434068525702492	0.115490553161749	church	NNS	popular_lore	fiction	B	B	AB	AB	group%1:03:00::	C	C	C	CDE	 28 members of a committee of the Federal Council of <font color=green>Churches</font>  ratified artificial methods of birth control.`` As to the necessity	NNPS	informative	4	1	3.34	0.25	2	Churches
church/NNS/br-f15/1887	-0.0711498846132449	-0.0246260674627692	church	NNS	popular_lore	fiction	B	B	AB	AB	group%1:03:00::	C	C	C	CDE	 1961, by the general board of the National Council of <font color=green>Churches</font> , the largest Protestant organization in the US. The board approved	NNPS	informative	3	2	3.64	0.67	2	Churches
church/NNS/br-f15/1944	-0.417037177445385	-0.119396490100726	church	NNS	popular_lore	fiction	B	B	AB	AB	church%1:14:00::	B	B	AB	AB	 of contraceptives. The general board declared:`` Most of the Protestant <font color=green>churches</font>  hold contraception and periodic continence to be morally right when	NNS	informative	4	1	3.77	0.25	1	churches
church/NNS/br-f15/1998	-0.249743314952531	-0.130343645390128	church	NNS	popular_lore	fiction	B	B	AB	AB	christian_church%1:14:00::	B	B	AB	AB	 of conception''. An action once universally condemned by all Christian <font color=green>churches</font>  and forbidden by the civil law is now not only	NNS	informative	2	2	4.06	1	3	churches
church/NNS/br-f15/821	-0.12748425832744	-0.0300530735608466	church	NNS	popular_lore	fiction	B	B	AB	AB	orthodox_catholic_church%1:14:00::	B1	B	AB	AB	 the exception of the Roman Catholic and the Orthodox Catholic <font color=green>Churches</font> , most churches make no moral distinction between rhythm and mechanical	NNPS	informative	6	5	4.27	0.83	7	Churches
church/NNS/br-f15/824	-0.108860698408324	-0.0346502847987387	church	NNS	popular_lore	fiction	B	B	AB	AB	church%1:14:00::	B	B	AB	AB	 of the Roman Catholic and the Orthodox Catholic Churches, most <font color=green>churches</font>  make no moral distinction between rhythm and mechanical or chemical	NNS	informative	5	5	4.05	1	9	churches
church/NNS/br-f44/1106	-0.0225138716801015	-0.290235150427076	church	NNS	popular_lore	fiction	C	C	C	CDE	church%1:14:00::	B	B	AB	AB	 who will strengthen the social class nucleus of the congregation. <font color=green>Churches</font>  can be strengthened through this process of co-optation so long	NNPS	informative	5	1	3.73	0.2	2	Churches
church/NNS/br-f44/1189	-0.091578677261752	-0.145743301757843	church	NNS	popular_lore	fiction	C	C	C	CDE	church%1:14:00::	B	B	AB	AB	 and publicity in reaching new members. The proclamation of the <font color=green>churches</font>  is almost totally confined to pastoral contacts by the clergy	NNS	informative	7	2	3.36	0.29	4	churches
