id	model.x	model.y	lemma	pos	genre	broadGenre	marisense	mbroad	mari3	mari2	sensekey	wnsense	wnbroad	wn3	wn2	text	newPos	newBroadGenre	cues	cuesWithWeight	meanWeight	weightedCuesRatio	weightedCW	wf
state/NNS/br-g10/1353	-0.0917697860940062	-0.0442374771974514	state	NNS	belles_lettres	fiction	A	A	AB	ABC	Z	Z	Z	Z	Z	 and in the end sacrifice to the sovereignty of the <font color=green>states</font>  all the liberty the citizens had gained by their Union	NNS	informative	3	3	3.22	1	4	states
state/NNS/br-g10/1401	-0.0500771922785111	-0.0157295919296294	state	NNS	belles_lettres	fiction	B	B	AB	ABC	Z	Z	Z	Z	Z	 that should continue to live, or an association of sovereign <font color=green>states</font>  that must fall prey either to`` anarchy or despotism''. Much	NNS	informative	4	2	2.32	0.5	5	states
state/NNS/br-g10/1482	-0.0466291157326451	0.0472648043052527	state	NNS	belles_lettres	fiction	A	A	AB	ABC	Z	Z	Z	Z	Z	 no such change in the rights the Constitution gave the <font color=green>states</font> . After the war began, he long refused to permit emancipation	NNS	informative	3	1	2.31	0.33	4	states
state/NNS/br-g10/1587	-0.0871651278746552	-0.0113638881582726	state	NNS	belles_lettres	fiction	B	B	AB	ABC	Z	Z	Z	Z	Z	 the free''. What Lincoln could not concede was that the <font color=green>states</font>  rather than the people were sovereign in the Union. He	NNS	informative	4	3	3.44	0.75	5	states
state/NNS/br-g10/1634	-0.0559449915281036	-0.0354913767167114	state	NNS	belles_lettres	fiction	A	A	AB	ABC	Z	Z	Z	Z	Z	 fact that the Americans who upheld the sovereignty of their <font color=green>states</font>  did this in order to keep many of their people	NNS	informative	3	3	2.87	1	5	states
state/NNS/br-g10/1726	-0.13620787895532	0.00350465622945934	state	NNS	belles_lettres	fiction	C	C	C	ABC	Z	Z	Z	Z	Z	 two concepts of the sovereign rights of men and of <font color=green>states</font> . On their decisive battlefield Lincoln did not distinguish between them	NNS	informative	3	2	3.82	0.67	6	states
state/NNS/br-g10/2060	-0.10444722580699	-0.0380012132203103	state	NNS	belles_lettres	fiction	B	B	AB	ABC	Z	Z	Z	Z	Z	 in the end to all associations composed primarily of sovereign <font color=green>states</font> , and to the liberties of their people. But the fact	NNS	informative	3	3	3.48	1	5	states
state/NNS/br-g10/2267	-0.0518885189286885	-0.00210931028255752	state	NNS	belles_lettres	fiction	A	A	AB	ABC	Z	Z	Z	Z	Z	 encroachment by the Union on the powers reserved to their <font color=green>states</font>  have continued ever since to safeguard all Americans against freedom	NNS	informative	6	4	2.88	0.67	6	states
state/NNS/br-g10/341	-0.0550605317157928	-0.0153229625200023	state	NNS	belles_lettres	fiction	B	B	AB	ABC	Z	Z	Z	Z	Z	 Constitution was a compact made by the people of sovereign <font color=green>states</font> , who therefore retained the right to secede from it. This	NNS	informative	4	3	2.85	0.75	8	states
state/NNS/br-g10/418	-0.0411241853541205	-0.03391257855117	state	NNS	belles_lettres	fiction	B	B	AB	ABC	Z	Z	Z	Z	Z	 that it was a compact among sovereign citizens rather than <font color=green>states</font> , and that therefore the states had no right to secede	NNS	informative	3	2	3.3	0.67	6	states
state/NNS/br-g10/424	-0.0472227499127982	-0.0348628578438013	state	NNS	belles_lettres	fiction	B	B	AB	ABC	Z	Z	Z	Z	Z	 among sovereign citizens rather than states, and that therefore the <font color=green>states</font>  had no right to secede, though the citizens could. Writing	NNS	informative	4	5	3.5	1.25	8	states
state/NNS/br-m03/1076	-0.0497030824067175	-0.0494338693934853	state	NNS	fiction_science	fiction	B	B	AB	ABC	Z	Z	Z	Z	Z	 present world hegemony of the United Nations; suspicion between member <font color=green>states</font>  still existed, but it was of about the same low	NNS	imaginative	3	1	2.33	0.33	4	states
