id	model.x	model.y	lemma	pos	genre	marisense	mbroad	mari3	mari2	sensekey	wnsense	wnbroad	wn3	wn2	text	newPos	newBroadGenre	cues	cuesWithWeight	meanWeight	weightedCuesRatio	weightedCW	wf	broadGenre
church/NN/br-a01/2073	-0.240866902322353	0.00221275877943996	church	NN	press_reportage	E	E	DE	CDE	church%1:04:00::	E	E	DE	CDE	 said.`` Being at the polls was just like being at <font color=green>church</font> . I did n't smell a drop of liquor, and we	NN	informative	1	0	1.98	0	4	church	others
church/NN/br-d01/1628	-0.306252568955077	-0.0578695015120009	church	NN	religion	B	B	AB	AB	church%1:14:00::	B	B	AB	AB	 age to whip men into a surrender to a particular <font color=green>church</font>  or church-state''. Apparently he does not intend that those who	NN	informative	3	1	2.51	0.33	3	church	others
church/NN/br-d02/1641	-0.170105474389222	-0.123714796948383	church	NN	religion	B	B	AB	AB	church%1:14:00::	B	B	AB	AB	 concerned to stand squarely within the tradition of the apostolic <font color=green>church</font> , they have exhibited no willingness whatever to sacrifice their modernity	NN	informative	2	1	2.84	0.5	3	church	others
church/NN/br-d02/706	-0.0973296345809473	-0.0340343018328728	church	NN	religion	A	A	AB	AB	church%1:14:00::	B	B	AB	AB	 there tends to be an almost complete indifference to the <font color=green>church</font>  and its traditional message of sin and grace. To be	NN	informative	4	4	2.08	1	7	church	others
church/NN/br-d02/786	-0.254420009457126	-0.0201467764130038	church	NN	religion	A	A	AB	AB	church%1:14:00::	B	B	AB	AB	 longer afford the luxury of such smug indignation? Can the <font color=green>church</font>  risk assuming that the`` folly'' of men is as dear	NN	informative	3	0	2.81	0	3	church	others
church/NN/br-d02/877	-0.17569069102279	-0.0953041514945695	church	NN	religion	A	A	AB	AB	church%1:14:00::	B	B	AB	AB	 precarious? There is an ancient and venerable tradition in the <font color=green>church</font> ( which derives, however, from the heritage of the Greeks rather	NN	informative	4	3	2.56	0.75	3	church	others
church/NN/br-d02/923	-0.0773799713701547	0.182788837525567	church	NN	religion	A	A	AB	AB	church%1:14:00::	B	B	AB	AB	 for accomplishing his work in the world. by analogy, the <font color=green>church</font>  also has been regarded as entirely independent of the`` world	NN	informative	3	1	1.86	0.33	3	church	others
church/NN/br-d02/949	-0.211423234801248	-0.0640629508776374	church	NN	religion	A	A	AB	AB	church%1:14:00::	B	B	AB	AB	 of requiring nothing from it in order to be the <font color=green>church</font> . But, as Scripture everywhere reminds us, God does have need	NN	informative	2	1	2.02	0.5	3	church	others
church/NN/br-d03/1080	-0.0918590201812845	-0.103493217524	church	NN	religion	E	E	DE	CDE	church%1:04:00::	E	E	DE	CDE	 phenomenon of redundancy is that fewer Protestants are going to <font color=green>church</font> . It should be admitted, too, that there is a good	NN	informative	2	1	2.01	0.5	4	church	others
church/NN/br-d03/1342	-0.0528765324559192	-0.00365457698383187	church	NN	religion	E	E	DE	CDE	church%1:06:00::	D	D	DE	CDE	 my experience to find as many men as women in <font color=green>church</font> , and to hear almost everyone in church congregations reciting the	NN	informative	5	2	2.05	0.4	7	church	others
church/NN/br-d03/1350	-0.0590220885094395	-0.00988055797778769	church	NN	religion	E	E	DE	CDE	church%1:06:00::	D	D	DE	CDE	 as women in church, and to hear almost everyone in <font color=green>church</font>  congregations reciting the Latin prayers and responses at Mass. They	NN	informative	5	4	2.39	0.8	10	church	others
church/NN/br-d03/1871	-0.0895419270646138	-0.0479732165519767	church	NN	religion	B	B	AB	AB	catholic_church%1:14:00::	B1	B	AB	AB	 the Sunday Observer implies a kindly recognition that the Catholic <font color=green>Church</font>  is now at least of equal stature in England with	NNP	informative	2	2	2.84	1	7	Church	others
church/NN/br-d03/1909	-0.125942228771172	-0.0371521157086386	church	NN	religion	B	B	AB	AB	church_of_england%1:14:00::	B2	B	AB	AB	 non-Catholic) wrote articles in the Observer depicting clergymen of the <font color=green>Church</font>  of England, the Church of Rome and the Nonconformist Church	NNP	informative	6	2	2.86	0.33	4	Church	others
church/NN/br-d03/2097	-0.0772374393041043	-0.0254028670306327	church	NN	religion	A	A	AB	AB	church%1:14:00::	B	B	AB	AB	 Canterbury. The good feeling which exists between these two important <font color=green>church</font>  figures is now well known in England. The Holy Sacrifice	NN	informative	4	0	2.17	0	4	church	others
church/NN/br-d03/2336	-0.0703919207591826	-0.0344868191162309	church	NN	religion	D	D	DE	CDE	catholic_church%1:14:00::	B1	B	AB	AB	 a votive Mass offered for Christian unity at a Catholic <font color=green>church</font>  in Slough during the Church Unity Octave.	NN	informative	2	1	2.99	0.5	6	church	others
church/NN/br-d03/2341	-0.0904050726781737	-0.0432500766659645	church	NN	religion	A	A	AB	AB	church%1:14:00::	B	B	AB	AB	 Christian unity at a Catholic church in Slough during the <font color=green>Church</font>  Unity Octave.	NNP	informative	2	1	3.17	0.5	5	Church	others
church/NN/br-d03/721	-0.242505428867812	0.0911690585106984	church	NN	religion	B	B	AB	AB	church%1:06:00::	D	D	DE	CDE	 crowds going in and out of the Birmingham Oratory( Catholic) <font color=green>Church</font>  on Sunday mornings. She found this a marvel because, as	NNP	informative	1	0	2.79	0	3	Church	others
church/NN/br-d03/862	-0.0241850337457248	0.0126755640578364	church	NN	religion	B	B	AB	AB	church_of_england%1:14:00::	B2	B	AB	AB	 to a newspaper report of the 1961 statistics of the <font color=green>Church</font>  of England, the`` total of confirmed members is 9748000, but	NNP	informative	3	2	2.44	0.67	5	Church	others
church/NN/br-d03/883	-0.226237266638327	0.154663688360597	church	NN	religion	C	C	C	CDE	church_roll%1:10:00::	C	C	C	CDE	 is 9748000, but only 2887671 are registered on the parochial <font color=green>church</font>  rolls'', and`` over 27 million people in England are baptized	NN	informative	4	3	2.55	0.75	3	church	others
church/NN/br-d03/899	-0.166531092476124	-0.0628265408799215	church	NN	religion	B	B	AB	AB	church_of_england%1:14:00::	B2	B	AB	AB	 over 27 million people in England are baptized into the <font color=green>Church</font>  of England, but roughly only a tenth of them continue	NNP	informative	3	2	2.81	0.67	3	Church	others
church/NN/br-d03/945	-0.0184436022839027	0.0113187715105565	church	NN	religion	B	B	AB	AB	church_of_england%1:14:00::	B2	B	AB	AB	 than an Archbishops' Commission`` reported last month that in the <font color=green>Church</font>  of England alone there are 790 churches which are redundant	NNP	informative	1	0	2.17	0	4	Church	others
church/NN/br-d04/56	-0.115465351340942	-0.0551308495030242	church	NN	religion	A	A	AB	AB	church_father%1:18:00::	A	A	AB	AB	 Jesus Christ the unique and the universal concur. Perhaps no <font color=green>church</font>  father saw this concurrence of the unique and the universal	NN	informative	4	6	2.34	1.5	6	church	others
church/NN/br-f15/713	-0.142622651183797	-0.105631931730172	church	NN	popular_lore	B	B	AB	AB	roman_catholic_church%1:14:00::	B1	B	AB	AB	 permit birth control only for medical reasons. The Roman Catholic <font color=green>Church</font> , however, sanctions a much more liberal policy on family planning	NNP	informative	5	3	2.82	0.6	4	Church	others
church/NN/br-f15/754	-0.0503371920818561	-0.0977073913216746	church	NN	popular_lore	B	B	AB	AB	roman_catholic_church%1:14:00::	B1	B	AB	AB	 disagree over the methods to be used. The Roman Catholic <font color=green>Church</font>  sanctions only abstention or the rhythm method, also known as	NNP	informative	1	0	2.88	0	5	Church	others
church/NN/br-f15/776	-0.00275831919474909	-0.0779677691745971	church	NN	popular_lore	A	A	AB	AB	roman_catholic_church%1:14:00::	B1	B	AB	AB	 as the use of the infertile or safe period. The <font color=green>Church</font>  considers this to be the method provided by nature and	NNP	informative	3	2	1.8	0.67	4	Church	others
church/NN/br-f15/862	-0.130951042849049	-0.182354693549274	church	NN	popular_lore	A	A	AB	AB	roman_catholic_church%1:14:00::	B1	B	AB	AB	 there seems little chance of agreement. The grounds for the <font color=green>Church</font>  's position are Scriptural( Old Testament), the teachings of the	NNP	informative	3	1	1.78	0.33	2	Church	others
church/NN/br-f15/882	-0.0614796015126611	-0.0543134184729938	church	NN	popular_lore	A	A	AB	AB	roman_catholic_church%1:14:00::	B1	B	AB	AB	 the teachings of the fathers and doctors of the early <font color=green>Church</font> , the unbroken tradition of nineteen centuries, the decisions of the	NNP	informative	4	3	1.88	0.75	4	Church	others
church/NN/br-f44/1076	-0.0570017555323456	-0.0911229470671281	church	NN	popular_lore	C	C	C	CDE	church%1:14:00::	B	B	AB	AB	 and economic level of the congregation; the mission of the <font color=green>church</font>  is actually a process of informal co-optation; the lay ministry	NN	informative	5	2	2.64	0.4	4	church	others
church/NN/br-f44/1122	-0.0122305976754639	-0.0457261570736741	church	NN	popular_lore	D	D	DE	CDE	church%1:14:00::	B	B	AB	AB	 process of co-optation so long as the environs of the <font color=green>church</font>  provide a sufficient pool of people who can fit the	NN	informative	1	0	1.53	0	4	church	others
church/NN/br-f44/1285	-0.0259895891519469	-0.0551421569430098	church	NN	popular_lore	C	C	C	CDE	church%1:14:00::	B	B	AB	AB	 co-optation is the principal form of mission in the contemporary <font color=green>church</font> ; economic integration and co-optation are the two methods by which	NN	informative	3	2	2.11	0.67	5	church	others
church/NN/br-f44/1618	-0.0197526492950923	-0.0632780124949789	church	NN	popular_lore	C	C	C	CDE	church%1:14:00::	B	B	AB	AB	 in the metropolis. It now becomes evident that the denominational <font color=green>church</font>  is intimately involved with the economy of middle-class culture, for	NN	informative	5	3	1.75	0.6	6	church	others
church/NN/br-f44/2150	-0.0116589697803615	-0.0125016240030274	church	NN	popular_lore	C	C	C	CDE	church%1:14:00::	B	B	AB	AB	 will occupy our attention under the rubric of the organization <font color=green>church</font> . An understanding of the new role of residential association in	NN	informative	3	3	1.76	1	6	church	others
church/NN/br-f44/368	-0.0207050427524894	-0.00840848086288779	church	NN	popular_lore	C	C	C	CDE	church%1:14:00::	B	B	AB	AB	 they can lose higher- and lower status members from the <font color=green>church</font>  without collapsing, but they need adequate recruits for the core	NN	informative	3	2	1.87	0.67	6	church	others
church/NN/br-f44/647	-0.0954653387665432	-0.0155106473670211	church	NN	popular_lore	A	A	AB	AB	church%1:14:00::	B	B	AB	AB	 denominations. There is much talk in theological circles about the`` <font color=green>Church</font>  as Mission'' and the`` Church 's Mission''; theologians have been	NNP	informative	4	4	2.82	1	6	Church	others
church/NN/br-f44/654	-0.131621732503984	-0.0104120273934198	church	NN	popular_lore	A	A	AB	AB	church%1:14:00::	B	B	AB	AB	 in theological circles about the`` Church as Mission'' and the`` <font color=green>Church</font>  's Mission''; theologians have been stressing the fact that the	NNP	informative	4	2	3.29	0.5	3	Church	others
church/NN/br-f44/667	-0.442171819101083	-0.13566507658561	church	NN	popular_lore	A	A	AB	AB	church%1:14:00::	B	B	AB	AB	 's Mission''; theologians have been stressing the fact that the <font color=green>Church</font>  does not exist for its own sake but as a	NNP	informative	4	1	2.53	0.25	1	Church	others
church/NN/br-f44/924	-0.0340514820289708	-0.0134826612527186	church	NN	popular_lore	C	C	C	CDE	church%1:14:00::	B	B	AB	AB	 with friendly members the`` contacts with an organization of the <font color=green>church</font> ''( 11.2 per cent of the cases), then a substantial two	NN	informative	3	3	2.49	1	4	church	others
church/NN/br-f44/986	-0.0478789013998245	-0.014308907447828	church	NN	popular_lore	C	C	C	CDE	church%1:14:00::	B	B	AB	AB	 people; the new people respond in kind by joining the <font color=green>church</font> . Missionary outreach by friendly contact looks somewhat different when one	NN	informative	4	2	1.82	0.5	7	church	others
church/NN/br-g12/1271	-0.278396253589511	-0.11055720851188	church	NN	belles_lettres	D	D	DE	CDE	church%1:06:00::	D	D	DE	CDE	 and gestured toward the Madeleine. The classical lines of the <font color=green>church</font>  which Napoleon thought of as a Temple of Glory, dominated	NN	informative	5	2	2.71	0.4	3	church	others
church/NN/br-g12/1807	-0.28846612251403	0.103270521435451	church	NN	belles_lettres	D	D	DE	CDE	church%1:06:00::	D	D	DE	CDE	 not attractive, but it is deeper. When you pass a <font color=green>church</font>  on an Irish bus, all the hands flurry in the	NN	informative	2	1	2.1	0.5	2	church	others
church/NN/br-h17/1434	0.0120037553745331	0.00788762362566856	church	NN	miscellaneous	C	C	C	CDE	church%1:14:00::	B	B	AB	AB	 preaching and from 20 to 25 hours per month to <font color=green>church</font>  activities. His claim was therefore`` so highly exaggerated'', the Department	NN	informative	1	1	1.91	1	5	church	tech
church/NN/br-j23/1105	-0.0281450786508484	-0.0452044098841364	church	NN	learned	C	C	C	CDE	church_member%1:18:00::	C	C	C	CDE	 which is reflective of our common religion. Even the non <font color=green>church</font>  members- the freewheelers, marginal religionists and so on- have the	NN	informative	2	1	2.53	0.5	2	church	tech
church/NN/br-j57/2237	-0.200286309824468	-0.0771910579320501	church	NN	learned	A	A	AB	AB	church_father%1:18:00::	A	A	AB	AB	 which reached Christianity by the way of Stoicism through the <font color=green>Church</font>  Fathers of Late Antiquity.	NNP	informative	3	2	2.38	0.67	2	Church	tech
church/NN/br-j57/958	-0.082575371333166	-0.00433723528860959	church	NN	learned	A	A	AB	AB	church_father%1:18:00::	A	A	AB	AB	 all possessions. This conception was taken up by the early <font color=green>Church</font>  Fathers and by canon lawyers and theologians in the Middle	NNP	informative	5	3	1.93	0.6	5	Church	tech
church/NN/br-j58/1496	-0.0247604936547471	0.0857537840576145	church	NN	learned	D	D	DE	CDE	church_bell%1:06:00::	D	D	DE	CDE	 In many Northern towns and cities meetings were held and <font color=green>church</font>  bells were tolled. Such was not the case in Rhode	NN	informative	4	1	1.75	0.25	4	church	tech
church/NN/br-k04/1076	-0.0514237139113168	0.016462258271048	church	NN	fiction_gral	D	D	DE	CDE	church%1:06:00::	D	D	DE	CDE	 There were two liquor saloons not very far from the <font color=green>church</font> , one white, that is conducted for white people with a	NN	imaginative	4	3	1.93	0.75	6	church	imag
church/NN/br-k04/1117	-0.334544839988598	0.0569674417341403	church	NN	fiction_gral	D	D	DE	CDE	church%1:06:00::	D	D	DE	CDE	 of gambling in both. On the other side of the <font color=green>church</font>  was a quiet, well-kept house with shutters and recently painted	NN	imaginative	4	0	2.92	0	2	church	imag
church/NN/br-k04/1145	-0.0987949799223233	0.280575680757975	church	NN	fiction_gral	C	C	C	CDE	church%1:14:00::	B	B	AB	AB	 it. It was called Kent House. The deacon of the <font color=green>church</font> , Carlson, was its janitor. One of the leading members of	NN	imaginative	3	0	1.91	0	2	church	imag
church/NN/br-k04/1353	-0.118686215088902	0.0424635675068667	church	NN	fiction_gral	D	D	DE	CDE	church%1:06:00::	D	D	DE	CDE	 tract of land, and it occurred to him that the <font color=green>church</font>  and the better Negro homes might gradually be moved to	NN	imaginative	3	1	1.67	0.33	3	church	imag
church/NN/br-k04/1419	-0.00609046984380598	0.0332307473910509	church	NN	fiction_gral	C	C	C	CDE	church%1:06:00::	D	D	DE	CDE	 stress, and that was that the contribution to the general <font color=green>church</font>  expenses, the dollar money, had been seriously falling behind in	NN	imaginative	3	3	1.82	1	6	church	imag
church/NN/br-k04/1433	-0.0457866750495413	0.06363612042877	church	NN	fiction_gral	C	C	C	CDE	church%1:06:00::	D	D	DE	CDE	 the dollar money, had been seriously falling behind in this <font color=green>church</font> , and that must be looked after immediately. In fact, he	NN	imaginative	1	1	1.76	1	4	church	imag
church/NN/br-k04/1485	-0.0562481227569075	-0.00397714459306425	church	NN	fiction_gral	C	C	C	CDE	church%1:06:00::	D	D	DE	CDE	 that clear as this was, they must have a better <font color=green>church</font> , a more business-like conduct of the church organization, and an	NN	imaginative	2	1	2.7	0.5	4	church	imag
church/NN/br-k04/1493	-0.0402138303341732	-0.00829586431911906	church	NN	fiction_gral	C	C	C	CDE	church%1:14:00::	B	B	AB	AB	 have a better church, a more business-like conduct of the <font color=green>church</font>  organization, and an effort to get this religious center out	NN	imaginative	4	2	2.58	0.5	5	church	imag
church/NN/br-k04/1514	-0.0160584203745232	-0.0363184871598038	church	NN	fiction_gral	C	C	C	CDE	church%1:14:00::	B	B	AB	AB	 out of its rut of wild worship into a modern <font color=green>church</font>  organization. He emphasized to the Presiding Elder the plan of	NN	imaginative	5	2	2.3	0.4	5	church	imag
church/NN/br-k04/1530	-0.0376171000481295	0.0495384016961992	church	NN	fiction_gral	D	D	DE	CDE	church%1:06:00::	D	D	DE	CDE	 the Presiding Elder the plan of giving up the old <font color=green>church</font>  and moving across the river. The Presiding Elder was sure	NN	imaginative	5	1	1.36	0.2	2	church	imag
church/NN/br-k04/1578	-0.0362846667067186	0.027202415084233	church	NN	fiction_gral	D	D	DE	CDE	church%1:06:00::	D	D	DE	CDE	 impossible. The bank which held the mortgage on the old <font color=green>church</font>  declared that the interest was considerably in arrears, and the	NN	imaginative	2	1	1.38	0.5	5	church	imag
church/NN/br-k04/1634	-0.102582327642931	0.0777990107656203	church	NN	fiction_gral	D	D	DE	CDE	church%1:06:00::	D	D	DE	CDE	 to colored folk. When it was proposed to rebuild the <font color=green>church</font> , Wilson found that the terms for a new mortgage were	NN	imaginative	2	0	1.96	0	4	church	imag
church/NN/br-k04/1685	-0.113148180641764	0.165190034688019	church	NN	fiction_gral	D	D	DE	CDE	church%1:06:00::	D	D	DE	CDE	 made to his Deacon Board, he met unanimous opposition. The <font color=green>church</font>  certainly would not be removed. The very proposition was sacrilege	NN	imaginative	3	0	2.19	0	3	church	imag
church/NN/br-k04/1807	-0.0958965342638497	0.0998947520779728	church	NN	fiction_gral	D	D	DE	CDE	church%1:06:00::	D	D	DE	CDE	 of money that has been invested by whites around that <font color=green>church</font> ? Tenements, stores, saloons, some gambling, I hope not too much	NN	imaginative	5	2	2.09	0.4	4	church	imag
church/NN/br-k04/1874	-0.178313446177239	0.113201826424997	church	NN	fiction_gral	D	D	DE	CDE	church%1:06:00::	D	D	DE	CDE	 were you I would just plan to repair the old <font color=green>church</font>  so it would last for five or ten years. By	NN	imaginative	3	3	2.06	1	3	church	imag
church/NN/br-k04/2301	-0.0529161299012761	-0.0249093284546938	church	NN	fiction_gral	B	B	AB	AB	methodist_church%1:14:00::	B2	B	AB	AB	 mean practically the end of his career in the Methodist <font color=green>church</font> , if not in all churches.	NN	imaginative	3	1	1.83	0.33	4	church	imag
church/NN/br-k04/356	-0.0814604648004383	0.0367910425223141	church	NN	fiction_gral	C	C	C	CDE	church%1:06:00::	D	D	DE	CDE	 with the whites, especially the rich who partly supported the <font color=green>church</font> . The Deacon Board, headed by a black man named Carlson	NN	imaginative	7	4	1.72	0.57	6	church	imag
church/NN/br-k04/397	-0.0751138876185912	-0.0409193493709662	church	NN	fiction_gral	C	C	C	CDE	church%1:06:00::	D	D	DE	CDE	 support of the Amen corner. The characteristic thing about this <font color=green>church</font>  was its Amen corner and the weekly religious orgy. A	NN	imaginative	4	4	2.14	1	5	church	imag
church/NN/br-k04/828	-0.0378708769535888	0.0252920463905212	church	NN	fiction_gral	C	C	C	CDE	church%1:14:00::	B	B	AB	AB	 the home of one of the old members of the <font color=green>church</font> , a woman named Catt who, as Wilson afterward found, was	NN	imaginative	2	1	1.8	0.5	5	church	imag
church/NN/br-k04/877	-0.0593447103304641	0.0593133715163403	church	NN	fiction_gral	C	C	C	CDE	church%1:14:00::	B	B	AB	AB	 never married, conducting a spotless home and devoted to her <font color=green>church</font> , but a perpetual dissenter and born critic. She soared over	NN	imaginative	2	1	2.14	0.5	5	church	imag
church/NN/br-k04/923	-0.110075566158378	0.0981864321918287	church	NN	fiction_gral	D	D	DE	CDE	church%1:06:00::	D	D	DE	CDE	 which she was chief repository. Then Wilson looked over the <font color=green>church</font>  and studied its condition. The salary of the pastor had	NN	imaginative	3	1	2.35	0.33	4	church	imag
church/NN/br-k04/975	-0.18014723777301	0.126206933990888	church	NN	fiction_gral	D	D	DE	CDE	church%1:06:00::	D	D	DE	CDE	 he mentioned this to the Deacons they said nothing. The <font color=green>church</font>  itself must be repaired. It was dirty and neglected. It	NN	imaginative	3	2	2.27	0.67	3	church	imag
church/NN/br-k06/1056	-0.192660425502653	0.000805810618192217	church	NN	fiction_gral	D	D	DE	CDE	church%1:06:00::	D	D	DE	CDE	 northward to Brooklyn, below Point Peter, he could see the <font color=green>church</font>  spire wherever he looked back. Sometimes they went south and	NN	imaginative	5	1	1.69	0.2	3	church	imag
church/NN/br-k06/1389	-0.226017757297196	0.0222070513028677	church	NN	fiction_gral	D	D	DE	CDE	church%1:06:00::	D	D	DE	CDE	 with its peaked lance. Stevie was constantly slipping into the <font color=green>church</font> . He pulled with all his strength at the heavy, brass	NN	imaginative	3	2	1.61	0.67	3	church	imag
church/NN/br-k06/1473	-0.32324097735044	-0.00822868168055075	church	NN	fiction_gral	D	D	DE	CDE	church%1:06:00::	D	D	DE	CDE	 hands tucked under his coattails, and staring into the dark <font color=green>church</font> . The figure was wreathed in an extraordinary luminescence. The boy	NN	imaginative	3	1	1.8	0.33	2	church	imag
church/NN/br-k06/528	-0.194591689088303	0.0729753129750637	church	NN	fiction_gral	D	D	DE	CDE	church%1:06:00::	D	D	DE	CDE	 his head out. There was the slate roof of the <font color=green>church</font> ; ivy climbed the red brick walls like a green scaled	NN	imaginative	5	3	1.74	0.6	6	church	imag
church/NN/br-k06/571	-0.372936781237889	0.079607709168969	church	NN	fiction_gral	D	D	DE	CDE	church%1:06:00::	D	D	DE	CDE	 cupboards.`` There 's a tower and a steeple on the <font color=green>church</font>  a million feet high. And the loudest clock in the	NN	imaginative	3	2	3.54	0.67	2	church	imag
church/NN/br-k06/659	-0.255672908759239	0.00850524651384157	church	NN	fiction_gral	D	D	DE	CDE	church%1:06:00::	D	D	DE	CDE	 Street to Orange Square. The steeple leaned backward, while the <font color=green>church</font>  advanced like a headless creature in a long, shapeless coat	NN	imaginative	5	0	2.25	0	3	church	imag
church/NN/br-k10/1423	-0.0394429493287214	0.0115736079569362	church	NN	fiction_gral	A	A	AB	AB	church%1:14:00::	B	B	AB	AB	 economics, and social issues that are no concern of the <font color=green>Church</font> ''? And John 's reply was always the same:`` Anything that	NNP	imaginative	5	1	1.92	0.2	4	Church	imag
church/NN/br-k10/1802	-0.266610396514693	0.0410655142346752	church	NN	fiction_gral	B	B	AB	AB	church_of_rome%1:14:00::	B1	B	AB	AB	 Geneva, saying that he had been a bishop of the <font color=green>Church</font>  of Rome and had been persecuted in Paris for his	NNP	imaginative	2	1	2.25	0.5	2	Church	imag
church/NN/br-k10/205	-0.160878704354014	0.100444343278938	church	NN	fiction_gral	A	A	AB	AB	church%1:14:00::	B	B	AB	AB	 that the couple would have to be punished if the <font color=green>Church</font>  was to be respected.`` I have told you before, and	NNP	imaginative	2	1	1.78	0.5	3	Church	imag
church/NN/br-k10/257	-0.273014375115001	-0.0800899831689872	church	NN	fiction_gral	A	A	AB	AB	church%1:14:00::	B	B	AB	AB	 is the answer the ungodly will always make when the <font color=green>Church</font>  points its fingers at their sins. I say to you	NNP	imaginative	3	2	2.13	0.67	2	Church	imag
church/NN/br-k10/271	-0.190325658019593	0.0113019968070284	church	NN	fiction_gral	A	A	AB	AB	church%1:14:00::	B	B	AB	AB	 fingers at their sins. I say to you that the <font color=green>Church</font>  will ever decry evil''! John 's reply was like a	NNP	imaginative	3	2	2.52	0.67	4	Church	imag
church/NN/br-k10/561	-0.0781320205967285	0.079636015271714	church	NN	fiction_gral	A	A	AB	AB	church%1:14:00::	B	B	AB	AB	 weeks before, in early November, without being reconciled to the <font color=green>Church</font> . The canons, in a body, had tried to force him	NNP	imaginative	3	0	1.41	0	2	Church	imag
church/NN/br-k10/588	-0.200811668339416	-0.0271969145502314	church	NN	fiction_gral	A	A	AB	AB	church%1:14:00::	B	B	AB	AB	 to let them give him the last rites of the <font color=green>Church</font> , but he had died still proclaiming salvation by faith. Burial	NNP	imaginative	3	1	2.66	0.33	4	Church	imag
church/NN/br-k10/967	-0.105862699533259	0.0562009130607342	church	NN	fiction_gral	D	D	DE	CDE	church%1:06:00::	D	D	DE	CDE	 all the time. Quickening his steps, John entered the vast <font color=green>church</font>  and climbed the tower steps to the bells. Underneath the	NN	imaginative	6	6	1.82	1	7	church	imag
church/NN/br-k13/533	-0.178524812935914	0.0605294007753364	church	NN	fiction_gral	D	D	DE	CDE	church%1:06:00::	D	D	DE	CDE	 Harold indicated the photograph on the wall and asked what <font color=green>church</font>  the stone sculpture was in. Eugene told him and he	NN	imaginative	3	3	1.93	1	7	church	imag
