id	model.x	model.y	lemma	pos	genre	broadGenre	marisense	mbroad	mari3	mari2	sensekey	wnsense	wnbroad	wn3	wn2	text	newPos	newBroadGenre	cues	cuesWithWeight	meanWeight	weightedCuesRatio	weightedCW	wf
state/NN/br-h14/736	0.39998876426648	-0.0918427895845952	state	NN	miscellaneous	non-fiction	A	A	AB	ABC	state%1:15:01::	A	A	AB	ABC	 high per capita income or a sparsely or thickly populated <font color=green>State</font> . The provisions are also designed to avoid disruption in State	NNP	informative	3	0	3.04	0	2	State
state/NN/br-h14/794	0.319723476613308	0.239224967115573	state	NN	miscellaneous	non-fiction	A	A	AB	ABC	state%1:15:01::	A	A	AB	ABC	 forth in the Act. The term`` State'' means the several <font color=green>States</font> , the District of Columbia, the Virgin Islands, Guam and Puerto	NNPS	informative	3	0	3.71	0	1	States
state/NN/br-h14/814	0.35109714719869	0.130562832818873	state	NN	miscellaneous	non-fiction	A5	A	AB	ABC	united_states%1:15:00::	A51	A	AB	ABC	 the Virgin Islands, Guam and Puerto Rico; the term`` United <font color=green>States</font> '' includes the several States and the District of Columbia, and	NNPS	informative	1	0	3.45	0	4	States
state/NN/br-h14/819	0.319723476613308	0.239224967115573	state	NN	miscellaneous	non-fiction	A	A	AB	ABC	state%1:15:01::	A	A	AB	ABC	 and Puerto Rico; the term`` United States'' includes the several <font color=green>States</font>  and the District of Columbia, and excludes the Virgin Islands	NNPS	informative	3	0	3.71	0	1	States
state/NN/br-h14/857	0.398401879552932	0.140847500438228	state	NN	miscellaneous	non-fiction	A	A	AB	ABC	state%1:15:01::	A	A	AB	ABC	 Hawaii. The following steps are employed in calculations: For each <font color=green>State</font> ( except Puerto Rico, Guam, the Virgin Islands, and, prior to	NNP	informative	4	1	3.36	0.25	3	State
state/NN/br-h14/981	0.327029237891385	0.0621620227136591	state	NN	miscellaneous	non-fiction	A	A	AB	ABC	state%1:15:01::	A	A	AB	ABC	 the result obtained in item 2 above.) Determine for each <font color=green>State</font> ( except the Virgin Islands, Guam and Puerto Rico, and, prior	NNP	informative	3	1	3.3	0.33	4	State
state/NN/br-h24/1030	0.383940507775539	0.158244994665645	state	NN	miscellaneous	non-fiction	A5	A	AB	ABC	united_states%1:15:00::	A51	A	AB	ABC	 States who, on April 15, are not in the United <font color=green>States</font>  or Puerto Rico, are allowed an extension of time until	NNPS	informative	1	0	3.4	0	2	States
state/NN/br-h24/1120	0.383940507775539	0.158244994665645	state	NN	miscellaneous	non-fiction	A5	A	AB	ABC	united_states%1:15:00::	A51	A	AB	ABC	 Naval Personnel on duty in Alaska or outside the United <font color=green>States</font>  and Puerto Rico are also allowed this automatic extension of	NNPS	informative	1	0	3.4	0	2	States
state/NN/br-h24/1166	0.383940507775539	0.158244994665645	state	NN	miscellaneous	non-fiction	A5	A	AB	ABC	united_states%1:15:00::	A51	A	AB	ABC	 that you were in Alaska or were outside the United <font color=green>States</font>  or Puerto Rico on April 15 or other due date	NNPS	informative	1	0	3.4	0	2	States
state/NN/br-h24/1574	0.383940507792078	0.158244994673666	state	NN	miscellaneous	non-fiction	A5	A	AB	ABC	united_states%1:15:00::	A51	A	AB	ABC	 of abode for the tax year is outside the United <font color=green>States</font> ( including Alaska and Hawaii), Puerto Rico, or the Virgin Islands	NNPS	informative	1	0	3.4	0	2	States
state/NNP/br-a01/1035	-0.354489501923061	-0.00694170342977194	state	NNP	press_reportage	press	A3	A	AB	ABC	person%1:03:00::	C1	C	C	ABC	 night in Blue Ridge brought enthusiastic responses from the audience. <font color=green>State</font>  Party Chairman James W. Dorsey added that enthusiasm was picking	NNP	informative	2	0	3.62	0	2	State
state/NNP/br-a01/1240	-0.0309569800732603	0.127374876663793	state	NNP	press_reportage	press	A2	A	AB	ABC	group%1:03:00::	B	B	AB	ABC	 system which the party opposes in its platform. Sam Caldwell, <font color=green>State</font>  Highway Department public relations director, resigned Tuesday to work for	NNP	informative	5	1	3.31	0.2	3	State
state/NNP/br-a01/1412	0.0477854098422343	-0.253902348052768	state	NNP	press_reportage	press	A2	A	AB	ABC	group%1:03:00::	B	B	AB	ABC	 as his first priority item. Meanwhile, it was learned the <font color=green>State</font>  Highway Department is very near being ready to issue the	NNP	informative	2	0	3.62	0	2	State
state/NNP/br-a01/1928	0.104590122245579	-0.289699791053895	state	NNP	press_reportage	press	A3	A	AB	ABC	group%1:03:00::	B	B	AB	ABC	 event Congress does provide this increase in federal funds'', the <font color=green>State</font>  Board of Education should be directed to`` give priority'' to	NNP	informative	5	0	3.77	0	1	State
state/NNP/br-a01/352	0.0668312842388376	0.286334276119092	state	NNP	press_reportage	press	A3	A	AB	ABC	group%1:03:00::	B	B	AB	ABC	 be effected''. The grand jury took a swipe at the <font color=green>State</font>  Welfare Department 's handling of federal funds granted for child	NNP	informative	3	0	3.59	0	2	State
state/NNP/br-a02/1877	0.00699773237389884	-0.057603460447567	state	NNP	press_reportage	press	A2	A	AB	ABC	group%1:03:00::	B	B	AB	ABC	 Okla.. In addition, Dr. Clark has studied at Rhode Island <font color=green>State</font>  College and Massachusetts Institute of Technology. During his college career	NNP	informative	2	0	3.44	0	4	State
state/NNP/br-a02/1952	-0.127250767895754	0.411498498727351	state	NNP	press_reportage	press	A2	A	AB	ABC	group%1:03:00::	B	B	AB	ABC	 associate professor of education at Fort Hays , Kan. , <font color=green>State</font>  College. He has served as a border patrolman and was	NNP	informative	2	0	3.15	0	1	State
state/NNP/br-a02/793	-0.158513674677031	-0.400531266285982	state	NNP	press_reportage	press	A3	A	AB	ABC	group%1:03:00::	B	B	AB	ABC	 finally, and sent to the Senate, a bill extending the <font color=green>State</font>  Health Department 's authority to give planning assistance to cities	NNP	informative	5	0	3.15	0	1	State
state/NNP/br-a12/156	-0.0954211493875655	0.247822619439605	state	NNP	press_reportage	press	A5	A	AB	ABC	group%1:03:00::	B	B	AB	ABC	 last Saturday night in the 41- 8 slaughter of Washington <font color=green>State</font> . Moritz is listed on the Longhorn roster as a right	NNP	informative	1	0	3.4	0	2	State
state/NNP/br-a12/1811	-0.0445481289133546	-0.322491484110993	state	NNP	press_reportage	press	A	A	AB	ABC	group%1:03:00::	B	B	AB	ABC	 M. C. Reynolds and Warren Rabb. Rabb, the former Louisiana <font color=green>State</font>  field general, came off the bench for his debut with	NNP	informative	2	1	3.32	0.5	2	State
state/NNP/br-a12/821	-0.0845616480886516	0.371659117650162	state	NNP	press_reportage	press	A5	A	AB	ABC	group%1:03:00::	B	B	AB	ABC	 bench. Wingback Jack Collins injured a knee in the Washington <font color=green>State</font>  game but insists he 'll be ready for Oklahoma. Last	NNP	informative	3	1	3.54	0.33	2	State
state/NNP/br-a15/1617	0.00853838436557744	-0.430406476359779	state	NNP	press_reportage	press	A2	A	AB	ABC	group%1:03:00::	B	B	AB	ABC	 baseball history, as the Blue and White beat Southeast Missouri <font color=green>State</font>  College, 5- 1, at Crystal City. The victory was the	NNP	informative	2	0	3.93	0	1	State
state/NNP/br-c02/2186	-0.00614320814397985	-0.157090193250331	state	NNP	press_reviews	press	A5	A	AB	ABC	group%1:03:00::	B	B	AB	ABC	 Earlier this month Edward R. Murrow, director of the United <font color=green>States</font>  Information Agency, came to Hollywood and had dinner with more	NNPS	informative	2	0	3.3	0	2	States
state/NNP/br-e31/292	0.0820258860713543	0.385915427474951	state	NNP	skill_and_hobbies	non-fiction	A3	A	AB	ABC	group%1:03:00::	B	B	AB	ABC	 harvested on 1500 commercial and private shooting preserves, and on <font color=green>State</font>  Game Commission controlled upland game areas during the 1960- 61	NNP	informative	5	1	3.13	0.2	1	State
state/NNP/br-f14/1306	-0.136730807955532	-0.489794731571473	state	NNP	popular_lore	fiction	C	C	C	ABC	person%1:03:00::	C1	C	C	ABC	 German state, including the Reich Minister of the Interior, the <font color=green>State</font>  Secretary in charge of the Four Year Plan, the Reich	NNP	informative	4	0	3.1	0	1	State
state/NNP/br-j14/2120	0.0615332315105847	-0.378166976326731	state	NNP	learned	non-fiction	A5	A	AB	ABC	group%1:03:00::	B	B	AB	ABC	 methods used to obtain them. The introduction of the United <font color=green>States</font>  Pharmacopoeia reference standard in 1952 and the redefinition and equating	NNPS	informative	1	0	3.02	0	1	States
state/NNP/br-k15/1529	0.190528859769585	-0.419133922902339	state	NNP	fiction_gral	fiction	A3	A	AB	ABC	group%1:03:00::	B	B	AB	ABC	 the U.S. Army. In spite of the fact that the <font color=green>state</font>  legislature voted us neutral, John Hunt Morgan is openly flying	NN	imaginative	5	1	3.13	0.2	1	state
