id	model.x	model.y	lemma	pos	genre	marisense	mbroad	mari3	mari2	sensekey	wnsense	wnbroad	wn3	wn2	text	newPos	newBroadGenre	cues	cuesWithWeight	meanWeight	weightedCuesRatio	weightedCW	wf	broadGenre
church/NN/br-a01/2073	-0.236566822401997	0.29103162856337	church	NN	press_reportage	E	E	DE	CDE	church%1:04:00::	E	E	DE	CDE	 said.`` Being at the polls was just like being at <font color=green>church</font> . I did n't smell a drop of liquor, and we	NN	informative	1	0	0.95	0	9	church	others
church/NN/br-a07/1303	0.138460195263229	-0.0893416932032919	church	NN	press_reportage	A	A	AB	AB	Z	Z	Z	Z	Z	 Africa, the Middle East and Latin America. Interviews with several <font color=green>church</font>  leaders have disclosed that this development has raised the question	NN	informative	3	1	1.72	0.33	7	church	others
church/NN/br-a07/1325	0.127970234024463	-0.0386380836682286	church	NN	press_reportage	A	A	AB	AB	Z	Z	Z	Z	Z	 the Peace Corps will be able to prevent confusion for <font color=green>church</font>  and state over methods, means and goals. There are a	NN	informative	4	3	1.24	0.75	8	church	others
church/NN/br-a07/1487	0.0506185163616914	-0.209488321146833	church	NN	press_reportage	A	A	AB	AB	Z	Z	Z	Z	Z	 projects and still preserve the constitutional requirement on separation of <font color=green>church</font>  and state? R. Sargent Shriver Jr., director of the corps	NN	informative	4	1	1.65	0.25	7	church	others
church/NN/br-a10/1754	0.101460242030301	0.0697681956929723	church	NN	press_reportage	A	A	AB	AB	Z	Z	Z	Z	Z	 one out of three Americans has vital contact with the <font color=green>church</font> . This means that more than 100 million have no vital	NN	informative	1	1	1.33	1	6	church	others
church/NN/br-a10/1769	-0.0227061342611535	-0.0213774840602077	church	NN	press_reportage	A	A	AB	AB	Z	Z	Z	Z	Z	 more than 100 million have no vital touch with the <font color=green>church</font>  or religious life'', he told delegates Friday. Talking of the	NN	informative	3	3	1.49	1	8	church	others
church/NN/br-a10/1850	0.113386958969766	-0.0720826213327849	church	NN	press_reportage	C	C	C	CDE	Z	Z	Z	Z	Z	 adding that the denomination had a national goal of one <font color=green>church</font>  for every 10000 persons.`` In this light we need 1000	NN	informative	3	2	0.52	0.67	6	church	others
church/NN/br-a10/1940	0.143542040477665	-0.0332272611464132	church	NN	press_reportage	A	A	AB	AB	Z	Z	Z	Z	Z	 this would necessitate some changes in methods, he said.`` The <font color=green>church</font>  's ability to change her methods is going to determine	NN	informative	1	0	1.22	0	8	church	others
church/NN/br-a16/453	-0.241287870458791	-0.0692991207753291	church	NN	press_reportage	D	D	DE	CDE	Z	Z	Z	Z	Z	 a small one at noon tomorrow in St. Bernadine 's <font color=green>church</font> , Forest Park. A small reception will follow in the Oak	NN	informative	4	2	1.55	0.5	6	church	others
church/NN/br-a17/1636	-0.274482177050224	-0.03017303764356	church	NN	press_reportage	D	D	DE	CDE	Z	Z	Z	Z	Z	 Gay, who were married Saturday at the Munger Place Methodist <font color=green>Church</font> . Parents of the bride are Mr. and Mrs. Ferris M.	NNP	informative	4	3	1.51	0.75	6	Church	others
church/NN/br-a17/1770	-0.343345233055949	-0.0700509267378717	church	NN	press_reportage	D	D	DE	CDE	Z	Z	Z	Z	Z	 College of Technology, in the chapel of the First Presbyterian <font color=green>Church</font>  of Houston. The bride, daughter of Rhodes Semmes Baker Jr.	NNP	informative	2	0	2.12	0	4	Church	others
church/NN/br-a17/2228	-0.11343036764385	-0.0451298066617643	church	NN	press_reportage	D	D	DE	CDE	Z	Z	Z	Z	Z	 Burgher Jr. seated guests. A reception was held at the <font color=green>church</font> . The First Christian Church of Pampa was the setting for	NN	informative	5	4	2.38	0.8	8	church	others
church/NN/br-a17/2233	-0.111675476860763	-0.0606065385455246	church	NN	press_reportage	D	D	DE	CDE	Z	Z	Z	Z	Z	 A reception was held at the church. The First Christian <font color=green>Church</font>  of Pampa was the setting for the wedding last Sunday	NNP	informative	4	2	2.22	0.5	7	Church	others
church/NN/br-a21/677	-0.217770773804386	-0.254578223393782	church	NN	press_reportage	D	D	DE	CDE	Z	Z	Z	Z	Z	 for 10 a. m. tomorrow in St. Anne 's Catholic <font color=green>Church</font> , 31978 Mound, in Warren. The mother and daughter, who will	NNP	informative	4	1	2.59	0.25	4	Church	others
church/NN/br-a22/1206	-0.254546360916675	-0.224481061963114	church	NN	press_reportage	B	B	AB	AB	Z	Z	Z	Z	Z	 World War 1,. He was a member of the Baptist <font color=green>church</font> . Survivors include two brothers, C. E. Killingsworth, Atlanta, and John	NN	informative	2	1	1.75	0.5	4	church	others
church/NN/br-a22/1283	-0.185038856781146	-0.195158379364613	church	NN	press_reportage	C	C	C	CDE	Z	Z	Z	Z	Z	 painter. He was a member of the Oakland City Methodist <font color=green>Church</font>  and a native of Atlanta. Funeral services will be at	NNP	informative	2	1	1.68	0.5	7	Church	others
church/NN/br-a22/307	-0.0804939267643776	-0.14515399413567	church	NN	press_reportage	B	B	AB	AB	Z	Z	Z	Z	Z	 challenged by the state. Emory is affiliated with the Methodist <font color=green>Church</font> . Some church leaders, both clerical and lay, have criticized the	NNP	informative	4	1	2.96	0.25	2	Church	others
church/NN/br-a22/310	-0.0656299879648727	-0.134727783554341	church	NN	press_reportage	A	A	AB	AB	Z	Z	Z	Z	Z	 the state. Emory is affiliated with the Methodist Church. Some <font color=green>church</font>  leaders, both clerical and lay, have criticized the university for	NN	informative	5	1	2.89	0.2	3	church	others
church/NN/br-a31/1395	-0.104648434814658	0.0137868928982789	church	NN	press_reportage	D	D	DE	CDE	Z	Z	Z	Z	Z	 from 4 to 8 p. m. Sunday at First Presbyterian <font color=green>Church</font> . At that time the second half of the Christian Youth	NNP	informative	5	1	1.02	0.2	8	Church	others
church/NN/br-a31/1542	-0.0356506354802431	0.116255504019126	church	NN	press_reportage	C	C	C	CDE	Z	Z	Z	Z	Z	 he and his wife serve as advisors at First Presbyterian <font color=green>Church</font> . And he wanted to be careful that the kids not	NNP	informative	3	0	0.69	0	6	Church	others
church/NN/br-a31/1842	-0.143425860472182	-0.234168654857995	church	NN	press_reportage	D	D	DE	CDE	Z	Z	Z	Z	Z	 planned for 10: 50 a. m. Sunday at First Christian <font color=green>Church</font> . It will be the second time the assistant manager of	NNP	informative	3	1	1.53	0.33	6	Church	others
church/NN/br-a31/2087	-0.214839216111863	-0.0650830408178459	church	NN	press_reportage	D	D	DE	CDE	Z	Z	Z	Z	Z	 Family'' at 7: 30 p. m. Sunday at Christ Lutheran <font color=green>Church</font> . Mr. and Mrs. George Treadwell will be honored at a	NNP	informative	3	0	1.36	0	6	Church	others
church/NN/br-a31/2112	-0.15745440835961	-0.0959726895561726	church	NN	press_reportage	D	D	DE	CDE	Z	Z	Z	Z	Z	 and program at 6 p. m. Sunday at Trinity Methodist <font color=green>Church</font> . He is the sexton of the church. A family worship	NNP	informative	3	0	1.76	0	4	Church	others
church/NN/br-a31/2120	-0.0362780117350689	-0.0324619624667134	church	NN	press_reportage	D	D	DE	CDE	Z	Z	Z	Z	Z	 at Trinity Methodist Church. He is the sexton of the <font color=green>church</font> . A family worship service will follow the program at 7	NN	informative	4	2	1.74	0.5	7	church	others
church/NN/br-a31/2172	-0.0328287476537148	-0.0096424923732591	church	NN	press_reportage	C	C	C	CDE	Z	Z	Z	Z	Z	 service marking National Family Week. Every family of Riviera Presbyterian <font color=green>Church</font>  has been asked to read the Bible and pray together	NNP	informative	6	6	1.07	1	12	Church	others
church/NN/br-a31/2212	-0.065353203376714	-0.0408954231711391	church	NN	press_reportage	C	C	C	CDE	Z	Z	Z	Z	Z	 participate. To start the week of special programs at the <font color=green>church</font> , the Rev. John D. Henderson will preach on`` A Successful	NN	informative	4	2	1.23	0.5	7	church	others
church/NN/br-a31/2241	0.0108867307180976	-0.38239976361335	church	NN	press_reportage	C	C	C	CDE	Z	Z	Z	Z	Z	 40 and 11 a. m. Sunday. New officers of the <font color=green>church</font>  will be ordained and installed at the 7: 30 p.	NN	informative	4	2	1.08	0.5	3	church	others
church/NN/br-a31/2280	-0.152623142220019	-0.0610525375754703	church	NN	press_reportage	C	C	C	CDE	Z	Z	Z	Z	Z	 held at 6: 15 p. m. Monday and the annual <font color=green>church</font>  picnic at 4 p. m. next Saturday. The week will	NN	informative	3	3	2.14	1	7	church	others
church/NN/br-b08/1866	-0.0286289217149783	-0.0138011129488433	church	NN	press_editorial	D	D	DE	CDE	Z	Z	Z	Z	Z	 wrote after almost a decade of service to this majestic <font color=green>church</font> .`` Such a church needs vigor and vitality in its rector	NN	informative	2	0	2.03	0	7	church	others
church/NN/br-b08/1871	-0.0598136224290629	-0.0718759261630554	church	NN	press_editorial	C	C	C	CDE	Z	Z	Z	Z	Z	 a decade of service to this majestic church.`` Such a <font color=green>church</font>  needs vigor and vitality in its rector and one man	NN	informative	4	2	2.46	0.5	4	church	others
church/NN/br-b08/1912	0.0430192243944675	-0.0940767520627876	church	NN	press_editorial	C	C	C	CDE	Z	Z	Z	Z	Z	 stay`` beyond the time that his leadership should benefit'' his <font color=green>church</font> , he wrote,`` for he becomes ordinary''. And so the young	NN	informative	2	1	1.72	0.5	5	church	others
church/NN/br-b08/2063	0.0920268059698245	0.127720498664581	church	NN	press_editorial	C	C	C	CDE	Z	Z	Z	Z	Z	 gives himself to God and to the believers of his <font color=green>church</font>  takes upon himself a life of giving. He does not	NN	informative	4	1	1.23	0.25	3	church	others
church/NN/br-b08/2245	-0.116293744349782	-0.30045268635318	church	NN	press_editorial	E	E	DE	CDE	Z	Z	Z	Z	Z	 them to bestow saintliness upon us in return for ostentatious <font color=green>church</font>  attendance and a few bucks a week, American cash. If	NN	informative	1	0	1.27	0	3	church	others
church/NN/br-b08/2363	-0.0585826058599261	0.0343086989661332	church	NN	press_editorial	D	D	DE	CDE	Z	Z	Z	Z	Z	 through him. But how little love we give him. The <font color=green>church</font>  truly is not a rest home for saints, but a	NN	informative	3	2	0.98	0.67	6	church	others
church/NN/br-b08/834	-0.0751903879144669	0.0798919105304814	church	NN	press_editorial	D	D	DE	CDE	Z	Z	Z	Z	Z	 agreement. I settled it tonight'', he continued.`` I leave this <font color=green>church</font>  with a feeling that a great weight has been lifted	NN	informative	1	0	1.27	0	6	church	others
church/NN/br-b12/2009	0.0138710288619664	0.116363807549046	church	NN	press_editorial	A	A	AB	AB	Z	Z	Z	Z	Z	 new version retains, however, the old phrase`` angel of the <font color=green>church</font> '' which Biblical scholars have previously interpreted as meaning bishop. This	NN	informative	4	2	1.81	0.5	8	church	others
church/NN/br-b12/2115	-0.0357975082924957	0.337198058366542	church	NN	press_editorial	A	A	AB	AB	Z	Z	Z	Z	Z	 and Greek and other ancient writings, some by the early <font color=green>church</font>  fathers, in themselves called for a restudy of the Bible	NN	informative	5	1	2.42	0.2	3	church	others
church/NN/br-b12/2217	-0.0519759616301901	-0.0715751486016471	church	NN	press_editorial	B	B	AB	AB	Z	Z	Z	Z	Z	 of a joint committee made up of representatives of the <font color=green>Church</font>  of England, Church of Scotland, Methodist Church, Congregational Union, Baptist	NNP	informative	6	1	2.12	0.17	6	Church	others
church/NN/br-b12/2226	-0.115098587286301	-0.162823772775808	church	NN	press_editorial	B	B	AB	AB	Z	Z	Z	Z	Z	 representatives of the Church of England, Church of Scotland, Methodist <font color=green>Church</font> , Congregational Union, Baptist Union, Presbyterian Church of England, Churches in	NNP	informative	7	2	3.36	0.29	4	Church	others
church/NN/br-b12/2235	-0.0805247294104286	-0.126128778514199	church	NN	press_editorial	B	B	AB	AB	Z	Z	Z	Z	Z	 Church of Scotland, Methodist Church, Congregational Union, Baptist Union, Presbyterian <font color=green>Church</font>  of England, Churches in Wales, Churches in Ireland, Society of	NNP	informative	9	3	3	0.33	5	Church	others
church/NN/br-b15/1190	-0.597901716402945	0.0810971155986246	church	NN	press_editorial	C	C	C	CDE	Z	Z	Z	Z	Z	 El; Rev. DeWitt Clemens, pastor of the Mathewson Street Methodist <font color=green>Church</font> ; Mr. Felix Miranda, of the Imperial Knife Co.; and to	NNP	informative	2	1	2.64	0.5	2	Church	others
church/NN/br-b18/1829	-0.020364944194992	-0.114821902268515	church	NN	press_editorial	C	C	C	CDE	Z	Z	Z	Z	Z	 the Women 's Association of the Trumbull Ave. United Presbyterian <font color=green>Church</font> , considerable use was made of material from The Detroit News	NNP	informative	4	1	1.4	0.25	5	Church	others
church/NN/br-b24/1259	0.0420476681397144	-0.0416634636591248	church	NN	press_editorial	C	C	C	CDE	Z	Z	Z	Z	Z	 or less native. Sometimes they get their initial experience in <font color=green>church</font>  haflis, conducted by Lebanese and Syrians in the U. S.	NN	informative	2	1	1.2	0.5	7	church	others
church/NNP/br-a17/2134	-0.236065507053814	0.122068035510818	church	NNP	press_reportage	D	D	DE	CDE	Z	Z	Z	Z	Z	 at the ceremony in Slaughter Chapel of the First Baptist <font color=green>Church</font> . Dan Beam presented music and the bride was given in	NNP	informative	2	0	2.28	0	5	Church	others
church/NNP/br-a18/760	-0.0740074979820772	-0.0185087653648198	church	NNP	press_reportage	C	C	C	CDE	Z	Z	Z	Z	Z	 the party. The women 's committee of St. David 's <font color=green>Church</font>  will hold its annual pre-Fair pink parade, a dessert bridge	NNP	informative	5	4	2.58	0.8	8	Church	others
church/NNP/br-a31/2143	-0.162095402367801	-0.0483777995823492	church	NNP	press_reportage	C	C	C	CDE	Z	Z	Z	Z	Z	 7: 45 p. m.. The outstanding family of Central Nazarene <font color=green>Church</font>  will be picked by ballot from among eight families during	NNP	informative	3	2	2.38	0.67	7	Church	others
church/NNP/br-a35/810	0.0241103140527499	0.00779303206442153	church	NNP	press_reportage	A	A	AB	AB	Z	Z	Z	Z	Z	 deserves closer scrutiny. For while the past needs of the <font color=green>Church</font>  in this country may have been adequately met by collegiate	NNP	informative	2	2	1.8	1	9	Church	others
church/NNP/br-b08/1804	-0.276706086741049	-0.151417541092592	church	NNP	press_editorial	C	C	C	CDE	Z	Z	Z	Z	Z	 his letter of resignation as rector of St. Luke 's <font color=green>Church</font>  in Atlanta. It was the cry of not just one	NNP	informative	3	1	1.73	0.33	6	Church	others
church/NNP/br-b12/2221	-0.0772558947775877	-0.173747925389382	church	NNP	press_editorial	B	B	AB	AB	Z	Z	Z	Z	Z	 committee made up of representatives of the Church of England, <font color=green>Church</font>  of Scotland, Methodist Church, Congregational Union, Baptist Union, Presbyterian Church	NNP	informative	9	5	3.57	0.56	5	Church	others
church/NNP/br-b22/1005	0.0692492134999653	-0.00723948775897825	church	NNP	press_editorial	A	A	AB	AB	Z	Z	Z	Z	Z	 concern itself directly only with the internal affairs of the <font color=green>Church</font> . As it has turned out, however, the excessive enthusiasm in	NNP	informative	2	2	1.89	1	7	Church	others
church/NNP/br-b22/1077	0.036135455609516	0.0831421815800428	church	NNP	press_editorial	A	A	AB	AB	Z	Z	Z	Z	Z	 that Pope John sees the renewal and purification of the <font color=green>Church</font>  as an absolutely necessary step toward Christian unity. Far from	NNP	informative	5	1	2.71	0.2	6	Church	others
church/NNP/br-b22/1102	0.171630126263161	0.103361732185717	church	NNP	press_editorial	A	A	AB	AB	Z	Z	Z	Z	Z	 to the ecumenical task, the Pontiff believes that a revivified <font color=green>Church</font>  is required in order that the whole world may see	NNP	informative	5	2	1.61	0.4	7	Church	others
church/NNP/br-b22/1154	0.0377764747430682	0.042068793448267	church	NNP	press_editorial	A	A	AB	AB	Z	Z	Z	Z	Z	 be to remove as far as possible whatever in the <font color=green>Church</font>  today stands in the way of unity. Secondly, a whole	NNP	informative	1	1	1.27	1	9	Church	others
church/NNP/br-b22/1193	0.0447675569920512	0.0561444023239333	church	NNP	press_editorial	A	A	AB	AB	Z	Z	Z	Z	Z	 unity is still very much alive and growing within the <font color=green>Church</font> . The establishment, by the Holy Father, of a permanent Secretariat	NNP	informative	3	1	1.87	0.33	9	Church	others
church/NNP/br-b22/1245	-0.00376333126376253	-0.0839732777915264	church	NNP	press_editorial	B	B	AB	AB	Z	Z	Z	Z	Z	 Churches assembly in New Delhi as`` official'' observers reverses the <font color=green>Church</font>  's earlier stand. The public appeal by the new Vatican	NNP	informative	3	1	2.43	0.33	9	Church	others
church/NNP/br-b22/1318	0.00751266798599838	-0.0324010563214256	church	NNP	press_editorial	B	B	AB	AB	Z	Z	Z	Z	Z	 as directly as anyone the new spirit that pervades the <font color=green>Church</font>  's stance toward the Protestant and Orthodox Churches. Noting all	NNP	informative	3	1	2.58	0.33	8	Church	others
church/NNS/br-a09/1417	-0.0475923202112027	0.136145149100647	church	NNS	press_reportage	D	D	DE	CDE	Z	Z	Z	Z	Z	 will feature row houses, garden apartments, four small parks, schools, <font color=green>churches</font> , a shopping center and several small clusters of stores. The	NNS	informative	7	4	2	0.57	8	churches	others
church/NNS/br-a10/1674	-0.0678197107919495	-0.0347684185394934	church	NNS	press_reportage	D	D	DE	CDE	Z	Z	Z	Z	Z	 need for their forthcoming program,`` Breakthrough'' scheduled to fill the <font color=green>churches</font>  for the next two years. In his opening address Wednesday	NNS	informative	5	4	1.97	0.8	6	churches	others
church/NNS/br-a10/1831	-0.162668627122852	0.0799460288723824	church	NNS	press_reportage	C	C	C	CDE	Z	Z	Z	Z	Z	 with this challenge''.`` In 35 years we have opened 7000 <font color=green>churches</font> '', the Rev. Mr. Brandt said, adding that the denomination had	NNS	informative	3	1	1.82	0.33	5	churches	others
church/NNS/br-a10/1863	0.0319294888074742	-0.142064181785835	church	NNS	press_reportage	C	C	C	CDE	Z	Z	Z	Z	Z	 for every 10000 persons.`` In this light we need 1000 <font color=green>churches</font>  in Illinois, where we have 200; 800 in Southern New	NNS	informative	3	3	1.2	1	5	churches	others
church/NNS/br-a10/1918	-0.0447574895563685	0.0162676846544871	church	NNS	press_reportage	C	C	C	CDE	Z	Z	Z	Z	Z	 Brandt suggested the vision of 8000 new Assemblies of God <font color=green>churches</font>  in the next 10 years. To accomplish this would necessitate	NNS	informative	3	2	2.42	0.67	6	churches	others
church/NNS/br-a10/1980	0.0116994708225459	-0.0214084951504107	church	NNS	press_reportage	C	C	C	CDE	Z	Z	Z	Z	Z	 includes: Encouraging by every means, all existing Assemblies of God <font color=green>churches</font>  to start new churches. Engaging mature, experienced men to pioneer	NNS	informative	6	2	2.96	0.33	10	churches	others
church/NNS/br-a10/1984	-0.0223505642441834	-0.00330230463631622	church	NNS	press_reportage	C	C	C	CDE	Z	Z	Z	Z	Z	 means, all existing Assemblies of God churches to start new <font color=green>churches</font> . Engaging mature, experienced men to pioneer or open new churches	NNS	informative	6	4	3.07	0.67	9	churches	others
church/NNS/br-a10/1996	-0.0157606709607187	0.0124155739965511	church	NNS	press_reportage	C	C	C	CDE	Z	Z	Z	Z	Z	 churches. Engaging mature, experienced men to pioneer or open new <font color=green>churches</font>  in strategic population centers. Surrounding pioneer pastors with vocational volunteers	NNS	informative	7	3	3.18	0.43	10	churches	others
church/NNS/br-a10/2022	-0.000169214528421554	-0.0107252319196147	church	NNS	press_reportage	C	C	C	CDE	Z	Z	Z	Z	Z	 will be urged to move into the area of new <font color=green>churches</font>  in the interest of lending their support to the new	NNS	informative	2	3	1.98	1.5	8	churches	others
church/NNS/br-a10/2051	-0.133638340895717	-0.131424314164143	church	NNS	press_reportage	C	C	C	CDE	Z	Z	Z	Z	Z	 to spend from 6- 12 months as apprentices in well-established <font color=green>churches</font> . U. S. Dist. Judge Charles L. Powell denied all motions	NNS	informative	2	0	2.15	0	5	churches	others
church/NNS/br-a31/1594	0.011275260330783	-0.0742501254197881	church	NNS	press_reportage	C	C	C	CDE	Z	Z	Z	Z	Z	 than 300 top teenagers and 65 adult advisers from Presbyterian <font color=green>churches</font>  of the area sat enthralled at the four-hour program. This	NNS	informative	4	3	2.16	0.75	6	churches	others
church/NNS/br-a31/1753	0.0336443707263112	-0.0342830002877725	church	NNS	press_reportage	C	C	C	CDE	Z	Z	Z	Z	Z	 Auditorium may be set up soon. And to encourage other <font color=green>churches</font>  to try their own programs, Kern said this Sunday 's	NNS	informative	3	2	1.05	0.67	8	churches	others
church/NNS/br-a31/1806	-0.011794546321175	-0.0154094845285734	church	NNS	press_reportage	D	D	DE	CDE	Z	Z	Z	Z	Z	 special services marking National Christian Family Week in Miami area <font color=green>churches</font>  next week. Of particular meaning to the Charles MacWhorter family	NNS	informative	4	3	1.75	0.75	12	churches	others
church/NNS/br-b04/1480	-0.0223862728959775	0.0419139149695699	church	NNS	press_editorial	C	C	C	CDE	Z	Z	Z	Z	Z	 his money and his name: Does it assail schools and <font color=green>churches</font>  with blanket accusations? Does it attack other traditional American institutions	NNS	informative	4	3	1.78	0.75	9	churches	others
church/NNS/br-b12/2239	-0.0374614806851093	-0.0463983974771472	church	NNS	press_editorial	B	B	AB	AB	Z	Z	Z	Z	Z	 Methodist Church, Congregational Union, Baptist Union, Presbyterian Church of England, <font color=green>Churches</font>  in Wales, Churches in Ireland, Society of Friends, British and	NNPS	informative	7	0	2.74	0	6	Churches	others
church/NNS/br-b12/2243	-0.0270110555365259	-0.0362675518529696	church	NNS	press_editorial	B	B	AB	AB	Z	Z	Z	Z	Z	 Union, Baptist Union, Presbyterian Church of England, Churches in Wales, <font color=green>Churches</font>  in Ireland, Society of Friends, British and Foreign Bible Society	NNPS	informative	2	0	2.71	0	6	Churches	others
church/NNS/br-b22/1233	-0.00973007055757481	-0.135676301829995	church	NNS	press_editorial	B	B	AB	AB	Z	Z	Z	Z	Z	 of five Catholic theologians to attend the World Council of <font color=green>Churches</font>  assembly in New Delhi as`` official'' observers reverses the Church	NNPS	informative	5	2	2.87	0.4	6	Churches	others
church/NNS/br-b22/1326	0.146785919828469	-0.24149644625239	church	NNS	press_editorial	B	B	AB	AB	Z	Z	Z	Z	Z	 pervades the Church 's stance toward the Protestant and Orthodox <font color=green>Churches</font> . Noting all the difficulties that stand in the way of	NNPS	informative	2	1	2.71	0.5	5	Churches	others
church/NNS/br-c08/1853	0.00453494250982246	0.0515440276156863	church	NNS	press_reviews	C	C	C	CDE	Z	Z	Z	Z	Z	 the early jazz forms and the music of the Negro <font color=green>churches</font> . To help him on this religious aspect of primitive jazz	NNS	informative	4	3	2.09	0.75	8	churches	others
country/NN/br-a04/1253	0.108942378762415	-0.0380970979177872	country	NN	press_reportage	B4	B	B14	B	Z	Z	Z	Z	Z	 that he agreed to the need for unity in the <font color=green>country</font>  now. But he further said that it was better politics	NN	informative	2	1	0.7	0.5	5	country	others
country/NN/br-a05/1184	0.029692854837136	0.00602267647718903	country	NN	press_reportage	B4	B	B14	B	Z	Z	Z	Z	Z	 Sheraton-Biltmore Hotel that about half of the people in the <font color=green>country</font>  want the`` welfare'' type of government and the other half	NN	informative	4	4	0.88	1	6	country	others
country/NN/br-a06/106	-0.257523993305188	0.0679388414546077	country	NN	press_reportage	A	A	A	A	Z	Z	Z	Z	Z	 Westfield Young Democratic Club cocktail party at the Scotch Plains <font color=green>Country</font>  Club. It was greeted with a chorus of boos by	NNP	informative	4	3	2.32	0.75	5	Country	others
country/NN/br-a07/1688	0.0474681838721658	-0.0186441814148476	country	NN	press_reportage	B	B	B14	B	Z	Z	Z	Z	Z	 those countries. A committee of experts has recommended that a <font color=green>country</font>  's population be considered in the distribution of professional posts	NN	informative	2	2	1.15	1	11	country	others
country/NN/br-a08/443	0.00905701343214989	-0.00215791927766817	country	NN	press_reportage	B4	B	B14	B	Z	Z	Z	Z	Z	 the National Archives building where hundreds of thousands of this <font color=green>country</font>  's most valuable records are kept. Also the department of	NN	informative	2	2	1.28	1	8	country	others
country/NN/br-a10/426	0.231132366671626	-0.06703054776431	country	NN	press_reportage	B3	B	B23	B	Z	Z	Z	Z	Z	 States must plan to absorb the exported goods of the <font color=green>country</font> , at what he termed a`` social cost''. Martin said the	NN	informative	4	3	1.41	0.75	6	country	others
country/NN/br-a10/460	-0.00520917072275548	-0.0401557455085788	country	NN	press_reportage	B3	B	B23	B	Z	Z	Z	Z	Z	 primary products which may involve the total income of one <font color=green>country</font> . The Portland school board was asked Monday to take a	NN	informative	3	3	0.92	1	9	country	others
country/NN/br-a16/837	-0.0800042518796139	0.173106096134324	country	NN	press_reportage	B1	B	B14	B	Z	Z	Z	Z	Z	 his brother would meet her at the border of that <font color=green>country</font> - so newly separated from Egypt and the United Arab Republic	NN	informative	2	2	1.45	1	6	country	others
country/NN/br-a17/346	-0.180024561583579	-0.00877869861179551	country	NN	press_reportage	A	A	A	A	Z	Z	Z	Z	Z	 will be a stag dinner Friday evening at the Denver <font color=green>Country</font>  Club which will precede the opening of the 1961 golf	NNP	informative	2	2	1.86	1	9	Country	others
