id	model.x	model.y	lemma	pos	genre	broadGenre	marisense	mbroad	mari3	mari2	sensekey	wnsense	wnbroad	wn3	wn2	text	newPos	newBroadGenre	cues	cuesWithWeight	meanWeight	weightedCuesRatio	weightedCW	wf
state/JJ/br-g17/2159	-0.00599220218922693	-0.00338942811645639	state	JJ	belles_lettres	fiction	A2	A	AB	ABC	state%5:00:02:public:00	A2	A	AB	ABC	 is involved. How did it happen, for example, that the <font color=green>state</font>  university, that great symbol of American democracy, failed to flourish	JJ	informative	3	3	2.56	1	9	state
state/JJ/br-g17/2327	0.0237262852367938	-0.0805354740879874	state	JJ	belles_lettres	fiction	A2	A	AB	ABC	state%5:00:02:public:00	A2	A	AB	ABC	 been the very last of the forty-eight to establish a <font color=green>state</font>  university? The state universities of Maine, New Hampshire, And Vermont	JJ	informative	4	1	4.03	0.25	5	state
state/JJ/br-g17/2331	0.0311055265325961	-0.0902593001276037	state	JJ	belles_lettres	fiction	A2	A	AB	ABC	state%5:00:02:public:00	A2	A	AB	ABC	 last of the forty-eight to establish a state university? The <font color=green>state</font>  universities of Maine, New Hampshire, And Vermont are older and	JJ	informative	4	2	4.27	0.5	5	state
state/JJ/br-g23/486	0.0398507323201678	-0.0272074356599641	state	JJ	belles_lettres	fiction	A2	A	AB	ABC	state%5:00:02:public:00	A2	A	AB	ABC	 The writer took a class of college students to the <font color=green>state</font>  hospital for the mentally ill in St. Joseph, Missouri. An	JJ	informative	2	2	3.31	1	9	state
state/JJ/br-l14/977	0.0257281101853907	0.0265381723395758	state	JJ	fiction_mystery	fiction	A2	A	AB	ABC	state%5:00:02:public:00	A2	A	AB	ABC	 modern, large, on five acres. Must have cost plenty. The <font color=green>State</font>  cops would check from time to time; pass word when	JJ	imaginative	1	1	2.76	1	10	State
state/NN/br-f03/1319	-0.138433822108653	0.323538204181661	state	NN	popular_lore	fiction	D	D	D	D	state_of_matter%1:26:00::	D2	D	D	D	 the coexistence of the infinite number of universal, apparently momentary <font color=green>states</font>  of matter, successive one after another in consciousness, but permanent	NNS	informative	2	0	1.35	0	2	states
state/NN/br-f04/1144	0.52244908288732	0.109526503735615	state	NN	popular_lore	fiction	A4	A	AB	ABC	Z	Z	Z	Z	Z	 metal cans of grains ordered from organic farms in the <font color=green>state</font> . Miss Colman pours measures of whole wheat, oats, and soy	NN	informative	2	0	1.55	0	1	state
state/NN/br-f05/1048	-0.000570723423700483	-0.269615040378694	state	NN	popular_lore	fiction	A3	A	AB	ABC	Z	Z	Z	Z	Z	 necessary to gain access to Wilson flat, arrangements at the <font color=green>state</font>  capital were far from satisfactory. Each time in, the unhappy	NN	informative	1	1	1.52	1	2	state
state/NN/br-f05/147	0.0591503669087114	0.189746891807608	state	NN	popular_lore	fiction	A4	A	AB	ABC	Z	Z	Z	Z	Z	 Great Flood of 1927- the worst natural disaster in the <font color=green>state</font>  's history- the little plane was its sole replacement in	NN	informative	2	0	1.66	0	3	state
state/NN/br-f05/162	0.0591503669087114	0.189746891807608	state	NN	popular_lore	fiction	A5	A	AB	ABC	Z	Z	Z	Z	Z	 little plane was its sole replacement in carrying the United <font color=green>States</font>  mails. Rain of near cloudburst proportions had fallen for three	NNPS	informative	1	0	1.66	0	3	States
state/NN/br-f05/242	0.130025001420951	-0.00414586166298081	state	NN	popular_lore	fiction	A4	A	AB	ABC	Z	Z	Z	Z	Z	 had offices- and wondered how to move the mail. The <font color=green>state</font>  's railroad system counted miles of broken bridges and missing	NN	informative	4	2	1.27	0.5	5	state
state/NN/br-f05/356	0.15903237177382	0.0738344367093074	state	NN	popular_lore	fiction	A4	A	AB	ABC	Z	Z	Z	Z	Z	 planes to fly the mail in and out of the <font color=green>state</font> , it seemed a likely temporary solution, easing Burlington 's bottleneck	NN	informative	3	1	1.59	0.33	4	state
state/NN/br-f05/813	0.401072312559951	-0.258983687850412	state	NN	popular_lore	fiction	A4	A	AB	ABC	Z	Z	Z	Z	Z	 to a brand-new airplane, aimed at putting their city and <font color=green>state</font>  on the flying map. The ship was a Waco biplane	NN	informative	2	1	2.04	0.5	1	state
state/NN/br-f09/1758	0.0181744053645413	-0.0276237891991715	state	NN	popular_lore	fiction	A5	A	AB	ABC	Z	Z	Z	Z	Z	 a temporary passport, good only for return to the United <font color=green>States</font> . And return to the United States she did, into waiting	NNPS	informative	2	0	1.4	0	4	States
state/NN/br-f09/1765	0.015705114934535	-0.0359606377858611	state	NN	popular_lore	fiction	A5	A	AB	ABC	Z	Z	Z	Z	Z	 return to the United States. And return to the United <font color=green>States</font>  she did, into waiting arms- the unromantic ones of the	NNPS	informative	1	0	1.42	0	2	States
state/NN/br-f11/1618	0.187647142656256	-0.0498830092679569	state	NN	popular_lore	fiction	A1	A	AB	ABC	Z	Z	Z	Z	Z	 an orthodontist, a man must first be licensed by his <font color=green>state</font>  as a dentist, then he must spend at least two	NN	informative	2	0	1.28	0	2	state
state/NN/br-f11/162	-0.0895755029548795	-0.371435108317107	state	NN	popular_lore	fiction	A5	A	AB	ABC	Z	Z	Z	Z	Z	 no special case.`` The majority of children in the United <font color=green>States</font>  could benefit by some form of orthodontic treatment'', says Dr.	NNPS	informative	1	0	2.16	0	1	States
state/NN/br-f11/1746	0.0816201465060919	-0.17498810655519	state	NN	popular_lore	fiction	A5	A	AB	ABC	Z	Z	Z	Z	Z	 of months or years. In many cities in the United <font color=green>States</font>  clinics associated with dental schools will take patients at a	NNPS	informative	1	0	1.28	0	3	States
state/NN/br-f12/1351	0.334085458040377	0.199253932241784	state	NN	popular_lore	fiction	A5	A	AB	ABC	Z	Z	Z	Z	Z	 women are named Miranda than Elizabeth; that in the United <font color=green>States</font>  more people die of heart disease than of smallpox. So	NNPS	informative	1	0	1.32	0	2	States
state/NN/br-f12/2279	0.194876305318111	-0.0143687170718215	state	NN	popular_lore	fiction	D	D	D	D	Z	Z	Z	Z	Z	 taken with other details it could have referred to a <font color=green>state</font>  of mental or spiritual confinement. In this connection it is	NN	informative	3	0	1.38	0	3	state
state/NN/br-f12/263	-0.460826484031395	-0.063827762770674	state	NN	popular_lore	fiction	D	D	D	D	Z	Z	Z	Z	Z	 this experiment are in a waking or only slightly dissociated <font color=green>state</font> , so that the sitter can make comments, ask and answer	NN	informative	3	0	2.18	0	1	state
state/NN/br-f14/1295	0.0569413729670455	-0.284276196168054	state	NN	popular_lore	fiction	B	B	AB	ABC	state%1:14:00::	B1	B	AB	ABC	 was attended by representatives of major organs of the German <font color=green>state</font> , including the Reich Minister of the Interior, the State Secretary	NN	informative	4	1	1.78	0.25	2	state
state/NN/br-f14/457	-0.366574317014037	0.0992817080342813	state	NN	popular_lore	fiction	A5	A	AB	ABC	united_states%1:15:00::	A51	A	AB	ABC	 and the tightening of Stalin 's dictatorship; in the United <font color=green>States</font>  the initiation of militant anti Communism, with the repentant ex	NNPS	informative	1	0	1.56	0	2	States
state/NN/br-f15/701	-0.00382135685022822	-0.118174356174113	state	NN	popular_lore	fiction	A1	A	AB	ABC	state%1:15:01::	A	A	AB	ABC	 considered by non-Catholics in family planning. The laws of many <font color=green>states</font>  permit birth control only for medical reasons. The Roman Catholic	NNS	informative	2	1	1.73	0.5	3	states
state/NN/br-f17/1114	0.0605694207566863	-0.0926899327661377	state	NN	popular_lore	fiction	A5	A	AB	ABC	united_states%1:14:00::	A52	A	AB	ABC	 presence of a colony on the Red prompted the United <font color=green>State</font>  War Department in 1819 to send Lieutenant-Colonel Henry Leavenworth from	NNP	informative	1	0	1.64	0	3	State
state/NN/br-f17/1144	0.127059763622229	-0.0279266538810033	state	NN	popular_lore	fiction	A5	A	AB	ABC	united_states%1:15:00::	A51	A	AB	ABC	 of Prairie du Chien, until then the most advanced United <font color=green>States</font>  post. In September 1822 two companies of infantry arrived at	NNPS	informative	1	0	1.47	0	3	States
state/NN/br-f17/1330	0.155397863997288	0.0426594363150847	state	NN	popular_lore	fiction	A5	A	AB	ABC	united_states%1:15:00::	A51	A	AB	ABC	 and disappointed Swiss who turned their eyes toward the United <font color=green>States</font> . Observing their distressing condition, Colonel Snelling allowed these half starved	NNPS	informative	1	0	1.83	0	3	States
state/NN/br-f17/1627	0.0673419138305531	-0.00846064629464391	state	NN	popular_lore	fiction	A5	A	AB	ABC	united_states%1:15:00::	A51	A	AB	ABC	 Swiss also decided to cast their lot with the United <font color=green>States</font> , and in 1823 several families paid guides to take them	NNPS	informative	1	0	1.49	0	4	States
state/NN/br-f17/1774	0.218826750512465	0.0304762679882349	state	NN	popular_lore	fiction	A5	A	AB	ABC	united_states%1:15:00::	A51	A	AB	ABC	 as Vevay, Indiana, a notable Swiss center in the United <font color=green>States</font> . In 1837, 157 Red River people with more than 200	NNPS	informative	2	1	1.77	0.5	3	States
state/NN/br-f17/548	-0.0168350851170653	-0.064161399937203	state	NN	popular_lore	fiction	A5	A	AB	ABC	united_states%1:15:00::	A51	A	AB	ABC	 of Congress forced the foreign firm out of the United <font color=green>States</font> , its British born employees, now become American citizens- Joseph Rolette	NNPS	informative	1	0	1.86	0	4	States
state/NN/br-f17/743	0.112817363791704	0.072907143960302	state	NN	popular_lore	fiction	A5	A	AB	ABC	united_states%1:15:00::	A51	A	AB	ABC	 return to the Atlantic coast by way of the United <font color=green>States</font> . In September 1817 at Fort Daer( Pembina) Dickson met the	NNPS	informative	1	0	1.47	0	3	States
state/NN/br-f17/794	0.117309056665356	-0.109849949772599	state	NN	popular_lore	fiction	A5	A	AB	ABC	united_states%1:15:00::	A51	A	AB	ABC	 route through Illinois territory to Indiana and the eastern United <font color=green>States</font>  was the best route for goods from England to reach	NNPS	informative	1	0	1.78	0	5	States
state/NN/br-f17/811	0.223846650094465	-0.110342884977005	state	NN	popular_lore	fiction	A5	A	AB	ABC	united_states%1:15:00::	A51	A	AB	ABC	 from England to reach Red River and that the United <font color=green>States</font>  was a better source of supply for many goods than	NNPS	informative	1	0	1.66	0	2	States
state/NN/br-f17/844	0.0187067735543396	-0.0430748253174634	state	NN	popular_lore	fiction	C	C	C	ABC	secretary_of_state%1:18:01::	C1	C	C	ABC	 on December 22 wrote to John Quincy Adams, Secretary of <font color=green>State</font>  at Washington, inquiring about laws covering trade with`` Missouri and	NNP	informative	2	2	1.49	1	6	State
state/NN/br-f19/1831	-0.190996258636507	-0.077851614314843	state	NN	popular_lore	fiction	A5	A	AB	ABC	united_states%1:15:00::	A51	A	AB	ABC	 of the hundred odd folklore courses given in the United <font color=green>States</font>  survive on sentiment and nationalism alone. If one wishes to	NNPS	informative	1	0	1.55	0	3	States
state/NN/br-f19/231	0.0143560551679702	-0.187345714867305	state	NN	popular_lore	fiction	A5	A	AB	ABC	united_states%1:15:00::	A51	A	AB	ABC	 pine, and they can be applied again to the United <font color=green>States</font>  in more recent years. The popularity of local color literature	NNPS	informative	1	0	1.65	0	2	States
state/NN/br-f19/373	-0.26370174139372	-0.185868176912831	state	NN	popular_lore	fiction	A5	A	AB	ABC	united_states%1:15:00::	A51	A	AB	ABC	 of the major culture lags of the twentieth century United <font color=green>States</font> . Yet nationalism has lost few of its charms for the	NNPS	informative	1	0	1.82	0	1	States
state/NN/br-f19/619	-0.153728059344569	0.0383345652577647	state	NN	popular_lore	fiction	A	A	AB	ABC	state%1:15:01::	A	A	AB	ABC	 symbol of honesty and the father image of the uniting <font color=green>States</font> . Abraham Lincoln emerged as an incarnation of the national Constitution	NNPS	informative	4	2	1.24	0.5	3	States
state/NN/br-f20/1147	0.34587786821886	0.106502887351289	state	NN	popular_lore	fiction	D	D	D	D	state%1:03:00::	D1	D	D	D	 guest list is in itself a little parable of the <font color=green>state</font>  of American civic life at this time. It included the	NN	informative	2	0	1.04	0	1	state
state/NN/br-f22/661	-0.24326768455447	0.350134689421714	state	NN	popular_lore	fiction	A5	A	AB	ABC	united_states%1:15:00::	A51	A	AB	ABC	 the best troop in the best regiment in the United <font color=green>States</font>  Army. He fed the captain bits of history about the	NNPS	informative	1	0	1.03	0	1	States
state/NN/br-f23/1235	-0.0611346196059023	-0.072202591547116	state	NN	popular_lore	fiction	A5	A	AB	ABC	united_states%1:15:00::	A51	A	AB	ABC	 it. The evidence suggests that foreign peoples believe the United <font color=green>States</font>  is weaker than the Soviet Union, and is bound to	NNPS	informative	1	0	1.54	0	4	States
state/NN/br-f23/129	-0.0618738993344115	-0.103536874137077	state	NN	popular_lore	fiction	A5	A	AB	ABC	united_states%1:15:00::	A51	A	AB	ABC	 these conditions be enjoyed by the people of the United <font color=green>States</font> . I speak of`` the largest possible measure'' because any person	NNPS	informative	1	0	1.36	0	2	States
state/NN/br-f23/1705	-0.0483579318692137	-0.214106874705357	state	NN	popular_lore	fiction	A5	A	AB	ABC	united_states%1:15:00::	A51	A	AB	ABC	 isolation and capture, not of Ghana, but of the United <font color=green>States</font> - and this purpose may be served very well by countries	NNPS	informative	1	0	1.04	0	1	States
state/NN/br-f23/773	-0.0398401068045764	0.13616814340454	state	NN	popular_lore	fiction	A5	A	AB	ABC	united_states%1:15:00::	A51	A	AB	ABC	 over-all American strength with over-all Soviet strength finds the United <font color=green>States</font>  not only superior, but so superior both in present weapons	NNPS	informative	1	0	1.45	0	5	States
state/NN/br-f24/1198	0.178490162809144	-0.0948373173617444	state	NN	popular_lore	fiction	A5	A	AB	ABC	united_states%1:15:00::	A51	A	AB	ABC	 of Paradise. He had attended three universities in the United <font color=green>States</font> . But he had never seen the mountainous half of his	NNPS	informative	1	0	1.46	0	2	States
state/NN/br-f24/525	-0.0144895896273415	0.0682194722052228	state	NN	popular_lore	fiction	D	D	D	D	state%1:03:00::	D1	D	D	D	 11, 1960). And now, in March, all Laos suffered a <font color=green>state</font>  of siege. The Pathet Lao forces held two northern provinces	NN	informative	1	0	1.65	0	3	state
state/NN/br-f33/1948	0.283416309927341	0.28284806765028	state	NN	popular_lore	fiction	A5	A	AB	ABC	united_states%1:15:00::	A51	A	AB	ABC	 get in. In a far distant part of the United <font color=green>States</font> , I was talking to an instructor about a boy who	NNPS	informative	1	0	1.2	0	1	States
state/NN/br-g01/1187	0.240600632968709	-0.267225169715223	state	NN	belles_lettres	fiction	A	A	AB	ABC	state%1:15:01::	A	A	AB	ABC	 traditional way of life persists much more in the older <font color=green>states</font>  than in the new ones. Probably a larger percentage of	NNS	informative	5	0	2.52	0	1	states
state/NN/br-g01/1276	-0.0991643832436883	0.141983546038984	state	NN	belles_lettres	fiction	A4	A	AB	ABC	state%1:15:01::	A	A	AB	ABC	 of course, important minority enclaves. The long settled areas of <font color=green>states</font>  like Virginia and South Carolina developed the ante-bellum culture to	NNS	informative	4	1	2.11	0.25	3	states
state/NN/br-g01/1429	0.219563654472442	-0.145238851755518	state	NN	belles_lettres	fiction	A	A	AB	ABC	state%1:15:01::	A	A	AB	ABC	 by the mother country. And no doubt many people in <font color=green>states</font>  like the Carolinas and Georgia, which were among the most	NNS	informative	3	1	1.28	0.33	1	states
state/NN/br-g01/1498	0.032513789064511	0.0241788210095581	state	NN	belles_lettres	fiction	A	A	AB	ABC	state%1:15:01::	A	A	AB	ABC	 that except for Northern meddling it would have ended in <font color=green>states</font>  like Virginia years before it did. Southern resentment has been	NNS	informative	2	2	1.52	1	5	states
state/NN/br-g01/26	-0.0721383638555185	-0.204817951762664	state	NN	belles_lettres	fiction	C	C	C	ABC	welfare_state%1:14:00::	B	B	AB	ABC	 also led the nation in the direction of a welfare <font color=green>state</font> . And both in their objectives of non-discrimination and of social	NN	informative	4	2	2.29	0.5	2	state
state/NN/br-g01/454	-0.01039374157274	-0.0625635176299775	state	NN	belles_lettres	fiction	A1	A	AB	ABC	state%1:15:01::	A	A	AB	ABC	 to coerce an uncooperative Congress or Supreme Court. As for <font color=green>states</font> ' rights, they have never counted in the thinking of my	NNS	informative	4	1	1.84	0.25	4	states
state/NN/br-g02/1005	-0.0136101326636333	-0.0844739716237772	state	NN	belles_lettres	fiction	A	A	AB	ABC	Z	Z	Z	Z	Z	 national responsibility for local economic distress won out over a`` <font color=green>state</font>  's- responsibility'' proposal- provision was made for payment for unemployment	NN	informative	4	3	1.5	0.75	6	state
state/NN/br-g02/1113	-0.0544422933223726	-0.125852625379947	state	NN	belles_lettres	fiction	A5	A	AB	ABC	Z	Z	Z	Z	Z	 individual welfare is a concept not limited to the United <font color=green>States</font>  or even to the Western nations. A measure of its	NNPS	informative	1	0	1.77	0	3	States
state/NN/br-g02/1335	-0.0475118010906387	-0.0865466514183958	state	NN	belles_lettres	fiction	C	C	C	ABC	Z	Z	Z	Z	Z	 better or for worse, we all now live in welfare <font color=green>states</font> , the organizing principle of which is collective responsibility for individual	NNS	informative	4	4	1.78	1	5	states
state/NN/br-g02/1584	-0.0965626983729368	0.0686881259101834	state	NN	belles_lettres	fiction	A5	A	AB	ABC	Z	Z	Z	Z	Z	 nation-state coincides roughly with the separate existence of the United <font color=green>States</font>  as an independent entity, it is perhaps natural for Americans	NNPS	informative	1	0	1.15	0	3	States
state/NN/br-g02/1630	-0.168268785280045	-0.144615150447225	state	NN	belles_lettres	fiction	C	C	C	ABC	Z	Z	Z	Z	Z	 is the political principle that epitomizes and glorifies the territorial <font color=green>state</font>  as the characteristic type of socal structure. But it is	NN	informative	5	2	1.86	0.4	3	state
state/NN/br-g02/1874	-0.236309183601157	-0.185450772713027	state	NN	belles_lettres	fiction	C	C	C	ABC	Z	Z	Z	Z	Z	 that the viability and usefulness of nationalism and the territorial <font color=green>state</font>  are rapidly dissipating at precisely the time that the nation-state	NN	informative	3	2	2.34	0.67	2	state
state/NN/br-g02/253	-0.024702979362291	-0.102598249031804	state	NN	belles_lettres	fiction	B	B	AB	ABC	Z	Z	Z	Z	Z	 was paid by statesman or scholar to an idea of <font color=green>state</font>  responsibility, either internally or externally. This was particularly true in	NN	informative	2	2	1.59	1	3	state
state/NN/br-g02/381	-0.0753370534938764	-0.27430012045252	state	NN	belles_lettres	fiction	A5	A	AB	ABC	Z	Z	Z	Z	Z	 in motivation, however much other nations( e. g., the United <font color=green>States</font> ) may have incidentally benefited. At the same time, all suggestions	NNPS	informative	1	0	1.74	0	3	States
state/NN/br-g02/411	-0.138424763348684	-0.220824107126424	state	NN	belles_lettres	fiction	C	C	C	ABC	Z	Z	Z	Z	Z	 existed for the welfare of the people within the territorial <font color=green>state</font>  was strongly resisted. Social Darwinism was able to stave off	NN	informative	4	2	2.84	0.5	2	state
state/NN/br-g02/533	0.130385659348355	-0.238795599839153	state	NN	belles_lettres	fiction	C	C	C	ABC	Z	Z	Z	Z	Z	 was transformed from one essentially negative in nature( the`` night-watchman <font color=green>state</font> '') to one with affirmative duties to perform. The`` positive state	NN	informative	5	1	1.6	0.2	2	state
state/NN/br-g02/547	-0.0751306858842272	0.0903416248293067	state	NN	belles_lettres	fiction	C	C	C	ABC	Z	Z	Z	Z	Z	 state'') to one with affirmative duties to perform. The`` positive <font color=green>state</font> '' came into existence. For lawyers, reflecting perhaps their parochial preferences	NN	informative	3	2	1.57	0.67	4	state
state/NN/br-g02/681	-0.104222415670657	-0.187269056972936	state	NN	belles_lettres	fiction	C	C	C	ABC	Z	Z	Z	Z	Z	 the many facets of the American version of the welfare <font color=green>state</font>  have become part of the conventional wisdom. A national consensus	NN	informative	3	1	2.2	0.33	2	state
state/NN/br-g02/9	0.1540246677878	-0.181932937957341	state	NN	belles_lettres	fiction	C	C	C	ABC	Z	Z	Z	Z	Z	 In the past, the duties of the <font color=green>state</font> , as Sir Henry Maine noted long ago, were only two	NN	informative	1	1	1.52	1	2	state
state/NN/br-g03/817	0.00434654633158685	-0.0721098413961529	state	NN	belles_lettres	fiction	A5	A	AB	ABC	Z	Z	Z	Z	Z	 sweeping defense policy reappraisal by the Kennedy Administration, basic United <font color=green>States</font>  strategy has been modified- and large new sums allocated- to	NNPS	informative	1	0	1.22	0	4	States
state/NN/br-g03/875	0.0882847883222468	0.111759937220628	state	NN	belles_lettres	fiction	A5	A	AB	ABC	Z	Z	Z	Z	Z	 Soviet missiles shortly after they are launched against the United <font color=green>States</font> . BMEWS intelligence is simultaneously flashed to NORAD( North American Air	NNPS	informative	1	0	1.45	0	4	States
state/NN/br-g06/1016	0.0752895929176044	0.0246836073227284	state	NN	belles_lettres	fiction	A5	A	AB	ABC	Z	Z	Z	Z	Z	 insistence of Arturo Toscanini, Steinberg left Germany for the United <font color=green>States</font> , by way of Switzerland. After he had spent the first	NNPS	informative	1	0	1.26	0	3	States
state/NN/br-g06/1056	0.0158685557312039	0.0610181662609954	state	NN	belles_lettres	fiction	A5	A	AB	ABC	Z	Z	Z	Z	Z	 NBC Orchestra, he made numerous guest appearances throughout the United <font color=green>States</font>  and Latin America. In 1945 he became conductor of the	NNPS	informative	1	0	1.44	0	5	States
state/NN/br-g06/1295	0.187330838050449	0.136839897240105	state	NN	belles_lettres	fiction	A5	A	AB	ABC	Z	Z	Z	Z	Z	 in Munich and Cologne.`` Then I return to the United <font color=green>States</font>  for engagements at the Hollywood Bowl and in Philadelphia'', he	NNPS	informative	1	0	1.1	0	2	States
state/NN/br-g07/2008	0.14879407019325	-0.0801268916535329	state	NN	belles_lettres	fiction	A	A	AB	ABC	Z	Z	Z	Z	Z	 upon- if not displacing- affectionate ties to one 's own <font color=green>state</font> , was epitomized by Washington. His first inaugural address speaks of	NN	informative	2	1	1.17	0.5	1	state
state/NN/br-g07/2122	-0.19700238440261	0.0572372614151518	state	NN	belles_lettres	fiction	A	A	AB	ABC	Z	Z	Z	Z	Z	 former and Jefferson and Madison upholding the latter position. The <font color=green>state</font>  's rights position was formulated by Jefferson and Madison in	NN	informative	5	5	1.81	1	6	state
state/NN/br-g07/2147	0.462655250134884	-0.0494952655130802	state	NN	belles_lettres	fiction	C	C	C	ABC	Z	Z	Z	Z	Z	 Virginia Resolves, but in their later careers as heads of <font color=green>state</font>  the two proved themselves better Hamiltonians than Jeffersonians. In purchasing	NN	informative	2	1	1.51	0.5	1	state
state/NN/br-g07/2238	-0.0446268134649955	-0.0059736327612128	state	NN	belles_lettres	fiction	A	A	AB	ABC	Z	Z	Z	Z	Z	 in 1832, the South Carolina nullifiers adopted the principle of <font color=green>state</font>  interposition which Madison had advanced in his old Virginia Resolve	NN	informative	4	2	1.77	0.5	6	state
state/NN/br-g07/546	-0.0177947146755455	-0.0579487149649954	state	NN	belles_lettres	fiction	A3	A	AB	ABC	Z	Z	Z	Z	Z	 France and the peace that ended the war, headed the <font color=green>state</font>  government of Pennsylvania, and exercised an important moderating influence at	NN	informative	2	1	1.3	0.5	3	state
state/NN/br-g07/690	0.0131552950474246	0.11431242940175	state	NN	belles_lettres	fiction	A1	A	AB	ABC	Z	Z	Z	Z	Z	 of pre-Revolutionary radical ideology, wrote the constitution of his home <font color=green>state</font>  of Massachusetts, negotiated, with Franklin and Jay, the peace with	NN	informative	4	2	1.56	0.5	5	state
state/NN/br-g07/853	0.0247525480039491	-0.11005744614191	state	NN	belles_lettres	fiction	C	C	C	ABC	Z	Z	Z	Z	Z	 party in American history, and, as Jefferson 's Secretary of <font color=green>State</font>  and his successor in the Presidency, guided the nation through	NNP	informative	1	1	1.91	1	3	State
state/NN/br-g10/1095	-0.315325912838359	0.192011678658789	state	NN	belles_lettres	fiction	A5	A	AB	ABC	Z	Z	Z	Z	Z	 are the two Preambles:`` we the People of the United <font color=green>States</font> , in order to form a more perfect Union, establish Justice	NNPS	informative	1	0	1.04	0	1	States
state/NN/br-g10/1145	-0.124052332944748	-0.0925828873896428	state	NN	belles_lettres	fiction	A5	A	AB	ABC	Z	Z	Z	Z	Z	 Posterity, do ordain and establish this Constitution for the United <font color=green>States</font>  of America''.`` We the people of the Confederate States, each	NNPS	informative	1	0	1.57	0	1	States
state/NN/br-g10/1160	-0.256918614547382	-0.0549787758314417	state	NN	belles_lettres	fiction	A1	A	AB	ABC	Z	Z	Z	Z	Z	 of America''.`` We the people of the Confederate States, each <font color=green>state</font>  acting in its sovereign and independent character, in order to	NN	informative	4	2	2.33	0.5	2	state
state/NN/br-g10/1216	-0.100442633236999	0.0225470990692483	state	NN	belles_lettres	fiction	A5	A	AB	ABC	Z	Z	Z	Z	Z	 God- do ordain and establish this Constitution for the Confederate <font color=green>States</font>  of America''. One is tempted to say that, on the	NNPS	informative	3	2	1.81	0.67	3	States
