id	model.x	model.y	lemma	pos	genre	marisense	mbroad	mari3	mari2	sensekey	wnsense	wnbroad	wn3	wn2	text	newPos	newBroadGenre	cues	cuesWithWeight	meanWeight	weightedCuesRatio	weightedCW	wf	broadGenre
state/JJ/br-e21/1143	0.00442847853376951	-0.0088529727839021	state	JJ	skill_and_hobbies	A2	A	AB	ABC	state%5:00:02:public:00	A2	A	AB	ABC	 which the area is blessed. Just as the national and <font color=green>state</font>  parks place emphasis on features which are of national or	JJ	informative	3	4	3.15	1.33	7	state	tech
state/JJ/br-e21/1154	0.00511267847884158	-0.00477483937152234	state	JJ	skill_and_hobbies	A3	A	AB	ABC	state%5:00:01:public:00	A2	A	AB	ABC	 parks place emphasis on features which are of national or <font color=green>state</font>  significance, counties should seek out these features which are distinctive	JJ	informative	3	3	3.44	1	9	state	tech
state/JJ/br-e31/1555	-0.0620391913958403	0.0267073249450884	state	JJ	skill_and_hobbies	A2	A	AB	ABC	state%5:00:02:public:00	A2	A	AB	ABC	 to make their cooking easy and their sleeping comfortable. Harassed <font color=green>state</font>  park officials often have more campers than they know what	JJ	informative	2	2	3.32	1	7	state	tech
state/JJ/br-e31/651	0.0239286304285574	0.00947719228713611	state	JJ	skill_and_hobbies	A3	A	AB	ABC	state%5:00:02:public:00	A2	A	AB	ABC	 the shooting development program have proudly participated in over 53 <font color=green>state</font>  and regional workshops, at which hundreds of school administrators, teachers	JJ	informative	3	3	2.94	1	6	state	tech
state/JJ/br-g17/2159	-0.0167253065007363	-0.00787763056811256	state	JJ	belles_lettres	A2	A	AB	ABC	state%5:00:02:public:00	A2	A	AB	ABC	 is involved. How did it happen, for example, that the <font color=green>state</font>  university, that great symbol of American democracy, failed to flourish	JJ	informative	3	3	2.56	1	9	state	others
state/JJ/br-g17/2327	0.0340972651405261	-0.0176255136212271	state	JJ	belles_lettres	A2	A	AB	ABC	state%5:00:02:public:00	A2	A	AB	ABC	 been the very last of the forty-eight to establish a <font color=green>state</font>  university? The state universities of Maine, New Hampshire, And Vermont	JJ	informative	4	1	4.03	0.25	5	state	others
state/JJ/br-g17/2331	0.052861174825271	-0.0160923109617235	state	JJ	belles_lettres	A2	A	AB	ABC	state%5:00:02:public:00	A2	A	AB	ABC	 last of the forty-eight to establish a state university? The <font color=green>state</font>  universities of Maine, New Hampshire, And Vermont are older and	JJ	informative	4	2	4.27	0.5	5	state	others
state/JJ/br-g23/486	-0.0165952749557195	0.029583293475087	state	JJ	belles_lettres	A2	A	AB	ABC	state%5:00:02:public:00	A2	A	AB	ABC	 The writer took a class of college students to the <font color=green>state</font>  hospital for the mentally ill in St. Joseph, Missouri. An	JJ	informative	2	2	3.31	1	9	state	others
state/JJ/br-h11/1931	0.0151914869780419	-0.0263463873585708	state	JJ	miscellaneous	D	D	D	D	solid-state%5:00:02:solid:01	D2	D	D	D	 addition to the basic programs in wavelength standards, spectroscopy, solid <font color=green>state</font>  physics, interactions of the free electron and atomic constants which	JJ	informative	3	2	3.38	0.67	8	state	tech
state/JJ/br-h11/1986	0.0214597986651095	-0.0370928225807287	state	JJ	miscellaneous	D	D	D	D	solid-state%5:00:02:solid:01	D2	D	D	D	 the far infrared, the application of infrared techniques to solid <font color=green>state</font>  studies, and increased emphasis on high resolution instrumentation. Two data	JJ	informative	3	2	3.5	0.67	11	state	tech
state/JJ/br-h14/1724	0.133305935890678	-0.00423202720843857	state	JJ	miscellaneous	A3	A	AB	ABC	state%5:00:02:public:00	A2	A	AB	ABC	 in order to provide matching for the minimum( base) allotment, <font color=green>State</font>  funds had to equal 1954 State funds. Prior to and	JJ	informative	3	4	4.4	1.33	9	State	tech
state/JJ/br-h14/1730	0.143049564959567	6.70753396162624e-05	state	JJ	miscellaneous	A3	A	AB	ABC	state%5:00:02:public:00	A2	A	AB	ABC	 the minimum( base) allotment, State funds had to equal 1954 <font color=green>State</font>  funds. Prior to and since 1960 the rest of the	JJ	informative	4	4	4.43	1	8	State	tech
state/JJ/br-h14/1763	0.0554755247299864	-0.00097839136091137	state	JJ	miscellaneous	A3	A	AB	ABC	state%5:00:02:public:00	A2	A	AB	ABC	 fiscal capacity of the State, with a pivot of 40% <font color=green>State</font> ( or 60% Federal) participation in total program costs. The percentage	JJ	informative	2	2	3.14	1	5	State	tech
state/JJ/br-h14/1868	0.101902403602495	-0.0220613820670441	state	JJ	miscellaneous	A3	A	AB	ABC	state%5:00:02:public:00	A2	A	AB	ABC	 will be matched on the basis of a 40% pivot <font color=green>State</font>  share, with maximum and minimum State shares of 50% and	JJ	informative	5	4	4.41	0.8	7	State	tech
state/JJ/br-h14/1997	0.0332583531810291	-0.00579763991569768	state	JJ	miscellaneous	A3	A	AB	ABC	state%5:00:02:public:00	A2	A	AB	ABC	 rates. The method used for computing the respective Federal and <font color=green>State</font>  shares in total program costs is specifically set forth in	JJ	informative	4	4	3.11	1	12	State	tech
state/JJ/br-h14/332	0.0535125822944026	-0.00386029685084779	state	JJ	miscellaneous	A3	A	AB	ABC	state%5:00:02:public:00	A2	A	AB	ABC	 grants to the States on the basis of population, matching <font color=green>State</font>  expenditures on a 50 - 50 basis. Under P. L.	JJ	informative	3	1	3.3	0.33	7	State	tech
state/JJ/br-h14/360	0.0401858482318783	-0.00374320492794535	state	JJ	miscellaneous	A3	A	AB	ABC	state%5:00:02:public:00	A2	A	AB	ABC	 Congress, the Federal Government assumed responsibility for 100% of necessary <font color=green>State</font>  expenditures in connection with administration and the counseling and placement	JJ	informative	4	3	2.97	0.75	7	State	tech
state/JJ/br-h14/533	0.069503245454145	0.00699931352084673	state	JJ	miscellaneous	A3	A	AB	ABC	state%5:00:02:public:00	A2	A	AB	ABC	 the authorizations, appropriations, allotment base, Federal grants to States and <font color=green>State</font>  matching funds for this part of the grant program. In	JJ	informative	6	5	3.52	0.83	9	State	tech
state/JJ/br-h14/747	0.018244335244753	-0.00140773867680195	state	JJ	miscellaneous	A3	A	AB	ABC	state%5:00:02:public:00	A2	A	AB	ABC	 State. The provisions are also designed to avoid disruption in <font color=green>State</font>  programs already in operation, which might otherwise result from the	JJ	informative	2	2	2.79	1	9	State	tech
state/JJ/br-h15/1500	0.0341726015826321	-0.00444057832201964	state	JJ	miscellaneous	A3	A	AB	ABC	state%5:00:02:public:00	A2	A	AB	ABC	 gather its own information and will receive broad information from <font color=green>State</font>  and Federal sources. It will tell you as soon as	JJ	informative	2	2	3.02	1	7	State	tech
state/JJ/br-j38/1551	0.0265219823455793	-0.000329799838707271	state	JJ	learned	A3	A	AB	ABC	state%5:00:02:public:00	A2	A	AB	ABC	 Federal government but from an exchange of experiences among states. <font color=green>State</font>  and local agencies in the vocational education field must be	JJ	informative	4	3	2.7	0.75	9	State	tech
state/JJ/br-j38/1590	0.019129680582006	0.000495468183082148	state	JJ	learned	A3	A	AB	ABC	state%5:00:02:public:00	A2	A	AB	ABC	 Federal effort to provide research and information to help guide <font color=green>state</font>  education departments and local school boards in existing programs. A	JJ	informative	5	5	2.9	1	14	state	tech
state/JJ/br-j38/1871	0.0277616852771443	0.0070825133622985	state	JJ	learned	A3	A	AB	ABC	state%5:00:02:public:00	A2	A	AB	ABC	 for training to meet national skilled manpower needs. If only <font color=green>state</font>  funds were used to pay for the vocational education, it	JJ	informative	3	3	2.78	1	10	state	tech
state/JJ/br-j38/441	0.0262788958869363	0.00812121784628989	state	JJ	learned	A3	A	AB	ABC	state%5:00:02:public:00	A2	A	AB	ABC	 enrolled in courses organized under two special programs administered by <font color=green>state</font>  and local school authorities:( 1) Vocational Education for National Defense	JJ	informative	4	4	3.26	1	10	state	tech
state/JJ/br-j38/86	0.0517177121378688	0.000453612400879399	state	JJ	learned	A1	A	AB	ABC	state%5:00:02:public:00	A2	A	AB	ABC	 appropriation of$ 7 million to support, on a matching basis, <font color=green>state</font>  administered programs of vocational education in agriculture, trades, industrial skills	JJ	informative	4	3	3.88	0.75	8	state	tech
state/JJ/br-l14/977	-0.0442671472255988	0.0239928839372977	state	JJ	fiction_mystery	A2	A	AB	ABC	state%5:00:02:public:00	A2	A	AB	ABC	 modern, large, on five acres. Must have cost plenty. The <font color=green>State</font>  cops would check from time to time; pass word when	JJ	imaginative	1	1	2.76	1	10	State	imag
state/NN/br-a01/1015	-0.00255570746125144	-0.169465925143191	state	NN	press_reportage	A3	A	AB	ABC	state%1:14:01::	B	B	AB	ABC	 governor 's race, a top official said Wednesday. Robert Snodgrass, <font color=green>state</font>  GOP chairman, said a meeting held Tuesday night in Blue	NN	informative	3	1	1.46	0.33	2	state	others
state/NN/br-a01/1165	0.0131062051512318	0.0465800765178607	state	NN	press_reportage	A3	A	AB	ABC	state%1:14:00::	B1	B	AB	ABC	 largest hurdle the Republicans would have to face is a <font color=green>state</font>  law which says that before making a first race, one	NN	informative	2	2	1.42	1	3	state	others
state/NN/br-a01/1440	-0.0238777267607031	-0.11920842571561	state	NN	press_reportage	A3	A	AB	ABC	state%1:14:00::	B1	B	AB	ABC	 highway reconstruction bonds. The bond issue will go to the <font color=green>state</font>  courts for a friendly test suit to test the validity	NN	informative	2	1	1.74	0.5	2	state	others
state/NN/br-a01/1835	0.215901140716632	0.0492302592190837	state	NN	press_reportage	A3	A	AB	ABC	state%1:14:00::	B1	B	AB	ABC	 education, provided that such funds be received and expended'' as <font color=green>state</font>  funds. Barber, who is in his 13th year as a	NN	informative	3	2	1.8	0.67	2	state	others
state/NN/br-a02/1165	0.00178863314291451	0.0707723899970641	state	NN	press_reportage	A2	A	AB	ABC	state%1:15:01::	A	A	AB	ABC	 attorney general and chief justice of the Texas Supreme Court. <font color=green>State</font>  representatives decided Thursday against taking a poll on what kind	NNP	informative	3	2	1.64	0.67	6	State	others
state/NN/br-a02/1454	0.111790383144784	-0.0131871739595766	state	NN	press_reportage	A1	A	AB	ABC	state%1:14:01::	B	B	AB	ABC	 would increase from$ 5000000 to$ 15000000 the maximum loan the <font color=green>state</font>  could make to a local water project. Cotten construed this	NN	informative	3	0	1.34	0	2	state	others
state/NN/br-a02/165	-0.0251721491555855	0.222452414740587	state	NN	press_reportage	A1	A	AB	ABC	state%1:14:01::	B	B	AB	ABC	 the books`` since Texas was a republic''. It permits the <font color=green>state</font>  to take over bank accounts, stocks and other personal property	NN	informative	4	1	1.19	0.25	2	state	others
state/NN/br-a02/2003	0.11634125733031	0.0324640258040209	state	NN	press_reportage	A3	A	AB	ABC	state%1:14:01::	B	B	AB	ABC	 62 session upon the recommendation of Supt. Chester O. Strickland. <font color=green>State</font>  and federal legislation against racial discrimination in employment was called	NNP	informative	2	1	2.08	0.5	3	State	others
state/NN/br-a02/214	0.0504391063704986	0.0243188463656959	state	NN	press_reportage	A2	A	AB	ABC	state_treasurer%1:18:00::	A2	A	AB	ABC	 companies and other corporations to report such property to the <font color=green>state</font>  treasurer. The escheat law cannot be enforced now because it	NN	informative	3	1	1.34	0.33	4	state	others
state/NN/br-a02/470	0.101647672441789	0.0570378620750575	state	NN	press_reportage	A1	A	AB	ABC	state%1:14:00::	B1	B	AB	ABC	 in the scholastic age at a reduced cost to the <font color=green>state</font> . There was no debate as the Senate passed the bill	NN	informative	3	3	1.5	1	4	state	others
state/NN/br-a02/620	0.049159548532886	0.287865678996669	state	NN	press_reportage	A2	A	AB	ABC	state%1:15:01::	A	A	AB	ABC	 saving them from coming to Austin to live in the <font color=green>state</font>  deaf school. Dallas may get to hear a debate on	NN	informative	3	1	1.44	0.33	2	state	others
state/NN/br-b20/1056	0.058225811156514	0.0823442021953777	state	NN	press_editorial	C	C	C	ABC	state_department%1:14:00::	C1	C	C	ABC	 which will bring down the wall and reunite the city. <font color=green>State</font>  Department officials refusing to show their passes at the boundary	NNP	informative	2	2	1.68	1	3	State	others
state/NN/br-b20/358	0.0572678850019123	0.0869106078017077	state	NN	press_editorial	A5	A	AB	ABC	united_states%1:14:00::	A52	A	AB	ABC	 seek a discontinuity in the arms policy of the United <font color=green>States</font>  is the least risky path our government can take. His	NNPS	informative	1	0	1.74	0	2	States	others
state/NN/br-b20/64	0.319996725166668	-0.383442174999628	state	NN	press_editorial	A5	A	AB	ABC	united_states%1:14:00::	A52	A	AB	ABC	 what we are getting. The biggest nuclear device the United <font color=green>States</font>  has exploded measured some 15 megatons, although our B-52s are	NNPS	informative	1	0	1.71	0	1	States	others
state/NN/br-c01/1164	0.0663407222747352	-0.120880216049802	state	NN	press_reviews	C	C	C	ABC	welfare_state%1:14:00::	B	B	AB	ABC	 we should take from these pages is that the welfare <font color=green>state</font>  in England still allows wild scope for all kinds of	NN	informative	1	1	1.66	1	4	state	others
state/NN/br-d03/319	-0.212923007329527	-0.197490033044525	state	NN	religion	D	D	D	D	state%1:03:00::	D1	D	D	D	 the Roman and Anglican Churches and about the present religious <font color=green>state</font>  of England. Since the Protestant clergy for the most part	NN	informative	2	0	1.01	0	1	state	others
state/NN/br-d04/1145	-0.0594342262157984	-0.240959605453	state	NN	religion	D	D	D	D	state%1:03:00::	D1	D	D	D	 and the whole human race''. Because he interprets the primitive <font color=green>state</font>  of man as one of mere potentiality or capacity and	NN	informative	3	0	1.33	0	1	state	others
state/NN/br-d04/1599	-0.050500804101213	0.174668107842226	state	NN	religion	D	D	D	D	state%1:03:00::	D1	D	D	D	 interminable and irremediable. But He set a bound to his[ <font color=green>state</font>  of] sin, by interposing death, and thus causing sin to	NN	informative	3	0	1.19	0	1	state	others
state/NN/br-e02/1889	-0.281525232269684	-0.389018710798684	state	NN	skill_and_hobbies	D	D	D	D	state%1:03:00::	D1	D	D	D	 temperature at which it lapses into a sort of dormant <font color=green>state</font> . This cooling does not change the avocado in any way	NN	informative	3	0	2.2	0	1	state	tech
state/NN/br-e22/2361	0.0480103107661749	-0.0874288889064974	state	NN	skill_and_hobbies	A5	A	AB	ABC	united_states%1:15:00::	A51	A	AB	ABC	 indeed in the musical history of the entire eastern United <font color=green>States</font> . On that date the Musicians Emergency Fund, organized to furnish	NNPS	informative	1	0	1.52	0	4	States	tech
state/NN/br-e22/71	-0.0261597255858342	0.168248438983326	state	NN	skill_and_hobbies	A5	A	AB	ABC	united_states_of_america%1:15:00::	A51	A	AB	ABC	 Republics. The Serge Prokofieff whom we knew in the United <font color=green>States</font>  of America was gay, witty, mercurial, full of pranks and	NNPS	informative	1	0	1.57	0	1	States	tech
state/NN/br-e27/173	0.0491850818805392	-0.0609601696437973	state	NN	skill_and_hobbies	A3	A	AB	ABC	state%1:15:01::	A	A	AB	ABC	 drug is being marketed under one trade name only or <font color=green>state</font>  regulatory organizations have approved its use on the feed tag	NN	informative	3	1	1.26	0.33	3	state	tech
state/NN/br-f03/1319	-0.0830343532168583	-0.332916195066239	state	NN	popular_lore	D	D	D	D	state_of_matter%1:26:00::	D2	D	D	D	 the coexistence of the infinite number of universal, apparently momentary <font color=green>states</font>  of matter, successive one after another in consciousness, but permanent	NNS	informative	2	0	1.35	0	2	states	others
state/NN/br-f14/1295	0.230456576020367	-0.133869764202382	state	NN	popular_lore	B	B	AB	ABC	state%1:14:00::	B1	B	AB	ABC	 was attended by representatives of major organs of the German <font color=green>state</font> , including the Reich Minister of the Interior, the State Secretary	NN	informative	4	1	1.78	0.25	2	state	others
state/NN/br-f14/457	-0.0901100826393996	0.378562507419836	state	NN	popular_lore	A5	A	AB	ABC	united_states%1:15:00::	A51	A	AB	ABC	 and the tightening of Stalin 's dictatorship; in the United <font color=green>States</font>  the initiation of militant anti Communism, with the repentant ex	NNPS	informative	1	0	1.56	0	2	States	others
state/NN/br-f15/701	0.0370178094735195	-0.0294786199614617	state	NN	popular_lore	A1	A	AB	ABC	state%1:15:01::	A	A	AB	ABC	 considered by non-Catholics in family planning. The laws of many <font color=green>states</font>  permit birth control only for medical reasons. The Roman Catholic	NNS	informative	2	1	1.73	0.5	3	states	others
state/NN/br-f17/1114	0.0415025498459373	0.0964008571341165	state	NN	popular_lore	A5	A	AB	ABC	united_states%1:14:00::	A52	A	AB	ABC	 presence of a colony on the Red prompted the United <font color=green>State</font>  War Department in 1819 to send Lieutenant-Colonel Henry Leavenworth from	NNP	informative	1	0	1.64	0	3	State	others
state/NN/br-f17/1144	-0.00311226197474155	0.13193187543401	state	NN	popular_lore	A5	A	AB	ABC	united_states%1:15:00::	A51	A	AB	ABC	 of Prairie du Chien, until then the most advanced United <font color=green>States</font>  post. In September 1822 two companies of infantry arrived at	NNPS	informative	1	0	1.47	0	3	States	others
state/NN/br-f17/1330	0.0205741992387669	-0.196252702756533	state	NN	popular_lore	A5	A	AB	ABC	united_states%1:15:00::	A51	A	AB	ABC	 and disappointed Swiss who turned their eyes toward the United <font color=green>States</font> . Observing their distressing condition, Colonel Snelling allowed these half starved	NNPS	informative	1	0	1.83	0	3	States	others
state/NN/br-f17/1627	0.00760436561941251	0.0817940472229234	state	NN	popular_lore	A5	A	AB	ABC	united_states%1:15:00::	A51	A	AB	ABC	 Swiss also decided to cast their lot with the United <font color=green>States</font> , and in 1823 several families paid guides to take them	NNPS	informative	1	0	1.49	0	4	States	others
state/NN/br-f17/1774	-0.0614169008584154	0.243351566223653	state	NN	popular_lore	A5	A	AB	ABC	united_states%1:15:00::	A51	A	AB	ABC	 as Vevay, Indiana, a notable Swiss center in the United <font color=green>States</font> . In 1837, 157 Red River people with more than 200	NNPS	informative	2	1	1.77	0.5	3	States	others
state/NN/br-f17/743	-0.0606992039370444	0.1357502221033	state	NN	popular_lore	A5	A	AB	ABC	united_states%1:15:00::	A51	A	AB	ABC	 return to the Atlantic coast by way of the United <font color=green>States</font> . In September 1817 at Fort Daer( Pembina) Dickson met the	NNPS	informative	1	0	1.47	0	3	States	others
state/NN/br-f17/794	0.0251459703473138	-0.121356816542415	state	NN	popular_lore	A5	A	AB	ABC	united_states%1:15:00::	A51	A	AB	ABC	 route through Illinois territory to Indiana and the eastern United <font color=green>States</font>  was the best route for goods from England to reach	NNPS	informative	1	0	1.78	0	5	States	others
state/NN/br-f17/811	0.0260167750740451	0.23776354349208	state	NN	popular_lore	A5	A	AB	ABC	united_states%1:15:00::	A51	A	AB	ABC	 from England to reach Red River and that the United <font color=green>States</font>  was a better source of supply for many goods than	NNPS	informative	1	0	1.66	0	2	States	others
state/NN/br-f17/844	0.018957483535055	0.0434401315176266	state	NN	popular_lore	C	C	C	ABC	secretary_of_state%1:18:01::	C1	C	C	ABC	 on December 22 wrote to John Quincy Adams, Secretary of <font color=green>State</font>  at Washington, inquiring about laws covering trade with`` Missouri and	NNP	informative	2	2	1.49	1	6	State	others
state/NN/br-f19/1831	-0.0397910321148163	-0.218384747336397	state	NN	popular_lore	A5	A	AB	ABC	united_states%1:15:00::	A51	A	AB	ABC	 of the hundred odd folklore courses given in the United <font color=green>States</font>  survive on sentiment and nationalism alone. If one wishes to	NNPS	informative	1	0	1.55	0	3	States	others
state/NN/br-f19/231	0.0675354089674817	0.128151759071382	state	NN	popular_lore	A5	A	AB	ABC	united_states%1:15:00::	A51	A	AB	ABC	 pine, and they can be applied again to the United <font color=green>States</font>  in more recent years. The popularity of local color literature	NNPS	informative	1	0	1.65	0	2	States	others
state/NN/br-f19/373	0.0556017223393279	-0.322644710615815	state	NN	popular_lore	A5	A	AB	ABC	united_states%1:15:00::	A51	A	AB	ABC	 of the major culture lags of the twentieth century United <font color=green>States</font> . Yet nationalism has lost few of its charms for the	NNPS	informative	1	0	1.82	0	1	States	others
state/NN/br-f19/619	-0.0811992961058011	-0.171848444700518	state	NN	popular_lore	A	A	AB	ABC	state%1:15:01::	A	A	AB	ABC	 symbol of honesty and the father image of the uniting <font color=green>States</font> . Abraham Lincoln emerged as an incarnation of the national Constitution	NNPS	informative	4	2	1.24	0.5	3	States	others
state/NN/br-f20/1147	-0.235274846248501	0.285527400423574	state	NN	popular_lore	D	D	D	D	state%1:03:00::	D1	D	D	D	 guest list is in itself a little parable of the <font color=green>state</font>  of American civic life at this time. It included the	NN	informative	2	0	1.04	0	1	state	others
state/NN/br-f22/661	-0.447655422876794	0.0437533289270644	state	NN	popular_lore	A5	A	AB	ABC	united_states%1:15:00::	A51	A	AB	ABC	 the best troop in the best regiment in the United <font color=green>States</font>  Army. He fed the captain bits of history about the	NNPS	informative	1	0	1.03	0	1	States	others
state/NN/br-f23/1235	0.034340806092864	-0.0729186862029481	state	NN	popular_lore	A5	A	AB	ABC	united_states%1:15:00::	A51	A	AB	ABC	 it. The evidence suggests that foreign peoples believe the United <font color=green>States</font>  is weaker than the Soviet Union, and is bound to	NNPS	informative	1	0	1.54	0	4	States	others
state/NN/br-f23/129	0.0732668429178299	-0.0994373982637371	state	NN	popular_lore	A5	A	AB	ABC	united_states%1:15:00::	A51	A	AB	ABC	 these conditions be enjoyed by the people of the United <font color=green>States</font> . I speak of`` the largest possible measure'' because any person	NNPS	informative	1	0	1.36	0	2	States	others
state/NN/br-f23/1705	0.146761356482144	-0.0917839598314235	state	NN	popular_lore	A5	A	AB	ABC	united_states%1:15:00::	A51	A	AB	ABC	 isolation and capture, not of Ghana, but of the United <font color=green>States</font> - and this purpose may be served very well by countries	NNPS	informative	1	0	1.04	0	1	States	others
state/NN/br-f23/773	-0.0442105577575458	-0.186547156335912	state	NN	popular_lore	A5	A	AB	ABC	united_states%1:15:00::	A51	A	AB	ABC	 over-all American strength with over-all Soviet strength finds the United <font color=green>States</font>  not only superior, but so superior both in present weapons	NNPS	informative	1	0	1.45	0	5	States	others
state/NN/br-f24/1198	-0.0495060432314263	-0.162781734085296	state	NN	popular_lore	A5	A	AB	ABC	united_states%1:15:00::	A51	A	AB	ABC	 of Paradise. He had attended three universities in the United <font color=green>States</font> . But he had never seen the mountainous half of his	NNPS	informative	1	0	1.46	0	2	States	others
state/NN/br-f24/525	-0.0527250895145559	0.145389920337513	state	NN	popular_lore	D	D	D	D	state%1:03:00::	D1	D	D	D	 11, 1960). And now, in March, all Laos suffered a <font color=green>state</font>  of siege. The Pathet Lao forces held two northern provinces	NN	informative	1	0	1.65	0	3	state	others
state/NN/br-f33/1948	-0.355374610889124	-0.163040506582778	state	NN	popular_lore	A5	A	AB	ABC	united_states%1:15:00::	A51	A	AB	ABC	 get in. In a far distant part of the United <font color=green>States</font> , I was talking to an instructor about a boy who	NNPS	informative	1	0	1.2	0	1	States	others
state/NN/br-g01/1187	0.276674033617313	-0.0622078195309819	state	NN	belles_lettres	A	A	AB	ABC	state%1:15:01::	A	A	AB	ABC	 traditional way of life persists much more in the older <font color=green>states</font>  than in the new ones. Probably a larger percentage of	NNS	informative	5	0	2.52	0	1	states	others
state/NN/br-g01/1276	-0.124558573659859	-0.187927849940954	state	NN	belles_lettres	A4	A	AB	ABC	state%1:15:01::	A	A	AB	ABC	 of course, important minority enclaves. The long settled areas of <font color=green>states</font>  like Virginia and South Carolina developed the ante-bellum culture to	NNS	informative	4	1	2.11	0.25	3	states	others
state/NN/br-g01/1429	0.0202039894478534	0.255429603463891	state	NN	belles_lettres	A	A	AB	ABC	state%1:15:01::	A	A	AB	ABC	 by the mother country. And no doubt many people in <font color=green>states</font>  like the Carolinas and Georgia, which were among the most	NNS	informative	3	1	1.28	0.33	1	states	others
state/NN/br-g01/1498	-0.0649586195985033	0.0842604371085082	state	NN	belles_lettres	A	A	AB	ABC	state%1:15:01::	A	A	AB	ABC	 that except for Northern meddling it would have ended in <font color=green>states</font>  like Virginia years before it did. Southern resentment has been	NNS	informative	2	2	1.52	1	5	states	others
state/NN/br-g01/26	0.136489942084421	-0.115878155125565	state	NN	belles_lettres	C	C	C	ABC	welfare_state%1:14:00::	B	B	AB	ABC	 also led the nation in the direction of a welfare <font color=green>state</font> . And both in their objectives of non-discrimination and of social	NN	informative	4	2	2.29	0.5	2	state	others
