id	model.x	model.y	lemma	pos	genre	marisense	mbroad	mari3	mari2	sensekey	wnsense	wnbroad	wn3	wn2	text	newPos	newBroadGenre	cues	cuesWithWeight	meanWeight	weightedCuesRatio	weightedCW	wf	broadGenre
state/NN/br-g01/454	0.0303282688668141	-0.0366105428355624	state	NN	belles_lettres	A1	A	AB	ABC	state%1:15:01::	A	A	AB	ABC	 to coerce an uncooperative Congress or Supreme Court. As for <font color=green>states</font> ' rights, they have never counted in the thinking of my	NNS	informative	4	1	1.84	0.25	4	states	others
state/NN/br-g17/2109	0.0952159866732453	0.369137579216901	state	NN	belles_lettres	A5	A	AB	ABC	united_states%1:15:00::	A51	A	AB	ABC	 the chief universities, colleges, and preparatory schools of the United <font color=green>States</font> . Why should this be so? It is true that New	NNPS	informative	1	0	1.83	0	1	States	others
state/NN/br-g17/2194	-0.0878900001054648	-0.140605915767023	state	NN	belles_lettres	A	A	AB	ABC	state%1:15:01::	A	A	AB	ABC	 country? Is n't it a bit odd that the three <font color=green>states</font>  of Southern New England( Massachusetts, Connecticut, and Rhode Island) have	NNS	informative	4	2	1.77	0.5	4	states	others
state/NN/br-g17/2210	0.0729643859483617	0.117926857284265	state	NN	belles_lettres	A2	A	AB	ABC	state%1:15:01::	A	A	AB	ABC	 Southern New England( Massachusetts, Connecticut, and Rhode Island) have had <font color=green>state</font>  institutions of university status only in the very recent past	NN	informative	5	2	1.96	0.4	4	state	others
state/NN/br-g17/2310	0.108423932841513	0.14153971169737	state	NN	belles_lettres	A	A	AB	ABC	state%1:15:01::	A	A	AB	ABC	 the West? Is it not ironical that Roger Williams 's <font color=green>state</font> , Rhode Island, should have been the very last of the	NN	informative	1	0	1.68	0	3	state	others
state/NN/br-g19/545	0.149681073773596	0.266563910549634	state	NN	belles_lettres	A5	A	AB	ABC	united_states%1:15:00::	A51	A	AB	ABC	 of the giant corporations in Western Europe and the United <font color=green>States</font>  dates from the period 1880- 1900. Now, although the roots	NNPS	informative	1	0	2.06	0	2	States	others
state/NN/br-g21/1159	-0.245390225617435	-0.25493168378242	state	NN	belles_lettres	A5	A	AB	ABC	united_states%1:14:00::	A52	A	AB	ABC	 During the next five years liberal leaders in the United <font color=green>States</font>  sank in the cumulative confusion attendant upon and manifested in	NNPS	informative	1	0	1.07	0	1	States	others
state/NN/br-g21/2184	-0.292268784907599	0.19479850264359	state	NN	belles_lettres	D	D	D	D	state%1:03:00::	D1	D	D	D	 to you an uncertain and uneasy, not to say confused, <font color=green>state</font>  of the public mind? What is the common man 's	NN	informative	4	2	1.56	0.5	2	state	others
state/NN/br-g21/991	0.016198996629863	-0.436131531554314	state	NN	belles_lettres	C	C	C	ABC	state%1:14:01::	B	B	AB	ABC	 the Marxist dream of a classless society under a Socialist <font color=green>State</font> . And the USSR existed as the revolutionary experiment in radical	NNP	informative	4	0	1.38	0	1	State	others
state/NN/br-g22/1822	0.108254874450067	0.0454748872860184	state	NN	belles_lettres	B	B	AB	ABC	state%1:14:01::	B	B	AB	ABC	 acting as controllers of the corporation whose responsibility to the <font color=green>state</font>  would now be defined against proprietorship because employees and proprietors	NN	informative	3	1	1.84	0.33	2	state	others
state/NN/br-g22/594	0.0822887094772756	0.0937313248242697	state	NN	belles_lettres	C	C	C	ABC	state_department%1:14:00::	C1	C	C	ABC	 of`` The Soviet Cultural Offensive'', he says,`` Long before the <font color=green>State</font>  Department organized its bureaucracy into an East-West Contacts Staff in	NNP	informative	2	1	1.72	0.5	2	State	others
state/NN/br-g22/643	0.0822190994390955	0.0999223144563062	state	NN	belles_lettres	C	C	C	ABC	state_department%1:14:00::	C1	C	C	ABC	 when the enterprising promoters of' Porgy and Bess' overrode the <font color=green>State</font>  Department to carry the contemporary' cultural warfare' behind the enemy	NNP	informative	1	1	1.79	1	2	State	others
state/NN/br-g28/1728	-0.0880941280399393	0.124854881834858	state	NN	belles_lettres	A4	A	AB	ABC	state%1:15:01::	A	A	AB	ABC	 preacher and a college and university president in four Southern <font color=green>states</font> , published the earliest of these backwoods sketches and in the	NNS	informative	1	1	1.52	1	3	states	others
state/NN/br-g43/2228	0.0076773909897161	0.180352435531001	state	NN	belles_lettres	D	D	D	D	state_of_affairs%1:26:00::	D1	D	D	D	 a search for the human significance of an event or <font color=green>state</font>  of affairs, a tendency to look at wholes rather than	NN	informative	2	1	1.25	0.5	2	state	others
state/NN/br-h09/1237	0.0426787248889178	0.0363480223727834	state	NN	miscellaneous	C	C	C	ABC	secretary_of_state%1:18:00::	C1	C	C	ABC	 development may, subject to the approval of the Secretary of <font color=green>State</font>  to assure that such activities are consistent with the foreign	NNP	informative	1	1	1.79	1	5	State	tech
state/NN/br-h09/1253	0.0745327218575233	-0.038761668941947	state	NN	miscellaneous	A5	A	AB	ABC	united_states%1:14:00::	A52	A	AB	ABC	 are consistent with the foreign policy objectives of the United <font color=green>States</font> , be expended in cooperation with public or private agencies in	NNPS	informative	1	0	1.82	0	4	States	tech
state/NN/br-h09/1279	0.0988895379743902	-0.0931149575264854	state	NN	miscellaneous	A5	A	AB	ABC	united_states%1:15:00::	A51	A	AB	ABC	 development of processes useful to the program in the United <font color=green>States</font> : And provided further, That every such contract or agreement made	NNPS	informative	1	0	1.11	0	1	States	tech
state/NN/br-h09/1332	0.0622457895933017	-0.0119988143743438	state	NN	miscellaneous	A5	A	AB	ABC	united_states%1:14:00::	A52	A	AB	ABC	 to the United States for the use of the United <font color=green>States</font>  throughout the world and for the use of the general	NNPS	informative	1	0	1.5	0	4	States	tech
state/NN/br-h09/1347	0.0197330221101931	0.0115472521813049	state	NN	miscellaneous	A5	A	AB	ABC	united_states%1:15:00::	A51	A	AB	ABC	 for the use of the general public within the United <font color=green>States</font> . Section 4 of the joint resolution of September 2, 1958	NNPS	informative	1	0	1.42	0	5	States	tech
state/NN/br-h09/14	0.0328633449126241	0.0285557120220433	state	NN	miscellaneous	A5	A	AB	ABC	united_states_of_america%1:15:00::	A51	A	AB	ABC	 by the Senate and House of Representatives of the United <font color=green>States</font>  of America in Congress assembled, That the Act of July	NNPS	informative	1	0	1.72	0	6	States	tech
state/NN/br-h09/1488	0.0462141982207655	0.024510457597122	state	NN	miscellaneous	A3	A	AB	ABC	state%1:14:01::	B	B	AB	ABC	 Congress. Upon such sale, there shall be returned to any <font color=green>State</font>  or public agency which has contributed financial assistance under section	NNP	informative	4	3	1.64	0.75	5	State	tech
state/NN/br-h09/1659	0.058652137178159	0.133157809195545	state	NN	miscellaneous	A3	A	AB	ABC	state%1:14:01::	B	B	AB	ABC	 coal and lignite mines); and the scope and adequacy of <font color=green>State</font>  mine safety laws applicable to such mines and the enforcement	NNP	informative	3	3	1.78	1	7	State	tech
state/NN/br-h09/1709	0.207424977647848	-0.164093984957387	state	NN	miscellaneous	A4	A	AB	ABC	state%1:14:01::	B	B	AB	ABC	 of, any metal or nonmetallic mine which is in a <font color=green>State</font> ( excluding any coal or lignite mine), the products of which	NNP	informative	3	2	1.34	0.67	3	State	tech
state/NN/br-h09/172	0.148847863818862	0.0590483031207083	state	NN	miscellaneous	A5	A	AB	ABC	united_states%1:15:00::	A51	A	AB	ABC	 other mineralized or chemically charged water, and the term' United <font color=green>States</font> ' extends to and includes the District of Columbia, the Commonwealth	NNPS	informative	1	0	2.52	0	4	States	tech
state/NN/br-h09/1779	0.209999292300144	0.0393993540485265	state	NN	miscellaneous	A5	A	AB	ABC	united_states%1:14:00::	A52	A	AB	ABC	 Commonwealth of Puerto Rico and any possession of the United <font color=green>States</font> ; and the term`` commerce'' means commerce between any State and	NNPS	informative	1	0	2.33	0	7	States	tech
state/NN/br-h09/1791	0.116389609036248	0.0796688183275236	state	NN	miscellaneous	A4	A	AB	ABC	state%1:14:01::	B	B	AB	ABC	 United States; and the term`` commerce'' means commerce between any <font color=green>State</font>  and any place outside thereof, or between points within the	NNP	informative	4	5	2.05	1.25	7	State	tech
state/NN/br-h09/1804	0.105877235481033	0.132770546426941	state	NN	miscellaneous	A4	A	AB	ABC	state%1:14:01::	B	B	AB	ABC	 any place outside thereof, or between points within the same <font color=green>State</font>  but through any place outside thereof. The Secretary of the	NNP	informative	4	2	2.26	0.5	6	State	tech
state/NN/br-h09/1886	0.0336626106189326	0.0440736784619767	state	NN	miscellaneous	A5	A	AB	ABC	united_states_of_america%1:15:00::	A51	A	AB	ABC	 by the Senate and House of Representatives of the United <font color=green>States</font>  of America in Congress assembled, That the Secretary of the	NNPS	informative	1	0	1.93	0	6	States	tech
state/NN/br-h09/197	0.16944549250513	-0.000266469559426733	state	NN	miscellaneous	A5	A	AB	ABC	united_states%1:14:00::	A52	A	AB	ABC	 Puerto Rico, and the territories and possessions of the United <font color=green>States</font> . In order to accomplish the purposes of this Act, the	NNPS	informative	1	0	1.94	0	3	States	tech
state/NN/br-h09/431	0.146761356482144	-0.0917839598314235	state	NN	miscellaneous	A5	A	AB	ABC	united_states%1:15:00::	A51	A	AB	ABC	 for beneficial consumptive purposes in various parts of the United <font color=green>States</font>  by the leading saline water processes as compared with other	NNPS	informative	1	0	1.04	0	1	States	tech
state/NN/br-h09/634	0.0786538359927387	-0.0946336707407381	state	NN	miscellaneous	A5	A	AB	ABC	united_states%1:15:00::	A51	A	AB	ABC	 and, in the case of projects located in the United <font color=green>States</font> , cooperate and participate in their development in instances in which	NNPS	informative	1	0	1.53	0	3	States	tech
state/NN/br-h09/704	0.144432998262556	0.0361435651021789	state	NN	miscellaneous	A3	A	AB	ABC	state_department%1:14:01::	C2	C	C	ABC	 projects; and cooperate with other Federal departments and agencies, with <font color=green>State</font>  and local departments, agencies, and instrumentalities, and with interested persons	NNP	informative	4	5	2.26	1.25	6	State	tech
state/NN/br-h09/859	0.0834707322214244	0.0319633321439022	state	NN	miscellaneous	A5	A	AB	ABC	united_states%1:15:00::	A51	A	AB	ABC	 the objectives of this Act. All research within the United <font color=green>States</font>  contracted for, sponsored, cosponsored, or authorized under authority of this	NNPS	informative	1	0	1.71	0	5	States	tech
state/NN/br-h11/1680	-0.0224945227427436	0.183448159168032	state	NN	miscellaneous	A5	A	AB	ABC	united_states%1:15:00::	A51	A	AB	ABC	 Canada, The Netherlands, United Kingdom, U. S. S. R., United <font color=green>States</font> , and West Germany, met at the NBS to devise means	NNPS	informative	1	0	1.22	0	3	States	tech
state/NN/br-h12/1064	0.303318371199707	0.126622895588082	state	NN	miscellaneous	A5	A	AB	ABC	united_states%1:14:00::	A52	A	AB	ABC	 8, as reimbursement for the expenses incurred by the United <font color=green>States</font> , an amount equal to 5 per centum of such payment	NNPS	informative	1	0	1.68	0	2	States	tech
state/NN/br-h12/1180	0.141685469371304	0.201518387408755	state	NN	miscellaneous	A5	A	AB	ABC	united_states%1:14:00::	A52	A	AB	ABC	 or persons found by the Comptroller General of the United <font color=green>States</font>  to be entitled thereto, without the necessity of compliance with	NNPS	informative	1	0	1.28	0	1	States	tech
state/NN/br-h12/12	0.084370547468312	0.063623448723583	state	NN	miscellaneous	A5	A	AB	ABC	united_states%1:14:00::	A52	A	AB	ABC	 In addition to the penalties provided in title 18, United <font color=green>States</font>  Code, section 1001, any person guilty of any act, as	NNPS	informative	1	0	1.41	0	4	States	tech
state/NN/br-h12/1261	0.141685469371304	0.201518387408755	state	NN	miscellaneous	A5	A	AB	ABC	united_states%1:14:00::	A52	A	AB	ABC	 or persons found by the Comptroller General of the United <font color=green>States</font>  to be entitled thereto; if a receiver or trustee for	NNPS	informative	1	0	1.28	0	1	States	tech
state/NN/br-h12/1291	0.151701314607542	0.0426808223953233	state	NN	miscellaneous	A5	A	AB	ABC	united_states%1:15:00::	A51	A	AB	ABC	 appointed by a court of competent jurisdiction in the United <font color=green>States</font>  and has not been discharged prior to the date of	NNPS	informative	1	0	2	0	6	States	tech
state/NN/br-h12/1345	0.0953707345187022	0.0581725051491653	state	NN	miscellaneous	A5	A	AB	ABC	united_states%1:15:00::	A51	A	AB	ABC	 appointed by a court of competent jurisdiction in the United <font color=green>States</font> , makes an assignment of the claim, or any part thereof	NNPS	informative	1	0	2.16	0	6	States	tech
state/NN/br-h12/1473	0.19689600135521	0.116095726447487	state	NN	miscellaneous	A5	A	AB	ABC	united_states%1:14:00::	A52	A	AB	ABC	 of the Treasury, or the Comptroller General of the United <font color=green>States</font> , as the case may be, shall find that any person	NNPS	informative	1	0	1.87	0	2	States	tech
state/NN/br-h12/1519	0.0828001491561766	-0.0240884859338994	state	NN	miscellaneous	A5	A	AB	ABC	united_states%1:14:00::	A52	A	AB	ABC	 bar to recovery by any other person against the United <font color=green>States</font> , its officers, agents, or employees with respect to such payment	NNPS	informative	1	0	1.55	0	4	States	tech
state/NN/br-h12/1573	0.232360780996245	0.111985609613853	state	NN	miscellaneous	A5	A	AB	ABC	united_states%1:14:00::	A52	A	AB	ABC	 construed as the assumption of any liability by the United <font color=green>States</font>  for the payment or satisfaction, in whole or in part	NNPS	informative	1	0	1.35	0	2	States	tech
state/NN/br-h12/1613	0.215629266503946	0.0583753100979246	state	NN	miscellaneous	A5	A	AB	ABC	united_states%1:14:00::	A52	A	AB	ABC	 There are hereby created in the Treasury of the United <font color=green>States</font> ( 1) a special fund to be known as the Yugoslav	NNPS	informative	1	0	2.12	0	2	States	tech
state/NN/br-h12/1681	0.0376925244611975	0.0257709576247269	state	NN	miscellaneous	A5	A	AB	ABC	united_states%1:15:00::	A51	A	AB	ABC	 into a settlement agreement with the Government of the United <font color=green>States</font>  as described in subsection( a) of section 4 of this	NNPS	informative	1	0	1.57	0	4	States	tech
state/NN/br-h12/1839	0.0315018452200734	0.0160311123906176	state	NN	miscellaneous	A5	A	AB	ABC	united_states_dollar%1:23:00::	A52	A	AB	ABC	 a) of this section any amounts hereafter paid, in United <font color=green>States</font>  dollars, by a foreign government which has entered into a	NNPS	informative	1	0	1.51	0	4	States	tech
state/NN/br-h12/1860	0.0366585787408954	0.0174201276856307	state	NN	miscellaneous	A5	A	AB	ABC	united_states%1:15:00::	A51	A	AB	ABC	 a claims settlement agreement with the Government of the United <font color=green>States</font>  as described in subsection( a) of section 4 of this	NNPS	informative	1	0	1.6	0	5	States	tech
state/NN/br-h12/2127	0.121148651331678	0.0628576776616272	state	NN	miscellaneous	C	C	C	ABC	secretary_of_state%1:18:01::	C1	C	C	ABC	 of the Treasury, upon the concurrence of the Secretary of <font color=green>State</font> , is authorized and directed, out of the sum covered into	NNP	informative	3	3	1.91	1	5	State	tech
state/NN/br-h12/2215	0.125714130511049	0.0895391671304236	state	NN	miscellaneous	C	C	C	ABC	secretary_of_state%1:18:01::	C1	C	C	ABC	 of the Yugoslav Claims Agreement of 1948. The Secretary of <font color=green>State</font>  shall certify to the Secretary of the Treasury the total	NNP	informative	3	4	2.26	1.33	4	State	tech
state/NN/br-h12/2273	0.0985228144676012	0.0531075137808519	state	NN	miscellaneous	A5	A	AB	ABC	united_states%1:14:00::	A52	A	AB	ABC	 other official or department, agency, or establishment of the United <font color=green>States</font> . There is hereby authorized to be appropriated, out of any	NNPS	informative	1	0	2.06	0	4	States	tech
state/NN/br-h12/298	0.126345415194787	0.0264063714164248	state	NN	miscellaneous	A5	A	AB	ABC	united_states%1:15:00::	A51	A	AB	ABC	 of the provisions of this subsection. Whoever, in the United <font color=green>States</font>  or elsewhere, pays or offers to pay, or promises to	NNPS	informative	1	0	1.59	0	4	States	tech
state/NN/br-h12/457	0.054567051354259	0.0262130209045842	state	NN	miscellaneous	A5	A	AB	ABC	united_states%1:14:00::	A52	A	AB	ABC	 of Justice as may be necessary to represent the United <font color=green>States</font>  as to any claims of the Government of the United	NNPS	informative	3	1	1.62	0.33	3	States	tech
state/NN/br-h12/468	0.0956726351759954	0.0171013980931523	state	NN	miscellaneous	A5	A	AB	ABC	united_states%1:15:00::	A51	A	AB	ABC	 as to any claims of the Government of the United <font color=green>States</font>  with respect to which the Commission has jurisdiction under this	NNPS	informative	1	0	1.93	0	5	States	tech
state/NN/br-h12/691	0.0480972292136735	0.0407774040664174	state	NN	miscellaneous	C	C	C	ABC	secretary_of_state%1:18:01::	C1	C	C	ABC	 fact and not subject to review by the Secretary of <font color=green>State</font>  or any other official, department, agency, or establishment of the	NNP	informative	3	3	2	1	6	State	tech
state/NN/br-h12/706	0.0565921441832039	0.0516048461141978	state	NN	miscellaneous	A5	A	AB	ABC	united_states%1:14:00::	A52	A	AB	ABC	 any other official, department, agency, or establishment of the United <font color=green>States</font>  or by any court by mandamus or otherwise. The Commission	NNPS	informative	1	0	1.98	0	3	States	tech
state/NN/br-h12/810	0.0623778770090369	0.0508484525872428	state	NN	miscellaneous	C	C	C	ABC	secretary_of_state%1:18:01::	C1	C	C	ABC	 the Secretary of the Treasury and to the Secretary of <font color=green>State</font>  copies of the awards made in favor of the Government	NNP	informative	3	4	1.88	1.33	7	State	tech
state/NN/br-h12/824	0.0494232002132164	0.0183174148191023	state	NN	miscellaneous	A5	A	AB	ABC	united_states%1:15:00::	A51	A	AB	ABC	 awards made in favor of the Government of the United <font color=green>States</font>  or of nationals of the United States under this Title	NNPS	informative	1	0	1.46	0	5	States	tech
state/NN/br-h12/831	0.0887560449706317	0.0247350451938111	state	NN	miscellaneous	A5	A	AB	ABC	united_states%1:15:00::	A51	A	AB	ABC	 of the United States or of nationals of the United <font color=green>States</font>  under this Title. The Commission shall certify to the Secretary	NNPS	informative	1	0	1.61	0	3	States	tech
state/NN/br-h12/844	0.0766870021663098	0.0652235904343952	state	NN	miscellaneous	C	C	C	ABC	secretary_of_state%1:18:01::	C1	C	C	ABC	 this Title. The Commission shall certify to the Secretary of <font color=green>State</font> , upon his request, copies of the formal submissions of claims	NNP	informative	1	1	1.68	1	5	State	tech
state/NN/br-h13/1432	0.0669045033642017	0.265505283390431	state	NN	miscellaneous	A5	A	AB	ABC	united_states%1:15:00::	A51	A	AB	ABC	 and planes in Cuba jeopardize the security of the United <font color=green>States</font> , violate the Monroe Doctrine, and threaten the security of every	NNPS	informative	1	0	1.76	0	4	States	tech
state/NN/br-h13/1525	0.0929854950051948	-0.0864792646045762	state	NN	miscellaneous	A5	A	AB	ABC	united_states%1:15:00::	A51	A	AB	ABC	 Cuba off the Inter-American Defense Board. For years the United <font color=green>States</font>  had been trying to get these countries to exclude Castro	NNPS	informative	1	0	1.42	0	3	States	tech
state/NN/br-h13/1758	0.111816415721857	-0.193486754474266	state	NN	miscellaneous	A5	A	AB	ABC	united_states%1:14:00::	A52	A	AB	ABC	 and agents to threaten the Americas. How can the United <font color=green>States</font>  act? Blockade is one answer offered by experts. In it	NNPS	informative	2	0	1.38	0	3	States	tech
state/NN/br-h13/1947	0.063247980650872	0.249175653009172	state	NN	miscellaneous	A5	A	AB	ABC	united_states%1:14:00::	A52	A	AB	ABC	 most severe reprisal, short of declared war, that the United <font color=green>States</font>  could invoke against Castro. It is the strategy of blockade	NNPS	informative	1	0	1.68	0	3	States	tech
state/NN/br-h14/1016	0.163441507793594	-0.0274230540101288	state	NN	miscellaneous	A	A	AB	ABC	state%1:15:01::	A	A	AB	ABC	 which bears the same ratio to 50% as the particular <font color=green>State</font>  's average per capita income bears to the average per	NNP	informative	4	3	2.17	0.75	10	State	tech
state/NN/br-h14/1049	0.0613025716007574	-0.0172167554227713	state	NN	miscellaneous	A	A	AB	ABC	state%1:15:01::	A	A	AB	ABC	 in item 3 above by the result obtained for each <font color=green>State</font>  in item 1 above.) Determine the particular State 's`` allotment	NNP	informative	3	2	2.25	0.67	8	State	tech
state/NN/br-h14/1059	0.0590428376751536	-0.0148931524064799	state	NN	miscellaneous	A	A	AB	ABC	state%1:15:01::	A	A	AB	ABC	 for each State in item 1 above.) Determine the particular <font color=green>State</font>  's`` allotment percentage''. By law this is 75% for the	NNP	informative	5	4	2.11	0.8	9	State	tech
state/NN/br-h14/1102	0.139204791262319	-0.00974704309653921	state	NN	miscellaneous	A	A	AB	ABC	state%1:15:01::	A	A	AB	ABC	 in effect prior to fiscal year 1962.) In all other <font color=green>States</font>  it is the difference obtained by subtracting from 100 the	NNPS	informative	1	0	1.77	0	3	States	tech
state/NN/br-h14/1123	0.155405245849986	-0.0293515076276915	state	NN	miscellaneous	A	A	AB	ABC	state%1:15:01::	A	A	AB	ABC	 the result obtained in item 4 above; except that no <font color=green>State</font>  shall have an allotment percentage less than 33- 1 3	NNP	informative	2	2	2.61	1	5	State	tech
state/NN/br-h14/1149	0.0704066690606269	-0.00477418558962982	state	NN	miscellaneous	A	A	AB	ABC	state%1:15:01::	A	A	AB	ABC	 more than 75%. If the resulting difference for the particular <font color=green>State</font>  is less or more than these extremes, the State 's	NNP	informative	4	2	1.82	0.5	2	State	tech
state/NN/br-h14/1159	0.14161631191014	-0.00519718803084674	state	NN	miscellaneous	A	A	AB	ABC	state%1:15:01::	A	A	AB	ABC	 particular State is less or more than these extremes, the <font color=green>State</font>  's allotment percentage must be raised or lowered to the	NNP	informative	4	2	2.39	0.5	4	State	tech
state/NN/br-h14/1175	0.0909829079379393	-0.0140518279985584	state	NN	miscellaneous	A	A	AB	ABC	state%1:15:01::	A	A	AB	ABC	 be raised or lowered to the appropriate extreme. Square each <font color=green>State</font>  's allotment percentage. Determine each State 's population.( See Source	NNP	informative	4	3	2.07	0.75	7	State	tech
state/NN/br-h14/1182	0.0946911781325758	-0.0121807633544552	state	NN	miscellaneous	A	A	AB	ABC	state%1:15:01::	A	A	AB	ABC	 appropriate extreme. Square each State 's allotment percentage. Determine each <font color=green>State</font>  's population.( See Source of Data, below for population data	NNP	informative	4	3	2.06	0.75	6	State	tech
state/NN/br-h14/1209	0.185779861284204	-0.0313125179052178	state	NN	miscellaneous	A	A	AB	ABC	state%1:15:01::	A	A	AB	ABC	 be used in this step.) Multiply the population of each <font color=green>State</font>  by the square of its allotment percentage.( Multiply result obtained	NNP	informative	3	3	2.26	1	5	State	tech
state/NN/br-h14/1251	0.064908444968603	-0.0087923720553257	state	NN	miscellaneous	A	A	AB	ABC	state%1:15:01::	A	A	AB	ABC	 the products obtained in item 8 above, for all the <font color=green>States</font> .( For each State, make all computations set forth in items	NNPS	informative	2	1	2.01	0.5	5	States	tech
state/NN/br-h14/1256	0.0473881004295756	0.000817095882662624	state	NN	miscellaneous	A	A	AB	ABC	state%1:15:01::	A	A	AB	ABC	 in item 8 above, for all the States.( For each <font color=green>State</font> , make all computations set forth in items 1 to 8	NNP	informative	1	1	1.67	1	4	State	tech
state/NN/br-h14/1278	0.12925497695305	-0.0438990528708679	state	NN	miscellaneous	A	A	AB	ABC	state%1:15:01::	A	A	AB	ABC	 8 above, and then add the results obtained for each <font color=green>State</font>  in item 8.) Determine the ratio that the amount being	NNP	informative	1	0	2.22	0	5	State	tech
state/NN/br-h14/1302	0.300376540595904	-0.0957804685415647	state	NN	miscellaneous	A	A	AB	ABC	state%1:15:01::	A	A	AB	ABC	 is to the sum of the products for all the <font color=green>States</font> .( Divide the amount being allotted by the result obtained in	NNPS	informative	3	0	1.33	0	1	States	tech
state/NN/br-h14/1323	0.0927408556317858	-0.0214710287924509	state	NN	miscellaneous	A	A	AB	ABC	state%1:15:01::	A	A	AB	ABC	 the result obtained in item 9 above.) Determine the particular <font color=green>State</font>  's unadjusted allotment for the particular fiscal year.( Multiply the	NNP	informative	4	3	2.24	0.75	8	State	tech
state/NN/br-h14/1336	0.108888605623304	-0.025096809406293	state	NN	miscellaneous	A	A	AB	ABC	state%1:15:01::	A	A	AB	ABC	 's unadjusted allotment for the particular fiscal year.( Multiply the <font color=green>State</font>  product in item 8 above by the result obtained in	NNP	informative	4	2	2.37	0.5	7	State	tech
state/NN/br-h14/1356	0.104209779760392	-0.0292079494219003	state	NN	miscellaneous	A	A	AB	ABC	state%1:15:01::	A	A	AB	ABC	 result obtained in item 10 above.) Determine if the particular <font color=green>State</font>  's unadjusted allotment( result obtained in item 11 above) is	NNP	informative	4	2	2.36	0.5	9	State	tech
