id	model.x	model.y	lemma	pos	genre	marisense	mbroad	mari3	mari2	sensekey	wnsense	wnbroad	wn3	wn2	text	newPos	newBroadGenre	cues	cuesWithWeight	meanWeight	weightedCuesRatio	weightedCW	wf	broadGenre
country/NNS/br-a10/384	0.0414349423877989	-0.0169387147564446	country	NNS	press_reportage	B3	B	B23	B	Z	Z	Z	Z	Z	 Economically, Martin said, the United States could best help foreign <font color=green>countries</font>  by helping them help themselves. Private business is more effective	NNS	informative	5	4	1.71	0.8	10	countries	others
country/NNS/br-a10/89	0.0158206381782719	0.00363213909748002	country	NNS	press_reportage	B2	B	B23	B	Z	Z	Z	Z	Z	 is married and the father of three children. Helping foreign <font color=green>countries</font>  to build a sound political structure is more important than	NNS	informative	3	3	1.52	1	13	countries	others
country/NNS/br-a16/703	0.0110123352218498	0.0655384856837741	country	NNS	press_reportage	B2	B	B23	B	Z	Z	Z	Z	Z	 Trade fair. Armed with letters from embassies to ministers of <font color=green>countries</font> , especially those in the near and far east, Mrs. Geraghty	NNS	informative	4	2	1.84	0.5	6	countries	others
country/NNS/br-a26/1144	0.157460040200763	-0.039795625439556	country	NNS	press_reportage	B3	B	B23	B	Z	Z	Z	Z	Z	 percentage of new gins in the U. S. and foreign <font color=green>countries</font>  contain machinery made in this area. The Murray Co. of	NNS	informative	3	1	1.84	0.33	5	countries	others
country/NNS/br-a34/1104	0.0796546740284345	0.0536247167124734	country	NNS	press_reportage	B	B	B14	B	Z	Z	Z	Z	Z	 would mean an unchecked spread of nuclear weapons to other <font color=green>countries</font>  as well as a fatal blow to any hope for	NNS	informative	4	3	1.82	0.75	10	countries	others
country/NNS/br-a34/1679	0.0279804052217544	-0.00834693234645602	country	NNS	press_reportage	B2	B	B23	B	Z	Z	Z	Z	Z	 major international problems that involve the interest of many other <font color=green>countries</font> . The meeting will, however, afford a timely and convenient opportunity	NNS	informative	3	3	1.63	1	9	countries	others
country/NNS/br-a34/1717	0.0853435356974052	-0.0420718837743693	country	NNS	press_reportage	B2	B	B23	B	Z	Z	Z	Z	Z	 the major issues which affect the relationships between the two <font color=green>countries</font> ''. The Vienna meeting will bring together a seasoned, 67- year-old	NNS	informative	2	1	1.8	0.5	8	countries	others
country/NNS/br-a43/1609	0.0291491475453244	-0.054424707305303	country	NNS	press_reportage	B3	B	B23	B	Z	Z	Z	Z	Z	 these: An international conference of the big textile-importing and textile-exporting <font color=green>countries</font>  will be called shortly by President Kennedy. Chief aims of	NNS	informative	4	2	1.77	0.5	8	countries	others
country/NNS/br-a43/1639	0.159884941812931	-0.00200519573985363	country	NNS	press_reportage	B3	B	B23	B	Z	Z	Z	Z	Z	 U. S. will try to get agreement among the industrialized <font color=green>countries</font>  to take more textile imports from the less-developed countries over	NNS	informative	5	3	2.26	0.6	7	countries	others
country/NNS/br-a43/1648	0.16481791209878	-0.0020860002343927	country	NNS	press_reportage	B3	B	B23	B	Z	Z	Z	Z	Z	 industrialized countries to take more textile imports from the less-developed <font color=green>countries</font>  over the years. Point is that developing countries often build	NNS	informative	5	2	2.16	0.4	8	countries	others
country/NNS/br-a43/1657	0.0672494355926817	-0.0122742039047626	country	NNS	press_reportage	B3	B	B23	B	Z	Z	Z	Z	Z	 the less-developed countries over the years. Point is that developing <font color=green>countries</font>  often build up a textile industry first, need encouragement to	NNS	informative	4	2	1.97	0.5	9	countries	others
country/NNS/br-a43/1698	0.0535047116520258	0.137530937817507	country	NNS	press_reportage	B2	B	B23	B	Z	Z	Z	Z	Z	 larger than it otherwise would. Idea is to let these <font color=green>countries</font>  earn their way as much as possible. At the same	NNS	informative	2	1	0.86	0.5	8	countries	others
country/NNS/br-a43/1723	0.057150565551571	-0.0209944390091522	country	NNS	press_reportage	B3	B	B23	B	Z	Z	Z	Z	Z	 purpose of the conference will be to get certain low-wage <font color=green>countries</font>  to control textile exports- especially dumping of specific products- to	NNS	informative	3	1	1.91	0.33	10	countries	others
country/NNS/br-a43/1738	0.178296976292906	0.030852007020166	country	NNS	press_reportage	B3	B	B23	B	Z	Z	Z	Z	Z	 textile exports- especially dumping of specific products- to high-wage textile-producing <font color=green>countries</font> . Japan, since 1957, has been`` voluntarily'' curbing exports of textiles	NNS	informative	4	0	2.38	0	4	countries	others
country/NNS/br-a43/1789	0.106563830924566	0.246289455019589	country	NNS	press_reportage	B2	B	B23	B	Z	Z	Z	Z	Z	 for several years under the`` Lancashire Pact''. None of these <font color=green>countries</font>  is happy with these arrangements. The Japanese want to increase	NNS	informative	3	2	1.68	0.67	5	countries	others
country/NNS/br-a43/1888	0.283181759084714	-0.0782773813799867	country	NNS	press_reportage	B3	B	B23	B	Z	Z	Z	Z	Z	 at the conference or through bilateral talks, the low-wage textile-producing <font color=green>countries</font>  in Asia and Europe will see that`` dumping'' practices cause	NNS	informative	4	1	3.11	0.25	4	countries	others
country/NNS/br-a43/2111	0.0674471963855508	0.0215288702487151	country	NNS	press_reportage	B3	B	B23	B	Z	Z	Z	Z	Z	 for other lines having difficulty competing with imports from low-wage <font color=green>countries</font> . Among the highest-paid workers in the world are U. S.	NNS	informative	4	2	2.1	0.5	9	countries	others
country/NNS/br-b01/1558	0.141001044595699	-0.155958294987594	country	NNS	press_editorial	B2	B	B23	B	Z	Z	Z	Z	Z	 countless schemes to do away with democratic leaders in neighboring <font color=green>countries</font>  such as President Romulo Betancourt of Venezuela. It was a	NNS	informative	4	3	1.91	0.75	6	countries	others
country/NNS/br-b05/608	0.000885523364179518	0.0134597550473637	country	NNS	press_editorial	B1	B	B14	B	Z	Z	Z	Z	Z	 the world. Mr. Freeman said that in many of the <font color=green>countries</font>  he visited on a recent world trade trip people were	NNS	informative	4	4	1.45	1	8	countries	others
country/NNS/br-b07/252	0.184717723387938	-0.0263934439336798	country	NNS	press_editorial	B	B	B14	B	Z	Z	Z	Z	Z	 from the Secretary down into political agents of the respective <font color=green>countries</font>  from which they come. The controversy now revolves mainly around	NNS	informative	4	3	1.87	0.75	8	countries	others
country/NNS/br-b11/1001	0.140794888328454	0.113211961999248	country	NNS	press_editorial	B3	B	B23	B	Z	Z	Z	Z	Z	 as part of the world menace allegedly looming over the <font color=green>countries</font>  of capitalism. Evidently the war drum beating and hysteria so	NNS	informative	3	2	2.23	0.67	6	countries	others
country/NNS/br-b13/1273	-0.0252769770504153	0.1868562316573	country	NNS	press_editorial	B1	B	B14	B	country%1:15:00::	B1	B	B1	B	 desire to visit the`` smaller, less traveled and relatively inexpensive <font color=green>countries</font> '', and is now prepared to teach modern Greek and Portuguese	NNS	informative	4	1	1.65	0.25	7	countries	others
country/NNS/br-b16/263	0.0441840512191505	-0.00240908562582814	country	NNS	press_editorial	B3	B	B23	B	Z	Z	Z	Z	Z	 any other program to solve the problems of the underdeveloped <font color=green>countries</font>  would be an investment that would pay off in world	NNS	informative	6	5	1.64	0.83	8	countries	others
country/NNS/br-b19/664	0.0761927079849527	0.0235050641298667	country	NNS	press_editorial	B2	B	B23	B	Z	Z	Z	Z	Z	 formed so that intelligent men with good intentions from all <font color=green>countries</font>  could meet and solve problems without resorting to war. Russia	NNS	informative	3	1	1.97	0.33	8	countries	others
country/NNS/br-b25/1744	0.0762750948127898	0.0383776039600982	country	NNS	press_editorial	B1	B	B14	B	Z	Z	Z	Z	Z	 and North Vietnamese liberating the southern half of their respective <font color=green>countries</font> . Perhaps Khrushchev is in a more difficult position than any	NNS	informative	2	1	1.37	0.5	9	countries	others
country/NNS/br-c07/1056	0.0040952413357706	0.000591839138909289	country	NNS	press_reviews	B4	B	B14	B	Z	Z	Z	Z	Z	 century in England, much ahead of similar revivals in other <font color=green>countries</font> . As a result no comparable literature of the period is	NNS	informative	4	3	1.48	0.75	8	countries	others
country/NNS/br-c07/1967	-0.118229998902476	0.183943797235539	country	NNS	press_reviews	B	B	B14	B	Z	Z	Z	Z	Z	 were accompanied by Anna Mi Lee, pianist. Selections from fifteen <font color=green>countries</font>  were sung as solos and duets in a broad range	NNS	informative	1	0	2.1	0	5	countries	others
country/NNS/br-c16/1019	0.0578469582766038	0.0218719197709834	country	NNS	press_reviews	B	B	B14	B	Z	Z	Z	Z	Z	 is Field Marshal Montgomery 's belief that in most Western <font color=green>countries</font>  about 60 per cent of the people do not really	NNS	informative	2	2	1.47	1	11	countries	others
country/NNS/br-c16/1072	0.129970674463915	0.029491281695518	country	NNS	press_reviews	B4	B	B14	B	Z	Z	Z	Z	Z	 are genuine Christians and believers in democracy. But these Western <font color=green>countries</font>  do care about themselves. Each feels intensely national. If, say	NNS	informative	5	4	1.94	0.8	8	countries	others
