id	model.x	model.y	lemma	pos	genre	marisense	mbroad	mari3	mari2	sensekey	wnsense	wnbroad	wn3	wn2	text	newPos	newBroadGenre	cues	cuesWithWeight	meanWeight	weightedCuesRatio	weightedCW	wf	broadGenre	wordform	msOct	mcuesOct	mcommOct	determiner	premodifier	postmodifier	building	definiteness	dgsense	number	capital	has_posm	prem_adj	prem_place	prem_name	prem_kind	comm	activity	organization	msOct4
church/NN/br-a01/2073	-0.187723047768139	-0.0260834341519967	church	NN	press_reportage	E	E	DE	CDE	church%1:04:00::	E	E	DE	CDE	 said.`` Being at the polls was just like being at <font color=green>church</font> . I did n't smell a drop of liquor, and we	NN	informative	1	0	0.95	0	9	church	others	church	c3	being at		none	NA	NA	yes	no	E	singular	no	no	no	no	no	no	no	yes	no	c
church/NN/br-a07/1303	-0.005901887629665	-0.135693228292651	church	NN	press_reportage	A	A	AB	AB	Z	Z	Z	Z	Z	 Africa, the Middle East and Latin America. Interviews with several <font color=green>church</font>  leaders have disclosed that this development has raised the question	NN	informative	3	1	1.72	0.33	7	church	others	church	a2	leaders		NA	NA	NA	no	NA	A	singular	no	no	no	no	no	no	no	NA	yes	a
church/NN/br-a07/1325	0.0336818684770739	-0.0968759799195093	church	NN	press_reportage	A	A	AB	AB	Z	Z	Z	Z	Z	 the Peace Corps will be able to prevent confusion for <font color=green>church</font>  and state over methods, means and goals. There are a	NN	informative	4	3	1.24	0.75	8	church	others	church	a1	Peace Corps;state		none	NA	NA	no	no	A	singular	no	no	no	no	no	no	no	NA	yes	a
church/NN/br-a07/1487	0.0152615777244559	-0.109771015073895	church	NN	press_reportage	A	A	AB	AB	Z	Z	Z	Z	Z	 projects and still preserve the constitutional requirement on separation of <font color=green>church</font>  and state? R. Sargent Shriver Jr., director of the corps	NN	informative	4	1	1.65	0.25	7	church	others	church	a1	constitutional requirement;state		none	NA	NA	no	no	A	singular	no	no	no	no	no	no	no	NA	yes	a
church/NN/br-a10/1754	0.0917610488969546	-0.11989171307386	church	NN	press_reportage	A	A	AB	AB	Z	Z	Z	Z	Z	 one out of three Americans has vital contact with the <font color=green>church</font> . This means that more than 100 million have no vital	NN	informative	1	1	1.33	1	6	church	others	church	d	vital contact with the;Americans		the	NA	NA	no	yes	A	singular	no	no	no	no	no	no	no	NA	no	d
church/NN/br-a10/1769	-0.0190968986202128	-0.0313976693660982	church	NN	press_reportage	A	A	AB	AB	Z	Z	Z	Z	Z	 more than 100 million have no vital touch with the <font color=green>church</font>  or religious life'', he told delegates Friday. Talking of the	NN	informative	3	3	1.49	1	8	church	others	church	d	touch with the;religious life	opposition to religious life	the	NA	NA	no	yes	A	singular	no	no	no	no	no	no	no	NA	no	d
church/NN/br-a10/1850	0.0438361403940323	-0.206928524551197	church	NN	press_reportage	C	C	C	CDE	Z	Z	Z	Z	Z	 adding that the denomination had a national goal of one <font color=green>church</font>  for every 10000 persons.`` In this light we need 1000	NN	informative	3	2	0.52	0.67	6	church	others	church	b	denomination;every 10000 persons		number	NA	NA	no	no	C	singular	no	no	no	no	no	no	yes	no	yes	b
church/NN/br-a10/1940	0.0930641257786364	-0.102627178001606	church	NN	press_reportage	A	A	AB	AB	Z	Z	Z	Z	Z	 this would necessitate some changes in methods, he said.`` The <font color=green>church</font>  's ability to change her methods is going to determine	NN	informative	1	0	1.22	0	8	church	others	church	a2	changes in methods;her methods		the	NA	NA	no	yes	A	singular	no	no	no	no	no	no	no	NA	yes	a
church/NN/br-a16/453	-0.0670833652017201	0.120939522870848	church	NN	press_reportage	D	D	DE	CDE	Z	Z	Z	Z	Z	 a small one at noon tomorrow in St. Bernadine 's <font color=green>church</font> , Forest Park. A small reception will follow in the Oak	NN	informative	4	2	1.55	0.5	6	church	others	church	c1	noon;tomorrow;in St. Bernadine’s;Forest Park;reception		none	St. Bernadine’s	NA	yes	no	D	singular	no	no	no	no	yes	no	no	no	no	c
church/NN/br-a17/1636	-0.126588397584375	0.0637743977955085	church	NN	press_reportage	D	D	DE	CDE	Z	Z	Z	Z	Z	 Gay, who were married Saturday at the Munger Place Methodist <font color=green>Church</font> . Parents of the bride are Mr. and Mrs. Ferris M.	NNP	informative	4	3	1.51	0.75	6	Church	others	Church	c1	married;Saturday;at the Munger Place;Methodist		the	Munger Place Methodist	NA	yes	yes	D	singular	yes	no	no	yes	no	yes	no	no	no	c
church/NN/br-a17/1770	-0.135484466377413	0.0757803770644294	church	NN	press_reportage	D	D	DE	CDE	Z	Z	Z	Z	Z	 College of Technology, in the chapel of the First Presbyterian <font color=green>Church</font>  of Houston. The bride, daughter of Rhodes Semmes Baker Jr.	NNP	informative	2	0	2.12	0	4	Church	others	Church	c1	chapel of the;First Presbyterian;of Houston;bride		the	First Presbyterian	NA	yes	yes	D	singular	yes	no	no	no	no	yes	no	no	no	c
church/NN/br-a17/2228	0.00316928667048768	0.0837809254225085	church	NN	press_reportage	D	D	DE	CDE	Z	Z	Z	Z	Z	 Burgher Jr. seated guests. A reception was held at the <font color=green>church</font> . The First Christian Church of Pampa was the setting for	NN	informative	5	4	2.38	0.8	8	church	others	church	c1	reception;held at the		the	NA	NA	yes	yes	D	singular	no	no	no	no	no	no	no	no	no	c
church/NN/br-a17/2233	0.00989726684354474	0.095769510617909	church	NN	press_reportage	D	D	DE	CDE	Z	Z	Z	Z	Z	 A reception was held at the church. The First Christian <font color=green>Church</font>  of Pampa was the setting for the wedding last Sunday	NNP	informative	4	2	2.22	0.5	7	Church	others	Church	c1	held;The First Christian;of Pampa;setting;wedding;Sunday		the	First Christian	of Pampa	yes	yes	D	singular	yes	yes	no	no	no	yes	no	no	no	c
church/NN/br-a21/677	0.0368710738114349	0.110522557555582	church	NN	press_reportage	D	D	DE	CDE	Z	Z	Z	Z	Z	 for 10 a. m. tomorrow in St. Anne 's Catholic <font color=green>Church</font> , 31978 Mound, in Warren. The mother and daughter, who will	NNP	informative	4	1	2.59	0.25	4	Church	others	Church	c1	10 a.m.;in St. Anne’s Catholic;Mound		none	St. Anne’s Catholic	NA	yes	no	D	singular	yes	no	no	no	yes	yes	no	no	no	c
church/NN/br-a22/1206	-0.106294088923593	0.0973406174367674	church	NN	press_reportage	B	B	AB	AB	Z	Z	Z	Z	Z	 World War 1,. He was a member of the Baptist <font color=green>church</font> . Survivors include two brothers, C. E. Killingsworth, Atlanta, and John	NN	informative	2	1	1.75	0.5	4	church	others	church	a2	member of the;Baptist		the	Baptist	NA	no	yes	B	singular	no	no	no	no	no	yes	no	NA	yes	a
church/NN/br-a22/1283	-0.068054704047229	0.0791835503907983	church	NN	press_reportage	C	C	C	CDE	Z	Z	Z	Z	Z	 painter. He was a member of the Oakland City Methodist <font color=green>Church</font>  and a native of Atlanta. Funeral services will be at	NNP	informative	2	1	1.68	0.5	7	Church	others	Church	c2	member of the;Oakland City;Methodist		the	Oakland City Methodist	NA	yes	yes	C	singular	yes	no	no	yes	no	yes	yes	no	no	c
church/NN/br-a22/307	0.0288043687390663	0.128030659855005	church	NN	press_reportage	B	B	AB	AB	Z	Z	Z	Z	Z	 challenged by the state. Emory is affiliated with the Methodist <font color=green>Church</font> . Some church leaders, both clerical and lay, have criticized the	NNP	informative	4	1	2.96	0.25	2	Church	others	Church	a2	affiliated with the;Methodist		the	Methodist	NA	no	yes	B	singular	yes	no	no	no	no	yes	no	NA	yes	a
church/NN/br-a22/310	0.0371871602848586	0.116006506044485	church	NN	press_reportage	A	A	AB	AB	Z	Z	Z	Z	Z	 the state. Emory is affiliated with the Methodist Church. Some <font color=green>church</font>  leaders, both clerical and lay, have criticized the university for	NN	informative	5	1	2.89	0.2	3	church	others	church	a2	leaders;clerical;lay		none	NA	NA	no	no	A	singular	no	no	no	no	no	no	no	NA	yes	a
church/NN/br-a31/1395	-0.132155588566128	0.114231758018387	church	NN	press_reportage	D	D	DE	CDE	Z	Z	Z	Z	Z	 from 4 to 8 p. m. Sunday at First Presbyterian <font color=green>Church</font> . At that time the second half of the Christian Youth	NNP	informative	5	1	1.02	0.2	8	Church	others	Church	c1	4 to 8 p.m.;Sunday;at First Presbyterian		none	First Presbyterian	NA	yes	no	D	singular	yes	no	no	no	no	yes	no	no	no	c
church/NN/br-a31/1542	-0.147710769157877	-0.229756598696937	church	NN	press_reportage	C	C	C	CDE	Z	Z	Z	Z	Z	 he and his wife serve as advisors at First Presbyterian <font color=green>Church</font> . And he wanted to be careful that the kids not	NNP	informative	3	0	0.69	0	6	Church	others	Church	c2	advisors at;First Presbyterian		none	First Presbyterian	NA	yes	no	C	singular	yes	no	no	no	no	yes	yes	no	no	c
church/NN/br-a31/1842	0.0392061234783704	0.182165741991984	church	NN	press_reportage	D	D	DE	CDE	Z	Z	Z	Z	Z	 planned for 10: 50 a. m. Sunday at First Christian <font color=green>Church</font> . It will be the second time the assistant manager of	NNP	informative	3	1	1.53	0.33	6	Church	others	Church	c1	10:50 a.m.;Sunday;at First Christian		none	First Christian	NA	yes	no	D	singular	yes	no	no	no	no	yes	no	no	no	c
church/NN/br-a31/2087	-0.0585823074926573	0.0861793056690863	church	NN	press_reportage	D	D	DE	CDE	Z	Z	Z	Z	Z	 Family'' at 7: 30 p. m. Sunday at Christ Lutheran <font color=green>Church</font> . Mr. and Mrs. George Treadwell will be honored at a	NNP	informative	3	0	1.36	0	6	Church	others	Church	c1	at Christ Lutheran;at 7:30 p.m.;Sunday		none	Christ Lutheran	NA	yes	no	D	singular	yes	no	no	no	yes	yes	no	no	no	c
church/NN/br-a31/2112	-0.0240566731753344	0.139808080811898	church	NN	press_reportage	D	D	DE	CDE	Z	Z	Z	Z	Z	 and program at 6 p. m. Sunday at Trinity Methodist <font color=green>Church</font> . He is the sexton of the church. A family worship	NNP	informative	3	0	1.76	0	4	Church	others	Church	c1	at 6 p.m. at;Trinity;Methodist;sexton		none	Trinity Methodist	NA	yes	no	D	singular	yes	no	no	no	yes	yes	no	no	no	c
church/NN/br-a31/2120	0.0480235833678739	0.117977453134116	church	NN	press_reportage	D	D	DE	CDE	Z	Z	Z	Z	Z	 at Trinity Methodist Church. He is the sexton of the <font color=green>church</font> . A family worship service will follow the program at 7	NN	informative	4	2	1.74	0.5	7	church	others	church	c2	sexton;Trinity Methodist Church		the	NA	NA	yes	yes	D	singular	no	no	no	no	no	no	yes	no	no	c
church/NN/br-a31/2172	-0.0408506689574718	0.110200125132301	church	NN	press_reportage	C	C	C	CDE	Z	Z	Z	Z	Z	 service marking National Family Week. Every family of Riviera Presbyterian <font color=green>Church</font>  has been asked to read the Bible and pray together	NNP	informative	6	6	1.07	1	12	Church	others	Church	c2	family of;Riviera Presbyterian;read the Bible		none	Riviera Presbyterian	NA	yes	no	C	singular	yes	no	no	yes	no	yes	yes	no	no	c
church/NN/br-a31/2212	-0.0882892252199057	0.0972998902121584	church	NN	press_reportage	C	C	C	CDE	Z	Z	Z	Z	Z	 participate. To start the week of special programs at the <font color=green>church</font> , the Rev. John D. Henderson will preach on`` A Successful	NN	informative	4	2	1.23	0.5	7	church	others	church	c3	special programs at the		the	NA	NA	yes	yes	C	singular	no	no	no	no	no	no	no	yes	no	c
church/NN/br-a31/2241	-0.182497285344822	-0.0644630143204601	church	NN	press_reportage	C	C	C	CDE	Z	Z	Z	Z	Z	 40 and 11 a. m. Sunday. New officers of the <font color=green>church</font>  will be ordained and installed at the 7: 30 p.	NN	informative	4	2	1.08	0.5	3	church	others	church	a2	officers of the;ordained;installed	the date and time might be confusing for the model if it learns to connect them to the building sense	the	NA	NA	no	yes	C	singular	no	no	no	no	no	no	no	NA	yes	a
church/NN/br-a31/2280	-0.0920602961393639	0.0662833076434497	church	NN	press_reportage	C	C	C	CDE	Z	Z	Z	Z	Z	 held at 6: 15 p. m. Monday and the annual <font color=green>church</font>  picnic at 4 p. m. next Saturday. The week will	NN	informative	3	3	2.14	1	7	church	others	church	b1	picnic;Saturday		NA	NA	NA	no	NA	C	singular	no	no	no	no	no	no	yes	yes	no	b
church/NN/br-b08/1866	0.0195078102689327	0.124844020690106	church	NN	press_editorial	D	D	DE	CDE	Z	Z	Z	Z	Z	 wrote after almost a decade of service to this majestic <font color=green>church</font> .`` Such a church needs vigor and vitality in its rector	NN	informative	2	0	2.03	0	7	church	others	church	c1	decade of service to;majestic	the building is majestic, but to what degree is the service to the building rather than its community?	this	majestic	NA	yes	yes	D	singular	no	no	yes	no	no	no	no	no	no	c
church/NN/br-b08/1871	0.031173714780138	0.154374846877228	church	NN	press_editorial	C	C	C	CDE	Z	Z	Z	Z	Z	 a decade of service to this majestic church.`` Such a <font color=green>church</font>  needs vigor and vitality in its rector and one man	NN	informative	4	2	2.46	0.5	4	church	others	church	c2	vigor;vitality;rector	the token actually conflates the sense of building and community (the building is magnificent, thus the rector must be awesome)	a	NA	NA	yes	no	C	singular	no	no	no	no	no	no	yes	no	no	c
church/NN/br-b08/1912	0.0131386299628231	-0.133500505808394	church	NN	press_editorial	C	C	C	CDE	Z	Z	Z	Z	Z	 stay`` beyond the time that his leadership should benefit'' his <font color=green>church</font> , he wrote,`` for he becomes ordinary''. And so the young	NN	informative	2	1	1.72	0.5	5	church	others	church	b	leadership;his		his	NA	NA	no	yes	C	singular	no	no	no	no	no	no	yes	no	yes	b
church/NN/br-b08/2063	0.0133031572711894	-0.255584147046738	church	NN	press_editorial	C	C	C	CDE	Z	Z	Z	Z	Z	 gives himself to God and to the believers of his <font color=green>church</font>  takes upon himself a life of giving. He does not	NN	informative	4	1	1.23	0.25	3	church	others	church	a2	believers of his	it could also be b	his	NA	NA	no	yes	A	singular	no	no	no	no	no	no	no	NA	yes	a
church/NN/br-b08/2245	-0.159593797379656	0.209721388000837	church	NN	press_editorial	E	E	DE	CDE	Z	Z	Z	Z	Z	 them to bestow saintliness upon us in return for ostentatious <font color=green>church</font>  attendance and a few bucks a week, American cash. If	NN	informative	1	0	1.27	0	3	church	others	church	c3	attendance;bucks a week		NA	NA	NA	yes	NA	E	singular	no	no	no	no	no	no	no	yes	no	c
church/NN/br-b08/2363	-0.105026610524462	0.0108514347095909	church	NN	press_editorial	D	D	DE	CDE	Z	Z	Z	Z	Z	 through him. But how little love we give him. The <font color=green>church</font>  truly is not a rest home for saints, but a	NN	informative	3	2	0.98	0.67	6	church	others	church	c1	rest home;saints	In the greater text, the building aspect is very much active, but with ‘going to...’ as a proxy for being religious and participating and so all the cs at the same time	the	NA	NA	yes	yes	D	singular	no	no	no	no	no	no	no	no	no	c
church/NN/br-b12/2009	0.167766935939722	-0.0555996034616245	church	NN	press_editorial	A	A	AB	AB	Z	Z	Z	Z	Z	 new version retains, however, the old phrase`` angel of the <font color=green>church</font> '' which Biblical scholars have previously interpreted as meaning bishop. This	NN	informative	4	2	1.81	0.5	8	church	others	church	a1	angel of the;bishop		the	NA	NA	no	yes	A	singular	no	no	no	no	no	no	no	NA	yes	a
church/NN/br-b12/2115	0.0167356473334962	0.219710786584784	church	NN	press_editorial	A	A	AB	AB	Z	Z	Z	Z	Z	 and Greek and other ancient writings, some by the early <font color=green>church</font>  fathers, in themselves called for a restudy of the Bible	NN	informative	5	1	2.42	0.2	3	church	others	church	a1	the early;fathers		NA	early	NA	no	NA	A	singular	no	no	no	no	no	yes	no	NA	yes	a
church/NN/br-b12/2217	0.00637753341096538	0.0609158566510305	church	NN	press_editorial	B	B	AB	AB	Z	Z	Z	Z	Z	 of a joint committee made up of representatives of the <font color=green>Church</font>  of England, Church of Scotland, Methodist Church, Congregational Union, Baptist	NNP	informative	6	1	2.12	0.17	6	Church	others	Church	a2	the;of England	capital letter, definiteness, posmodifier	the	NA	of England	no	yes	B	singular	yes	yes	no	no	no	no	no	NA	yes	a
church/NN/br-b12/2226	0.0580589068706579	0.0870158590701822	church	NN	press_editorial	B	B	AB	AB	Z	Z	Z	Z	Z	 representatives of the Church of England, Church of Scotland, Methodist <font color=green>Church</font> , Congregational Union, Baptist Union, Presbyterian Church of England, Churches in	NNP	informative	7	2	3.36	0.29	4	Church	others	Church	a2	Methodist		the	Methodist	NA	no	yes	B	singular	yes	no	no	no	no	yes	no	NA	yes	a
church/NN/br-b12/2235	0.0562071122932226	0.0533611346703756	church	NN	press_editorial	B	B	AB	AB	Z	Z	Z	Z	Z	 Church of Scotland, Methodist Church, Congregational Union, Baptist Union, Presbyterian <font color=green>Church</font>  of England, Churches in Wales, Churches in Ireland, Society of	NNP	informative	9	3	3	0.33	5	Church	others	Church	a2	Presbyterian;of England	I think this is part of the same enumeration preceded by a ‘the’, so I will add it even though it doesn’t show in the shorter context	the	Presbyterian	of England	no	yes	B	singular	yes	yes	no	no	no	yes	no	NA	yes	a
church/NN/br-b15/1190	-0.0544309060954514	0.229461383495554	church	NN	press_editorial	C	C	C	CDE	Z	Z	Z	Z	Z	 El; Rev. DeWitt Clemens, pastor of the Mathewson Street Methodist <font color=green>Church</font> ; Mr. Felix Miranda, of the Imperial Knife Co.; and to	NNP	informative	2	1	2.64	0.5	2	Church	others	Church	c2	pastor;Mathewson Street Methodist		the	Mathewson Street Methodist	NA	yes	yes	C	singular	yes	no	no	yes	no	yes	yes	no	no	c
church/NN/br-b18/1829	-0.0788566522704797	-0.0384034183940678	church	NN	press_editorial	C	C	C	CDE	Z	Z	Z	Z	Z	 the Women 's Association of the Trumbull Ave. United Presbyterian <font color=green>Church</font> , considerable use was made of material from The Detroit News	NNP	informative	4	1	1.4	0.25	5	Church	others	Church	c2	Women’s Association of the;Trumbull Ave.;United Presbyterian		the	Trumbull Ave. United Presbyterian	NA	yes	yes	C	singular	yes	no	no	yes	no	yes	yes	no	no	c
church/NN/br-b24/1259	-0.030561894778307	-0.0528676065483168	church	NN	press_editorial	C	C	C	CDE	Z	Z	Z	Z	Z	 or less native. Sometimes they get their initial experience in <font color=green>church</font>  haflis, conducted by Lebanese and Syrians in the U. S.	NN	informative	2	1	1.2	0.5	7	church	others	church	b1	haflis		NA	NA	NA	no	NA	?	singular	no	no	no	no	no	no	yes	yes	no	b
church/NN/br-d01/1628	-0.128991051005941	-0.148239046301295	church	NN	religion	B	B	AB	AB	church%1:14:00::	B	B	AB	AB	 age to whip men into a surrender to a particular <font color=green>church</font>  or church-state''. Apparently he does not intend that those who	NN	informative	3	2	1.45	0.67	7	church	others	church	a2	particular	the particular branch is not specified, but the fact that it’s one out of many is explicited	a	NA	NA	no	no	B	singular	no	no	no	no	no	no	no	NA	yes	a
church/NN/br-d02/1641	0.116214545136929	0.107758562113305	church	NN	religion	B	B	AB	AB	church%1:14:00::	B	B	AB	AB	 concerned to stand squarely within the tradition of the apostolic <font color=green>church</font> , they have exhibited no willingness whatever to sacrifice their modernity	NN	informative	2	1	2.36	0.5	4	church	others	church	a2	tradition;apostolic		the	apostolic	NA	no	yes	B	singular	no	no	no	no	no	yes	no	NA	yes	a
church/NN/br-d02/706	-0.0225506462134636	0.0979865376186114	church	NN	religion	A	A	AB	AB	church%1:14:00::	B	B	AB	AB	 there tends to be an almost complete indifference to the <font color=green>church</font>  and its traditional message of sin and grace. To be	NN	informative	4	4	1.69	1	9	church	others	church	a2	indifference to the;traditional message;sin and grace		the	NA	NA	no	yes	A	singular	no	no	no	no	no	no	no	NA	yes	a
church/NN/br-d02/786	-0.0238130280131224	-0.20083221900432	church	NN	religion	A	A	AB	AB	church%1:14:00::	B	B	AB	AB	 longer afford the luxury of such smug indignation? Can the <font color=green>church</font>  risk assuming that the`` folly'' of men is as dear	NN	informative	3	0	1.89	0	5	church	others	church	a2	risk assuming	definiteness and agent	the	NA	NA	no	yes	A	singular	no	no	no	no	no	no	no	NA	yes	a
church/NN/br-d02/877	0.108808431643883	0.119425068895533	church	NN	religion	A	A	AB	AB	church%1:14:00::	B	B	AB	AB	 precarious? There is an ancient and venerable tradition in the <font color=green>church</font> ( which derives, however, from the heritage of the Greeks rather	NN	informative	4	3	1.68	0.75	5	church	others	church	a2	ancient and venerable tradition		the	NA	NA	no	yes	A	singular	no	no	no	no	no	no	no	NA	yes	a
church/NN/br-d02/923	0.143115527304781	-0.125111409169657	church	NN	religion	A	A	AB	AB	church%1:14:00::	B	B	AB	AB	 for accomplishing his work in the world. by analogy, the <font color=green>church</font>  also has been regarded as entirely independent of the`` world	NN	informative	3	2	1.14	0.67	7	church	others	church	a1	independent of the world		the	NA	NA	no	yes	A	singular	no	no	no	no	no	no	no	NA	yes	a
church/NN/br-d02/949	-0.0953228416698491	-0.155468474325212	church	NN	religion	A	A	AB	AB	church%1:14:00::	B	B	AB	AB	 of requiring nothing from it in order to be the <font color=green>church</font> . But, as Scripture everywhere reminds us, God does have need	NN	informative	2	1	1.21	0.5	6	church	others	church	a1	to be the;Scripture;God		the	NA	NA	no	yes	A	singular	no	no	no	no	no	no	no	NA	yes	a
church/NN/br-d02/969	0.0446144098337446	-0.176499943859017	church	NN	religion	A	A	AB	AB	church%1:14:00::	B	B	AB	AB	 us, God does have need of his creatures, and the <font color=green>church</font> , a fortiori, can ill afford to do without the talents	NN	informative	4	3	1.5	0.75	5	church	others	church	a1	God;creatures;afford	definiteness and agent	the	NA	NA	no	yes	A	singular	no	no	no	no	no	no	no	NA	yes	a
church/NN/br-d03/1080	-0.0277958685793376	-0.0397896589748228	church	NN	religion	E	E	DE	CDE	church%1:04:00::	E	E	DE	CDE	 phenomenon of redundancy is that fewer Protestants are going to <font color=green>church</font> . It should be admitted, too, that there is a good	NN	informative	2	2	1.3	1	7	church	others	church	c3	going to;Protestant;redundancy		none	NA	NA	yes	no	E	singular	no	no	no	no	no	no	no	yes	no	c
church/NN/br-d03/1342	0.0231054760710645	0.0824932628372299	church	NN	religion	E	E	DE	CDE	church%1:06:00::	D	D	DE	CDE	 my experience to find as many men as women in <font color=green>church</font> , and to hear almost everyone in church congregations reciting the	NN	informative	5	2	2.05	0.4	7	church	others	church	c3	find as many men as women in		none	NA	NA	yes	no	?	singular	no	no	no	no	no	no	no	yes	no	c
church/NN/br-d03/1350	0.0148151078011849	0.0735889369026844	church	NN	religion	E	E	DE	CDE	church%1:06:00::	D	D	DE	CDE	 as women in church, and to hear almost everyone in <font color=green>church</font>  congregations reciting the Latin prayers and responses at Mass. They	NN	informative	5	4	2.39	0.8	10	church	others	church	c3	everyone in;women in church;congregations		NA	NA	NA	yes	NA	?	singular	no	no	no	no	no	no	no	yes	no	c
church/NN/br-d03/1871	0.0514903029567705	0.0687746035501496	church	NN	religion	B	B	AB	AB	catholic_church%1:14:00::	B1	B	AB	AB	 the Sunday Observer implies a kindly recognition that the Catholic <font color=green>Church</font>  is now at least of equal stature in England with	NNP	informative	2	2	2.11	1	10	Church	others	Church	a2	Catholic		the	Catholic	NA	no	yes	B	singular	yes	no	no	no	no	yes	no	NA	yes	a
church/NN/br-d03/1909	0.0235181550015567	0.106419937139242	church	NN	religion	B	B	AB	AB	church_of_england%1:14:00::	B2	B	AB	AB	 non-Catholic) wrote articles in the Observer depicting clergymen of the <font color=green>Church</font>  of England, the Church of Rome and the Nonconformist Church	NNP	informative	6	2	2.46	0.33	5	Church	others	Church	a2	clergymen of the;of England		the	NA	of England	no	yes	B	singular	yes	yes	no	no	no	no	no	NA	yes	a
church/NN/br-d03/2097	-0.00476738687007836	0.0401124722994881	church	NN	religion	A	A	AB	AB	church%1:14:00::	B	B	AB	AB	 Canterbury. The good feeling which exists between these two important <font color=green>church</font>  figures is now well known in England. The Holy Sacrifice	NN	informative	4	2	1.23	0.5	9	church	others	church	a2	figures		NA	NA	NA	no	NA	A	singular	no	no	no	no	no	no	no	NA	yes	a
church/NN/br-d03/2336	0.0492208679336967	0.063157093464031	church	NN	religion	D	D	DE	CDE	catholic_church%1:14:00::	B1	B	AB	AB	 a votive Mass offered for Christian unity at a Catholic <font color=green>church</font>  in Slough during the Church Unity Octave.	NN	informative	2	1	2.61	0.5	7	church	others	church	c1	Mass;offered;at a Catholic;in Slough		a	Catholic	NA	yes	no	D	singular	no	no	no	no	no	yes	no	no	no	c
church/NN/br-d03/2341	0.0666468372709632	0.0760402639624171	church	NN	religion	A	A	AB	AB	church%1:14:00::	B	B	AB	AB	 Christian unity at a Catholic church in Slough during the <font color=green>Church</font>  Unity Octave.	NNP	informative	2	1	3.17	0.5	5	Church	others	Church	a1	during then;Unity Octave		NA	NA	NA	no	NA	A	singular	yes	no	no	no	no	no	no	NA	yes	a
church/NN/br-d03/721	-0.0198994534144307	0.13524761685809	church	NN	religion	B	B	AB	AB	church%1:06:00::	D	D	DE	CDE	 crowds going in and out of the Birmingham Oratory( Catholic) <font color=green>Church</font>  on Sunday mornings. She found this a marvel because, as	NNP	informative	1	0	2.79	0	3	Church	others	Church	c1	crowds;going in and out of the;Sunday mornings	Name of church plus ‘going in and out’	the	Birmingham Oratory (Catholic)	NA	yes	yes	D	singular	yes	no	no	yes	no	yes	no	no	no	c
church/NN/br-d03/862	0.0210141524488326	0.00806924031628643	church	NN	religion	B	B	AB	AB	church_of_england%1:14:00::	B2	B	AB	AB	 to a newspaper report of the 1961 statistics of the <font color=green>Church</font>  of England, the`` total of confirmed members is 9748000, but	NNP	informative	3	2	1.85	0.67	7	Church	others	Church	a2	of England		the	NA	of England	no	yes	B	singular	yes	yes	no	no	no	no	no	NA	yes	a
