id	model.x	model.y	lemma	pos	genre	marisense	mbroad	mari3	mari2	sensekey	wnsense	wnbroad	wn3	wn2	text	newPos	newBroadGenre	cues	cuesWithWeight	meanWeight	weightedCuesRatio	weightedCW	wf	broadGenre	wordform	msOct	mcuesOct	mcommOct	determiner	premodifier	postmodifier	building	definiteness	dgsense	number	capital	has_posm	prem_adj	prem_place	prem_name	prem_kind	comm	activity	organization	msOct4
church/NN/br-f44/667	0.0675238056523187	-0.215738679767911	church	NN	popular_lore	A	A	AB	AB	church%1:14:00::	B	B	AB	AB	 's Mission''; theologians have been stressing the fact that the <font color=green>Church</font>  does not exist for its own sake but as a	NNP	informative	4	2	1.21	0.5	5	Church	others	Church	a1	theologians;exist;Mission	Capital letter and definiteness	the	NA	NA	no	yes	A	singular	yes	no	no	no	no	no	no	NA	yes	a
church/NN/br-f44/924	0.0982825893345657	-0.0371417775972984	church	NN	popular_lore	C	C	C	CDE	church%1:14:00::	B	B	AB	AB	 with friendly members the`` contacts with an organization of the <font color=green>church</font> ''( 11.2 per cent of the cases), then a substantial two	NN	informative	3	3	1.81	1	6	church	others	church	b	an organization of the		the	NA	NA	no	yes	C	singular	no	no	no	no	no	no	yes	no	yes	b
church/NN/br-f44/986	0.000691223813425711	-0.0294324998526982	church	NN	popular_lore	C	C	C	CDE	church%1:14:00::	B	B	AB	AB	 people; the new people respond in kind by joining the <font color=green>church</font> . Missionary outreach by friendly contact looks somewhat different when one	NN	informative	4	2	1.32	0.5	12	church	others	church	b	joining the;missionary outreach		the	NA	NA	no	yes	C	singular	no	no	no	no	no	no	yes	no	yes	b
church/NN/br-g05/1358	-0.174417735577477	-0.206842022503404	church	NN	belles_lettres	D	D	DE	CDE	Z	Z	Z	Z	Z	 which contain nine greater alcoves as frescoed and capacious as <font color=green>church</font>  apses. Here, in the old days- when they had come	NN	informative	3	0	0.96	0	2	church	others	church	c1	alcoves;frescoed;capacious;apses		NA	NA	NA	yes	NA	D	singular	no	no	no	no	no	no	no	no	no	c
church/NN/br-g12/1271	0.202704183440107	0.0926820252513434	church	NN	belles_lettres	D	D	DE	CDE	church%1:06:00::	D	D	DE	CDE	 and gestured toward the Madeleine. The classical lines of the <font color=green>church</font>  which Napoleon thought of as a Temple of Glory, dominated	NN	informative	5	2	2.71	0.4	3	church	others	church	c1	classical lines;Madeleine;Temple of Glory		the	NA	NA	yes	yes	D	singular	no	no	no	no	no	no	no	no	no	c
church/NN/br-g12/1807	-0.0898757721420844	0.169027953488235	church	NN	belles_lettres	D	D	DE	CDE	church%1:06:00::	D	D	DE	CDE	 not attractive, but it is deeper. When you pass a <font color=green>church</font>  on an Irish bus, all the hands flurry in the	NN	informative	2	2	1.11	1	4	church	others	church	c1	pass;bus		a	NA	NA	yes	no	D	singular	no	no	no	no	no	no	no	no	no	c
church/NN/br-g12/544	-0.20268315244547	0.0145864983953267	church	NN	belles_lettres	D	D	DE	CDE	church%1:06:00::	D	D	DE	CDE	 the Madeleine and across to a sidewalk cafe opposite that <font color=green>church</font> . The conversation that ensued may have been engrossing but it	NN	informative	4	3	1.88	0.75	6	church	others	church	c1	Madeleine;sidewalk;opposite		that	NA	NA	yes	yes	D	singular	no	no	no	no	no	no	no	no	no	c
church/NN/br-h17/1199	-0.0318985505541356	-0.0861409608522505	church	NN	miscellaneous	C	C	C	CDE	church%1:14:00::	B	B	AB	AB	 because of his willingness to kill in defense of his <font color=green>church</font>  and home. Upon administrative approval of the reclassification, he was	NN	informative	2	1	1.75	0.5	6	church	tech	church	b	in defense of his		his	NA	NA	no	yes	C	singular	no	no	no	no	no	no	yes	no	yes	b
church/NN/br-h17/1434	0.0171742244801738	-0.0485796905582034	church	NN	miscellaneous	C	C	C	CDE	church%1:14:00::	B	B	AB	AB	 preaching and from 20 to 25 hours per month to <font color=green>church</font>  activities. His claim was therefore`` so highly exaggerated'', the Department	NN	informative	1	1	1.32	1	8	church	tech	church	b1	preaching;hours per month;activities		NA	NA	NA	no	NA	C	singular	no	no	no	no	no	no	yes	yes	no	b
church/NN/br-j23/1105	0.166023813135611	-0.0111774231843291	church	NN	learned	C	C	C	CDE	church_member%1:18:00::	C	C	C	CDE	 which is reflective of our common religion. Even the non <font color=green>church</font>  members- the freewheelers, marginal religionists and so on- have the	NN	informative	2	2	1.19	1	6	church	tech	church	a2	members;common religion		NA	NA	NA	no	NA	?	singular	no	no	no	no	no	no	no	NA	yes	a
church/NN/br-j57/2237	0.0785854967091865	0.135503562012755	church	NN	learned	A	A	AB	AB	church_father%1:18:00::	A	A	AB	AB	 which reached Christianity by the way of Stoicism through the <font color=green>Church</font>  Fathers of Late Antiquity.	NNP	informative	3	2	1.57	0.67	4	Church	tech	Church	a1	Christianity;Stoicism;Fathers;Late Antiquity		NA	NA	NA	no	NA	A	singular	yes	no	no	no	no	no	no	NA	yes	a
church/NN/br-j57/958	0.132702116325007	0.0906053926936291	church	NN	learned	A	A	AB	AB	church_father%1:18:00::	A	A	AB	AB	 all possessions. This conception was taken up by the early <font color=green>Church</font>  Fathers and by canon lawyers and theologians in the Middle	NNP	informative	5	3	1.69	0.6	6	Church	tech	Church	a1	conception;early;Fathers;canon lawyers;theologians		NA	early	NA	no	NA	A	singular	yes	no	no	no	no	yes	no	NA	yes	a
church/NN/br-j58/1496	-0.0655889898724525	-0.127867238004189	church	NN	learned	D	D	DE	CDE	church_bell%1:06:00::	D	D	DE	CDE	 In many Northern towns and cities meetings were held and <font color=green>church</font>  bells were tolled. Such was not the case in Rhode	NN	informative	4	2	1.21	0.5	7	church	tech	church	c1	bells		NA	NA	NA	yes	NA	D	singular	no	no	no	no	no	no	no	no	no	c
church/NN/br-k04/1076	-0.0860329837617886	-0.0284304704911796	church	NN	fiction_gral	D	D	DE	CDE	church%1:06:00::	D	D	DE	CDE	 There were two liquor saloons not very far from the <font color=green>church</font> , one white, that is conducted for white people with a	NN	imaginative	4	3	1.42	0.75	10	church	imag	church	c1	saloons;far from		the	NA	NA	yes	yes	D	singular	no	no	no	no	no	no	no	no	no	c
church/NN/br-k04/1117	-0.18283872404462	0.105847173958665	church	NN	fiction_gral	D	D	DE	CDE	church%1:06:00::	D	D	DE	CDE	 of gambling in both. On the other side of the <font color=green>church</font>  was a quiet, well-kept house with shutters and recently painted	NN	imaginative	4	0	1.7	0	4	church	imag	church	c1	on the other side of the;house;shutters;painted		the	NA	NA	yes	yes	D	singular	no	no	no	no	no	no	no	no	no	c
church/NN/br-k04/1145	-0.195582376412022	-0.157284691208594	church	NN	fiction_gral	C	C	C	CDE	church%1:14:00::	B	B	AB	AB	 it. It was called Kent House. The deacon of the <font color=green>church</font> , Carlson, was its janitor. One of the leading members of	NN	imaginative	3	0	1.02	0	5	church	imag	church	c2	deacon of 	the reference of janitor is to Kent House, not the church… being a deacon refers to the community aspect mainly	the	NA	NA	yes	yes	?	singular	no	no	no	no	no	no	yes	no	no	c
church/NN/br-k04/1353	-0.0739845421738028	-0.0999759963746501	church	NN	fiction_gral	D	D	DE	CDE	church%1:06:00::	D	D	DE	CDE	 tract of land, and it occurred to him that the <font color=green>church</font>  and the better Negro homes might gradually be moved to	NN	imaginative	3	3	0.96	1	7	church	imag	church	c1	land;homes;moved		the	NA	NA	yes	yes	D	singular	no	no	no	no	no	no	no	no	no	c
church/NN/br-k04/1419	-0.0595108629384242	-0.113794586107045	church	NN	fiction_gral	C	C	C	CDE	church%1:06:00::	D	D	DE	CDE	 stress, and that was that the contribution to the general <font color=green>church</font>  expenses, the dollar money, had been seriously falling behind in	NN	imaginative	3	3	1.25	1	10	church	imag	church	b	expenses;dollar money;contribution		NA	NA	NA	no	NA	C	singular	no	no	no	no	no	no	yes	no	yes	b
church/NN/br-k04/1433	-0.104575849241568	-0.110453798537098	church	NN	fiction_gral	C	C	C	CDE	church%1:06:00::	D	D	DE	CDE	 the dollar money, had been seriously falling behind in this <font color=green>church</font> , and that must be looked after immediately. In fact, he	NN	imaginative	1	1	0.85	1	12	church	imag	church	b	dollar money;falling behind	the building aspect might be in the background as well (in other occurrences, it gets highlighted by ‘mortgage’)	this	NA	NA	no	yes	C	singular	no	no	no	no	no	no	yes	no	yes	b
church/NN/br-k04/1485	0.0150487674264533	0.0660547863096665	church	NN	fiction_gral	C	C	C	CDE	church%1:06:00::	D	D	DE	CDE	 that clear as this was, they must have a better <font color=green>church</font> , a more business-like conduct of the church organization, and an	NN	imaginative	2	1	1.91	0.5	6	church	imag	church	b	business-like conduct;organization		a	better	NA	no	no	?	singular	no	no	yes	no	no	no	yes	no	yes	b
church/NN/br-k04/1493	0.014919899873763	0.0377135879686624	church	NN	fiction_gral	C	C	C	CDE	church%1:14:00::	B	B	AB	AB	 have a better church, a more business-like conduct of the <font color=green>church</font>  organization, and an effort to get this religious center out	NN	imaginative	4	3	1.73	0.75	8	church	imag	church	b	business-like conduct;organization		the	NA	NA	no	yes	C	singular	no	no	no	no	no	no	yes	no	yes	b
church/NN/br-k04/1514	0.0203592375854499	0.020533499841104	church	NN	fiction_gral	C	C	C	CDE	church%1:14:00::	B	B	AB	AB	 out of its rut of wild worship into a modern <font color=green>church</font>  organization. He emphasized to the Presiding Elder the plan of	NN	imaginative	5	3	2	0.6	6	church	imag	church	b	modern;organization;wild worship		NA	NA	NA	no	NA	C	singular	no	no	no	no	no	no	yes	no	yes	b
church/NN/br-k04/1530	-0.154542951972413	-0.126058181089478	church	NN	fiction_gral	D	D	DE	CDE	church%1:06:00::	D	D	DE	CDE	 the Presiding Elder the plan of giving up the old <font color=green>church</font>  and moving across the river. The Presiding Elder was sure	NN	imaginative	5	3	0.85	0.6	5	church	imag	church	c1	old;moving;across the river		the	old	NA	yes	yes	D	singular	no	no	yes	no	no	no	no	no	no	c
church/NN/br-k04/1578	-0.0389470800342266	-0.110418730156072	church	NN	fiction_gral	D	D	DE	CDE	church%1:06:00::	D	D	DE	CDE	 impossible. The bank which held the mortgage on the old <font color=green>church</font>  declared that the interest was considerably in arrears, and the	NN	imaginative	2	1	1.18	0.5	6	church	imag	church	c1	bank;mortgage;the old		the	old	NA	yes	yes	D	singular	no	no	yes	no	no	no	no	no	no	c
church/NN/br-k04/1634	-0.11957038958942	-0.0400510604710419	church	NN	fiction_gral	D	D	DE	CDE	church%1:06:00::	D	D	DE	CDE	 to colored folk. When it was proposed to rebuild the <font color=green>church</font> , Wilson found that the terms for a new mortgage were	NN	imaginative	2	0	1.69	0	5	church	imag	church	c1	rebuild;mortgage		the	NA	NA	yes	yes	D	singular	no	no	no	no	no	no	no	no	no	c
church/NN/br-k04/1685	0.0391083595311554	-0.141791204436874	church	NN	fiction_gral	D	D	DE	CDE	church%1:06:00::	D	D	DE	CDE	 made to his Deacon Board, he met unanimous opposition. The <font color=green>church</font>  certainly would not be removed. The very proposition was sacrilege	NN	imaginative	3	1	1.2	0.33	7	church	imag	church	c1	removed;Deacon Board		the	NA	NA	yes	yes	D	singular	no	no	no	no	no	no	no	no	no	c
church/NN/br-k04/1807	-0.184639766310165	0.0185804305984106	church	NN	fiction_gral	D	D	DE	CDE	church%1:06:00::	D	D	DE	CDE	 of money that has been invested by whites around that <font color=green>church</font> ? Tenements, stores, saloons, some gambling, I hope not too much	NN	imaginative	5	2	1.57	0.4	6	church	imag	church	c1	money;invested;around;tenemenets;stores;saloons	opposition to other buildings	that	NA	NA	yes	yes	D	singular	no	no	no	no	no	no	no	no	no	c
church/NN/br-k04/1874	-0.180085999091085	-0.0815841062160494	church	NN	fiction_gral	D	D	DE	CDE	church%1:06:00::	D	D	DE	CDE	 were you I would just plan to repair the old <font color=green>church</font>  so it would last for five or ten years. By	NN	imaginative	3	3	1.21	1	6	church	imag	church	c1	repair;old;last;years		the	old	NA	yes	yes	D	singular	no	no	yes	no	no	no	no	no	no	c
church/NN/br-k04/2301	0.0600346691589417	0.00610642168994925	church	NN	fiction_gral	B	B	AB	AB	methodist_church%1:14:00::	B2	B	AB	AB	 mean practically the end of his career in the Methodist <font color=green>church</font> , if not in all churches.	NN	imaginative	3	1	1.33	0.33	6	church	imag	church	a2	career;Methodist		the	Methodist	NA	no	yes	B	singular	no	no	no	no	no	yes	no	NA	yes	a
church/NN/br-k04/356	-0.105425623471457	-0.0422261768416866	church	NN	fiction_gral	C	C	C	CDE	church%1:06:00::	D	D	DE	CDE	 with the whites, especially the rich who partly supported the <font color=green>church</font> . The Deacon Board, headed by a black man named Carlson	NN	imaginative	7	4	1.56	0.57	7	church	imag	church	b	supported;Deacon Board		the	NA	NA	no	yes	C	singular	no	no	no	no	no	no	yes	no	yes	b
church/NN/br-k04/397	-0.105368312028504	-0.0600485178349897	church	NN	fiction_gral	C	C	C	CDE	church%1:06:00::	D	D	DE	CDE	 support of the Amen corner. The characteristic thing about this <font color=green>church</font>  was its Amen corner and the weekly religious orgy. A	NN	imaginative	4	4	1.81	1	6	church	imag	church	b	Amen corner;weekly religious orgy		this	NA	NA	no	yes	C	singular	no	no	no	no	no	no	yes	no	yes	b
church/NN/br-k04/828	-0.0945384208588228	0.0264178502745105	church	NN	fiction_gral	C	C	C	CDE	church%1:14:00::	B	B	AB	AB	 the home of one of the old members of the <font color=green>church</font> , a woman named Catt who, as Wilson afterward found, was	NN	imaginative	2	2	1.46	1	7	church	imag	church	b	members		the	NA	NA	no	yes	C	singular	no	no	no	no	no	no	yes	no	yes	b
church/NN/br-k04/877	-0.0787657790783817	0.0446256985201941	church	NN	fiction_gral	C	C	C	CDE	church%1:14:00::	B	B	AB	AB	 never married, conducting a spotless home and devoted to her <font color=green>church</font> , but a perpetual dissenter and born critic. She soared over	NN	imaginative	2	1	2.14	0.5	5	church	imag	church	b	devoted to her		her	NA	NA	no	yes	C	singular	no	no	no	no	no	no	yes	no	yes	b
church/NN/br-k04/923	-0.0778246029906408	-0.00309259791295997	church	NN	fiction_gral	D	D	DE	CDE	church%1:06:00::	D	D	DE	CDE	 which she was chief repository. Then Wilson looked over the <font color=green>church</font>  and studied its condition. The salary of the pastor had	NN	imaginative	3	3	1.39	1	8	church	imag	church	c1	looked over;condition;pastor		the	NA	NA	yes	yes	D	singular	no	no	no	no	no	no	no	no	no	c
church/NN/br-k04/975	-0.180318113129995	-0.111445868512012	church	NN	fiction_gral	D	D	DE	CDE	church%1:06:00::	D	D	DE	CDE	 he mentioned this to the Deacons they said nothing. The <font color=green>church</font>  itself must be repaired. It was dirty and neglected. It	NN	imaginative	3	2	1.12	0.67	7	church	imag	church	c1	repaired;dirty;neglected		the	NA	NA	yes	yes	D	singular	no	no	no	no	no	no	no	no	no	c
church/NN/br-k06/1056	-0.0747215711652647	0.12408788670182	church	NN	fiction_gral	D	D	DE	CDE	church%1:06:00::	D	D	DE	CDE	 northward to Brooklyn, below Point Peter, he could see the <font color=green>church</font>  spire wherever he looked back. Sometimes they went south and	NN	imaginative	5	2	1.15	0.4	6	church	imag	church	c1	spire;northward		NA	NA	NA	yes	NA	D	singular	no	no	no	no	no	no	no	no	no	c
church/NN/br-k06/1389	-0.102771031659409	-0.087533994816001	church	NN	fiction_gral	D	D	DE	CDE	church%1:06:00::	D	D	DE	CDE	 with its peaked lance. Stevie was constantly slipping into the <font color=green>church</font> . He pulled with all his strength at the heavy, brass	NN	imaginative	3	2	1.31	0.67	5	church	imag	church	c1	slipping into the		the	NA	NA	yes	yes	D	singular	no	no	no	no	no	no	no	no	no	c
church/NN/br-k06/1473	-0.203055958900909	-0.0443213101655158	church	NN	fiction_gral	D	D	DE	CDE	church%1:06:00::	D	D	DE	CDE	 hands tucked under his coattails, and staring into the dark <font color=green>church</font> . The figure was wreathed in an extraordinary luminescence. The boy	NN	imaginative	3	2	1.3	0.67	4	church	imag	church	c1	staring into the;dark;figure		the	dark	NA	yes	yes	D	singular	no	no	yes	no	no	no	no	no	no	c
church/NN/br-k06/528	-0.176492892031424	-0.00762354438178595	church	NN	fiction_gral	D	D	DE	CDE	church%1:06:00::	D	D	DE	CDE	 his head out. There was the slate roof of the <font color=green>church</font> ; ivy climbed the red brick walls like a green scaled	NN	imaginative	5	3	1.52	0.6	7	church	imag	church	c1	slate roof;ivy;brick walls		the	NA	NA	yes	yes	D	singular	no	no	no	no	no	no	no	no	no	c
church/NN/br-k06/571	-0.183022866206069	0.16773865243879	church	NN	fiction_gral	D	D	DE	CDE	church%1:06:00::	D	D	DE	CDE	 cupboards.`` There 's a tower and a steeple on the <font color=green>church</font>  a million feet high. And the loudest clock in the	NN	imaginative	3	2	1.6	0.67	5	church	imag	church	c1	tower;steeple;high;clock		the	NA	NA	yes	yes	D	singular	no	no	no	no	no	no	no	no	no	c
church/NN/br-k06/659	-0.125033911792569	-0.174979039596482	church	NN	fiction_gral	D	D	DE	CDE	church%1:06:00::	D	D	DE	CDE	 Street to Orange Square. The steeple leaned backward, while the <font color=green>church</font>  advanced like a headless creature in a long, shapeless coat	NN	imaginative	5	0	2.25	0	3	church	imag	church	c1	steeple;backward		the	NA	NA	yes	yes	D	singular	no	no	no	no	no	no	no	no	no	c
church/NN/br-k06/852	-0.0959392707638958	0.191802303990813	church	NN	fiction_gral	D	D	DE	CDE	church%1:06:00::	D	D	DE	CDE	 Church with its high steeple and clock. There was no <font color=green>church</font>  like Drew Church, no preacher like Papa, who was intimate	NN	imaginative	3	2	1.81	0.67	5	church	imag	church	c1	steeple;clock;Drew;there was		none	NA	NA	yes	no	D	singular	no	no	no	no	no	no	no	no	no	c
church/NN/br-k10/1423	0.141691668304376	-0.0966152811356934	church	NN	fiction_gral	A	A	AB	AB	church%1:14:00::	B	B	AB	AB	 economics, and social issues that are no concern of the <font color=green>Church</font> ''? And John 's reply was always the same:`` Anything that	NNP	imaginative	5	1	1.17	0.2	8	Church	imag	Church	a2	concern of the	Capital letter and definiteness	the	NA	NA	no	yes	A	singular	yes	no	no	no	no	no	no	NA	yes	a
church/NN/br-k10/1445	-0.102785989127635	0.129369020103621	church	NN	fiction_gral	A	A	AB	AB	church%1:14:00::	B	B	AB	AB	 same:`` Anything that affects souls is the concern of the <font color=green>Church</font> ! We will have righteousness''! Tears burned behind his eyes as	NNP	imaginative	3	2	1.5	0.67	7	Church	imag	Church	a2	affects souls;concern of the;righteousness	Capital letter and definiteness	the	NA	NA	no	yes	A	singular	yes	no	no	no	no	no	no	NA	yes	a
church/NN/br-k10/1802	-0.0348916639274009	0.209934836305734	church	NN	fiction_gral	B	B	AB	AB	church_of_rome%1:14:00::	B1	B	AB	AB	 Geneva, saying that he had been a bishop of the <font color=green>Church</font>  of Rome and had been persecuted in Paris for his	NNP	imaginative	2	1	0.91	0.5	7	Church	imag	Church	a2	bishop of the;of Rome		the	NA	of Rome	no	yes	B	singular	yes	yes	no	no	no	no	no	NA	yes	a
church/NN/br-k10/205	-0.0330915835066778	-0.236256410906646	church	NN	fiction_gral	A	A	AB	AB	church%1:14:00::	B	B	AB	AB	 that the couple would have to be punished if the <font color=green>Church</font>  was to be respected.`` I have told you before, and	NNP	imaginative	2	1	1.15	0.5	5	Church	imag	Church	a2	punished;respected	Capital letter and definiteness	the	NA	NA	no	yes	A	singular	yes	no	no	no	no	no	no	NA	yes	a
church/NN/br-k10/257	-0.0637178692306937	-0.149455958561026	church	NN	fiction_gral	A	A	AB	AB	church%1:14:00::	B	B	AB	AB	 is the answer the ungodly will always make when the <font color=green>Church</font>  points its fingers at their sins. I say to you	NNP	imaginative	3	2	1.07	0.67	7	Church	imag	Church	a1	ungodly;points its fingers at their sins	capital letter, definiteness, agent	the	NA	NA	no	yes	A	singular	yes	no	no	no	no	no	no	NA	yes	a
church/NN/br-k10/271	0.0243662088170089	0.19856830381558	church	NN	fiction_gral	A	A	AB	AB	church%1:14:00::	B	B	AB	AB	 fingers at their sins. I say to you that the <font color=green>Church</font>  will ever decry evil''! John 's reply was like a	NNP	imaginative	3	2	1.57	0.67	7	Church	imag	Church	a2	will ever decry evil	Capital letter and definiteness	the	NA	NA	no	yes	A	singular	yes	no	no	no	no	no	no	NA	yes	a
church/NN/br-k10/561	-0.149023982805202	0.125059064496717	church	NN	fiction_gral	A	A	AB	AB	church%1:14:00::	B	B	AB	AB	 weeks before, in early November, without being reconciled to the <font color=green>Church</font> . The canons, in a body, had tried to force him	NNP	imaginative	3	1	1	0.33	4	Church	imag	Church	a2	reconciled to the;canons	Capital letter and definiteness	the	NA	NA	no	yes	A	singular	yes	no	no	no	no	no	no	NA	yes	a
church/NN/br-k10/588	0.0258235640597536	0.14814211967284	church	NN	fiction_gral	A	A	AB	AB	church%1:14:00::	B	B	AB	AB	 to let them give him the last rites of the <font color=green>Church</font> , but he had died still proclaiming salvation by faith. Burial	NNP	imaginative	3	2	1.55	0.67	8	Church	imag	Church	a2	last rites of the;salvation by faith	Capital letter and definiteness	the	NA	NA	no	yes	?	singular	yes	no	no	no	no	no	no	NA	yes	a
church/NN/br-k10/967	-0.159032337176052	0.0585247527647187	church	NN	fiction_gral	D	D	DE	CDE	church%1:06:00::	D	D	DE	CDE	 all the time. Quickening his steps, John entered the vast <font color=green>church</font>  and climbed the tower steps to the bells. Underneath the	NN	imaginative	6	6	1.67	1	8	church	imag	church	c1	entered;vast;climbed;tower steps;bells	Funny the two different senses of ‘steps’ with different contributions to ‘church’ here, both to the building sense	the	vast	NA	yes	yes	D	singular	no	no	yes	no	no	no	no	no	no	c
church/NN/br-k13/533	-0.179013545588459	0.0480929328843383	church	NN	fiction_gral	D	D	DE	CDE	church%1:06:00::	D	D	DE	CDE	 Harold indicated the photograph on the wall and asked what <font color=green>church</font>  the stone sculpture was in. Eugene told him and he	NN	imaginative	3	3	1.29	1	11	church	imag	church	c1	photograph;stone sculpture;in		none	NA	NA	yes	no	D	singular	no	no	no	no	no	no	no	no	no	c
church/NN/br-k14/1114	-0.0754558325691914	-0.262538829535056	church	NN	fiction_gral	A	A	AB	AB	church%1:14:00::	B	B	AB	AB	 not want my people to get in trouble with the <font color=green>Church</font> ''.`` I am working for the Cardinal of San Dionigi. I'm	NNP	imaginative	3	2	0.73	0.67	4	Church	imag	Church	a2	get in trouble with the;Cardinal	Capital letter and definiteness	the	NA	NA	no	yes	A	singular	yes	no	no	no	no	no	no	NA	yes	a
church/NN/br-k14/826	-0.184197306139703	-0.164141970180147	church	NN	fiction_gral	D	D	DE	CDE	church%1:06:00::	D	D	DE	CDE	 Jewish section was in Trastevere, near the Tiber at the <font color=green>church</font>  of San Francesco a Ripa. The colony had been small	NN	imaginative	4	1	0.93	0.25	6	church	imag	church	c1	Trastevere;Tiber;at the;of San Francesco a Ripa		the	NA	of San Francesco a Ripa	yes	yes	D	singular	no	yes	no	no	no	no	no	no	no	c
church/NN/br-k15/188	-0.0990037531988982	0.07301250463556	church	NN	fiction_gral	D	D	DE	CDE	church%1:06:00::	D	D	DE	CDE	 They held the funeral the next morning from the crossroads <font color=green>church</font>  and buried the little box in the quiet family plot	NN	imaginative	6	6	1.94	1	10	church	imag	church	c1	held;funeral;crossroads		the	crossroads	NA	yes	yes	D	singular	no	no	no	yes	no	no	no	no	no	c
church/NN/br-k16/1431	-0.187963812959707	0.0371648067236642	church	NN	fiction_gral	D	D	DE	CDE	church%1:06:00::	D	D	DE	CDE	 thickets. Along Wappinger Creek in Dutchess County, past the white <font color=green>church</font>  at Fishkill, past Verplanck 's Point on the east bank	NN	imaginative	6	5	1.74	0.83	5	church	imag	church	c1	Along Wappinger Creek;Dutchess County;at Fishkill	the series of directions and concrete places points to the building sense	the	white	NA	yes	yes	D	singular	no	no	yes	no	no	no	no	no	no	c
church/NN/br-k16/2285	-0.170909343006587	0.0163273874112266	church	NN	fiction_gral	E	E	DE	CDE	church_service%1:04:00::	E	E	DE	CDE	 him out of some dim corner of memory from a <font color=green>church</font>  service when he was a boy- yes, in a white	NN	imaginative	1	1	1.51	1	6	church	imag	church	c3	service		a	NA	NA	yes	no	E	singular	no	no	no	no	no	no	no	yes	no	c
church/NN/br-k16/2298	-0.16624372003083	-0.0181079106574362	church	NN	fiction_gral	D	D	DE	CDE	church%1:06:00::	D	D	DE	CDE	 service when he was a boy- yes, in a white <font color=green>church</font>  with a thin spur steeple in the patriarchal Hudson Valley	NN	imaginative	5	3	0.99	0.6	5	church	imag	church	c1	white;steeple;Hudson Valley		a	white	NA	yes	no	D	singular	no	no	yes	no	no	no	no	no	no	c
church/NN/br-k19/168	-0.191686940138047	0.138572771293835	church	NN	fiction_gral	A	A	AB	AB	church%1:14:00::	B	B	AB	AB	 for a more exalted office in the hierarchy of the <font color=green>church</font> - his ambitions for the bishopry had died very early in	NN	imaginative	5	1	0.63	0.2	6	church	imag	church	a2	exalted office;hierarchy of the;bishopry		the	NA	NA	no	yes	A	singular	no	no	no	no	no	no	no	NA	yes	a
church/NN/br-k19/213	0.0985698786922167	-0.115914082940724	church	NN	fiction_gral	A	A	AB	AB	church%1:14:00::	B	B	AB	AB	 of this desire was due to his devotion to the <font color=green>church</font>  and how much was his own ego, demanding to be	NN	imaginative	1	1	1.21	1	8	church	imag	church	a1	his devotion to the	nonspecification and definiteness	the	NA	NA	no	yes	A	singular	no	no	no	no	no	no	no	NA	yes	a
church/NN/br-k25/81	-0.0548637687108116	-0.0632142631296162	church	NN	fiction_gral	D	D	DE	CDE	church%1:06:00::	D	D	DE	CDE	 whether a private residence in his Pennsylvania county or a <font color=green>church</font>  in Brazil, without it being obvious that he had done	NN	imaginative	3	2	1.09	0.67	7	church	imag	church	c1	residence;in Brazil	the opposition to ‘private residence’ points the focus to the building	a	NA	NA	yes	no	D	singular	no	no	no	no	no	no	no	no	no	c
