id	model.x	model.y	lemma	pos	genre	broadGenre	marisense	mbroad	mari3	mari2	sensekey	wnsense	wnbroad	wn3	wn2	text	newPos	newBroadGenre	cues	cuesWithWeight	meanWeight	weightedCuesRatio	weightedCW	wf
state/NN/br-g10/1323	-0.233555507297756	-0.00584282689485168	state	NN	belles_lettres	fiction	A1	A	AB	ABC	Z	Z	Z	Z	Z	 them, the same right must be conceded to each remaining <font color=green>state</font>  whenever it saw fit to secede: This would destroy the	NN	informative	1	1	2.01	1	4	state
state/NN/br-g10/1430	-0.181319630198303	0.0348416906075511	state	NN	belles_lettres	fiction	A1	A	AB	ABC	Z	Z	Z	Z	Z	 slavery, Lincoln was always willing to concede to each`` slave <font color=green>state</font> '' the right to decide independently whether to continue or end	NN	informative	3	1	1.71	0.33	3	state
state/NN/br-g10/1790	-0.247060370562478	0.0838206142148668	state	NN	belles_lettres	fiction	C	C	C	ABC	Z	Z	Z	Z	Z	 Inaugural. To my knowledge, Lincoln remains the only Head of <font color=green>State</font>  and Commander-in-Chief who, while fighting a fearful war whose issue	NNP	informative	3	1	1.85	0.33	2	State
state/NN/br-g10/2033	-0.376215995233324	-0.0699709071574105	state	NN	belles_lettres	fiction	A5	A	AB	ABC	Z	Z	Z	Z	Z	 devotion'' to prevent disunion, preserved individual freedom in the United <font color=green>States</font>  from the dangers of anarchy, inherent in confederations, which throughout	NNPS	informative	1	0	1.38	0	2	States
state/NN/br-g10/310	-0.0888835881424308	0.256283841013316	state	NN	belles_lettres	fiction	A5	A	AB	ABC	Z	Z	Z	Z	Z	 down to this: The Southern States insisted that the United <font color=green>States</font>  was, in last analysis, what its name implied- a Union	NNPS	informative	1	0	1.18	0	1	States
state/NN/br-g10/586	-0.0951149173906601	0.00387365890465622	state	NN	belles_lettres	fiction	A5	A	AB	ABC	Z	Z	Z	Z	Z	 to secede'', they formed what they officially styled`` The Confederate <font color=green>States</font>  of America''. Dictionaries, as we have seen, still cite this	NNPS	informative	2	2	1.72	1	3	States
state/NN/br-g10/688	-0.0363848541730483	-0.169202865416097	state	NN	belles_lettres	fiction	A3	A	AB	ABC	Z	Z	Z	Z	Z	 substantially the same division of power between the central and <font color=green>state</font>  governments, and among the executive, legislative and judicial branches. Many	NN	informative	4	2	2.24	0.5	2	state
state/NN/br-g10/731	-0.354968211521191	-0.151295859141268	state	NN	belles_lettres	fiction	A1	A	AB	ABC	Z	Z	Z	Z	Z	 Constitution was that the former recognized the right of each <font color=green>state</font>  to secede. But though each of its members had asserted	NN	informative	3	1	2.54	0.33	1	state
state/NN/br-g10/773	-0.143048016497276	-0.144224638697684	state	NN	belles_lettres	fiction	A1	A	AB	ABC	Z	Z	Z	Z	Z	 month before hostilities began- included no explicit provision authorizing a <font color=green>state</font>  to secede. Its drafters discussed this vital point but left	NN	informative	3	3	2.08	1	4	state
state/NN/br-g13/1778	0.00475194061143697	-0.166596102311984	state	NN	belles_lettres	fiction	A1	A	AB	ABC	Z	Z	Z	Z	Z	 do not count, for they hold the laws of the <font color=green>state</font>  null and void. They feel they are leagued against a	NN	informative	1	1	1.55	1	3	state
state/NN/br-g17/2109	0.207174147987983	-0.360611608566716	state	NN	belles_lettres	fiction	A5	A	AB	ABC	united_states%1:15:00::	A51	A	AB	ABC	 the chief universities, colleges, and preparatory schools of the United <font color=green>States</font> . Why should this be so? It is true that New	NNPS	informative	1	0	1.83	0	1	States
state/NN/br-g17/2194	0.136366533372802	0.0196999714126795	state	NN	belles_lettres	fiction	A	A	AB	ABC	state%1:15:01::	A	A	AB	ABC	 country? Is n't it a bit odd that the three <font color=green>states</font>  of Southern New England( Massachusetts, Connecticut, and Rhode Island) have	NNS	informative	4	2	1.77	0.5	4	states
state/NN/br-g17/2210	0.0940375546429088	-0.0880593333368578	state	NN	belles_lettres	fiction	A2	A	AB	ABC	state%1:15:01::	A	A	AB	ABC	 Southern New England( Massachusetts, Connecticut, and Rhode Island) have had <font color=green>state</font>  institutions of university status only in the very recent past	NN	informative	5	2	1.96	0.4	4	state
state/NN/br-g17/2310	0.0977261357705084	-0.160731744624767	state	NN	belles_lettres	fiction	A	A	AB	ABC	state%1:15:01::	A	A	AB	ABC	 the West? Is it not ironical that Roger Williams 's <font color=green>state</font> , Rhode Island, should have been the very last of the	NN	informative	1	0	1.68	0	3	state
state/NN/br-g19/545	0.00795251715992916	-0.337030040951161	state	NN	belles_lettres	fiction	A5	A	AB	ABC	united_states%1:15:00::	A51	A	AB	ABC	 of the giant corporations in Western Europe and the United <font color=green>States</font>  dates from the period 1880- 1900. Now, although the roots	NNPS	informative	1	0	2.06	0	2	States
state/NN/br-g21/1159	-0.177844670212932	0.302932671439554	state	NN	belles_lettres	fiction	A5	A	AB	ABC	united_states%1:14:00::	A52	A	AB	ABC	 During the next five years liberal leaders in the United <font color=green>States</font>  sank in the cumulative confusion attendant upon and manifested in	NNPS	informative	1	0	1.07	0	1	States
state/NN/br-g21/2009	0.0940110219207454	0.0911280006921361	state	NN	belles_lettres	fiction	A5	A	AB	ABC	united_states%1:14:00::	A52	A	AB	ABC	 same refrain mentioned above:`` The paramount goal of the United <font color=green>States</font> , set long ago, was to guard the rights of the	NNPS	informative	1	0	1.14	0	2	States
state/NN/br-g21/2184	0.180266531008134	0.303969276783495	state	NN	belles_lettres	fiction	D	D	D	D	state%1:03:00::	D1	D	D	D	 to you an uncertain and uneasy, not to say confused, <font color=green>state</font>  of the public mind? What is the common man 's	NN	informative	4	2	1.56	0.5	2	state
state/NN/br-g21/244	-0.089943853075858	-0.19783112579639	state	NN	belles_lettres	fiction	A5	A	AB	ABC	united_states%1:14:00::	A52	A	AB	ABC	 to be the duty of the destiny of the United <font color=green>States</font>  to assist in the creation of a better world by	NNPS	informative	1	0	1.82	0	3	States
state/NN/br-g21/991	0.188784613269828	0.420252071367222	state	NN	belles_lettres	fiction	C	C	C	ABC	state%1:14:01::	B	B	AB	ABC	 the Marxist dream of a classless society under a Socialist <font color=green>State</font> . And the USSR existed as the revolutionary experiment in radical	NNP	informative	4	0	1.38	0	1	State
state/NN/br-g22/1822	-0.0188088081315874	-0.136206733512095	state	NN	belles_lettres	fiction	B	B	AB	ABC	state%1:14:01::	B	B	AB	ABC	 acting as controllers of the corporation whose responsibility to the <font color=green>state</font>  would now be defined against proprietorship because employees and proprietors	NN	informative	3	1	1.84	0.33	2	state
state/NN/br-g22/594	0.0338223102366248	-0.141563329378442	state	NN	belles_lettres	fiction	C	C	C	ABC	state_department%1:14:00::	C1	C	C	ABC	 of`` The Soviet Cultural Offensive'', he says,`` Long before the <font color=green>State</font>  Department organized its bureaucracy into an East-West Contacts Staff in	NNP	informative	2	1	1.72	0.5	2	State
state/NN/br-g22/643	0.0292111950623981	-0.142115480359991	state	NN	belles_lettres	fiction	C	C	C	ABC	state_department%1:14:00::	C1	C	C	ABC	 when the enterprising promoters of' Porgy and Bess' overrode the <font color=green>State</font>  Department to carry the contemporary' cultural warfare' behind the enemy	NNP	informative	1	1	1.79	1	2	State
state/NN/br-g28/1728	0.11222080823951	-0.0152085062423715	state	NN	belles_lettres	fiction	A4	A	AB	ABC	state%1:15:01::	A	A	AB	ABC	 preacher and a college and university president in four Southern <font color=green>states</font> , published the earliest of these backwoods sketches and in the	NNS	informative	1	1	1.52	1	3	states
state/NN/br-g43/2228	-0.150103246062276	-0.11064944264152	state	NN	belles_lettres	fiction	D	D	D	D	state_of_affairs%1:26:00::	D1	D	D	D	 a search for the human significance of an event or <font color=green>state</font>  of affairs, a tendency to look at wholes rather than	NN	informative	2	1	1.25	0.5	2	state
state/NN/br-k03/2239	-0.436548209715766	0.144641601965245	state	NN	fiction_gral	fiction	A4	A	AB	ABC	state%1:15:01::	A	A	AB	ABC	 've got a quarter of a million Germans in my <font color=green>state</font> , and those krautheads tune in on Father Werther every night	NN	imaginative	2	0	2.03	0	1	state
state/NN/br-k03/2311	0.000963895916217408	0.346337742052882	state	NN	fiction_gral	fiction	A4	A	AB	ABC	state%1:15:01::	A	A	AB	ABC	 he says,' Look here, there 's a mill in my <font color=green>state</font>  employs five thousand people making uniforms for the Navy.	NN	imaginative	3	1	1.72	0.33	2	state
state/NN/br-k05/60	0.0868860163704289	-0.241205461594408	state	NN	fiction_gral	fiction	C	C	C	ABC	secretary_of_state%1:18:00::	C1	C	C	ABC	 he was delivering a prescription from Dr. Verdi. Secretary of <font color=green>State</font>  Seward was a sick man. The idea had come from	NNP	imaginative	1	0	2.61	0	1	State
state/NN/br-k10/1990	-0.194146476990064	-0.0522170426352143	state	NN	fiction_gral	fiction	B	B	AB	ABC	state%1:14:01::	B	B	AB	ABC	 or unleavened bread are inconsequential. Geneva must remain a sovereign <font color=green>state</font> . We will not yield to the demands of Bern''! The	NN	imaginative	3	3	2.13	1	3	state
state/NN/br-k14/2245	0.0329690714279355	0.460617236482612	state	NN	fiction_gral	fiction	D	D	D	D	state%1:03:00::	D1	D	D	D	 worry; and by the second night he was in a <font color=green>state</font>  of panic: he could see nothing out of the afflicted	NN	imaginative	2	1	1.36	0.5	1	state
state/NN/br-k15/1299	-0.00296757207093971	-0.0904672663290385	state	NN	fiction_gral	fiction	A3	A	AB	ABC	state_government%1:14:00::	C2	C	C	ABC	 of the convention in Wheeling, Which had formed a new <font color=green>state</font>  government by declaring the government at Richmond in the east	NN	imaginative	3	2	1.76	0.67	4	state
state/NN/br-k15/210	0.334717683840313	0.350964377753533	state	NN	fiction_gral	fiction	D	D	D	D	state%1:03:00::	D1	D	D	D	 Kate moved through all the preparations and services in a <font color=green>state</font>  of bewilderment. She would not accept the death of such	NN	imaginative	1	0	1.61	0	1	state
state/NN/br-k27/1154	-0.0396378969773655	0.489867556916556	state	NN	fiction_gral	fiction	D	D	D	D	state%1:03:00::	D1	D	D	D	 words about the doctor 's provincial American speech and a <font color=green>state</font>  of nerves brought on by the demands of his work	NN	imaginative	1	1	1.53	1	1	state
state/NN/br-k27/586	-0.385063288257152	0.265389042791787	state	NN	fiction_gral	fiction	D	D	D	D	state%1:03:00::	D1	D	D	D	 sense of immediacy left him and he fell into a <font color=green>state</font>  of harmony with the birds around him. He stroked the	NN	imaginative	2	1	1.21	0.5	1	state
state/NN/br-l01/1511	0.0934034910866019	-0.108926160902062	state	NN	fiction_mystery	fiction	A4	A	AB	ABC	Z	Z	Z	Z	Z	 It was a fantastic story. Only two people in the <font color=green>state</font>  of Illinois knew that I was entering Hanover State Hospital	NN	imaginative	1	1	1.52	1	4	state
state/NN/br-l01/88	0.104941504784889	-0.108780816501614	state	NN	fiction_mystery	fiction	A1	A	AB	ABC	Z	Z	Z	Z	Z	 the patients, that technically I was a ward of the <font color=green>state</font>  of Illinois, going to a hospital for the mentally ill	NN	imaginative	2	2	1.38	1	5	state
state/NN/br-l16/162	-0.229554737837462	-0.0149844116666673	state	NN	fiction_mystery	fiction	D	D	D	D	emotional_state%1:26:00::	D1	D	D	D	 escaped him, followed by a sentiment that revealed his emotional <font color=green>state</font> .`` Why, I 'm not fit to touch the hem of	NN	imaginative	2	2	1.81	1	3	state
state/NN/br-l16/552	0.0552431623977789	-0.0969588825569731	state	NN	fiction_mystery	fiction	C	C	C	ABC	state_department%1:14:00::	C1	C	C	ABC	 Leigh. If you want to spend another day in the <font color=green>State</font>  Department- another day- you get in there and tell that	NNP	imaginative	1	1	1.66	1	2	State
state/NN/br-m01/1641	0.0395937141804919	-0.0673855825104461	state	NN	fiction_science	fiction	A5	A	AB	ABC	president_of_the_united_states%1:18:00::	A51	A	AB	ABC	 the purpose was less immediate. The President of the United <font color=green>States</font>  proclaimed the first Sunday in November as`` National Grandmothers '	NNPS	imaginative	1	0	1.31	0	3	States
state/NN/br-m02/939	0.253788754456557	-0.0431430807714196	state	NN	fiction_science	fiction	B	B	AB	ABC	state%1:15:01::	A	A	AB	ABC	 China, all of southeast Asia, southern India and Ceylon, these <font color=green>states</font>  of the Malay Federation spoke Bazaar. Siberia spoke Icelandic. His	NNS	imaginative	7	1	1.64	0.14	2	states
state/NN/br-m03/1014	-0.116603439041563	-0.122746487443362	state	NN	fiction_science	fiction	A5	A	AB	ABC	Z	Z	Z	Z	Z	 agreements, for instance, had been unreassuringly dismal; but the United <font color=green>States</font>  and the Union of Soviet Socialist Republics nevertheless did eventually	NNPS	imaginative	1	0	1.45	0	3	States
state/NN/br-n06/4	-0.204404674372731	0.224163191475017	state	NN	fiction_adventure	fiction	D	D	D	D	Z	Z	Z	Z	Z	 Such was my <font color=green>state</font>  of mind that I did not question the possibility of	NN	imaginative	2	0	1.01	0	1	state
state/NN/br-n07/1774	0.308657141366047	0.269055972823411	state	NN	fiction_adventure	fiction	A4	A	AB	ABC	Z	Z	Z	Z	Z	 Barton was free flashed across the central portion of the <font color=green>state</font> . It reached Donald Kruger in his massive home in Burlingame	NN	imaginative	3	0	1.48	0	2	state
state/NN/br-n11/1961	-0.035248307846711	0.257440575553305	state	NN	fiction_adventure	fiction	A4	A	AB	ABC	state%1:15:01::	A	A	AB	ABC	 for him by privately claiming every unsolved murder in the <font color=green>state</font> . It is also possible, but equally doubtful, that he actually	NN	imaginative	1	0	1.12	0	2	state
state/NN/br-p05/1180	0.0859974337281189	0.403573893235521	state	NN	fiction_romance	fiction	B	B	AB	ABC	Z	Z	Z	Z	Z	 Orient in their faces; there are beauties from the Balkan <font color=green>states</font>  who are similarly endowed, and- back in the blessed United	NNS	imaginative	1	0	2.25	0	1	states
state/NN/br-p05/1193	0.06340044173016	0.338757569605606	state	NN	fiction_romance	fiction	A5	A	AB	ABC	Z	Z	Z	Z	Z	 who are similarly endowed, and- back in the blessed United <font color=green>States</font> - they were regarded simply as pretty women. Now, having been	NNPS	imaginative	1	0	1.92	0	2	States
state/NN/br-p09/1670	-0.144252371373876	0.452972858437963	state	NN	fiction_romance	fiction	A5	A	AB	ABC	united_states%1:15:00::	A51	A	AB	ABC	 doing for them he would do all over the United <font color=green>States</font>  some day. So they stayed quiet and hung not on	NNPS	imaginative	1	0	1.6	0	1	States
state/NN/br-r01/934	0.158176142052726	0.178180774642293	state	NN	humor	fiction	D	D	D	D	Z	Z	Z	Z	Z	 Barco, policemen with shovels, newspaper reporters, and cameramen. Barco, his <font color=green>state</font>  of apprehension gone, never to return, had assumed a matter-of-factness	NN	imaginative	1	1	1.44	1	2	state
state/NN/br-r06/57	-0.35892278764953	0.341673518378304	state	NN	humor	fiction	D	D	D	D	state%1:03:00::	D1	D	D	D	 the venerable gentleman becomes an angry old man about the <font color=green>state</font>  of literature or something else that is dwindling and diminishing	NN	imaginative	3	0	1.55	0	1	state
state/NN/br-r09/1146	0.469699766521637	-0.0893371639309902	state	NN	humor	fiction	B	B	AB	ABC	state%1:15:01::	A	A	AB	ABC	 altogether different cup of tea. They hail from Travancore, a <font color=green>state</font>  in the subcontinent where Kali, the goddess of death, is	NN	imaginative	2	0	1.07	0	1	state
state/NNP/br-f04/1665	0.0372740301500713	-0.00375594135298601	state	NNP	popular_lore	fiction	A5	A	AB	ABC	Z	Z	Z	Z	Z	 Following a talk by Mr. Clark at the New York <font color=green>State</font>  Natural Food Associates Convention, a man from the audience offered	NNP	informative	2	1	2.23	0.5	7	State
state/NNP/br-f05/1004	0.0296650625061668	0.0156251779287981	state	NNP	popular_lore	fiction	A3	A	AB	ABC	Z	Z	Z	Z	Z	 set his plane down on Towne field back of the <font color=green>State</font>  House when the wind was right, and used Wilson flat	NNP	informative	2	1	1.82	0.5	6	State
state/NNP/br-f05/568	0.0313061279420181	0.000872405593885259	state	NNP	popular_lore	fiction	A3	A	AB	ABC	Z	Z	Z	Z	Z	 the flood. Though the makeshift airports were ready, the York <font color=green>State</font>  Guard flyers proved unable to keep any kind of mail	NNP	informative	2	1	1.88	0.5	7	State
state/NNP/br-f14/1306	-0.126796757791716	0.122243595978134	state	NNP	popular_lore	fiction	C	C	C	ABC	person%1:03:00::	C1	C	C	ABC	 German state, including the Reich Minister of the Interior, the <font color=green>State</font>  Secretary in charge of the Four Year Plan, the Reich	NNP	informative	4	0	2.09	0	2	State
state/NNP/br-f24/1708	0.0158289457812269	-0.0582875623533832	state	NNP	popular_lore	fiction	A5	A	AB	ABC	group%1:03:00::	B	B	AB	ABC	 Economics, headed the rural development division of USOM, the United <font color=green>States</font>  Operations Mission administering U. S. aid.`` What you see are	NNPS	informative	3	0	2.12	0	6	States
state/NNP/br-g02/719	0.00801896133534982	0.0139953101068003	state	NNP	belles_lettres	fiction	B	B	AB	ABC	Z	Z	Z	Z	Z	 Ratified in the Republican Party victory in 1952, the Positive <font color=green>State</font>  is now evidenced by political campaigns being waged not on	NNP	informative	4	3	2.57	0.75	7	State
state/NNP/br-g06/699	0.0836118643036788	0.0188150784960322	state	NNP	belles_lettres	fiction	B	B	AB	ABC	Z	Z	Z	Z	Z	 his tenure he also fulfilled guest engagements at the Berlin <font color=green>State</font>  Opera. Two years later he became director of the Frankfurt	NNP	informative	3	2	2.37	0.67	4	State
state/NNP/br-g07/30	0.0517308086477397	-0.0187356396830387	state	NNP	belles_lettres	fiction	A5	A	AB	ABC	Z	Z	Z	Z	Z	 That test, as President Kennedy forthrightly depicted it in his <font color=green>State</font>  of the Union message, will determine`` whether a nation organized	NNP	informative	2	0	1.72	0	3	State
state/NNP/br-g10/357	-0.065095382499024	-0.0321091925509924	state	NNP	belles_lettres	fiction	A	A	AB	ABC	Z	Z	Z	Z	Z	 the right to secede from it. This right of the <font color=green>State</font> , its upholders contended, was essential to maintain the federal balance	NNP	informative	4	2	2.1	0.5	7	State
state/NNP/br-k03/1304	0.429570034306558	0.216719212024532	state	NNP	fiction_gral	fiction	A2	A	AB	ABC	group%1:03:00::	B	B	AB	ABC	 a pharmacist. And so he had, so he had. At <font color=green>State</font>  College, he had no time to walk among the violets	NNP	imaginative	1	0	3	0	1	State
state/NNP/br-k03/485	0.124402742850851	0.197708056882024	state	NNP	fiction_gral	fiction	A5	A	AB	ABC	location%1:03:00::	A	A	AB	ABC	 I heard of some that tried it back in the <font color=green>States</font> , and he 'd knock them clear across the room. There	NNPS	imaginative	1	0	1.9	0	2	States
state/NNP/br-k15/1529	0.00344803128416493	-0.00741896761702156	state	NNP	fiction_gral	fiction	A3	A	AB	ABC	group%1:03:00::	B	B	AB	ABC	 the U.S. Army. In spite of the fact that the <font color=green>state</font>  legislature voted us neutral, John Hunt Morgan is openly flying	NN	imaginative	5	4	2.38	0.8	7	state
state/NNP/br-l01/1520	0.12082443118108	-0.0959881565234331	state	NNP	fiction_mystery	fiction	A2	A	AB	ABC	Z	Z	Z	Z	Z	 the state of Illinois knew that I was entering Hanover <font color=green>State</font>  Hospital under an assumed name, or why. It was unlikely	NNP	imaginative	1	1	2.86	1	4	State
state/NNPS/br-f02/8	0.0318547884645338	0.0560518084251823	state	NNPS	popular_lore	fiction	A5	A	AB	ABC	Z	Z	Z	Z	Z	 She was just another freighter from the <font color=green>States</font> , and she seemed as commonplace as her name. She was	NNPS	informative	1	0	2.37	0	4	States
state/NNPS/br-g07/2287	-0.00626259770106663	0.0475844510286427	state	NNPS	belles_lettres	fiction	A	A	AB	ABC	Z	Z	Z	Z	Z	 death, Madison expressed the wish`` that the Union of the <font color=green>States</font>  be cherished and perpetuated. Let the open enemy to it	NNPS	informative	1	0	3.87	0	8	States
state/NNPS/br-g10/1157	-0.0269299138907583	-0.020099799291073	state	NNPS	belles_lettres	fiction	A5	A	AB	ABC	Z	Z	Z	Z	Z	 United States of America''.`` We the people of the Confederate <font color=green>States</font> , each state acting in its sovereign and independent character, in	NNPS	informative	1	1	3.6	1	9	States
state/NNPS/br-g10/1255	-0.0810056803988811	0.0317811045301313	state	NNPS	belles_lettres	fiction	A	A	AB	ABC	Z	Z	Z	Z	Z	 of the Nineteenth century was fought. But though the Southern <font color=green>States</font> , when drafting a constitution to unite themselves, narrowed the difference	NNPS	informative	3	1	4.05	0.33	3	States
state/NNPS/br-g10/1505	0.0180453194490474	-0.00675889678494507	state	NNPS	belles_lettres	fiction	A	A	AB	ABC	Z	Z	Z	Z	Z	 of the slaves by Union action even in the Border <font color=green>States</font>  that stayed with the Union. He issued his Emancipation Proclamation	NNPS	informative	3	0	2.92	0	4	States
state/NNPS/br-g10/1942	-0.154745534868852	-0.0315910181667759	state	NNPS	belles_lettres	fiction	A	A	AB	ABC	Z	Z	Z	Z	Z	 the balance between the powers they had delegated to the <font color=green>States</font>  and to their Union. They differed in the balance they	NNPS	informative	3	2	4.74	0.67	4	States
state/NNPS/br-g10/2221	0.0105221937151691	0.0456626452643512	state	NNPS	belles_lettres	fiction	A	A	AB	ABC	Z	Z	Z	Z	Z	 from the ballot to the bullet. Yet though the Southern <font color=green>States</font>  lost the worst errors in their case, they did not	NNPS	informative	1	0	3.57	0	7	States
state/NNPS/br-g10/305	0.00365580868569068	-0.00153846934946777	state	NNPS	belles_lettres	fiction	A	A	AB	ABC	Z	Z	Z	Z	Z	 this subject. The difference came down to this: The Southern <font color=green>States</font>  insisted that the United States was, in last analysis, what	NNPS	informative	2	0	3.37	0	5	States
state/NNPS/br-g10/325	-0.00741671221212219	0.0131292529514048	state	NNPS	belles_lettres	fiction	A	A	AB	ABC	Z	Z	Z	Z	Z	 in last analysis, what its name implied- a Union of <font color=green>States</font> . To their leaders the Constitution was a compact made by	NNPS	informative	2	0	4.22	0	4	States
state/NNPS/br-g10/568	-0.0670770664590872	-0.0242121259802286	state	NNPS	belles_lettres	fiction	A1	A	AB	ABC	Z	Z	Z	Z	Z	 the base alloy of hypocrisy''.[ His emphasis] When the Southern <font color=green>States</font>  exercised their`` right to secede'', they formed what they officially	NNPS	informative	2	1	4.19	0.5	5	States
state/NNPS/br-l03/126	0.0612477382891503	0.0559259609772596	state	NNPS	fiction_mystery	fiction	A5	A	AB	ABC	Z	Z	Z	Z	Z	 on duty, too''.`` A night policeman just like in the <font color=green>States</font> . You know''?`` Canada does n't have much of this here	NNPS	imaginative	1	1	3.44	1	5	States
state/NNPS/br-l03/1478	0.0591053868987036	0.146715000724662	state	NNPS	fiction_mystery	fiction	A5	A	AB	ABC	Z	Z	Z	Z	Z	 a poor dumb Canadian or a smart aleck from the <font color=green>States</font> ''? Vince lifted his hand as if to strike, but his	NNPS	imaginative	2	0	4.38	0	6	States
state/NNPS/br-p05/410	-0.00662355193469038	-0.0145640659466993	state	NNPS	fiction_romance	fiction	A5	A	AB	ABC	Z	Z	Z	Z	Z	 marriage counselor- sometimes the Navy sent people back to the <font color=green>States</font>  to preserve a marriage- but mental health as a rule	NNPS	imaginative	1	0	3.7	0	8	States
state/NNS/br-f04/222	0.00563458602591259	-0.0374299905180181	state	NNS	popular_lore	fiction	A4	A	AB	ABC	Z	Z	Z	Z	Z	 ages eight to fourteen, grades four through eight. From fourteen <font color=green>states</font>  and three foreign countries they come to spend the months	NNS	informative	2	1	1.42	0.5	4	states
state/NNS/br-g02/1031	-0.0172760187879514	-0.0270401165204445	state	NNS	belles_lettres	fiction	A	A	AB	ABC	Z	Z	Z	Z	Z	 nation-wide taxation rather than by a levy only on those <font color=green>states</font>  afflicted with manpower surplus. The American people have indeed come	NNS	informative	5	2	2.59	0.4	5	states
state/NNS/br-g02/66	-0.103765377429795	-0.0304023906080827	state	NNS	belles_lettres	fiction	B	B	AB	ABC	Z	Z	Z	Z	Z	 territorial borders. Outside those limits it asserted, as against other <font color=green>states</font> , a position of sovereign equality, and, as against the`` inferior	NNS	informative	4	3	3.2	0.75	6	states
state/NNS/br-g08/986	-0.0223124251200724	0.0352445836196777	state	NNS	belles_lettres	fiction	A4	A	AB	ABC	Z	Z	Z	Z	Z	 's evidence, such as the fact that only three Southern <font color=green>states</font> ( South Carolina, Alabama and Mississippi) still openly defy integration, would	NNS	informative	5	2	2.67	0.4	7	states
state/NNS/br-g10/1053	-0.0253452580206309	-0.0226494163771159	state	NNS	belles_lettres	fiction	B	B	AB	ABC	Z	Z	Z	Z	Z	 in making their government the people were acting through their <font color=green>states</font> , whereas the Preamble of 1787- 89 expressed, as clearly as	NNS	informative	4	2	1.8	0.5	4	states
state/NNS/br-g10/1304	-0.142867461327066	-0.0294972187572274	state	NNS	belles_lettres	fiction	B	B	AB	ABC	Z	Z	Z	Z	Z	 on the concept that it was composed primarily of sovereign <font color=green>states</font> . If the Union conceded this to them, the same right	NNS	informative	2	1	3.73	0.5	5	states
state/NNS/br-g10/1341	-0.0643606522049739	-0.0670139375392785	state	NNS	belles_lettres	fiction	A	A	AB	ABC	Z	Z	Z	Z	Z	 This would destroy the federal balance between it and the <font color=green>states</font> , and in the end sacrifice to the sovereignty of the	NNS	informative	3	3	2.95	1	4	states
