id	model.x	model.y	lemma	pos	marisense	mbroad	mari3	mari2	sensekey	wnsense	wnbroad	wn3	wn2	text	cues	cues_with_weight	mean_weight	weighted.cues_ratio	weighted_cw	genre	broad_genre
state/NNP/br-c02/2186	-0.0569018442674164	-0.00234691676793794	state	NNP	A5	A	AB	ABC	group%1:03:00::	B	B	AB	ABC	 Earlier this month Edward R. Murrow, director of the United <font color=green>States</font>  Information Agency, came to Hollywood and had dinner with more	2	0	2.97372081685199	0	4	press_reviews	press
state/NNP/br-d10/1491	0.00824348774343488	0.0247278882306917	state	NNP	B	B	AB	ABC	Z	Z	Z	Z	Z	 between Hindus and Muslims; neither has the establishment of the <font color=green>State</font>  of Israel fostered harmony between Muslims and Jews. I turn	4	1	3.43910353097688	0.25	4	religion	non-fiction
state/NNP/br-d13/2068	-0.0309820433200083	-0.0160895552935323	state	NNP	A	A	AB	ABC	Z	Z	Z	Z	Z	 of Massachusetts, lies about thirty-one miles southeast of its mother <font color=green>State</font> . Some of the Island is sand and is not suitable	3	2	3.51940482177538	0.666666666666667	3	religion	non-fiction
state/NNP/br-e06/1531	0.18540952291079	-0.0507151823904294	state	NNP	A3	A	AB	ABC	Z	Z	Z	Z	Z	 10 horsepower before it can be used on Federal waterways. <font color=green>State</font>  numbering laws differ from each other in many ways. Fees	2	0	2.95828199371367	0	1	skill_and_hobbies	non-fiction
state/NNP/br-f05/1004	-0.0367063647514156	-0.0745651511883309	state	NNP	A3	A	AB	ABC	Z	Z	Z	Z	Z	 set his plane down on Towne field back of the <font color=green>State</font>  House when the wind was right, and used Wilson flat	2	0	2.63115818921059	0	1	popular_lore	fiction
state/NNP/br-g06/699	-0.0906196299873661	0.0362739477808474	state	NNP	B	B	AB	ABC	Z	Z	Z	Z	Z	 his tenure he also fulfilled guest engagements at the Berlin <font color=green>State</font>  Opera. Two years later he became director of the Frankfurt	3	0	3.21502987571757	0	1	belles_lettres	fiction
state/NNP/br-h03/276	-0.0288509450579226	-0.00693763731354979	state	NNP	A	A	AB	ABC	Z	Z	Z	Z	Z	 the usual distinction of saying that he was from the <font color=green>State</font>  of Texas. I did so because I agree with so	1	1	2.82784739399952	1	2	miscellaneous	non-fiction
state/NNP/br-h03/945	-0.00437913496608481	0.0172436288691497	state	NNP	A	A	AB	ABC	Z	Z	Z	Z	Z	 needs, the aspirations, the interests of my district and my <font color=green>State</font> . What Sam Rayburn 's life proves to us all is	3	2	3.14313917232681	0.666666666666667	3	miscellaneous	non-fiction
state/NNP/br-h03/990	-0.0439709759442771	0.0157967337320596	state	NNP	A	A	AB	ABC	Z	Z	Z	Z	Z	 's own community, one 's own district, one 's own <font color=green>State</font> , and by that help himself represent even better the sweep	3	1	2.74691023412656	0.333333333333333	2	miscellaneous	non-fiction
state/NNP/br-h04/1565	0.173341500706817	-0.115808761505659	state	NNP	A2	A	AB	ABC	Z	Z	Z	Z	Z	 assignment, and replacement of all vehicles.( Note: So far as <font color=green>State</font>  Police cars are concerned, only their replacement is under this	2	0	3.16151023532694	0	2	miscellaneous	non-fiction
state/NNP/br-h05/1109	-0.0996880852211356	0.0332305778708134	state	NNP	A3	A	AB	ABC	Z	Z	Z	Z	Z	 The Institute of Public Administration, in its report to the <font color=green>State</font>  Fiscal Study Commission in 1959, recommended`` consolidating and centralizing all	4	0	2.92716208499986	0	1	miscellaneous	non-fiction
state/NNP/br-h08/1102	-0.113663096542967	0.0679342543043729	state	NNP	A3	A	AB	ABC	Z	Z	Z	Z	Z	 from our own community by attending our Pageants and the <font color=green>State</font>  Pageant June 17; And now, therefore, do I, John A.	2	0	2.90785114008678	0	1	miscellaneous	non-fiction
state/NNP/br-h08/1355	-0.0538381859005369	0.00678229414745906	state	NNP	A	A	AB	ABC	Z	Z	Z	Z	Z	 therefore, do I, John A. Notte, Jr., Governor of the <font color=green>State</font>  of Rhode Island and Providence Plantations, proclaim Tuesday, October 24	4	1	3.76460525930112	0.25	5	miscellaneous	non-fiction
state/NNP/br-h08/1580	-0.0306636663693011	-0.00368280198070908	state	NNP	A2	A	AB	ABC	Z	Z	Z	Z	Z	 the middle of the acts or in the intermissions. The <font color=green>State</font>  Ballet of Rhode Island, the first incorporated group, was formed	2	0	3.53280613069105	0	3	miscellaneous	non-fiction
state/NNP/br-h08/1623	0.0498483117499052	-0.0342804986702331	state	NNP	A	A	AB	ABC	Z	Z	Z	Z	Z	 ballet performances, to contribute to the cultural life of the <font color=green>State</font> , and to provide opportunity for gifted dance students who, for	2	1	3.15562434653997	0.5	3	miscellaneous	non-fiction
state/NNP/br-h08/1673	-0.0857825392001403	-0.00276959978365269	state	NNP	A	A	AB	ABC	Z	Z	Z	Z	Z	 therefore, do I, John A. Notte, Jr., Governor of the <font color=green>State</font>  of Rhode Island and Providence Plantations, proclaim the week of	4	1	3.94677334214046	0.25	4	miscellaneous	non-fiction
state/NNP/br-h08/1722	-0.00223732569557168	0.00102291208895643	state	NNP	A	A	AB	ABC	Z	Z	Z	Z	Z	 event which should contribute to the cultural life of the <font color=green>State</font> . In testimony whereof, I have hereunto set my hand and	2	1	2.83038493260185	0.5	3	miscellaneous	non-fiction
state/NNP/br-h08/193	-0.0857825392001403	-0.00276959978365269	state	NNP	A	A	AB	ABC	Z	Z	Z	Z	Z	 therefore, do I, John A. Notte, Jr., Governor of the <font color=green>State</font>  of Rhode Island and Providence Plantations, proclaim the week of	4	1	3.94677334214046	0.25	4	miscellaneous	non-fiction
state/NNP/br-h08/2129	-0.0857825392001403	-0.00276959978365269	state	NNP	A	A	AB	ABC	Z	Z	Z	Z	Z	 therefore, do I, John A. Notte, Jr., Governor of the <font color=green>State</font>  of Rhode Island and Providence Plantations, proclaim Thursday, November 23	4	1	3.94677334214046	0.25	4	miscellaneous	non-fiction
state/NNP/br-h08/2215	-0.0152384153209924	-0.0248221949019469	state	NNP	A	A	AB	ABC	Z	Z	Z	Z	Z	 hereunto set my hand and caused the seal of the <font color=green>State</font>  to be affixed this 21 st day of November, in	2	1	3.45856690512189	0.5	4	miscellaneous	non-fiction
state/NNP/br-h08/547	-0.0599175300381882	-0.00779655389042181	state	NNP	A	A	AB	ABC	Z	Z	Z	Z	Z	 therefore, do i, John A. Notte, Jr., Governor of the <font color=green>State</font>  of Rhode Island and Providence Plantations, proclaim Saturday, May 20	4	1	3.82776875081921	0.25	5	miscellaneous	non-fiction
state/NNP/br-h08/888	-0.00457092721084088	-0.049464111303909	state	NNP	A	A	AB	ABC	Z	Z	Z	Z	Z	 hereunto set my hand and caused the seal of the <font color=green>State</font>  to be affixed this 20 th day of April, in	2	1	3.34480958859082	0.5	4	miscellaneous	non-fiction
state/NNP/br-h18/225	0.045828969243875	0.020747588620822	state	NNP	B	B	AB	ABC	person%1:03:00::	C1	C	C	ABC	 resolve differences between this and other departments. Assistant Secretaries of <font color=green>State</font>  will now carry an increased burden of active formulation and	2	1	2.86152661354364	0.5	2	miscellaneous	non-fiction
state/NNP/br-j10/2120	-0.0544792583092293	0.0178836476973093	state	NNP	A	A	AB	ABC	location%1:03:00::	A	A	AB	ABC	 for nomias. This may just be pride in my adopted <font color=green>State</font>  of Washington, but certainly I love to visit their mound	2	1	2.73851565666378	0.5	2	learned	non-fiction
state/NNP/br-k03/1304	-0.147012688718155	-0.19953137899553	state	NNP	A2	A	AB	ABC	group%1:03:00::	B	B	AB	ABC	 a pharmacist. And so he had, so he had. At <font color=green>State</font>  College, he had no time to walk among the violets	1	0	2.99934348051144	0	1	fiction_gral	fiction
state/NNP/br-l01/1520	-0.0329565126433426	-0.0111485022426439	state	NNP	A2	A	AB	ABC	Z	Z	Z	Z	Z	 the state of Illinois knew that I was entering Hanover <font color=green>State</font>  Hospital under an assumed name, or why. It was unlikely	1	1	3.03405137361998	1	3	fiction_mystery	fiction
state/NNPS/br-d08/142	-0.0105890120697153	-0.00368097790074254	state	NNPS	B	B	AB	ABC	Z	Z	Z	Z	Z	 only a longed-for ideal in the time of the Warring <font color=green>States</font> , was finally realized by the establishment of a Chinese Empire	3	1	4.26539635139571	0.333333333333333	5	religion	non-fiction
state/NNPS/br-g07/2287	-0.0282662612438993	-0.0323540721579273	state	NNPS	A	A	AB	ABC	Z	Z	Z	Z	Z	 death, Madison expressed the wish`` that the Union of the <font color=green>States</font>  be cherished and perpetuated. Let the open enemy to it	1	0	4.43013112472244	0	6	belles_lettres	fiction
state/NNPS/br-g10/1157	-0.00595978200768076	0.011019010450163	state	NNPS	A5	A	AB	ABC	Z	Z	Z	Z	Z	 United States of America''.`` We the people of the Confederate <font color=green>States</font> , each state acting in its sovereign and independent character, in	1	1	4.03134219651964	1	7	belles_lettres	fiction
state/NNPS/br-g10/1505	-0.0136709976195393	0.0315047340930506	state	NNPS	A	A	AB	ABC	Z	Z	Z	Z	Z	 of the slaves by Union action even in the Border <font color=green>States</font>  that stayed with the Union. He issued his Emancipation Proclamation	3	0	3.41203810669679	0	3	belles_lettres	fiction
state/NNPS/br-g10/568	0.00403611334255067	-0.00518881536454445	state	NNPS	A1	A	AB	ABC	Z	Z	Z	Z	Z	 the base alloy of hypocrisy''.[ His emphasis] When the Southern <font color=green>States</font>  exercised their`` right to secede'', they formed what they officially	2	1	4.18511443121857	0.5	5	belles_lettres	fiction
state/NNS/br-a03/1877	0.104723492267266	0.018220478054698	state	NNS	A1	A	AB	ABC	Z	Z	Z	Z	Z	 President said he will ask Congress to increase grants to <font color=green>states</font>  for vocational rehabilitation. He did not say by how much	3	1	4.26938470806476	0.333333333333333	2	press_reportage	press
state/NNS/br-a04/2052	0.0232057534776855	0.0131517880440972	state	NNS	A1	A	AB	ABC	Z	Z	Z	Z	Z	 through the enactment of legislation to provide federal grants to <font color=green>states</font>  for specified efforts in combating this disturbing crime trend. The	4	3	3.44994945392034	0.75	6	press_reportage	press
state/NNS/br-a08/613	-0.0302362442155237	0.0379529736498287	state	NNS	A	A	AB	ABC	Z	Z	Z	Z	Z	 of Vice-President L. B. Johnson. Then will come nine other <font color=green>states</font>  in the order of their admission to the union. Division	3	1	3.34900318603166	0.333333333333333	2	press_reportage	press
state/NNS/br-a26/1320	-0.0120715290793981	-0.0458386140176159	state	NNS	A4	A	AB	ABC	Z	Z	Z	Z	Z	 equipment. The firm recently expanded domestic sales into the Southeastern <font color=green>states</font>  as a result of an agreement with Cen-Tennial Gin Co.	3	0	3.29306092479003	0	3	press_reportage	press
state/NNS/br-a26/1671	0.000484479567490149	-0.0351052322677971	state	NNS	A4	A	AB	ABC	Z	Z	Z	Z	Z	 started here 14 years ago. They distribute equipment in 11 <font color=green>states</font> . The firm also handles gin and oil mill supplies such	3	2	3.275991311848	0.666666666666667	5	press_reportage	press
state/NNS/br-a28/397	0.0934764836554867	-0.0193400264342262	state	NNS	A	A	AB	ABC	Z	Z	Z	Z	Z	 sections are showing an upswing, however; the drought-seared North Central <font color=green>states</font>  are the most notable exceptions to the uptrend. The significance	3	0	4.01790146196736	0	2	press_reportage	press
state/NNS/br-a41/1111	0.00975473059872069	0.113547071284779	state	NNS	B	B	AB	ABC	Z	Z	Z	Z	Z	 Joseph Kasavubu) who favored splitting the country into small independent <font color=green>states</font> , Balkanizing it. Second, there were those( Moise Tshombe) who favored	4	0	3.47283677863055	0	2	press_reportage	press
state/NNS/br-b02/2106	0.0131887683937323	0.0206082511717543	state	NNS	A1	A	AB	ABC	Z	Z	Z	Z	Z	 expected to report out a good bill calling for the <font color=green>states</font>  to match federal funds. This year 's Senate measure would	4	2	2.85905200213323	0.5	3	press_editorial	press
state/NNS/br-b18/504	-0.0445974597281792	0.00127634508778216	state	NNS	B	B	AB	ABC	Z	Z	Z	Z	Z	 Smoldering Congo'' you make the following comment:`` Far too many <font color=green>states</font>  are following the Russian example in refusing to pay their	4	1	2.64558737674236	0.25	2	press_editorial	press
state/NNS/br-b26/1852	0.0238673907066636	0.0532845300388005	state	NNS	B	B	AB	ABC	Z	Z	Z	Z	Z	 the freedom of the individuals concerned and also for the <font color=green>states</font>  which have been threatened by Communist domination'. At least in	4	3	2.97371335102905	0.75	3	press_editorial	press
state/NNS/br-c12/229	-0.0131339036718988	-0.00748464414792108	state	NNS	A4	A	AB	ABC	Z	Z	Z	Z	Z	 to reaching this audience in about half of the 50 <font color=green>states</font> . These and other figures and comments have been reported in	1	0	3.23428041376159	0	3	press_reviews	press
state/NNS/br-c12/526	0.00998940137621904	0.0850104712330279	state	NNS	A4	A	AB	ABC	Z	Z	Z	Z	Z	 half of the U. S. Negroes live outside the southeastern <font color=green>states</font> . Also, the state with the largest number of Negroes is	4	1	2.97277111586972	0.25	1	press_reviews	press
state/NNS/br-e06/1549	0.0104622289716647	-0.0775505582033965	state	NNS	A	A	AB	ABC	Z	Z	Z	Z	Z	 in many ways. Fees are not the same and some <font color=green>states</font>  do not require certain craft, such as sailboats with no	3	0	3.22858008334201	0	2	skill_and_hobbies	non-fiction
state/NNS/br-e06/1570	0.0158977092447232	-0.0241972903038135	state	NNS	A1	A	AB	ABC	Z	Z	Z	Z	Z	 sailboats with no power, to be registered at all. Many <font color=green>states</font>  have laws regulating the use of boat trailers and some	3	2	3.60349744958262	0.666666666666667	5	skill_and_hobbies	non-fiction
state/NNS/br-e06/1593	0.00908463936548218	-0.0268438099559186	state	NNS	A1	A	AB	ABC	Z	Z	Z	Z	Z	 have restrictions regarding the age of motor boat operators. Generally, <font color=green>states</font>  reserve for communities the right to have local ordinances regulating	4	2	3.56597592076241	0.5	6	skill_and_hobbies	non-fiction
state/NNS/br-g02/1031	0.101903218970321	0.0287730990310743	state	NNS	A	A	AB	ABC	Z	Z	Z	Z	Z	 nation-wide taxation rather than by a levy only on those <font color=green>states</font>  afflicted with manpower surplus. The American people have indeed come	5	1	3.60419681182215	0.2	2	belles_lettres	fiction
state/NNS/br-g10/1304	0.0336272513850286	0.0339727124179905	state	NNS	B	B	AB	ABC	Z	Z	Z	Z	Z	 on the concept that it was composed primarily of sovereign <font color=green>states</font> . If the Union conceded this to them, the same right	2	1	4.12585669251952	0.5	4	belles_lettres	fiction
state/NNS/br-g10/1587	-0.015215894605075	0.0703661966407622	state	NNS	B	B	AB	ABC	Z	Z	Z	Z	Z	 the free''. What Lincoln could not concede was that the <font color=green>states</font>  rather than the people were sovereign in the Union. He	4	2	4.3301528128964	0.5	3	belles_lettres	fiction
state/NNS/br-g10/1634	0.0138782003426109	0.0889548679082793	state	NNS	A	A	AB	ABC	Z	Z	Z	Z	Z	 fact that the Americans who upheld the sovereignty of their <font color=green>states</font>  did this in order to keep many of their people	3	2	3.49796204537206	0.666666666666667	3	belles_lettres	fiction
state/NNS/br-g10/1726	0.0037260473409682	0.0189434116518939	state	NNS	C	C	C	ABC	Z	Z	Z	Z	Z	 two concepts of the sovereign rights of men and of <font color=green>states</font> . On their decisive battlefield Lincoln did not distinguish between them	3	2	3.82083562760481	0.666666666666667	6	belles_lettres	fiction
state/NNS/br-g10/418	0.0097701194269902	0.0374987795827169	state	NNS	B	B	AB	ABC	Z	Z	Z	Z	Z	 that it was a compact among sovereign citizens rather than <font color=green>states</font> , and that therefore the states had no right to secede	3	2	4.27320454615589	0.666666666666667	3	belles_lettres	fiction
state/NNS/br-h04/397	0.00653311002218587	-0.0067792733657966	state	NNS	A4	A	AB	ABC	Z	Z	Z	Z	Z	 cars. A survey of practices and/ or policies in other <font color=green>states</font>  concerning assignment and use of state automobiles reveals several points	6	4	3.38365257857509	0.666666666666667	7	miscellaneous	non-fiction
state/NNS/br-h04/482	0.0146983471708812	-0.0032884298612774	state	NNS	A	A	AB	ABC	Z	Z	Z	Z	Z	 for acquisition, allocation and/ or maintenance of state-owned vehicles. Nineteen <font color=green>states</font>  report laws, policies or regulations for assigning state vehicles in	6	4	3.51013740716316	0.666666666666667	7	miscellaneous	non-fiction
state/NNS/br-h04/502	0.0625505708106608	-0.0845950426673953	state	NNS	A	A	AB	ABC	Z	Z	Z	Z	Z	 state vehicles in lieu of paying mileage allowances. Of these <font color=green>states</font>  the average`` change-over'' point( at which a car is substituted	4	2	3.95834852160903	0.5	3	miscellaneous	non-fiction
state/NNS/br-h05/401	-0.00202697059139989	0.0115180904476612	state	NNS	A	A	AB	ABC	Z	Z	Z	Z	Z	 to Rhode Island, but are recognized as common to all <font color=green>states</font> . Although the laws of the various states, in general, specify	4	1	3.38097775861115	0.25	4	miscellaneous	non-fiction
state/NNS/br-h05/409	0.0160188182903488	0.0185665054311317	state	NNS	A1	A	AB	ABC	Z	Z	Z	Z	Z	 common to all states. Although the laws of the various <font color=green>states</font> , in general, specify the situs of property, i. e., residence	5	2	3.27297640195342	0.4	3	miscellaneous	non-fiction
state/NNS/br-h06/1819	0.00328866875227228	0.0311784018845232	state	NNS	A	A	AB	ABC	Z	Z	Z	Z	Z	 and on a regional basis between the six New England <font color=green>states</font> . On the basis that all citizens of the state are	4	2	3.14581775324506	0.5	2	miscellaneous	non-fiction
state/NNS/br-h07/173	0.0205537303756643	0.00648653054793697	state	NNS	A	A	AB	ABC	Z	Z	Z	Z	Z	 taxes of approximately$ 450000. A review of practices in other <font color=green>states</font>  regarding fiscal uniformity is pertinent to this report. Included in	4	2	3.54174087842228	0.5	5	miscellaneous	non-fiction
state/NNS/br-h07/190	-0.00605351028832867	0.00052927868274357	state	NNS	A1	A	AB	ABC	Z	Z	Z	Z	Z	 pertinent to this report. Included in the findings are: Forty-six <font color=green>states</font> , including Rhode Island, end their fiscal year on June 30	4	1	3.19642841752521	0.25	5	miscellaneous	non-fiction
state/NNS/br-h07/207	-0.000568825494483049	-0.00626553439871293	state	NNS	A1	A	AB	ABC	Z	Z	Z	Z	Z	 end their fiscal year on June 30. The other four <font color=green>states</font>  end on varying dates: Alabama( Sept. 30), New York( March	5	2	3.63626307621262	0.4	6	miscellaneous	non-fiction
state/NNS/br-h07/241	-0.0018981558477846	0.0201371748055934	state	NNS	A1	A	AB	ABC	Z	Z	Z	Z	Z	 31), Pennsylvania( May 31), and Texas( August 31). In sixteen <font color=green>states</font> , the fiscal year ending of the cities( June 30) is	5	2	3.26985074705449	0.4	2	miscellaneous	non-fiction
state/NNS/br-h07/475	0.0120511151733852	-0.011652008938229	state	NNS	A1	A	AB	ABC	Z	Z	Z	Z	Z	 close their fiscal years on December 31. The remaining twelve <font color=green>states</font>  have varying fiscal years for the state, city and local	5	2	3.61119370911044	0.4	5	miscellaneous	non-fiction
