id	model.x	model.y	lemma	pos	marisense	mbroad	mari3	mari2	sensekey	wnsense	wnbroad	wn3	wn2	text	cues	cues_with_weight	mean_weight	weighted.cues_ratio	weighted_cw	genre	broad_genre
country/NNS/br-j22/397	0.107596659349689	0.0199779890059219	country	NNS	B3	B	B23	B	country%1:14:00::	B2	B	BB2	B	 As a nation, we feel an obligation to assist other <font color=green>countries</font>  in their development; but this obligation pertains only to countries	2	2	3.534542420064	1	4	learned	non-fiction
country/NNS/br-j22/408	0.0938557571247425	0.0118939362406466	country	NNS	B2	B	B23	B	country%1:14:00::	B2	B	BB2	B	 countries in their development; but this obligation pertains only to <font color=green>countries</font>  which are honestly seeking to become responsible members of a	4	3	2.99099665952339	0.75	3	learned	non-fiction
country/NNS/br-j22/429	0.0538919882626615	0.256553746839768	country	NNS	B2	B	B23	B	country%1:14:00::	B2	B	BB2	B	 a stable and forward-moving world community. When we look at <font color=green>countries</font>  like Iran, Iraq, Pakistan, and Burma, where substantial progress has	8	1	2.93743915498571	0.125	1	learned	non-fiction
country/NNS/br-j22/474	0.0990484955558673	0.01463674650775	country	NNS	B2	B	B23	B	country%1:14:00::	B2	B	BB2	B	 of centralized government exist, we find a second category of <font color=green>countries</font>  with a different set of problems and hence different priorities	4	1	2.68962192380317	0.25	3	learned	non-fiction
country/NNS/br-j22/603	0.0994479424131698	0.0396433344279925	country	NNS	B2	B	B23	B	country%1:14:00::	B2	B	BB2	B	 achieve the national goals of modernization already symbolically accepted. Most <font color=green>countries</font>  in this second category share the difficulty of having many	3	2	3.27877786139272	0.666666666666667	4	learned	non-fiction
country/NNS/br-j22/892	0.0572983217893248	0.0105395599046659	country	NNS	B2	B	B23	B	country%1:14:00::	B2	B	BB2	B	 performance can we provide telling assistance. With respect to those <font color=green>countries</font>  whose leaders prefer to live with their illusions, we can	2	2	2.49710777165481	1	4	learned	non-fiction
country/NNS/br-j22/929	0.0836775217237841	0.0220671750308773	country	NNS	B3	B	B23	B	country%1:14:00::	B2	B	BB2	B	 clear for all to see. Our technical assistance to these <font color=green>countries</font>  should place special emphasis on inducing the central governments to	4	2	2.47651997093587	0.5	3	learned	non-fiction
country/NNS/br-j37/1682	0.0770283289287083	0.0116108449246816	country	NNS	B2	B	B23	B	country%1:14:00::	B2	B	BB2	B	 solutions devised in the electoral experiences of the rapidly changing <font color=green>countries</font>  are often of comparative value and essential to evaluating election	4	2	3.024561717401	0.5	6	learned	non-fiction
country/NNS/br-j42/1418	0.105017318258223	0.0758561790074114	country	NNS	B2	B	B23	B	country%1:14:00::	B2	B	BB2	B	 the Common Law in England. Codification was followed in all <font color=green>countries</font>  by a growing amount of legislation, some changing and adjusting	4	1	2.23427323977469	0.25	2	learned	non-fiction
country/NNS/br-j42/428	0.22147778580354	0.0652336385327526	country	NNS	B2	B	B23	B	country%1:14:00::	B2	B	BB2	B	 from the North) was the neutralization of the Latin American <font color=green>countries</font> ; out of the question was the neutralization of Asia and	3	1	3.91250470328068	0.333333333333333	1	learned	non-fiction
country/NNS/br-j42/665	0.00691933479460381	0.0171501234951156	country	NNS	B2	B	B23	B	country%1:14:00::	B2	B	BB2	B	 civilization must formally enter into the circle of law governed <font color=green>countries</font> . They must do something with the acquiescence of the latter	3	2	2.85429166851836	0.666666666666667	4	learned	non-fiction
