id	model.x	model.y	lemma	pos	marisense	mbroad	mari3	mari2	sensekey	wnsense	wnbroad	wn3	wn2	text	cues	cues_with_weight	mean_weight	weighted.cues_ratio	weighted_cw	genre	broad_genre
state/NN/br-h04/368	0.00353352961991218	-0.168632034933241	state	NN	A2	A	AB	ABC	Z	Z	Z	Z	Z	 is reasonably economical for the state to have drivers garage <font color=green>state</font>  cars at their homes. The state has recently undertaken liability	3	0	2.72929389040317	0	1	miscellaneous	non-fiction
state/NN/br-h04/375	0.00353352961991218	-0.168632034933241	state	NN	A1	A	AB	ABC	Z	Z	Z	Z	Z	 to have drivers garage state cars at their homes. The <font color=green>state</font>  has recently undertaken liability insurance for drivers of state cars	4	0	2.72929389040317	0	2	miscellaneous	non-fiction
state/NN/br-h04/384	0.00353352961991218	-0.168632034933241	state	NN	A2	A	AB	ABC	Z	Z	Z	Z	Z	 The state has recently undertaken liability insurance for drivers of <font color=green>state</font>  cars. A survey of practices and/ or policies in other	4	0	2.72929389040317	0	1	miscellaneous	non-fiction
state/NN/br-h04/425	0.0624385274231203	-0.160864105049672	state	NN	A2	A	AB	ABC	Z	Z	Z	Z	Z	 practices. Forty-seven states assign or provide vehicles for employees on <font color=green>state</font>  business. Two other states provide vehicles, but only with legislative	4	2	2.7100830541375	0.5	2	miscellaneous	non-fiction
state/NN/br-h04/745	0.0717370022439853	-0.0989840331011275	state	NN	A1	A	AB	ABC	Z	Z	Z	Z	Z	 payments over$ 50 per month are more expensive to the <font color=green>state</font>  than the assignment of state-owned vehicles. Travel allowances, including subsistence	4	1	2.77704294615832	0.25	2	miscellaneous	non-fiction
state/NN/br-h04/821	0.0579269284846824	-0.203181380459052	state	NN	A1	A	AB	ABC	Z	Z	Z	Z	Z	 is difficult to pinpoint the time of origin of the <font color=green>state</font>  purchasing automobiles for use of employees in Rhode Island. Few	4	1	2.97080431858746	0.25	1	miscellaneous	non-fiction
state/NN/br-h06/1678	-0.133032935950417	-0.152541181971941	state	NN	A3	A	AB	ABC	Z	Z	Z	Z	Z	 that`` Metropolian Planning( in Rhode Island) means, or should mean, <font color=green>state</font>  planning'', the state guide plan will take into account the	2	0	2.92690413971222	0	1	miscellaneous	non-fiction
state/NN/br-h07/1010	0.0153773218285837	0.0545837503074763	state	NN	A4	A	AB	ABC	Z	Z	Z	Z	Z	 sums of money to the several local governments in this <font color=green>state</font>  as indicated below: It has been said that when local	4	2	2.67932875827011	0.5	2	miscellaneous	non-fiction
state/NN/br-h07/482	0.0153773218285837	0.0545837503074763	state	NN	A3	A	AB	ABC	Z	Z	Z	Z	Z	 The remaining twelve states have varying fiscal years for the <font color=green>state</font> , city and local governments. However, only Illinois, Oregon, Louisiana and	7	2	2.67932875827011	0.285714285714286	2	miscellaneous	non-fiction
state/NN/br-h09/1237	-0.0628922011591399	0.0875954676436546	state	NN	C	C	C	ABC	secretary_of_state%1:18:00::	C1	C	C	ABC	 development may, subject to the approval of the Secretary of <font color=green>State</font>  to assure that such activities are consistent with the foreign	1	1	2.61125545952129	1	1	miscellaneous	non-fiction
state/NN/br-h09/1765	-0.141750117367018	0.0445967018096497	state	NN	Z	Z	Z	Z	state%1:14:01::	B	B	AB	ABC	 of this Act. As used in this section- the term`` <font color=green>State</font> '' includes the Commonwealth of Puerto Rico and any possession of	1	0	3.40815671351767	0	2	miscellaneous	non-fiction
state/NN/br-h09/1779	-0.0758218495511121	-0.0646804263032561	state	NN	A5	A	AB	ABC	united_states%1:14:00::	A52	A	AB	ABC	 Commonwealth of Puerto Rico and any possession of the United <font color=green>States</font> ; and the term`` commerce'' means commerce between any State and	1	0	3.19060322994418	0	3	miscellaneous	non-fiction
state/NN/br-h09/1791	-0.0746132509821587	-0.156756359496744	state	NN	A4	A	AB	ABC	state%1:14:01::	B	B	AB	ABC	 United States; and the term`` commerce'' means commerce between any <font color=green>State</font>  and any place outside thereof, or between points within the	4	2	2.6872678785036	0.5	3	miscellaneous	non-fiction
state/NN/br-h09/1886	-0.0628922011591399	0.0875954676436546	state	NN	A5	A	AB	ABC	united_states_of_america%1:15:00::	A51	A	AB	ABC	 by the Senate and House of Representatives of the United <font color=green>States</font>  of America in Congress assembled, That the Secretary of the	1	0	2.61125545952129	0	1	miscellaneous	non-fiction
state/NN/br-h09/832	0.0521307381718456	0.0617602484890511	state	NN	C	C	C	ABC	department_of_state%1:14:00::	C1	C	C	ABC	 the Department of Health Education and Welfare, the Department of <font color=green>State</font> , and other concerned agencies shall also be carried out in	2	1	2.82575415659074	0.5	1	miscellaneous	non-fiction
state/NN/br-h12/2127	-0.0628922011591399	0.0875954676436546	state	NN	C	C	C	ABC	secretary_of_state%1:18:01::	C1	C	C	ABC	 of the Treasury, upon the concurrence of the Secretary of <font color=green>State</font> , is authorized and directed, out of the sum covered into	3	1	2.61125545952129	0.333333333333333	1	miscellaneous	non-fiction
state/NN/br-h12/2215	-0.0628922011591399	0.0875954676436546	state	NN	C	C	C	ABC	secretary_of_state%1:18:01::	C1	C	C	ABC	 of the Yugoslav Claims Agreement of 1948. The Secretary of <font color=green>State</font>  shall certify to the Secretary of the Treasury the total	3	2	2.61125545952129	0.666666666666667	2	miscellaneous	non-fiction
state/NN/br-h12/468	0.0906767956590983	0.124626171777225	state	NN	A5	A	AB	ABC	united_states%1:15:00::	A51	A	AB	ABC	 as to any claims of the Government of the United <font color=green>States</font>  with respect to which the Commission has jurisdiction under this	1	0	3.12106015415318	0	1	miscellaneous	non-fiction
state/NN/br-h12/810	-0.0628922011591399	0.0875954676436546	state	NN	C	C	C	ABC	secretary_of_state%1:18:01::	C1	C	C	ABC	 the Secretary of the Treasury and to the Secretary of <font color=green>State</font>  copies of the awards made in favor of the Government	3	2	2.61125545952129	0.666666666666667	2	miscellaneous	non-fiction
state/NN/br-h12/844	-0.0628922011591399	0.0875954676436546	state	NN	C	C	C	ABC	secretary_of_state%1:18:01::	C1	C	C	ABC	 this Title. The Commission shall certify to the Secretary of <font color=green>State</font> , upon his request, copies of the formal submissions of claims	1	1	2.61125545952129	1	1	miscellaneous	non-fiction
state/NN/br-h14/1049	-0.000350798340528232	-0.0651687483067743	state	NN	A	A	AB	ABC	state%1:15:01::	A	A	AB	ABC	 in item 3 above by the result obtained for each <font color=green>State</font>  in item 1 above.) Determine the particular State 's`` allotment	3	0	2.82029823792568	0	4	miscellaneous	non-fiction
state/NN/br-h14/1059	0.0260773502083672	-0.033146893498776	state	NN	A	A	AB	ABC	state%1:15:01::	A	A	AB	ABC	 for each State in item 1 above.) Determine the particular <font color=green>State</font>  's`` allotment percentage''. By law this is 75% for the	5	2	2.86484707240485	0.4	4	miscellaneous	non-fiction
state/NN/br-h14/1123	0.0260773502083672	-0.033146893498776	state	NN	A	A	AB	ABC	state%1:15:01::	A	A	AB	ABC	 the result obtained in item 4 above; except that no <font color=green>State</font>  shall have an allotment percentage less than 33- 1 3	2	2	2.86484707240485	1	4	miscellaneous	non-fiction
state/NN/br-h14/1209	0.147836502501605	-0.0187416689248693	state	NN	A	A	AB	ABC	state%1:15:01::	A	A	AB	ABC	 be used in this step.) Multiply the population of each <font color=green>State</font>  by the square of its allotment percentage.( Multiply result obtained	3	2	2.90939590688402	0.666666666666667	2	miscellaneous	non-fiction
state/NN/br-h14/1251	-0.000350798340528232	-0.0651687483067743	state	NN	A	A	AB	ABC	state%1:15:01::	A	A	AB	ABC	 the products obtained in item 8 above, for all the <font color=green>States</font> .( For each State, make all computations set forth in items	2	0	2.82029823792568	0	2	miscellaneous	non-fiction
state/NN/br-h14/1323	0.0229522063192495	-0.0541318636469623	state	NN	A	A	AB	ABC	state%1:15:01::	A	A	AB	ABC	 the result obtained in item 9 above.) Determine the particular <font color=green>State</font>  's unadjusted allotment for the particular fiscal year.( Multiply the	4	1	2.97838140236258	0.25	3	miscellaneous	non-fiction
state/NN/br-h14/1336	0.0229522063192495	-0.0541318636469623	state	NN	A	A	AB	ABC	state%1:15:01::	A	A	AB	ABC	 's unadjusted allotment for the particular fiscal year.( Multiply the <font color=green>State</font>  product in item 8 above by the result obtained in	4	1	2.97838140236258	0.25	3	miscellaneous	non-fiction
state/NN/br-h14/1356	0.0229522063192495	-0.0541318636469623	state	NN	A	A	AB	ABC	state%1:15:01::	A	A	AB	ABC	 result obtained in item 10 above.) Determine if the particular <font color=green>State</font>  's unadjusted allotment( result obtained in item 11 above) is	4	1	2.91514813658782	0.25	5	miscellaneous	non-fiction
state/NN/br-h14/1389	0.344148593168333	0.0957982194654885	state	NN	A	A	AB	ABC	state%1:15:01::	A	A	AB	ABC	 so lower its unadjusted allotment to its maximum allotment.( Each <font color=green>State</font>  's unadjusted allotment for any fiscal year, which exceeds its	5	3	3.29454773123637	0.6	3	miscellaneous	non-fiction
state/NN/br-h14/1444	0.0229522063192495	-0.0541318636469623	state	NN	A	A	AB	ABC	state%1:15:01::	A	A	AB	ABC	 by the amount of the excess.) Determine if the particular <font color=green>State</font>  's unadjusted allotment( result obtained in item 11 above) is	4	1	2.97838140236258	0.25	3	miscellaneous	non-fiction
state/NN/br-h14/1485	0.344152533461206	0.0957780362102563	state	NN	A	A	AB	ABC	state%1:15:01::	A	A	AB	ABC	 to its minimum allotment. Regardless of its unadjusted allotment, each <font color=green>State</font>  is guaranteed by law a minimum allotment each year equal	4	3	3.29454773123637	0.75	3	miscellaneous	non-fiction
state/NN/br-h14/1552	0.344148723235578	0.0957976734859172	state	NN	A	A	AB	ABC	state%1:15:01::	A	A	AB	ABC	 increase the unadjusted allotments to the specified minimum in those <font color=green>States</font>  where the unadjusted allotment is less than the minimum allotment	3	2	3.29454773123637	0.666666666666667	2	miscellaneous	non-fiction
state/NN/br-h14/1786	0.142821323786858	-0.0592967978968543	state	NN	A1	A	AB	ABC	state%1:15:01::	A	A	AB	ABC	 The percentage of Federal participation in such costs for any <font color=green>State</font>  is referred to in the law as that State 's	4	1	2.52424408253166	0.25	1	miscellaneous	non-fiction
state/NN/br-h14/2039	-0.0530465321406584	0.00236905930482366	state	NN	A5	A	AB	ABC	united_states%1:15:00::	A51	A	AB	ABC	 the Virgin Islands, Guam and Puerto Rico; the term`` United <font color=green>States</font> '' includes the several States and the District of Columbia and	1	0	3.44934225774158	0	4	miscellaneous	non-fiction
state/NN/br-h14/2082	-0.0489264635176338	-0.038279080910989	state	NN	A	A	AB	ABC	state%1:15:01::	A	A	AB	ABC	 The following steps are employed in the calculations: For each <font color=green>State</font> ( except the Virgin Islands, Guam, Puerto Rico, and, prior to	3	1	3.08465131014735	0.333333333333333	5	miscellaneous	non-fiction
state/NN/br-h14/2143	0.272107409834709	-0.0619058018869609	state	NN	A5	A	AB	ABC	united_states%1:15:00::	A51	A	AB	ABC	 above.) Determine the average per capita income for the United <font color=green>States</font>  for the last three years.( The same amount used in	1	0	3.03729644311599	0	2	miscellaneous	non-fiction
state/NN/br-h14/2182	0.117036202100917	-0.0476383663883544	state	NN	A5	A	AB	ABC	united_states%1:15:00::	A51	A	AB	ABC	 40% to the average per capita income of the United <font color=green>States</font> .( Divide 40 by the amount used in item 2 above	1	0	3.06737286004993	0	3	miscellaneous	non-fiction
state/NN/br-h14/2252	0.0428813644150413	-0.0586507482437442	state	NN	A5	A	AB	ABC	united_states%1:15:00::	A51	A	AB	ABC	 bears to the average per capita income of the United <font color=green>States</font> .( Multiply the result obtained in item 3 above by the	1	0	2.92879734052083	0	4	miscellaneous	non-fiction
state/NN/br-h14/789	-0.11285121926568	0.0106485866752062	state	NN	Z	Z	Z	Z	state%1:15:01::	A	A	AB	ABC	 allotments is specifically set forth in the Act. The term`` <font color=green>State</font> '' means the several States, the District of Columbia, the Virgin	1	0	3.70782693115455	0	1	miscellaneous	non-fiction
state/NN/br-h14/794	-0.0492540545550028	-0.0233865189791628	state	NN	A	A	AB	ABC	state%1:15:01::	A	A	AB	ABC	 forth in the Act. The term`` State'' means the several <font color=green>States</font> , the District of Columbia, the Virgin Islands, Guam and Puerto	3	0	3.01384712735983	0	3	miscellaneous	non-fiction
state/NN/br-h14/857	-0.0489264635176338	-0.038279080910989	state	NN	A	A	AB	ABC	state%1:15:01::	A	A	AB	ABC	 Hawaii. The following steps are employed in calculations: For each <font color=green>State</font> ( except Puerto Rico, Guam, the Virgin Islands, and, prior to	4	1	3.08465131014735	0.25	5	miscellaneous	non-fiction
state/NN/br-h14/981	-0.0111919512467952	-0.0237045034715493	state	NN	A	A	AB	ABC	state%1:15:01::	A	A	AB	ABC	 the result obtained in item 2 above.) Determine for each <font color=green>State</font> ( except the Virgin Islands, Guam and Puerto Rico, and, prior	3	1	3.00912186094116	0.333333333333333	7	miscellaneous	non-fiction
state/NN/br-h24/1574	-0.141750117367018	0.0445967018096498	state	NN	A5	A	AB	ABC	united_states%1:15:00::	A51	A	AB	ABC	 of abode for the tax year is outside the United <font color=green>States</font> ( including Alaska and Hawaii), Puerto Rico, or the Virgin Islands	1	0	3.40815671351767	0	2	miscellaneous	non-fiction
state/NN/br-h24/497	-0.0642545195638808	0.0275700675129718	state	NN	A5	A	AB	ABC	united_states%1:15:00::	A51	A	AB	ABC	 if they were citizens of the United States. Their United <font color=green>States</font>  tax returns are due April 16, 1962. However, if their	1	0	2.64660217455806	0	1	miscellaneous	non-fiction
state/NN/br-j22/976	0.0343729815206498	0.0790827943853044	state	NN	A3	A	AB	ABC	state%1:15:01::	A	A	AB	ABC	 the governments to develop their own technical assistance to communities, <font color=green>state</font>  and provincial governments, rural communities, and other smaller groups, making	3	2	2.71432034861301	0.666666666666667	2	learned	non-fiction
state/NN/br-j38/1818	0.0343729815206498	0.0790827943853044	state	NN	A3	A	AB	ABC	state_government%1:14:00::	C2	C	C	ABC	 unless a new industry is in sight and requests it. <font color=green>State</font>  governments have been taking the lead in establishing area vocational	2	1	2.71432034861301	0.5	1	learned	non-fiction
state/NN/br-j38/276	0.110336056272324	0.0388333751989329	state	NN	A3	A	AB	ABC	state%1:14:01::	B	B	AB	ABC	 is limited to half of the total expenditure, and the <font color=green>state</font>  or local districts must pay at least half. The state	3	1	2.55201375588215	0.333333333333333	1	learned	non-fiction
state/NN/br-j38/388	0.110336056272324	0.0388333751989329	state	NN	A1	A	AB	ABC	state%1:14:01::	B	B	AB	ABC	 matching fund principle has been in initially encouraging the poorest <font color=green>states</font>  and school districts to spend enough to obtain their full	3	1	2.55201375588215	0.333333333333333	1	learned	non-fiction
state/NN/br-j58/515	-0.0554348282639482	-0.0182710185060366	state	NN	A4	A	AB	ABC	state%1:15:01::	A	A	AB	ABC	 and butchered her citizens''. In the eastern section of the <font color=green>state</font>  the newspapers' reaction to Brown 's trial and sentence were	3	0	2.59403984446721	0	1	learned	non-fiction
state/NN/br-j58/840	-0.0554348282639482	-0.0182710185060366	state	NN	A4	A	AB	ABC	state%1:15:01::	A	A	AB	ABC	 Congressional offices from the eastern and western sections of the <font color=green>state</font> . During the month of November hardly a day passed when	2	0	2.59403984446721	0	1	learned	non-fiction
state/NN/br-j58/87	0.0343729815206498	0.0790827943853044	state	NN	A3	A	AB	ABC	state_government%1:14:00::	C2	C	C	ABC	 the liberation of the slaves but also the overthrow of <font color=green>state</font>  and federal governments. The Providence Daily Journal answered the Daily	2	1	2.71432034861301	0.5	1	learned	non-fiction
state/NN/br-k05/60	-0.0628922011591399	0.0875954676436546	state	NN	C	C	C	ABC	secretary_of_state%1:18:00::	C1	C	C	ABC	 he was delivering a prescription from Dr. Verdi. Secretary of <font color=green>State</font>  Seward was a sick man. The idea had come from	1	0	2.61125545952129	0	1	fiction_gral	fiction
state/NN/br-k10/1990	-0.054528119871772	0.115800951750284	state	NN	B	B	AB	ABC	state%1:14:01::	B	B	AB	ABC	 or unleavened bread are inconsequential. Geneva must remain a sovereign <font color=green>state</font> . We will not yield to the demands of Bern''! The	3	1	2.6626025159045	0.333333333333333	1	fiction_gral	fiction
state/NNP/br-a01/1928	0.0585749862179295	0.0228687724501737	state	NNP	A3	A	AB	ABC	group%1:03:00::	B	B	AB	ABC	 event Congress does provide this increase in federal funds'', the <font color=green>State</font>  Board of Education should be directed to`` give priority'' to	5	1	3.19412566697097	0.2	2	press_reportage	press
state/NNP/br-a01/352	0.00870353543844517	0.0103704829497055	state	NNP	A3	A	AB	ABC	group%1:03:00::	B	B	AB	ABC	 be effected''. The grand jury took a swipe at the <font color=green>State</font>  Welfare Department 's handling of federal funds granted for child	3	0	3.11699929483472	0	4	press_reportage	press
state/NNP/br-a01/392	0.0230345186670713	0.027891503513537	state	NNP	A3	A	AB	ABC	group%1:03:00::	B	B	AB	ABC	 Fulton County general assistance program'', the jury said, but the <font color=green>State</font>  Welfare Department`` has seen fit to distribute these funds through	3	0	2.68431868057382	0	3	press_reportage	press
state/NNP/br-a02/914	-0.0978875554889904	-0.0388789697836014	state	NNP	A2	A	AB	ABC	location%1:03:00::	A	A	AB	ABC	 will be sought later on but in the meantime the <font color=green>State</font>  Hospital board can accept gifts and donations of a site	1	1	2.82528953939376	1	1	press_reportage	press
state/NNP/br-a06/128	-0.0212677605978425	0.0119884779138807	state	NNP	A3	A	AB	ABC	Z	Z	Z	Z	Z	 500 women in Trenton Monday at a forum of the <font color=green>State</font>  Federation of Women 's Clubs. Hughes said Monday,`` It is	2	2	3.07004006206334	1	5	press_reportage	press
state/NNP/br-a06/2141	-0.230605026455862	0.0520544695594527	state	NNP	A3	A	AB	ABC	Z	Z	Z	Z	Z	 tangle with the Republican nominee''. Fifteen members of the Republican <font color=green>State</font>  Committee who are retiring- voluntarily- this year were honored yesterday	2	0	2.79921729908398	0	1	press_reportage	press
state/NNP/br-a06/422	0.00819341827608345	-0.0039366886821167	state	NNP	A2	A	AB	ABC	Z	Z	Z	Z	Z	 launched into what the issues should be in the campaign. <font color=green>State</font>  aid to schools, the continuance of railroad passenger service, the	3	1	2.96115307990141	0.333333333333333	3	press_reportage	press
state/NNP/br-a10/979	-0.0618632439637255	-0.00264999872292492	state	NNP	A3	A	AB	ABC	Z	Z	Z	Z	Z	 Circuit Judge. He will attend a meeting of the Republican <font color=green>State</font>  Central Committee Saturday in Portland and see the Washington-Oregon football	4	0	2.97387256773049	0	3	press_reportage	press
state/NNP/br-a12/821	-0.0469068211103508	-0.016903589500127	state	NNP	A5	A	AB	ABC	group%1:03:00::	B	B	AB	ABC	 bench. Wingback Jack Collins injured a knee in the Washington <font color=green>State</font>  game but insists he 'll be ready for Oklahoma. Last	3	3	3.04453079642509	1	5	press_reportage	press
state/NNP/br-a17/2060	-0.0655519294772866	-0.0301938870322307	state	NNP	A2	A	AB	ABC	Z	Z	Z	Z	Z	 Miss Shirley Joan Meredith, a former student of North Texas <font color=green>State</font>  University, was married Saturday to Larry W. Mills, who has	2	1	3.2795260323557	0.5	3	press_reportage	press
state/NNP/br-a17/2075	-0.0726121273287152	0.0024702171974533	state	NNP	A2	A	AB	ABC	Z	Z	Z	Z	Z	 married Saturday to Larry W. Mills, who has attended Arlington <font color=green>State</font>  College. They will live at 2705 Fitzhugh after a wedding	2	0	3.12980076281049	0	2	press_reportage	press
state/NNP/br-a18/1949	-0.0656299670823318	0.0213122485206379	state	NNP	Z	Z	Z	Z	Z	Z	Z	Z	Z	 will be hosts this Tuesday evening at dinner at the <font color=green>State</font>  st. home of the Walkers honoring Mrs. McConnell 's debutante	2	0	2.69497896546717	0	3	press_reportage	press
state/NNP/br-a19/775	-0.0401441639756344	0.0360654412675806	state	NNP	A3	A	AB	ABC	Z	Z	Z	Z	Z	 board member said later, that Dr. Thomas G. Pullen, Jr., <font color=green>State</font>  superintendent of schools, told Dr. Jenkins and a number of	3	2	3.15939747039224	0.666666666666667	3	press_reportage	press
state/NNP/br-a22/538	0.0313411929834139	0.0167617968008844	state	NNP	A	A	AB	ABC	Z	Z	Z	Z	Z	 other hand, Emory University derives its corporate existence from the <font color=green>State</font>  of Georgia.`` When and if it can do so without	1	1	3.32105749380222	1	2	press_reportage	press
state/NNP/br-a23/1258	0.113940402084225	-0.138756397933595	state	NNP	A2	A	AB	ABC	Z	Z	Z	Z	Z	 and entertainment for functions throughout the Northwest. These included Oregon <font color=green>State</font>  Fair, for which he had been booked on and off	3	0	3.14060355050762	0	1	press_reportage	press
state/NNP/br-a23/1535	-0.0811265869387542	-0.0399352965372769	state	NNP	A2	A	AB	ABC	Z	Z	Z	Z	Z	 the Year'' in national competition completed this week at Ohio <font color=green>State</font>  University, Columbus, Ohio. Tim Larson, a junior at Wilson High	2	2	3.46020987426494	1	3	press_reportage	press
state/NNP/br-a28/1967	-0.0319849781396771	0.0152429367677893	state	NNP	A3	A	AB	ABC	Z	Z	Z	Z	Z	 could be ruled taxable to them in the year made. <font color=green>State</font>  Briefs: Voters in four counties containing and bordering Denver authorized	4	1	3.2644482398954	0.25	3	press_reportage	press
state/NNP/br-a40/1784	-0.0171278791990141	0.101523371162102	state	NNP	A5	A	AB	ABC	Z	Z	Z	Z	Z	 fall, after state investigators questioned her white roommate at Wayne <font color=green>State</font> . But Holmes was rejected again`` on the basis of his	1	0	3.19520319649012	0	2	press_reportage	press
state/NNP/br-a43/66	0.17532018543205	0.00580325340015484	state	NNP	A3	A	AB	ABC	Z	Z	Z	Z	Z	 Things are looking up these days for many of the <font color=green>State</font>  turnpikes on which investors depend for income from their toll-road	4	1	3.21206251448977	0.25	1	press_reportage	press
state/NNP/br-a44/1069	-0.134469153801904	-0.0232098464047597	state	NNP	A2	A	AB	ABC	Z	Z	Z	Z	Z	 requests every day. It is connected by teletype with the <font color=green>State</font>  Library in Albany, which will supply any book to a	1	0	3.66883801655628	0	2	press_reportage	press
state/NNP/br-a44/278	0.138236167977656	-0.0923973821147778	state	NNP	A5	A	AB	ABC	Z	Z	Z	Z	Z	 book resources on a county-wide or regional basis. New York <font color=green>State</font>  has what is probably the most advanced of these co-operative	1	0	2.79921729908398	0	1	press_reportage	press
state/NNP/br-a44/346	-0.0457921278733953	-0.089391368129434	state	NNP	A5	A	AB	ABC	Z	Z	Z	Z	Z	 At one extreme are the systems of upper New York <font color=green>State</font> , where libraries in two or more counties combine to serve	1	0	2.90132460047785	0	2	press_reportage	press
state/NNP/br-a44/650	0.0568392171119805	-0.0237299878495953	state	NNP	A5	A	AB	ABC	Z	Z	Z	Z	Z	 nearly 95 per cent of the population of New York <font color=green>State</font>  now has access to a system, and enthusiastic librarians foresee	1	0	3.57939015521657	0	2	press_reportage	press
state/NNP/br-b01/1166	-0.0978875554889904	-0.0388789697836014	state	NNP	A2	A	AB	ABC	Z	Z	Z	Z	Z	 the form of a$ 1750000 budget increase for the Milledgeville <font color=green>State</font>  Hospital. Actually it amounts to$ 1250000 above what the institution	2	1	2.82528953939376	0.5	1	press_editorial	press
state/NNP/br-b04/1446	0.253635653516417	0.0568228590965964	state	NNP	A2	A	AB	ABC	Z	Z	Z	Z	Z	 to get gulled. According to The Chicago Tribune News Service, <font color=green>State</font>  Atty. Gen. Stanley Mosk of California has devised a series	3	0	3.13373067121986	0	1	press_editorial	press
state/NNP/br-b11/747	-0.165039073255579	-0.0186863457781895	state	NNP	A3	A	AB	ABC	Z	Z	Z	Z	Z	 Memorial Bldg., which graphically illustrates the CDC 's broad appeal. <font color=green>State</font>  Sen. Dick Richards will keynote; state and county committeemen, CDC	3	0	3.46342229630148	0	2	press_editorial	press
state/NNP/br-b14/1767	-0.0174068488550283	0.00685813876662439	state	NNP	A3	A	AB	ABC	Z	Z	Z	Z	Z	 and Lt. Gov. Byrd accepted the invitations of the Georgia <font color=green>State</font>  Chamber of Commerce to join the tour next November, the	2	1	3.02053429935626	0.5	5	press_editorial	press
state/NNP/br-b14/1827	-0.0119090589784616	-0.00230754560362905	state	NNP	A3	A	AB	ABC	Z	Z	Z	Z	Z	 opportunity, when the bravado comments are cast aside. The Georgia <font color=green>State</font>  Chamber of Commerce tried to guard against the danger of	2	1	2.98432484916834	0.5	7	press_editorial	press
state/NNP/br-b15/365	-0.0327297183449121	0.0190427324504765	state	NNP	A2	A	AB	ABC	Z	Z	Z	Z	Z	 grow. Mr. Richard Preston, executive director of the New Hampshire <font color=green>State</font>  Planning and Development Commission, in his remarks to the Governors	4	0	3.12643440016389	0	4	press_editorial	press
state/NNP/br-b25/264	-0.00222255532710655	0.2232233156535	state	NNP	A	A	AB	ABC	Z	Z	Z	Z	Z	 the dictatorship of the proletariat by an`` All People 's <font color=green>State</font> '', and also of having laid down the lines for a	1	0	3.57404251065819	0	1	press_editorial	press
