id	model.x	model.y	lemma	pos	marisense	mbroad	mari3	mari2	sensekey	wnsense	wnbroad	wn3	wn2	text	cues	cues_with_weight	mean_weight	weighted.cues_ratio	weighted_cw	genre	broad_genre
church/NN/br-k16/1431	-0.323531202621486	0.144985720838459	church	NN	D	D	DE	CDE	church%1:06:00::	D	D	DE	CDE	 thickets. Along Wappinger Creek in Dutchess County, past the white <font color=green>church</font>  at Fishkill, past Verplanck 's Point on the east bank	6	1	3.08781160200236	0.166666666666667	1	fiction_gral	fiction
church/NN/br-k16/2285	-0.218343222379286	0.0600757055342653	church	NN	E	E	DE	CDE	church_service%1:04:00::	E	E	DE	CDE	 him out of some dim corner of memory from a <font color=green>church</font>  service when he was a boy- yes, in a white	1	0	2.44286652326029	0	2	fiction_gral	fiction
church/NN/br-k19/213	0.0162909342295825	-0.126022439581869	church	NN	A	A	AB	AB	church%1:14:00::	B	B	AB	AB	 of this desire was due to his devotion to the <font color=green>church</font>  and how much was his own ego, demanding to be	1	1	2.50316061121197	1	3	fiction_gral	fiction
church/NN/br-k25/81	-0.0367304850295658	0.275677199641567	church	NN	D	D	DE	CDE	church%1:06:00::	D	D	DE	CDE	 whether a private residence in his Pennsylvania county or a <font color=green>church</font>  in Brazil, without it being obvious that he had done	3	1	2.23214549194464	0.333333333333333	1	fiction_gral	fiction
church/NN/br-l08/1824	-0.187211141336677	0.00679769549078139	church	NN	E	E	DE	CDE	church%1:04:00::	E	E	DE	CDE	 did n't feel good on Sunday, could n't go to <font color=green>church</font> - there 'd be a little argument, but she could be	3	1	3.06839351614526	0.333333333333333	1	fiction_mystery	fiction
church/NN/br-l08/2109	0.337439813548217	0.0209443067904241	church	NN	C	C	C	CDE	church%1:06:00::	D	D	DE	CDE	 with foreign sounding names, the ones went to the same <font color=green>church</font>  and- Different place, different job, different people, she 'd be	2	0	2.45528904325885	0	1	fiction_mystery	fiction
church/NN/br-m01/2360	-0.0727577696123779	0.129499225285366	church	NN	E	E	DE	CDE	church%1:04:00::	E	E	DE	CDE	 continued most of the week following that ill-starred trip to <font color=green>church</font> , during which period Mike stayed in his room and usually	1	0	2.27296748646489	0	1	fiction_science	fiction
church/NN/br-m01/265	0.0791817091960008	-0.276768942605708	church	NN	Z	Z	Z	Z	church%1:14:00::	B	B	AB	AB	 was no Martian concept to match it- unless one took`` <font color=green>church</font> '' and`` worship'' and`` God'' and`` congregation'' and many other words	1	0	3.57921913991125	0	1	fiction_science	fiction
church/NN/br-p01/1161	-0.146885758755635	0.155334711169181	church	NN	D	D	DE	CDE	church%1:06:00::	D	D	DE	CDE	 hill, rising with the hill to the top where the <font color=green>church</font>  was and beyond that to the cemetery. Only paved alleyways	7	2	3.234374373285	0.285714285714286	2	fiction_romance	fiction
church/NN/br-p01/21	-0.0967350764363343	0.0263356339713071	church	NN	D	D	DE	CDE	church_tower%1:06:00::	D	D	DE	CDE	 them he could have been the broken bell in the <font color=green>church</font>  tower which rang before and after Mass, and at noon	4	3	2.807689985914	0.75	4	fiction_romance	fiction
church/NN/br-p01/222	-0.0306174233980788	0.000322739405394021	church	NN	E	E	DE	CDE	church%1:04:00::	E	E	DE	CDE	 from its elders. Youth obeyed when commanded. It went to <font color=green>church</font>  on Sunday and one Saturday a month went to confession	5	3	2.65602364933207	0.6	6	fiction_romance	fiction
church/NN/br-p01/829	0.172682528302166	0.00578168030542266	church	NN	D	D	DE	CDE	church%1:06:00::	D	D	DE	CDE	 to Drexel Street and his back in opposition to the <font color=green>church</font>  behind him. For all he saw or cared to see	5	1	2.68177012495429	0.2	2	fiction_romance	fiction
church/NN/br-p09/150	-0.0879932099365257	-0.0113084914953922	church	NN	D	D	DE	CDE	church%1:06:00::	D	D	DE	CDE	 all right. Wednesday nights after youth fellowship. Out of the <font color=green>church</font>  and into his big car, it tooling over the road	4	0	2.21381905687956	0	3	fiction_romance	fiction
church/NN/br-p12/1014	-0.308649347760385	0.21055210138427	church	NN	D	D	DE	CDE	church%1:06:00::	D	D	DE	CDE	 Then they took a taxi to Trastevere.`` There 's a <font color=green>church</font>  you should see'', she said. And when they stood by	3	1	3.16101500602565	0.333333333333333	1	fiction_romance	fiction
church/NN/br-p12/1102	-0.297492092967736	0.00232320724052442	church	NN	D	D	DE	CDE	church_bell%1:06:00::	D	D	DE	CDE	 in the morning when he woke up at ten the <font color=green>church</font>  bells were ringing. He had never heard so many bells	2	1	2.5448897579877	0.5	2	fiction_romance	fiction
church/NN/br-p12/1260	-0.0592178224872997	-0.0552815967006321	church	NN	E	E	DE	CDE	church%1:04:00::	E	E	DE	CDE	 snuggled against him, he wondered if she ever went to <font color=green>church</font> . Why did he want her to go to church? he	2	0	2.78359622898791	0	2	fiction_romance	fiction
church/NN/br-p12/1270	-0.0592178224872997	-0.0552815967006321	church	NN	E	E	DE	CDE	church%1:04:00::	E	E	DE	CDE	 to church. Why did he want her to go to <font color=green>church</font> ? he wondered. Probably because it was a place where she	2	0	2.78359622898791	0	2	fiction_romance	fiction
church/NN/br-p12/1433	0.157805701754296	-0.24664030533935	church	NN	C	C	C	CDE	church%1:04:00::	E	E	DE	CDE	 woman though, she would take only what she needed from <font color=green>church</font> . It was too bad he was n't a Catholic himself	3	1	4.37928204639583	0.333333333333333	1	fiction_romance	fiction
church/NN/br-p12/1559	-0.534881513549987	-0.0402427657809138	church	NN	E	E	DE	CDE	church%1:04:00::	E	E	DE	CDE	 girl like Carla if she got up and went to <font color=green>church</font> . A half hour later he got her up to go	1	0	2.67843259457306	0	1	fiction_romance	fiction
church/NN/br-r05/1163	-0.160191874858638	0.0149869173329342	church	NN	C	C	C	CDE	church%1:06:00::	D	D	DE	CDE	 While Henry Morgan was escorting Miss Vera Green from the <font color=green>church</font>  social last Saturday night, a savage dog attacked them and	3	1	2.76445023800357	0.333333333333333	2	humor	fiction
church/NNP/br-d03/1914	-0.00617548696712013	-0.0205633214039991	church	NNP	B	B	AB	AB	group%1:03:00::	C	C	C	CDE	 the Observer depicting clergymen of the Church of England, the <font color=green>Church</font>  of Rome and the Nonconformist Church. The Catholic priest, though	5	2	4.13426812544131	0.4	6	religion	non-fiction
church/NNP/br-d03/1920	-0.0102258643963876	-0.0118433800654258	church	NNP	B	B	AB	AB	group%1:03:00::	C	C	C	CDE	 Church of England, the Church of Rome and the Nonconformist <font color=green>Church</font> . The Catholic priest, though somewhat superficially drawn, easily came out	5	3	3.8444046288351	0.6	6	religion	non-fiction
church/NNP/br-d03/2022	0.0114904924405868	-0.0202032917004655	church	NNP	B	B	AB	AB	group%1:03:00::	C	C	C	CDE	 comments were equally made by an Anglican parson, a Free <font color=green>Church</font>  minister and a Catholic priest. Catholic priests have frequently appeared	3	2	4.16712721836267	0.666666666666667	7	religion	non-fiction
church/NNP/br-d03/91	0.0384191087527402	-0.00633598945192411	church	NNP	A	A	AB	AB	group%1:03:00::	C	C	C	CDE	 the religious sphere so popularly discussed as Christian unity. The <font color=green>Church</font>  Unity Octave, January 18- 25, was enthusiastically devoted to prayer	5	2	3.29178043423902	0.4	5	religion	non-fiction
church/NNP/br-j57/304	-0.0113196532701105	-0.0302076744529181	church	NNP	B	B	AB	AB	group%1:03:00::	C	C	C	CDE	 Indeed, it is even surprising in the Canon of Christ <font color=green>Church</font>  and Regius Professor of Ecclesiastical History, who fathered this most	3	1	3.31801462270308	0.333333333333333	4	learned	non-fiction
church/NNP/br-k04/233	-0.0426847590769824	0.0235570586898059	church	NNP	D	D	DE	CDE	group%1:03:00::	C	C	C	CDE	 of this crowded region was the Allen African Methodist Episcopal <font color=green>Church</font> . It was an old and dirty wooden structure, sadly in	4	3	3.14222616394731	0.75	6	fiction_gral	fiction
church/NNP/br-k06/1930	-0.10424092664456	0.0143258518261627	church	NNP	D	D	DE	CDE	group%1:03:00::	C	C	C	CDE	 strike the steeples of the other churches; not of Drew <font color=green>Church</font> . A flash illumined the trees as a crooked bolt twigged	2	1	3.25689879087578	0.5	3	fiction_gral	fiction
church/NNP/br-k06/698	-0.145723946343655	-0.23419183840273	church	NNP	D	D	DE	CDE	group%1:03:00::	C	C	C	CDE	 the foothills, was the city of God. The Dutch Reformed <font color=green>Church</font> , with two steeples and its own school was on Main	4	0	2.59437691365385	0	1	fiction_gral	fiction
church/NNP/br-k06/714	-0.00185247401361302	-0.0598487656672567	church	NNP	D	D	DE	CDE	group%1:03:00::	C	C	C	CDE	 and its own school was on Main Street; the Episcopal <font color=green>Church</font>  was one block down Sussex Street; the Catholic Saint Mary's	4	1	4.15787350694977	0.25	2	fiction_gral	fiction
church/NNP/br-k06/726	-0.020217050852409	-0.00467284870398455	church	NNP	D	D	DE	CDE	group%1:03:00::	C	C	C	CDE	 was one block down Sussex Street; the Catholic Saint Mary's <font color=green>Church</font> , with an even taller steeple and a cross on top	5	1	4.10176907869684	0.2	3	fiction_gral	fiction
church/NNP/br-k06/841	-0.0461071713180516	0.00407696515395389	church	NNP	D	D	DE	CDE	group%1:03:00::	C	C	C	CDE	 became familiar with God, who resided chiefly in Drew Centennial <font color=green>Church</font>  with its high steeple and clock. There was no church	3	1	3.43281726206981	0.333333333333333	4	fiction_gral	fiction
church/NNP/br-k06/855	-0.0678391139437718	-0.0161557336059818	church	NNP	D	D	DE	CDE	group%1:03:00::	C	C	C	CDE	 high steeple and clock. There was no church like Drew <font color=green>Church</font> , no preacher like Papa, who was intimate with Him, and	2	1	3.76473133724878	0.5	5	fiction_gral	fiction
church/NNP/br-k10/1229	-0.0300940388915777	-0.0228169089183315	church	NNP	B	B	AB	AB	group%1:03:00::	C	C	C	CDE	 smashing images and tearing down symbols sacred to the Old <font color=green>Church</font> . John found it difficult, but he held him in check	4	3	3.60506000655835	0.75	6	fiction_gral	fiction
church/NNS/br-d02/548	0.0428119508170407	-0.00132940172970449	church	NNS	B	B	AB	AB	church%1:14:00::	B	B	AB	AB	 observed to characterize the preaching and teaching of the American <font color=green>churches</font> . In the absence of a truly adequate conceptuality in which	3	1	2.63138682911329	0.333333333333333	5	religion	non-fiction
church/NNS/br-d03/1011	0.0853384046244397	0.216488279109815	church	NNS	D	D	DE	CDE	church%1:06:00::	D	D	DE	CDE	 often, the sale of 764 chapels''. Most of these former <font color=green>churches</font>  are now used as warehouses, but`` neither Anglicans nor Nonconformists	3	0	2.59775386916358	0	1	religion	non-fiction
church/NNS/br-d03/1027	0.0461228824880578	-0.167511032857565	church	NNS	D	D	DE	CDE	church%1:06:00::	D	D	DE	CDE	 as warehouses, but`` neither Anglicans nor Nonconformists object to selling <font color=green>churches</font>  to Roman Catholics'', and have done so. While it must	2	0	3.52201022051384	0	3	religion	non-fiction
church/NNS/br-d03/1051	0.057048891540214	-0.0174558197673152	church	NNS	D	D	DE	CDE	church%1:06:00::	D	D	DE	CDE	 be said that these same Protestants have built some new <font color=green>churches</font>  during this period, and that religious population shifts have emptied	4	2	3.14518794507178	0.5	4	religion	non-fiction
church/NNS/br-d03/1063	0.0282450534842472	0.00838582427615524	church	NNS	C	C	C	CDE	church%1:06:00::	D	D	DE	CDE	 during this period, and that religious population shifts have emptied <font color=green>churches</font> , a principal reason for this phenomenon of redundancy is that	5	4	3.00697658727012	0.8	6	religion	non-fiction
church/NNS/br-d03/110	0.0162200745525344	-0.000836844576014449	church	NNS	C	C	C	CDE	church%1:14:00::	B	B	AB	AB	 was enthusiastically devoted to prayer and discussion by the various <font color=green>churches</font> . Many people seem hopeful, yet it is difficult to predict	5	4	2.81700257677126	0.8	5	religion	non-fiction
church/NNS/br-d03/1472	0.109608931737303	-0.131823197982174	church	NNS	E	E	DE	CDE	church%1:06:00::	D	D	DE	CDE	 thy Son''. A hymn often to be heard in Catholic <font color=green>churches</font>  is`` Faith of our Fathers'', which glories in England 's	3	1	3.01694917008364	0.333333333333333	1	religion	non-fiction
church/NNS/br-d03/1884	0.00709886284123287	-0.00309185830831918	church	NNS	B	B	AB	AB	church%1:14:00::	B	B	AB	AB	 at least of equal stature in England with the Protestant <font color=green>churches</font> . On successive Sundays during October, 1960, Paul Ferris( a non-Catholic	2	2	3.13357127745217	1	6	religion	non-fiction
church/NNS/br-d03/313	0.017276582913641	-0.0657474345268167	church	NNS	B	B	AB	AB	anglican_church%1:14:00::	B2	B	AB	AB	 saying and writing and implying about the Roman and Anglican <font color=green>Churches</font>  and about the present religious state of England. Since the	5	3	3.48289566650028	0.6	3	religion	non-fiction
church/NNS/br-d03/35	-0.000752804876129076	-0.0273743815661337	church	NNS	B	B	AB	AB	anglican_church%1:14:00::	B2	B	AB	AB	 efforts of only unauthorized individuals of the Roman and Anglican <font color=green>Churches</font> , and urging a communion of prayer unacceptable to Rome, this	5	3	3.34532258775227	0.6	5	religion	non-fiction
church/NNS/br-d03/779	-0.00520580683451794	-0.02456395451251	church	NNS	D	D	DE	CDE	church%1:06:00::	D	D	DE	CDE	 less than ten. From many sides come remarks that Protestant <font color=green>churches</font>  are badly attended and the large medieval cathedrals look all	4	2	3.23792864718516	0.5	5	religion	non-fiction
church/NNS/br-d03/849	0.022482360530823	0.0191055660014288	church	NNS	C	C	C	CDE	church%1:06:00::	D	D	DE	CDE	 admit the great falling off in effective membership in their <font color=green>churches</font> . According to a newspaper report of the 1961 statistics of	2	2	2.6779609103552	1	6	religion	non-fiction
church/NNS/br-d03/929	0.034420281745156	0.0369305972246664	church	NNS	C	C	C	CDE	church%1:06:00::	D	D	DE	CDE	 the Manchester Guardian of last November, entitled`` Fate of Redundant <font color=green>Churches</font> '', states than an Archbishops' Commission`` reported last month that in	2	0	2.81552286483522	0	4	religion	non-fiction
church/NNS/br-d03/952	-0.0238499347015645	-0.012107218298182	church	NNS	C	C	C	CDE	church%1:06:00::	D	D	DE	CDE	 that in the Church of England alone there are 790 <font color=green>churches</font>  which are redundant now, or will be in 20 years	3	2	2.62033423788637	0.666666666666667	3	religion	non-fiction
church/NNS/br-f15/1245	0.0685059935170485	-0.014501513230524	church	NNS	B	B	AB	AB	church%1:14:00::	B	B	AB	AB	 Consider what happened during World War 1,, when the Protestant <font color=green>churches</font>  united to push the Prohibition law through Congress. Many of	2	2	3.49881741460129	1	5	popular_lore	fiction
church/NNS/br-f15/1425	0.214435702250701	-0.191266920910424	church	NNS	B	B	AB	AB	christian_church%1:14:00::	B	B	AB	AB	 turn of the century, contraception was condemned by all Christian <font color=green>churches</font>  as immoral, unnatural and contrary to divine law. This was	5	0	4.07218286657303	0	3	popular_lore	fiction
church/NNS/br-f15/1455	0.0195877283651831	-0.0155930256940006	church	NNS	B	B	AB	AB	orthodox_church%1:14:00::	B1	B	AB	AB	 laws of Christian countries. Today, the Roman Catholic and Orthodox <font color=green>Churches</font>  stand virtually alone in holding that conviction. The various Lambeth	5	5	3.35192621567683	1	8	popular_lore	fiction
church/NNS/br-f15/1720	0.0364677048704329	0.0145786952812771	church	NNS	B	B	AB	AB	group%1:03:00::	C	C	C	CDE	 28 members of a committee of the Federal Council of <font color=green>Churches</font>  ratified artificial methods of birth control.`` As to the necessity	4	2	2.76184578136971	0.5	5	popular_lore	fiction
church/NNS/br-f15/1887	0.0802209486384062	-0.0234275893138474	church	NNS	B	B	AB	AB	group%1:03:00::	C	C	C	CDE	 1961, by the general board of the National Council of <font color=green>Churches</font> , the largest Protestant organization in the US. The board approved	3	2	3.15074059609539	0.666666666666667	3	popular_lore	fiction
church/NNS/br-f15/1944	0.13948546730461	-0.0624111234846043	church	NNS	B	B	AB	AB	church%1:14:00::	B	B	AB	AB	 of contraceptives. The general board declared:`` Most of the Protestant <font color=green>churches</font>  hold contraception and periodic continence to be morally right when	4	1	2.74695319572317	0.25	3	popular_lore	fiction
church/NNS/br-f15/1998	0.175760623558629	-0.199618187982947	church	NNS	B	B	AB	AB	christian_church%1:14:00::	B	B	AB	AB	 of conception''. An action once universally condemned by all Christian <font color=green>churches</font>  and forbidden by the civil law is now not only	2	2	4.05330990190653	1	3	popular_lore	fiction
church/NNS/br-f15/821	0.0187323716842337	-0.0234295884921365	church	NNS	B	B	AB	AB	orthodox_catholic_church%1:14:00::	B1	B	AB	AB	 the exception of the Roman Catholic and the Orthodox Catholic <font color=green>Churches</font> , most churches make no moral distinction between rhythm and mechanical	6	6	3.92728011125074	1	9	popular_lore	fiction
church/NNS/br-f15/824	0.0165833759628364	-0.0162253858580809	church	NNS	B	B	AB	AB	church%1:14:00::	B	B	AB	AB	 of the Roman Catholic and the Orthodox Catholic Churches, most <font color=green>churches</font>  make no moral distinction between rhythm and mechanical or chemical	5	6	3.92949683722811	1.2	10	popular_lore	fiction
church/NNS/br-f44/1106	0.167479001062273	-0.080925912513164	church	NNS	C	C	C	CDE	church%1:14:00::	B	B	AB	AB	 who will strengthen the social class nucleus of the congregation. <font color=green>Churches</font>  can be strengthened through this process of co-optation so long	5	2	3.4363573853646	0.4	3	popular_lore	fiction
church/NNS/br-f44/1189	0.0481515952453262	0.0134063895355321	church	NNS	C	C	C	CDE	church%1:14:00::	B	B	AB	AB	 and publicity in reaching new members. The proclamation of the <font color=green>churches</font>  is almost totally confined to pastoral contacts by the clergy	7	3	3.21645861586986	0.428571428571429	5	popular_lore	fiction
church/NNS/br-f44/124	0.0177101428673873	0.0254143183069914	church	NNS	C	C	C	CDE	church%1:14:00::	B	B	AB	AB	 inner city blight account for the decline of central city <font color=green>churches</font> . Central cities reveal two adverse features for the major denominations	4	2	2.58627925989293	0.5	6	popular_lore	fiction
church/NNS/br-f44/1262	0.0616426189734776	0.0291014109269301	church	NNS	C	C	C	CDE	church%1:14:00::	B	B	AB	AB	 will account for a major share of recruitment by the <font color=green>churches</font> , making it quite evident that the extension of economic integration	2	0	2.60952439384908	0	4	popular_lore	fiction
church/NNS/br-f44/1427	0.0424198769312319	0.0255031161981739	church	NNS	C	C	C	CDE	church%1:14:00::	B	B	AB	AB	 for more than a single generation. The fact that metropolitan <font color=green>churches</font>  of the major denominations have moved approximately every generation for	4	3	3.29764670004341	0.75	6	popular_lore	fiction
church/NNS/br-f44/1475	0.0524258816496834	-0.0130364395910759	church	NNS	D	D	DE	CDE	church%1:06:00::	D	D	DE	CDE	 in religious life, when one recalls the number of city <font color=green>churches</font>  which deteriorated beyond repair before being abandoned, raises fundamental questions	4	2	2.96608781235231	0.5	4	popular_lore	fiction
church/NNS/br-f44/1683	-0.00352695506153455	0.0349181721075236	church	NNS	C	C	C	CDE	church%1:14:00::	B	B	AB	AB	 hopelessly unstable environment. More than creatures of metropolitan forces, the <font color=green>churches</font>  have taken the lead in counteracting the interdependence of metropolitan	2	2	3.49717170750286	1	5	popular_lore	fiction
church/NNS/br-f44/1802	0.00150855425930399	0.0665281285986647	church	NNS	D	D	DE	CDE	church%1:14:00::	B	B	AB	AB	 fight their way into the lower middle-class suburbs, and the <font color=green>churches</font>  will experience the same decay and rebuilding cycle which has	3	2	3.4346608580355	0.666666666666667	6	popular_lore	fiction
church/NNS/br-f44/1918	0.0402369098187606	-0.00935977355936987	church	NNS	C	C	C	CDE	church%1:14:00::	B	B	AB	AB	 of middle-class culture could lead to various projections for the <font color=green>churches</font> . It could be argued that any fellowship which centers in	3	3	3.04795441299106	1	5	popular_lore	fiction
church/NNS/br-f44/2015	-0.0138205700657209	-0.0186035740755957	church	NNS	C	C	C	CDE	church%1:14:00::	B	B	AB	AB	 next chapter to the style of association in the denominational <font color=green>churches</font> ; this style is characteristically an expression of the communal style	3	0	2.45169440028571	0	4	popular_lore	fiction
church/NNS/br-f44/2181	-0.0164297680919564	0.0543591900800366	church	NNS	C	C	C	CDE	church%1:14:00::	B	B	AB	AB	 have fashioned the iron cage of conformity which imprisons the <font color=green>churches</font>  in their suburban captivity. The perplexing question still remains as	2	1	2.57993234186034	0.5	3	popular_lore	fiction
church/NNS/br-f44/2201	-0.0164830184499874	0.0214885890694632	church	NNS	C	C	C	CDE	church%1:14:00::	B	B	AB	AB	 remains as to why the middle classes turn to the <font color=green>churches</font>  as a vehicle of social identity when their clubs and	5	3	2.70458907788663	0.6	5	popular_lore	fiction
church/NNS/br-f44/343	0.0246600189436019	0.0482757800147125	church	NNS	C	C	C	CDE	church%1:14:00::	B	B	AB	AB	 moreover, residential mobility is so high in metropolitan areas that <font color=green>churches</font>  have to recruit constantly in their core stratum in order	5	3	3.34297827941728	0.6	5	popular_lore	fiction
church/NNS/br-f44/868	-0.0882033500226626	0.0662256864303149	church	NNS	C	C	C	CDE	church%1:14:00::	B	B	AB	AB	 and congregational outreach have not been carefully studied in the <font color=green>churches</font> ; one study in Pittsburgh, however, has illuminated the situation. In	2	1	3.48671046072042	0.5	4	popular_lore	fiction
church/NNS/br-f44/890	0.0495529688238277	0.0617229564345145	church	NNS	C	C	C	CDE	church%1:14:00::	B	B	AB	AB	 the situation. In a sample of new members of Pittsburgh <font color=green>churches</font> , almost 60 per cent were recruited by initial`` contacts with	3	2	3.2592697640902	0.666666666666667	4	popular_lore	fiction
church/NNS/br-k01/769	-0.208882033631065	0.0749869788816989	church	NNS	D	D	DE	CDE	church%1:06:00::	D	D	DE	CDE	 It was a Negro section of peeling row houses, store-front <font color=green>churches</font>  and ragged children. Rachel had to bend toward Scotty and	2	0	2.66127490989341	0	3	fiction_gral	fiction
church/NNS/br-k04/2307	-0.0265765472389742	-0.0414810721968909	church	NNS	B	B	AB	AB	church%1:06:00::	D	D	DE	CDE	 his career in the Methodist church, if not in all <font color=green>churches</font> .	2	0	2.47282813564805	0	2	fiction_gral	fiction
church/NNS/br-k06/1925	-0.26415277772347	0.0455377111269102	church	NNS	D	D	DE	CDE	church%1:06:00::	D	D	DE	CDE	 them open. Lightning might strike the steeples of the other <font color=green>churches</font> ; not of Drew Church. A flash illumined the trees as	2	0	3.77670279945204	0	2	fiction_gral	fiction
country/NN/br-b20/2202	-0.292835816847528	0.0909641273448352	country	NN	B2	B	B23	B	country%1:14:00::	B2	B	BB2	B	 more serious should the cold war mount in frenzy. The <font color=green>country</font>  is committed to the doctrine of security by military means	5	0	2.48031020150283	0	1	press_editorial	press
country/NN/br-b20/308	-0.0199414987225804	0.0586251221829042	country	NN	B4	B	B14	B	country%1:15:00::	B1	B	B1	B	 that of diplomatic policy''. Morrison points out that since our <font color=green>country</font>  is more urbanized than the Soviet Union or Red China	5	2	2.33750842367562	0.4	3	press_editorial	press
country/NN/br-c01/2379	0.0449468509389214	0.00269524778874152	country	NN	B	B	B14	B	country%1:14:00::	B2	B	BB2	B	 in this last of the Russian films to reach this <font color=green>country</font>  in the program of joint cultural exchange. Also on the	4	2	2.12723967436343	0.5	3	press_reviews	press
country/NN/br-c01/621	0.145934920729372	0.192908083811272	country	NN	B1	B	B14	B	country%1:15:00::	B1	B	B1	B	 extraordinary, considers the finest house of its kind in the <font color=green>country</font> - and of course he does n't weep at the capacity	3	0	2.5133801027551	0	2	press_reviews	press
country/NN/br-c01/944	-0.107330018434999	0.173359841871731	country	NN	B1	B	B14	B	country%1:15:00::	B1	B	B1	B	 bookers, cancellation of one of the richest bookings in the <font color=green>country</font> . Will somebody please reopen the Auditorium? Paintings and drawings by	2	0	2.73971221823663	0	2	press_reviews	press
country/NN/br-c02/2222	-0.292835816847528	0.0909641273448352	country	NN	B4	B	B14	B	country%1:14:00::	B2	B	BB2	B	 storylines too. He intimated that they were n't doing the <font color=green>country</font>  much good in the Cold War. And to an industry	2	0	2.48031020150283	0	1	press_reviews	press
country/NN/br-c02/2265	0.337507027303727	-0.179643598591764	country	NN	B4	B	B14	B	country%1:14:00::	B2	B	BB2	B	 globe'', he said,`` the major source of impressions about this <font color=green>country</font>  are in the movies they meet. Would we want a	1	0	2.01030657225709	0	1	press_reviews	press
country/NN/br-d03/1224	0.0429926631082317	-0.0799568692155403	country	NN	B4	B	B14	B	country%1:14:01::	B	B	BB2	B	 seems no longer very meaningful to call England a`` Protestant <font color=green>country</font> ''. One of the ironies of the present crusade for Christian	2	2	2.24202320298879	1	2	religion	non-fiction
