id	model.x	model.y	lemma	pos	marisense	mbroad	mari3	mari2	sensekey	wnsense	wnbroad	wn3	wn2	text	cues	cues_with_weight	mean_weight	weighted.cues_ratio	weighted_cw	genre	broad_genre
country/NN/br-a06/106	-0.10836118089729	-0.0595448937069765	country	NN	A	A	A	A	Z	Z	Z	Z	Z	 Westfield Young Democratic Club cocktail party at the Scotch Plains <font color=green>Country</font>  Club. It was greeted with a chorus of boos by	4	1	3.06654727013611	0.25	2	press_reportage	press
country/NN/br-a18/1123	-0.0463780237307454	-0.0569434306149842	country	NN	A	A	A	A	Z	Z	Z	Z	Z	 exhibit and sale of paintings and sculpture at the Philmont <font color=green>Country</font>  Club on April 8 and 9. A preview party for	2	1	2.81479385460288	0.5	4	press_reportage	press
country/NN/br-a18/24	-0.076490138886549	-0.0173998143858295	country	NN	A	A	A	A	Z	Z	Z	Z	Z	 of the Thrift Shop Committee for May 6 at Philmont <font color=green>Country</font>  Club. The women have a reputation for giving parties that	3	1	3.30736050467298	0.333333333333333	2	press_reportage	press
country/NN/br-a26/490	-0.0924116310724118	-0.120949344821565	country	NN	B1	B	B14	B	Z	Z	Z	Z	Z	 price would be quoted regularly in newspapers all over the <font color=green>country</font> . He was also pleased with the wide distribution because he	5	0	3.14974085544546	0	1	press_reportage	press
country/NN/br-a29/2109	-0.11955496195977	-0.03475110286713	country	NN	A	A	A	A	Z	Z	Z	Z	Z	 The get-together Friday night will be a banquet at the <font color=green>country</font>  club patio and pool, and an orchestra will play for	4	1	3.1419587150034	0.25	1	press_reportage	press
country/NN/br-a30/1777	0.0193880452648901	-0.0968690723922575	country	NN	B1	B	B14	B	Z	Z	Z	Z	Z	 Longinotti. Newcomers of social note from other parts of the <font color=green>country</font>  are the Ray Carbones, formerly of Panama; the Geddes MacGregors	3	1	3.1373183354469	0.333333333333333	1	press_reportage	press
country/NN/br-a30/392	-0.188253409986711	-0.06421337431949	country	NN	B1	B	B14	B	Z	Z	Z	Z	Z	 Club, guests came by chartered plane from all over the <font color=green>country</font> . A flight originating in Florida picked up guests on the	4	0	2.94765071332908	0	2	press_reportage	press
country/NN/br-a33/399	-0.0201178706849296	0.0716863694745924	country	NN	B1	B	B14	B	Z	Z	Z	Z	Z	 Regional representatives appointed to serve from each section of the <font color=green>country</font>  include Frank E. Barnes of Boston. President Kennedy could n't	3	1	2.95191511211554	0.333333333333333	1	press_reportage	press
country/NN/br-a41/1455	-0.182123671304711	0.119734276123714	country	NN	B1	B	B14	B	Z	Z	Z	Z	Z	 the thousands of Belgian civilians who had remained in the <font color=green>country</font> . The Belgian government decided to act, and on July 10	2	0	3.26557267097058	0	2	press_reportage	press
country/NN/br-b01/1784	-0.164293007379246	0.0145705156114248	country	NN	B2	B	B23	B	Z	Z	Z	Z	Z	 character. Tardily the Government here came to understand how this <font color=green>country</font>  's own reputation was tarnished by the association with repression	3	1	3.47276229434255	0.333333333333333	1	press_editorial	press
country/NN/br-b05/2202	-0.057121964691087	-0.145975424138848	country	NN	B3	B	B23	B	Z	Z	Z	Z	Z	 day. Then off to a remote place in an underdeveloped <font color=green>country</font>  where the diet, culture, language and living conditions will be	7	1	2.79776443228828	0.142857142857143	1	press_editorial	press
country/NN/br-b10/2098	0.24901845064205	0.190003095395076	country	NN	B1	B	B14	B	Z	Z	Z	Z	Z	 in the past few years is still available in this <font color=green>country</font> . The work is executed in England( by hand) and can	3	0	2.70345375281704	0	1	press_editorial	press
country/NN/br-b16/284	0.0558495391533807	-0.0611258679914286	country	NN	B3	B	B23	B	Z	Z	Z	Z	Z	 in world peace, increased world trade, and prosperity for every <font color=green>country</font>  on the globe. Let us prepare for peace, instead of	5	2	2.79873143367757	0.4	2	press_editorial	press
country/NN/br-b18/873	0.0906767956590983	0.124626171777225	country	NN	B2	B	B23	B	Z	Z	Z	Z	Z	 did not include repeal of the Connally amendment to this <font color=green>country</font>  's domestic jurisdiction reservation to its Adherence to the Statute	4	1	2.72365646013456	0.25	1	press_editorial	press
country/NN/br-b27/1414	-0.109429897616123	-0.237973648989959	country	NN	B1	B	B14	B	Z	Z	Z	Z	Z	 in between. We had a couple of schools in this <font color=green>country</font> , the principal one being on the Marshall Field estate out	3	0	2.58123612009279	0	1	press_editorial	press
country/NN/br-b27/595	-0.0521966389264957	-0.298443020048769	country	NN	B4	B	B14	B	Z	Z	Z	Z	Z	 and personal opinion called yellow journalism which flourished in this <font color=green>country</font>  more than a generation ago. We do n't need this	3	1	2.76031813548121	0.333333333333333	2	press_editorial	press
country/NN/br-c01/621	0.062238858840454	0.168207680571262	country	NN	B1	B	B14	B	country%1:15:00::	B1	B	B1	B	 extraordinary, considers the finest house of its kind in the <font color=green>country</font> - and of course he does n't weep at the capacity	3	0	2.54645000400737	0	1	press_reviews	press
country/NN/br-c14/2215	-0.0924116310724118	-0.120949344821565	country	NN	B	B	B14	B	Z	Z	Z	Z	Z	 particular type of music or the music of a given <font color=green>country</font> . It is commendable that a regularly scheduled hour is set	2	0	3.14974085544546	0	1	press_reviews	press
country/NN/br-c15/2033	-0.32341327647147	-0.3649633999778	country	NN	A1	A	A	A	Z	Z	Z	Z	Z	 buoys in dozens of frostbite races. Some pleasant fall cruising <font color=green>country</font>  is mapped out below. Pleasure boating is just scooting into	3	0	3.39660093337698	0	1	press_reviews	press
country/NN/br-d03/249	-0.0944317263429749	0.340011691407586	country	NN	B4	B	B14	B	country%1:14:01::	B	B	BB2	B	 century literature of England, I knew only a Protestant dominated <font color=green>country</font> . Since arriving here, however, I have formed a far different	3	1	2.68365112552086	0.333333333333333	1	religion	non-fiction
country/NN/br-d11/1770	0.131523735535259	0.161624808040686	country	NN	B1	B	B14	B	Z	Z	Z	Z	Z	 would far rather die after a Russian occupation of this <font color=green>country</font> - by some deliberate act of refusal- than die uselessly by	1	0	2.93917608633811	0	1	religion	non-fiction
country/NN/br-d12/128	-0.0487820208909118	0.0680192168389501	country	NN	B4	B	B14	B	Z	Z	Z	Z	Z	 for the human aspirations of racial minority groups in this <font color=green>country</font> . It is not surprising that, as spokesman for real estate	3	0	2.83128712432692	0	1	religion	non-fiction
country/NN/br-d14/772	0.0690896424485237	0.179722086596183	country	NN	B4	B	B14	B	Z	Z	Z	Z	Z	 the Protestantism of the nineteenth-century immigration. The ideals of the <font color=green>country</font>  were deeply indebted to the Protestantism of the older stock	3	3	3.1266845752108	1	3	religion	non-fiction
country/NN/br-d17/1276	0.00363421698070729	-0.25600246226223	country	NN	B1	B	B14	B	Z	Z	Z	Z	Z	 during surgery, we asked others to pray; all over the <font color=green>country</font>  a massive shield of prayer was thrown around him. Today	4	0	2.58123612009279	0	1	religion	non-fiction
country/NN/br-e12/1718	-0.252379050629403	-0.238944145196165	country	NN	A1	A	A	A	Z	Z	Z	Z	Z	 hatched his boyish mischief. Similarly in Illinois there is Lincoln <font color=green>country</font>  to be seen- his tomb and other landmarks. Minnesota, fabled	3	1	2.74427574733729	0.333333333333333	1	skill_and_hobbies	non-fiction
country/NN/br-e12/2274	-0.152051422092374	-0.0882240071156237	country	NN	A	A	A	A	Z	Z	Z	Z	Z	 formations of eroded rock which loom out of the semiarid <font color=green>country</font>  in both parks. Colorado 's Grand Canyon, probably the most	4	0	2.65466358864761	0	1	skill_and_hobbies	non-fiction
country/NN/br-e12/31	-0.0626493954611749	0.162771086178736	country	NN	B1	B	B14	B	Z	Z	Z	Z	Z	 textbook description alone, the overwhelming space and variety of this <font color=green>country</font>  held together under one government. The miracle of democratic America	6	1	3.01133853258634	0.166666666666667	1	skill_and_hobbies	non-fiction
country/NN/br-e17/338	0.231159698029499	0.233528940434253	country	NN	B1	B	B14	B	Z	Z	Z	Z	Z	 that building codes and regulations vary so much throughout the <font color=green>country</font> , the first thing to do is to find out what	4	1	2.51283339320839	0.25	1	skill_and_hobbies	non-fiction
country/NN/br-e30/1177	0.104991546399803	-0.0127813103088724	country	NN	B1	B	B14	B	country%1:15:00::	B1	B	B1	B	 What 's your profit margin? In what section of the <font color=green>country</font>  are you located? Are you in a rural or urban	4	1	2.5400602059086	0.25	1	skill_and_hobbies	non-fiction
country/NN/br-f04/177	-0.000866251651287584	-0.112557956565948	country	NN	B1	B	B14	B	Z	Z	Z	Z	Z	 region of some of the loveliest mountain scenery in the <font color=green>country</font> , the school buildings are located amid open fields and farm	6	2	2.70365379282771	0.333333333333333	2	popular_lore	fiction
country/NN/br-f04/202	-0.027424291163091	-0.111321958572251	country	NN	A	A	A	A	Z	Z	Z	Z	Z	 These contemporary structures, beautifully adapted to a school in the <font color=green>country</font> , are home to 60 children, ages eight to fourteen, grades	3	0	2.93739700793132	0	3	popular_lore	fiction
country/NN/br-f05/2164	0.132500443972897	-0.129394239138826	country	NN	B1	B	B14	B	Z	Z	Z	Z	Z	 stubby plane as their link with the rest of the <font color=green>country</font> . The flyer had his share of near-misses. At Fort Ethan	3	1	2.5295004456936	0.333333333333333	1	popular_lore	fiction
country/NN/br-f09/444	0.0193880452648901	-0.0968690723922575	country	NN	B1	B	B14	B	Z	Z	Z	Z	Z	 parts of Europe and Egypt and finally back into this <font color=green>country</font> . She has been acting as a prostitute.`` Our information is	3	0	3.1373183354469	0	1	popular_lore	fiction
country/NN/br-f13/1645	0.104991546399803	-0.0127813103088724	country	NN	A	A	A	A	country%1:15:01::	A	A	A	A	 a neighborhood of well-kept homes. There are slums in the <font color=green>country</font>  as well as in the city. Few rural areas are	5	1	2.5400602059086	0.2	1	popular_lore	fiction
country/NN/br-f15/2048	-0.0423313362765658	-0.118375748063473	country	NN	B1	B	B14	B	country%1:14:00::	B2	B	BB2	B	 translated into action by the majority of people in this <font color=green>country</font> . Repeated polls have disclosed that most married couples are now	4	0	2.52964169860788	0	2	popular_lore	fiction
country/NN/br-f15/664	0.143846422761338	-0.0429945023859812	country	NN	B	B	B14	B	country%1:14:00::	B2	B	BB2	B	 necessities of life, the degree of population density of a <font color=green>country</font>  and the shortage of housing facilities may legitimately be taken	4	0	2.55503374769877	0	1	popular_lore	fiction
country/NN/br-f23/1643	0.214975801395411	-0.0559970974561577	country	NN	B2	B	B23	B	country%1:14:00::	B2	B	BB2	B	 first stage of a Communist takeover is to`` neutralize'' a <font color=green>country</font> . The second stage is to retain the nominal classification of	3	0	2.64518484469306	0	1	popular_lore	fiction
country/NN/br-g03/84	0.0417270728244042	-0.350354236876968	country	NN	B1	B	B14	B	Z	Z	Z	Z	Z	 the White House, in offices of key scientists across the <font color=green>country</font>  and aboard the submarines that prowl for months underwater, with	3	0	2.74427574733729	0	1	belles_lettres	fiction
country/NN/br-g18/1249	-0.0647643816312517	-0.0533627954314456	country	NN	B4	B	B14	B	country%1:14:01::;1:15:00::	B	B	BB2	B	 little patience with collective mediocrity. He saw Sweden as a <font color=green>country</font>  of smug and narrow provincialism, indifferent to the heroic spirit	3	0	2.89033410726727	0	3	belles_lettres	fiction
country/NN/br-g23/17	-0.119022935840745	-0.208151709105169	country	NN	B4	B	B14	B	country%1:14:00::	B2	B	BB2	B	 Woodrow Wilson 's administration, a red scare developed in our <font color=green>country</font> . Many Americans reacted irrationally to the challenge of Russia and	5	0	2.55503374769877	0	1	belles_lettres	fiction
country/NN/br-g28/2097	-0.186621722991602	-0.130268746062681	country	NN	A1	A	A	A	country%1:15:00::	B1	B	B1	B	 as a young man prepared to find in the new <font color=green>country</font>  the setting of romantic adventure and idealized beauty. But Thorpe	3	0	2.5295004456936	0	1	belles_lettres	fiction
country/NN/br-h02/351	0.41260733098274	-0.205556941678173	country	NN	B3	B	B23	B	Z	Z	Z	Z	Z	 programing and budgeting completely beyond the capabilities of the recipient <font color=green>country</font>  would result in the frustration of the basic objective of	3	1	3.65364603636687	0.333333333333333	1	miscellaneous	non-fiction
country/NN/br-h02/454	0.41263187043142	-0.205507527335847	country	NN	B3	B	B23	B	Z	Z	Z	Z	Z	 In such a case, however, we would encourage the recipient <font color=green>country</font>  to get on with its programing task, supply it with	5	1	3.65364603636687	0.2	1	miscellaneous	non-fiction
country/NN/br-h02/490	0.412621389670854	-0.20552910465681	country	NN	B3	B	B23	B	Z	Z	Z	Z	Z	 expansion or even a continuation of our assistance to the <font color=green>country</font>  's development was conditional upon programing progress being made. At	4	1	3.65364603636687	0.25	1	miscellaneous	non-fiction
country/NN/br-h03/1847	-0.15355925561588	0.185272095848444	country	NN	B4	B	B14	B	Z	Z	Z	Z	Z	 the greatest American public figures in the history of our <font color=green>country</font>  and I consider that I have been signally honored in	4	0	2.81998756907299	0	1	miscellaneous	non-fiction
country/NN/br-h03/351	-0.153559254108173	0.185272097039482	country	NN	B4	B	B14	B	Z	Z	Z	Z	Z	 alone his own district but all the people of our <font color=green>country</font> . To honor him is to honor ourselves. In this my	3	0	2.81998756907299	0	2	miscellaneous	non-fiction
country/NN/br-h03/688	-0.146238355490739	0.206431488430511	country	NN	B4	B	B14	B	Z	Z	Z	Z	Z	 honesty- all dedicated to secure the best interests of the <font color=green>country</font>  he has loved and served so long. May the Divine	3	0	2.57242549041063	0	1	miscellaneous	non-fiction
country/NN/br-j37/1184	-0.057121964691087	-0.145975424138848	country	NN	B1	B	B14	B	country%1:15:00::	B1	B	B1	B	 communication and understanding in the more remote areas of the <font color=green>country</font> , but it also served to minimize the national political value	3	1	2.79776443228828	0.333333333333333	1	learned	non-fiction
country/NN/br-k03/444	-0.0172625670712818	-0.0310428763472365	country	NN	A	A	A	A	country%5:00:01:rural:00	A	A	A	A	 or his own sentry. He was a wiry, inscrutable, silent <font color=green>country</font>  boy from the red clay of rural Alabama, and he	4	2	2.57696301931686	0.5	3	fiction_gral	fiction
country/NN/br-k08/973	-0.135150073634417	-0.0513412015498714	country	NN	A	A	A	A	country%1:15:01::	A	A	A	A	 just for this once, for this one weekend in the <font color=green>country</font> , he would make a little piece out of his melodies	3	1	3.10393131941416	0.333333333333333	1	fiction_gral	fiction
country/NN/br-l11/1246	-0.135150073634417	-0.0513412015498714	country	NN	A	A	A	A	country%1:15:01::	A	A	A	A	 a manner Esquire might suggest for the outdoor man 's <font color=green>country</font>  weekend. Dark gray sports jacket, lighter gray slacks, pink flannel	2	1	3.10393131941416	0.5	1	fiction_mystery	fiction
country/NN/br-n01/1082	-0.00762291829818043	-0.300732465640374	country	NN	A	A	A	A	Z	Z	Z	Z	Z	 He had seen a few nester wagons go through the <font color=green>country</font> , the families almost starving to death, but he had never	4	1	2.68365112552086	0.25	1	fiction_adventure	fiction
country/NN/br-n09/1051	0.278171389691828	0.430243537738274	country	NN	A	A	A	A	country%1:15:01::	A	A	A	A	 distant derrick of the wildcat- a test well in unexplored <font color=green>country</font> . And even with her limited knowledge of such things, she	2	0	2.64518484469306	0	1	fiction_adventure	fiction
country/NN/br-n11/2133	-0.143530491926441	-0.00599196868306245	country	NN	A1	A	A	A	country%1:15:02::	A1	A	A	A	 to frighten three rustling homesteaders out of the Upper Laramie <font color=green>country</font>  in a single week.`` My reputation 's my stock in	3	0	3.04045293367763	0	2	fiction_adventure	fiction
country/NNS/br-a04/938	-0.0112746308578551	0.0325335852846693	country	NNS	B2	B	B23	B	Z	Z	Z	Z	Z	 Viet Nam. They count on the aid of the neutral <font color=green>countries</font>  attending the Geneva conference to achieve this. The United States	4	3	3.16896167406768	0.75	4	press_reportage	press
country/NNS/br-a07/1587	-0.0238640821583955	0.0209326800510507	country	NNS	B3	B	B23	B	Z	Z	Z	Z	Z	 the successful banker. Indonesia is one of the twenty under-developed <font color=green>countries</font>  of Asia, Africa and Latin America that are receiving Soviet	4	0	3.27643793349998	0	3	press_reportage	press
country/NNS/br-a07/1628	0.0233492173201792	0.0335861916655812	country	NNS	B3	B	B23	B	Z	Z	Z	Z	Z	 technical and military assistance to the uncommitted nations. The Communist <font color=green>countries</font>  allocated more than$ 1000000000 in economic aid alone last year	5	2	3.12803182809828	0.4	2	press_reportage	press
country/NNS/br-a07/1659	0.106623420314531	-0.0648973621146245	country	NNS	B3	B	B23	B	Z	Z	Z	Z	Z	 biggest annual outlay since the Communist program for the under-developed <font color=green>countries</font>  made its modest beginning in 1954. In 1960 more than	3	0	2.91458101690966	0	1	press_reportage	press
country/NNS/br-a07/1678	0.0168332423382279	0.00770561166252096	country	NNS	B1	B	B14	B	Z	Z	Z	Z	Z	 1960 more than 6000 Communist technicians were present in those <font color=green>countries</font> . A committee of experts has recommended that a country 's	1	0	2.83564848057431	0	3	press_reportage	press
country/NNS/br-a10/231	0.0818767549590786	0.0513537951291578	country	NNS	B4	B	B14	B	Z	Z	Z	Z	Z	 want it will lack ritiuality and loyalty. Insuring that the <font color=green>countries</font>  have a freedom of choice, he said, was the biggest	2	0	2.90567551267229	0	2	press_reportage	press
country/NNS/br-a10/304	0.0339079811354398	-0.0501346702718468	country	NNS	B4	B	B14	B	Z	Z	Z	Z	Z	 Martin called for patience on the part of Americans.`` The <font color=green>countries</font>  are trying to build in a decade the kind of	2	0	3.40208352366398	0	2	press_reportage	press
country/NNS/br-a10/89	-0.00812376299441806	0.060357841471933	country	NNS	B2	B	B23	B	Z	Z	Z	Z	Z	 is married and the father of three children. Helping foreign <font color=green>countries</font>  to build a sound political structure is more important than	3	1	3.30323900670144	0.333333333333333	1	press_reportage	press
country/NNS/br-a26/1144	-0.00812376299441806	0.060357841471933	country	NNS	B3	B	B23	B	Z	Z	Z	Z	Z	 percentage of new gins in the U. S. and foreign <font color=green>countries</font>  contain machinery made in this area. The Murray Co. of	3	0	3.30323900670144	0	1	press_reportage	press
country/NNS/br-a34/1104	-0.0170897521748395	-0.0809246541158672	country	NNS	B	B	B14	B	Z	Z	Z	Z	Z	 would mean an unchecked spread of nuclear weapons to other <font color=green>countries</font>  as well as a fatal blow to any hope for	4	1	3.03112484067077	0.25	3	press_reportage	press
country/NNS/br-a34/1717	0.00466830075863516	0.0212421355460248	country	NNS	B2	B	B23	B	Z	Z	Z	Z	Z	 the major issues which affect the relationships between the two <font color=green>countries</font> ''. The Vienna meeting will bring together a seasoned, 67- year-old	2	0	2.83917418803468	0	3	press_reportage	press
country/NNS/br-a43/1639	0.047200654777888	-0.000266136522437671	country	NNS	B3	B	B23	B	Z	Z	Z	Z	Z	 U. S. will try to get agreement among the industrialized <font color=green>countries</font>  to take more textile imports from the less-developed countries over	5	2	3.79097174549849	0.4	3	press_reportage	press
country/NNS/br-a43/1648	0.047200654777888	-0.000266136522437671	country	NNS	B3	B	B23	B	Z	Z	Z	Z	Z	 industrialized countries to take more textile imports from the less-developed <font color=green>countries</font>  over the years. Point is that developing countries often build	5	2	3.48705078511057	0.4	4	press_reportage	press
country/NNS/br-a43/1738	0.0634177023229274	-0.0109860835446687	country	NNS	B3	B	B23	B	Z	Z	Z	Z	Z	 textile exports- especially dumping of specific products- to high-wage textile-producing <font color=green>countries</font> . Japan, since 1957, has been`` voluntarily'' curbing exports of textiles	4	0	2.84898373442384	0	1	press_reportage	press
country/NNS/br-a43/1789	-0.0165617068488968	-0.0198191895411646	country	NNS	B2	B	B23	B	Z	Z	Z	Z	Z	 for several years under the`` Lancashire Pact''. None of these <font color=green>countries</font>  is happy with these arrangements. The Japanese want to increase	3	2	2.62733902603609	0.666666666666667	2	press_reportage	press
country/NNS/br-a43/2111	0.0275367767799497	-0.0148622230264281	country	NNS	B3	B	B23	B	Z	Z	Z	Z	Z	 for other lines having difficulty competing with imports from low-wage <font color=green>countries</font> . Among the highest-paid workers in the world are U. S.	4	2	3.13036250014699	0.5	4	press_reportage	press
country/NNS/br-b13/1273	-0.251025438376819	-0.0133236377524691	country	NNS	B1	B	B14	B	country%1:15:00::	B1	B	B1	B	 desire to visit the`` smaller, less traveled and relatively inexpensive <font color=green>countries</font> '', and is now prepared to teach modern Greek and Portuguese	4	0	3.52638255801565	0	1	press_editorial	press
country/NNS/br-b16/263	0.139607332236139	0.0346097319629818	country	NNS	B3	B	B23	B	Z	Z	Z	Z	Z	 any other program to solve the problems of the underdeveloped <font color=green>countries</font>  would be an investment that would pay off in world	6	1	3.00622560682077	0.166666666666667	1	press_editorial	press
country/NNS/br-c16/1019	-0.0406998040662937	0.0277206351348966	country	NNS	B	B	B14	B	Z	Z	Z	Z	Z	 is Field Marshal Montgomery 's belief that in most Western <font color=green>countries</font>  about 60 per cent of the people do not really	2	1	2.95380307869502	0.5	3	press_reviews	press
country/NNS/br-f04/226	-0.00812376299441806	0.060357841471933	country	NNS	B	B	B14	B	Z	Z	Z	Z	Z	 grades four through eight. From fourteen states and three foreign <font color=green>countries</font>  they come to spend the months from mid-September to June	4	1	3.30323900670144	0.25	1	popular_lore	fiction
country/NNS/br-f14/1851	0.0132796794143187	0.000409612660290653	country	NNS	B1	B	B14	B	country%1:15:00::	B1	B	B1	B	 of the Jews in Germany and later in the occupied <font color=green>countries</font>  contributed to terrorizing the populations, splitting apart individuals and groups	4	2	2.94000479526991	0.5	3	popular_lore	fiction
country/NNS/br-f14/2151	0.0563933446117415	0.106083717141563	country	NNS	B1	B	B14	B	country%1:14:00::	B2	B	BB2	B	 Was n't this meaning of Eichmann 's experience in various <font color=green>countries</font>  worth highlighting? As the first collective confrontation of the Nazi	3	0	3.24806497811701	0	2	popular_lore	fiction
country/NNS/br-f15/1446	-0.120920516748358	0.092054413388712	country	NNS	B4	B	B14	B	country%1:14:00::	B2	B	BB2	B	 This was generally reflected in the civil laws of Christian <font color=green>countries</font> . Today, the Roman Catholic and Orthodox Churches stand virtually alone	4	0	2.935105739637	0	2	popular_lore	fiction
country/NNS/br-f15/290	0.00418859726229899	0.0399799378100829	country	NNS	B3	B	B23	B	country%1:14:00::	B2	B	BB2	B	 including birth-control information and material in foreign aid to underdeveloped <font color=green>countries</font> . Where it is not actually erupting, it rumbles and smolders	3	2	3.38975488438437	0.666666666666667	3	popular_lore	fiction
country/NNS/br-g12/2313	0.0205163026904405	-0.00100888530234959	country	NNS	B4	B	B14	B	country%1:14:00::	B2	B	BB2	B	 the technological and economic revolutions now going on in the <font color=green>countries</font>  of Asia and Africa, and also of course on how	5	3	3.46674778277855	0.6	3	belles_lettres	fiction
country/NNS/br-h02/1181	0.022279595719139	0.0119194549259367	country	NNS	B2	B	B23	B	Z	Z	Z	Z	Z	 many instances it can withhold or limit its aid to <font color=green>countries</font>  not yet willing to make such efforts. There are other	1	1	2.97410112901684	1	4	miscellaneous	non-fiction
country/NNS/br-h02/1193	-0.0100638823821315	0.0822355416940747	country	NNS	B2	B	B23	B	Z	Z	Z	Z	Z	 not yet willing to make such efforts. There are other <font color=green>countries</font>  where, with skillful diplomacy, we may be able by our	2	1	3.00736272881016	0.5	2	miscellaneous	non-fiction
country/NNS/br-h02/1242	-0.13482242301454	-0.11029467660766	country	NNS	B3	B	B23	B	Z	Z	Z	Z	Z	 Governments are rarely monolithic. But there will be still other <font color=green>countries</font>  where, despite the inadequacy of the level of self-help, we	4	1	3.58041495110938	0.25	2	miscellaneous	non-fiction
country/NNS/br-h02/1480	0.0219182663994066	-0.0109170288606885	country	NNS	B	B	B14	B	Z	Z	Z	Z	Z	 absorb the bulk of our capital assistance. The number of <font color=green>countries</font>  thus favorably situated is small, but their peoples constitute over	3	1	3.00032180459792	0.333333333333333	4	miscellaneous	non-fiction
country/NNS/br-h02/1779	0.0402626929576782	-0.0419969849260225	country	NNS	B3	B	B23	B	Z	Z	Z	Z	Z	 importantly, several of the more advanced of the less developed <font color=green>countries</font>  have found through experience that they must plan their own	3	2	3.85175470748572	0.666666666666667	3	miscellaneous	non-fiction
