id	model.x	model.y	lemma	pos	marisense	mbroad	mari3	mari2	sensekey	wnsense	wnbroad	wn3	wn2	text	cues	cues_with_weight	mean_weight	weighted.cues_ratio	weighted_cw	genre	broad_genre
country/NN/br-d03/1509	-0.156074603627022	-0.310163830938975	country	NN	B4	B	B14	B	country%1:14:01::	B	B	BB2	B	 Faith of our Fathers: Mary 's prayers/ Shall win our <font color=green>country</font>  back to thee''. The English saints are widely venerated, quite	3	1	2.84271582015055	0.333333333333333	1	religion	non-fiction
country/NN/br-d03/249	0.0641451020022332	-0.140956330417498	country	NN	B4	B	B14	B	country%1:14:01::	B	B	BB2	B	 century literature of England, I knew only a Protestant dominated <font color=green>country</font> . Since arriving here, however, I have formed a far different	3	2	2.35555192830646	0.666666666666667	2	religion	non-fiction
country/NN/br-e30/1177	0.0802973826627604	0.0959489932672221	country	NN	B1	B	B14	B	country%1:15:00::	B1	B	B1	B	 What 's your profit margin? In what section of the <font color=green>country</font>  are you located? Are you in a rural or urban	4	1	2.29559438634298	0.25	2	skill_and_hobbies	non-fiction
country/NN/br-e31/1795	0.12297687134489	0.464324543867431	country	NN	B4	B	B14	B	country%1:15:00::;1:14:00::	B1	B	B1	B	 and( 6) more education. The more people learn about their <font color=green>country</font> , the more they want to learn. Camping is family fun	3	0	2.44881153444346	0	1	skill_and_hobbies	non-fiction
country/NN/br-e31/1819	0.106199921327609	-0.0566849237055155	country	NN	B1	B	B14	B	country%1:15:00::	B1	B	B1	B	 and it is helping more Americans see more of the <font color=green>country</font>  than they ever saw before. But make no mistake about	2	1	2.1184487308768	0.5	1	skill_and_hobbies	non-fiction
country/NN/br-f03/2248	-0.114111917275257	0.0406562023915557	country	NN	A	A	A	A	country%1:15:01::	A	A	A	A	 the convention, Depew was seated on the porch of a <font color=green>country</font>  home on the Hudson, gazing at the opposite shore.	4	2	2.36561457597741	0.5	4	popular_lore	fiction
country/NN/br-f13/1645	0.187118730184693	0.125198319996379	country	NN	A	A	A	A	country%1:15:01::	A	A	A	A	 a neighborhood of well-kept homes. There are slums in the <font color=green>country</font>  as well as in the city. Few rural areas are	5	1	2.5400602059086	0.2	1	popular_lore	fiction
country/NN/br-f13/637	0.190229278780458	0.226838139057791	country	NN	A	A	A	A	country%1:15:01::	A	A	A	A	 Generally, the same level of living costs less in the <font color=green>country</font>  than in the city. The savings are not as great	3	0	2.18465995940187	0	1	popular_lore	fiction
country/NN/br-f13/701	0.0112862093754447	0.229437916080537	country	NN	A	A	A	A	country%1:15:01::	A	A	A	A	 similar municipal services are of equal quality in city and <font color=green>country</font> , real estate taxes are usually about the same. A part-time	4	0	2.09913778596371	0	1	popular_lore	fiction
country/NN/br-f15/2048	-0.0968586087323594	-0.0650571805633581	country	NN	B1	B	B14	B	country%1:14:00::	B2	B	BB2	B	 translated into action by the majority of people in this <font color=green>country</font> . Repeated polls have disclosed that most married couples are now	4	0	2.33464678123383	0	4	popular_lore	fiction
country/NN/br-f15/235	-0.347640882943382	-0.231914390103261	country	NN	B4	B	B14	B	country%1:14:00::	B2	B	BB2	B	 more tension, rancor and strife among religious groups in this <font color=green>country</font>  than the birth-control issue. It has flared up periodically on	3	0	2.0886736013312	0	1	popular_lore	fiction
country/NN/br-f15/664	0.207997970325725	0.219972799904697	country	NN	B	B	B14	B	country%1:14:00::	B2	B	BB2	B	 necessities of life, the degree of population density of a <font color=green>country</font>  and the shortage of housing facilities may legitimately be taken	4	0	2.55503374769877	0	1	popular_lore	fiction
country/NN/br-f17/2140	0.145774423205181	0.16782727974651	country	NN	A1	A	A	A	country%1:15:02::	A1	A	A	A	 three men to cart goods to them from the Mississippi <font color=green>country</font> . Others carried pemmican from`` the Forks'' to St. Paul and	4	0	2.4923827827371	0	1	popular_lore	fiction
country/NN/br-f18/2329	-0.272245206740433	-0.125795036337024	country	NN	B1	B	B14	B	country%1:15:00::	B1	B	B1	B	 have been satisfied to have staid at home when my <font color=green>country</font>  is invaded by a thievin foe By a set of	3	0	2.50460289407187	0	1	popular_lore	fiction
country/NN/br-f19/1206	0.225959164919279	-0.22332743989827	country	NN	B1	B	B14	B	country%1:14:00::	B2	B	BB2	B	 and seldom taught properly to American undergraduates. In addition, this <font color=green>country</font>  has been settled by many peoples of many heritages and	3	1	2.2716713363915	0.333333333333333	1	popular_lore	fiction
country/NN/br-f19/140	0.0816323013982802	-0.0345331248934145	country	NN	B2	B	B23	B	country%1:14:00::	B2	B	BB2	B	 a given generation feels must have occurred. 2) As a <font color=green>country</font>  superimposes its cultural and political attitudes on others, it searches	4	1	2.26772339483886	0.25	2	popular_lore	fiction
country/NN/br-f19/350	0.152185020281411	0.0862492522871536	country	NN	B4	B	B14	B	country%1:14:00::	B2	B	BB2	B	 Of course, nationalism has really outlived its usefulness in a <font color=green>country</font>  as world oriented as ours, and its continued existence reflects	3	0	2.17577101198462	0	1	popular_lore	fiction
country/NN/br-f23/1643	0.159584039045685	0.0208665186835934	country	NN	B2	B	B23	B	country%1:14:00::	B2	B	BB2	B	 first stage of a Communist takeover is to`` neutralize'' a <font color=green>country</font> . The second stage is to retain the nominal classification of	3	1	2.34297531221743	0.333333333333333	2	popular_lore	fiction
country/NN/br-f23/2055	0.0156714631283198	-0.0137907681153686	country	NN	B2	B	B23	B	country%1:14:00::	B2	B	BB2	B	 are displaying open sympathy for Castroism, and there is no <font color=green>country</font> - save the Dominican Republic whose funeral services we recently arranged	2	0	2.33696044875905	0	3	popular_lore	fiction
country/NN/br-g01/1421	-0.0373770584655353	-0.11871010788686	country	NN	B4	B	B14	B	mother_country%1:15:00::	B1	B	B1	B	 the sympathy they felt extended to them by the mother <font color=green>country</font> . And no doubt many people in states like the Carolinas	2	0	2.26895378127731	0	2	belles_lettres	fiction
country/NN/br-g17/2183	-0.024132526303328	-0.0899670453147037	country	NN	B1	B	B14	B	country%1:15:00::	B1	B	B1	B	 New England as it did in other parts of the <font color=green>country</font> ? Is n't it a bit odd that the three states	3	0	2.02745273109206	0	1	belles_lettres	fiction
country/NN/br-g17/767	0.242322513200341	0.0904589306193431	country	NN	B4	B	B14	B	country%1:14:01::	B	B	BB2	B	 all partial or local legislation''. Who will say that our <font color=green>country</font>  is even now a homogeneous community? that regional peculiarities do	4	1	2.13530306243178	0.25	1	belles_lettres	fiction
country/NN/br-g18/1249	0.054677089370772	-0.032032919266116	country	NN	B4	B	B14	B	country%1:14:01::;1:15:00::	B	B	BB2	B	 little patience with collective mediocrity. He saw Sweden as a <font color=green>country</font>  of smug and narrow provincialism, indifferent to the heroic spirit	3	0	2.770446615164	0	4	belles_lettres	fiction
country/NN/br-g18/1754	0.0895998944755346	0.0510860583596484	country	NN	B4	B	B14	B	country%1:14:01::	B	B	BB2	B	 an invasion of Russia and each brought ruin on the <font color=green>country</font>  that worshipped him. Each is still glorified as a national	3	0	2.49341648507096	0	2	belles_lettres	fiction
country/NN/br-g21/1021	-0.347640883042604	-0.231914390275674	country	NN	B4	B	B14	B	country%1:15:00::	B1	B	B1	B	 by the time the war ended, liberal leadership in this <font color=green>country</font>  was spiritually Marxist. We will recall that the still confident	3	0	2.0886736013312	0	1	belles_lettres	fiction
country/NN/br-g21/106	-0.347640879198923	-0.231914387098724	country	NN	B4	B	B14	B	country%1:14:01::	B	B	BB2	B	 relationship that he found between religion and politics in this <font color=green>country</font>  and what happened to it. He points out that from	2	0	2.0886736013312	0	1	belles_lettres	fiction
country/NN/br-g21/15	-0.0424118687296482	-0.163660946290024	country	NN	B4	B	B14	B	country%1:14:01::	B	B	BB2	B	 pointed up the relation between the Protestant movement in this <font color=green>country</font>  and the development of a social religion, which he called	4	1	2.27263363810836	0.25	2	belles_lettres	fiction
country/NN/br-g21/605	-0.34764088268428	-0.231914390145789	country	NN	B4	B	B14	B	country%1:14:00::	B2	B	BB2	B	 man? French Egalitarianism had had only nominal influence in this <font color=green>country</font>  before the days of Popularism. The riotous onrush of industrialism	4	0	2.0886736013312	0	1	belles_lettres	fiction
country/NN/br-g21/964	0.0112398395240507	-0.0996568728490461	country	NN	B4	B	B14	B	country%1:14:01::	B	B	BB2	B	 peace. The long road that had taken liberals in this <font color=green>country</font>  into the social religion of democracy, into a worship of	5	2	2.23576852710458	0.4	3	belles_lettres	fiction
country/NN/br-g23/17	0.00355456008331102	0.0117720797330605	country	NN	B4	B	B14	B	country%1:14:00::	B2	B	BB2	B	 Woodrow Wilson 's administration, a red scare developed in our <font color=green>country</font> . Many Americans reacted irrationally to the challenge of Russia and	5	1	2.35882612080712	0.2	4	belles_lettres	fiction
country/NN/br-g28/1507	0.0722794971308291	0.268213262408666	country	NN	A	A	A	A	back_country%1:15:00::	A	A	A	A	 William Byrd described the Lubberlanders he encountered in the back <font color=green>country</font>  of Virginia and North Carolina. The chief literary antecedents of	3	0	2.51283339320839	0	1	belles_lettres	fiction
country/NN/br-g28/2097	-0.0514031917154196	-0.254929931117395	country	NN	A1	A	A	A	country%1:15:00::	B1	B	B1	B	 as a young man prepared to find in the new <font color=green>country</font>  the setting of romantic adventure and idealized beauty. But Thorpe	3	0	2.5295004456936	0	1	belles_lettres	fiction
country/NN/br-g43/348	-0.225496380552609	-0.0319792904570351	country	NN	A	A	A	A	country_doctor%1:18:00::	A	A	A	A	 most unforgettable character I ever met'' deals with village grocers, <font color=green>country</font>  doctors, favorite if illiterate aunts, and so forth. Scientists often	2	0	2.38137025364792	0	1	belles_lettres	fiction
country/NN/br-h18/1813	-0.0517863037728332	-0.0964026115399183	country	NN	B4	B	B14	B	country%1:14:00::	B2	B	BB2	B	 action can hope to win public support, first in this <font color=green>country</font>  and then abroad? For the policy officer will know that	5	1	2.38616236342603	0.2	2	miscellaneous	non-fiction
country/NN/br-h18/1847	0.106645903593102	-0.00498211836311398	country	NN	B3	B	B23	B	country%1:14:01::	B	B	BB2	B	 of policy will be conditioned by the readiness of the <font color=green>country</font>  to sustain it. He is interested in public opinion for	5	3	2.45897594228528	0.6	3	miscellaneous	non-fiction
country/NN/br-h18/2087	0.147671277823655	-0.0315298206422163	country	NN	B2	B	B23	B	country%1:14:00::	B2	B	BB2	B	 public opinion until the President and the leaders of the <font color=green>country</font>  have gone to the public to explain what is required	3	0	2.40892020541616	0	1	miscellaneous	non-fiction
country/NN/br-h18/2142	0.0931630932439495	0.0581521626721296	country	NN	B4	B	B14	B	country%1:14:01::	B	B	BB2	B	 Marshall plan, any public-opinion expert would have said that the <font color=green>country</font>  would have accepted such proposals. The problem in the policy	4	1	2.19374136743149	0.25	2	miscellaneous	non-fiction
country/NN/br-h18/857	0.181806043174656	0.0644686300488364	country	NN	B1	B	B14	B	country%1:15:00::	B1	B	B1	B	 the representatives of other agencies who are stationed in his <font color=green>country</font> . He is expected to supervise, to encourage, to direct, to	2	0	2.95191511211554	0	1	miscellaneous	non-fiction
country/NN/br-j37/1184	0.0828009918442483	0.154791137597952	country	NN	B1	B	B14	B	country%1:15:00::	B1	B	B1	B	 communication and understanding in the more remote areas of the <font color=green>country</font> , but it also served to minimize the national political value	3	1	2.60427428557125	0.333333333333333	2	learned	non-fiction
country/NN/br-j37/958	0.262620061313798	0.00526549786920434	country	NN	B2	B	B23	B	country%1:14:00::	B2	B	BB2	B	 a developing country and evaluating their results. In the new <font color=green>country</font>  the electoral process is considered as a means of resolving	4	1	2.31562955178119	0.25	2	learned	non-fiction
country/NN/br-j38/1233	-0.0840500010580545	-0.204995747347157	country	NN	B1	B	B14	B	country%1:14:00::	B2	B	BB2	B	 inherent in the system of local school districts in this <font color=green>country</font> . Planning of vocational education programs and courses is oriented to	3	0	2.26874256788733	0	2	learned	non-fiction
country/NN/br-j56/1063	-0.0900305102032444	0.0830954640777139	country	NN	A	A	A	A	country_club%1:14:00::	A	A	A	A	 had come into vogue, but also to witness the Ekwanok <font color=green>Country</font>  Club tournaments. New Yorkers were kept informed of scores by	2	1	2.60441781937444	0.5	2	learned	non-fiction
country/NN/br-j58/690	-0.139729781150619	-0.0126542719427702	country	NN	B4	B	B14	B	country%1:14:00::	B2	B	BB2	B	 commuted to imprisonment, it would be well- well for the <font color=green>country</font>  and for Virginia''. Despite the excitement being caused by the	1	0	2.27245277206843	0	3	learned	non-fiction
country/NN/br-k03/1240	-0.180894997825216	0.458318731411365	country	NN	A	A	A	A	country%5:00:01:rural:00	A	A	A	A	 sit in the back seat of cars along a dark <font color=green>country</font>  lane. No, they must look the other way and climb	5	0	2.01531911408064	0	1	fiction_gral	fiction
country/NN/br-k03/444	-0.0158387336714706	0.0657362576543094	country	NN	A	A	A	A	country%5:00:01:rural:00	A	A	A	A	 or his own sentry. He was a wiry, inscrutable, silent <font color=green>country</font>  boy from the red clay of rural Alabama, and he	4	2	2.57696301931686	0.5	3	fiction_gral	fiction
country/NN/br-k08/558	0.00288226887409511	0.166913447462642	country	NN	A	A	A	A	country%1:15:00::	B1	B	B1	B	 one day, while on a week 's visit to the <font color=green>country</font>  home of a retired Swiss jeweler, Rousseau amused the company	3	1	2.32476463901839	0.333333333333333	3	fiction_gral	fiction
country/NN/br-k08/973	-0.0641033368473539	0.233678187776325	country	NN	A	A	A	A	country%1:15:01::	A	A	A	A	 just for this once, for this one weekend in the <font color=green>country</font> , he would make a little piece out of his melodies	3	1	3.10393131941416	0.333333333333333	1	fiction_gral	fiction
country/NN/br-k17/1981	-0.190643449064549	-0.121145843753911	country	NN	B4	B	B14	B	country%1:15:00::	B1	B	B1	B	 I 've lost faith, Styka. I used to love this <font color=green>country</font>  and believe that someday we 'd win our battle for	2	1	2.47205866545332	0.5	2	fiction_gral	fiction
country/NN/br-k23/1336	0.236695964973713	0.448104659528709	country	NN	A1	A	A	A	country%1:15:01::	A	A	A	A	 wheel. They rarely spoke. Abel sat and regarded the farm <font color=green>country</font>  which, spreading out from both sides of the road, rolled	3	0	2.29798864470887	0	1	fiction_gral	fiction
country/NN/br-k25/869	0.141316208671359	0.106447586402822	country	NN	B1	B	B14	B	country%1:15:00::	B1	B	B1	B	 shawl over her head, which she had bought in that <font color=green>country</font>  during one of their trips abroad, and handed him a	4	1	2.68365112552086	0.25	1	fiction_gral	fiction
country/NN/br-l11/1246	-0.110079499026186	0.0468198087920538	country	NN	A	A	A	A	country%1:15:01::	A	A	A	A	 a manner Esquire might suggest for the outdoor man 's <font color=green>country</font>  weekend. Dark gray sports jacket, lighter gray slacks, pink flannel	2	2	2.31226335494009	1	5	fiction_mystery	fiction
country/NN/br-n09/1051	-0.310035158369908	-0.045699134694305	country	NN	A	A	A	A	country%1:15:01::	A	A	A	A	 distant derrick of the wildcat- a test well in unexplored <font color=green>country</font> . And even with her limited knowledge of such things, she	2	0	2.55876343827336	0	2	fiction_adventure	fiction
country/NN/br-n09/492	-0.247202146577554	-0.151490906977555	country	NN	B1	B	B14	B	country%1:15:00::	B1	B	B1	B	 gun- a strange ommission for a peace officer in this <font color=green>country</font> . Never, he 'd once told Joyce, had he encountered any	3	0	2.16419666895805	0	2	fiction_adventure	fiction
country/NN/br-n11/2133	-0.0342313325537657	-0.183095139362326	country	NN	A1	A	A	A	country%1:15:02::	A1	A	A	A	 to frighten three rustling homesteaders out of the Upper Laramie <font color=green>country</font>  in a single week.`` My reputation 's my stock in	3	0	3.04045293367763	0	2	fiction_adventure	fiction
country/NN/br-p12/2090	-0.278548736569515	0.0080262739363293	country	NN	B1	B	B14	B	country%1:15:00::	B1	B	B1	B	 him she had met a nice man from his adopted <font color=green>country</font> . And Sam thanked her, and hoped he might meet her	2	0	2.08108675431814	0	1	fiction_romance	fiction
country/NN/br-r08/1810	-0.119676815005399	-0.104199561160917	country	NN	B4	B	B14	B	country%1:15:00::	B1	B	B1	B	 seems to be staging a well deserved comeback. In this <font color=green>country</font> , the two guiding lights are, without doubt, Felix Fing and	2	0	2.14482256108989	0	4	humor	fiction
country/NNS/br-b13/1273	-0.0532690832823381	-0.0763318165845233	country	NNS	B1	B	B14	B	country%1:15:00::	B1	B	B1	B	 desire to visit the`` smaller, less traveled and relatively inexpensive <font color=green>countries</font> '', and is now prepared to teach modern Greek and Portuguese	4	1	2.6918456116641	0.25	3	press_editorial	press
country/NNS/br-f14/1851	0.0167372703353397	0.010348647066276	country	NNS	B1	B	B14	B	country%1:15:00::	B1	B	B1	B	 of the Jews in Germany and later in the occupied <font color=green>countries</font>  contributed to terrorizing the populations, splitting apart individuals and groups	4	2	2.6274379141383	0.5	5	popular_lore	fiction
country/NNS/br-f14/2054	0.0195081852702399	-0.001688466514106	country	NNS	B	B	B14	B	country%1:14:00::	B2	B	BB2	B	 to post before the world the contrasting fates of the <font color=green>countries</font>  in which the Final Solution was aided by native Jew	4	2	2.52130670640491	0.5	4	popular_lore	fiction
country/NNS/br-f14/2151	0.21766712758069	-0.023671700507288	country	NNS	B1	B	B14	B	country%1:14:00::	B2	B	BB2	B	 Was n't this meaning of Eichmann 's experience in various <font color=green>countries</font>  worth highlighting? As the first collective confrontation of the Nazi	3	0	3.24806497811701	0	2	popular_lore	fiction
country/NNS/br-f15/1446	0.0403701957605434	-0.0595925268017882	country	NNS	B4	B	B14	B	country%1:14:00::	B2	B	BB2	B	 This was generally reflected in the civil laws of Christian <font color=green>countries</font> . Today, the Roman Catholic and Orthodox Churches stand virtually alone	4	1	2.5115255287704	0.25	5	popular_lore	fiction
country/NNS/br-f15/290	0.120200687172679	0.0457106847291107	country	NNS	B3	B	B23	B	country%1:14:00::	B2	B	BB2	B	 including birth-control information and material in foreign aid to underdeveloped <font color=green>countries</font> . Where it is not actually erupting, it rumbles and smolders	3	2	3.38975488438437	0.666666666666667	3	popular_lore	fiction
country/NNS/br-f23/2029	0.0178568136273916	0.064232655146075	country	NNS	B2	B	B23	B	country%1:14:00::	B2	B	BB2	B	 a Soviet bridgehead ninety miles off our coast. In some <font color=green>countries</font>  the trend has gone further than others: Mexico, Panama, and	4	2	2.74473618585452	0.5	3	popular_lore	fiction
country/NNS/br-g12/2313	0.0881477890864373	0.0164559002025289	country	NNS	B4	B	B14	B	country%1:14:00::	B2	B	BB2	B	 the technological and economic revolutions now going on in the <font color=green>countries</font>  of Asia and Africa, and also of course on how	5	4	3.21404612366247	0.8	4	belles_lettres	fiction
country/NNS/br-g18/2235	-0.0210571813668667	-0.000960491536114095	country	NNS	B	B	B14	B	country%1:14:01::	B	B	BB2	B	 a perfect introduction to Swedish history for readers of other <font color=green>countries</font> . Some of the earlier episodes have touches of the supernatural	3	0	2.55556964115087	0	4	belles_lettres	fiction
country/NNS/br-h09/1266	0.0548874677192382	0.0215109091520208	country	NNS	B1	B	B14	B	country%1:14:00::	B2	B	BB2	B	 expended in cooperation with public or private agencies in foreign <font color=green>countries</font>  in the development of processes useful to the program in	5	3	2.42937392844839	0.6	5	miscellaneous	non-fiction
country/NNS/br-h13/1532	0.0288328585510388	0.013048285906077	country	NNS	B2	B	B23	B	country%1:14:00::	B2	B	BB2	B	 years the United States had been trying to get these <font color=green>countries</font>  to exclude Castro 's representative from secret military talks. But	5	4	2.39816891994777	0.8	6	miscellaneous	non-fiction
country/NNS/br-h13/2195	0.418124836555962	0.114965833505666	country	NNS	B2	B	B23	B	country%1:14:00::	B2	B	BB2	B	 without discrimination. Once these conditions of international law are met, <font color=green>countries</font>  that try to run to blockade do so at their	4	1	3.26241701218118	0.25	1	miscellaneous	non-fiction
country/NNS/br-h13/2315	0.0510224011884859	0.0365373942897652	country	NNS	B3	B	B23	B	country%1:14:00::	B2	B	BB2	B	 coming from Russia and Czechoslovakia. Shipments of arms from Western <font color=green>countries</font>  could similarly be seized as contraband. In a total blockade	5	1	2.73091798578623	0.2	3	miscellaneous	non-fiction
country/NNS/br-h21/1267	0.0392681045304328	0.0369609503061486	country	NNS	B1	B	B14	B	country%1:14:00::	B2	B	BB2	B	 a rider which limits competitive bidding by firms in other <font color=green>countries</font>  on certain military supply items. As I have repeatedly stated	2	1	2.85246935208166	0.5	7	miscellaneous	non-fiction
country/NNS/br-j10/1243	0.105082196640116	0.106868507634235	country	NNS	B2	B	B23	B	european_country%1:15:00::	B1	B	B1	B	 the`` cuckoo bumblebee'' as it is called in some European <font color=green>countries</font> . Female individuals of Psithyrus look deceptively like the workers and	2	0	2.96741380136097	0	2	learned	non-fiction
country/NNS/br-j22/1309	0.0610643591670575	0.0511662245911112	country	NNS	B3	B	B23	B	country%1:14:00::	B2	B	BB2	B	 At a third stage in the modernization process are such <font color=green>countries</font>  as India, Brazil, the Philippines, and Taiwan, which are ready	6	2	3.57015209511797	0.333333333333333	3	learned	non-fiction
country/NNS/br-j22/1375	-0.304741662433275	0.310945102385187	country	NNS	B3	B	B23	B	country%1:14:00::	B2	B	BB2	B	 in the program to wider and wider groups. But these <font color=green>countries</font>  have made big strides toward developing the necessary human and	4	1	3.39938286725434	0.25	1	learned	non-fiction
country/NNS/br-j22/1437	0.0997382165359514	0.0372790910927496	country	NNS	B3	B	B23	B	country%1:14:00::	B2	B	BB2	B	 economies. On the economic front, the first priority of these <font color=green>countries</font>  is to mobilize a vastly increased volume of resources. Several	4	3	2.74218355742121	0.75	4	learned	non-fiction
country/NNS/br-j22/1464	0.124434698687186	0.0278431985157165	country	NNS	B3	B	B23	B	country%1:14:00::	B2	B	BB2	B	 carried out if self-sustaining growth is to be achieved. These <font color=green>countries</font>  must formulate a comprehensive, long-term program covering the objectives of	4	1	2.99914077764823	0.25	5	learned	non-fiction
country/NNS/br-j22/171	-0.0137405918169324	0.00955175657595251	country	NNS	B2	B	B23	B	country%1:14:00::	B2	B	BB2	B	 and dangerous consequences of social change which have troubled other <font color=green>countries</font>  passing through this stage can be escaped. The United States	4	1	2.58745454627566	0.25	5	learned	non-fiction
country/NNS/br-j22/194	0.0326927081224593	0.00575673967387866	country	NNS	B2	B	B23	B	country%1:14:00::	B2	B	BB2	B	 help by communicating a genuine concern with the problems these <font color=green>countries</font>  face and a readiness to provide technical and other appropriate	3	2	2.66846867980287	0.666666666666667	7	learned	non-fiction
country/NNS/br-j22/1968	0.0333569692085551	0.00840923914975144	country	NNS	B4	B	B14	B	country%1:14:00::	B2	B	BB2	B	 to take seriously their claims to being democratic and free <font color=green>countries</font> ; we also have, in consequence, the duty to appraise realistically	2	1	2.42331946371519	0.5	4	learned	non-fiction
country/NNS/br-j22/2116	-0.0490068475335924	0.138851332684939	country	NNS	B3	B	B23	B	country%1:14:00::	B2	B	BB2	B	 generate. It follows that any effective policy toward the underdeveloped <font color=green>countries</font>  must have a realistically long working horizon. It must be	3	0	2.79683285726905	0	2	learned	non-fiction
country/NNS/br-j22/257	0.126744230250971	-0.0889486631629233	country	NNS	B3	B	B23	B	country%1:14:00::	B2	B	BB2	B	 and the lack of cohesion and stability which characterize these <font color=green>countries</font>  may make them particularly prone to diversions and external adventures	2	0	3.33149793875722	0	4	learned	non-fiction
country/NNS/br-j22/347	0.0438039323088276	0.0872595080216726	country	NNS	B2	B	B23	B	country%1:14:00::	B2	B	BB2	B	 world scene. When necessary, we should make it clear that <font color=green>countries</font>  which choose to derive marginal advantages from the cold war	5	3	2.79456002392058	0.6	4	learned	non-fiction
