id	model.x	model.y	lemma	pos	marisense	mbroad	mari3	mari2	sensekey	wnsense	wnbroad	wn3	wn2	text	cues	cues_with_weight	mean_weight	weighted.cues_ratio	weighted_cw	genre	broad_genre
church/NN/br-a01/2073	-0.127810458455953	0.100566542723404	church	NN	E	E	DE	CDE	church%1:04:00::	E	E	DE	CDE	 said.`` Being at the polls was just like being at <font color=green>church</font> . I did n't smell a drop of liquor, and we	1	0	2.29875384298412	0	3	press_reportage	press
church/NN/br-d01/1628	-0.0984766385657077	-0.266490387780028	church	NN	B	B	AB	AB	church%1:14:00::	B	B	AB	AB	 age to whip men into a surrender to a particular <font color=green>church</font>  or church-state''. Apparently he does not intend that those who	3	1	2.83714093027039	0.333333333333333	2	religion	non-fiction
church/NN/br-d02/1641	0.107830133777755	-0.0312869830517747	church	NN	B	B	AB	AB	church%1:14:00::	B	B	AB	AB	 concerned to stand squarely within the tradition of the apostolic <font color=green>church</font> , they have exhibited no willingness whatever to sacrifice their modernity	2	1	2.83709208603536	0.5	3	religion	non-fiction
church/NN/br-d02/706	0.00241108727755695	-0.0692915312988205	church	NN	A	A	AB	AB	church%1:14:00::	B	B	AB	AB	 there tends to be an almost complete indifference to the <font color=green>church</font>  and its traditional message of sin and grace. To be	4	2	2.59583043756589	0.5	4	religion	non-fiction
church/NN/br-d02/786	-0.00746309513659666	0.119350807576411	church	NN	A	A	AB	AB	church%1:14:00::	B	B	AB	AB	 longer afford the luxury of such smug indignation? Can the <font color=green>church</font>  risk assuming that the`` folly'' of men is as dear	3	0	2.80427872843094	0	3	religion	non-fiction
church/NN/br-d02/877	0.0139001789926124	-0.0470076109699734	church	NN	A	A	AB	AB	church%1:14:00::	B	B	AB	AB	 precarious? There is an ancient and venerable tradition in the <font color=green>church</font> ( which derives, however, from the heritage of the Greeks rather	4	3	2.56413187014748	0.75	3	religion	non-fiction
church/NN/br-d02/923	0.266273496068137	-0.315750858455001	church	NN	A	A	AB	AB	church%1:14:00::	B	B	AB	AB	 for accomplishing his work in the world. by analogy, the <font color=green>church</font>  also has been regarded as entirely independent of the`` world	3	0	3.13601370382024	0	1	religion	non-fiction
church/NN/br-d02/949	0.242765768318124	0.150373486308338	church	NN	A	A	AB	AB	church%1:14:00::	B	B	AB	AB	 of requiring nothing from it in order to be the <font color=green>church</font> . But, as Scripture everywhere reminds us, God does have need	2	0	2.98716807622267	0	1	religion	non-fiction
church/NN/br-d02/969	-0.0798735071385477	0.106906549984175	church	NN	A	A	AB	AB	church%1:14:00::	B	B	AB	AB	 us, God does have need of his creatures, and the <font color=green>church</font> , a fortiori, can ill afford to do without the talents	4	2	2.61597310831214	0.5	2	religion	non-fiction
church/NN/br-d03/1080	0.185509472526749	-0.071599415940358	church	NN	E	E	DE	CDE	church%1:04:00::	E	E	DE	CDE	 phenomenon of redundancy is that fewer Protestants are going to <font color=green>church</font> . It should be admitted, too, that there is a good	2	1	2.28482574977355	0.5	2	religion	non-fiction
church/NN/br-d03/1342	-0.0422030152977309	-0.0732104196197774	church	NN	E	E	DE	CDE	church%1:06:00::	D	D	DE	CDE	 my experience to find as many men as women in <font color=green>church</font> , and to hear almost everyone in church congregations reciting the	5	2	2.95195484225548	0.4	3	religion	non-fiction
church/NN/br-d03/1350	-0.0138440370815743	-0.0277767515231621	church	NN	E	E	DE	CDE	church%1:06:00::	D	D	DE	CDE	 as women in church, and to hear almost everyone in <font color=green>church</font>  congregations reciting the Latin prayers and responses at Mass. They	5	4	2.81893035224512	0.8	7	religion	non-fiction
church/NN/br-d03/1871	0.0320412365173431	-0.0227962750503844	church	NN	B	B	AB	AB	catholic_church%1:14:00::	B1	B	AB	AB	 the Sunday Observer implies a kindly recognition that the Catholic <font color=green>Church</font>  is now at least of equal stature in England with	2	2	3.09803328542137	1	6	religion	non-fiction
church/NN/br-d03/1909	-0.00423043076437989	-0.00443329469194814	church	NN	B	B	AB	AB	church_of_england%1:14:00::	B2	B	AB	AB	 non-Catholic) wrote articles in the Observer depicting clergymen of the <font color=green>Church</font>  of England, the Church of Rome and the Nonconformist Church	6	2	2.85615829924049	0.333333333333333	4	religion	non-fiction
church/NN/br-d03/2097	0.0342834897582363	-0.0263271170326863	church	NN	A	A	AB	AB	church%1:14:00::	B	B	AB	AB	 Canterbury. The good feeling which exists between these two important <font color=green>church</font>  figures is now well known in England. The Holy Sacrifice	4	0	2.48175667660213	0	2	religion	non-fiction
church/NN/br-d03/2336	0.0208125368012052	-0.0352495142009598	church	NN	D	D	DE	CDE	catholic_church%1:14:00::	B1	B	AB	AB	 a votive Mass offered for Christian unity at a Catholic <font color=green>church</font>  in Slough during the Church Unity Octave.	2	1	2.99059766646577	0.5	6	religion	non-fiction
church/NN/br-d03/2341	0.0314441295456225	-0.0501159301551543	church	NN	A	A	AB	AB	church%1:14:00::	B	B	AB	AB	 Christian unity at a Catholic church in Slough during the <font color=green>Church</font>  Unity Octave.	2	1	3.17197210239365	0.5	5	religion	non-fiction
church/NN/br-d03/721	-0.0281438247462071	-0.01077146451932	church	NN	B	B	AB	AB	church%1:06:00::	D	D	DE	CDE	 crowds going in and out of the Birmingham Oratory( Catholic) <font color=green>Church</font>  on Sunday mornings. She found this a marvel because, as	1	0	2.78913174830542	0	3	religion	non-fiction
church/NN/br-d03/862	0.0178945581996319	0.0148739909695896	church	NN	B	B	AB	AB	church_of_england%1:14:00::	B2	B	AB	AB	 to a newspaper report of the 1961 statistics of the <font color=green>Church</font>  of England, the`` total of confirmed members is 9748000, but	3	2	2.58260300513157	0.666666666666667	4	religion	non-fiction
church/NN/br-d03/883	-0.0279886210228955	0.150982675320392	church	NN	C	C	C	CDE	church_roll%1:10:00::	C	C	C	CDE	 is 9748000, but only 2887671 are registered on the parochial <font color=green>church</font>  rolls'', and`` over 27 million people in England are baptized	4	3	2.546047912838	0.75	3	religion	non-fiction
church/NN/br-d03/899	-0.0236980743167013	0.0398107972738652	church	NN	B	B	AB	AB	church_of_england%1:14:00::	B2	B	AB	AB	 over 27 million people in England are baptized into the <font color=green>Church</font>  of England, but roughly only a tenth of them continue	3	2	2.81517574053193	0.666666666666667	3	religion	non-fiction
church/NN/br-d03/945	0.0108784586042559	-0.040221906737959	church	NN	B	B	AB	AB	church_of_england%1:14:00::	B2	B	AB	AB	 than an Archbishops' Commission`` reported last month that in the <font color=green>Church</font>  of England alone there are 790 churches which are redundant	1	0	2.72451058449298	0	2	religion	non-fiction
church/NN/br-d04/56	0.0258943626827708	-0.0601002624798868	church	NN	A	A	AB	AB	church_father%1:18:00::	A	A	AB	AB	 Jesus Christ the unique and the universal concur. Perhaps no <font color=green>church</font>  father saw this concurrence of the unique and the universal	4	5	2.47040112380858	1.25	5	religion	non-fiction
church/NN/br-f15/713	0.0728714845198229	-0.219673927126558	church	NN	B	B	AB	AB	roman_catholic_church%1:14:00::	B1	B	AB	AB	 permit birth control only for medical reasons. The Roman Catholic <font color=green>Church</font> , however, sanctions a much more liberal policy on family planning	5	2	3.87076524704997	0.4	2	popular_lore	fiction
church/NN/br-f15/754	0.0251076827919263	-0.06247830202337	church	NN	B	B	AB	AB	roman_catholic_church%1:14:00::	B1	B	AB	AB	 disagree over the methods to be used. The Roman Catholic <font color=green>Church</font>  sanctions only abstention or the rhythm method, also known as	1	0	3.21005704088164	0	4	popular_lore	fiction
church/NN/br-f15/776	0.298155224652573	-0.0255392221356565	church	NN	A	A	AB	AB	roman_catholic_church%1:14:00::	B1	B	AB	AB	 as the use of the infertile or safe period. The <font color=green>Church</font>  considers this to be the method provided by nature and	3	1	2.76828892369492	0.333333333333333	1	popular_lore	fiction
church/NN/br-f15/862	0.0618626456913363	-0.394686021543073	church	NN	A	A	AB	AB	roman_catholic_church%1:14:00::	B1	B	AB	AB	 there seems little chance of agreement. The grounds for the <font color=green>Church</font>  's position are Scriptural( Old Testament), the teachings of the	3	1	2.3771712639949	0.333333333333333	1	popular_lore	fiction
church/NN/br-f15/882	0.0959655834533762	-0.130630925900315	church	NN	A	A	AB	AB	roman_catholic_church%1:14:00::	B1	B	AB	AB	 the teachings of the fathers and doctors of the early <font color=green>Church</font> , the unbroken tradition of nineteen centuries, the decisions of the	4	1	2.48060685124314	0.25	1	popular_lore	fiction
church/NN/br-f44/1076	0.0290980380031664	-0.040520052031307	church	NN	C	C	C	CDE	church%1:14:00::	B	B	AB	AB	 and economic level of the congregation; the mission of the <font color=green>church</font>  is actually a process of informal co-optation; the lay ministry	5	2	2.87796569654453	0.4	3	popular_lore	fiction
church/NN/br-f44/1285	0.0683065562966954	0.0102325588731216	church	NN	C	C	C	CDE	church%1:14:00::	B	B	AB	AB	 co-optation is the principal form of mission in the contemporary <font color=green>church</font> ; economic integration and co-optation are the two methods by which	3	1	2.89149761735479	0.333333333333333	2	popular_lore	fiction
church/NN/br-f44/1618	0.0733423673053866	-0.0992596730941927	church	NN	C	C	C	CDE	church%1:14:00::	B	B	AB	AB	 in the metropolis. It now becomes evident that the denominational <font color=green>church</font>  is intimately involved with the economy of middle-class culture, for	5	1	2.30942087186894	0.2	2	popular_lore	fiction
church/NN/br-f44/2150	0.103240840633376	0.0295919997737355	church	NN	C	C	C	CDE	church%1:14:00::	B	B	AB	AB	 will occupy our attention under the rubric of the organization <font color=green>church</font> . An understanding of the new role of residential association in	3	1	2.26309649185286	0.333333333333333	2	popular_lore	fiction
church/NN/br-f44/368	0.125391442217765	0.0637792019069421	church	NN	C	C	C	CDE	church%1:14:00::	B	B	AB	AB	 they can lose higher- and lower status members from the <font color=green>church</font>  without collapsing, but they need adequate recruits for the core	3	1	2.81548636299412	0.333333333333333	2	popular_lore	fiction
church/NN/br-f44/647	0.00661715708295311	-0.0183016534961645	church	NN	A	A	AB	AB	church%1:14:00::	B	B	AB	AB	 denominations. There is much talk in theological circles about the`` <font color=green>Church</font>  as Mission'' and the`` Church 's Mission''; theologians have been	4	4	2.99216059641493	1	5	popular_lore	fiction
church/NN/br-f44/654	-0.00516317754246663	-0.0379811308620083	church	NN	A	A	AB	AB	church%1:14:00::	B	B	AB	AB	 in theological circles about the`` Church as Mission'' and the`` <font color=green>Church</font>  's Mission''; theologians have been stressing the fact that the	4	2	3.29046574267242	0.5	3	popular_lore	fiction
church/NN/br-f44/667	-0.195881851792312	-0.184272975156475	church	NN	A	A	AB	AB	church%1:14:00::	B	B	AB	AB	 's Mission''; theologians have been stressing the fact that the <font color=green>Church</font>  does not exist for its own sake but as a	4	1	2.53325058472856	0.25	1	popular_lore	fiction
church/NN/br-f44/924	0.0468621910089113	0.00968463404301904	church	NN	C	C	C	CDE	church%1:14:00::	B	B	AB	AB	 with friendly members the`` contacts with an organization of the <font color=green>church</font> ''( 11.2 per cent of the cases), then a substantial two	3	3	2.48861896209931	1	4	popular_lore	fiction
church/NN/br-f44/986	-0.0170663250646437	0.0162456037017254	church	NN	C	C	C	CDE	church%1:14:00::	B	B	AB	AB	 people; the new people respond in kind by joining the <font color=green>church</font> . Missionary outreach by friendly contact looks somewhat different when one	4	2	2.27962118217019	0.5	3	popular_lore	fiction
church/NN/br-g12/1271	-0.0821044325187994	-0.0572221289639535	church	NN	D	D	DE	CDE	church%1:06:00::	D	D	DE	CDE	 and gestured toward the Madeleine. The classical lines of the <font color=green>church</font>  which Napoleon thought of as a Temple of Glory, dominated	5	2	2.70755159910915	0.4	3	belles_lettres	fiction
church/NN/br-g12/1807	-0.141534964852742	-0.156663964157958	church	NN	D	D	DE	CDE	church%1:06:00::	D	D	DE	CDE	 not attractive, but it is deeper. When you pass a <font color=green>church</font>  on an Irish bus, all the hands flurry in the	2	0	2.25746329992893	0	1	belles_lettres	fiction
church/NN/br-g12/544	-0.208658729238228	0.0682319949081908	church	NN	D	D	DE	CDE	church%1:06:00::	D	D	DE	CDE	 the Madeleine and across to a sidewalk cafe opposite that <font color=green>church</font> . The conversation that ensued may have been engrossing but it	4	2	2.40710681895031	0.5	3	belles_lettres	fiction
church/NN/br-h17/1199	0.299825701541815	0.0674002702580443	church	NN	C	C	C	CDE	church%1:14:00::	B	B	AB	AB	 because of his willingness to kill in defense of his <font color=green>church</font>  and home. Upon administrative approval of the reclassification, he was	2	0	3.65926184758478	0	1	miscellaneous	non-fiction
church/NN/br-h17/1434	0.187316059377968	0.0308002515166702	church	NN	C	C	C	CDE	church%1:14:00::	B	B	AB	AB	 preaching and from 20 to 25 hours per month to <font color=green>church</font>  activities. His claim was therefore`` so highly exaggerated'', the Department	1	1	2.44158533320965	1	2	miscellaneous	non-fiction
church/NN/br-j23/1105	0.112722567777125	0.0480378156103462	church	NN	C	C	C	CDE	church_member%1:18:00::	C	C	C	CDE	 which is reflective of our common religion. Even the non <font color=green>church</font>  members- the freewheelers, marginal religionists and so on- have the	2	1	2.52044886528405	0.5	2	learned	non-fiction
church/NN/br-j57/2237	0.135769699734007	-0.276418181427973	church	NN	A	A	AB	AB	church_father%1:18:00::	A	A	AB	AB	 which reached Christianity by the way of Stoicism through the <font color=green>Church</font>  Fathers of Late Antiquity.	3	1	3.06455473983809	0.333333333333333	1	learned	non-fiction
church/NN/br-j57/958	0.118235148272895	-0.0328409257247351	church	NN	A	A	AB	AB	church_father%1:18:00::	A	A	AB	AB	 all possessions. This conception was taken up by the early <font color=green>Church</font>  Fathers and by canon lawyers and theologians in the Middle	5	1	2.45936813710958	0.2	2	learned	non-fiction
church/NN/br-j58/1496	0.0356925624848302	0.067851928763866	church	NN	D	D	DE	CDE	church_bell%1:06:00::	D	D	DE	CDE	 In many Northern towns and cities meetings were held and <font color=green>church</font>  bells were tolled. Such was not the case in Rhode	4	0	2.15574203182276	0	2	learned	non-fiction
church/NN/br-k04/1076	-0.0552916162515617	0.114186170230478	church	NN	D	D	DE	CDE	church%1:06:00::	D	D	DE	CDE	 There were two liquor saloons not very far from the <font color=green>church</font> , one white, that is conducted for white people with a	4	1	2.306659109428	0.25	3	fiction_gral	fiction
church/NN/br-k04/1117	-0.148100619488487	0.0947211495333618	church	NN	D	D	DE	CDE	church%1:06:00::	D	D	DE	CDE	 of gambling in both. On the other side of the <font color=green>church</font>  was a quiet, well-kept house with shutters and recently painted	4	0	2.9248928324193	0	2	fiction_gral	fiction
church/NN/br-k04/1145	-0.317740900223051	0.282371541920476	church	NN	C	C	C	CDE	church%1:14:00::	B	B	AB	AB	 it. It was called Kent House. The deacon of the <font color=green>church</font> , Carlson, was its janitor. One of the leading members of	3	0	2.73467231289593	0	1	fiction_gral	fiction
church/NN/br-k04/1419	0.0218342336358759	0.1037191808337	church	NN	C	C	C	CDE	church%1:06:00::	D	D	DE	CDE	 stress, and that was that the contribution to the general <font color=green>church</font>  expenses, the dollar money, had been seriously falling behind in	3	0	2.39623262207121	0	2	fiction_gral	fiction
church/NN/br-k04/1433	0.0218342336358759	0.1037191808337	church	NN	C	C	C	CDE	church%1:06:00::	D	D	DE	CDE	 the dollar money, had been seriously falling behind in this <font color=green>church</font> , and that must be looked after immediately. In fact, he	1	0	2.39623262207121	0	2	fiction_gral	fiction
church/NN/br-k04/1485	0.0406586443778754	-0.016691889333857	church	NN	C	C	C	CDE	church%1:06:00::	D	D	DE	CDE	 that clear as this was, they must have a better <font color=green>church</font> , a more business-like conduct of the church organization, and an	2	1	3.00605215969893	0.5	3	fiction_gral	fiction
church/NN/br-k04/1493	0.0382078657586892	-0.0184216563853165	church	NN	C	C	C	CDE	church%1:14:00::	B	B	AB	AB	 have a better church, a more business-like conduct of the <font color=green>church</font>  organization, and an effort to get this religious center out	4	2	2.76845770698141	0.5	4	fiction_gral	fiction
church/NN/br-k04/1514	0.0768255188589558	-0.0370634546795963	church	NN	C	C	C	CDE	church%1:14:00::	B	B	AB	AB	 out of its rut of wild worship into a modern <font color=green>church</font>  organization. He emphasized to the Presiding Elder the plan of	5	2	2.70993452558037	0.4	3	fiction_gral	fiction
church/NN/br-k04/1634	-0.0843340371450243	-0.0419004526296103	church	NN	D	D	DE	CDE	church%1:06:00::	D	D	DE	CDE	 to colored folk. When it was proposed to rebuild the <font color=green>church</font> , Wilson found that the terms for a new mortgage were	2	0	2.25570003093811	0	2	fiction_gral	fiction
church/NN/br-k04/1685	0.123019173119815	-0.00869599718547239	church	NN	D	D	DE	CDE	church%1:06:00::	D	D	DE	CDE	 made to his Deacon Board, he met unanimous opposition. The <font color=green>church</font>  certainly would not be removed. The very proposition was sacrilege	3	0	2.72139481078136	0	2	fiction_gral	fiction
church/NN/br-k04/1807	-0.139987874557276	0.200016814687499	church	NN	D	D	DE	CDE	church%1:06:00::	D	D	DE	CDE	 of money that has been invested by whites around that <font color=green>church</font> ? Tenements, stores, saloons, some gambling, I hope not too much	5	1	2.90185087955516	0.2	2	fiction_gral	fiction
church/NN/br-k04/1874	-0.0787783123214921	0.220556208061726	church	NN	D	D	DE	CDE	church%1:06:00::	D	D	DE	CDE	 were you I would just plan to repair the old <font color=green>church</font>  so it would last for five or ten years. By	3	2	2.4333179823306	0.666666666666667	2	fiction_gral	fiction
church/NN/br-k04/2301	0.129022588616553	-0.133142268510421	church	NN	B	B	AB	AB	methodist_church%1:14:00::	B2	B	AB	AB	 mean practically the end of his career in the Methodist <font color=green>church</font> , if not in all churches.	3	1	2.5065823376464	0.333333333333333	1	fiction_gral	fiction
church/NN/br-k04/356	-0.12221123048573	0.0756264095875599	church	NN	C	C	C	CDE	church%1:06:00::	D	D	DE	CDE	 with the whites, especially the rich who partly supported the <font color=green>church</font> . The Deacon Board, headed by a black man named Carlson	7	2	2.21299464619528	0.285714285714286	3	fiction_gral	fiction
church/NN/br-k04/397	-0.0222692119163109	0.00596556996808044	church	NN	C	C	C	CDE	church%1:06:00::	D	D	DE	CDE	 support of the Amen corner. The characteristic thing about this <font color=green>church</font>  was its Amen corner and the weekly religious orgy. A	4	4	2.18523977794942	1	4	fiction_gral	fiction
church/NN/br-k04/828	0.0525739859770482	0.0276435089517469	church	NN	C	C	C	CDE	church%1:14:00::	B	B	AB	AB	 the home of one of the old members of the <font color=green>church</font> , a woman named Catt who, as Wilson afterward found, was	2	1	2.52716037545012	0.5	2	fiction_gral	fiction
church/NN/br-k04/877	-0.0149151791414095	-0.0502673685449888	church	NN	C	C	C	CDE	church%1:14:00::	B	B	AB	AB	 never married, conducting a spotless home and devoted to her <font color=green>church</font> , but a perpetual dissenter and born critic. She soared over	2	1	2.36778958859435	0.5	4	fiction_gral	fiction
church/NN/br-k04/923	-0.0760337638116338	-0.0283271647731863	church	NN	D	D	DE	CDE	church%1:06:00::	D	D	DE	CDE	 which she was chief repository. Then Wilson looked over the <font color=green>church</font>  and studied its condition. The salary of the pastor had	3	1	2.58802207299419	0.333333333333333	3	fiction_gral	fiction
church/NN/br-k04/975	-0.213665190619691	0.122915757493897	church	NN	D	D	DE	CDE	church%1:06:00::	D	D	DE	CDE	 he mentioned this to the Deacons they said nothing. The <font color=green>church</font>  itself must be repaired. It was dirty and neglected. It	3	2	2.57891912223528	0.666666666666667	2	fiction_gral	fiction
church/NN/br-k06/1056	-0.222702385451937	-0.048821370179619	church	NN	D	D	DE	CDE	church%1:06:00::	D	D	DE	CDE	 northward to Brooklyn, below Point Peter, he could see the <font color=green>church</font>  spire wherever he looked back. Sometimes they went south and	5	0	2.10992785922039	0	1	fiction_gral	fiction
church/NN/br-k06/1473	0.0208474127882936	-0.225406535588069	church	NN	D	D	DE	CDE	church%1:06:00::	D	D	DE	CDE	 hands tucked under his coattails, and staring into the dark <font color=green>church</font> . The figure was wreathed in an extraordinary luminescence. The boy	3	0	2.17387658382066	0	1	fiction_gral	fiction
church/NN/br-k06/528	-0.207047781451346	0.13566509865604	church	NN	D	D	DE	CDE	church%1:06:00::	D	D	DE	CDE	 his head out. There was the slate roof of the <font color=green>church</font> ; ivy climbed the red brick walls like a green scaled	5	1	2.63119105011092	0.2	2	fiction_gral	fiction
church/NN/br-k06/571	-0.176648276916035	0.0609649581000428	church	NN	D	D	DE	CDE	church%1:06:00::	D	D	DE	CDE	 cupboards.`` There 's a tower and a steeple on the <font color=green>church</font>  a million feet high. And the loudest clock in the	3	2	3.54448853810278	0.666666666666667	2	fiction_gral	fiction
church/NN/br-k06/659	-0.112882450653869	0.1297089104258	church	NN	D	D	DE	CDE	church%1:06:00::	D	D	DE	CDE	 Street to Orange Square. The steeple leaned backward, while the <font color=green>church</font>  advanced like a headless creature in a long, shapeless coat	5	0	2.44838382062215	0	2	fiction_gral	fiction
church/NN/br-k06/852	-0.173466964794919	-0.0270866853261314	church	NN	D	D	DE	CDE	church%1:06:00::	D	D	DE	CDE	 Church with its high steeple and clock. There was no <font color=green>church</font>  like Drew Church, no preacher like Papa, who was intimate	3	1	2.73741353761488	0.333333333333333	3	fiction_gral	fiction
church/NN/br-k10/1423	-0.0351781720197187	-0.248299862014191	church	NN	A	A	AB	AB	church%1:14:00::	B	B	AB	AB	 economics, and social issues that are no concern of the <font color=green>Church</font> ''? And John 's reply was always the same:`` Anything that	5	0	3.32577023910171	0	1	fiction_gral	fiction
church/NN/br-k10/1445	-0.196549136364991	-0.0709003327638579	church	NN	A	A	AB	AB	church%1:14:00::	B	B	AB	AB	 same:`` Anything that affects souls is the concern of the <font color=green>Church</font> ! We will have righteousness''! Tears burned behind his eyes as	3	1	2.92210286902256	0.333333333333333	2	fiction_gral	fiction
church/NN/br-k10/1802	-0.078406801294665	-0.141401488515311	church	NN	B	B	AB	AB	church_of_rome%1:14:00::	B1	B	AB	AB	 Geneva, saying that he had been a bishop of the <font color=green>Church</font>  of Rome and had been persecuted in Paris for his	2	1	2.82544733753487	0.5	1	fiction_gral	fiction
church/NN/br-k10/205	0.296861697356037	-0.214305462912468	church	NN	A	A	AB	AB	church%1:14:00::	B	B	AB	AB	 that the couple would have to be punished if the <font color=green>Church</font>  was to be respected.`` I have told you before, and	2	1	2.6476609359063	0.5	1	fiction_gral	fiction
church/NN/br-k10/257	0.00528133024488066	-0.293141086154307	church	NN	A	A	AB	AB	church%1:14:00::	B	B	AB	AB	 is the answer the ungodly will always make when the <font color=green>Church</font>  points its fingers at their sins. I say to you	3	1	2.7401971888279	0.333333333333333	1	fiction_gral	fiction
church/NN/br-k10/271	-0.00722660860303963	-0.0932527158455072	church	NN	A	A	AB	AB	church%1:14:00::	B	B	AB	AB	 fingers at their sins. I say to you that the <font color=green>Church</font>  will ever decry evil''! John 's reply was like a	3	2	2.96531664020996	0.666666666666667	3	fiction_gral	fiction
church/NN/br-k10/588	0.0936999393319014	-0.256585182753431	church	NN	A	A	AB	AB	church%1:14:00::	B	B	AB	AB	 to let them give him the last rites of the <font color=green>Church</font> , but he had died still proclaiming salvation by faith. Burial	3	1	3.14526757564034	0.333333333333333	3	fiction_gral	fiction
church/NN/br-k10/967	-0.183599979514695	0.105579970383128	church	NN	D	D	DE	CDE	church%1:06:00::	D	D	DE	CDE	 all the time. Quickening his steps, John entered the vast <font color=green>church</font>  and climbed the tower steps to the bells. Underneath the	6	2	3.2411776229471	0.333333333333333	2	fiction_gral	fiction
church/NN/br-k13/533	-0.078455591259753	0.00447354858486389	church	NN	D	D	DE	CDE	church%1:06:00::	D	D	DE	CDE	 Harold indicated the photograph on the wall and asked what <font color=green>church</font>  the stone sculpture was in. Eugene told him and he	3	2	2.44254840881152	0.666666666666667	4	fiction_gral	fiction
church/NN/br-k14/826	0.0212464692096879	0.251394379409804	church	NN	D	D	DE	CDE	church%1:06:00::	D	D	DE	CDE	 Jewish section was in Trastevere, near the Tiber at the <font color=green>church</font>  of San Francesco a Ripa. The colony had been small	4	0	2.61048193266455	0	1	fiction_gral	fiction
church/NN/br-k15/188	-0.0755647618688434	0.00909601386035959	church	NN	D	D	DE	CDE	church%1:06:00::	D	D	DE	CDE	 They held the funeral the next morning from the crossroads <font color=green>church</font>  and buried the little box in the quiet family plot	6	4	2.6459826054824	0.666666666666667	5	fiction_gral	fiction
