id	model.x	model.y	lemma	pos	genre	marisense	mbroad	mari3	mari2	sensekey	wnsense	wnbroad	wn3	wn2	text	newPos	newBroadGenre	cues	cuesWithWeight	meanWeight	weightedCuesRatio	weightedCW	wf	broadGenre
state/NN/br-f24/1198	-0.0658869535157121	0.172850302359465	state	NN	popular_lore	A5	A	AB	ABC	united_states%1:15:00::	A51	A	AB	ABC	 of Paradise. He had attended three universities in the United <font color=green>States</font> . But he had never seen the mountainous half of his	NNPS	informative	1	0	1.27	0	3	States	others
state/NN/br-f24/1855	-0.0820493655883561	-0.0353620741126393	state	NN	popular_lore	C	C	C	ABC	state%1:14:00::	B1	B	AB	ABC	 without violence. That 's a big step toward a modern <font color=green>state</font> . You might say we are in the nation building business	NN	informative	3	1	0.7	0.33	3	state	others
state/NN/br-f24/525	-0.177733025515729	0.11370960365362	state	NN	popular_lore	D	D	D	D	state%1:03:00::	D1	D	D	D	 11, 1960). And now, in March, all Laos suffered a <font color=green>state</font>  of siege. The Pathet Lao forces held two northern provinces	NN	informative	1	0	1.27	0	4	state	others
state/NN/br-f33/1948	-0.258255388654308	-0.378529006996446	state	NN	popular_lore	A5	A	AB	ABC	united_states%1:15:00::	A51	A	AB	ABC	 get in. In a far distant part of the United <font color=green>States</font> , I was talking to an instructor about a boy who	NNPS	informative	1	0	0.64	0	2	States	others
state/NN/br-g01/1187	0.317376492323673	-0.0702879061907288	state	NN	belles_lettres	A	A	AB	ABC	state%1:15:01::	A	A	AB	ABC	 traditional way of life persists much more in the older <font color=green>states</font>  than in the new ones. Probably a larger percentage of	NNS	informative	5	1	0.87	0.2	3	states	others
state/NN/br-g01/1276	-0.152994057287872	0.138093994800515	state	NN	belles_lettres	A4	A	AB	ABC	state%1:15:01::	A	A	AB	ABC	 of course, important minority enclaves. The long settled areas of <font color=green>states</font>  like Virginia and South Carolina developed the ante-bellum culture to	NNS	informative	4	1	1.36	0.25	6	states	others
state/NN/br-g01/1429	0.0307328558245526	0.293862456453196	state	NN	belles_lettres	A	A	AB	ABC	state%1:15:01::	A	A	AB	ABC	 by the mother country. And no doubt many people in <font color=green>states</font>  like the Carolinas and Georgia, which were among the most	NNS	informative	3	1	0.5	0.33	3	states	others
state/NN/br-g01/1498	-0.0938758824999272	0.0523003404652032	state	NN	belles_lettres	A	A	AB	ABC	state%1:15:01::	A	A	AB	ABC	 that except for Northern meddling it would have ended in <font color=green>states</font>  like Virginia years before it did. Southern resentment has been	NNS	informative	2	2	1.25	1	7	states	others
state/NN/br-g01/1849	-0.107384469674869	0.0287075437236855	state	NN	belles_lettres	A5	A	AB	ABC	united_states%1:14:00::	A52	A	AB	ABC	 both hot and cold. In every war of the United <font color=green>States</font>  since the Civil War the South was more belligerent than	NNPS	informative	1	0	0.91	0	5	States	others
state/NN/br-g01/26	-0.0411651159898684	-0.0444657219917226	state	NN	belles_lettres	C	C	C	ABC	welfare_state%1:14:00::	B	B	AB	ABC	 also led the nation in the direction of a welfare <font color=green>state</font> . And both in their objectives of non-discrimination and of social	NN	informative	4	3	1.02	0.75	6	state	others
state/NN/br-g01/454	-0.0256564674635145	0.111023523012754	state	NN	belles_lettres	A1	A	AB	ABC	state%1:15:01::	A	A	AB	ABC	 to coerce an uncooperative Congress or Supreme Court. As for <font color=green>states</font> ' rights, they have never counted in the thinking of my	NNS	informative	4	2	1.56	0.5	5	states	others
state/NN/br-g01/574	-0.125567368155169	0.224754046238627	state	NN	belles_lettres	A	A	AB	ABC	state%1:15:01::	A	A	AB	ABC	 And if he is so scornful of the rights of <font color=green>states</font> , why not advocate a different sort of constitution that he	NNS	informative	3	1	0.47	0.33	1	states	others
state/NN/br-g17/2109	0.086514447872099	0.228751907256539	state	NN	belles_lettres	A5	A	AB	ABC	united_states%1:15:00::	A51	A	AB	ABC	 the chief universities, colleges, and preparatory schools of the United <font color=green>States</font> . Why should this be so? It is true that New	NNPS	informative	1	0	0.99	0	4	States	others
state/NN/br-g17/2194	-0.141563594941564	0.0894140742919629	state	NN	belles_lettres	A	A	AB	ABC	state%1:15:01::	A	A	AB	ABC	 country? Is n't it a bit odd that the three <font color=green>states</font>  of Southern New England( Massachusetts, Connecticut, and Rhode Island) have	NNS	informative	4	2	1.2	0.5	7	states	others
state/NN/br-g17/2210	-0.0116289340730799	0.05769018796084	state	NN	belles_lettres	A2	A	AB	ABC	state%1:15:01::	A	A	AB	ABC	 Southern New England( Massachusetts, Connecticut, and Rhode Island) have had <font color=green>state</font>  institutions of university status only in the very recent past	NN	informative	5	4	1.22	0.8	9	state	others
state/NN/br-g17/2310	0.0094479797572823	0.15130082858626	state	NN	belles_lettres	A	A	AB	ABC	state%1:15:01::	A	A	AB	ABC	 the West? Is it not ironical that Roger Williams 's <font color=green>state</font> , Rhode Island, should have been the very last of the	NN	informative	1	0	1.1	0	6	state	others
state/NN/br-g19/545	-0.0643161238129136	0.241413285421724	state	NN	belles_lettres	A5	A	AB	ABC	united_states%1:15:00::	A51	A	AB	ABC	 of the giant corporations in Western Europe and the United <font color=green>States</font>  dates from the period 1880- 1900. Now, although the roots	NNPS	informative	1	0	1.27	0	4	States	others
state/NN/br-g21/1159	-0.170713485831214	-0.019251357678717	state	NN	belles_lettres	A5	A	AB	ABC	united_states%1:14:00::	A52	A	AB	ABC	 During the next five years liberal leaders in the United <font color=green>States</font>  sank in the cumulative confusion attendant upon and manifested in	NNPS	informative	1	0	0.75	0	4	States	others
state/NN/br-g21/2009	-0.08499819691789	-0.0247008633335279	state	NN	belles_lettres	A5	A	AB	ABC	united_states%1:14:00::	A52	A	AB	ABC	 same refrain mentioned above:`` The paramount goal of the United <font color=green>States</font> , set long ago, was to guard the rights of the	NNPS	informative	1	0	0.71	0	5	States	others
state/NN/br-g21/2184	-0.212108851084499	-0.081831199448945	state	NN	belles_lettres	D	D	D	D	state%1:03:00::	D1	D	D	D	 to you an uncertain and uneasy, not to say confused, <font color=green>state</font>  of the public mind? What is the common man 's	NN	informative	4	3	1.23	0.75	4	state	others
state/NN/br-g21/244	-0.065095442271249	-0.129155346937973	state	NN	belles_lettres	A5	A	AB	ABC	united_states%1:14:00::	A52	A	AB	ABC	 to be the duty of the destiny of the United <font color=green>States</font>  to assist in the creation of a better world by	NNPS	informative	1	0	1.31	0	5	States	others
state/NN/br-g21/991	-0.0793692812977123	-0.245677469930831	state	NN	belles_lettres	C	C	C	ABC	state%1:14:01::	B	B	AB	ABC	 the Marxist dream of a classless society under a Socialist <font color=green>State</font> . And the USSR existed as the revolutionary experiment in radical	NNP	informative	4	1	0.47	0.25	5	State	others
state/NN/br-g22/1822	0.0193522135225404	-0.033821550258419	state	NN	belles_lettres	B	B	AB	ABC	state%1:14:01::	B	B	AB	ABC	 acting as controllers of the corporation whose responsibility to the <font color=green>state</font>  would now be defined against proprietorship because employees and proprietors	NN	informative	3	2	1.3	0.67	5	state	others
state/NN/br-g22/594	0.0189886749771675	0.0956117886503839	state	NN	belles_lettres	C	C	C	ABC	state_department%1:14:00::	C1	C	C	ABC	 of`` The Soviet Cultural Offensive'', he says,`` Long before the <font color=green>State</font>  Department organized its bureaucracy into an East-West Contacts Staff in	NNP	informative	2	1	1.27	0.5	4	State	others
state/NN/br-g22/643	-0.00775875987558312	0.0678330106492422	state	NN	belles_lettres	C	C	C	ABC	state_department%1:14:00::	C1	C	C	ABC	 when the enterprising promoters of' Porgy and Bess' overrode the <font color=green>State</font>  Department to carry the contemporary' cultural warfare' behind the enemy	NNP	informative	1	1	1.04	1	5	State	others
state/NN/br-g28/1728	-0.094867711054922	0.0951842933086678	state	NN	belles_lettres	A4	A	AB	ABC	state%1:15:01::	A	A	AB	ABC	 preacher and a college and university president in four Southern <font color=green>states</font> , published the earliest of these backwoods sketches and in the	NNS	informative	1	1	1.13	1	6	states	others
state/NN/br-g43/2228	-0.204408615787019	-0.0357338386781415	state	NN	belles_lettres	D	D	D	D	state_of_affairs%1:26:00::	D1	D	D	D	 a search for the human significance of an event or <font color=green>state</font>  of affairs, a tendency to look at wholes rather than	NN	informative	2	1	0.99	0.5	3	state	others
state/NN/br-h09/1237	0.0135301642614549	0.0543648527241716	state	NN	miscellaneous	C	C	C	ABC	secretary_of_state%1:18:00::	C1	C	C	ABC	 development may, subject to the approval of the Secretary of <font color=green>State</font>  to assure that such activities are consistent with the foreign	NNP	informative	1	1	1.2	1	8	State	tech
state/NN/br-h09/1253	-0.00163143113244719	-0.00953217588513288	state	NN	miscellaneous	A5	A	AB	ABC	united_states%1:14:00::	A52	A	AB	ABC	 are consistent with the foreign policy objectives of the United <font color=green>States</font> , be expended in cooperation with public or private agencies in	NNPS	informative	1	0	1.41	0	7	States	tech
state/NN/br-h09/1279	0.0148317813303505	-0.0151575609453152	state	NN	miscellaneous	A5	A	AB	ABC	united_states%1:15:00::	A51	A	AB	ABC	 development of processes useful to the program in the United <font color=green>States</font> : And provided further, That every such contract or agreement made	NNPS	informative	1	0	0.61	0	5	States	tech
state/NN/br-h09/1325	0.0217155213668247	-0.00805450472183294	state	NN	miscellaneous	A5	A	AB	ABC	united_states%1:14:00::	A52	A	AB	ABC	 connection therewith shall be available without cost to the United <font color=green>States</font>  for the use of the United States throughout the world	NNPS	informative	1	0	1.05	0	7	States	tech
state/NN/br-h09/1332	0.0169672544888248	-0.012930348181068	state	NN	miscellaneous	A5	A	AB	ABC	united_states%1:14:00::	A52	A	AB	ABC	 to the United States for the use of the United <font color=green>States</font>  throughout the world and for the use of the general	NNPS	informative	1	0	1.03	0	7	States	tech
state/NN/br-h09/1347	0.00557888625343465	0.00186068726739939	state	NN	miscellaneous	A5	A	AB	ABC	united_states%1:15:00::	A51	A	AB	ABC	 for the use of the general public within the United <font color=green>States</font> . Section 4 of the joint resolution of September 2, 1958	NNPS	informative	1	0	1.33	0	6	States	tech
state/NN/br-h09/14	0.00887384767154076	0.060235451022706	state	NN	miscellaneous	A5	A	AB	ABC	united_states_of_america%1:15:00::	A51	A	AB	ABC	 by the Senate and House of Representatives of the United <font color=green>States</font>  of America in Congress assembled, That the Act of July	NNPS	informative	1	0	1.72	0	6	States	tech
state/NN/br-h09/1488	0.0117884404543716	0.0109717467489964	state	NN	miscellaneous	A3	A	AB	ABC	state%1:14:01::	B	B	AB	ABC	 Congress. Upon such sale, there shall be returned to any <font color=green>State</font>  or public agency which has contributed financial assistance under section	NNP	informative	4	4	1.15	1	9	State	tech
state/NN/br-h09/1534	0.00855859547290166	0.0754767873831087	state	NN	miscellaneous	A5	A	AB	ABC	united_states_of_america%1:15:00::	A51	A	AB	ABC	 by the Senate and House of Representatives of the United <font color=green>States</font>  of America in Congress assembled, That the Secretary of the	NNPS	informative	1	0	1.93	0	6	States	tech
state/NN/br-h09/1659	0.022917237425929	0.19218104067166	state	NN	miscellaneous	A3	A	AB	ABC	state%1:14:01::	B	B	AB	ABC	 coal and lignite mines); and the scope and adequacy of <font color=green>State</font>  mine safety laws applicable to such mines and the enforcement	NNP	informative	3	3	1.58	1	8	State	tech
state/NN/br-h09/1709	0.173091808095458	-0.208937390183773	state	NN	miscellaneous	A4	A	AB	ABC	state%1:14:01::	B	B	AB	ABC	 of, any metal or nonmetallic mine which is in a <font color=green>State</font> ( excluding any coal or lignite mine), the products of which	NNP	informative	3	2	1.1	0.67	5	State	tech
state/NN/br-h09/172	0.172063437359818	0.0843593415893506	state	NN	miscellaneous	A5	A	AB	ABC	united_states%1:15:00::	A51	A	AB	ABC	 other mineralized or chemically charged water, and the term' United <font color=green>States</font> ' extends to and includes the District of Columbia, the Commonwealth	NNPS	informative	1	0	2.05	0	5	States	tech
state/NN/br-h09/1779	0.217904743773137	0.042962150876591	state	NN	miscellaneous	A5	A	AB	ABC	united_states%1:14:00::	A52	A	AB	ABC	 Commonwealth of Puerto Rico and any possession of the United <font color=green>States</font> ; and the term`` commerce'' means commerce between any State and	NNPS	informative	1	0	2.12	0	8	States	tech
state/NN/br-h09/1791	0.115889525546813	0.0979538390087996	state	NN	miscellaneous	A4	A	AB	ABC	state%1:14:01::	B	B	AB	ABC	 United States; and the term`` commerce'' means commerce between any <font color=green>State</font>  and any place outside thereof, or between points within the	NNP	informative	4	5	1.87	1.25	8	State	tech
state/NN/br-h09/1804	0.107560246411774	0.189048357842025	state	NN	miscellaneous	A4	A	AB	ABC	state%1:14:01::	B	B	AB	ABC	 any place outside thereof, or between points within the same <font color=green>State</font>  but through any place outside thereof. The Secretary of the	NNP	informative	4	2	2.26	0.5	6	State	tech
state/NN/br-h09/1886	0.00855859547290166	0.0754767873831087	state	NN	miscellaneous	A5	A	AB	ABC	united_states_of_america%1:15:00::	A51	A	AB	ABC	 by the Senate and House of Representatives of the United <font color=green>States</font>  of America in Congress assembled, That the Secretary of the	NNPS	informative	1	0	1.93	0	6	States	tech
state/NN/br-h09/197	0.15409815387289	0.00532466811895378	state	NN	miscellaneous	A5	A	AB	ABC	united_states%1:14:00::	A52	A	AB	ABC	 Puerto Rico, and the territories and possessions of the United <font color=green>States</font> . In order to accomplish the purposes of this Act, the	NNPS	informative	1	0	1.26	0	5	States	tech
state/NN/br-h09/431	0.019924351133386	-0.0508126282373165	state	NN	miscellaneous	A5	A	AB	ABC	united_states%1:15:00::	A51	A	AB	ABC	 for beneficial consumptive purposes in various parts of the United <font color=green>States</font>  by the leading saline water processes as compared with other	NNPS	informative	1	0	0.76	0	4	States	tech
state/NN/br-h09/634	-0.00350823959011847	-0.0611461787591706	state	NN	miscellaneous	A5	A	AB	ABC	united_states%1:15:00::	A51	A	AB	ABC	 and, in the case of projects located in the United <font color=green>States</font> , cooperate and participate in their development in instances in which	NNPS	informative	1	0	0.88	0	7	States	tech
state/NN/br-h09/704	0.0964243017110875	0.064216993624344	state	NN	miscellaneous	A3	A	AB	ABC	state_department%1:14:01::	C2	C	C	ABC	 projects; and cooperate with other Federal departments and agencies, with <font color=green>State</font>  and local departments, agencies, and instrumentalities, and with interested persons	NNP	informative	4	5	2.02	1.25	7	State	tech
state/NN/br-h09/832	0.00581188620256734	0.0175906277593657	state	NN	miscellaneous	C	C	C	ABC	department_of_state%1:14:00::	C1	C	C	ABC	 the Department of Health Education and Welfare, the Department of <font color=green>State</font> , and other concerned agencies shall also be carried out in	NNP	informative	2	3	1.38	1.5	10	State	tech
state/NN/br-h09/859	0.0656383850160993	0.0616526915390277	state	NN	miscellaneous	A5	A	AB	ABC	united_states%1:15:00::	A51	A	AB	ABC	 the objectives of this Act. All research within the United <font color=green>States</font>  contracted for, sponsored, cosponsored, or authorized under authority of this	NNPS	informative	1	0	1.46	0	6	States	tech
state/NN/br-h11/1680	-0.126283274069685	0.169291991857615	state	NN	miscellaneous	A5	A	AB	ABC	united_states%1:15:00::	A51	A	AB	ABC	 Canada, The Netherlands, United Kingdom, U. S. S. R., United <font color=green>States</font> , and West Germany, met at the NBS to devise means	NNPS	informative	1	0	0.98	0	4	States	tech
state/NN/br-h12/1064	0.189161592829022	-0.060455407518646	state	NN	miscellaneous	A5	A	AB	ABC	united_states%1:14:00::	A52	A	AB	ABC	 8, as reimbursement for the expenses incurred by the United <font color=green>States</font> , an amount equal to 5 per centum of such payment	NNPS	informative	1	0	1.01	0	5	States	tech
state/NN/br-h12/1180	0.0316247957535746	0.149807241732077	state	NN	miscellaneous	A5	A	AB	ABC	united_states%1:14:00::	A52	A	AB	ABC	 or persons found by the Comptroller General of the United <font color=green>States</font>  to be entitled thereto, without the necessity of compliance with	NNPS	informative	1	0	0.89	0	3	States	tech
state/NN/br-h12/12	0.0485459718945352	0.0358578902901925	state	NN	miscellaneous	A5	A	AB	ABC	united_states%1:14:00::	A52	A	AB	ABC	 In addition to the penalties provided in title 18, United <font color=green>States</font>  Code, section 1001, any person guilty of any act, as	NNPS	informative	1	0	1.01	0	7	States	tech
state/NN/br-h12/1261	0.0535732037028364	0.180925262129394	state	NN	miscellaneous	A5	A	AB	ABC	united_states%1:14:00::	A52	A	AB	ABC	 or persons found by the Comptroller General of the United <font color=green>States</font>  to be entitled thereto; if a receiver or trustee for	NNPS	informative	1	0	1.02	0	2	States	tech
state/NN/br-h12/1291	0.113947844569675	0.0626387085854124	state	NN	miscellaneous	A5	A	AB	ABC	united_states%1:15:00::	A51	A	AB	ABC	 appointed by a court of competent jurisdiction in the United <font color=green>States</font>  and has not been discharged prior to the date of	NNPS	informative	1	0	1.49	0	9	States	tech
state/NN/br-h12/1345	0.0861312122415002	0.113594491651856	state	NN	miscellaneous	A5	A	AB	ABC	united_states%1:15:00::	A51	A	AB	ABC	 appointed by a court of competent jurisdiction in the United <font color=green>States</font> , makes an assignment of the claim, or any part thereof	NNPS	informative	1	0	2.16	0	6	States	tech
state/NN/br-h12/1473	0.135384318946867	0.131052315224621	state	NN	miscellaneous	A5	A	AB	ABC	united_states%1:14:00::	A52	A	AB	ABC	 of the Treasury, or the Comptroller General of the United <font color=green>States</font> , as the case may be, shall find that any person	NNPS	informative	1	0	1.43	0	3	States	tech
state/NN/br-h12/1519	0.0166719164056414	-0.0287566729009569	state	NN	miscellaneous	A5	A	AB	ABC	united_states%1:14:00::	A52	A	AB	ABC	 bar to recovery by any other person against the United <font color=green>States</font> , its officers, agents, or employees with respect to such payment	NNPS	informative	1	0	1.16	0	7	States	tech
state/NN/br-h12/1573	0.127702808959607	0.0842290866480706	state	NN	miscellaneous	A5	A	AB	ABC	united_states%1:14:00::	A52	A	AB	ABC	 construed as the assumption of any liability by the United <font color=green>States</font>  for the payment or satisfaction, in whole or in part	NNPS	informative	1	0	0.9	0	5	States	tech
state/NN/br-h12/1597	0.00800002080169311	0.0390674831874245	state	NN	miscellaneous	A5	A	AB	ABC	united_states%1:15:00::	A51	A	AB	ABC	 any claim on behalf of any national of the United <font color=green>States</font>  against any foreign government. There are hereby created in the	NNPS	informative	1	0	1.39	0	5	States	tech
state/NN/br-h12/1613	0.160250904690824	0.0678366851428553	state	NN	miscellaneous	A5	A	AB	ABC	united_states%1:14:00::	A52	A	AB	ABC	 There are hereby created in the Treasury of the United <font color=green>States</font> ( 1) a special fund to be known as the Yugoslav	NNPS	informative	1	0	0.98	0	5	States	tech
state/NN/br-h12/1681	0.013105781841557	0.0323632507668	state	NN	miscellaneous	A5	A	AB	ABC	united_states%1:15:00::	A51	A	AB	ABC	 into a settlement agreement with the Government of the United <font color=green>States</font>  as described in subsection( a) of section 4 of this	NNPS	informative	1	0	1.32	0	5	States	tech
state/NN/br-h12/1839	0.0112295003832894	0.00637644456779131	state	NN	miscellaneous	A5	A	AB	ABC	united_states_dollar%1:23:00::	A52	A	AB	ABC	 a) of this section any amounts hereafter paid, in United <font color=green>States</font>  dollars, by a foreign government which has entered into a	NNPS	informative	1	0	1.09	0	8	States	tech
state/NN/br-h12/1860	0.0173713059742605	0.0284189261340104	state	NN	miscellaneous	A5	A	AB	ABC	united_states%1:15:00::	A51	A	AB	ABC	 a claims settlement agreement with the Government of the United <font color=green>States</font>  as described in subsection( a) of section 4 of this	NNPS	informative	1	0	1.39	0	6	States	tech
state/NN/br-h12/2127	0.09858203150085	0.0956278279695312	state	NN	miscellaneous	C	C	C	ABC	secretary_of_state%1:18:01::	C1	C	C	ABC	 of the Treasury, upon the concurrence of the Secretary of <font color=green>State</font> , is authorized and directed, out of the sum covered into	NNP	informative	3	3	1.63	1	6	State	tech
state/NN/br-h12/2215	0.0906592020744414	0.112666151204158	state	NN	miscellaneous	C	C	C	ABC	secretary_of_state%1:18:01::	C1	C	C	ABC	 of the Yugoslav Claims Agreement of 1948. The Secretary of <font color=green>State</font>  shall certify to the Secretary of the Treasury the total	NNP	informative	3	4	1.91	1.33	5	State	tech
state/NN/br-h12/2273	0.0532220374565232	0.0687055069893102	state	NN	miscellaneous	A5	A	AB	ABC	united_states%1:14:00::	A52	A	AB	ABC	 other official or department, agency, or establishment of the United <font color=green>States</font> . There is hereby authorized to be appropriated, out of any	NNPS	informative	1	0	1.58	0	6	States	tech
state/NN/br-h12/298	0.0903853311455965	0.0126784720537479	state	NN	miscellaneous	A5	A	AB	ABC	united_states%1:15:00::	A51	A	AB	ABC	 of the provisions of this subsection. Whoever, in the United <font color=green>States</font>  or elsewhere, pays or offers to pay, or promises to	NNPS	informative	1	0	1.21	0	6	States	tech
state/NN/br-h12/457	0.0171910019272001	0.0456253266639981	state	NN	miscellaneous	A5	A	AB	ABC	united_states%1:14:00::	A52	A	AB	ABC	 of Justice as may be necessary to represent the United <font color=green>States</font>  as to any claims of the Government of the United	NNPS	informative	3	1	1.29	0.33	4	States	tech
state/NN/br-h12/468	0.0744484372879817	0.0478376652395369	state	NN	miscellaneous	A5	A	AB	ABC	united_states%1:15:00::	A51	A	AB	ABC	 as to any claims of the Government of the United <font color=green>States</font>  with respect to which the Commission has jurisdiction under this	NNPS	informative	1	0	1.64	0	6	States	tech
state/NN/br-h12/512	0.0833532210719284	0.0730827577057385	state	NN	miscellaneous	A5	A	AB	ABC	united_states%1:15:00::	A51	A	AB	ABC	 made by the Commission to the Government of the United <font color=green>States</font>  shall be covered into the Treasury to the credit of	NNPS	informative	1	0	1.24	0	5	States	tech
state/NN/br-h12/691	0.0194718620288989	0.0458561802917782	state	NN	miscellaneous	C	C	C	ABC	secretary_of_state%1:18:01::	C1	C	C	ABC	 fact and not subject to review by the Secretary of <font color=green>State</font>  or any other official, department, agency, or establishment of the	NNP	informative	3	3	1.6	1	8	State	tech
state/NN/br-h12/706	0.0212989747863378	0.0598396690459372	state	NN	miscellaneous	A5	A	AB	ABC	united_states%1:14:00::	A52	A	AB	ABC	 any other official, department, agency, or establishment of the United <font color=green>States</font>  or by any court by mandamus or otherwise. The Commission	NNPS	informative	1	0	1.47	0	5	States	tech
state/NN/br-h12/810	0.044414792719229	0.0748097043357134	state	NN	miscellaneous	C	C	C	ABC	secretary_of_state%1:18:01::	C1	C	C	ABC	 the Secretary of the Treasury and to the Secretary of <font color=green>State</font>  copies of the awards made in favor of the Government	NNP	informative	3	4	1.88	1.33	7	State	tech
state/NN/br-h12/824	0.0324826927908247	0.028116089460623	state	NN	miscellaneous	A5	A	AB	ABC	united_states%1:15:00::	A51	A	AB	ABC	 awards made in favor of the Government of the United <font color=green>States</font>  or of nationals of the United States under this Title	NNPS	informative	1	0	1.46	0	5	States	tech
state/NN/br-h12/831	0.072455409065309	0.0391930641864368	state	NN	miscellaneous	A5	A	AB	ABC	united_states%1:15:00::	A51	A	AB	ABC	 of the United States or of nationals of the United <font color=green>States</font>  under this Title. The Commission shall certify to the Secretary	NNPS	informative	1	0	1.61	0	3	States	tech
state/NN/br-h12/844	0.0546075199035379	0.0983424181319303	state	NN	miscellaneous	C	C	C	ABC	secretary_of_state%1:18:01::	C1	C	C	ABC	 this Title. The Commission shall certify to the Secretary of <font color=green>State</font> , upon his request, copies of the formal submissions of claims	NNP	informative	1	1	1.49	1	6	State	tech
state/NN/br-h13/1432	-0.232517560990599	0.0359722841508662	state	NN	miscellaneous	A5	A	AB	ABC	united_states%1:15:00::	A51	A	AB	ABC	 and planes in Cuba jeopardize the security of the United <font color=green>States</font> , violate the Monroe Doctrine, and threaten the security of every	NNPS	informative	1	0	1.18	0	8	States	tech
state/NN/br-h13/1525	-0.0511232395787177	0.0148664066944695	state	NN	miscellaneous	A5	A	AB	ABC	united_states%1:15:00::	A51	A	AB	ABC	 Cuba off the Inter-American Defense Board. For years the United <font color=green>States</font>  had been trying to get these countries to exclude Castro	NNPS	informative	1	0	0.91	0	6	States	tech
state/NN/br-h13/1758	-0.077287664573245	-0.0617107410421618	state	NN	miscellaneous	A5	A	AB	ABC	united_states%1:14:00::	A52	A	AB	ABC	 and agents to threaten the Americas. How can the United <font color=green>States</font>  act? Blockade is one answer offered by experts. In it	NNPS	informative	2	0	1.12	0	6	States	tech
