id	model.x	model.y	lemma	pos	genre	marisense	mbroad	mari3	mari2	sensekey	wnsense	wnbroad	wn3	wn2	text	newPos	newBroadGenre	cues	cuesWithWeight	meanWeight	weightedCuesRatio	weightedCW	wf	broadGenre
state/JJ/br-e21/1143	-0.0248260181560608	-0.0212273306320321	state	JJ	skill_and_hobbies	A2	A	AB	ABC	state%5:00:02:public:00	A2	A	AB	ABC	 which the area is blessed. Just as the national and <font color=green>state</font>  parks place emphasis on features which are of national or	JJ	informative	3	4	2.31	1.33	10	state	tech
state/JJ/br-e21/1154	-0.0182951406574986	-0.0111845443953842	state	JJ	skill_and_hobbies	A3	A	AB	ABC	state%5:00:01:public:00	A2	A	AB	ABC	 parks place emphasis on features which are of national or <font color=green>state</font>  significance, counties should seek out these features which are distinctive	JJ	informative	3	3	3.44	1	9	state	tech
state/JJ/br-e31/1555	-0.100349194160898	-0.0347301896544146	state	JJ	skill_and_hobbies	A2	A	AB	ABC	state%5:00:02:public:00	A2	A	AB	ABC	 to make their cooking easy and their sleeping comfortable. Harassed <font color=green>state</font>  park officials often have more campers than they know what	JJ	informative	2	2	2.44	1	10	state	tech
state/JJ/br-e31/651	-0.00113096453809845	0.0105152725147828	state	JJ	skill_and_hobbies	A3	A	AB	ABC	state%5:00:02:public:00	A2	A	AB	ABC	 the shooting development program have proudly participated in over 53 <font color=green>state</font>  and regional workshops, at which hundreds of school administrators, teachers	JJ	informative	3	3	2.94	1	6	state	tech
state/JJ/br-g17/2159	-0.0442324331499109	-0.0120884418105545	state	JJ	belles_lettres	A2	A	AB	ABC	state%5:00:02:public:00	A2	A	AB	ABC	 is involved. How did it happen, for example, that the <font color=green>state</font>  university, that great symbol of American democracy, failed to flourish	JJ	informative	3	3	2.32	1	10	state	others
state/JJ/br-g17/2327	0.0364287014774652	0.041364703177186	state	JJ	belles_lettres	A2	A	AB	ABC	state%5:00:02:public:00	A2	A	AB	ABC	 been the very last of the forty-eight to establish a <font color=green>state</font>  university? The state universities of Maine, New Hampshire, And Vermont	JJ	informative	4	1	4.03	0.25	5	state	others
state/JJ/br-g17/2331	0.0620805607875912	0.0522250143009086	state	JJ	belles_lettres	A2	A	AB	ABC	state%5:00:02:public:00	A2	A	AB	ABC	 last of the forty-eight to establish a state university? The <font color=green>state</font>  universities of Maine, New Hampshire, And Vermont are older and	JJ	informative	4	2	4.27	0.5	5	state	others
state/JJ/br-g23/486	-0.0482249972299512	0.069858243391811	state	JJ	belles_lettres	A2	A	AB	ABC	state%5:00:02:public:00	A2	A	AB	ABC	 The writer took a class of college students to the <font color=green>state</font>  hospital for the mentally ill in St. Joseph, Missouri. An	JJ	informative	2	2	2.99	1	10	state	others
state/JJ/br-h11/1931	-0.00569859975164006	-0.0457924911300534	state	JJ	miscellaneous	D	D	D	D	solid-state%5:00:02:solid:01	D2	D	D	D	 addition to the basic programs in wavelength standards, spectroscopy, solid <font color=green>state</font>  physics, interactions of the free electron and atomic constants which	JJ	informative	3	2	3.38	0.67	8	state	tech
state/JJ/br-h11/1986	0.00742992241721786	-0.0669171196302599	state	JJ	miscellaneous	D	D	D	D	solid-state%5:00:02:solid:01	D2	D	D	D	 the far infrared, the application of infrared techniques to solid <font color=green>state</font>  studies, and increased emphasis on high resolution instrumentation. Two data	JJ	informative	3	2	3.5	0.67	11	state	tech
state/JJ/br-h14/1724	0.124257648574467	-0.011421520271384	state	JJ	miscellaneous	A3	A	AB	ABC	state%5:00:02:public:00	A2	A	AB	ABC	 in order to provide matching for the minimum( base) allotment, <font color=green>State</font>  funds had to equal 1954 State funds. Prior to and	JJ	informative	3	4	4	1.33	10	State	tech
state/JJ/br-h14/1730	0.137921331991801	-0.00988490150556474	state	JJ	miscellaneous	A3	A	AB	ABC	state%5:00:02:public:00	A2	A	AB	ABC	 the minimum( base) allotment, State funds had to equal 1954 <font color=green>State</font>  funds. Prior to and since 1960 the rest of the	JJ	informative	4	4	3.99	1	9	State	tech
state/JJ/br-h14/1763	0.0475996577415979	0.000660246889836487	state	JJ	miscellaneous	A3	A	AB	ABC	state%5:00:02:public:00	A2	A	AB	ABC	 fiscal capacity of the State, with a pivot of 40% <font color=green>State</font> ( or 60% Federal) participation in total program costs. The percentage	JJ	informative	2	2	3.14	1	5	State	tech
state/JJ/br-h14/1868	0.103628794413161	-0.0359790994802373	state	JJ	miscellaneous	A3	A	AB	ABC	state%5:00:02:public:00	A2	A	AB	ABC	 will be matched on the basis of a 40% pivot <font color=green>State</font>  share, with maximum and minimum State shares of 50% and	JJ	informative	5	4	4.41	0.8	7	State	tech
state/JJ/br-h14/1875	0.135745834772546	-0.054824339247497	state	JJ	miscellaneous	A3	A	AB	ABC	state%5:00:02:public:00	A2	A	AB	ABC	 of a 40% pivot State share, with maximum and minimum <font color=green>State</font>  shares of 50% and 30%, respectively. The pre 1960 rate	JJ	informative	3	3	4.5	1	6	State	tech
state/JJ/br-h14/1997	0.0334778672291798	-0.0146014246229287	state	JJ	miscellaneous	A3	A	AB	ABC	state%5:00:02:public:00	A2	A	AB	ABC	 rates. The method used for computing the respective Federal and <font color=green>State</font>  shares in total program costs is specifically set forth in	JJ	informative	4	4	2.88	1	13	State	tech
state/JJ/br-h14/332	0.0567261322167823	-0.0143149763454963	state	JJ	miscellaneous	A3	A	AB	ABC	state%5:00:02:public:00	A2	A	AB	ABC	 grants to the States on the basis of population, matching <font color=green>State</font>  expenditures on a 50 - 50 basis. Under P. L.	JJ	informative	3	1	3.3	0.33	7	State	tech
state/JJ/br-h14/360	0.0218031111053571	-0.0146594561102215	state	JJ	miscellaneous	A3	A	AB	ABC	state%5:00:02:public:00	A2	A	AB	ABC	 Congress, the Federal Government assumed responsibility for 100% of necessary <font color=green>State</font>  expenditures in connection with administration and the counseling and placement	JJ	informative	4	3	2.97	0.75	7	State	tech
state/JJ/br-h14/533	0.0628859553572994	0.00879297150140585	state	JJ	miscellaneous	A3	A	AB	ABC	state%5:00:02:public:00	A2	A	AB	ABC	 the authorizations, appropriations, allotment base, Federal grants to States and <font color=green>State</font>  matching funds for this part of the grant program. In	JJ	informative	6	5	3.52	0.83	9	State	tech
state/JJ/br-h14/747	0.0102312756683646	-0.00898681202055819	state	JJ	miscellaneous	A3	A	AB	ABC	state%5:00:02:public:00	A2	A	AB	ABC	 State. The provisions are also designed to avoid disruption in <font color=green>State</font>  programs already in operation, which might otherwise result from the	JJ	informative	2	2	2.56	1	10	State	tech
state/JJ/br-h15/1500	0.0203121273098686	-0.0122036751030207	state	JJ	miscellaneous	A3	A	AB	ABC	state%5:00:02:public:00	A2	A	AB	ABC	 gather its own information and will receive broad information from <font color=green>State</font>  and Federal sources. It will tell you as soon as	JJ	informative	2	2	2.55	1	9	State	tech
state/JJ/br-j38/1551	0.0137755943530081	0.00390530485928698	state	JJ	learned	A3	A	AB	ABC	state%5:00:02:public:00	A2	A	AB	ABC	 Federal government but from an exchange of experiences among states. <font color=green>State</font>  and local agencies in the vocational education field must be	JJ	informative	4	3	2.7	0.75	9	State	tech
state/JJ/br-j38/1590	0.00909155166545419	0.00186543100148484	state	JJ	learned	A3	A	AB	ABC	state%5:00:02:public:00	A2	A	AB	ABC	 Federal effort to provide research and information to help guide <font color=green>state</font>  education departments and local school boards in existing programs. A	JJ	informative	5	5	2.9	1	14	state	tech
state/JJ/br-j38/1871	0.0190542165560385	0.00620389686271223	state	JJ	learned	A3	A	AB	ABC	state%5:00:02:public:00	A2	A	AB	ABC	 for training to meet national skilled manpower needs. If only <font color=green>state</font>  funds were used to pay for the vocational education, it	JJ	informative	3	3	2.39	1	12	state	tech
state/JJ/br-j38/441	0.0152869859416983	0.0202340589505685	state	JJ	learned	A3	A	AB	ABC	state%5:00:02:public:00	A2	A	AB	ABC	 enrolled in courses organized under two special programs administered by <font color=green>state</font>  and local school authorities:( 1) Vocational Education for National Defense	JJ	informative	4	4	3.26	1	10	state	tech
state/JJ/br-j38/86	0.0439950892961205	0.00287866589811807	state	JJ	learned	A1	A	AB	ABC	state%5:00:02:public:00	A2	A	AB	ABC	 appropriation of$ 7 million to support, on a matching basis, <font color=green>state</font>  administered programs of vocational education in agriculture, trades, industrial skills	JJ	informative	4	3	3.88	0.75	8	state	tech
state/JJ/br-l14/977	-0.0703901614996511	-0.0143655864235227	state	JJ	fiction_mystery	A2	A	AB	ABC	state%5:00:02:public:00	A2	A	AB	ABC	 modern, large, on five acres. Must have cost plenty. The <font color=green>State</font>  cops would check from time to time; pass word when	JJ	imaginative	1	1	2.41	1	12	State	imag
state/NN/br-a01/1015	-0.0386330590243977	0.138577980656279	state	NN	press_reportage	A3	A	AB	ABC	state%1:14:01::	B	B	AB	ABC	 governor 's race, a top official said Wednesday. Robert Snodgrass, <font color=green>state</font>  GOP chairman, said a meeting held Tuesday night in Blue	NN	informative	3	1	0.73	0.33	7	state	others
state/NN/br-a01/1049	-0.233575269849643	0.00261885306007481	state	NN	press_reportage	A3	A	AB	ABC	state%1:15:01::	A	A	AB	ABC	 W. Dorsey added that enthusiasm was picking up for a <font color=green>state</font>  rally to be held Sept. 8 in Savannah at which	NN	informative	2	0	0.52	0	3	state	others
state/NN/br-a01/1165	-0.0531036910073996	0.0353571758135753	state	NN	press_reportage	A3	A	AB	ABC	state%1:14:00::	B1	B	AB	ABC	 largest hurdle the Republicans would have to face is a <font color=green>state</font>  law which says that before making a first race, one	NN	informative	2	2	1.24	1	4	state	others
state/NN/br-a01/1440	-0.0487376475118291	0.0651325820363961	state	NN	press_reportage	A3	A	AB	ABC	state%1:14:00::	B1	B	AB	ABC	 highway reconstruction bonds. The bond issue will go to the <font color=green>state</font>  courts for a friendly test suit to test the validity	NN	informative	2	2	1	1	7	state	others
state/NN/br-a01/1835	0.12629776169709	0.0406547857550397	state	NN	press_reportage	A3	A	AB	ABC	state%1:14:00::	B1	B	AB	ABC	 education, provided that such funds be received and expended'' as <font color=green>state</font>  funds. Barber, who is in his 13th year as a	NN	informative	3	3	1.1	1	4	state	others
state/NN/br-a01/413	0.0539596381259806	0.139594862203989	state	NN	press_reportage	A4	A	AB	ABC	state%1:15:01::	A	A	AB	ABC	 through the welfare departments of all the counties in the <font color=green>state</font>  with the exception of Fulton County, which receives none of	NN	informative	2	2	1.73	1	5	state	others
state/NN/br-a02/1165	-0.0449263911691477	0.0838222949298968	state	NN	press_reportage	A2	A	AB	ABC	state%1:15:01::	A	A	AB	ABC	 attorney general and chief justice of the Texas Supreme Court. <font color=green>State</font>  representatives decided Thursday against taking a poll on what kind	NNP	informative	3	2	1.4	0.67	8	State	others
state/NN/br-a02/1454	0.0893755127790062	-0.034338831797028	state	NN	press_reportage	A1	A	AB	ABC	state%1:14:01::	B	B	AB	ABC	 would increase from$ 5000000 to$ 15000000 the maximum loan the <font color=green>state</font>  could make to a local water project. Cotten construed this	NN	informative	3	2	0.82	0.67	4	state	others
state/NN/br-a02/165	-0.0452601028120308	0.0177643969039291	state	NN	press_reportage	A1	A	AB	ABC	state%1:14:01::	B	B	AB	ABC	 the books`` since Texas was a republic''. It permits the <font color=green>state</font>  to take over bank accounts, stocks and other personal property	NN	informative	4	1	0.87	0.25	5	state	others
state/NN/br-a02/2003	0.0784783815719182	0.037868534993244	state	NN	press_reportage	A3	A	AB	ABC	state%1:14:01::	B	B	AB	ABC	 62 session upon the recommendation of Supt. Chester O. Strickland. <font color=green>State</font>  and federal legislation against racial discrimination in employment was called	NNP	informative	2	2	1.16	1	8	State	others
state/NN/br-a02/214	0.00347988921920569	0.0152196609472021	state	NN	press_reportage	A2	A	AB	ABC	state_treasurer%1:18:00::	A2	A	AB	ABC	 companies and other corporations to report such property to the <font color=green>state</font>  treasurer. The escheat law cannot be enforced now because it	NN	informative	3	2	1.01	0.67	7	state	others
state/NN/br-a02/470	0.0975526148961047	0.108536392951546	state	NN	press_reportage	A1	A	AB	ABC	state%1:14:00::	B1	B	AB	ABC	 in the scholastic age at a reduced cost to the <font color=green>state</font> . There was no debate as the Senate passed the bill	NN	informative	3	3	1.5	1	4	state	others
state/NN/br-a02/620	-0.0194810774215124	0.181083302443722	state	NN	press_reportage	A2	A	AB	ABC	state%1:15:01::	A	A	AB	ABC	 saving them from coming to Austin to live in the <font color=green>state</font>  deaf school. Dallas may get to hear a debate on	NN	informative	3	3	0.85	1	5	state	others
state/NN/br-b20/1056	0.0155638138051883	0.100373854567154	state	NN	press_editorial	C	C	C	ABC	state_department%1:14:00::	C1	C	C	ABC	 which will bring down the wall and reunite the city. <font color=green>State</font>  Department officials refusing to show their passes at the boundary	NNP	informative	2	2	1.18	1	5	State	others
state/NN/br-b20/358	-0.0242275251119984	0.00744432434216033	state	NN	press_editorial	A5	A	AB	ABC	united_states%1:14:00::	A52	A	AB	ABC	 seek a discontinuity in the arms policy of the United <font color=green>States</font>  is the least risky path our government can take. His	NNPS	informative	1	0	0.92	0	6	States	others
state/NN/br-b20/64	-0.0818973700607936	-0.145626665625141	state	NN	press_editorial	A5	A	AB	ABC	united_states%1:14:00::	A52	A	AB	ABC	 what we are getting. The biggest nuclear device the United <font color=green>States</font>  has exploded measured some 15 megatons, although our B-52s are	NNPS	informative	1	0	0.81	0	6	States	others
state/NN/br-c01/1164	-0.104002035066396	-0.019143352925527	state	NN	press_reviews	C	C	C	ABC	welfare_state%1:14:00::	B	B	AB	ABC	 we should take from these pages is that the welfare <font color=green>state</font>  in England still allows wild scope for all kinds of	NN	informative	1	1	1.26	1	7	state	others
state/NN/br-d03/319	-0.17318694674071	0.0705354625574748	state	NN	religion	D	D	D	D	state%1:03:00::	D1	D	D	D	 the Roman and Anglican Churches and about the present religious <font color=green>state</font>  of England. Since the Protestant clergy for the most part	NN	informative	2	0	0.55	0	5	state	others
state/NN/br-d04/1145	-0.0610621229553434	-0.0869075944924167	state	NN	religion	D	D	D	D	state%1:03:00::	D1	D	D	D	 and the whole human race''. Because he interprets the primitive <font color=green>state</font>  of man as one of mere potentiality or capacity and	NN	informative	3	1	0.9	0.33	5	state	others
state/NN/br-d04/1599	0.0146903604370501	-0.153150821351585	state	NN	religion	D	D	D	D	state%1:03:00::	D1	D	D	D	 interminable and irremediable. But He set a bound to his[ <font color=green>state</font>  of] sin, by interposing death, and thus causing sin to	NN	informative	3	1	0.53	0.33	3	state	others
state/NN/br-d04/2174	-0.135198719266992	-0.13066298586824	state	NN	religion	D	D	D	D	state%1:03:00::	D1	D	D	D	 existence itself is a form of punishment rather than the <font color=green>state</font>  into which man is put by the will of the	NN	informative	3	1	0.96	0.33	4	state	others
state/NN/br-e02/1595	-0.0345074884321434	-0.260780912862202	state	NN	skill_and_hobbies	A5	A	AB	ABC	united_states%1:15:00::	A51	A	AB	ABC	 made it possible to ship avocado anywhere in the United <font color=green>States</font> . It has a great many assets to recommend it and	NNPS	informative	1	0	1	0	4	States	tech
state/NN/br-e02/1889	-0.104488555188203	-0.484120972341725	state	NN	skill_and_hobbies	D	D	D	D	state%1:03:00::	D1	D	D	D	 temperature at which it lapses into a sort of dormant <font color=green>state</font> . This cooling does not change the avocado in any way	NN	informative	3	0	0.67	0	4	state	tech
state/NN/br-e22/2361	-0.0371480175887536	0.106542375566693	state	NN	skill_and_hobbies	A5	A	AB	ABC	united_states%1:15:00::	A51	A	AB	ABC	 indeed in the musical history of the entire eastern United <font color=green>States</font> . On that date the Musicians Emergency Fund, organized to furnish	NNPS	informative	1	0	1.09	0	7	States	tech
state/NN/br-e22/71	-0.205313906115999	0.0849417687109356	state	NN	skill_and_hobbies	A5	A	AB	ABC	united_states_of_america%1:15:00::	A51	A	AB	ABC	 Republics. The Serge Prokofieff whom we knew in the United <font color=green>States</font>  of America was gay, witty, mercurial, full of pranks and	NNPS	informative	1	0	1.22	0	2	States	tech
state/NN/br-e27/125	0.0687915840551217	-0.180452005291061	state	NN	skill_and_hobbies	A1	A	AB	ABC	state%1:15:01::	A	A	AB	ABC	 minerals. The drug 's chemical name is listed, since most <font color=green>states</font>  require feed processors to use this name instead of the	NNS	informative	2	1	0.57	0.5	9	states	tech
state/NN/br-e27/173	-0.00993930812115761	-0.0289531290042746	state	NN	skill_and_hobbies	A3	A	AB	ABC	state%1:15:01::	A	A	AB	ABC	 drug is being marketed under one trade name only or <font color=green>state</font>  regulatory organizations have approved its use on the feed tag	NN	informative	3	2	0.73	0.67	9	state	tech
state/NN/br-e31/250	0.126024693170724	-0.157361293811131	state	NN	skill_and_hobbies	A4	A	AB	ABC	state%1:15:01::	A	A	AB	ABC	 game bags are possible and legal in more than 40 <font color=green>states</font> , on shooting preserves( one of the newer phases of modern	NNS	informative	3	1	0.55	0.33	4	states	tech
state/NN/br-f03/1319	-0.121207714829446	-0.160563731386858	state	NN	popular_lore	D	D	D	D	state_of_matter%1:26:00::	D2	D	D	D	 the coexistence of the infinite number of universal, apparently momentary <font color=green>states</font>  of matter, successive one after another in consciousness, but permanent	NNS	informative	2	1	0.65	0.5	7	states	others
state/NN/br-f14/1295	-0.00530261644889387	0.106692610768086	state	NN	popular_lore	B	B	AB	ABC	state%1:14:00::	B1	B	AB	ABC	 was attended by representatives of major organs of the German <font color=green>state</font> , including the Reich Minister of the Interior, the State Secretary	NN	informative	4	2	0.92	0.5	6	state	others
state/NN/br-f14/1775	-0.108166917060348	0.0107754683674736	state	NN	popular_lore	B	B	AB	ABC	state%1:14:00::	B1	B	AB	ABC	 own power and in destroying that of rival organizations and <font color=green>states</font> . Certainly, one of the best ways of warning the world	NNS	informative	4	1	0.64	0.25	5	states	others
state/NN/br-f14/457	-0.403359221512385	0.0978218168059528	state	NN	popular_lore	A5	A	AB	ABC	united_states%1:15:00::	A51	A	AB	ABC	 and the tightening of Stalin 's dictatorship; in the United <font color=green>States</font>  the initiation of militant anti Communism, with the repentant ex	NNPS	informative	1	0	1.15	0	3	States	others
state/NN/br-f15/701	-0.0164603274951937	-0.00247875579289836	state	NN	popular_lore	A1	A	AB	ABC	state%1:15:01::	A	A	AB	ABC	 considered by non-Catholics in family planning. The laws of many <font color=green>states</font>  permit birth control only for medical reasons. The Roman Catholic	NNS	informative	2	2	1.11	1	7	states	others
state/NN/br-f17/1114	-0.0271074117754646	0.0598573927400192	state	NN	popular_lore	A5	A	AB	ABC	united_states%1:14:00::	A52	A	AB	ABC	 presence of a colony on the Red prompted the United <font color=green>State</font>  War Department in 1819 to send Lieutenant-Colonel Henry Leavenworth from	NNP	informative	1	0	0.99	0	7	State	others
state/NN/br-f17/1144	-0.0474691990870573	0.160307303556792	state	NN	popular_lore	A5	A	AB	ABC	united_states%1:15:00::	A51	A	AB	ABC	 of Prairie du Chien, until then the most advanced United <font color=green>States</font>  post. In September 1822 two companies of infantry arrived at	NNPS	informative	1	0	1.05	0	5	States	others
state/NN/br-f17/1330	0.0174472163529191	-0.181719889080361	state	NN	popular_lore	A5	A	AB	ABC	united_states%1:15:00::	A51	A	AB	ABC	 and disappointed Swiss who turned their eyes toward the United <font color=green>States</font> . Observing their distressing condition, Colonel Snelling allowed these half starved	NNPS	informative	1	0	1.56	0	4	States	others
state/NN/br-f17/1627	-0.03642718099279	0.0162324896597576	state	NN	popular_lore	A5	A	AB	ABC	united_states%1:15:00::	A51	A	AB	ABC	 Swiss also decided to cast their lot with the United <font color=green>States</font> , and in 1823 several families paid guides to take them	NNPS	informative	1	0	1.15	0	7	States	others
state/NN/br-f17/1774	-0.081131495527217	0.306610523133607	state	NN	popular_lore	A5	A	AB	ABC	united_states%1:15:00::	A51	A	AB	ABC	 as Vevay, Indiana, a notable Swiss center in the United <font color=green>States</font> . In 1837, 157 Red River people with more than 200	NNPS	informative	2	1	1.11	0.5	5	States	others
state/NN/br-f17/548	-0.00209458533318908	0.0274212027797835	state	NN	popular_lore	A5	A	AB	ABC	united_states%1:15:00::	A51	A	AB	ABC	 of Congress forced the foreign firm out of the United <font color=green>States</font> , its British born employees, now become American citizens- Joseph Rolette	NNPS	informative	1	0	1.09	0	8	States	others
state/NN/br-f17/743	-0.12692582991457	0.156724427822227	state	NN	popular_lore	A5	A	AB	ABC	united_states%1:15:00::	A51	A	AB	ABC	 return to the Atlantic coast by way of the United <font color=green>States</font> . In September 1817 at Fort Daer( Pembina) Dickson met the	NNPS	informative	1	0	1.25	0	4	States	others
state/NN/br-f17/794	-0.0726247251150489	0.0484545357694057	state	NN	popular_lore	A5	A	AB	ABC	united_states%1:15:00::	A51	A	AB	ABC	 route through Illinois territory to Indiana and the eastern United <font color=green>States</font>  was the best route for goods from England to reach	NNPS	informative	1	0	1.36	0	9	States	others
state/NN/br-f17/811	-0.102546644430105	0.0426573558394987	state	NN	popular_lore	A5	A	AB	ABC	united_states%1:15:00::	A51	A	AB	ABC	 from England to reach Red River and that the United <font color=green>States</font>  was a better source of supply for many goods than	NNPS	informative	1	0	0.94	0	6	States	others
state/NN/br-f17/844	-0.016138295905213	0.0572839506867706	state	NN	popular_lore	C	C	C	ABC	secretary_of_state%1:18:01::	C1	C	C	ABC	 on December 22 wrote to John Quincy Adams, Secretary of <font color=green>State</font>  at Washington, inquiring about laws covering trade with`` Missouri and	NNP	informative	2	2	1.14	1	9	State	others
state/NN/br-f19/1831	-0.206783024851096	-0.144486615082896	state	NN	popular_lore	A5	A	AB	ABC	united_states%1:15:00::	A51	A	AB	ABC	 of the hundred odd folklore courses given in the United <font color=green>States</font>  survive on sentiment and nationalism alone. If one wishes to	NNPS	informative	1	0	1.12	0	5	States	others
state/NN/br-f19/231	-0.0105568915304037	-0.0162212505577766	state	NN	popular_lore	A5	A	AB	ABC	united_states%1:15:00::	A51	A	AB	ABC	 pine, and they can be applied again to the United <font color=green>States</font>  in more recent years. The popularity of local color literature	NNPS	informative	1	0	0.93	0	6	States	others
state/NN/br-f19/373	-0.110993361832796	-0.0633513355843855	state	NN	popular_lore	A5	A	AB	ABC	united_states%1:15:00::	A51	A	AB	ABC	 of the major culture lags of the twentieth century United <font color=green>States</font> . Yet nationalism has lost few of its charms for the	NNPS	informative	1	0	0.9	0	4	States	others
state/NN/br-f19/619	-0.196437085425072	0.0638773290633926	state	NN	popular_lore	A	A	AB	ABC	state%1:15:01::	A	A	AB	ABC	 symbol of honesty and the father image of the uniting <font color=green>States</font> . Abraham Lincoln emerged as an incarnation of the national Constitution	NNPS	informative	4	3	0.93	0.75	5	States	others
state/NN/br-f20/1147	-0.0726989371258498	0.037686312847696	state	NN	popular_lore	D	D	D	D	state%1:03:00::	D1	D	D	D	 guest list is in itself a little parable of the <font color=green>state</font>  of American civic life at this time. It included the	NN	informative	2	0	0.8	0	4	state	others
state/NN/br-f22/661	-0.194493394291898	0.0325841621895906	state	NN	popular_lore	A5	A	AB	ABC	united_states%1:15:00::	A51	A	AB	ABC	 the best troop in the best regiment in the United <font color=green>States</font>  Army. He fed the captain bits of history about the	NNPS	informative	1	0	0.7	0	6	States	others
state/NN/br-f23/1235	-0.0548349616700168	-0.0136679351305425	state	NN	popular_lore	A5	A	AB	ABC	united_states%1:15:00::	A51	A	AB	ABC	 it. The evidence suggests that foreign peoples believe the United <font color=green>States</font>  is weaker than the Soviet Union, and is bound to	NNPS	informative	1	0	1.02	0	8	States	others
state/NN/br-f23/129	0.0154438935490879	-0.0978945558589052	state	NN	popular_lore	A5	A	AB	ABC	united_states%1:15:00::	A51	A	AB	ABC	 these conditions be enjoyed by the people of the United <font color=green>States</font> . I speak of`` the largest possible measure'' because any person	NNPS	informative	1	0	0.82	0	4	States	others
state/NN/br-f23/1705	0.0339669320008376	-0.0810535052246713	state	NN	popular_lore	A5	A	AB	ABC	united_states%1:15:00::	A51	A	AB	ABC	 isolation and capture, not of Ghana, but of the United <font color=green>States</font> - and this purpose may be served very well by countries	NNPS	informative	1	0	0.89	0	2	States	others
state/NN/br-f23/773	-0.147931459498344	-0.0531321609066828	state	NN	popular_lore	A5	A	AB	ABC	united_states%1:15:00::	A51	A	AB	ABC	 over-all American strength with over-all Soviet strength finds the United <font color=green>States</font>  not only superior, but so superior both in present weapons	NNPS	informative	1	0	1.11	0	8	States	others
