id	model.x	model.y	lemma	pos	genre	marisense	mbroad	mari3	mari2	sensekey	wnsense	wnbroad	wn3	wn2	text	newPos	newBroadGenre	cues	cuesWithWeight	meanWeight	weightedCuesRatio	weightedCW	wf	broadGenre
state/NN/br-h13/1947	-0.177245439999515	0.00421055741053119	state	NN	miscellaneous	A5	A	AB	ABC	united_states%1:14:00::	A52	A	AB	ABC	 most severe reprisal, short of declared war, that the United <font color=green>States</font>  could invoke against Castro. It is the strategy of blockade	NNPS	informative	1	0	1.25	0	5	States	tech
state/NN/br-h14/1016	0.174394530989246	-0.0587017964543595	state	NN	miscellaneous	A	A	AB	ABC	state%1:15:01::	A	A	AB	ABC	 which bears the same ratio to 50% as the particular <font color=green>State</font>  's average per capita income bears to the average per	NNP	informative	4	3	2.17	0.75	10	State	tech
state/NN/br-h14/1049	0.0532166440221341	-0.0297472197387765	state	NN	miscellaneous	A	A	AB	ABC	state%1:15:01::	A	A	AB	ABC	 in item 3 above by the result obtained for each <font color=green>State</font>  in item 1 above.) Determine the particular State 's`` allotment	NNP	informative	3	2	2.1	0.67	9	State	tech
state/NN/br-h14/1059	0.0624136500903546	-0.0192786743392557	state	NN	miscellaneous	A	A	AB	ABC	state%1:15:01::	A	A	AB	ABC	 for each State in item 1 above.) Determine the particular <font color=green>State</font>  's`` allotment percentage''. By law this is 75% for the	NNP	informative	5	4	2.11	0.8	9	State	tech
state/NN/br-h14/1102	0.0663647500198921	-0.0177267335783677	state	NN	miscellaneous	A	A	AB	ABC	state%1:15:01::	A	A	AB	ABC	 in effect prior to fiscal year 1962.) In all other <font color=green>States</font>  it is the difference obtained by subtracting from 100 the	NNPS	informative	1	0	1.1	0	7	States	tech
state/NN/br-h14/1123	0.120626210561251	-0.0476778726560701	state	NN	miscellaneous	A	A	AB	ABC	state%1:15:01::	A	A	AB	ABC	 the result obtained in item 4 above; except that no <font color=green>State</font>  shall have an allotment percentage less than 33- 1 3	NNP	informative	2	2	2.13	1	7	State	tech
state/NN/br-h14/1149	0.0340663216394119	-0.0232640961129763	state	NN	miscellaneous	A	A	AB	ABC	state%1:15:01::	A	A	AB	ABC	 more than 75%. If the resulting difference for the particular <font color=green>State</font>  is less or more than these extremes, the State 's	NNP	informative	4	2	1.38	0.5	4	State	tech
state/NN/br-h14/1159	0.103730069052785	-0.014422710027324	state	NN	miscellaneous	A	A	AB	ABC	state%1:15:01::	A	A	AB	ABC	 particular State is less or more than these extremes, the <font color=green>State</font>  's allotment percentage must be raised or lowered to the	NNP	informative	4	2	1.91	0.5	6	State	tech
state/NN/br-h14/1175	0.0867864296404281	-0.0181934037352336	state	NN	miscellaneous	A	A	AB	ABC	state%1:15:01::	A	A	AB	ABC	 be raised or lowered to the appropriate extreme. Square each <font color=green>State</font>  's allotment percentage. Determine each State 's population.( See Source	NNP	informative	4	3	1.71	0.75	9	State	tech
state/NN/br-h14/1182	0.0834182777987945	-0.0169343348056462	state	NN	miscellaneous	A	A	AB	ABC	state%1:15:01::	A	A	AB	ABC	 appropriate extreme. Square each State 's allotment percentage. Determine each <font color=green>State</font>  's population.( See Source of Data, below for population data	NNP	informative	4	3	1.53	0.75	9	State	tech
state/NN/br-h14/1209	0.150296827632584	-0.0428860147117992	state	NN	miscellaneous	A	A	AB	ABC	state%1:15:01::	A	A	AB	ABC	 be used in this step.) Multiply the population of each <font color=green>State</font>  by the square of its allotment percentage.( Multiply result obtained	NNP	informative	3	3	1.58	1	8	State	tech
state/NN/br-h14/1251	0.057876465540166	-0.0257809669013534	state	NN	miscellaneous	A	A	AB	ABC	state%1:15:01::	A	A	AB	ABC	 the products obtained in item 8 above, for all the <font color=green>States</font> .( For each State, make all computations set forth in items	NNPS	informative	2	1	1.8	0.5	6	States	tech
state/NN/br-h14/1256	0.0458100895089709	-0.0195672392357027	state	NN	miscellaneous	A	A	AB	ABC	state%1:15:01::	A	A	AB	ABC	 in item 8 above, for all the States.( For each <font color=green>State</font> , make all computations set forth in items 1 to 8	NNP	informative	1	1	1.46	1	5	State	tech
state/NN/br-h14/1278	0.10279854235823	-0.0654480790313019	state	NN	miscellaneous	A	A	AB	ABC	state%1:15:01::	A	A	AB	ABC	 8 above, and then add the results obtained for each <font color=green>State</font>  in item 8.) Determine the ratio that the amount being	NNP	informative	1	0	1.78	0	7	State	tech
state/NN/br-h14/1302	0.0794830844046604	-0.0489888904306781	state	NN	miscellaneous	A	A	AB	ABC	state%1:15:01::	A	A	AB	ABC	 is to the sum of the products for all the <font color=green>States</font> .( Divide the amount being allotted by the result obtained in	NNPS	informative	3	2	0.96	0.67	5	States	tech
state/NN/br-h14/1323	0.0830514267550772	-0.0312124158638839	state	NN	miscellaneous	A	A	AB	ABC	state%1:15:01::	A	A	AB	ABC	 the result obtained in item 9 above.) Determine the particular <font color=green>State</font>  's unadjusted allotment for the particular fiscal year.( Multiply the	NNP	informative	4	3	2.08	0.75	9	State	tech
state/NN/br-h14/1336	0.0871827254716061	-0.0369001392661941	state	NN	miscellaneous	A	A	AB	ABC	state%1:15:01::	A	A	AB	ABC	 's unadjusted allotment for the particular fiscal year.( Multiply the <font color=green>State</font>  product in item 8 above by the result obtained in	NNP	informative	4	2	2.03	0.5	9	State	tech
state/NN/br-h14/1356	0.0960209510585672	-0.0462577292611188	state	NN	miscellaneous	A	A	AB	ABC	state%1:15:01::	A	A	AB	ABC	 result obtained in item 10 above.) Determine if the particular <font color=green>State</font>  's unadjusted allotment( result obtained in item 11 above) is	NNP	informative	4	2	2.1	0.5	11	State	tech
state/NN/br-h14/1389	0.157494209346814	-0.0200406840929028	state	NN	miscellaneous	A	A	AB	ABC	state%1:15:01::	A	A	AB	ABC	 so lower its unadjusted allotment to its maximum allotment.( Each <font color=green>State</font>  's unadjusted allotment for any fiscal year, which exceeds its	NNP	informative	5	5	2.34	1	6	State	tech
state/NN/br-h14/1444	0.0881334440837117	-0.0420917492347609	state	NN	miscellaneous	A	A	AB	ABC	state%1:15:01::	A	A	AB	ABC	 by the amount of the excess.) Determine if the particular <font color=green>State</font>  's unadjusted allotment( result obtained in item 11 above) is	NNP	informative	4	2	1.99	0.5	8	State	tech
state/NN/br-h14/1485	0.0832401620110241	-0.0196341891063755	state	NN	miscellaneous	A	A	AB	ABC	state%1:15:01::	A	A	AB	ABC	 to its minimum allotment. Regardless of its unadjusted allotment, each <font color=green>State</font>  is guaranteed by law a minimum allotment each year equal	NNP	informative	4	6	1.67	1.5	12	State	tech
state/NN/br-h14/1521	0.129537386271719	-0.0171372164779027	state	NN	miscellaneous	A	A	AB	ABC	state%1:15:01::	A	A	AB	ABC	 percentage of 5.4865771 which brings total 1954 allotments to all <font color=green>States</font>  up to$ 23000000. The funds recouped by reductions in item	NNPS	informative	3	2	1.16	0.67	5	States	tech
state/NN/br-h14/1552	0.18362864188683	-0.0361943500331395	state	NN	miscellaneous	A	A	AB	ABC	state%1:15:01::	A	A	AB	ABC	 increase the unadjusted allotments to the specified minimum in those <font color=green>States</font>  where the unadjusted allotment is less than the minimum allotment	NNPS	informative	3	2	1.63	0.67	7	States	tech
state/NN/br-h14/1579	0.383310490708169	-0.21311534315134	state	NN	miscellaneous	A	A	AB	ABC	state%1:15:01::	A	A	AB	ABC	 above); and second, to increase uniformly the allotments to those <font color=green>States</font>  whose allotments are below their maximums, with adjustments to prevent	NNPS	informative	3	1	0.87	0.33	2	States	tech
state/NN/br-h14/1595	0.0970875049657628	-0.0106805250774393	state	NN	miscellaneous	A	A	AB	ABC	state%1:15:01::	A	A	AB	ABC	 their maximums, with adjustments to prevent the allotment of any <font color=green>State</font>  from thereby exceeding its maximum. For the States which maintain	NNP	informative	4	4	1.79	1	6	State	tech
state/NN/br-h14/1604	0.039032821677035	-0.0031277774442599	state	NN	miscellaneous	A	A	AB	ABC	state%1:15:01::	A	A	AB	ABC	 of any State from thereby exceeding its maximum. For the <font color=green>States</font>  which maintain two separate agencies- one for the vocational rehabilitation	NNPS	informative	3	3	1.55	1	7	States	tech
state/NN/br-h14/1755	0.0927464706204103	-0.0346253847755019	state	NN	miscellaneous	A	A	AB	ABC	state%1:15:01::	A	A	AB	ABC	 matched at rates related to the fiscal capacity of the <font color=green>State</font> , with a pivot of 40% State( or 60% Federal) participation	NNP	informative	5	2	1.24	0.4	6	State	tech
state/NN/br-h14/1786	0.0440783214983891	0.000943538061320765	state	NN	miscellaneous	A1	A	AB	ABC	state%1:15:01::	A	A	AB	ABC	 The percentage of Federal participation in such costs for any <font color=green>State</font>  is referred to in the law as that State 's	NNP	informative	4	4	1.5	1	8	State	tech
state/NN/br-h14/1795	0.0382004116414427	0.00360316591701448	state	NN	miscellaneous	A	A	AB	ABC	state%1:15:01::	A	A	AB	ABC	 any State is referred to in the law as that <font color=green>State</font>  's`` Federal share''. For purposes of this explanation, this percentage	NNP	informative	5	3	1.29	0.6	8	State	tech
state/NN/br-h14/1815	0.0974970121913304	-0.0121785446858346	state	NN	miscellaneous	A	A	AB	ABC	state%1:15:01::	A	A	AB	ABC	 of this explanation, this percentage is referred to as the <font color=green>States</font> `` unadjusted Federal share''. Beginning in 1960, the matching requirements for	NNPS	informative	5	3	1.33	0.6	7	States	tech
state/NN/br-h14/1897	0.111634838691836	-0.0143265811880046	state	NN	miscellaneous	A	A	AB	ABC	state%1:15:01::	A	A	AB	ABC	 pre 1960 rate of Federal participation with respect to any <font color=green>State</font>  's base allotment, as well as the adjusted rate in	NNP	informative	5	4	1.33	0.8	8	State	tech
state/NN/br-h14/1924	0.106168398273131	0.0059633289518048	state	NN	miscellaneous	A	A	AB	ABC	state%1:15:01::	A	A	AB	ABC	 1960- 1962 period, is designated by the statute as that <font color=green>State</font>  's`` adjusted Federal Share''. The provisions for determining a State	NNP	informative	4	2	1.41	0.5	6	State	tech
state/NN/br-h14/1937	0.072182273592182	-0.0127905000355444	state	NN	miscellaneous	A	A	AB	ABC	state%1:15:01::	A	A	AB	ABC	 State 's`` adjusted Federal Share''. The provisions for determining a <font color=green>State</font>  's unadjusted Federal share are designed to reflect the varying	NNP	informative	4	3	1.94	0.75	9	State	tech
state/NN/br-h14/1952	0.0442388479899126	-0.0164386736625078	state	NN	miscellaneous	A	A	AB	ABC	state%1:15:01::	A	A	AB	ABC	 are designed to reflect the varying financial resources among the <font color=green>States</font> . The purpose of the adjusted Federal share relating to the	NNPS	informative	6	2	1.53	0.33	9	States	tech
state/NN/br-h14/198	0.250001557446443	0.182751672973219	state	NN	miscellaneous	A	A	AB	ABC	state%1:15:01::	A	A	AB	ABC	 backlog of an estimated two million disabled. To assist the <font color=green>States</font> , therefore, in rehabilitating handicapped individuals,`` so that they may prepare	NNPS	informative	2	1	1.11	0.5	3	States	tech
state/NN/br-h14/2019	0.0778863254103672	0.0219108494192327	state	NN	miscellaneous	A	A	AB	ABC	state%1:15:01::	A	A	AB	ABC	 forth in the Act. The term`` State'' means the several <font color=green>States</font> , the District of Columbia, the Virgin Islands, Guam and Puerto	NNPS	informative	4	1	1.98	0.25	9	States	tech
state/NN/br-h14/2039	0.154958893957285	0.0303643097595579	state	NN	miscellaneous	A5	A	AB	ABC	united_states%1:15:00::	A51	A	AB	ABC	 the Virgin Islands, Guam and Puerto Rico; the term`` United <font color=green>States</font> '' includes the several States and the District of Columbia and	NNPS	informative	1	0	2.55	0	9	States	tech
state/NN/br-h14/2044	0.101818178490809	0.0265024496937363	state	NN	miscellaneous	A	A	AB	ABC	state%1:15:01::	A	A	AB	ABC	 and Puerto Rico; the term`` United States'' includes the several <font color=green>States</font>  and the District of Columbia and excludes the Virgin Islands	NNPS	informative	2	1	2.27	0.5	8	States	tech
state/NN/br-h14/2082	0.373026155609633	0.0250614130066503	state	NN	miscellaneous	A	A	AB	ABC	state%1:15:01::	A	A	AB	ABC	 The following steps are employed in the calculations: For each <font color=green>State</font> ( except the Virgin Islands, Guam, Puerto Rico, and, prior to	NNP	informative	3	1	2.15	0.33	8	State	tech
state/NN/br-h14/2143	0.171443038957295	-0.0356990043201008	state	NN	miscellaneous	A5	A	AB	ABC	united_states%1:15:00::	A51	A	AB	ABC	 above.) Determine the average per capita income for the United <font color=green>States</font>  for the last three years.( The same amount used in	NNPS	informative	1	0	1.77	0	7	States	tech
state/NN/br-h14/2182	0.204846956003494	-0.0441770202381976	state	NN	miscellaneous	A5	A	AB	ABC	united_states%1:15:00::	A51	A	AB	ABC	 40% to the average per capita income of the United <font color=green>States</font> .( Divide 40 by the amount used in item 2 above	NNPS	informative	1	0	1.81	0	8	States	tech
state/NN/br-h14/2200	0.244708275725359	-0.0252139298765079	state	NN	miscellaneous	A	A	AB	ABC	state%1:15:01::	A	A	AB	ABC	 the amount used in item 2 above.) Determine for each <font color=green>State</font> ( except the Virgin Islands, Guam, Puerto Rico, and, prior to	NNP	informative	3	1	2.52	0.33	9	State	tech
state/NN/br-h14/2236	0.174394530989246	-0.0587017964543595	state	NN	miscellaneous	A	A	AB	ABC	state%1:15:01::	A	A	AB	ABC	 which bears the same ratio to 40% as the particular <font color=green>State</font>  's average per capita income bears to the average per	NNP	informative	4	3	2.17	0.75	10	State	tech
state/NN/br-h14/2252	0.136534245503823	-0.0512823995379808	state	NN	miscellaneous	A5	A	AB	ABC	united_states%1:15:00::	A51	A	AB	ABC	 bears to the average per capita income of the United <font color=green>States</font> .( Multiply the result obtained in item 3 above by the	NNPS	informative	1	0	2.13	0	10	States	tech
state/NN/br-h14/2269	0.0634364319156074	-0.028074067758907	state	NN	miscellaneous	A	A	AB	ABC	state%1:15:01::	A	A	AB	ABC	 in item 3 above by the amount used for each <font color=green>State</font>  in item 1 above.) Determine the particular State 's`` Federal	NNP	informative	2	1	1.95	0.5	9	State	tech
state/NN/br-h14/2279	0.0385573954335238	-0.00975098192041647	state	NN	miscellaneous	A	A	AB	ABC	state%1:15:01::	A	A	AB	ABC	 for each State in item 1 above.) Determine the particular <font color=green>State</font>  's`` Federal Share''. By law this is 70% for the	NNP	informative	3	1	1.93	0.33	9	State	tech
state/NN/br-h14/2323	0.0663647500198921	-0.0177267335783677	state	NN	miscellaneous	A	A	AB	ABC	state%1:15:01::	A	A	AB	ABC	 in effect prior to fiscal year 1962.) In all other <font color=green>States</font>  it is the difference obtained by subtracting from 100 the	NNPS	informative	1	1	1.1	1	7	States	tech
state/NN/br-h14/2344	0.0676959531546572	-0.0274682002992337	state	NN	miscellaneous	A	A	AB	ABC	state%1:15:01::	A	A	AB	ABC	 the result obtained in item 4 above; except that no <font color=green>State</font>  shall have a Federal share less than 50% nor more	NNP	informative	2	2	1.9	1	7	State	tech
state/NN/br-h14/2367	0.0340663216394119	-0.0232640961129763	state	NN	miscellaneous	A	A	AB	ABC	state%1:15:01::	A	A	AB	ABC	 more than 70%. If the resulting difference for the particular <font color=green>State</font>  is less or more than these extremes, the State 's	NNP	informative	3	2	1.38	0.67	4	State	tech
state/NN/br-h14/2377	0.0544898045542697	2.32947425873711e-06	state	NN	miscellaneous	A	A	AB	ABC	state%1:15:01::	A	A	AB	ABC	 particular State is less or more than these extremes, the <font color=green>State</font>  's Federal share must be raised or lowered to the	NNP	informative	4	2	1.64	0.5	6	State	tech
state/NN/br-h14/30	0.046457927130836	0.0148105801669937	state	NN	miscellaneous	A	A	AB	ABC	state%1:15:01::	A	A	AB	ABC	 of the vocational rehabilitation program has been to assist the <font color=green>States</font> , by means of grants-in-aid, to return disabled men and women	NNPS	informative	2	1	1.21	0.5	7	States	tech
state/NN/br-h14/324	0.0616089790739793	-0.00298550420379052	state	NN	miscellaneous	A1	A	AB	ABC	state%1:15:01::	A	A	AB	ABC	 existed until 1943, the Federal Government made grants to the <font color=green>States</font>  on the basis of population, matching State expenditures on a	NNPS	informative	5	4	1.6	0.8	7	States	tech
state/NN/br-h14/531	0.122922982460807	0.00748633421262552	state	NN	miscellaneous	A1	A	AB	ABC	state%1:15:01::	A	A	AB	ABC	 selected years, the authorizations, appropriations, allotment base, Federal grants to <font color=green>States</font>  and State matching funds for this part of the grant	NNPS	informative	4	4	2.23	1	7	States	tech
state/NN/br-h14/549	0.0704395699617871	0.0059012123123122	state	NN	miscellaneous	A1	A	AB	ABC	state%1:15:01::	A	A	AB	ABC	 part of the grant program. In order to assist the <font color=green>States</font>  in maintaining basic vocational rehabilitation services, Section 2 of the	NNPS	informative	3	3	1.47	1	9	States	tech
state/NN/br-h14/567	0.0358293422890375	-0.00346277198441036	state	NN	miscellaneous	A	A	AB	ABC	state%1:15:01::	A	A	AB	ABC	 Section 2 of the amended Act provides that allotments to <font color=green>States</font>  for support of such services be based on( 1) need	NNPS	informative	3	2	1.05	0.67	5	States	tech
state/NN/br-h14/585	0.0674016929897068	-0.0485004260400735	state	NN	miscellaneous	A	A	AB	ABC	state%1:15:01::	A	A	AB	ABC	 services be based on( 1) need, as measured by a <font color=green>State</font>  's population, and( 2) fiscal capacity, as measured by its	NNP	informative	4	3	1.03	0.75	5	State	tech
state/NN/br-h14/643	0.167491747474619	-0.0424821333115735	state	NN	miscellaneous	A	A	AB	ABC	state%1:15:01::	A	A	AB	ABC	 base'' allotment, and a`` ceiling'' or maximum allotment, for each <font color=green>State</font> . It stipulates, in addition, that all amounts remaining as a	NNP	informative	3	4	1.53	1.33	7	State	tech
state/NN/br-h14/679	0.242594133780447	0.0626636816058627	state	NN	miscellaneous	A	A	AB	ABC	state%1:15:01::	A	A	AB	ABC	 not used for insuring the`` floor'', be redistributed to those <font color=green>States</font>  still below their maximums. These provisions are designed to reflect	NNPS	informative	3	1	1.66	0.33	2	States	tech
state/NN/br-h14/699	0.0540682710677304	-0.116273621374045	state	NN	miscellaneous	A	A	AB	ABC	state%1:15:01::	A	A	AB	ABC	 to reflect the differences in wealth and population among the <font color=green>States</font> , with the objective that a vocationally handicapped person have access	NNPS	informative	3	2	0.95	0.67	6	States	tech
state/NN/br-h14/721	0.233711790882015	-0.032842529174195	state	NN	miscellaneous	A	A	AB	ABC	state%1:15:01::	A	A	AB	ABC	 to needed services regardless of whether he resides in a <font color=green>State</font>  with a low or high per capita income or a	NNP	informative	4	2	1.42	0.5	7	State	tech
state/NN/br-h14/736	0.1914232240858	-0.0190681027155561	state	NN	miscellaneous	A	A	AB	ABC	state%1:15:01::	A	A	AB	ABC	 high per capita income or a sparsely or thickly populated <font color=green>State</font> . The provisions are also designed to avoid disruption in State	NNP	informative	3	1	1.49	0.33	8	State	tech
state/NN/br-h14/794	0.0778863254103672	0.0219108494192327	state	NN	miscellaneous	A	A	AB	ABC	state%1:15:01::	A	A	AB	ABC	 forth in the Act. The term`` State'' means the several <font color=green>States</font> , the District of Columbia, the Virgin Islands, Guam and Puerto	NNPS	informative	3	0	1.98	0	9	States	tech
state/NN/br-h14/814	0.154958893957285	0.0303643097595579	state	NN	miscellaneous	A5	A	AB	ABC	united_states%1:15:00::	A51	A	AB	ABC	 the Virgin Islands, Guam and Puerto Rico; the term`` United <font color=green>States</font> '' includes the several States and the District of Columbia, and	NNPS	informative	1	0	2.55	0	9	States	tech
state/NN/br-h14/819	0.0867328300911402	0.0253864085023597	state	NN	miscellaneous	A	A	AB	ABC	state%1:15:01::	A	A	AB	ABC	 and Puerto Rico; the term`` United States'' includes the several <font color=green>States</font>  and the District of Columbia, and excludes the Virgin Islands	NNPS	informative	3	1	2.22	0.33	7	States	tech
state/NN/br-h14/857	0.373026155609633	0.0250614130066503	state	NN	miscellaneous	A	A	AB	ABC	state%1:15:01::	A	A	AB	ABC	 Hawaii. The following steps are employed in calculations: For each <font color=green>State</font> ( except Puerto Rico, Guam, the Virgin Islands, and, prior to	NNP	informative	4	1	2.15	0.25	8	State	tech
state/NN/br-h14/981	0.207830664194621	-0.0270451397926275	state	NN	miscellaneous	A	A	AB	ABC	state%1:15:01::	A	A	AB	ABC	 the result obtained in item 2 above.) Determine for each <font color=green>State</font> ( except the Virgin Islands, Guam and Puerto Rico, and, prior	NNP	informative	3	1	2.69	0.33	9	State	tech
state/NN/br-h17/670	-0.118774362144877	0.335570708094573	state	NN	miscellaneous	A5	A	AB	ABC	united_states%1:14:00::	A52	A	AB	ABC	 petitioner. Daniel M. Friedman argued the cause for the United <font color=green>States</font> . On the brief were Solicitor General Rankin, Assistant Attorney General	NNPS	informative	1	0	1.63	0	3	States	tech
state/NN/br-h18/132	-0.00756504072034168	0.0439785266620922	state	NN	miscellaneous	C	C	C	ABC	department_of_state%1:14:00::	C1	C	C	ABC	 our situation. It is the concern of the Department of <font color=green>State</font>  that the American people are safe and secure- defense is	NNP	informative	1	1	0.98	1	7	State	tech
state/NN/br-h18/1462	-0.0615101511481173	-0.162222438555315	state	NN	miscellaneous	A5	A	AB	ABC	united_states%1:14:00::	A52	A	AB	ABC	 of policy, well established precedents, the commitments of the United <font color=green>States</font>  under international charters and treaties, basic statutes, and well understood	NNPS	informative	1	0	1.04	0	4	States	tech
state/NN/br-h18/163	-0.00583030868511622	0.0342256237475734	state	NN	miscellaneous	C	C	C	ABC	department_of_state%1:14:00::	C1	C	C	ABC	 Defense. It is also the concern of the Department of <font color=green>State</font>  that our trading relationships with the rest of the world	NNP	informative	3	2	0.95	0.67	6	State	tech
state/NN/br-h18/2007	0.040392476206344	0.120677959456477	state	NN	miscellaneous	C	C	C	ABC	department_of_state%1:14:00::	C1	C	C	ABC	 this point by saying,`` You fellows in the Department of <font color=green>State</font>  do n't know much about domestic politics''. This is an	NNP	informative	1	1	1.18	1	4	State	tech
state/NN/br-h18/22	-0.00227196518767396	0.500788660790588	state	NN	miscellaneous	A5	A	AB	ABC	united_states%1:14:00::	A52	A	AB	ABC	 to make a few suggestions: What we in the United <font color=green>States</font>  do or do not do will make a very large	NNPS	informative	1	0	1.06	0	1	States	tech
state/NN/br-h18/705	0.124360814412886	0.138241115517476	state	NN	miscellaneous	A5	A	AB	ABC	united_states%1:15:00::	A51	A	AB	ABC	 our Capital, can be easily be directed against the United <font color=green>States</font>  and all that it stands for. Dozens of seemingly small	NNPS	informative	1	0	1.4	0	3	States	tech
state/NN/br-h18/791	-0.00961449270080884	0.0149247164404829	state	NN	miscellaneous	C	C	C	ABC	department_of_state%1:14:00::	C1	C	C	ABC	 who can do something about them. If the Department of <font color=green>State</font>  is to take primary responsibility for foreign policy in Washington	NNP	informative	1	1	1.2	1	7	State	tech
state/NN/br-h21/1002	-0.00331726880887585	-0.0321939639852204	state	NN	miscellaneous	A	A	AB	ABC	state%1:15:01::	A	A	AB	ABC	 Federal Aviation Agency. The growing communications needs of this new <font color=green>State</font>  can best be met, as they have in other States	NNP	informative	5	2	0.72	0.4	7	State	tech
state/NN/br-h21/1013	-0.00525324059947076	-0.036112519552418	state	NN	miscellaneous	A4	A	AB	ABC	state%1:15:01::	A	A	AB	ABC	 State can best be met, as they have in other <font color=green>States</font> , through the operation and development of such facilities by private	NNPS	informative	4	4	0.68	1	6	States	tech
state/NN/br-h24/1018	0.152327985065523	0.11796982179808	state	NN	miscellaneous	A5	A	AB	ABC	united_states%1:15:00::	A51	A	AB	ABC	 also Interest on Unpaid Taxes, below. Citizens of the United <font color=green>States</font>  who, on April 15, are not in the United States	NNPS	informative	1	0	1.66	0	4	States	tech
state/NN/br-h24/1030	0.320750105943684	0.0676101049126351	state	NN	miscellaneous	A5	A	AB	ABC	united_states%1:15:00::	A51	A	AB	ABC	 States who, on April 15, are not in the United <font color=green>States</font>  or Puerto Rico, are allowed an extension of time until	NNPS	informative	1	0	2.27	0	5	States	tech
state/NN/br-h24/1120	0.273856452599661	0.0211999617216593	state	NN	miscellaneous	A5	A	AB	ABC	united_states%1:15:00::	A51	A	AB	ABC	 Naval Personnel on duty in Alaska or outside the United <font color=green>States</font>  and Puerto Rico are also allowed this automatic extension of	NNPS	informative	1	0	1.5	0	9	States	tech
state/NN/br-h24/1166	0.280525171706206	0.0564917202464785	state	NN	miscellaneous	A5	A	AB	ABC	united_states%1:15:00::	A51	A	AB	ABC	 that you were in Alaska or were outside the United <font color=green>States</font>  or Puerto Rico on April 15 or other due date	NNPS	informative	1	0	2.18	0	6	States	tech
state/NN/br-h24/1574	0.208950826818779	0.0292694298028723	state	NN	miscellaneous	A5	A	AB	ABC	united_states%1:15:00::	A51	A	AB	ABC	 of abode for the tax year is outside the United <font color=green>States</font> ( including Alaska and Hawaii), Puerto Rico, or the Virgin Islands	NNPS	informative	1	0	1.93	0	7	States	tech
