id	model.x	model.y	lemma	pos	genre	marisense	mbroad	mari3	mari2	sensekey	wnsense	wnbroad	wn3	wn2	text	newPos	newBroadGenre	cues	cuesWithWeight	meanWeight	weightedCuesRatio	weightedCW	wf	broadGenre
state/NN/br-h24/1608	0.122007266627076	0.089547905010937	state	NN	miscellaneous	A5	A	AB	ABC	united_states%1:15:00::	A51	A	AB	ABC	 of business in any internal revenue district in the United <font color=green>States</font> , you should file your return with the Office of International	NNPS	informative	1	0	0.93	0	6	States	tech
state/NN/br-h24/471	0.0707456367269602	0.0721983594817475	state	NN	miscellaneous	A5	A	AB	ABC	united_states%1:15:00::	A51	A	AB	ABC	 in Canada or Mexico who earn wages in the United <font color=green>States</font>  may be subject to withholding of tax on their wages	NNPS	informative	3	2	1.18	0.67	8	States	tech
state/NN/br-h24/493	0.0503105501615738	0.0330013505310462	state	NN	miscellaneous	A5	A	AB	ABC	united_states%1:15:00::	A51	A	AB	ABC	 the same as if they were citizens of the United <font color=green>States</font> . Their United States tax returns are due April 16, 1962	NNPS	informative	1	0	1.62	0	6	States	tech
state/NN/br-h24/497	0.0569127731428366	0.0357629286945943	state	NN	miscellaneous	A5	A	AB	ABC	united_states%1:15:00::	A51	A	AB	ABC	 if they were citizens of the United States. Their United <font color=green>States</font>  tax returns are due April 16, 1962. However, if their	NNPS	informative	1	0	1.52	0	6	States	tech
state/NN/br-h24/512	0.135288123696002	0.0414133626841992	state	NN	miscellaneous	A5	A	AB	ABC	united_states%1:15:00::	A51	A	AB	ABC	 returns are due April 16, 1962. However, if their United <font color=green>States</font>  income is not subject to the withholding of tax on	NNPS	informative	1	0	1.38	0	6	States	tech
state/NN/br-j03/1194	0.00563504794678838	-0.0919128045019545	state	NN	learned	D	D	D	D	state%1:03:00::	D1	D	D	D	 equilibrium( referred to by some as thermostatics) to the steady <font color=green>state</font> . This can be justified thermodynamically in this case, and this	NN	informative	3	1	1.07	0.33	7	state	tech
state/NN/br-j03/2180	0.0600113636859914	-0.461170500493905	state	NN	learned	D	D	D	D	state%1:03:00::	D1	D	D	D	 which states that** f, where \q is the probability that <font color=green>state</font> ( i.e., volume for an ideal gas) could be reached by	NN	informative	3	0	0.86	0	2	state	tech
state/NN/br-j03/353	0.0396282911017485	-0.225366860345607	state	NN	learned	D	D	D	D	state%1:03:00::	D1	D	D	D	 the tape was run for over 1 hr., a steady <font color=green>state</font>  was not reached, and it was concluded that the reason	NN	informative	2	2	0.9	1	5	state	tech
state/NN/br-j03/577	-0.0421180805840604	-0.156058415986595	state	NN	learned	D	D	D	D	state%1:03:00::	D1	D	D	D	 fluid measured from the top of the block, and steady <font color=green>states</font>  were apparently reached with these fluids. It is presumed that	NNS	informative	3	2	0.94	0.67	6	states	tech
state/NN/br-j07/1320	0.136847074741007	-0.337793424890704	state	NN	learned	A5	A	AB	ABC	united_states%1:15:00::	A51	A	AB	ABC	 cause a deviation from a linear relationship. In the United <font color=green>States</font> , most of the sensors are calibrated by dropping small spheres	NNPS	informative	1	0	0.94	0	3	States	tech
state/NN/br-j07/414	0.0897435320012376	-0.189812776861754	state	NN	learned	D	D	D	D	state%1:03:00::	D1	D	D	D	 the material spiraling into the sun, maintaining a fairly steady <font color=green>state</font> . Asteroidal collisions are also thought to contribute material. It is	NN	informative	3	1	0.86	0.33	5	state	tech
state/NN/br-j10/14	-0.299953575141098	-0.238713971534213	state	NN	learned	D	D	D	D	state%1:03:00::	D1	D	D	D	 the honeybee, practically all bees and bumblebees hibernate in a <font color=green>state</font>  of torpor. Occasionally, you may come across one or two	NN	informative	2	0	0.83	0	3	state	tech
state/NN/br-j10/1969	-0.23386811086333	-0.133888497749953	state	NN	learned	A5	A	AB	ABC	united_states%1:15:00::	A51	A	AB	ABC	 found in tremendous numbers in certain parts of the United <font color=green>States</font>  west of the Great Plains, for example, in Utah and	NNPS	informative	1	0	0.74	0	3	States	tech
state/NN/br-j10/1988	0.0044861404754969	0.0819181405337453	state	NN	learned	A5	A	AB	ABC	united_states%1:15:00::	A51	A	AB	ABC	 for example, in Utah and central Washington. In the United <font color=green>States</font>  Department of Agriculture 's Yearbook of Agriculture, 1952, which is	NNPS	informative	1	0	1.61	0	5	States	tech
state/NN/br-j10/543	-0.081958619304081	-0.0458064222395293	state	NN	learned	A5	A	AB	ABC	united_states%1:15:00::	A51	A	AB	ABC	 Bombus; there must be several dozen species in the United <font color=green>States</font>  alone. If you really insist on knowing their names, an	NNPS	informative	1	0	0.63	0	5	States	tech
state/NN/br-j11/799	0.079321501076703	-0.212969730886515	state	NN	learned	A5	A	AB	ABC	united_states%1:15:00::	A51	A	AB	ABC	 summary of the habits of the snakes of the United <font color=green>States</font> , could supply data on the maturing period for only three	NNPS	informative	1	0	0.73	0	5	States	tech
state/NN/br-j11/916	-0.116601567233311	0.106115048485271	state	NN	learned	A5	A	AB	ABC	united_states%1:15:00::	A51	A	AB	ABC	 three. Other herpetologists have ascertained that in the northern United <font color=green>States</font>  the prairie rattlesnake may not give first birth until it	NNPS	informative	1	0	1.05	0	3	States	tech
state/NN/br-j17/1109	0.0447968478255192	-0.312760786684229	state	NN	learned	D	D	D	D	state%1:03:00::	D1	D	D	D	 balance, but for the sake of correlating autonomic and clinical <font color=green>states</font> , and of studying the effect of certain therapeutic procedures on	NNS	informative	5	3	1.22	0.6	5	states	tech
state/NN/br-j17/1231	-0.00398776539571	-0.185065287392736	state	NN	learned	D	D	D	D	state%1:03:00::	D1	D	D	D	 persons by drugs. The fundamental differences between physiological and pathological <font color=green>states</font>  of parasympathetic( and also of sympathetic) dominance remain to be	NNS	informative	5	3	1.2	0.6	8	states	tech
state/NN/br-j17/1283	0.0254867808452423	-0.19642354636568	state	NN	learned	D	D	D	D	state%1:03:00::	D1	D	D	D	 its balance lead also to qualitative alterations in reactivity. A <font color=green>state</font>  of parasympathetic`` tuning'' of the hypothalamus induced experimentally causes not	NN	informative	6	2	1.03	0.33	5	state	tech
state/NN/br-j17/1330	-0.0153297592829667	-0.103401347313142	state	NN	learned	D	D	D	D	state%1:03:00::	D1	D	D	D	 a stimulus acting sympathetically under control conditions elicits in this <font color=green>state</font>  of tuning a parasympathetic response! Furthermore, conditioned reactions are fundamentally	NN	informative	4	4	1.08	1	9	state	tech
state/NN/br-j17/1500	-0.0118718150996563	-0.125215206052679	state	NN	learned	D	D	D	D	state%1:03:00::	D1	D	D	D	 altering the hypothalamic balance alter conditioned reactions;( 3) in a <font color=green>state</font>  of depression, the positive conditioned stimulus may fail to elicit	NN	informative	4	4	1.3	1	10	state	tech
state/NN/br-j17/1558	-0.00879159776199818	-0.143745308268895	state	NN	learned	D	D	D	D	state%1:03:00::	D1	D	D	D	 fundamental alterations in conditioned reactions occur in a variety of <font color=green>states</font>  in which the hypothalamic balance has been altered by physiological	NNS	informative	4	3	1.23	0.75	10	states	tech
state/NN/br-j17/1626	-0.0218175295263442	-0.152696106705888	state	NN	learned	D	D	D	D	emotional_state%1:26:00::	D1	D	D	D	 just mentioned which alter the hypothalamic balance would influence emotional <font color=green>state</font>  and behavior but that emotion itself would act likewise. We	NN	informative	4	4	1.14	1	10	state	tech
state/NN/br-j17/2022	-0.0183344614436514	-0.228084455146978	state	NN	learned	D	D	D	D	state%1:03:00::	D1	D	D	D	 a functional antagonism exists between an aggressive attitude and a <font color=green>state</font>  of anxiety. Although in both emotions sympathetic symptoms are present	NN	informative	3	1	1.25	0.33	7	state	tech
state/NN/br-j17/2059	0.150949702930287	-0.168057983625707	state	NN	learned	D	D	D	D	state%1:03:00::	D1	D	D	D	 by the rate of the excretion of the catecholamines, the <font color=green>state</font>  of the muscle tone, and the Mecholyl test. The psychological	NN	informative	2	1	0.92	0.5	2	state	tech
state/NN/br-j17/2076	-0.0112944971915158	-0.16588132423951	state	NN	learned	D	D	D	D	emotional_state%1:26:00::	D1	D	D	D	 and the Mecholyl test. The psychological incompatibility of these emotional <font color=green>states</font>  seems to be reflected in, or based on, this marked	NNS	informative	2	2	1.3	1	5	states	tech
state/NN/br-j17/2207	0.0240525172400044	-0.233638812897121	state	NN	learned	D	D	D	D	state%1:03:00::	D1	D	D	D	 for major changes in behavior seen in various moods and <font color=green>states</font>  of emotions in man and beast under physiological circumstances, in	NNS	informative	4	3	1.05	0.75	5	states	tech
state/NN/br-j17/2256	-0.00440105894537907	-0.134307008782618	state	NN	learned	D	D	D	D	state%1:03:00::	D1	D	D	D	 neurotic and psychotic disorders and the parallelism observed between autonomic <font color=green>states</font>  and psychological behavior in several instances, it is further suggested	NNS	informative	3	2	1.12	0.67	7	states	tech
state/NN/br-j17/504	0.0149367889926749	-0.20859462222451	state	NN	learned	D	D	D	D	state%1:03:00::	D1	D	D	D	 level, the lessened hypothalamic cortical discharges lead to a diminished <font color=green>state</font>  of activity in the cortex with consequent reduction in the	NN	informative	4	3	0.96	0.75	5	state	tech
state/NN/br-j17/574	0.0204795936578985	-0.208002926085381	state	NN	learned	D	D	D	D	state%1:03:00::	D1	D	D	D	 these pathological conditions, we should remember that changes in the <font color=green>state</font>  of the hypothalamus within physiological limits distinguish sleep from wakefulness	NN	informative	5	4	0.99	0.8	8	state	tech
state/NN/br-j17/891	-0.0299310336926503	-0.157921447073147	state	NN	learned	D	D	D	D	emotional_state%1:26:00::	D1	D	D	D	 direction causes excitatory effects and, eventually, maniclike changes. The emotional <font color=green>states</font>  produced by drugs influence the cortical potentials in a characteristic	NNS	informative	5	4	1.06	0.8	6	states	tech
state/NN/br-j22/1281	0.0199675583825055	-0.022499510456953	state	NN	learned	A5	A	AB	ABC	united_states%1:14:00::	A52	A	AB	ABC	 By holding out prospects for external capital assistance, the United <font color=green>States</font>  can provide strong incentives to prepare for the concerted economic	NNPS	informative	1	0	1.12	0	8	States	tech
state/NN/br-j22/182	-0.0935903942676262	-0.0647104056672859	state	NN	learned	A5	A	AB	ABC	united_states%1:15:00::	A51	A	AB	ABC	 countries passing through this stage can be escaped. The United <font color=green>States</font>  can help by communicating a genuine concern with the problems	NNPS	informative	1	0	0.76	0	6	States	tech
state/NN/br-j22/976	0.0362762737493187	-0.0188573228846129	state	NN	learned	A3	A	AB	ABC	state%1:15:01::	A	A	AB	ABC	 the governments to develop their own technical assistance to communities, <font color=green>state</font>  and provincial governments, rural communities, and other smaller groups, making	NN	informative	3	4	1.3	1.33	9	state	tech
state/NN/br-j23/1025	-0.106619970063465	-0.119800992852375	state	NN	learned	A5	A	AB	ABC	united_states%1:15:00::	A51	A	AB	ABC	 reaffirms, and maintains the fundamental values. Even in the united <font color=green>states</font> , with its freedom of religious belief and worship and its	NNS	informative	1	0	1.02	0	5	states	tech
state/NN/br-j23/1206	-0.211123359184405	-0.194336808179349	state	NN	learned	D	D	D	D	state%1:03:00::	D1	D	D	D	 marriage as a sacrament, much law-breaking as sinful, occasionally the <font color=green>state</font>  as a divine instrument. It places certain values at least	NN	informative	4	2	0.81	0.5	4	state	tech
state/NN/br-j23/1793	-0.130918173180718	-0.0269205238747393	state	NN	learned	A5	A	AB	ABC	united_states%1:15:00::	A51	A	AB	ABC	 at many secular semi-public and public occasions in the United <font color=green>States</font> ; and it is evidenced in the prayers offered, in the	NNPS	informative	1	0	1.08	0	7	States	tech
state/NN/br-j23/786	-0.0696228124827916	-0.0813103157068718	state	NN	learned	D	D	D	D	state%1:03:00::	D1	D	D	D	 a principle of compensation, mainly in a promised perfect future <font color=green>state</font> . The belief in immortality, where held, functions as a redress	NN	informative	2	2	1.09	1	9	state	tech
state/NN/br-j29/2105	-0.15162305616917	-0.215310222051562	state	NN	learned	D	D	D	D	state%1:03:00::	D1	D	D	D	 able to achieve because he is aroused to an energetic <font color=green>state</font>  without becoming confused or panicked. Sarason et al. present evidence	NN	informative	4	1	0.76	0.25	4	state	tech
state/NN/br-j31/1184	-0.147946355652597	0.27212798470074	state	NN	learned	D	D	D	D	state%1:03:00::	D1	D	D	D	 room which she preferred to keep in a very cold <font color=green>state</font> , and plunking myself down in my chair- in short, behaving	NN	informative	2	0	0.32	0	2	state	tech
state/NN/br-j34/732	0.0824874905273752	-0.166357404118594	state	NN	learned	D	D	D	D	emotional_state%1:26:00::	D1	D	D	D	 differences from one speaker to another, or from one emotional <font color=green>state</font>  to another, may far exceed the small differences between tones	NN	informative	1	1	0.97	1	6	state	tech
state/NN/br-j38/1125	0.0103905985644631	-0.00632358761974275	state	NN	learned	A1	A	AB	ABC	state%1:14:01::	B	B	AB	ABC	 which make it an asset to industrial development efforts. Few <font color=green>states</font>  make effective use of their existing vocational education programs or	NNS	informative	5	5	0.99	1	8	states	tech
state/NN/br-j38/1149	0.0260681916044931	-0.00574653473364857	state	NN	learned	A1	A	AB	ABC	state%1:14:01::	B	B	AB	ABC	 the purpose of attracting new industry. The opportunity exists for <font color=green>states</font>  to reserve some of their vocational education funds to apply	NNS	informative	4	4	1.1	1	11	states	tech
state/NN/br-j38/1549	0.0340283790947575	0.0199578176752781	state	NN	learned	A1	A	AB	ABC	state%1:14:01::	B	B	AB	ABC	 the Federal government but from an exchange of experiences among <font color=green>states</font> . State and local agencies in the vocational education field must	NNS	informative	6	4	1.51	0.67	7	states	tech
state/NN/br-j38/1818	0.0335007939437683	0.0134894810916218	state	NN	learned	A3	A	AB	ABC	state_government%1:14:00::	C2	C	C	ABC	 unless a new industry is in sight and requests it. <font color=green>State</font>  governments have been taking the lead in establishing area vocational	NNP	informative	2	2	0.89	1	9	State	tech
state/NN/br-j38/1888	0.048390018790392	0.0123701250207593	state	NN	learned	A1	A	AB	ABC	state%1:14:01::	B	B	AB	ABC	 for the vocational education, it could be argued that the <font color=green>state</font>  should not have to bear the cost of vocational training	NN	informative	3	3	1.38	1	7	state	tech
state/NN/br-j38/1905	0.0627451006735519	0.0101174613443793	state	NN	learned	A4	A	AB	ABC	state%1:15:01::	A	A	AB	ABC	 cost of vocational training which would benefit employers in other <font color=green>states</font> . However, if Federal funds are used, it would be entirely	NNS	informative	3	2	1.12	0.67	10	states	tech
state/NN/br-j38/249	0.0178307661849052	0.00949557016723717	state	NN	learned	A1	A	AB	ABC	state%1:14:01::	B	B	AB	ABC	 control remain primarily with the local school districts. Even the <font color=green>states</font>  remain primarily in an assisting role, providing leadership and teacher	NNS	informative	4	4	0.96	1	11	states	tech
state/NN/br-j38/276	0.0213319505953726	0.0109840868194479	state	NN	learned	A3	A	AB	ABC	state%1:14:01::	B	B	AB	ABC	 is limited to half of the total expenditure, and the <font color=green>state</font>  or local districts must pay at least half. The state	NN	informative	3	2	1.14	0.67	8	state	tech
state/NN/br-j38/287	0.0127261673195032	0.0169080970657299	state	NN	learned	A1	A	AB	ABC	state%1:14:01::	B	B	AB	ABC	 state or local districts must pay at least half. The <font color=green>state</font>  may decide to encourage local programs by paying half of	NN	informative	4	5	1.06	1.25	11	state	tech
state/NN/br-j38/303	0.0307846663873992	0.0141207882228829	state	NN	learned	A1	A	AB	ABC	state%1:14:01::	B	B	AB	ABC	 local programs by paying half of the cost, or the <font color=green>state</font>  may require the local district to bear this half or	NN	informative	4	4	1.23	1	9	state	tech
state/NN/br-j38/326	0.0558916373570221	0.00627808647216964	state	NN	learned	A3	A	AB	ABC	state_government%1:14:00::	C2	C	C	ABC	 some part of it. Throughout the history of the program, <font color=green>state</font>  government expenditures in the aggregate have usually matched or exceeded	NN	informative	3	3	1.17	1	6	state	tech
state/NN/br-j38/353	0.0624741272856429	0.0177553395196882	state	NN	learned	A3	A	AB	ABC	state_government%1:14:00::	C2	C	C	ABC	 districts all together have spent more than either Federal or <font color=green>state</font>  governments. Today, Federal funds account for only one-fifth of the	NN	informative	3	4	1.94	1.33	7	state	tech
state/NN/br-j38/388	0.0348119245544485	-0.00966413004885492	state	NN	learned	A1	A	AB	ABC	state%1:14:01::	B	B	AB	ABC	 matching fund principle has been in initially encouraging the poorest <font color=green>states</font>  and school districts to spend enough to obtain their full	NNS	informative	3	2	1.32	0.67	10	states	tech
state/NN/br-j38/687	0.00497208803860567	-0.0131652909750651	state	NN	learned	A4	A	AB	ABC	state%1:15:01::	A	A	AB	ABC	 it provides the essential groundwork for developing skills. In most <font color=green>states</font> , trade and industrial training is provided in a minority of	NNS	informative	4	3	0.63	0.75	10	states	tech
state/NN/br-j38/769	0.00685946302438179	0.0118506395926194	state	NN	learned	A1	A	AB	ABC	state%1:14:01::	B	B	AB	ABC	 For a number of years Kentucky, Louisiana and several other <font color=green>states</font>  have been building state sponsored vocational education schools that serve	NNS	informative	5	5	1.12	1	14	states	tech
state/NN/br-j38/773	0.0109063347768038	0.0141522249503325	state	NN	learned	A1	A	AB	ABC	state%1:14:01::	B	B	AB	ABC	 years Kentucky, Louisiana and several other states have been building <font color=green>state</font>  sponsored vocational education schools that serve nearby school districts in	NN	informative	4	4	1.24	1	15	state	tech
state/NN/br-j38/885	-0.0124682437454427	-0.00592592919062174	state	NN	learned	A4	A	AB	ABC	state%1:15:01::	A	A	AB	ABC	 By 1960 there were such schools in all but 4 <font color=green>states</font> . They were operating in 10 of the 17 major areas	NNS	informative	4	2	0.33	0.5	4	states	tech
state/NN/br-j41/109	-0.0434330364417243	-0.0265207586574008	state	NN	learned	A5	A	AB	ABC	united_states%1:15:00::	A51	A	AB	ABC	 wages and prices in the steel industry of the United <font color=green>States</font>  since World War 2,. Indeed, the apparent stiffening of the	NNPS	informative	1	0	0.58	0	6	States	tech
state/NN/br-j42/1014	-0.164321555133107	-0.0803507303358349	state	NN	learned	C	C	C	ABC	state%1:14:00::	B1	B	AB	ABC	 occurred. It reached its ultimate philosophical statement in notions of`` <font color=green>state</font>  will'' put forward by the Germans, especially by Hegel, although	NN	informative	4	3	1.06	0.75	7	state	tech
state/NN/br-j42/1082	-0.0481344496020964	0.000480103865065142	state	NN	learned	C	C	C	ABC	state%1:14:00::	B1	B	AB	ABC	 community this reduced law to Jellinek 's auto limitation. A <font color=green>state</font> , the highest form of human organization in fact and theory	NN	informative	4	3	0.76	0.75	5	state	tech
state/NN/br-j42/1184	-0.0389938156865754	-0.0745995657063126	state	NN	learned	B	B	AB	ABC	state%1:14:00::	B1	B	AB	ABC	 except that willed by, acknowledged by, or consented to by <font color=green>states</font> . Hidden behind Hegelian abstractions were more practical reasons for a	NNS	informative	3	2	0.99	0.67	6	states	tech
state/NN/br-j42/148	-0.0516031606662754	-0.0479222997127237	state	NN	learned	B	B	AB	ABC	state%1:14:00::	B1	B	AB	ABC	 with an international political system in which a number of <font color=green>states</font>  were competitive, suspicious, and opportunistic in their political alignments with	NNS	informative	4	4	0.4	1	6	states	tech
state/NN/br-j42/2015	-0.0493777600351097	-0.0274659784523317	state	NN	learned	B	B	AB	ABC	state%1:14:00::	B1	B	AB	ABC	 arrangement. It is not surprising that the international obligations of <font color=green>states</font>  were also viewed in terms of contract. In fact, some	NNS	informative	3	2	0.56	0.67	8	states	tech
state/NN/br-j42/2212	-0.00864604515297984	0.022171379122818	state	NN	learned	B	B	AB	ABC	state%1:14:00::	B1	B	AB	ABC	 proper, or, as it is often called, public international law. <font color=green>States</font>  were free to enact, within broad though( perhaps) determinate limits	NNPS	informative	5	4	0.83	0.8	5	States	tech
state/NN/br-j42/301	-0.0569615328622815	-0.0573145749197266	state	NN	learned	B	B	AB	ABC	state%1:14:00::	B1	B	AB	ABC	 doctrine applicable among the great nations and the smaller European <font color=green>states</font>  did not really comfortably fit less developed and less powerful	NNS	informative	4	3	0.98	0.75	10	states	tech
state/NN/br-j42/339	-0.176800786623712	0.027451010156747	state	NN	learned	A5	A	AB	ABC	united_states%1:15:00::	A51	A	AB	ABC	 in Latin America by the special interest of the United <font color=green>States</font>  as expressed in the Monroe Doctrine, itself from the outset	NNPS	informative	1	0	1.3	0	6	States	tech
state/NN/br-j42/635	-0.112907373919315	-0.00387919904592487	state	NN	learned	B	B	AB	ABC	state%1:14:00::	B1	B	AB	ABC	 law if they were to join this community as sovereign <font color=green>states</font> . Hall, for example, was quite explicit on this point when	NNS	informative	2	2	1.35	1	5	states	tech
state/NN/br-j42/652	-0.245912723731885	-0.0571451724064764	state	NN	learned	B	B	AB	ABC	state%1:14:00::	B1	B	AB	ABC	 example, was quite explicit on this point when he said`` <font color=green>states</font>  outside European civilization must formally enter into the circle of	NNS	informative	2	2	1.37	1	5	states	tech
state/NN/br-j42/777	-0.00693946704079328	-0.0521145291251584	state	NN	learned	B	B	AB	ABC	state%1:14:00::	B1	B	AB	ABC	 of Justice into particular rules governing the relations of sovereign <font color=green>states</font> . The difference is important, for although the older law of	NNS	informative	2	2	1.45	1	7	states	tech
state/NN/br-j42/879	-0.0450559064870819	-0.054701780883804	state	NN	learned	C	C	C	ABC	state%1:14:00::	B1	B	AB	ABC	 entirely and confined itself to rules limiting the exercise of <font color=green>state</font>  power for reasons essentially unconnected with justice or morality save	NN	informative	4	3	0.94	0.75	8	state	tech
state/NN/br-j42/964	0.00882752818871679	-0.0221611428202607	state	NN	learned	C	C	C	ABC	state%1:14:00::	B1	B	AB	ABC	 was the growing nationalism and the tendency to regard the <font color=green>state</font> , and the individual 's identification with the state, as transcending	NN	informative	4	3	1.15	0.75	6	state	tech
state/NN/br-j42/973	0.0153954127906083	-0.00381534509444103	state	NN	learned	C	C	C	ABC	state%1:14:00::	B1	B	AB	ABC	 regard the state, and the individual 's identification with the <font color=green>state</font> , as transcending other ties of social solidarity. National identification was	NN	informative	3	2	0.97	0.67	7	state	tech
state/NN/br-j52/965	-0.0381069031494321	-0.105247173255048	state	NN	learned	D	D	D	D	state%1:03:00::	D1	D	D	D	 since all that is expressed in either case is a <font color=green>state</font>  of feeling, and that feeling is still there. And our	NN	informative	2	3	0.4	1.5	4	state	tech
state/NN/br-j56/249	0.0475526328459177	0.0196227138868129	state	NN	learned	A3	A	AB	ABC	state%1:15:01::	A	A	AB	ABC	 1958 town meeting directed town authorities to seek federal and <font color=green>state</font>  funds with which to conduct a preliminary survey of a	NN	informative	3	3	1.08	1	9	state	tech
state/NN/br-j58/1112	-0.00580531872213425	0.231566217207573	state	NN	learned	A2	A	AB	ABC	state_prison%1:06:00::	A2	A	AB	ABC	 claimed that there were a score of men in the <font color=green>state</font>  prison who were a thousand times more deserving of sympathy	NN	informative	1	1	0.69	1	3	state	tech
state/NN/br-j58/146	-0.119015148892913	0.0586975072804919	state	NN	learned	A4	A	AB	ABC	state%1:15:01::	A	A	AB	ABC	 principles that they do not interfere with slavery in the <font color=green>states</font> ''. The two major newspapers in Providence continued, throughout the crisis	NNS	informative	3	3	0.91	1	7	states	tech
state/NN/br-j58/1974	0.0206150166294668	0.138588940353286	state	NN	learned	B	B	AB	ABC	state%1:15:01::	A	A	AB	ABC	 recalled that in Rhode Island a party opposed to the <font color=green>state</font>  's condemnation of a man( Thomas W. Dorr) proclaimed the	NN	informative	1	0	1.01	0	6	state	tech
state/NN/br-j58/1987	-0.00336052906727192	0.131576636733004	state	NN	learned	A1	A	AB	ABC	state%1:15:01::	A	A	AB	ABC	 's condemnation of a man( Thomas W. Dorr) proclaimed the <font color=green>state</font>  's action as a violation of the law of the	NN	informative	4	2	1.19	0.5	4	state	tech
state/NN/br-j58/320	-0.157942134223275	0.140283300154407	state	NN	learned	A1	A	AB	ABC	state%1:15:01::	A	A	AB	ABC	 1859, John Brown was found guilty of treason against the <font color=green>state</font>  of Virginia, inciting slave rebellion, and murder. For these crimes	NN	informative	1	1	1.45	1	6	state	tech
