id	model.x	model.y	lemma	wf	pos	newPos	genre	broadGenre	newBroadGenre	marisense	mbroad	mari3	mari2	sensekey	wnsense	wnbroad	wn3	wn2	text	cues	cuesWithWeight	meanWeight	weightedCuesRatio	weightedCW
state/NN/br-a24/1213	-0.0237490901107203	-0.139073635999465	state	state	NN	NN	press_reportage	others	informative	A1	A	AB	ABC	Z	Z	Z	Z	Z	 the owners. Atty. Gen. J. Joseph Nugent appeared for the <font color=green>state</font> . Santa 's lieutenants in charge of the Journal-Bulletin Santa Claus	3	0	1.08	0	6
state/NN/br-a24/706	0.00279366045891502	-0.0100444837028605	state	state	NN	NN	press_reportage	others	informative	A3	A	AB	ABC	Z	Z	Z	Z	Z	 the firm 's 25 workers joined before striking, said the <font color=green>state</font>  Labor Relations Board has been asked to set up an	3	1	0.87	0.33	7
state/NN/br-a28/1391	0.0576926809906619	-0.0283512272678685	state	state	NN	NN	press_reportage	others	informative	A3	A	AB	ABC	Z	Z	Z	Z	Z	 the benefit received. A rule on the Federal deductibility of <font color=green>state</font>  taxes is contested. A realty corporation in Louisiana owed no	3	2	0.95	0.67	8
state/NN/br-a28/2062	0.0406765133222017	0.0122825993187153	state	state	NN	NN	press_reportage	others	informative	A	A	AB	ABC	Z	Z	Z	Z	Z	 certain supplies without divulging the identity of the parent. The <font color=green>state</font>  's occupation tax is computed on gross sales. The court	4	3	1.21	0.75	9
state/NN/br-a29/831	0.0105881290443131	-0.0749727647202074	state	state	NN	NN	press_reportage	others	informative	A3	A	AB	ABC	Z	Z	Z	Z	Z	 trustees of the Dallas Museum of Fine Arts. She is <font color=green>state</font>  chairman for the New Mexico Tuberculosis and Cancer Associations. Both	3	0	1.02	0	6
state/NN/br-a33/1770	0.0955872786714479	-0.0619523503130388	state	States	NN	NNPS	press_reportage	others	informative	A5	A	AB	ABC	Z	Z	Z	Z	Z	 Accepted Scottish Rite for the Southern Jurisdiction of the United <font color=green>States</font> . The opening session of the 5- day session will begin	1	0	1.73	0	5
state/NN/br-a33/830	-0.0209666293594884	0.163774272261156	state	States	NN	NNPS	press_reportage	others	informative	A5	A	AB	ABC	Z	Z	Z	Z	Z	 and their work is being duplicated all across the United <font color=green>States</font> .`` This is a great national cultural asset, and therefore it	1	0	0.38	0	4
state/NN/br-a34/673	0.0992274308926187	0.0338137197622408	state	States	NN	NNPS	press_reportage	others	informative	A5	A	AB	ABC	Z	Z	Z	Z	Z	 it unnecessary. He wanted time, too, to review the United <font color=green>States</font> ' global commitments and to test both the policies he had	1	0	1.68	0	4
state/NN/br-a36/316	0.0488984268693384	-0.00350914717926905	state	States	NN	NNPS	press_reportage	others	informative	A5	A	AB	ABC	Z	Z	Z	Z	Z	 by the new workers. The company has billed the United <font color=green>States</font>  Government for$ 7500000 of these expenses under the Defense Department	1	0	1.37	0	5
state/NN/br-a37/215	-0.0437903575913155	0.326929666453878	state	States	NN	NNPS	press_reportage	others	informative	A5	A	AB	ABC	Z	Z	Z	Z	Z	 relations immediately.`` There is a limit to what the United <font color=green>States</font>  in self-respect can endure'', said the President.`` That limit has	1	0	1.02	0	2
state/NN/br-a37/643	0.0572457338831594	-0.0874466740476657	state	State	NN	NNP	press_reportage	others	informative	C	C	C	ABC	Z	Z	Z	Z	Z	 neighboring South Viet Nam and Laos. The late Secretary of <font color=green>State</font>  John Foster Dulles considered the 1954 Geneva agreement a specimen	1	1	1.73	1	8
state/NN/br-a40/1438	0.0850994095386503	-0.328136397907052	state	state	NN	NN	press_reportage	others	informative	B	B	AB	ABC	Z	Z	Z	Z	Z	 Beyeler arranged to sell$ 1500000 worth of Klees to the <font color=green>state</font>  of North Rhine-Westphalia, which will house them in a museum	3	1	0.56	0.33	3
state/NN/br-a41/564	0.0391155119810614	0.00921315734713612	state	States	NN	NNPS	press_reportage	others	informative	A5	A	AB	ABC	Z	Z	Z	Z	Z	 companies producing agricultural products were lumped together, with the United <font color=green>States</font>  government as a heavy partner''. Had they been truly ruthless	1	0	1.11	0	5
state/NN/br-a44/262	0.0390936071545077	0.0237836475428594	state	state	NN	NN	press_reportage	others	informative	A1	A	AB	ABC	Z	Z	Z	Z	Z	 of state governments, whereby, with the financial help of the <font color=green>state</font> , libraries share their book resources on a county-wide or regional	6	4	1.23	0.67	6
state/NN/br-a44/764	0.086176890126424	0.0266012058147209	state	state	NN	NN	press_reportage	others	informative	A3	A	AB	ABC	Z	Z	Z	Z	Z	 resources of a given area for maximum efficiency. The basic <font color=green>state</font>  grant is thirty cents for each person served, and there	2	1	1.03	0.5	7
state/NN/br-a44/829	0.0159399266674561	0.0601982986264481	state	state	NN	NN	press_reportage	others	informative	A1	A	AB	ABC	Z	Z	Z	Z	Z	 of New York City, the system is credited by the <font color=green>state</font>  with serving one million persons, a figure that has doubled	3	3	0.61	1	7
state/NN/br-b01/1030	0.0361595047718532	-0.134455620702253	state	state	NN	NN	press_editorial	others	informative	C	C	C	ABC	Z	Z	Z	Z	Z	 rapidly. Touring Africa, the new U. S. assistant secretary of <font color=green>state</font>  observed`` Africa should be for the Africans'' and the British	1	1	1.61	1	5
state/NN/br-b01/1195	0.134051248514548	-0.0195809585733432	state	state	NN	NN	press_editorial	others	informative	A1	A	AB	ABC	Z	Z	Z	Z	Z	 additional half-million dollars Gov. Vandiver allocated last year from the <font color=green>state</font>  surplus. Either way it sounds like a sizable hunk of	3	2	0.98	0.67	5
state/NN/br-b01/1813	0.0130056066960299	-0.0100862085662504	state	States	NN	NNPS	press_editorial	others	informative	A5	A	AB	ABC	Z	Z	Z	Z	Z	 been cited for numerous aggressions in the Caribbean, the United <font color=green>States</font>  and many other members of the Organization of American States	1	0	1.1	0	7
state/NN/br-b01/329	-0.0299463777704542	-0.0895733017587935	state	state	NN	NN	press_editorial	others	informative	A	A	AB	ABC	Z	Z	Z	Z	Z	 past have made Georgia look like anything but`` the empire <font color=green>state</font>  of the South''. We congratulate the entire membership on its	2	2	1.07	1	3
state/NN/br-b01/614	0.142270802377869	-0.0416061122591159	state	state	NN	NN	press_editorial	others	informative	A3	A	AB	ABC	Z	Z	Z	Z	Z	 Commission. Coupling its own budget of$ 83750 with a$ 30000 <font color=green>state</font>  grant authorized by Gov. Vandiver, the group expects to sign	3	2	1.73	0.67	5
state/NN/br-b01/862	0.00150721739492419	-0.0186163570670508	state	State	NN	NNP	press_editorial	others	informative	C	C	C	ABC	Z	Z	Z	Z	Z	 American military forces to fight conventional wars too, Secretary of <font color=green>State</font>  Rusk junks bluff and nuclear brinkmanship and builds more muscle	1	1	1.24	1	7
state/NN/br-b02/2120	0.0311507720897992	-0.0320569858005982	state	state	NN	NN	press_editorial	others	informative	A1	A	AB	ABC	Z	Z	Z	Z	Z	 federal funds. This year 's Senate measure would provide each <font color=green>state</font>  and the District of Columbia with$ 1000000 to be used	3	3	1.75	1	7
state/NN/br-b02/901	0.0418906096525616	0.0263685032269568	state	state	NN	NN	press_editorial	others	informative	A3	A	AB	ABC	Z	Z	Z	Z	Z	 specific prohibition. Why, then, with these voluntary barricades and some <font color=green>state</font>  laws barring liquor ads, is it necessary to seek congressional	3	1	1	0.33	6
state/NN/br-b04/1971	0.0143629907654354	0.0141252899304808	state	state	NN	NN	press_editorial	others	informative	A4	A	AB	ABC	Z	Z	Z	Z	Z	 commissions, boards and councils and other public agencies in this <font color=green>state</font>  exist to aid in the conduct of the people 's	5	3	0.83	0.6	10
state/NN/br-b04/2010	0.0203340053389975	0.0272145389922548	state	state	NN	NN	press_editorial	others	informative	A4	A	AB	ABC	Z	Z	Z	Z	Z	 that their deliberations be conducted openly.`` The people of this <font color=green>state</font>  do not yield their sovereignty to the agencies that serve	3	2	0.9	0.67	8
state/NN/br-b04/715	0.0341626263495642	-0.0229910114726635	state	state	NN	NN	press_editorial	others	informative	A3	A	AB	ABC	Z	Z	Z	Z	Z	 happened in this field during the past 12 months. Each <font color=green>state</font>  advisory committee documented its own activity. Some accounts are quite	3	1	0.52	0.33	6
state/NN/br-b04/830	0.039738035910226	0.0281991857833643	state	state	NN	NN	press_editorial	others	informative	A3	A	AB	ABC	Z	Z	Z	Z	Z	 progressed in a sound and equitable program at both the <font color=green>state</font>  and local levels in its efforts to review and assess	3	3	1.25	1	7
state/NN/br-b05/1334	-0.116574961657909	-0.104757390964914	state	state	NN	NN	press_editorial	others	informative	C	C	C	ABC	Z	Z	Z	Z	Z	 secretary 's neck may be spared. Cambodia 's chief of <font color=green>state</font> , who has been accused of harboring Communist marauders and otherwise	1	1	1	1	6
state/NN/br-b05/142	-0.00608370005827741	-0.0319614111689087	state	States	NN	NNPS	press_editorial	others	informative	B	B	AB	ABC	Z	Z	Z	Z	Z	 responsive to Castro in Cuba. Within the Organization of American <font color=green>States</font> , there may be some criticism of this unilateral American intervention	4	3	1.15	0.75	6
state/NN/br-b05/2071	0.0111587710854407	-0.0166657704579288	state	state	NN	NN	press_editorial	others	informative	A1	A	AB	ABC	Z	Z	Z	Z	Z	 has tagged the sanctuary as the kind of place the <font color=green>state</font>  hopes to include in its program to double its park	3	2	0.64	0.67	6
state/NN/br-b06/2054	-0.00489328172703384	0.000382141241263938	state	States	NN	NNPS	press_editorial	others	informative	A5	A	AB	ABC	Z	Z	Z	Z	Z	 that President Ngo Dinh Diem apparently does not want United <font color=green>States</font>  troops. He may want additional technical help, and this should	1	0	0.79	0	5
state/NN/br-b06/2079	0.117850202198381	-0.016654153153556	state	States	NN	NNPS	press_editorial	others	informative	A5	A	AB	ABC	Z	Z	Z	Z	Z	 be forthcoming. South Viet Nam has received$ 1450000000 in United <font color=green>States</font>  aid since 1954 and the rate of assistance has been	1	0	1.16	0	9
state/NN/br-b07/452	-0.206153666357734	0.123690825276786	state	States	NN	NNPS	press_editorial	others	informative	A5	A	AB	ABC	Z	Z	Z	Z	Z	 instructions. This is the root issue for which the United <font color=green>States</font>  should stand. We should not become confused or let our	1	0	1.17	0	3
state/NN/br-b11/1043	0.00188100468188405	0.107571776322368	state	States	NN	NNPS	press_editorial	others	informative	A5	A	AB	ABC	Z	Z	Z	Z	Z	 played up artificially because it is needed by the United <font color=green>States</font>  to justify its arms drive''. The Soviet news agency TASS	1	0	0.92	0	4
state/NN/br-b11/1246	0.0238981805561522	0.0195704040128561	state	States	NN	NNPS	press_editorial	others	informative	A5	A	AB	ABC	Z	Z	Z	Z	Z	 the most vital domestic and foreign problems confronting the United <font color=green>States</font> . In fact, the world heard nothing but sabre-rattling, the same	1	0	0.63	0	7
state/NN/br-b11/1370	0.0469518727749986	0.108114839611626	state	States	NN	NNPS	press_editorial	others	informative	A5	A	AB	ABC	Z	Z	Z	Z	Z	 U. S. President has shown once again that the United <font color=green>States</font>  needs the fanning of the West Berlin crisis to justify	1	0	0.78	0	4
state/NN/br-b11/177	0.0679211332581248	-0.0512537710184484	state	state	NN	NN	press_editorial	others	informative	A	A	AB	ABC	Z	Z	Z	Z	Z	 for a whole series of lesser candidate-picking conventions in the <font color=green>state</font>  's 38 new Congressional districts. At the head of the	4	1	1.79	0.25	4
state/NN/br-b11/910	-0.0473696233971998	0.00414429993589021	state	States	NN	NNPS	press_editorial	others	informative	A5	A	AB	ABC	Z	Z	Z	Z	Z	 's latest warning to the Communist world that the United <font color=green>States</font>  will build up its military strength to meet any challenge	1	0	0.82	0	7
state/NN/br-b12/673	0.0318906419616641	-0.0727653313569737	state	States	NN	NNPS	press_editorial	others	informative	A5	A	AB	ABC	Z	Z	Z	Z	Z	 man who was instrumental in opening relations between the United <font color=green>States</font>  and Korea, Frederick T. Frelinghuysen, secretary of state in the	1	0	2.19	0	5
state/NN/br-b12/683	0.0232012106558411	-0.0571981414475766	state	state	NN	NN	press_editorial	others	informative	C	C	C	ABC	Z	Z	Z	Z	Z	 the United States and Korea, Frederick T. Frelinghuysen, secretary of <font color=green>state</font>  in the administration of Chester A. Arthur. In addition Rep.	2	2	1.73	1	9
state/NN/br-b12/706	0.0299935371126423	-0.0304995285822743	state	State	NN	NNP	press_editorial	others	informative	C	C	C	ABC	Z	Z	Z	Z	Z	 's brother Harry was on the Korean desk of the <font color=green>State</font>  Department in World War 2,. Next year is the 80	1	1	0.78	1	6
state/NN/br-b12/751	0.0283248599844339	-0.180417287729173	state	state	NN	NN	press_editorial	others	informative	C	C	C	ABC	Z	Z	Z	Z	Z	 find the correspondence between Frederick Frelinghuysen, who was secretary of <font color=green>state</font>  in 1883 and 1884, and Gen. Lucius Foote, who was	1	1	2.42	1	3
state/NN/br-b14/2011	-0.00688709748731662	-0.170267588961985	state	state	NN	NN	press_editorial	others	informative	A4	A	AB	ABC	Z	Z	Z	Z	Z	 such a good one. Why not have them travel the <font color=green>state</font>  in November debating? It would present a forum for them	3	1	0.88	0.33	2
state/NN/br-b16/1030	0.0115885478818497	-0.0927521588252266	state	state	NN	NN	press_editorial	others	informative	A3	A	AB	ABC	Z	Z	Z	Z	Z	 a member for more than 40 years, on the recent <font color=green>state</font>  convention. I regret that Bertha Madeira[ today 's`` Voice''] obtained	1	0	1.22	0	4
state/NN/br-b18/1111	0.0301795622004203	0.0326353728415387	state	States	NN	NNPS	press_editorial	others	informative	A5	A	AB	ABC	Z	Z	Z	Z	Z	 the Connally amendment- an act which could expose the United <font color=green>States</font>  to no practical risk yet would put an end to	1	0	1.25	0	5
state/NN/br-b18/35	0.00844273677315422	0.0708446167202301	state	States	NN	NNPS	press_editorial	others	informative	A5	A	AB	ABC	Z	Z	Z	Z	Z	 make conventional warfare of the past a nullity. The United <font color=green>States</font>  and Soviet Russia have enough nuclear weapons to destroy all	1	0	1.06	0	8
state/NN/br-b18/898	0.0445310900286365	-0.0273237117228395	state	States	NN	NNPS	press_editorial	others	informative	A5	A	AB	ABC	Z	Z	Z	Z	Z	 Court of Justice. The Connally amendment says that the United <font color=green>States</font> , rather than the court, shall determine whether a matter is	1	0	1.54	0	6
state/NN/br-b18/919	0.0713396305137773	0.00146705807305516	state	States	NN	NNPS	press_editorial	others	informative	A5	A	AB	ABC	Z	Z	Z	Z	Z	 matter is essentially within the domestic jurisdiction of the United <font color=green>States</font>  in a case before the World Court to which the	1	0	1.22	0	7
state/NN/br-b18/931	0.0412579599241277	-0.0193423899497202	state	States	NN	NNPS	press_editorial	others	informative	A5	A	AB	ABC	Z	Z	Z	Z	Z	 a case before the World Court to which the United <font color=green>States</font>  is a party. If the case is thus determined by	1	0	0.78	0	7
state/NN/br-b18/976	0.0342024026294922	-0.042086815480484	state	States	NN	NNPS	press_editorial	others	informative	A5	A	AB	ABC	Z	Z	Z	Z	Z	 to the other party to a dispute with the United <font color=green>States</font> , it also prevents us from using the court effectively. Yet	1	0	0.62	0	6
state/NN/br-b20/1056	0.0466397544477608	-0.0515254217934796	state	State	NN	NNP	press_editorial	others	informative	C	C	C	ABC	state_department%1:14:00::	C1	C	C	ABC	 which will bring down the wall and reunite the city. <font color=green>State</font>  Department officials refusing to show their passes at the boundary	2	2	1.18	1	5
state/NN/br-b20/64	0.0684464442886322	0.179165574345574	state	States	NN	NNPS	press_editorial	others	informative	A5	A	AB	ABC	united_states%1:14:00::	A52	A	AB	ABC	 what we are getting. The biggest nuclear device the United <font color=green>States</font>  has exploded measured some 15 megatons, although our B-52s are	1	0	0.78	0	6
state/NN/br-b21/308	-0.0401424532443168	-0.0698451240419806	state	state	NN	NN	press_editorial	others	informative	A2	A	AB	ABC	Z	Z	Z	Z	Z	 butchery be the signal for the arrest of the 50 <font color=green>state</font>  highway commissioners. Then let the whole lot be hanged in	2	2	0.92	1	7
state/NN/br-b22/213	0.059098785790961	0.0822491947145345	state	States	NN	NNPS	press_editorial	others	informative	A5	A	AB	ABC	Z	Z	Z	Z	Z	 would prove viable has been shaken. Once again, the United <font color=green>States</font>  must choose. And once again, the choices are much the	1	0	0.31	0	2
state/NN/br-b22/537	0.0433309497459769	0.118062359388654	state	States	NN	NNPS	press_editorial	others	informative	A5	A	AB	ABC	Z	Z	Z	Z	Z	 world opinion, he argued that the responsibility of the United <font color=green>States</font>  is`` to do, confidently and firmly, not what is popular	1	0	1.18	0	3
state/NN/br-b22/97	-0.0697220401387298	-0.523234868940039	state	States	NN	NNPS	press_editorial	others	informative	A5	A	AB	ABC	Z	Z	Z	Z	Z	 obvious- during the mid to late' 50 's- the United <font color=green>States</font>  appeared to have three choices. It could have unilaterally abandoned	1	0	0.77	0	2
state/NN/br-b23/1014	-0.0182998176516697	0.0117157163161164	state	state	NN	NN	press_editorial	others	informative	B	B	AB	ABC	Z	Z	Z	Z	Z	 has historically served China as a buffer state. A friendly <font color=green>state</font> , sometimes only semi-independent, but never hostile. China never tried to	4	2	1.56	0.5	6
state/NN/br-b25/1008	-0.0259261126248218	0.0942251945583343	state	state	NN	NN	press_editorial	others	informative	D	D	D	D	Z	Z	Z	Z	Z	 line of peaceful coexistence, reducing this concept merely to the <font color=green>state</font>  of peace or rather, the absence of war at a	3	2	0.92	0.67	4
state/NN/br-b25/593	0.0734331297588953	0.00425852579205541	state	state	NN	NN	press_editorial	others	informative	C	C	C	ABC	Z	Z	Z	Z	Z	 other'' 50 per cent of the nation from that`` welfare <font color=green>state</font> '' which the Soviet Union so greatly prides itself on being	4	2	1.22	0.5	6
state/NN/br-b26/846	0.0506592347542528	0.0746616883062872	state	States	NN	NNPS	press_editorial	others	informative	A5	A	AB	ABC	Z	Z	Z	Z	Z	 to this dilemma is not the incorporation of the United <font color=green>States</font>  into an Atlantic Community or`` economic empire'', but merely what	1	0	1.12	0	3
state/NN/br-b27/1479	-0.00928490634011801	-0.257216952616306	state	States	NN	NNPS	press_editorial	others	informative	A5	A	AB	ABC	Z	Z	Z	Z	Z	 and its teaching. Four of us here in the United <font color=green>States</font>  attended, first as students, then as instructors, almost every one	1	0	0.54	0	2
state/NN/br-b27/1505	-0.0148660522413789	-0.025151867915813	state	States	NN	NNPS	press_editorial	others	informative	A5	A	AB	ABC	Z	Z	Z	Z	Z	 one of these schools, in England, Canada, and the United <font color=green>States</font> . We set up the Lloyd 's Neck school, worked out	1	0	1.26	0	7
state/NN/br-c01/1164	-0.00412515888650299	0.0152817640082561	state	state	NN	NN	press_reviews	others	informative	C	C	C	ABC	welfare_state%1:14:00::	B	B	AB	ABC	 we should take from these pages is that the welfare <font color=green>state</font>  in England still allows wild scope for all kinds of	1	1	1.26	1	7
state/NN/br-c03/237	-0.0709581057039751	-0.202768659760513	state	States	NN	NNPS	press_reviews	others	informative	A5	A	AB	ABC	Z	Z	Z	Z	Z	 Bella Bella'', by Robert Fleming, was given its first United <font color=green>States</font>  performance. The title refers to the nickname given his wife	1	0	1.02	0	2
state/NN/br-c06/257	0.0313217348860932	-0.0273911577036113	state	State	NN	NNP	press_reviews	others	informative	C	C	C	ABC	Z	Z	Z	Z	Z	 subsequently convicted of perjury in denying that he gave secret <font color=green>State</font>  Department documents to Soviet agents, was at Yalta. And Harry	2	1	1.33	0.5	6
state/NN/br-c12/91	-0.13640177913168	0.122525004726337	state	States	NN	NNPS	press_reviews	others	informative	A5	A	AB	ABC	Z	Z	Z	Z	Z	 partly at Negro listeners- an audience which, in the United <font color=green>States</font> , comprises some 19000000 people with$ 20000000000 to spend each year	1	0	1.3	0	3
state/NN/br-c16/1216	0.0162653150209136	0.0275919551569235	state	state	NN	NN	press_reviews	others	informative	C	C	C	ABC	Z	Z	Z	Z	Z	 Government devoted its attention to the creation of a welfare <font color=green>state</font> . With Britain looking inward, overseas problems were neglected and the	4	3	1.47	0.75	7
state/NN/br-c16/1236	-0.0992338355193848	0.136742140191723	state	States	NN	NNPS	press_reviews	others	informative	A5	A	AB	ABC	Z	Z	Z	Z	Z	 neglected and the baton was passed on to the United <font color=green>States</font> . Montgomery believes that she started well.`` America gave generously in	2	1	1.07	0.5	5
state/NN/br-c16/1508	-0.0622462275012527	0.0246785908165482	state	States	NN	NNPS	press_reviews	others	informative	A5	A	AB	ABC	Z	Z	Z	Z	Z	 As faulty as has been our leadership clearly the United <font color=green>States</font>  must be relied upon to lead. The path to leadership	1	0	0.88	0	6
state/NN/br-d03/319	-0.159702002206732	-0.0749500353267784	state	state	NN	NN	religion	others	informative	D	D	D	D	state%1:03:00::	D1	D	D	D	 the Roman and Anglican Churches and about the present religious <font color=green>state</font>  of England. Since the Protestant clergy for the most part	2	0	0.56	0	5
state/NN/br-d04/1145	-0.0433714789175101	0.0300790734229628	state	state	NN	NN	religion	others	informative	D	D	D	D	state%1:03:00::	D1	D	D	D	 and the whole human race''. Because he interprets the primitive <font color=green>state</font>  of man as one of mere potentiality or capacity and	3	1	0.87	0.33	5
state/NN/br-d04/1599	-0.16038521735862	-0.0931497608339633	state	state	NN	NN	religion	others	informative	D	D	D	D	state%1:03:00::	D1	D	D	D	 interminable and irremediable. But He set a bound to his[ <font color=green>state</font>  of] sin, by interposing death, and thus causing sin to	3	1	0.53	0.33	3
state/NN/br-d04/2174	-0.0660824809343426	0.0954503346829211	state	state	NN	NN	religion	others	informative	D	D	D	D	state%1:03:00::	D1	D	D	D	 existence itself is a form of punishment rather than the <font color=green>state</font>  into which man is put by the will of the	3	1	0.95	0.33	4
state/NN/br-d07/925	0.0818093581222198	-0.073873582125334	state	States	NN	NNPS	religion	others	informative	A5	A	AB	ABC	Z	Z	Z	Z	Z	 the same effect on Communists. The President of the United <font color=green>States</font>  has said:`` We will never negotiate out of fear, and	1	0	1.01	0	4
state/NN/br-d10/1157	0.125874057414129	-0.094745731617224	state	state	NN	NN	religion	others	informative	B	B	AB	ABC	Z	Z	Z	Z	Z	 many Buddhists argue that Buddhism ought to be the official <font color=green>state</font>  religion. In 1960 Ceylon nationalized its sectarian- preponderantly Christian- schools	4	1	1.52	0.25	2
state/NN/br-d10/1528	-0.0783136663726633	0.164932499060342	state	state	NN	NN	religion	others	informative	A1	A	AB	ABC	Z	Z	Z	Z	Z	 by progressive disaffection with claims to divine sanction for the <font color=green>state</font> , whatever its political form. The American Constitution was historic at	4	1	1.15	0.25	3
state/NN/br-d13/292	-0.280032568013406	-0.137625288348337	state	State	NN	NNP	religion	others	informative	A5	A	AB	ABC	Z	Z	Z	Z	Z	 is enough TNT to fill the tower of the Empire <font color=green>State</font>  Building; and with the availability of bombs of that size	2	0	1.15	0	2
state/NN/br-d13/950	-0.418867675689094	-0.073584343451657	state	state	NN	NN	religion	others	informative	A4	A	AB	ABC	Z	Z	Z	Z	Z	 snowing snow, it snows peas; so we get the whole <font color=green>state</font>  covered with peas, about four feet deep. You can imagine	2	2	1.19	1	4
state/NN/br-d14/13	-0.0589847464914627	0.0383149890030072	state	States	NN	NNPS	religion	others	informative	A5	A	AB	ABC	Z	Z	Z	Z	Z	 extent and in what ways did Christianity affect the United <font color=green>States</font>  of America in the nineteenth century? How far and in	1	0	0.74	0	5
state/NN/br-d14/853	-0.33437115306022	0.163268582242713	state	States	NN	NNPS	religion	others	informative	A5	A	AB	ABC	Z	Z	Z	Z	Z	 on the Evangelical revivals. The great seal of the United <font color=green>States</font>  was obviously inspired by the Christian faith. Here was what	1	0	0.82	0	3
state/NN/br-d15/1409	-0.131892645913676	0.161177175252918	state	state	NN	NN	religion	others	informative	D	D	D	D	Z	Z	Z	Z	Z	 words, or any other manifestations that belong to the normal <font color=green>state</font>  of consciousness are considered only the surface of experience. The	4	1	1.01	0.25	3
state/NN/br-e02/1595	0.308082289350932	-0.0511338564865292	state	States	NN	NNPS	skill_and_hobbies	tech	informative	A5	A	AB	ABC	united_states%1:15:00::	A51	A	AB	ABC	 made it possible to ship avocado anywhere in the United <font color=green>States</font> . It has a great many assets to recommend it and	1	0	1.01	0	4
state/NN/br-e06/115	-0.273887907796208	-0.101815520617426	state	state	NN	NN	skill_and_hobbies	tech	informative	A4	A	AB	ABC	Z	Z	Z	Z	Z	 from sea to shining sea. Boats are operated in every <font color=green>state</font>  in the Union, with the heaviest concentrations along both coasts	3	0	0.63	0	4
state/NN/br-e06/1425	0.0267387925637593	0.115711478404028	state	state	NN	NN	skill_and_hobbies	tech	informative	A	A	AB	ABC	Z	Z	Z	Z	Z	 restriction on boating. Laws on boating vary according to the <font color=green>state</font>  in which the craft is to be used and according	3	1	1.36	0.33	10
