id	model.x	model.y	lemma	wf	pos	newPos	genre	broadGenre	newBroadGenre	marisense	mbroad	mari3	mari2	sensekey	wnsense	wnbroad	wn3	wn2	text	cues	cuesWithWeight	meanWeight	weightedCuesRatio	weightedCW
state/NN/br-e06/1446	0.0957757861727537	0.189942999936147	state	state	NN	NN	skill_and_hobbies	tech	informative	A4	A	AB	ABC	Z	Z	Z	Z	Z	 according to its horsepower. What may be acceptable in one <font color=green>state</font>  may be strictly prohibited across the boundary line. The main	4	2	1.31	0.5	3
state/NN/br-e06/1473	0.161998577505395	0.148171511384986	state	state	NN	NN	skill_and_hobbies	tech	informative	A	A	AB	ABC	Z	Z	Z	Z	Z	 the boat is numbered according to the regulations of the <font color=green>state</font>  in which the boat will be principally used. If your	2	2	1.1	1	6
state/NN/br-e06/38	-0.0393549746352544	0.220472353183073	state	States	NN	NNPS	skill_and_hobbies	tech	informative	A5	A	AB	ABC	Z	Z	Z	Z	Z	 the sole concern of fishermen, rich people, and the United <font color=green>States</font>  Navy. Today the recreational boating scene is awash with heartening	1	0	1.41	0	3
state/NN/br-e12/2292	0.0613486672433117	0.117694648892009	state	States	NN	NNPS	skill_and_hobbies	tech	informative	A5	A	AB	ABC	Z	Z	Z	Z	Z	 Grand Canyon, probably the most famous landmark of the United <font color=green>States</font> , can be the highpoint of your Western vacation.	1	0	0.31	0	3
state/NN/br-e12/750	-0.0967683455572853	-0.116331952583845	state	States	NN	NNPS	skill_and_hobbies	tech	informative	A5	A	AB	ABC	Z	Z	Z	Z	Z	 f will do for bright, frontal sunlight. The Southern United <font color=green>States</font> , extending from Florida in the east to Texas in the	1	0	0.93	0	5
state/NN/br-e12/887	-0.0440860614215732	-0.0369948941927674	state	States	NN	NNPS	skill_and_hobbies	tech	informative	A5	A	AB	ABC	Z	Z	Z	Z	Z	 Fredericksburg, Virginia. Florida provides tropical scenes unequalled in the United <font color=green>States</font> . At Cypress Gardens special bleachers are set up for photographers	1	0	1.12	0	6
state/NN/br-e15/1831	-0.0573964101527249	-0.0378365543102702	state	state	NN	NN	skill_and_hobbies	tech	informative	D	D	D	D	Z	Z	Z	Z	Z	 cut pieces on plaster board to dry to firm leather-hard <font color=green>state</font> . Score side edges of base; join sides and base with	2	1	0.77	0.5	8
state/NN/br-e31/250	-0.157126599716182	0.103437260502072	state	states	NN	NNS	skill_and_hobbies	tech	informative	A4	A	AB	ABC	state%1:15:01::	A	A	AB	ABC	 game bags are possible and legal in more than 40 <font color=green>states</font> , on shooting preserves( one of the newer phases of modern	3	1	0.54	0.33	4
state/NN/br-f03/1319	-0.101711628309622	0.120072414076544	state	states	NN	NNS	popular_lore	others	informative	D	D	D	D	state_of_matter%1:26:00::	D2	D	D	D	 the coexistence of the infinite number of universal, apparently momentary <font color=green>states</font>  of matter, successive one after another in consciousness, but permanent	2	1	0.64	0.5	7
state/NN/br-f04/1144	-0.037897865544961	0.101658784233299	state	state	NN	NN	popular_lore	others	informative	A4	A	AB	ABC	Z	Z	Z	Z	Z	 metal cans of grains ordered from organic farms in the <font color=green>state</font> . Miss Colman pours measures of whole wheat, oats, and soy	2	1	0.85	0.5	6
state/NN/br-f05/162	-0.0633769093450994	-0.13741955969691	state	States	NN	NNPS	popular_lore	others	informative	A5	A	AB	ABC	Z	Z	Z	Z	Z	 little plane was its sole replacement in carrying the United <font color=green>States</font>  mails. Rain of near cloudburst proportions had fallen for three	1	0	1.37	0	4
state/NN/br-f05/242	-0.0564470710096555	-0.0650925604635887	state	state	NN	NN	popular_lore	others	informative	A4	A	AB	ABC	Z	Z	Z	Z	Z	 had offices- and wondered how to move the mail. The <font color=green>state</font>  's railroad system counted miles of broken bridges and missing	4	3	0.93	0.75	8
state/NN/br-f05/813	-0.210283374180328	-0.165150540894178	state	state	NN	NN	popular_lore	others	informative	A4	A	AB	ABC	Z	Z	Z	Z	Z	 to a brand-new airplane, aimed at putting their city and <font color=green>state</font>  on the flying map. The ship was a Waco biplane	2	2	0.95	1	4
state/NN/br-f11/162	0.183173580708858	0.0215983825142273	state	States	NN	NNPS	popular_lore	others	informative	A5	A	AB	ABC	Z	Z	Z	Z	Z	 no special case.`` The majority of children in the United <font color=green>States</font>  could benefit by some form of orthodontic treatment'', says Dr.	1	0	1.16	0	3
state/NN/br-f12/1351	-0.186135325409055	-0.0250223880905925	state	States	NN	NNPS	popular_lore	others	informative	A5	A	AB	ABC	Z	Z	Z	Z	Z	 women are named Miranda than Elizabeth; that in the United <font color=green>States</font>  more people die of heart disease than of smallpox. So	1	0	1.06	0	4
state/NN/br-f12/2279	-0.049137542054364	0.0736108423439453	state	state	NN	NN	popular_lore	others	informative	D	D	D	D	Z	Z	Z	Z	Z	 taken with other details it could have referred to a <font color=green>state</font>  of mental or spiritual confinement. In this connection it is	3	2	0.71	0.67	8
state/NN/br-f12/263	-0.0151785587304488	-0.285112232460053	state	state	NN	NN	popular_lore	others	informative	D	D	D	D	Z	Z	Z	Z	Z	 this experiment are in a waking or only slightly dissociated <font color=green>state</font> , so that the sitter can make comments, ask and answer	3	1	0.81	0.33	4
state/NN/br-f12/338	-0.10778179422169	0.325548566712116	state	state	NN	NN	popular_lore	others	informative	D	D	D	D	Z	Z	Z	Z	Z	 to realize that the medium was describing very vividly his <font color=green>state</font>  of mind. He himself might not have been really aware	2	0	0.22	0	2
state/NN/br-f14/1775	-0.0481414790515609	0.0316365076103906	state	states	NN	NNS	popular_lore	others	informative	B	B	AB	ABC	state%1:14:00::	B1	B	AB	ABC	 own power and in destroying that of rival organizations and <font color=green>states</font> . Certainly, one of the best ways of warning the world	4	1	0.63	0.25	5
state/NN/br-f17/1627	-0.0615458558541414	-0.0568920360063483	state	States	NN	NNPS	popular_lore	others	informative	A5	A	AB	ABC	united_states%1:15:00::	A51	A	AB	ABC	 Swiss also decided to cast their lot with the United <font color=green>States</font> , and in 1823 several families paid guides to take them	1	0	1.18	0	7
state/NN/br-f17/743	-0.023864283899297	-0.0734772535327792	state	States	NN	NNPS	popular_lore	others	informative	A5	A	AB	ABC	united_states%1:15:00::	A51	A	AB	ABC	 return to the Atlantic coast by way of the United <font color=green>States</font> . In September 1817 at Fort Daer( Pembina) Dickson met the	1	0	1.3	0	4
state/NN/br-f19/1831	-0.0927264486366023	0.156787398865235	state	States	NN	NNPS	popular_lore	others	informative	A5	A	AB	ABC	united_states%1:15:00::	A51	A	AB	ABC	 of the hundred odd folklore courses given in the United <font color=green>States</font>  survive on sentiment and nationalism alone. If one wishes to	1	0	1.12	0	5
state/NN/br-f19/231	0.0320124278232532	0.0309702082738542	state	States	NN	NNPS	popular_lore	others	informative	A5	A	AB	ABC	united_states%1:15:00::	A51	A	AB	ABC	 pine, and they can be applied again to the United <font color=green>States</font>  in more recent years. The popularity of local color literature	1	0	1.11	0	5
state/NN/br-f19/373	0.00685526849487333	0.168349525671319	state	States	NN	NNPS	popular_lore	others	informative	A5	A	AB	ABC	united_states%1:15:00::	A51	A	AB	ABC	 of the major culture lags of the twentieth century United <font color=green>States</font> . Yet nationalism has lost few of its charms for the	1	0	0.89	0	4
state/NN/br-f19/619	-0.132426888587662	0.049343318627495	state	States	NN	NNPS	popular_lore	others	informative	A	A	AB	ABC	state%1:15:01::	A	A	AB	ABC	 symbol of honesty and the father image of the uniting <font color=green>States</font> . Abraham Lincoln emerged as an incarnation of the national Constitution	4	3	0.94	0.75	5
state/NN/br-f23/1705	-0.0378850393066206	0.0701068579372443	state	States	NN	NNPS	popular_lore	others	informative	A5	A	AB	ABC	united_states%1:15:00::	A51	A	AB	ABC	 isolation and capture, not of Ghana, but of the United <font color=green>States</font> - and this purpose may be served very well by countries	1	0	0.9	0	2
state/NN/br-f23/773	0.0224515494278766	0.0416720256946055	state	States	NN	NNPS	popular_lore	others	informative	A5	A	AB	ABC	united_states%1:15:00::	A51	A	AB	ABC	 over-all American strength with over-all Soviet strength finds the United <font color=green>States</font>  not only superior, but so superior both in present weapons	1	0	1.1	0	8
state/NN/br-f24/525	-0.00618157022516936	-0.0893797160565527	state	state	NN	NN	popular_lore	others	informative	D	D	D	D	state%1:03:00::	D1	D	D	D	 11, 1960). And now, in March, all Laos suffered a <font color=green>state</font>  of siege. The Pathet Lao forces held two northern provinces	1	0	1.3	0	4
state/NN/br-f33/1948	-0.375052889275884	0.0205169888875695	state	States	NN	NNPS	popular_lore	others	informative	A5	A	AB	ABC	united_states%1:15:00::	A51	A	AB	ABC	 get in. In a far distant part of the United <font color=green>States</font> , I was talking to an instructor about a boy who	1	0	0.63	0	2
state/NN/br-g01/1187	0.302955881975744	0.134235941046495	state	states	NN	NNS	belles_lettres	others	informative	A	A	AB	ABC	state%1:15:01::	A	A	AB	ABC	 traditional way of life persists much more in the older <font color=green>states</font>  than in the new ones. Probably a larger percentage of	5	0	1.34	0	2
state/NN/br-g01/1429	0.0343988642250144	-0.276285603326264	state	states	NN	NNS	belles_lettres	others	informative	A	A	AB	ABC	state%1:15:01::	A	A	AB	ABC	 by the mother country. And no doubt many people in <font color=green>states</font>  like the Carolinas and Georgia, which were among the most	3	1	0.51	0.33	3
state/NN/br-g01/1849	-0.0326323162722417	-0.0367704464237057	state	States	NN	NNPS	belles_lettres	others	informative	A5	A	AB	ABC	united_states%1:14:00::	A52	A	AB	ABC	 both hot and cold. In every war of the United <font color=green>States</font>  since the Civil War the South was more belligerent than	1	0	0.9	0	5
state/NN/br-g01/26	0.0546119608673087	0.0360992259277043	state	state	NN	NN	belles_lettres	others	informative	C	C	C	ABC	welfare_state%1:14:00::	B	B	AB	ABC	 also led the nation in the direction of a welfare <font color=green>state</font> . And both in their objectives of non-discrimination and of social	4	3	1.03	0.75	6
state/NN/br-g01/574	-0.190364357555381	-0.198523558108298	state	states	NN	NNS	belles_lettres	others	informative	A	A	AB	ABC	state%1:15:01::	A	A	AB	ABC	 And if he is so scornful of the rights of <font color=green>states</font> , why not advocate a different sort of constitution that he	3	1	0.47	0.33	1
state/NN/br-g02/1005	0.0251713352348983	0.00941686626898373	state	state	NN	NN	belles_lettres	others	informative	A	A	AB	ABC	Z	Z	Z	Z	Z	 national responsibility for local economic distress won out over a`` <font color=green>state</font>  's- responsibility'' proposal- provision was made for payment for unemployment	4	4	1.41	1	7
state/NN/br-g02/1335	0.0249191614674262	0.032803811169359	state	states	NN	NNS	belles_lettres	others	informative	C	C	C	ABC	Z	Z	Z	Z	Z	 better or for worse, we all now live in welfare <font color=green>states</font> , the organizing principle of which is collective responsibility for individual	4	4	1.48	1	6
state/NN/br-g02/253	0.0230420932953592	0.0623179868423142	state	state	NN	NN	belles_lettres	others	informative	B	B	AB	ABC	Z	Z	Z	Z	Z	 was paid by statesman or scholar to an idea of <font color=green>state</font>  responsibility, either internally or externally. This was particularly true in	2	2	1.11	1	5
state/NN/br-g02/411	0.0401127018058888	0.0533619187693839	state	state	NN	NN	belles_lettres	others	informative	C	C	C	ABC	Z	Z	Z	Z	Z	 existed for the welfare of the people within the territorial <font color=green>state</font>  was strongly resisted. Social Darwinism was able to stave off	4	2	1.26	0.5	7
state/NN/br-g02/681	0.0643332546120363	0.0561037344363074	state	state	NN	NN	belles_lettres	others	informative	C	C	C	ABC	Z	Z	Z	Z	Z	 the many facets of the American version of the welfare <font color=green>state</font>  have become part of the conventional wisdom. A national consensus	3	2	1.02	0.67	5
state/NN/br-g03/817	0.0336117103917401	0.0111629709049667	state	States	NN	NNPS	belles_lettres	others	informative	A5	A	AB	ABC	Z	Z	Z	Z	Z	 sweeping defense policy reappraisal by the Kennedy Administration, basic United <font color=green>States</font>  strategy has been modified- and large new sums allocated- to	1	0	0.85	0	8
state/NN/br-g03/875	-0.0489327172411162	-0.0241944232525534	state	States	NN	NNPS	belles_lettres	others	informative	A5	A	AB	ABC	Z	Z	Z	Z	Z	 Soviet missiles shortly after they are launched against the United <font color=green>States</font> . BMEWS intelligence is simultaneously flashed to NORAD( North American Air	1	0	1.01	0	8
state/NN/br-g06/1295	-0.110610430245278	-0.107809137172556	state	States	NN	NNPS	belles_lettres	others	informative	A5	A	AB	ABC	Z	Z	Z	Z	Z	 in Munich and Cologne.`` Then I return to the United <font color=green>States</font>  for engagements at the Hollywood Bowl and in Philadelphia'', he	1	0	0.86	0	4
state/NN/br-g07/2238	-0.0234557399503571	-0.0413745103603447	state	state	NN	NN	belles_lettres	others	informative	A	A	AB	ABC	Z	Z	Z	Z	Z	 in 1832, the South Carolina nullifiers adopted the principle of <font color=green>state</font>  interposition which Madison had advanced in his old Virginia Resolve	4	2	1.63	0.5	7
state/NN/br-g07/546	0.0115158670374709	0.000291745380407418	state	state	NN	NN	belles_lettres	others	informative	A3	A	AB	ABC	Z	Z	Z	Z	Z	 France and the peace that ended the war, headed the <font color=green>state</font>  government of Pennsylvania, and exercised an important moderating influence at	2	2	1.13	1	6
state/NN/br-g07/853	0.0084423058836431	-0.0796886424181738	state	State	NN	NNP	belles_lettres	others	informative	C	C	C	ABC	Z	Z	Z	Z	Z	 party in American history, and, as Jefferson 's Secretary of <font color=green>State</font>  and his successor in the Presidency, guided the nation through	1	1	1.39	1	5
state/NN/br-g10/1145	-0.0296974407333548	0.0646027500592034	state	States	NN	NNPS	belles_lettres	others	informative	A5	A	AB	ABC	Z	Z	Z	Z	Z	 Posterity, do ordain and establish this Constitution for the United <font color=green>States</font>  of America''.`` We the people of the Confederate States, each	1	0	1.11	0	3
state/NN/br-g10/1160	-0.0582747840084921	0.142649625108018	state	state	NN	NN	belles_lettres	others	informative	A1	A	AB	ABC	Z	Z	Z	Z	Z	 of America''.`` We the people of the Confederate States, each <font color=green>state</font>  acting in its sovereign and independent character, in order to	4	3	1.45	0.75	5
state/NN/br-g10/1216	-0.165146740517151	-0.0423277409401609	state	States	NN	NNPS	belles_lettres	others	informative	A5	A	AB	ABC	Z	Z	Z	Z	Z	 God- do ordain and establish this Constitution for the Confederate <font color=green>States</font>  of America''. One is tempted to say that, on the	3	2	1.31	0.67	5
state/NN/br-g10/1323	-0.128455739161323	-0.00199333687489286	state	state	NN	NN	belles_lettres	others	informative	A1	A	AB	ABC	Z	Z	Z	Z	Z	 them, the same right must be conceded to each remaining <font color=green>state</font>  whenever it saw fit to secede: This would destroy the	1	1	1.55	1	6
state/NN/br-g10/1430	-0.0881336170014494	-0.0709119201631018	state	state	NN	NN	belles_lettres	others	informative	A1	A	AB	ABC	Z	Z	Z	Z	Z	 slavery, Lincoln was always willing to concede to each`` slave <font color=green>state</font> '' the right to decide independently whether to continue or end	3	2	1.1	0.67	6
state/NN/br-g10/2033	-0.00193220852872524	0.100006259033996	state	States	NN	NNPS	belles_lettres	others	informative	A5	A	AB	ABC	Z	Z	Z	Z	Z	 devotion'' to prevent disunion, preserved individual freedom in the United <font color=green>States</font>  from the dangers of anarchy, inherent in confederations, which throughout	1	0	0.8	0	6
state/NN/br-g10/310	-0.0265453166571406	0.117643056732482	state	States	NN	NNPS	belles_lettres	others	informative	A5	A	AB	ABC	Z	Z	Z	Z	Z	 down to this: The Southern States insisted that the United <font color=green>States</font>  was, in last analysis, what its name implied- a Union	1	0	0.77	0	4
state/NN/br-g10/586	-0.120623227186418	-0.093686714099642	state	States	NN	NNPS	belles_lettres	others	informative	A5	A	AB	ABC	Z	Z	Z	Z	Z	 to secede'', they formed what they officially styled`` The Confederate <font color=green>States</font>  of America''. Dictionaries, as we have seen, still cite this	2	2	1.44	1	4
state/NN/br-g10/731	0.195965241224092	-0.333123547353185	state	state	NN	NN	belles_lettres	others	informative	A1	A	AB	ABC	Z	Z	Z	Z	Z	 Constitution was that the former recognized the right of each <font color=green>state</font>  to secede. But though each of its members had asserted	3	2	1.16	0.67	3
state/NN/br-g10/773	0.117838860621861	0.025423935086341	state	state	NN	NN	belles_lettres	others	informative	A1	A	AB	ABC	Z	Z	Z	Z	Z	 month before hostilities began- included no explicit provision authorizing a <font color=green>state</font>  to secede. Its drafters discussed this vital point but left	3	3	1.63	1	6
state/NN/br-g13/1133	-0.158116215969287	-0.260838239967847	state	state	NN	NN	belles_lettres	others	informative	A4	A	AB	ABC	Z	Z	Z	Z	Z	 will destroy the shrines, temples, museums, and churches of the <font color=green>state</font>  that is the implacable enemy of the life they believe	4	1	0.19	0.25	1
state/NN/br-g13/1778	0.0999300532073525	0.10126870384074	state	state	NN	NN	belles_lettres	others	informative	A1	A	AB	ABC	Z	Z	Z	Z	Z	 do not count, for they hold the laws of the <font color=green>state</font>  null and void. They feel they are leagued against a	1	1	1.24	1	4
state/NN/br-g17/2109	0.1978732126301	-0.0933977393076159	state	States	NN	NNPS	belles_lettres	others	informative	A5	A	AB	ABC	united_states%1:15:00::	A51	A	AB	ABC	 the chief universities, colleges, and preparatory schools of the United <font color=green>States</font> . Why should this be so? It is true that New	1	0	1	0	4
state/NN/br-g17/2194	-0.00922024285550862	-0.0709028653423905	state	states	NN	NNS	belles_lettres	others	informative	A	A	AB	ABC	state%1:15:01::	A	A	AB	ABC	 country? Is n't it a bit odd that the three <font color=green>states</font>  of Southern New England( Massachusetts, Connecticut, and Rhode Island) have	4	2	1.22	0.5	7
state/NN/br-g19/545	0.20541480071872	0.0856362116382822	state	States	NN	NNPS	belles_lettres	others	informative	A5	A	AB	ABC	united_states%1:15:00::	A51	A	AB	ABC	 of the giant corporations in Western Europe and the United <font color=green>States</font>  dates from the period 1880- 1900. Now, although the roots	1	0	1.27	0	4
state/NN/br-g21/1159	-0.135287822574446	0.0170638267757754	state	States	NN	NNPS	belles_lettres	others	informative	A5	A	AB	ABC	united_states%1:14:00::	A52	A	AB	ABC	 During the next five years liberal leaders in the United <font color=green>States</font>  sank in the cumulative confusion attendant upon and manifested in	1	0	0.76	0	4
state/NN/br-g21/244	-0.0115831226456948	0.103224822584113	state	States	NN	NNPS	belles_lettres	others	informative	A5	A	AB	ABC	united_states%1:14:00::	A52	A	AB	ABC	 to be the duty of the destiny of the United <font color=green>States</font>  to assist in the creation of a better world by	1	0	1.31	0	5
state/NN/br-g21/991	-0.0329287119514303	0.153916071009984	state	State	NN	NNP	belles_lettres	others	informative	C	C	C	ABC	state%1:14:01::	B	B	AB	ABC	 the Marxist dream of a classless society under a Socialist <font color=green>State</font> . And the USSR existed as the revolutionary experiment in radical	4	1	0.48	0.25	5
state/NN/br-g22/594	0.0477861594708082	-0.0448053995433515	state	State	NN	NNP	belles_lettres	others	informative	C	C	C	ABC	state_department%1:14:00::	C1	C	C	ABC	 of`` The Soviet Cultural Offensive'', he says,`` Long before the <font color=green>State</font>  Department organized its bureaucracy into an East-West Contacts Staff in	2	1	1.29	0.5	4
state/NN/br-h02/1137	0.119504596581327	0.0358165091735021	state	States	NN	NNPS	miscellaneous	tech	informative	A5	A	AB	ABC	Z	Z	Z	Z	Z	 it is politically essential in the long run. The United <font color=green>States</font>  can use its aid as an incentive to self-help by	1	0	0.74	0	7
state/NN/br-h03/1478	-0.0623258342213881	0.0161253047166713	state	States	NN	NNPS	miscellaneous	tech	informative	A5	A	AB	ABC	Z	Z	Z	Z	Z	 years to come for this is an influence the United <font color=green>States</font>  and the whole world can ill afford to lose. All	1	0	0.73	0	6
state/NN/br-h03/1886	0.117026690641325	-0.236983838148458	state	States	NN	NNPS	miscellaneous	tech	informative	A5	A	AB	ABC	Z	Z	Z	Z	Z	 the House of Representatives in the Congress of the United <font color=green>States</font> . Others may speak of Speaker Rayburn' S uniquely long and	1	0	1.02	0	2
state/NN/br-h03/305	-0.132661897715123	0.0785879742406147	state	States	NN	NNPS	miscellaneous	tech	informative	A5	A	AB	ABC	Z	Z	Z	Z	Z	 the beloved Speaker of all the people of the United <font color=green>States</font> . For the dignity, the influence, and the power of the	1	0	1.09	0	4
state/NN/br-h04/1058	0.0941288922253243	0.0336201672673126	state	state	NN	NN	miscellaneous	tech	informative	A2	A	AB	ABC	Z	Z	Z	Z	Z	 the past twenty years the ratio of state-owned automobiles per <font color=green>state</font>  employees has varied from 1 to 22 then to 1	2	2	1.39	1	9
state/NN/br-h04/1221	0.119473534471524	0.073870418841463	state	state	NN	NN	miscellaneous	tech	informative	A1	A	AB	ABC	Z	Z	Z	Z	Z	 at war. Gasoline and automobile tires were rationed commodities. The <font color=green>state</font>  was confronted with transportation problems similar to those of the	3	3	1.13	1	5
state/NN/br-h04/127	0.0216202641240345	0.0108281377009742	state	state	NN	NN	miscellaneous	tech	informative	A2	A	AB	ABC	Z	Z	Z	Z	Z	 mile. Purchase of state vehicles is handled similarly to all <font color=green>state</font>  purchases. Unit prices to the state are considerably lower than	4	4	1.52	1	9
state/NN/br-h04/134	0.0198052574877075	0.00640161489542013	state	state	NN	NN	miscellaneous	tech	informative	A1	A	AB	ABC	Z	Z	Z	Z	Z	 handled similarly to all state purchases. Unit prices to the <font color=green>state</font>  are considerably lower than to the general public because of	5	4	1.44	0.8	7
state/NN/br-h04/1348	0.0365601827986935	-0.00705125582551675	state	state	NN	NN	miscellaneous	tech	informative	A3	A	AB	ABC	Z	Z	Z	Z	Z	 established as the central staff and auxiliary department of the <font color=green>state</font>  government. The management of state-owned vehicles since that time has	2	2	1.52	1	8
state/NN/br-h04/151	0.0425571619974688	-0.00485202327828167	state	state	NN	NN	miscellaneous	tech	informative	A3	A	AB	ABC	Z	Z	Z	Z	Z	 general public because of quantity purchases and no payment of <font color=green>state</font>  sales or federal excise taxes. The legislature 's role in	5	4	1.49	0.8	9
state/NN/br-h04/199	0.0175875095995813	0.00406922088281567	state	state	NN	NN	miscellaneous	tech	informative	A1	A	AB	ABC	Z	Z	Z	Z	Z	 and management of state vehicles have been shaped by the <font color=green>state</font>  's administrative officers. Meaningful policies include:( a) kinds of cars	3	2	1.45	0.67	10
state/NN/br-h04/2213	0.022310508826402	0.0031839944369935	state	state	NN	NN	miscellaneous	tech	informative	A2	A	AB	ABC	Z	Z	Z	Z	Z	 administrative policies governing the purchase, assignment, use, and management of <font color=green>state</font>  vehicles. The legislature 's role in policy determination in this	5	5	1.42	1	10
state/NN/br-h04/278	0.021555084828243	0.0196808302758707	state	state	NN	NN	miscellaneous	tech	informative	A1	A	AB	ABC	Z	Z	Z	Z	Z	 on state automobiles. A review of these policies indicates: The <font color=green>state</font>  purchases and assigns grades of cars according to need and	2	2	1.96	1	6
state/NN/br-h04/30	-0.00538653395541096	-0.0014053636521588	state	state	NN	NN	miscellaneous	tech	informative	A1	A	AB	ABC	Z	Z	Z	Z	Z	 least one state vehicle was in existence in 1917. The <font color=green>state</font>  presently owns 389 passenger vehicles in comparison to approximately 200	2	2	1.54	1	9
state/NN/br-h04/425	0.0593537510668276	0.00244123383202727	state	state	NN	NN	miscellaneous	tech	informative	A2	A	AB	ABC	Z	Z	Z	Z	Z	 practices. Forty-seven states assign or provide vehicles for employees on <font color=green>state</font>  business. Two other states provide vehicles, but only with legislative	4	6	1.28	1.5	10
state/NN/br-h04/528	0.136592628147296	0.022746513499751	state	state	NN	NN	miscellaneous	tech	informative	A2	A	AB	ABC	Z	Z	Z	Z	Z	 for allowances) is 13200 miles per year. Mileage allowances for <font color=green>state</font>  employees are of two types:( a) actual mileage and( b	2	3	1.55	1.5	9
state/NN/br-h04/681	0.0841474107415699	0.0455985592199121	state	state	NN	NN	miscellaneous	tech	informative	A1	A	AB	ABC	Z	Z	Z	Z	Z	 mileage allowances are well-administered and not unduly expensive for the <font color=green>state</font> . The travel regulations, requirements and procedures governing reimbursement are controlled	5	3	1.73	0.6	8
state/NN/br-h04/882	0.28697596078312	-0.0908634114005537	state	state	NN	NN	miscellaneous	tech	informative	A1	A	AB	ABC	Z	Z	Z	Z	Z	 should be enough to say that the practice of the <font color=green>state</font>  buying automobiles is at least forty years old. The best	2	2	0.88	1	5
state/NN/br-h04/901	0.0675371252172813	0.0426886102052513	state	state	NN	NN	miscellaneous	tech	informative	A1	A	AB	ABC	Z	Z	Z	Z	Z	 old. The best reason that can be advanced for the <font color=green>state</font>  adopting the practice was the advent of expanded highway construction	3	3	0.82	1	6
