id	model.x	model.y	lemma	wf	pos	newPos	genre	broadGenre	newBroadGenre	marisense	mbroad	mari3	mari2	sensekey	wnsense	wnbroad	wn3	wn2	text	cues	cuesWithWeight	meanWeight	weightedCuesRatio	weightedCW
state/NN/br-h05/1130	0.0379664244140135	0.00279301420313597	state	state	NN	NN	miscellaneous	tech	informative	A2	A	AB	ABC	Z	Z	Z	Z	Z	 centralizing all aspects of property tax administration in a single <font color=green>state</font>  agency professionally organized and equipped for the job''. The resulting	4	4	1.43	1	6
state/NN/br-h05/130	0.0675634141127524	0.0303343714011981	state	state	NN	NN	miscellaneous	tech	informative	A1	A	AB	ABC	Z	Z	Z	Z	Z	 there has come into being a situation in which the <font color=green>state</font>  must raise all of its own revenues and, in addition	2	2	0.42	1	7
state/NN/br-h05/31	0.0553088857417559	-0.00596521944753301	state	state	NN	NN	miscellaneous	tech	informative	A3	A	AB	ABC	Z	Z	Z	Z	Z	 own operations and a part of the cost of the <font color=green>state</font>  government as well. For many years a state tax on	4	3	1.16	0.75	6
state/NN/br-h05/497	0.0206270274191123	0.135227990473161	state	state	NN	NN	miscellaneous	tech	informative	A4	A	AB	ABC	Z	Z	Z	Z	Z	 taxation of all personal property, belonging to inhabitants of the <font color=green>state</font> , both tangible and intangible, and the tangible personal property of	3	2	1.43	0.67	6
state/NN/br-h05/513	0.00813489493445491	0.0569751718976691	state	state	NN	NN	miscellaneous	tech	informative	A4	A	AB	ABC	Z	Z	Z	Z	Z	 intangible, and the tangible personal property of non-residents in this <font color=green>state</font> . In defining personal property, it specifically mentions`` all ships or	2	2	0.98	1	10
state/NN/br-h05/90	0.101826420372491	-0.0163825055024963	state	state	NN	NN	miscellaneous	tech	informative	A1	A	AB	ABC	Z	Z	Z	Z	Z	 new and expanded services have placed financial burdens on the <font color=green>state</font>  which could not have been foreseen in earlier years. At	3	1	0.49	0.33	5
state/NN/br-h05/976	-0.0108642164926344	0.0307925879027934	state	state	NN	NN	miscellaneous	tech	informative	A3	A	AB	ABC	Z	Z	Z	Z	Z	 This condition will undoubtedly continue until such time as a <font color=green>state</font>  uniform system of evaluation is established, or through mutual agreement	3	3	0.7	1	9
state/NN/br-h06/1102	0.00471396888195412	0.0297672625126056	state	States	NN	NNPS	miscellaneous	tech	informative	A5	A	AB	ABC	Z	Z	Z	Z	Z	 Its purpose was to find ways of offsetting the United <font color=green>States</font> ' declining balance of trade for 1958 and 1959. Approximately 100	1	0	1.23	0	4
state/NN/br-h06/1634	-0.0074997414287825	0.0252486126076849	state	state	NN	NN	miscellaneous	tech	informative	A3	A	AB	ABC	Z	Z	Z	Z	Z	 priority will be given to the preparation of a meaningful <font color=green>state</font>  guide plan to serve as a background for all other	2	2	1.37	1	8
state/NN/br-h06/1649	0.0208929569351956	0.0150516059657753	state	state	NN	NN	miscellaneous	tech	informative	A4	A	AB	ABC	Z	Z	Z	Z	Z	 as a background for all other planning activities in the <font color=green>state</font> . Recognizing the truth of the statement by the Institute of	3	3	0.95	1	6
state/NN/br-h06/1683	0.0191386038125573	-0.00640361639106123	state	state	NN	NN	miscellaneous	tech	informative	A3	A	AB	ABC	Z	Z	Z	Z	Z	 in Rhode Island) means, or should mean, state planning'', the <font color=green>state</font>  guide plan will take into account the metropolitan nature of	3	2	1.26	0.67	9
state/NN/br-h06/1766	0.0244824411563772	0.0157353926840371	state	state	NN	NN	miscellaneous	tech	informative	A4	A	AB	ABC	Z	Z	Z	Z	Z	 cost basis, technical planning assistance to those communities in the <font color=green>state</font>  unable to maintain their own planning staff. The planning division	3	5	1.22	1.67	11
state/NN/br-h06/1798	0.0287109192836616	0.000132924007041828	state	state	NN	NN	miscellaneous	tech	informative	A1	A	AB	ABC	Z	Z	Z	Z	Z	 all levels of government; among the operating departments of the <font color=green>state</font> ; between the cities and towns of the state; and on	5	5	1.8	1	6
state/NN/br-h06/1829	0.0222207346923048	0.0135418048307114	state	state	NN	NN	miscellaneous	tech	informative	A	A	AB	ABC	Z	Z	Z	Z	Z	 England states. On the basis that all citizens of the <font color=green>state</font>  are entitled to benefit equally in the development of its	4	3	1.31	0.75	7
state/NN/br-h06/1874	0.0312839423092703	0.00487452881717541	state	state	NN	NN	miscellaneous	tech	informative	A3	A	AB	ABC	Z	Z	Z	Z	Z	 political boundaries, within the framework of the state plan. The <font color=green>state</font>  development budget will reflect the capital needs of all the	3	3	1.46	1	7
state/NN/br-h06/1901	0.0177592124021426	0.0010605485944064	state	state	NN	NN	miscellaneous	tech	informative	A3	A	AB	ABC	Z	Z	Z	Z	Z	 the projects in the budget will be based on the <font color=green>state</font>  plan. In preparing the state guide plan, particular attention will	4	5	1.62	1.25	9
state/NN/br-h06/1907	0.00142788934327973	0.0036255475934534	state	state	NN	NN	miscellaneous	tech	informative	A3	A	AB	ABC	Z	Z	Z	Z	Z	 will be based on the state plan. In preparing the <font color=green>state</font>  guide plan, particular attention will be given means of strengthening	2	3	1.34	1.5	9
state/NN/br-h06/1942	0.0207661764448933	0.000887745929109595	state	state	NN	NN	miscellaneous	tech	informative	A3	A	AB	ABC	Z	Z	Z	Z	Z	 recreation. Functionally the planning division carries out four activities: long-range <font color=green>state</font>  planning, current state planning, local planning assistance; and the preparation	2	5	1.64	2.5	12
state/NN/br-h06/870	0.0543342451509738	0.00176210514214752	state	States	NN	NNPS	miscellaneous	tech	informative	A5	A	AB	ABC	Z	Z	Z	Z	Z	 and nineteen were received from 35 of our 50 United <font color=green>States</font>  and 11 came from foreign countries. New York led in	1	0	0.68	0	4
state/NN/br-h07/1010	0.0659472998527842	-0.000112947758577942	state	state	NN	NN	miscellaneous	tech	informative	A4	A	AB	ABC	Z	Z	Z	Z	Z	 sums of money to the several local governments in this <font color=green>state</font>  as indicated below: It has been said that when local	4	4	1.1	1	8
state/NN/br-h07/1050	0.0912596145830132	-0.0134795921056014	state	state	NN	NN	miscellaneous	tech	informative	A3	A	AB	ABC	Z	Z	Z	Z	Z	 year was no great handicap; but with the growth of <font color=green>state</font>  and federal fiscal aid, the emphasis on equalization, and the	3	3	1.43	1	4
state/NN/br-h07/1285	-0.0244960932346152	0.0698575466087249	state	state	NN	NN	miscellaneous	tech	informative	A4	A	AB	ABC	Z	Z	Z	Z	Z	 city. Fortunately, there are no cities or towns in the <font color=green>state</font> , with one or two possible exceptions that are in too	2	2	1.35	1	5
state/NN/br-h07/132	0.0791045181833407	0.00349287168356983	state	state	NN	NN	miscellaneous	tech	informative	A3	A	AB	ABC	Z	Z	Z	Z	Z	 Audits. It is not an exaggeration to say that the <font color=green>state</font>  government has little or no fiscal control over these units	3	3	1.12	1	4
state/NN/br-h07/1566	-0.0154852144890247	0.0970065620797482	state	state	NN	NN	miscellaneous	tech	informative	A4	A	AB	ABC	Z	Z	Z	Z	Z	 An analysis of the fiscal-tax collection year calendars throughout the <font color=green>state</font>  indicates that transition may not be as painful as is	2	0	1.04	0	7
state/NN/br-h07/398	0.0179902783198061	-0.0622532885056235	state	state	NN	NN	miscellaneous	tech	informative	A1	A	AB	ABC	Z	Z	Z	Z	Z	 Iowa, Kentucky, Maine, Maryland, Minnesota, Virginia, and South Carolina). One <font color=green>state</font> , Alabama, closes its fiscal year on September 30, and all	8	3	1.57	0.38	8
state/NN/br-h08/1051	0.0335154135983371	-0.0313206173666933	state	state	NN	NN	miscellaneous	tech	informative	A4	A	AB	ABC	Z	Z	Z	Z	Z	 various youth, health, welfare and community betterment activities throughout the <font color=green>state</font> . Miss Sally May Saabye,( Miss Rhode Island 1960) says that	3	1	1.67	0.33	5
state/NN/br-h08/650	0.0487132603483245	-0.0511784526872964	state	States	NN	NNPS	miscellaneous	tech	informative	A5	A	AB	ABC	Z	Z	Z	Z	Z	 one hundred and eighty-sixth. Governor. The President of the United <font color=green>States</font> , pursuant to a Joint Resolution of Congress, has issued a	1	0	0.87	0	5
state/NN/br-h09/1325	0.0235010856177168	0.0131862281238652	state	States	NN	NNPS	miscellaneous	tech	informative	A5	A	AB	ABC	united_states%1:14:00::	A52	A	AB	ABC	 connection therewith shall be available without cost to the United <font color=green>States</font>  for the use of the United States throughout the world	1	0	1.04	0	7
state/NN/br-h09/1488	0.0132574876988983	-0.00243934234247072	state	State	NN	NNP	miscellaneous	tech	informative	A3	A	AB	ABC	state%1:14:01::	B	B	AB	ABC	 Congress. Upon such sale, there shall be returned to any <font color=green>State</font>  or public agency which has contributed financial assistance under section	4	4	1.16	1	9
state/NN/br-h09/1534	0.0304114389951081	-0.046184939164464	state	States	NN	NNPS	miscellaneous	tech	informative	A5	A	AB	ABC	united_states_of_america%1:15:00::	A51	A	AB	ABC	 by the Senate and House of Representatives of the United <font color=green>States</font>  of America in Congress assembled, That the Secretary of the	1	0	1.99	0	6
state/NN/br-h09/1804	0.0442026661341098	-0.137042920241116	state	State	NN	NNP	miscellaneous	tech	informative	A4	A	AB	ABC	state%1:14:01::	B	B	AB	ABC	 any place outside thereof, or between points within the same <font color=green>State</font>  but through any place outside thereof. The Secretary of the	4	2	2.32	0.5	6
state/NN/br-h09/431	-0.023787815163956	0.0215867838172357	state	States	NN	NNPS	miscellaneous	tech	informative	A5	A	AB	ABC	united_states%1:15:00::	A51	A	AB	ABC	 for beneficial consumptive purposes in various parts of the United <font color=green>States</font>  by the leading saline water processes as compared with other	1	0	0.76	0	4
state/NN/br-h09/634	0.0336221715221504	0.0408083557303527	state	States	NN	NNPS	miscellaneous	tech	informative	A5	A	AB	ABC	united_states%1:15:00::	A51	A	AB	ABC	 and, in the case of projects located in the United <font color=green>States</font> , cooperate and participate in their development in instances in which	1	0	0.89	0	7
state/NN/br-h09/704	0.0987034807455895	-0.0204526670589874	state	State	NN	NNP	miscellaneous	tech	informative	A3	A	AB	ABC	state_department%1:14:01::	C2	C	C	ABC	 projects; and cooperate with other Federal departments and agencies, with <font color=green>State</font>  and local departments, agencies, and instrumentalities, and with interested persons	4	5	2.01	1.25	7
state/NN/br-h09/832	0.0297547794201861	0.000729544024782196	state	State	NN	NNP	miscellaneous	tech	informative	C	C	C	ABC	department_of_state%1:14:00::	C1	C	C	ABC	 the Department of Health Education and Welfare, the Department of <font color=green>State</font> , and other concerned agencies shall also be carried out in	2	3	1.39	1.5	10
state/NN/br-h09/859	0.133925475336442	0.0270947697309736	state	States	NN	NNPS	miscellaneous	tech	informative	A5	A	AB	ABC	united_states%1:15:00::	A51	A	AB	ABC	 the objectives of this Act. All research within the United <font color=green>States</font>  contracted for, sponsored, cosponsored, or authorized under authority of this	1	0	1.47	0	6
state/NN/br-h12/1261	-0.0150693065938499	-0.118292509755907	state	States	NN	NNPS	miscellaneous	tech	informative	A5	A	AB	ABC	united_states%1:14:00::	A52	A	AB	ABC	 or persons found by the Comptroller General of the United <font color=green>States</font>  to be entitled thereto; if a receiver or trustee for	1	0	1.04	0	2
state/NN/br-h12/1345	0.0661247650279195	-0.0454156330533273	state	States	NN	NNPS	miscellaneous	tech	informative	A5	A	AB	ABC	united_states%1:15:00::	A51	A	AB	ABC	 appointed by a court of competent jurisdiction in the United <font color=green>States</font> , makes an assignment of the claim, or any part thereof	1	0	2.17	0	6
state/NN/br-h12/1473	0.111898343094913	-0.086545334448613	state	States	NN	NNPS	miscellaneous	tech	informative	A5	A	AB	ABC	united_states%1:14:00::	A52	A	AB	ABC	 of the Treasury, or the Comptroller General of the United <font color=green>States</font> , as the case may be, shall find that any person	1	0	1.49	0	3
state/NN/br-h12/1519	0.0229806685028511	-0.0179052064193079	state	States	NN	NNPS	miscellaneous	tech	informative	A5	A	AB	ABC	united_states%1:14:00::	A52	A	AB	ABC	 bar to recovery by any other person against the United <font color=green>States</font> , its officers, agents, or employees with respect to such payment	1	0	1.18	0	7
state/NN/br-h12/1573	0.0328688790430087	0.0852069180489022	state	States	NN	NNPS	miscellaneous	tech	informative	A5	A	AB	ABC	united_states%1:14:00::	A52	A	AB	ABC	 construed as the assumption of any liability by the United <font color=green>States</font>  for the payment or satisfaction, in whole or in part	1	0	0.92	0	5
state/NN/br-h12/1597	0.0505663027243713	-0.0128406499775092	state	States	NN	NNPS	miscellaneous	tech	informative	A5	A	AB	ABC	united_states%1:15:00::	A51	A	AB	ABC	 any claim on behalf of any national of the United <font color=green>States</font>  against any foreign government. There are hereby created in the	1	0	1.4	0	5
state/NN/br-h12/1613	0.133953731240193	-0.0430211525984782	state	States	NN	NNPS	miscellaneous	tech	informative	A5	A	AB	ABC	united_states%1:14:00::	A52	A	AB	ABC	 There are hereby created in the Treasury of the United <font color=green>States</font> ( 1) a special fund to be known as the Yugoslav	1	0	1	0	5
state/NN/br-h12/2127	0.0801977607217422	-0.0466769281892505	state	State	NN	NNP	miscellaneous	tech	informative	C	C	C	ABC	secretary_of_state%1:18:01::	C1	C	C	ABC	 of the Treasury, upon the concurrence of the Secretary of <font color=green>State</font> , is authorized and directed, out of the sum covered into	3	3	1.68	1	6
state/NN/br-h12/2215	0.0744348056678706	-0.0481268546323438	state	State	NN	NNP	miscellaneous	tech	informative	C	C	C	ABC	secretary_of_state%1:18:01::	C1	C	C	ABC	 of the Yugoslav Claims Agreement of 1948. The Secretary of <font color=green>State</font>  shall certify to the Secretary of the Treasury the total	3	4	1.98	1.33	5
state/NN/br-h12/2273	0.0749803370045382	-0.0260815589265559	state	States	NN	NNPS	miscellaneous	tech	informative	A5	A	AB	ABC	united_states%1:14:00::	A52	A	AB	ABC	 other official or department, agency, or establishment of the United <font color=green>States</font> . There is hereby authorized to be appropriated, out of any	1	0	1.59	0	6
state/NN/br-h12/298	0.0674821827657056	0.00966163662009797	state	States	NN	NNPS	miscellaneous	tech	informative	A5	A	AB	ABC	united_states%1:15:00::	A51	A	AB	ABC	 of the provisions of this subsection. Whoever, in the United <font color=green>States</font>  or elsewhere, pays or offers to pay, or promises to	1	0	1.22	0	6
state/NN/br-h12/457	0.0462249760483714	-0.00301540069242068	state	States	NN	NNPS	miscellaneous	tech	informative	A5	A	AB	ABC	united_states%1:14:00::	A52	A	AB	ABC	 of Justice as may be necessary to represent the United <font color=green>States</font>  as to any claims of the Government of the United	3	1	1.29	0.33	4
state/NN/br-h12/691	0.0330463988049855	-0.0331046129098405	state	State	NN	NNP	miscellaneous	tech	informative	C	C	C	ABC	secretary_of_state%1:18:01::	C1	C	C	ABC	 fact and not subject to review by the Secretary of <font color=green>State</font>  or any other official, department, agency, or establishment of the	3	3	1.6	1	8
state/NN/br-h12/810	0.0374210953249367	-0.0395608495149328	state	State	NN	NNP	miscellaneous	tech	informative	C	C	C	ABC	secretary_of_state%1:18:01::	C1	C	C	ABC	 the Secretary of the Treasury and to the Secretary of <font color=green>State</font>  copies of the awards made in favor of the Government	3	4	1.94	1.33	7
state/NN/br-h12/844	0.0185075457310425	-0.0453679758617154	state	State	NN	NNP	miscellaneous	tech	informative	C	C	C	ABC	secretary_of_state%1:18:01::	C1	C	C	ABC	 this Title. The Commission shall certify to the Secretary of <font color=green>State</font> , upon his request, copies of the formal submissions of claims	1	1	1.52	1	6
state/NN/br-h14/1102	0.0647961743442947	0.0201098421139266	state	States	NN	NNPS	miscellaneous	tech	informative	A	A	AB	ABC	state%1:15:01::	A	A	AB	ABC	 in effect prior to fiscal year 1962.) In all other <font color=green>States</font>  it is the difference obtained by subtracting from 100 the	1	0	1.1	0	7
state/NN/br-h14/1149	0.0115401650950389	0.0261799266502778	state	State	NN	NNP	miscellaneous	tech	informative	A	A	AB	ABC	state%1:15:01::	A	A	AB	ABC	 more than 75%. If the resulting difference for the particular <font color=green>State</font>  is less or more than these extremes, the State 's	4	2	1.39	0.5	4
state/NN/br-h14/1159	0.131720870134222	-0.000897975477580058	state	State	NN	NNP	miscellaneous	tech	informative	A	A	AB	ABC	state%1:15:01::	A	A	AB	ABC	 particular State is less or more than these extremes, the <font color=green>State</font>  's allotment percentage must be raised or lowered to the	4	2	1.94	0.5	6
state/NN/br-h14/1175	0.0709005295183063	0.0186095882558536	state	State	NN	NNP	miscellaneous	tech	informative	A	A	AB	ABC	state%1:15:01::	A	A	AB	ABC	 be raised or lowered to the appropriate extreme. Square each <font color=green>State</font>  's allotment percentage. Determine each State 's population.( See Source	4	3	1.72	0.75	9
state/NN/br-h14/1182	0.0596882047213589	0.0189083621481308	state	State	NN	NNP	miscellaneous	tech	informative	A	A	AB	ABC	state%1:15:01::	A	A	AB	ABC	 appropriate extreme. Square each State 's allotment percentage. Determine each <font color=green>State</font>  's population.( See Source of Data, below for population data	4	3	1.55	0.75	9
state/NN/br-h14/1256	-0.0371565264404054	-0.0185800516197892	state	State	NN	NNP	miscellaneous	tech	informative	A	A	AB	ABC	state%1:15:01::	A	A	AB	ABC	 in item 8 above, for all the States.( For each <font color=green>State</font> , make all computations set forth in items 1 to 8	1	1	1.48	1	5
state/NN/br-h14/1278	0.0134781911908269	0.0408635429850067	state	State	NN	NNP	miscellaneous	tech	informative	A	A	AB	ABC	state%1:15:01::	A	A	AB	ABC	 8 above, and then add the results obtained for each <font color=green>State</font>  in item 8.) Determine the ratio that the amount being	1	0	1.78	0	7
state/NN/br-h14/1302	0.049802831028284	0.0487984675674925	state	States	NN	NNPS	miscellaneous	tech	informative	A	A	AB	ABC	state%1:15:01::	A	A	AB	ABC	 is to the sum of the products for all the <font color=green>States</font> .( Divide the amount being allotted by the result obtained in	3	2	1	0.67	5
state/NN/br-h14/1389	0.21445385231997	-0.000503195666157648	state	State	NN	NNP	miscellaneous	tech	informative	A	A	AB	ABC	state%1:15:01::	A	A	AB	ABC	 so lower its unadjusted allotment to its maximum allotment.( Each <font color=green>State</font>  's unadjusted allotment for any fiscal year, which exceeds its	5	5	2.36	1	6
state/NN/br-h14/1485	0.073997008709348	0.0276918334178861	state	State	NN	NNP	miscellaneous	tech	informative	A	A	AB	ABC	state%1:15:01::	A	A	AB	ABC	 to its minimum allotment. Regardless of its unadjusted allotment, each <font color=green>State</font>  is guaranteed by law a minimum allotment each year equal	4	6	1.7	1.5	12
state/NN/br-h14/1604	0.0350746079854763	0.0105761236206557	state	States	NN	NNPS	miscellaneous	tech	informative	A	A	AB	ABC	state%1:15:01::	A	A	AB	ABC	 of any State from thereby exceeding its maximum. For the <font color=green>States</font>  which maintain two separate agencies- one for the vocational rehabilitation	3	3	1.54	1	7
state/NN/br-h14/1755	0.0977634371325661	0.0403484464373786	state	State	NN	NNP	miscellaneous	tech	informative	A	A	AB	ABC	state%1:15:01::	A	A	AB	ABC	 matched at rates related to the fiscal capacity of the <font color=green>State</font> , with a pivot of 40% State( or 60% Federal) participation	5	2	1.22	0.4	6
state/NN/br-h14/1786	0.0424859561743802	0.00372035453364326	state	State	NN	NNP	miscellaneous	tech	informative	A1	A	AB	ABC	state%1:15:01::	A	A	AB	ABC	 The percentage of Federal participation in such costs for any <font color=green>State</font>  is referred to in the law as that State 's	4	4	1.52	1	8
state/NN/br-h14/1795	0.0316805722410365	-0.00334202221802502	state	State	NN	NNP	miscellaneous	tech	informative	A	A	AB	ABC	state%1:15:01::	A	A	AB	ABC	 any State is referred to in the law as that <font color=green>State</font>  's`` Federal share''. For purposes of this explanation, this percentage	5	3	1.3	0.6	8
state/NN/br-h14/1897	0.112683489976108	-0.00968916361382556	state	State	NN	NNP	miscellaneous	tech	informative	A	A	AB	ABC	state%1:15:01::	A	A	AB	ABC	 pre 1960 rate of Federal participation with respect to any <font color=green>State</font>  's base allotment, as well as the adjusted rate in	5	4	1.34	0.8	8
state/NN/br-h14/1924	0.0799622821103644	-0.00524191910722293	state	State	NN	NNP	miscellaneous	tech	informative	A	A	AB	ABC	state%1:15:01::	A	A	AB	ABC	 1960- 1962 period, is designated by the statute as that <font color=green>State</font>  's`` adjusted Federal Share''. The provisions for determining a State	4	2	1.42	0.5	6
state/NN/br-h14/2039	0.0108429245027958	-0.0419631566129494	state	States	NN	NNPS	miscellaneous	tech	informative	A5	A	AB	ABC	united_states%1:15:00::	A51	A	AB	ABC	 the Virgin Islands, Guam and Puerto Rico; the term`` United <font color=green>States</font> '' includes the several States and the District of Columbia and	1	0	2.59	0	9
state/NN/br-h14/2143	0.170432691012698	0.0635653657404899	state	States	NN	NNPS	miscellaneous	tech	informative	A5	A	AB	ABC	united_states%1:15:00::	A51	A	AB	ABC	 above.) Determine the average per capita income for the United <font color=green>States</font>  for the last three years.( The same amount used in	1	0	1.78	0	7
state/NN/br-h14/2182	0.156279809726662	0.0450880208416489	state	States	NN	NNPS	miscellaneous	tech	informative	A5	A	AB	ABC	united_states%1:15:00::	A51	A	AB	ABC	 40% to the average per capita income of the United <font color=green>States</font> .( Divide 40 by the amount used in item 2 above	1	0	1.83	0	8
state/NN/br-h14/2236	0.116495746827208	0.0812253529340939	state	State	NN	NNP	miscellaneous	tech	informative	A	A	AB	ABC	state%1:15:01::	A	A	AB	ABC	 which bears the same ratio to 40% as the particular <font color=green>State</font>  's average per capita income bears to the average per	4	3	2.17	0.75	10
state/NN/br-h14/2279	0.0105516501191135	0.00407395240697961	state	State	NN	NNP	miscellaneous	tech	informative	A	A	AB	ABC	state%1:15:01::	A	A	AB	ABC	 for each State in item 1 above.) Determine the particular <font color=green>State</font>  's`` Federal Share''. By law this is 70% for the	3	1	1.94	0.33	9
state/NN/br-h14/2377	0.0572894327776619	-0.0120209497172851	state	State	NN	NNP	miscellaneous	tech	informative	A	A	AB	ABC	state%1:15:01::	A	A	AB	ABC	 particular State is less or more than these extremes, the <font color=green>State</font>  's Federal share must be raised or lowered to the	4	2	1.66	0.5	6
state/NN/br-h14/981	-0.0406407244151039	-0.0171503371088867	state	State	NN	NNP	miscellaneous	tech	informative	A	A	AB	ABC	state%1:15:01::	A	A	AB	ABC	 the result obtained in item 2 above.) Determine for each <font color=green>State</font> ( except the Virgin Islands, Guam and Puerto Rico, and, prior	3	1	2.72	0.33	9
state/NN/br-h17/2004	0.292205780185551	-0.216219453787958	state	States	NN	NNPS	miscellaneous	tech	informative	A5	A	AB	ABC	Z	Z	Z	Z	Z	 be placed in a registrant 's file. Gonzales v. United <font color=green>States</font> , supra. But there is nothing in the Act requiring the	1	0	0.39	0	3
state/NN/br-h17/936	0.173142662837383	0.112366299659431	state	States	NN	NNPS	miscellaneous	tech	informative	A5	A	AB	ABC	Z	Z	Z	Z	Z	 claims are controlled by the rationale of gonzales v. United <font color=green>States</font> , 348 U. S. 407 ( 1955 ), and United States	1	0	1.16	0	2
state/NN/br-h18/132	0.0230709694131685	-0.0124982137929412	state	State	NN	NNP	miscellaneous	tech	informative	C	C	C	ABC	department_of_state%1:14:00::	C1	C	C	ABC	 our situation. It is the concern of the Department of <font color=green>State</font>  that the American people are safe and secure- defense is	1	1	0.96	1	7
state/NN/br-h18/1462	0.130868463687634	0.0698678033962966	state	States	NN	NNPS	miscellaneous	tech	informative	A5	A	AB	ABC	united_states%1:14:00::	A52	A	AB	ABC	 of policy, well established precedents, the commitments of the United <font color=green>States</font>  under international charters and treaties, basic statutes, and well understood	1	0	1.02	0	4
state/NN/br-h18/2007	0.0465325200877591	-0.0438472723521077	state	State	NN	NNP	miscellaneous	tech	informative	C	C	C	ABC	department_of_state%1:14:00::	C1	C	C	ABC	 this point by saying,`` You fellows in the Department of <font color=green>State</font>  do n't know much about domestic politics''. This is an	1	1	1.18	1	4
state/NN/br-h18/705	0.0690752035117927	0.0736971731776513	state	States	NN	NNPS	miscellaneous	tech	informative	A5	A	AB	ABC	united_states%1:15:00::	A51	A	AB	ABC	 our Capital, can be easily be directed against the United <font color=green>States</font>  and all that it stands for. Dozens of seemingly small	1	0	1.4	0	3
state/NN/br-h18/791	0.0224965129245856	-0.0104245629084496	state	State	NN	NNP	miscellaneous	tech	informative	C	C	C	ABC	department_of_state%1:14:00::	C1	C	C	ABC	 who can do something about them. If the Department of <font color=green>State</font>  is to take primary responsibility for foreign policy in Washington	1	1	1.2	1	7
state/NN/br-h21/1002	0.0661175969405558	-0.0146143402239413	state	State	NN	NNP	miscellaneous	tech	informative	A	A	AB	ABC	state%1:15:01::	A	A	AB	ABC	 Federal Aviation Agency. The growing communications needs of this new <font color=green>State</font>  can best be met, as they have in other States	5	2	0.82	0.4	6
