id	model.x	model.y	lemma	wf	pos	newPos	genre	broadGenre	newBroadGenre	marisense	mbroad	mari3	mari2	sensekey	wnsense	wnbroad	wn3	wn2	text	cues	cuesWithWeight	meanWeight	weightedCuesRatio	weightedCW
church/NN/br-a01/2073	-0.234074233722462	-0.0928427459882907	church	church	NN	NN	press_reportage	others	informative	E	E	DE	CDE	church%1:04:00::	E	E	DE	CDE	 said.`` Being at the polls was just like being at <font color=green>church</font> . I did n't smell a drop of liquor, and we	1	0	0.95	0	9
church/NN/br-a07/1487	0.0267243970038792	-0.00936245869180732	church	church	NN	NN	press_reportage	others	informative	A	A	AB	AB	Z	Z	Z	Z	Z	 projects and still preserve the constitutional requirement on separation of <font color=green>church</font>  and state? R. Sargent Shriver Jr., director of the corps	4	2	1.46	0.5	8
church/NN/br-a10/1754	-0.0424185051789279	0.0423887262006604	church	church	NN	NN	press_reportage	others	informative	A	A	AB	AB	Z	Z	Z	Z	Z	 one out of three Americans has vital contact with the <font color=green>church</font> . This means that more than 100 million have no vital	1	1	1.32	1	6
church/NN/br-a10/1769	-0.0307019961457528	-0.00257256879990494	church	church	NN	NN	press_reportage	others	informative	A	A	AB	AB	Z	Z	Z	Z	Z	 more than 100 million have no vital touch with the <font color=green>church</font>  or religious life'', he told delegates Friday. Talking of the	3	3	1.49	1	8
church/NN/br-a17/1636	-0.162139442067539	-0.121827289942985	church	Church	NN	NNP	press_reportage	others	informative	D	D	DE	CDE	Z	Z	Z	Z	Z	 Gay, who were married Saturday at the Munger Place Methodist <font color=green>Church</font> . Parents of the bride are Mr. and Mrs. Ferris M.	4	3	1.17	0.75	8
church/NN/br-a17/1770	-0.141563782605038	-0.103874178162597	church	Church	NN	NNP	press_reportage	others	informative	D	D	DE	CDE	Z	Z	Z	Z	Z	 College of Technology, in the chapel of the First Presbyterian <font color=green>Church</font>  of Houston. The bride, daughter of Rhodes Semmes Baker Jr.	2	0	2.16	0	4
church/NN/br-a17/2228	-0.12362014842226	-0.0559518198644108	church	church	NN	NN	press_reportage	others	informative	D	D	DE	CDE	Z	Z	Z	Z	Z	 Burgher Jr. seated guests. A reception was held at the <font color=green>church</font> . The First Christian Church of Pampa was the setting for	5	4	2.15	0.8	9
church/NN/br-a21/677	-0.175517013996676	-0.155607261841253	church	Church	NN	NNP	press_reportage	others	informative	D	D	DE	CDE	Z	Z	Z	Z	Z	 for 10 a. m. tomorrow in St. Anne 's Catholic <font color=green>Church</font> , 31978 Mound, in Warren. The mother and daughter, who will	4	1	2.63	0.25	4
church/NN/br-a22/1283	-0.0364371732213284	-0.0996039054924054	church	Church	NN	NNP	press_reportage	others	informative	C	C	C	CDE	Z	Z	Z	Z	Z	 painter. He was a member of the Oakland City Methodist <font color=green>Church</font>  and a native of Atlanta. Funeral services will be at	2	1	1.72	0.5	7
church/NN/br-a31/1395	-0.170581182867626	-0.0676171131702088	church	Church	NN	NNP	press_reportage	others	informative	D	D	DE	CDE	Z	Z	Z	Z	Z	 from 4 to 8 p. m. Sunday at First Presbyterian <font color=green>Church</font> . At that time the second half of the Christian Youth	5	1	1.03	0.2	8
church/NN/br-a31/1542	-0.187238767248781	-0.0115287971487967	church	Church	NN	NNP	press_reportage	others	informative	C	C	C	CDE	Z	Z	Z	Z	Z	 he and his wife serve as advisors at First Presbyterian <font color=green>Church</font> . And he wanted to be careful that the kids not	3	1	0.59	0.33	7
church/NN/br-a31/2212	-0.00252757694283463	-0.0773865365230759	church	church	NN	NN	press_reportage	others	informative	C	C	C	CDE	Z	Z	Z	Z	Z	 participate. To start the week of special programs at the <font color=green>church</font> , the Rev. John D. Henderson will preach on`` A Successful	4	2	1.28	0.5	7
church/NN/br-a31/2241	0.159130750513271	-0.201382807205233	church	church	NN	NN	press_reportage	others	informative	C	C	C	CDE	Z	Z	Z	Z	Z	 40 and 11 a. m. Sunday. New officers of the <font color=green>church</font>  will be ordained and installed at the 7: 30 p.	4	2	1.11	0.5	3
church/NN/br-a31/2280	-0.0591541094555955	-0.119120107948815	church	church	NN	NN	press_reportage	others	informative	C	C	C	CDE	Z	Z	Z	Z	Z	 held at 6: 15 p. m. Monday and the annual <font color=green>church</font>  picnic at 4 p. m. next Saturday. The week will	3	3	2.23	1	7
church/NN/br-b08/1866	-0.0531078720481509	-0.00155871245962034	church	church	NN	NN	press_editorial	others	informative	D	D	DE	CDE	Z	Z	Z	Z	Z	 wrote after almost a decade of service to this majestic <font color=green>church</font> .`` Such a church needs vigor and vitality in its rector	2	0	2.03	0	7
church/NN/br-b08/1871	-0.11126009526611	-0.0193869161720331	church	church	NN	NN	press_editorial	others	informative	C	C	C	CDE	Z	Z	Z	Z	Z	 a decade of service to this majestic church.`` Such a <font color=green>church</font>  needs vigor and vitality in its rector and one man	4	2	2.45	0.5	4
church/NN/br-b08/1912	-0.014414649964743	0.0303197085243168	church	church	NN	NN	press_editorial	others	informative	C	C	C	CDE	Z	Z	Z	Z	Z	 stay`` beyond the time that his leadership should benefit'' his <font color=green>church</font> , he wrote,`` for he becomes ordinary''. And so the young	2	1	1.72	0.5	5
church/NN/br-b08/2063	-0.163986658514181	0.0700629877655739	church	church	NN	NN	press_editorial	others	informative	C	C	C	CDE	Z	Z	Z	Z	Z	 gives himself to God and to the believers of his <font color=green>church</font>  takes upon himself a life of giving. He does not	4	1	0.92	0.25	4
church/NN/br-b08/834	-0.0786824912122657	-0.0105784891072288	church	church	NN	NN	press_editorial	others	informative	D	D	DE	CDE	Z	Z	Z	Z	Z	 agreement. I settled it tonight'', he continued.`` I leave this <font color=green>church</font>  with a feeling that a great weight has been lifted	1	0	1.27	0	6
church/NN/br-b12/2235	-0.120639909392633	-0.0830564533411937	church	Church	NN	NNP	press_editorial	others	informative	B	B	AB	AB	Z	Z	Z	Z	Z	 Church of Scotland, Methodist Church, Congregational Union, Baptist Union, Presbyterian <font color=green>Church</font>  of England, Churches in Wales, Churches in Ireland, Society of	9	3	3.04	0.33	5
church/NN/br-d01/1628	-0.172361324279186	0.0216276330494491	church	church	NN	NN	religion	others	informative	B	B	AB	AB	church%1:14:00::	B	B	AB	AB	 age to whip men into a surrender to a particular <font color=green>church</font>  or church-state''. Apparently he does not intend that those who	3	2	1.45	0.67	7
church/NN/br-d02/706	-0.068593137244021	0.0376583263894062	church	church	NN	NN	religion	others	informative	A	A	AB	AB	church%1:14:00::	B	B	AB	AB	 there tends to be an almost complete indifference to the <font color=green>church</font>  and its traditional message of sin and grace. To be	4	4	1.69	1	9
church/NN/br-d02/877	-0.120453787402719	0.0572477071381841	church	church	NN	NN	religion	others	informative	A	A	AB	AB	church%1:14:00::	B	B	AB	AB	 precarious? There is an ancient and venerable tradition in the <font color=green>church</font> ( which derives, however, from the heritage of the Greeks rather	4	3	1.68	0.75	5
church/NN/br-d03/1080	-0.114430654308006	0.0828974925271827	church	church	NN	NN	religion	others	informative	E	E	DE	CDE	church%1:04:00::	E	E	DE	CDE	 phenomenon of redundancy is that fewer Protestants are going to <font color=green>church</font> . It should be admitted, too, that there is a good	2	2	1.32	1	7
church/NN/br-d03/1342	-0.119951159834484	-0.0251875669588563	church	church	NN	NN	religion	others	informative	E	E	DE	CDE	church%1:06:00::	D	D	DE	CDE	 my experience to find as many men as women in <font color=green>church</font> , and to hear almost everyone in church congregations reciting the	5	2	2.05	0.4	7
church/NN/br-d03/1350	-0.102969061086329	-0.000486720753191123	church	church	NN	NN	religion	others	informative	E	E	DE	CDE	church%1:06:00::	D	D	DE	CDE	 as women in church, and to hear almost everyone in <font color=green>church</font>  congregations reciting the Latin prayers and responses at Mass. They	5	4	2.38	0.8	10
church/NN/br-d03/2336	-0.0887449905720096	-0.00509536197893145	church	church	NN	NN	religion	others	informative	D	D	DE	CDE	catholic_church%1:14:00::	B1	B	AB	AB	 a votive Mass offered for Christian unity at a Catholic <font color=green>church</font>  in Slough during the Church Unity Octave.	2	1	2.61	0.5	7
church/NN/br-d03/2341	-0.115892512543659	-0.0277046919157534	church	Church	NN	NNP	religion	others	informative	A	A	AB	AB	church%1:14:00::	B	B	AB	AB	 Christian unity at a Catholic church in Slough during the <font color=green>Church</font>  Unity Octave.	2	1	3.17	0.5	5
church/NN/br-d03/721	-0.0795165403683879	-0.129275415798974	church	Church	NN	NNP	religion	others	informative	B	B	AB	AB	church%1:06:00::	D	D	DE	CDE	 crowds going in and out of the Birmingham Oratory( Catholic) <font color=green>Church</font>  on Sunday mornings. She found this a marvel because, as	1	0	2.85	0	3
church/NN/br-d03/862	0.00168478577609713	-0.0173224838595139	church	Church	NN	NNP	religion	others	informative	B	B	AB	AB	church_of_england%1:14:00::	B2	B	AB	AB	 to a newspaper report of the 1961 statistics of the <font color=green>Church</font>  of England, the`` total of confirmed members is 9748000, but	3	2	1.86	0.67	7
church/NN/br-d03/883	-0.0877740619423115	-0.247627073643398	church	church	NN	NN	religion	others	informative	C	C	C	CDE	church_roll%1:10:00::	C	C	C	CDE	 is 9748000, but only 2887671 are registered on the parochial <font color=green>church</font>  rolls'', and`` over 27 million people in England are baptized	4	3	2	0.75	4
church/NN/br-d03/945	-0.0119074715675859	-0.0276571729866961	church	Church	NN	NNP	religion	others	informative	B	B	AB	AB	church_of_england%1:14:00::	B2	B	AB	AB	 than an Archbishops' Commission`` reported last month that in the <font color=green>Church</font>  of England alone there are 790 churches which are redundant	1	0	1.3	0	8
church/NN/br-d04/56	-0.131735263378925	0.063971625826085	church	church	NN	NN	religion	others	informative	A	A	AB	AB	church_father%1:18:00::	A	A	AB	AB	 Jesus Christ the unique and the universal concur. Perhaps no <font color=green>church</font>  father saw this concurrence of the unique and the universal	4	6	2.11	1.5	7
church/NN/br-d06/2174	-0.0736315109024369	0.00606875530194714	church	church	NN	NN	religion	others	informative	C	C	C	CDE	Z	Z	Z	Z	Z	 spiritually. No amount of religious ceremonies or even joining a <font color=green>church</font>  will relieve the gnawing of your`` inner'' space. Why? Because	3	3	1.81	1	7
church/NN/br-d07/216	-0.199363475397986	0.0262762402602704	church	church	NN	NN	religion	others	informative	C	C	C	CDE	Z	Z	Z	Z	Z	 of the most wholesome things you could schedule in your <font color=green>church</font>  would thus be a group confessional where people could admit	4	2	1.23	0.5	5
church/NN/br-d09/1619	0.0222028326431628	-0.0732782549753668	church	church	NN	NN	religion	others	informative	C	C	C	CDE	Z	Z	Z	Z	Z	 the group of new members to be put in the <font color=green>church</font>  paper or placed on the bulletin board. Have a fellowship	5	4	1.1	0.8	7
church/NN/br-d09/2026	-0.00163030797729638	0.0338534037362826	church	church	NN	NN	religion	others	informative	C	C	C	CDE	Z	Z	Z	Z	Z	 planned and carefully developed. The entire membership of the local <font color=green>church</font>  must be alerted to their part in this dynamic process	3	3	1.09	1	11
church/NN/br-d09/2084	-0.128423874131648	-0.0337078343163155	church	church	NN	NN	religion	others	informative	A	A	AB	AB	Z	Z	Z	Z	Z	 under way. Those who enter the front door of the <font color=green>church</font>  intelligently and with Christian dedication will not so easily step	2	1	1.32	0.5	6
church/NN/br-d09/2174	-0.0100572184309236	-0.0264785007547368	church	church	NN	NN	religion	others	informative	C	C	C	CDE	Z	Z	Z	Z	Z	 members. The new members justifiably expect some things from their <font color=green>church</font>  family:	3	4	1.47	1.33	6
church/NN/br-d09/731	-0.0234319089659252	0.000330862824391452	church	church	NN	NN	religion	others	informative	C	C	C	CDE	Z	Z	Z	Z	Z	 activities of the local church. The lay leadership of the <font color=green>church</font>  may be invited to speak on the various phases of	2	2	2.04	1	8
church/NN/br-d09/749	-0.0209344128198923	0.00792072456196557	church	church	NN	NN	religion	others	informative	C	C	C	CDE	Z	Z	Z	Z	Z	 on the various phases of church life, service opportunities, the <font color=green>church</font>  school, missions, men 's work, women 's work, youth program	9	5	2.15	0.56	9
church/NN/br-d09/837	-0.000383453796568241	-0.000240163714869964	church	church	NN	NN	religion	others	informative	C	C	C	CDE	Z	Z	Z	Z	Z	 facilities and refreshments. The social time gives an opportunity for <font color=green>church</font>  leaders to become acquainted with the new members. In conducting	5	4	1.84	0.8	6
church/NN/br-d12/1462	-0.00693445185128147	-0.00450005761285142	church	church	NN	NN	religion	others	informative	A	A	AB	AB	Z	Z	Z	Z	Z	 is discussed must surely be raised. The role of both <font color=green>church</font>  and university as sources of information and settings within which	3	1	1.41	0.33	7
church/NN/br-d12/233	-0.0569921017353734	0.0771578594655006	church	church	NN	NN	religion	others	informative	A	A	AB	AB	Z	Z	Z	Z	Z	 social change? What social, ethical and theological insights can the <font color=green>church</font>  and university help him bring to bear upon his situation	5	6	1.87	1.2	8
church/NN/br-d14/209	-0.0472706434003859	0.0176762617583885	church	church	NN	NN	religion	others	informative	A	A	AB	AB	Z	Z	Z	Z	Z	 of churches. Presumably those who did not have a formal <font color=green>church</font>  connexion had also felt the influence of Christianity to a	3	3	1.49	1	9
church/NN/br-d14/234	-0.0493940892118909	0.0286039017549174	church	church	NN	NN	religion	others	informative	C	C	C	CDE	Z	Z	Z	Z	Z	 extent. Many of them had once been members of a <font color=green>church</font>  or at least had been given instruction in Christianity but	3	3	1.18	1	10
church/NN/br-d14/557	0.0920054890092074	0.0460565516851826	church	church	NN	NN	religion	others	informative	A	A	AB	AB	Z	Z	Z	Z	Z	 If guilty, the offender might be excluded from membership. As <font color=green>church</font>  membership burgeoned, such measures faded into desuetude. But whether this	2	3	1.98	1.5	5
church/NN/br-d17/1073	-0.19384392213798	0.0368150454615414	church	church	NN	NN	religion	others	informative	C	C	C	CDE	Z	Z	Z	Z	Z	 different, and something important: Ruth Peale, her wide experience in <font color=green>church</font>  work; Sidney Fields, years of experience as a New York	2	3	1.02	1.5	7
church/NN/br-e13/754	0.110357324904517	0.190202944027827	church	church	NN	NN	skill_and_hobbies	tech	informative	D	D	DE	CDE	Z	Z	Z	Z	Z	 the first of which was begun by Constantine, this fourth <font color=green>church</font>  was started by Justinian in 532 and completed twenty years	4	4	0.36	1	6
church/NN/br-f15/713	-0.0933364959319288	-0.0383151057506573	church	Church	NN	NNP	popular_lore	others	informative	B	B	AB	AB	roman_catholic_church%1:14:00::	B1	B	AB	AB	 permit birth control only for medical reasons. The Roman Catholic <font color=green>Church</font> , however, sanctions a much more liberal policy on family planning	5	4	1.24	0.8	11
church/NN/br-f15/862	-0.124660610897872	0.00890033773076246	church	Church	NN	NNP	popular_lore	others	informative	A	A	AB	AB	roman_catholic_church%1:14:00::	B1	B	AB	AB	 there seems little chance of agreement. The grounds for the <font color=green>Church</font>  's position are Scriptural( Old Testament), the teachings of the	3	1	0.78	0.33	8
church/NN/br-f44/1122	-0.0195373329271338	0.046369924228954	church	church	NN	NN	popular_lore	others	informative	D	D	DE	CDE	church%1:14:00::	B	B	AB	AB	 process of co-optation so long as the environs of the <font color=green>church</font>  provide a sufficient pool of people who can fit the	1	0	1.19	0	6
church/NN/br-f44/1285	-0.00195266159126631	0.0182931577324271	church	church	NN	NN	popular_lore	others	informative	C	C	C	CDE	church%1:14:00::	B	B	AB	AB	 co-optation is the principal form of mission in the contemporary <font color=green>church</font> ; economic integration and co-optation are the two methods by which	3	2	1.48	0.67	8
church/NN/br-f44/2150	0.00465638358542902	0.00372823839010703	church	church	NN	NN	popular_lore	others	informative	C	C	C	CDE	church%1:14:00::	B	B	AB	AB	 will occupy our attention under the rubric of the organization <font color=green>church</font> . An understanding of the new role of residential association in	3	3	1.46	1	8
church/NN/br-f44/368	-0.00849400643546232	0.020942271400858	church	church	NN	NN	popular_lore	others	informative	C	C	C	CDE	church%1:14:00::	B	B	AB	AB	 they can lose higher- and lower status members from the <font color=green>church</font>  without collapsing, but they need adequate recruits for the core	3	2	1.5	0.67	8
church/NN/br-f44/654	-0.0991645670379857	-0.054513466784695	church	Church	NN	NNP	popular_lore	others	informative	A	A	AB	AB	church%1:14:00::	B	B	AB	AB	 in theological circles about the`` Church as Mission'' and the`` <font color=green>Church</font>  's Mission''; theologians have been stressing the fact that the	4	2	2.31	0.5	5
church/NN/br-f44/986	-0.0510137135300959	0.00767289888757288	church	church	NN	NN	popular_lore	others	informative	C	C	C	CDE	church%1:14:00::	B	B	AB	AB	 people; the new people respond in kind by joining the <font color=green>church</font> . Missionary outreach by friendly contact looks somewhat different when one	4	2	1.32	0.5	12
church/NN/br-g05/1358	-0.269147430341306	0.00402681567887935	church	church	NN	NN	belles_lettres	others	informative	D	D	DE	CDE	Z	Z	Z	Z	Z	 which contain nine greater alcoves as frescoed and capacious as <font color=green>church</font>  apses. Here, in the old days- when they had come	3	0	0.96	0	2
church/NN/br-g12/1271	-0.253985933896442	0.0627541233551619	church	church	NN	NN	belles_lettres	others	informative	D	D	DE	CDE	church%1:06:00::	D	D	DE	CDE	 and gestured toward the Madeleine. The classical lines of the <font color=green>church</font>  which Napoleon thought of as a Temple of Glory, dominated	5	2	2.65	0.4	3
church/NN/br-h17/1199	0.0314555093528775	-0.00824504020145163	church	church	NN	NN	miscellaneous	tech	informative	C	C	C	CDE	church%1:14:00::	B	B	AB	AB	 because of his willingness to kill in defense of his <font color=green>church</font>  and home. Upon administrative approval of the reclassification, he was	2	1	1.75	0.5	6
church/NN/br-j57/2237	-0.234856786820348	0.0349232425018523	church	Church	NN	NNP	learned	tech	informative	A	A	AB	AB	church_father%1:18:00::	A	A	AB	AB	 which reached Christianity by the way of Stoicism through the <font color=green>Church</font>  Fathers of Late Antiquity.	3	2	1.58	0.67	4
church/NN/br-j57/958	-0.0653644501515148	0.00116359051654066	church	Church	NN	NNP	learned	tech	informative	A	A	AB	AB	church_father%1:18:00::	A	A	AB	AB	 all possessions. This conception was taken up by the early <font color=green>Church</font>  Fathers and by canon lawyers and theologians in the Middle	5	3	1.27	0.6	8
church/NNS/br-a09/1417	-0.0778096743669002	-0.0831895342740556	church	churches	NNS	NNS	press_reportage	others	informative	D	D	DE	CDE	Z	Z	Z	Z	Z	 will feature row houses, garden apartments, four small parks, schools, <font color=green>churches</font> , a shopping center and several small clusters of stores. The	7	4	1.99	0.57	8
church/NNS/br-a10/1674	-0.0332206708894276	-0.0757548356227625	church	churches	NNS	NNS	press_reportage	others	informative	D	D	DE	CDE	Z	Z	Z	Z	Z	 need for their forthcoming program,`` Breakthrough'' scheduled to fill the <font color=green>churches</font>  for the next two years. In his opening address Wednesday	5	4	2	0.8	6
church/NNS/br-a10/1831	-0.14248305326217	-0.225885655020706	church	churches	NNS	NNS	press_reportage	others	informative	C	C	C	CDE	Z	Z	Z	Z	Z	 with this challenge''.`` In 35 years we have opened 7000 <font color=green>churches</font> '', the Rev. Mr. Brandt said, adding that the denomination had	3	1	1.85	0.33	5
church/NNS/br-a10/1863	0.00254316395105474	-0.0820955185226988	church	churches	NNS	NNS	press_reportage	others	informative	C	C	C	CDE	Z	Z	Z	Z	Z	 for every 10000 persons.`` In this light we need 1000 <font color=green>churches</font>  in Illinois, where we have 200; 800 in Southern New	3	3	1.2	1	5
church/NNS/br-a10/1980	-0.0137038457236563	0.0229477796400379	church	churches	NNS	NNS	press_reportage	others	informative	C	C	C	CDE	Z	Z	Z	Z	Z	 includes: Encouraging by every means, all existing Assemblies of God <font color=green>churches</font>  to start new churches. Engaging mature, experienced men to pioneer	6	2	2.94	0.33	10
church/NNS/br-a10/1984	-0.0367369828183182	0.0127240313596433	church	churches	NNS	NNS	press_reportage	others	informative	C	C	C	CDE	Z	Z	Z	Z	Z	 means, all existing Assemblies of God churches to start new <font color=green>churches</font> . Engaging mature, experienced men to pioneer or open new churches	6	4	3.06	0.67	9
church/NNS/br-a10/1996	-0.0164403368564656	0.0262350529859035	church	churches	NNS	NNS	press_reportage	others	informative	C	C	C	CDE	Z	Z	Z	Z	Z	 churches. Engaging mature, experienced men to pioneer or open new <font color=green>churches</font>  in strategic population centers. Surrounding pioneer pastors with vocational volunteers	7	3	3.17	0.43	10
church/NNS/br-a10/2051	-0.046809632802489	-0.122217977306882	church	churches	NNS	NNS	press_reportage	others	informative	C	C	C	CDE	Z	Z	Z	Z	Z	 to spend from 6- 12 months as apprentices in well-established <font color=green>churches</font> . U. S. Dist. Judge Charles L. Powell denied all motions	2	0	2.18	0	5
church/NNS/br-a31/1753	0.0273881836837426	0.0250951975983991	church	churches	NNS	NNS	press_reportage	others	informative	C	C	C	CDE	Z	Z	Z	Z	Z	 Auditorium may be set up soon. And to encourage other <font color=green>churches</font>  to try their own programs, Kern said this Sunday 's	3	2	1.04	0.67	8
church/NNS/br-a31/1806	-0.00672684188479883	-0.0109883742697074	church	churches	NNS	NNS	press_reportage	others	informative	D	D	DE	CDE	Z	Z	Z	Z	Z	 special services marking National Christian Family Week in Miami area <font color=green>churches</font>  next week. Of particular meaning to the Charles MacWhorter family	4	3	1.78	0.75	12
church/NNS/br-b04/1480	-0.0391728725706135	-0.00633133809610681	church	churches	NNS	NNS	press_editorial	others	informative	C	C	C	CDE	Z	Z	Z	Z	Z	 his money and his name: Does it assail schools and <font color=green>churches</font>  with blanket accusations? Does it attack other traditional American institutions	4	3	1.78	0.75	9
church/NNS/br-b12/2239	-0.0664263984207012	-0.0246307284507171	church	Churches	NNS	NNPS	press_editorial	others	informative	B	B	AB	AB	Z	Z	Z	Z	Z	 Methodist Church, Congregational Union, Baptist Union, Presbyterian Church of England, <font color=green>Churches</font>  in Wales, Churches in Ireland, Society of Friends, British and	7	0	2.75	0	6
church/NNS/br-b22/1326	-0.111049112638554	0.105253373888438	church	Churches	NNS	NNPS	press_editorial	others	informative	B	B	AB	AB	Z	Z	Z	Z	Z	 pervades the Church 's stance toward the Protestant and Orthodox <font color=green>Churches</font> . Noting all the difficulties that stand in the way of	2	1	2.7	0.5	5
church/NNS/br-c08/1853	-0.0548874515616858	0.0515335595156794	church	churches	NNS	NNS	press_reviews	others	informative	C	C	C	CDE	Z	Z	Z	Z	Z	 the early jazz forms and the music of the Negro <font color=green>churches</font> . To help him on this religious aspect of primitive jazz	4	3	2.06	0.75	8
church/NNS/br-d03/1011	0.0599582785739961	-0.110532355502226	church	churches	NNS	NNS	religion	others	informative	D	D	DE	CDE	church%1:06:00::	D	D	DE	CDE	 often, the sale of 764 chapels''. Most of these former <font color=green>churches</font>  are now used as warehouses, but`` neither Anglicans nor Nonconformists	3	1	1.24	0.33	4
church/NNS/br-d03/1027	-0.21593892140463	-0.0253800751597346	church	churches	NNS	NNS	religion	others	informative	D	D	DE	CDE	church%1:06:00::	D	D	DE	CDE	 as warehouses, but`` neither Anglicans nor Nonconformists object to selling <font color=green>churches</font>  to Roman Catholics'', and have done so. While it must	2	1	2.61	0.5	5
church/NNS/br-d03/110	-0.0365041641259459	0.0258853989609166	church	churches	NNS	NNS	religion	others	informative	C	C	C	CDE	church%1:14:00::	B	B	AB	AB	 was enthusiastically devoted to prayer and discussion by the various <font color=green>churches</font> . Many people seem hopeful, yet it is difficult to predict	5	5	1.86	1	9
church/NNS/br-d03/1884	-0.0376601518248374	-0.0238883747735604	church	churches	NNS	NNS	religion	others	informative	B	B	AB	AB	church%1:14:00::	B	B	AB	AB	 at least of equal stature in England with the Protestant <font color=green>churches</font> . On successive Sundays during October, 1960, Paul Ferris( a non-Catholic	2	2	2.47	1	8
church/NNS/br-d03/313	-0.108451874365741	0.00512277848081575	church	Churches	NNS	NNPS	religion	others	informative	B	B	AB	AB	anglican_church%1:14:00::	B2	B	AB	AB	 saying and writing and implying about the Roman and Anglican <font color=green>Churches</font>  and about the present religious state of England. Since the	5	4	1.78	0.8	7
church/NNS/br-d03/35	-0.0756007223438198	-0.002461521683921	church	Churches	NNS	NNPS	religion	others	informative	B	B	AB	AB	anglican_church%1:14:00::	B2	B	AB	AB	 efforts of only unauthorized individuals of the Roman and Anglican <font color=green>Churches</font> , and urging a communion of prayer unacceptable to Rome, this	5	3	2.66	0.6	7
church/NNS/br-d03/849	0.00400922897892672	-0.0044281932397596	church	churches	NNS	NNS	religion	others	informative	C	C	C	CDE	church%1:06:00::	D	D	DE	CDE	 admit the great falling off in effective membership in their <font color=green>churches</font> . According to a newspaper report of the 1961 statistics of	2	2	2.22	1	8
