id	model.x	model.y	lemma	pos	genre	broadGenre	marisense	mbroad	mari3	mari2	sensekey	wnsense	wnbroad	wn3	wn2	text	newPos	newBroadGenre	cues	cuesWithWeight	meanWeight	weightedCuesRatio	weightedCW	wf
country/NN/br-a41/1455	0.248257349877472	0.0358545989311483	country	NN	press_reportage	press	B1	B	B14	B	Z	Z	Z	Z	Z	 the thousands of Belgian civilians who had remained in the <font color=green>country</font> . The Belgian government decided to act, and on July 10	NN	informative	2	0	1.8	0	5	country
country/NN/br-a41/1497	-0.0570464029265029	-0.155166318065909	country	NN	press_reportage	press	B	B	B14	B	Z	Z	Z	Z	Z	 Moise Tshombe, announced that his province had seceded from the <font color=green>country</font> . Confusion became chaos; each succeeding day brought new acts of	NN	informative	2	2	1.35	1	9	country
country/NN/br-a41/342	0.00224276910048765	0.00421122657681217	country	NN	press_reportage	press	B2	B	B23	B	Z	Z	Z	Z	Z	 part of a government, of managing the affairs of a <font color=green>country</font>  in the manner of a father dealing with his children	NN	informative	2	2	1.34	1	7	country
country/NN/br-a44/2146	0.0176758806715645	0.00629516153359332	country	NN	press_reportage	press	B1	B	B14	B	Z	Z	Z	Z	Z	 condition. There are, for example, approximately 25000000 people in this <font color=green>country</font>  with no public library service and about 50000000 with inadequate	NN	informative	5	4	1.31	0.8	10	country
country/NN/br-b01/1647	0.0572284171285237	0.0672434246133204	country	NN	press_editorial	press	B4	B	B14	B	Z	Z	Z	Z	Z	 become oppressive. Unquestionably Trujillo did some good things for his <font color=green>country</font> : he improved public facilities such as roads and sanitation, attracted	NN	informative	4	2	1.49	0.5	5	country
country/NN/br-b01/1784	-0.0768744759887435	0.217760737176138	country	NN	press_editorial	press	B2	B	B23	B	Z	Z	Z	Z	Z	 character. Tardily the Government here came to understand how this <font color=green>country</font>  's own reputation was tarnished by the association with repression	NN	informative	3	1	1.12	0.33	5	country
country/NN/br-b01/774	0.0490338361802266	0.0490468931375939	country	NN	press_editorial	press	B2	B	B23	B	Z	Z	Z	Z	Z	 By limiting American strength too much to nuclear strength, this <font color=green>country</font>  limited its ability to fight any kind of war besides	NN	informative	5	4	1.33	0.8	9	country
country/NN/br-b02/2021	0.0571666727479506	0.15475407010615	country	NN	press_editorial	press	B	B	B14	B	Z	Z	Z	Z	Z	 in the fighting- this last big effort to seal that <font color=green>country</font>  from the cold war had to be made. The world	NN	informative	3	1	1.43	0.33	7	country
country/NN/br-b05/2003	-0.0515679561222189	0.0636030119792606	country	NN	press_editorial	press	B1	B	B14	B	Z	Z	Z	Z	Z	 it the recreation spot of people from all over the <font color=green>country</font> . By comparison, Stone Harbor bird sanctuary 's allies seem less	NN	informative	6	4	1.68	0.67	8	country
country/NN/br-b05/2202	0.141776703893018	0.141202511795001	country	NN	press_editorial	press	B3	B	B23	B	Z	Z	Z	Z	Z	 day. Then off to a remote place in an underdeveloped <font color=green>country</font>  where the diet, culture, language and living conditions will be	NN	informative	7	6	1.54	0.86	7	country
country/NN/br-b05/482	0.0818645812900514	0.0376030453246192	country	NN	press_editorial	press	B	B	B14	B	Z	Z	Z	Z	Z	 for world trade as a condition of national survival, this <font color=green>country</font>  can have little patience with labor 's family feuds. The	NN	informative	7	6	1.16	0.86	8	country
country/NN/br-b09/110	-0.161221915111604	-0.00564657912272847	country	NN	press_editorial	press	A	A	A	A	Z	Z	Z	Z	Z	 the Pod porch, alone. He had that day attended a <font color=green>country</font>  auction, and he had come back with a prize. The	NN	informative	3	2	1.29	0.67	6	country
country/NN/br-b11/138	-0.0674165812329596	0.0434134440027009	country	NN	press_editorial	press	B1	B	B14	B	Z	Z	Z	Z	Z	 December that would enlist top-drawer Democrats from all over the <font color=green>country</font> . Blueprints for doubling the CDC 's present 55000 enrollment. Arrangements	NN	informative	3	2	1.73	0.67	6	country
country/NN/br-b11/1896	-0.191648211787436	-0.0839277498300686	country	NN	press_editorial	press	B1	B	B14	B	Z	Z	Z	Z	Z	 made its first appearance as the Saturday Evening Post. The <font color=green>country</font>  was now full of Gazettes and Samuel C. Atkinson and	NN	informative	2	1	1.14	0.5	7	country
country/NN/br-b11/1989	-0.074901579604065	0.0985604418634903	country	NN	press_editorial	press	B1	B	B14	B	Z	Z	Z	Z	Z	 Post was one of the most popular weeklies in the <font color=green>country</font> . But during the second half of the century its fortunes	NN	informative	3	1	0.7	0.33	6	country
country/NN/br-b11/2098	-0.0321840804615937	0.167980059069605	country	NN	press_editorial	press	B1	B	B14	B	Z	Z	Z	Z	Z	 again became one of the most popular weeklies of the <font color=green>country</font> .`` Remember the French railroad baron who was going to take	NN	informative	3	1	0.88	0.33	6	country
country/NN/br-b15/1451	-0.0207900126966212	0.0172110309475116	country	NN	press_editorial	press	B4	B	B14	B	Z	Z	Z	Z	Z	 Russia, not in the least! I am proud of my <font color=green>country</font> , the small city I live in, my wonderful parents, my	NN	informative	3	2	0.69	0.67	9	country
country/NN/br-b16/2025	0.000434667416368874	0.0903046266274486	country	NN	press_editorial	press	B4	B	B14	B	Z	Z	Z	Z	Z	 in London while they finished their drinks. They do our <font color=green>country</font>  great harm by such actions. Those in the public eye	NN	informative	4	2	1.5	0.5	6	country
country/NN/br-b16/284	0.0982886755085491	0.0817725827353799	country	NN	press_editorial	press	B3	B	B23	B	Z	Z	Z	Z	Z	 in world peace, increased world trade, and prosperity for every <font color=green>country</font>  on the globe. Let us prepare for peace, instead of	NN	informative	5	7	1.4	1.4	10	country
country/NN/br-b16/85	0.106685515553503	0.0885891924483118	country	NN	press_editorial	press	B4	B	B14	B	Z	Z	Z	Z	Z	 win his present position, Mr. Kennedy was vitriolic about this <font color=green>country</font>  's`` prestige'' abroad. What does he think a remark like	NN	informative	2	2	1.05	1	7	country
country/NN/br-b18/873	0.375244935765353	-0.0274850085293402	country	NN	press_editorial	press	B2	B	B23	B	Z	Z	Z	Z	Z	 did not include repeal of the Connally amendment to this <font color=green>country</font>  's domestic jurisdiction reservation to its Adherence to the Statute	NN	informative	4	2	1.63	0.5	4	country
country/NN/br-b19/286	0.0873140149220891	0.116766122194471	country	NN	press_editorial	press	B2	B	B23	B	Z	Z	Z	Z	Z	 wrongs can make a right! I am referring to this <font color=green>country</font>  conducting atmosphere tests of nuclear bombs just because Russia is	NN	informative	3	3	1.46	1	9	country
country/NN/br-b20/2202	0.049619478417066	0.0470205058928155	country	NN	press_editorial	press	B2	B	B23	B	country%1:14:00::	B2	B	BB2	B	 more serious should the cold war mount in frenzy. The <font color=green>country</font>  is committed to the doctrine of security by military means	NN	informative	5	3	1.31	0.6	9	country
country/NN/br-b20/308	0.0694073417720111	0.0720110834253857	country	NN	press_editorial	press	B4	B	B14	B	country%1:15:00::	B1	B	B1	B	 that of diplomatic policy''. Morrison points out that since our <font color=green>country</font>  is more urbanized than the Soviet Union or Red China	NN	informative	5	3	1.68	0.6	8	country
country/NN/br-b21/1131	0.162720155434541	0.211081520345319	country	NN	press_editorial	press	B2	B	B23	B	Z	Z	Z	Z	Z	 devices, Ambassador Stevenson warned the UN General Assembly that this <font color=green>country</font> , in`` self protection'', might have to resume above-ground tests. More	NN	informative	3	2	1.59	0.67	8	country
country/NN/br-b21/1487	0.0307395880598198	0.0254234863031676	country	NN	press_editorial	press	B1	B	B14	B	Z	Z	Z	Z	Z	 far more important as a potential health hazard in this <font color=green>country</font>  and throughout the world''. Dr. Linus Pauling, a Nobel Prize	NN	informative	4	3	1.11	0.75	11	country
country/NN/br-b21/49	-0.000223114379352332	0.0271818551994585	country	NN	press_editorial	press	B1	B	B14	B	Z	Z	Z	Z	Z	 But there is reason in all things, and in this <font color=green>country</font>  the heathenish cult of the motor-car is exceeding all bounds	NN	informative	3	3	1.36	1	8	country
country/NN/br-b23/2111	-0.093828928179307	0.181949362984123	country	NN	press_editorial	press	B2	B	B23	B	Z	Z	Z	Z	Z	 with the Communist bloc, and is busily turning his own <font color=green>country</font>  into a totalitarian dictatorship. As our planes land the war	NN	informative	4	1	1.48	0.25	6	country
country/NN/br-b24/1149	-0.14297633384593	0.0704985679455848	country	NN	press_editorial	press	B1	B	B14	B	Z	Z	Z	Z	Z	 them can bolt one down in mid-shimmy. All over the <font color=green>country</font> , belly clubs have never been bigger, especially in Detroit, Boston	NN	informative	5	2	1.23	0.4	7	country
country/NN/br-b25/328	0.0229998116156703	0.00255684659156251	country	NN	press_editorial	press	B2	B	B23	B	Z	Z	Z	Z	Z	 take a more direct and active part in running the <font color=green>country</font> . Also, elections would be more democratic; there might even be	NN	informative	4	3	1	0.75	10	country
country/NN/br-b27/1414	0.036224741381515	0.0248835234976528	country	NN	press_editorial	press	B1	B	B14	B	Z	Z	Z	Z	Z	 in between. We had a couple of schools in this <font color=green>country</font> , the principal one being on the Marshall Field estate out	NN	informative	3	3	1.46	1	9	country
country/NN/br-c01/2379	0.0374331851569551	0.0123671030672283	country	NN	press_reviews	press	B	B	B14	B	country%1:14:00::	B2	B	BB2	B	 in this last of the Russian films to reach this <font color=green>country</font>  in the program of joint cultural exchange. Also on the	NN	informative	4	3	1.45	0.75	9	country
country/NN/br-c01/621	-0.0516603090246095	0.366722022888104	country	NN	press_reviews	press	B1	B	B14	B	country%1:15:00::	B1	B	B1	B	 extraordinary, considers the finest house of its kind in the <font color=green>country</font> - and of course he does n't weep at the capacity	NN	informative	3	1	1.21	0.33	5	country
country/NN/br-c02/2222	0.0659908055842973	0.225386605957048	country	NN	press_reviews	press	B4	B	B14	B	country%1:14:00::	B2	B	BB2	B	 storylines too. He intimated that they were n't doing the <font color=green>country</font>  much good in the Cold War. And to an industry	NN	informative	2	0	1.29	0	4	country
country/NN/br-c02/2265	-0.0548320697579904	0.120549775732559	country	NN	press_reviews	press	B4	B	B14	B	country%1:14:00::	B2	B	BB2	B	 globe'', he said,`` the major source of impressions about this <font color=green>country</font>  are in the movies they meet. Would we want a	NN	informative	1	0	0.98	0	7	country
country/NN/br-c03/731	0.00950981412862456	-0.00427112438500837	country	NN	press_reviews	press	B1	B	B14	B	Z	Z	Z	Z	Z	 of the very best is only now published in this <font color=green>country</font> , five years after its first publication in England. It is	NN	informative	3	3	1.39	1	7	country
country/NN/br-c08/1831	0.00795646721669756	0.10717718233986	country	NN	press_reviews	press	B1	B	B14	B	Z	Z	Z	Z	Z	 African roots among the slaves who were brought to this <font color=green>country</font>  and the West Indies, he stressed the close relationship between	NN	informative	4	2	1.79	0.5	7	country
country/NN/br-c10/1333	-0.175669041862046	0.0595913381008932	country	NN	press_reviews	press	B1	B	B14	B	Z	Z	Z	Z	Z	 although I saw Jouvet as Arnolphe when he visited this <font color=green>country</font>  shortly before his death; by that time, he seemed to	NN	informative	1	1	1.38	1	4	country
country/NN/br-c14/1501	0.302795195078207	0.259841627123172	country	NN	press_reviews	press	A	A	A	A	Z	Z	Z	Z	Z	 best essays Mr. Sansom expresses his enthusiasm for the many <font color=green>country</font>  mansions designed by Andrea Palladio himself that dot the environs	NN	informative	3	1	0.97	0.33	3	country
country/NN/br-c14/2215	0.0262379429248043	0.124439792128738	country	NN	press_reviews	press	B	B	B14	B	Z	Z	Z	Z	Z	 particular type of music or the music of a given <font color=green>country</font> . It is commendable that a regularly scheduled hour is set	NN	informative	2	3	0.96	1.5	9	country
country/NN/br-c15/2033	-0.0303191483429923	0.233325922442578	country	NN	press_reviews	press	A1	A	A	A	Z	Z	Z	Z	Z	 buoys in dozens of frostbite races. Some pleasant fall cruising <font color=green>country</font>  is mapped out below. Pleasure boating is just scooting into	NN	informative	3	0	1.49	0	7	country
country/NN/br-c15/2317	-0.264052039140416	0.182957167348181	country	NN	press_reviews	press	B1	B	B14	B	Z	Z	Z	Z	Z	 fishing in the Brazos) or pushing eastward to the pirate <font color=green>country</font>  of Barataria. Off Grand Isle, yachters often visit the towering	NN	informative	3	0	1.34	0	2	country
country/NN/br-d03/1224	0.0382952510927841	-0.0598420788695006	country	NN	religion	non-fiction	B4	B	B14	B	country%1:14:01::	B	B	BB2	B	 seems no longer very meaningful to call England a`` Protestant <font color=green>country</font> ''. One of the ironies of the present crusade for Christian	NN	informative	2	2	1.26	1	7	country
country/NN/br-d03/1509	-0.062006103035676	-0.110058918975231	country	NN	religion	non-fiction	B4	B	B14	B	country%1:14:01::	B	B	BB2	B	 Faith of our Fathers: Mary 's prayers/ Shall win our <font color=green>country</font>  back to thee''. The English saints are widely venerated, quite	NN	informative	3	1	1.56	0.33	6	country
country/NN/br-d03/249	-0.0158162425786759	-0.0395500473240999	country	NN	religion	non-fiction	B4	B	B14	B	country%1:14:01::	B	B	BB2	B	 century literature of England, I knew only a Protestant dominated <font color=green>country</font> . Since arriving here, however, I have formed a far different	NN	informative	3	3	1.26	1	7	country
country/NN/br-d06/2068	-0.00364162672284695	0.0698875635021532	country	NN	religion	non-fiction	B4	B	B14	B	Z	Z	Z	Z	Z	 are more important than worshipping the God who made our <font color=green>country</font>  great. Is forgiveness of past sins, assurance of present help	NN	informative	2	1	1.16	0.5	8	country
country/NN/br-d07/523	-0.0312579073629575	0.11562242265908	country	NN	religion	non-fiction	B	B	B14	B	Z	Z	Z	Z	Z	 are tearing us apart. A visitor from a more peaceful <font color=green>country</font>  across the sea was taken to one of our amusement	NN	informative	4	1	1.28	0.25	6	country
country/NN/br-d10/1879	0.0460289436605443	0.0404299105702375	country	NN	religion	non-fiction	B4	B	B14	B	Z	Z	Z	Z	Z	 the secularists are less disposed to compromise. And in this <font color=green>country</font>  Gustave Weigel 's delineation of the line between the sacral	NN	informative	4	1	0.92	0.25	5	country
country/NN/br-d11/1770	0.0332420712608298	0.103504099296726	country	NN	religion	non-fiction	B1	B	B14	B	Z	Z	Z	Z	Z	 would far rather die after a Russian occupation of this <font color=green>country</font> - by some deliberate act of refusal- than die uselessly by	NN	informative	1	1	1.47	1	7	country
country/NN/br-d12/128	0.0863075385657449	0.0051904561667109	country	NN	religion	non-fiction	B4	B	B14	B	Z	Z	Z	Z	Z	 for the human aspirations of racial minority groups in this <font color=green>country</font> . It is not surprising that, as spokesman for real estate	NN	informative	3	3	1.42	1	10	country
country/NN/br-d14/653	0.0865708758887949	0.0507634410823324	country	NN	religion	non-fiction	B4	B	B14	B	Z	Z	Z	Z	Z	 ways in which it helped shape the ideals of the <font color=green>country</font>  and of the manner in which it stimulated efforts to	NN	informative	1	0	1.37	0	8	country
country/NN/br-d14/68	0.0662274611085029	-8.90427071583014e-05	country	NN	religion	non-fiction	B	B	B14	B	Z	Z	Z	Z	Z	 the social, economic, and political life and institutions of the <font color=green>country</font> ? A complete picture is impossible- partly because of the limitations	NN	informative	4	3	0.82	0.75	9	country
country/NN/br-d14/772	0.285176319678935	-0.323216482369576	country	NN	religion	non-fiction	B4	B	B14	B	Z	Z	Z	Z	Z	 the Protestantism of the nineteenth-century immigration. The ideals of the <font color=green>country</font>  were deeply indebted to the Protestantism of the older stock	NN	informative	3	3	2.36	1	5	country
country/NN/br-d17/1276	-0.146912180739104	0.0578321776030334	country	NN	religion	non-fiction	B1	B	B14	B	Z	Z	Z	Z	Z	 during surgery, we asked others to pray; all over the <font color=green>country</font>  a massive shield of prayer was thrown around him. Today	NN	informative	4	3	1.85	0.75	8	country
country/NN/br-d17/859	0.113228480164218	-0.052651226029754	country	NN	religion	non-fiction	B4	B	B14	B	Z	Z	Z	Z	Z	 into schools the spiritual and moral values on which this <font color=green>country</font>  was built. Thousands of free copies are sent each month	NN	informative	4	4	1.32	1	8	country
country/NN/br-d17/983	-0.0042530979386199	0.0531995200546502	country	NN	religion	non-fiction	B1	B	B14	B	Z	Z	Z	Z	Z	 in spiritual stories, my roving editors cover not only the <font color=green>country</font> , but the whole world. Glenn Kittler has been twice to	NN	informative	3	3	0.85	1	7	country
country/NN/br-e03/1334	0.0601298604661092	0.04977889038668	country	NN	skill_and_hobbies	non-fiction	B1	B	B14	B	Z	Z	Z	Z	Z	 could use all the small airfields we have in this <font color=green>country</font> , we could disperse our strategic aircraft by a factor of	NN	informative	4	2	1.1	0.5	7	country
country/NN/br-e06/1085	0.171738655018687	0.00995591714790928	country	NN	skill_and_hobbies	non-fiction	B1	B	B14	B	Z	Z	Z	Z	Z	 making life easier for the growing boating population of the <font color=green>country</font> ; and to making the owning of a boat simpler. There	NN	informative	2	2	1.18	1	7	country
country/NN/br-e06/952	0.0165414746486575	0.0403211050606373	country	NN	skill_and_hobbies	non-fiction	B3	B	B23	B	Z	Z	Z	Z	Z	 comes to boats and their motors, Americans excel over any <font color=green>country</font>  in the world in the long run. Russia, whose technology	NN	informative	3	2	1.24	0.67	7	country
country/NN/br-e12/1062	-0.0911311986962729	0.0493734020209073	country	NN	skill_and_hobbies	non-fiction	A1	A	A	A	Z	Z	Z	Z	Z	 museums. In contrast are the vast open stretches of ranch <font color=green>country</font>  and oil wells. In San Antonio visit the famous Alamo	NN	informative	5	4	1.36	0.8	8	country
country/NN/br-e12/1718	0.0775500320303147	0.300945480989896	country	NN	skill_and_hobbies	non-fiction	A1	A	A	A	Z	Z	Z	Z	Z	 hatched his boyish mischief. Similarly in Illinois there is Lincoln <font color=green>country</font>  to be seen- his tomb and other landmarks. Minnesota, fabled	NN	informative	3	2	1.28	0.67	7	country
country/NN/br-e12/175	0.176468881429734	0.289068740822567	country	NN	skill_and_hobbies	non-fiction	B1	B	B14	B	Z	Z	Z	Z	Z	 this special U. S. A. vacation feature. We divided the <font color=green>country</font>  into five regions plus Hawaii and Alaska and in each	NN	informative	2	2	1.62	1	6	country
country/NN/br-e12/2274	-0.214327567459527	0.477175591120186	country	NN	skill_and_hobbies	non-fiction	A	A	A	A	Z	Z	Z	Z	Z	 formations of eroded rock which loom out of the semiarid <font color=green>country</font>  in both parks. Colorado 's Grand Canyon, probably the most	NN	informative	4	1	2.1	0.25	2	country
country/NN/br-e12/31	0.0260548244738229	0.00666505716245659	country	NN	skill_and_hobbies	non-fiction	B1	B	B14	B	Z	Z	Z	Z	Z	 textbook description alone, the overwhelming space and variety of this <font color=green>country</font>  held together under one government. The miracle of democratic America	NN	informative	6	5	1.44	0.83	9	country
country/NN/br-e12/351	-0.17686326001399	0.160156690839192	country	NN	skill_and_hobbies	non-fiction	A1	A	A	A	Z	Z	Z	Z	Z	 or to Lancaster, Pa., the center of the Pennsylvania Dutch <font color=green>country</font> ; Philadelphia with its historic buildings and nearby Valley Forge; to	NN	informative	2	2	1.62	1	6	country
country/NN/br-e17/338	0.18993230807202	0.144714728825373	country	NN	skill_and_hobbies	non-fiction	B1	B	B14	B	Z	Z	Z	Z	Z	 that building codes and regulations vary so much throughout the <font color=green>country</font> , the first thing to do is to find out what	NN	informative	4	3	1.45	0.75	6	country
country/NN/br-e18/632	0.0263165032912112	0.0931950014631261	country	NN	skill_and_hobbies	non-fiction	B1	B	B14	B	Z	Z	Z	Z	Z	 Newburyport was the inventor of the arched bridges in this <font color=green>country</font> . As Mr. Palmer was educated to house-building only, and had	NN	informative	3	1	1.38	0.33	7	country
country/NN/br-e20/6	-0.13428709555615	0.0954481243964829	country	NN	skill_and_hobbies	non-fiction	B1	B	B14	B	Z	Z	Z	Z	Z	 Draw a line across the <font color=green>country</font>  at the latitude of lower Pennsylvania. Any house built now	NN	informative	3	2	1.03	0.67	7	country
country/NN/br-e28/1281	0.0140120615278401	0.0428444604184537	country	NN	skill_and_hobbies	non-fiction	B1	B	B14	B	country%1:15:00::	B1	B	B1	B	 some benefit they can share? In one company covering the <font color=green>country</font>  with a high quality sales force of 10 men, the	NN	informative	2	2	0.94	1	8	country
country/NN/br-e29/1920	0.0100568212122579	-0.0190028647953218	country	NN	skill_and_hobbies	non-fiction	B1	B	B14	B	country%1:15:00::	B1	B	B1	B	 a candidate. Since there are almost no schools in the <font color=green>country</font>  offering graduate work in interior design this rule cannot at	NN	informative	2	1	0.67	0.5	9	country
country/NN/br-e31/1795	-0.0305122766125451	0.0814073074667971	country	NN	skill_and_hobbies	non-fiction	B4	B	B14	B	country%1:15:00::;1:14:00::	B1	B	B1	B	 and( 6) more education. The more people learn about their <font color=green>country</font> , the more they want to learn. Camping is family fun	NN	informative	3	4	1.01	1.33	7	country
country/NN/br-f03/2248	-0.195276162800178	0.0302431646728876	country	NN	popular_lore	fiction	A	A	A	A	country%1:15:01::	A	A	A	A	 the convention, Depew was seated on the porch of a <font color=green>country</font>  home on the Hudson, gazing at the opposite shore.	NN	informative	4	4	1.87	1	7	country
country/NN/br-f04/177	-0.118519164097107	0.111096894171382	country	NN	popular_lore	fiction	B1	B	B14	B	Z	Z	Z	Z	Z	 region of some of the loveliest mountain scenery in the <font color=green>country</font> , the school buildings are located amid open fields and farm	NN	informative	6	4	1.59	0.67	8	country
country/NN/br-f04/202	-0.0825652116768512	0.0903523363246162	country	NN	popular_lore	fiction	A	A	A	A	Z	Z	Z	Z	Z	 These contemporary structures, beautifully adapted to a school in the <font color=green>country</font> , are home to 60 children, ages eight to fourteen, grades	NN	informative	3	2	1.67	0.67	8	country
country/NN/br-f05/2164	-0.137115246538501	0.202137015173045	country	NN	popular_lore	fiction	B1	B	B14	B	Z	Z	Z	Z	Z	 stubby plane as their link with the rest of the <font color=green>country</font> . The flyer had his share of near-misses. At Fort Ethan	NN	informative	3	2	1.35	0.67	5	country
country/NN/br-f09/1740	0.00697945875199645	0.149758562233043	country	NN	popular_lore	fiction	B1	B	B14	B	Z	Z	Z	Z	Z	 taken the passport so that Diane could n't leave the <font color=green>country</font>  without his approval. Officials provided a temporary passport, good only	NN	informative	3	1	0.99	0.33	8	country
country/NN/br-f09/444	0.172922084176023	0.123073148103232	country	NN	popular_lore	fiction	B1	B	B14	B	Z	Z	Z	Z	Z	 parts of Europe and Egypt and finally back into this <font color=green>country</font> . She has been acting as a prostitute.`` Our information is	NN	informative	3	1	1.22	0.33	5	country
country/NN/br-f11/1531	0.192155058974815	0.204048124204742	country	NN	popular_lore	fiction	B1	B	B14	B	Z	Z	Z	Z	Z	 a complete full-banded job differs in various parts of the <font color=green>country</font> . Work that might cost$ 500 to$ 750 in the South	NN	informative	3	1	1.23	0.33	5	country
country/NN/br-f13/1645	0.0621101740750768	0.100672690054992	country	NN	popular_lore	fiction	A	A	A	A	country%1:15:01::	A	A	A	A	 a neighborhood of well-kept homes. There are slums in the <font color=green>country</font>  as well as in the city. Few rural areas are	NN	informative	5	4	0.93	0.8	7	country
country/NN/br-f13/637	0.0151290210646758	0.184970756572463	country	NN	popular_lore	fiction	A	A	A	A	country%1:15:01::	A	A	A	A	 Generally, the same level of living costs less in the <font color=green>country</font>  than in the city. The savings are not as great	NN	informative	3	3	1.13	1	6	country
country/NN/br-f15/2048	0.0400746118040361	0.00276111724302101	country	NN	popular_lore	fiction	B1	B	B14	B	country%1:14:00::	B2	B	BB2	B	 translated into action by the majority of people in this <font color=green>country</font> . Repeated polls have disclosed that most married couples are now	NN	informative	4	3	1.82	0.75	8	country
country/NN/br-f15/235	0.0448198502175564	0.0132266339837788	country	NN	popular_lore	fiction	B4	B	B14	B	country%1:14:00::	B2	B	BB2	B	 more tension, rancor and strife among religious groups in this <font color=green>country</font>  than the birth-control issue. It has flared up periodically on	NN	informative	3	2	0.98	0.67	6	country
country/NN/br-f17/2140	0.0947241200207378	0.229168635650143	country	NN	popular_lore	fiction	A1	A	A	A	country%1:15:02::	A1	A	A	A	 three men to cart goods to them from the Mississippi <font color=green>country</font> . Others carried pemmican from`` the Forks'' to St. Paul and	NN	informative	4	2	1.44	0.5	4	country
country/NN/br-f18/2329	-0.0393068554407596	0.208678662283383	country	NN	popular_lore	fiction	B1	B	B14	B	country%1:15:00::	B1	B	B1	B	 have been satisfied to have staid at home when my <font color=green>country</font>  is invaded by a thievin foe By a set of	NN	informative	3	1	0.75	0.33	7	country
