id	model.x	model.y	lemma	pos	genre	broadGenre	marisense	mbroad	mari3	mari2	sensekey	wnsense	wnbroad	wn3	wn2	text	newPos	newBroadGenre	cues	cuesWithWeight	meanWeight	weightedCuesRatio	weightedCW	wf
church/NNS/br-a10/1984	-0.00219209197015897	-0.0252149458198204	church	NNS	press_reportage	press	C	C	C	CDE	Z	Z	Z	Z	Z	 means, all existing Assemblies of God churches to start new <font color=green>churches</font> . Engaging mature, experienced men to pioneer or open new churches	NNS	informative	6	4	3.06	0.67	9	churches
church/NNS/br-a10/1996	0.0237954711105106	-0.0156351055483537	church	NNS	press_reportage	press	C	C	C	CDE	Z	Z	Z	Z	Z	 churches. Engaging mature, experienced men to pioneer or open new <font color=green>churches</font>  in strategic population centers. Surrounding pioneer pastors with vocational volunteers	NNS	informative	7	3	3.17	0.43	10	churches
church/NNS/br-a10/2051	-0.127640753047386	-0.121307320124315	church	NNS	press_reportage	press	C	C	C	CDE	Z	Z	Z	Z	Z	 to spend from 6- 12 months as apprentices in well-established <font color=green>churches</font> . U. S. Dist. Judge Charles L. Powell denied all motions	NNS	informative	2	0	2.18	0	5	churches
church/NNS/br-a31/1753	0.0372986788919795	0.0369187195790866	church	NNS	press_reportage	press	C	C	C	CDE	Z	Z	Z	Z	Z	 Auditorium may be set up soon. And to encourage other <font color=green>churches</font>  to try their own programs, Kern said this Sunday 's	NNS	informative	3	2	1.04	0.67	8	churches
church/NNS/br-a31/1806	-0.00154076565877269	-0.00478863585850032	church	NNS	press_reportage	press	D	D	DE	CDE	Z	Z	Z	Z	Z	 special services marking National Christian Family Week in Miami area <font color=green>churches</font>  next week. Of particular meaning to the Charles MacWhorter family	NNS	informative	4	3	1.78	0.75	12	churches
church/NNS/br-b12/2243	-0.000975565993106432	-0.0530780054920563	church	NNS	press_editorial	press	B	B	AB	AB	Z	Z	Z	Z	Z	 Union, Baptist Union, Presbyterian Church of England, Churches in Wales, <font color=green>Churches</font>  in Ireland, Society of Friends, British and Foreign Bible Society	NNPS	informative	2	0	2.73	0	6	Churches
church/NNS/br-b22/1233	0.0622211927735312	-0.124517041436277	church	NNS	press_editorial	press	B	B	AB	AB	Z	Z	Z	Z	Z	 of five Catholic theologians to attend the World Council of <font color=green>Churches</font>  assembly in New Delhi as`` official'' observers reverses the Church	NNPS	informative	5	2	2.9	0.4	6	Churches
church/NNS/br-b22/1326	0.102138136503287	-0.230245644927876	church	NNS	press_editorial	press	B	B	AB	AB	Z	Z	Z	Z	Z	 pervades the Church 's stance toward the Protestant and Orthodox <font color=green>Churches</font> . Noting all the difficulties that stand in the way of	NNPS	informative	2	1	2.7	0.5	5	Churches
church/NNS/br-c08/1853	0.0279145300000267	-0.0422460899000675	church	NNS	press_reviews	press	C	C	C	CDE	Z	Z	Z	Z	Z	 the early jazz forms and the music of the Negro <font color=green>churches</font> . To help him on this religious aspect of primitive jazz	NNS	informative	4	3	2.06	0.75	8	churches
church/NNS/br-d03/1011	0.229099642372342	-0.0974406071469067	church	NNS	religion	non-fiction	D	D	DE	CDE	church%1:06:00::	D	D	DE	CDE	 often, the sale of 764 chapels''. Most of these former <font color=green>churches</font>  are now used as warehouses, but`` neither Anglicans nor Nonconformists	NNS	informative	3	1	1.24	0.33	4	churches
church/NNS/br-d03/1027	0.0830812797751557	-0.239581676309513	church	NNS	religion	non-fiction	D	D	DE	CDE	church%1:06:00::	D	D	DE	CDE	 as warehouses, but`` neither Anglicans nor Nonconformists object to selling <font color=green>churches</font>  to Roman Catholics'', and have done so. While it must	NNS	informative	2	1	2.61	0.5	5	churches
church/NNS/br-d03/1051	0.044650408923424	-0.0245754447112263	church	NNS	religion	non-fiction	D	D	DE	CDE	church%1:06:00::	D	D	DE	CDE	 be said that these same Protestants have built some new <font color=green>churches</font>  during this period, and that religious population shifts have emptied	NNS	informative	4	4	2.19	1	8	churches
church/NNS/br-d03/1063	0.0703371698974853	-0.0371754114904256	church	NNS	religion	non-fiction	C	C	C	CDE	church%1:06:00::	D	D	DE	CDE	 during this period, and that religious population shifts have emptied <font color=green>churches</font> , a principal reason for this phenomenon of redundancy is that	NNS	informative	5	4	2.61	0.8	8	churches
church/NNS/br-d03/110	0.0227566068159534	-0.0236413900624196	church	NNS	religion	non-fiction	C	C	C	CDE	church%1:14:00::	B	B	AB	AB	 was enthusiastically devoted to prayer and discussion by the various <font color=green>churches</font> . Many people seem hopeful, yet it is difficult to predict	NNS	informative	5	5	1.86	1	9	churches
church/NNS/br-d03/1472	0.00516993161755356	-0.212058874966835	church	NNS	religion	non-fiction	E	E	DE	CDE	church%1:06:00::	D	D	DE	CDE	 thy Son''. A hymn often to be heard in Catholic <font color=green>churches</font>  is`` Faith of our Fathers'', which glories in England 's	NNS	informative	3	2	1.54	0.67	4	churches
church/NNS/br-d03/1884	0.0151094901673323	-0.121060382804677	church	NNS	religion	non-fiction	B	B	AB	AB	church%1:14:00::	B	B	AB	AB	 at least of equal stature in England with the Protestant <font color=green>churches</font> . On successive Sundays during October, 1960, Paul Ferris( a non-Catholic	NNS	informative	2	2	2.47	1	8	churches
church/NNS/br-d03/313	0.0385793691166848	-0.0915092652415625	church	NNS	religion	non-fiction	B	B	AB	AB	anglican_church%1:14:00::	B2	B	AB	AB	 saying and writing and implying about the Roman and Anglican <font color=green>Churches</font>  and about the present religious state of England. Since the	NNPS	informative	5	4	1.78	0.8	7	Churches
church/NNS/br-d03/35	0.0473538450801478	-0.108818296790646	church	NNS	religion	non-fiction	B	B	AB	AB	anglican_church%1:14:00::	B2	B	AB	AB	 efforts of only unauthorized individuals of the Roman and Anglican <font color=green>Churches</font> , and urging a communion of prayer unacceptable to Rome, this	NNPS	informative	5	3	2.66	0.6	7	Churches
church/NNS/br-d03/779	0.0124616450813535	-0.130183951377095	church	NNS	religion	non-fiction	D	D	DE	CDE	church%1:06:00::	D	D	DE	CDE	 less than ten. From many sides come remarks that Protestant <font color=green>churches</font>  are badly attended and the large medieval cathedrals look all	NNS	informative	4	3	2.45	0.75	8	churches
church/NNS/br-d03/849	0.0362275452194422	-0.0414763047415541	church	NNS	religion	non-fiction	C	C	C	CDE	church%1:06:00::	D	D	DE	CDE	 admit the great falling off in effective membership in their <font color=green>churches</font> . According to a newspaper report of the 1961 statistics of	NNS	informative	2	2	2.22	1	8	churches
church/NNS/br-d03/929	-0.0218935909660351	-0.15242477499131	church	NNS	religion	non-fiction	C	C	C	CDE	church%1:06:00::	D	D	DE	CDE	 the Manchester Guardian of last November, entitled`` Fate of Redundant <font color=green>Churches</font> '', states than an Archbishops' Commission`` reported last month that in	NNPS	informative	2	0	2.42	0	6	Churches
church/NNS/br-d03/952	-0.030320757842034	-0.0800838270288826	church	NNS	religion	non-fiction	C	C	C	CDE	church%1:06:00::	D	D	DE	CDE	 that in the Church of England alone there are 790 <font color=green>churches</font>  which are redundant now, or will be in 20 years	NNS	informative	3	2	2.11	0.67	4	churches
church/NNS/br-d03/971	0.0255314358705818	0.191719868458296	church	NNS	religion	non-fiction	D	D	DE	CDE	church%1:06:00::	D	D	DE	CDE	 will be in 20 years' time. A further 260 Anglican <font color=green>churches</font>  have been demolished since 1948''. And in the last five	NNS	informative	1	0	1.1	0	1	churches
church/NNS/br-d05/1536	0.177485189088141	-0.110228560901812	church	NNS	religion	non-fiction	C	C	C	CDE	Z	Z	Z	Z	Z	 descended from the founders( among which were still the Unitarian <font color=green>churches</font> ), made explicit from the beginning that the conflict between him	NNS	informative	1	0	1.85	0	5	churches
church/NNS/br-d05/1935	-0.240220596736747	0.300878552051959	church	NNS	religion	non-fiction	C	C	C	CDE	Z	Z	Z	Z	Z	 his colleagues know that he intended them:`` Even the Unitarian <font color=green>churches</font>  have caught the malaria, and are worse than those who	NNS	informative	2	0	2.16	0	2	churches
church/NNS/br-d09/1216	0.0527130496863448	-0.0234786892906433	church	NNS	religion	non-fiction	C	C	C	CDE	Z	Z	Z	Z	Z	 membership training, since this is a recent development in many <font color=green>churches</font> . Those coming from other denominations will welcome the opportunity to	NNS	informative	3	2	1.82	0.67	8	churches
church/NNS/br-d09/181	0.0336504313873945	-0.0646197996988167	church	NNS	religion	non-fiction	C	C	C	CDE	Z	Z	Z	Z	Z	 life of the Church. Neglect means spiritual paralysis or death. <font color=green>Churches</font>  that have a carefully planned program of membership preparation and	NNPS	informative	4	3	1.93	0.75	8	Churches
church/NNS/br-d09/1910	0.029079514270107	-0.0251093492693789	church	NNS	religion	non-fiction	C	C	C	CDE	Z	Z	Z	Z	Z	 This problem is illustrated by the fact that many local <font color=green>churches</font>  drop from the active membership rolls each year as many	NNS	informative	4	3	1.99	0.75	7	churches
church/NNS/br-d09/559	-0.00142136215025219	-0.0174307301529241	church	NNS	religion	non-fiction	C	C	C	CDE	Z	Z	Z	Z	Z	 devotion to it if membership requires something of them. Many <font color=green>churches</font>  find the Sunday school hour to be the most practical	NNS	informative	4	3	1.52	0.75	13	churches
church/NNS/br-d09/891	0.0424387798382009	-0.00589255239281957	church	NNS	religion	non-fiction	C	C	C	CDE	Z	Z	Z	Z	Z	 have been found effective. Extend the number of classes. Some <font color=green>churches</font>  have six or more training sessions of two hours each	NNS	informative	3	3	1.84	1	8	churches
church/NNS/br-d10/2114	0.0690327358297294	-0.0524370479650419	church	NNS	religion	non-fiction	B	B	AB	AB	Z	Z	Z	Z	Z	 Newbiggin reflects the dominant position within the World Council of <font color=green>Churches</font>  when he says,`` We must claim absoluteness and finality for	NNPS	informative	2	1	2.16	0.5	6	Churches
church/NNS/br-d10/305	0.0413351644314157	0.235976081637008	church	NNS	religion	non-fiction	C	C	C	CDE	Z	Z	Z	Z	Z	 may have a certain justification, we ought to dispense with <font color=green>churches</font> . The suggestion is naive. Man is at once a gregarious	NNS	informative	1	0	1	0	5	churches
church/NNS/br-d14/1926	0.158968835217069	-0.193048640361266	church	NNS	religion	non-fiction	B	B	AB	AB	Z	Z	Z	Z	Z	 John Greenleaf Whittier( 1807- 1892) he eventually attacked the orthodox <font color=green>churches</font>  for what he deemed their cowardly compromising on the slavery	NNS	informative	2	1	3.54	0.5	5	churches
church/NNS/br-d14/199	-0.00377643829199851	-0.057336733925188	church	NNS	religion	non-fiction	C	C	C	CDE	Z	Z	Z	Z	Z	 proportion, although in 1914 still a minority, were members of <font color=green>churches</font> . Presumably those who did not have a formal church connexion	NNS	informative	2	1	2.24	0.5	7	churches
church/NNS/br-d14/457	0.0429803446948162	-0.035376423318351	church	NNS	religion	non-fiction	C	C	C	CDE	Z	Z	Z	Z	Z	 church members mounted, the degree of discipline exercised by the <font color=green>churches</font>  lessened and the trend was towards conformity to the general	NNS	informative	3	2	2.6	0.67	7	churches
church/NNS/br-d14/507	0.0486232538522867	-0.0826121195121801	church	NNS	religion	non-fiction	C	C	C	CDE	Z	Z	Z	Z	Z	 the ethical codes to which the majority subscribed. Thus Baptist <font color=green>churches</font>  on the frontier took cognizance of charges against their members	NNS	informative	3	2	2.69	0.67	9	churches
church/NNS/br-d17/569	0.0464748121536345	-0.0200939162419712	church	NNS	religion	non-fiction	C	C	C	CDE	Z	Z	Z	Z	Z	 one of my editorial workers wanted to find out how <font color=green>churches</font>  and philanthropic organizations met the needs of New York 's	NNS	informative	2	1	1.55	0.5	8	churches
church/NNS/br-e13/808	0.158275299092921	-0.0743038524030625	church	NNS	skill_and_hobbies	non-fiction	D	D	DE	CDE	Z	Z	Z	Z	Z	 fell in. Nevertheless, it remained one of the most splendid <font color=green>churches</font>  of the Eastern Empire, where the Byzantine Emperors were crowned	NNS	informative	2	1	2.12	0.5	6	churches
church/NNS/br-f15/1425	0.136757073002453	-0.18848238918067	church	NNS	popular_lore	fiction	B	B	AB	AB	christian_church%1:14:00::	B	B	AB	AB	 turn of the century, contraception was condemned by all Christian <font color=green>churches</font>  as immoral, unnatural and contrary to divine law. This was	NNS	informative	5	1	3.21	0.2	5	churches
church/NNS/br-f15/1455	0.0251168481225043	-0.0633373007975871	church	NNS	popular_lore	fiction	B	B	AB	AB	orthodox_church%1:14:00::	B1	B	AB	AB	 laws of Christian countries. Today, the Roman Catholic and Orthodox <font color=green>Churches</font>  stand virtually alone in holding that conviction. The various Lambeth	NNPS	informative	5	5	2.59	1	12	Churches
church/NNS/br-f15/1720	0.0402869128298182	-0.04801725691939	church	NNS	popular_lore	fiction	B	B	AB	AB	group%1:03:00::	C	C	C	CDE	 28 members of a committee of the Federal Council of <font color=green>Churches</font>  ratified artificial methods of birth control.`` As to the necessity	NNPS	informative	4	2	2.44	0.5	7	Churches
church/NNS/br-f15/1944	-0.0151371060074785	-0.0441545840552335	church	NNS	popular_lore	fiction	B	B	AB	AB	church%1:14:00::	B	B	AB	AB	 of contraceptives. The general board declared:`` Most of the Protestant <font color=green>churches</font>  hold contraception and periodic continence to be morally right when	NNS	informative	4	3	1.86	0.75	7	churches
church/NNS/br-f15/1998	0.0540477595337786	-0.106289654330871	church	NNS	popular_lore	fiction	B	B	AB	AB	christian_church%1:14:00::	B	B	AB	AB	 of conception''. An action once universally condemned by all Christian <font color=green>churches</font>  and forbidden by the civil law is now not only	NNS	informative	2	2	2.08	1	9	churches
church/NNS/br-f15/824	0.0839908711409641	-0.155949735973332	church	NNS	popular_lore	fiction	B	B	AB	AB	church%1:14:00::	B	B	AB	AB	 of the Roman Catholic and the Orthodox Catholic Churches, most <font color=green>churches</font>  make no moral distinction between rhythm and mechanical or chemical	NNS	informative	5	6	3.61	1.2	11	churches
church/NNS/br-f44/1106	0.118387197967172	-0.0529594965603336	church	NNS	popular_lore	fiction	C	C	C	CDE	church%1:14:00::	B	B	AB	AB	 who will strengthen the social class nucleus of the congregation. <font color=green>Churches</font>  can be strengthened through this process of co-optation so long	NNPS	informative	5	4	2.47	0.8	6	Churches
church/NNS/br-f44/1189	0.00978845106078959	-0.0390508840243521	church	NNS	popular_lore	fiction	C	C	C	CDE	church%1:14:00::	B	B	AB	AB	 and publicity in reaching new members. The proclamation of the <font color=green>churches</font>  is almost totally confined to pastoral contacts by the clergy	NNS	informative	7	5	2.48	0.71	8	churches
church/NNS/br-f44/1427	0.0558782210358989	-0.0335698340181513	church	NNS	popular_lore	fiction	C	C	C	CDE	church%1:14:00::	B	B	AB	AB	 for more than a single generation. The fact that metropolitan <font color=green>churches</font>  of the major denominations have moved approximately every generation for	NNS	informative	4	4	2.43	1	10	churches
church/NNS/br-f44/1683	0.175846314039064	-0.138513928744021	church	NNS	popular_lore	fiction	C	C	C	CDE	church%1:14:00::	B	B	AB	AB	 hopelessly unstable environment. More than creatures of metropolitan forces, the <font color=green>churches</font>  have taken the lead in counteracting the interdependence of metropolitan	NNS	informative	2	2	2.66	1	7	churches
church/NNS/br-f44/1918	0.0874065993048948	-0.101639733216442	church	NNS	popular_lore	fiction	C	C	C	CDE	church%1:14:00::	B	B	AB	AB	 of middle-class culture could lead to various projections for the <font color=green>churches</font> . It could be argued that any fellowship which centers in	NNS	informative	3	3	2.69	1	6	churches
church/NNS/br-f44/2015	0.0939517244031744	-0.13178687510135	church	NNS	popular_lore	fiction	C	C	C	CDE	church%1:14:00::	B	B	AB	AB	 next chapter to the style of association in the denominational <font color=green>churches</font> ; this style is characteristically an expression of the communal style	NNS	informative	3	1	2.31	0.33	5	churches
church/NNS/br-f44/2181	-0.0407644142781104	0.097810922581726	church	NNS	popular_lore	fiction	C	C	C	CDE	church%1:14:00::	B	B	AB	AB	 have fashioned the iron cage of conformity which imprisons the <font color=green>churches</font>  in their suburban captivity. The perplexing question still remains as	NNS	informative	2	1	1.91	0.5	5	churches
church/NNS/br-f44/343	0.146733473507013	-0.107018012173391	church	NNS	popular_lore	fiction	C	C	C	CDE	church%1:14:00::	B	B	AB	AB	 moreover, residential mobility is so high in metropolitan areas that <font color=green>churches</font>  have to recruit constantly in their core stratum in order	NNS	informative	5	3	2.34	0.6	8	churches
church/NNS/br-f44/868	0.0234289468341735	-0.171531327760474	church	NNS	popular_lore	fiction	C	C	C	CDE	church%1:14:00::	B	B	AB	AB	 and congregational outreach have not been carefully studied in the <font color=green>churches</font> ; one study in Pittsburgh, however, has illuminated the situation. In	NNS	informative	2	1	2.38	0.5	7	churches
church/NNS/br-k01/769	-0.27084646356944	0.103442838399255	church	NNS	fiction_gral	fiction	D	D	DE	CDE	church%1:06:00::	D	D	DE	CDE	 It was a Negro section of peeling row houses, store-front <font color=green>churches</font>  and ragged children. Rachel had to bend toward Scotty and	NNS	imaginative	2	1	1.91	0.5	5	churches
church/NNS/br-k04/2307	-0.0375243949556802	-0.196159598292751	church	NNS	fiction_gral	fiction	B	B	AB	AB	church%1:06:00::	D	D	DE	CDE	 his career in the Methodist church, if not in all <font color=green>churches</font> .	NNS	imaginative	2	0	2.48	0	2	churches
church/NNS/br-k06/1925	-0.223898496270345	0.273889243153504	church	NNS	fiction_gral	fiction	D	D	DE	CDE	church%1:06:00::	D	D	DE	CDE	 them open. Lightning might strike the steeples of the other <font color=green>churches</font> ; not of Drew Church. A flash illumined the trees as	NNS	imaginative	2	0	2.21	0	5	churches
country/NN/br-a04/1253	0.0918036297505955	-0.0742450475664552	country	NN	press_reportage	press	B4	B	B14	B	Z	Z	Z	Z	Z	 that he agreed to the need for unity in the <font color=green>country</font>  now. But he further said that it was better politics	NN	informative	2	1	0.7	0.5	5	country
country/NN/br-a05/1184	0.00822397815469389	0.0218993784793001	country	NN	press_reportage	press	B4	B	B14	B	Z	Z	Z	Z	Z	 Sheraton-Biltmore Hotel that about half of the people in the <font color=green>country</font>  want the`` welfare'' type of government and the other half	NN	informative	4	4	0.88	1	6	country
country/NN/br-a06/106	-0.250751426770965	-0.0556078232806022	country	NN	press_reportage	press	A	A	A	A	Z	Z	Z	Z	Z	 Westfield Young Democratic Club cocktail party at the Scotch Plains <font color=green>Country</font>  Club. It was greeted with a chorus of boos by	NNP	informative	4	3	2.35	0.75	5	Country
country/NN/br-a07/1688	0.0512683301236941	0.00540100580763693	country	NN	press_reportage	press	B	B	B14	B	Z	Z	Z	Z	Z	 those countries. A committee of experts has recommended that a <font color=green>country</font>  's population be considered in the distribution of professional posts	NN	informative	2	2	1.14	1	11	country
country/NN/br-a08/443	0.0123329621514781	0.0121158920706465	country	NN	press_reportage	press	B4	B	B14	B	Z	Z	Z	Z	Z	 the National Archives building where hundreds of thousands of this <font color=green>country</font>  's most valuable records are kept. Also the department of	NN	informative	2	2	1.29	1	8	country
country/NN/br-a10/426	0.22378634216192	0.0144281833643875	country	NN	press_reportage	press	B3	B	B23	B	Z	Z	Z	Z	Z	 States must plan to absorb the exported goods of the <font color=green>country</font> , at what he termed a`` social cost''. Martin said the	NN	informative	4	3	1.41	0.75	6	country
country/NN/br-a10/460	0.0113450328608246	-0.0106696130632597	country	NN	press_reportage	press	B3	B	B23	B	Z	Z	Z	Z	Z	 primary products which may involve the total income of one <font color=green>country</font> . The Portland school board was asked Monday to take a	NN	informative	3	3	0.94	1	9	country
country/NN/br-a16/837	-0.165094296889936	-0.0320083423169574	country	NN	press_reportage	press	B1	B	B14	B	Z	Z	Z	Z	Z	 his brother would meet her at the border of that <font color=green>country</font> - so newly separated from Egypt and the United Arab Republic	NN	informative	2	2	1.46	1	6	country
country/NN/br-a17/346	-0.169463435038664	-0.0602652808652903	country	NN	press_reportage	press	A	A	A	A	Z	Z	Z	Z	Z	 will be a stag dinner Friday evening at the Denver <font color=green>Country</font>  Club which will precede the opening of the 1961 golf	NNP	informative	2	2	1.89	1	9	Country
country/NN/br-a18/1063	-0.199979754201979	-0.202774261902846	country	NN	press_reportage	press	A	A	A	A	Z	Z	Z	Z	Z	 Mrs. John Charles Cotty is chairman of publicity for the <font color=green>country</font>  fair and Mrs. Francis G. Felske and Mrs. Francis Smythe	NN	informative	1	1	1.3	1	10	country
country/NN/br-a18/24	-0.223346874245299	-0.0452381334543416	country	NN	press_reportage	press	A	A	A	A	Z	Z	Z	Z	Z	 of the Thrift Shop Committee for May 6 at Philmont <font color=green>Country</font>  Club. The women have a reputation for giving parties that	NNP	informative	3	1	1.72	0.33	6	Country
country/NN/br-a20/641	0.236299922472606	-0.216017030710266	country	NN	press_reportage	press	B2	B	B23	B	Z	Z	Z	Z	Z	 and the two civil servants the recipients for selling their <font color=green>country</font>  's secrets. The fact that secrets of the Dreadnought, and	NN	informative	3	4	2.33	1.33	5	country
country/NN/br-a26/490	-0.0651023602905898	0.0439371482518404	country	NN	press_reportage	press	B1	B	B14	B	Z	Z	Z	Z	Z	 price would be quoted regularly in newspapers all over the <font color=green>country</font> . He was also pleased with the wide distribution because he	NN	informative	5	5	1.28	1	12	country
country/NN/br-a27/436	-0.0228087824122866	0.0125456836196619	country	NN	press_reportage	press	B2	B	B23	B	Z	Z	Z	Z	Z	 the steel strike. Draper declared,`` As I see it, this <font color=green>country</font>  has never faced such great dangers as threaten us today	NN	informative	4	3	0.91	0.75	9	country
country/NN/br-a28/645	0.019554710397357	0.0331454088880458	country	NN	press_reportage	press	B3	B	B23	B	Z	Z	Z	Z	Z	 the rural recovery are being felt almost immediately by the <font color=green>country</font>  's farm equipment manufacturers. For example, farm equipment shipments of	NN	informative	3	4	1.16	1.33	12	country
country/NN/br-a29/2062	-0.222023435886864	-0.0425738294033579	country	NN	press_reportage	press	A	A	A	A	Z	Z	Z	Z	Z	 weekend they have reserved the entire Stagecoach Inn and adjoining <font color=green>country</font>  club, Saledo, for festivities. Invitations have been extended to some	NN	informative	3	1	2.5	0.33	5	country
country/NN/br-a29/2109	-0.193481710691981	-0.0592915381018427	country	NN	press_reportage	press	A	A	A	A	Z	Z	Z	Z	Z	 The get-together Friday night will be a banquet at the <font color=green>country</font>  club patio and pool, and an orchestra will play for	NN	informative	4	2	1.02	0.5	7	country
country/NN/br-a30/1777	0.223470556262315	0.104870435127361	country	NN	press_reportage	press	B1	B	B14	B	Z	Z	Z	Z	Z	 Longinotti. Newcomers of social note from other parts of the <font color=green>country</font>  are the Ray Carbones, formerly of Panama; the Geddes MacGregors	NN	informative	3	1	1.42	0.33	5	country
country/NN/br-a30/292	-0.0924325582941656	-0.037420911413307	country	NN	press_reportage	press	A	A	A	A	Z	Z	Z	Z	Z	 three-building complex. Fall foliage and flowers will decorate Los Angeles <font color=green>Country</font>  Club for the annual formal party Saturday evening. More than	NNP	informative	3	2	1.98	0.67	9	Country
country/NN/br-a30/392	-0.144575740375843	0.0493800914606094	country	NN	press_reportage	press	B1	B	B14	B	Z	Z	Z	Z	Z	 Club, guests came by chartered plane from all over the <font color=green>country</font> . A flight originating in Florida picked up guests on the	NN	informative	4	3	1.94	0.75	8	country
country/NN/br-a32/320	-0.00338092276112948	0.011532558503849	country	NN	press_reportage	press	B3	B	B23	B	Z	Z	Z	Z	Z	 today as it ever was; that its presentation in this <font color=green>country</font>  is part of a capitalist plot to boobify the American	NN	informative	4	2	1.08	0.5	9	country
country/NN/br-a33/399	0.0824313641334814	-0.06492212368929	country	NN	press_reportage	press	B1	B	B14	B	Z	Z	Z	Z	Z	 Regional representatives appointed to serve from each section of the <font color=green>country</font>  include Frank E. Barnes of Boston. President Kennedy could n't	NN	informative	3	3	1.45	1	8	country
country/NN/br-a33/754	0.0101731126078328	0.0396961094449029	country	NN	press_reportage	press	B1	B	B14	B	Z	Z	Z	Z	Z	 serious music''. He added`` I think that sometimes in this <font color=green>country</font>  we are not aware as we should be of the	NN	informative	3	2	0.72	0.67	7	country
country/NN/br-a35/813	0.0229247107428087	0.0127825753030403	country	NN	press_reportage	press	B4	B	B14	B	Z	Z	Z	Z	Z	 For while the past needs of the Church in this <font color=green>country</font>  may have been adequately met by collegiate institutions, which in	NN	informative	2	1	1.32	0.5	8	country
country/NN/br-a41/1107	0.162450939599153	0.169509194578595	country	NN	press_reportage	press	B	B	B14	B	Z	Z	Z	Z	Z	 those Congolese( among them Joseph Kasavubu) who favored splitting the <font color=green>country</font>  into small independent states, Balkanizing it. Second, there were those	NN	informative	2	2	1.39	1	6	country
