id	model.x	model.y	lemma	pos	genre	broadGenre	marisense	mbroad	mari3	mari2	sensekey	wnsense	wnbroad	wn3	wn2	text	newPos	newBroadGenre	cues	cuesWithWeight	meanWeight	weightedCuesRatio	weightedCW	wf
church/NN/br-a01/2073	-0.33984279250862	-0.00277656286976007	church	NN	press_reportage	press	E	E	DE	CDE	church%1:04:00::	E	E	DE	CDE	 said.`` Being at the polls was just like being at <font color=green>church</font> . I did n't smell a drop of liquor, and we	NN	informative	1	0	0.95	0	9	church
church/NN/br-a07/1325	0.114356363489735	-0.035624799149786	church	NN	press_reportage	press	A	A	AB	AB	Z	Z	Z	Z	Z	 the Peace Corps will be able to prevent confusion for <font color=green>church</font>  and state over methods, means and goals. There are a	NN	informative	4	4	1.1	1	9	church
church/NN/br-a10/1754	0.0842605236328264	-0.0502047587032568	church	NN	press_reportage	press	A	A	AB	AB	Z	Z	Z	Z	Z	 one out of three Americans has vital contact with the <font color=green>church</font> . This means that more than 100 million have no vital	NN	informative	1	1	1.32	1	6	church
church/NN/br-a10/1769	0.00234814760869832	-0.0414032680945451	church	NN	press_reportage	press	A	A	AB	AB	Z	Z	Z	Z	Z	 more than 100 million have no vital touch with the <font color=green>church</font>  or religious life'', he told delegates Friday. Talking of the	NN	informative	3	3	1.49	1	8	church
church/NN/br-a10/1850	0.137894567718662	0.00525692359312996	church	NN	press_reportage	press	C	C	C	CDE	Z	Z	Z	Z	Z	 adding that the denomination had a national goal of one <font color=green>church</font>  for every 10000 persons.`` In this light we need 1000	NN	informative	3	2	0.52	0.67	6	church
church/NN/br-a10/1940	0.119654877492472	-0.0465770102950679	church	NN	press_reportage	press	A	A	AB	AB	Z	Z	Z	Z	Z	 this would necessitate some changes in methods, he said.`` The <font color=green>church</font>  's ability to change her methods is going to determine	NN	informative	1	0	1.22	0	8	church
church/NN/br-a16/453	-0.194919766359947	-0.140690983451199	church	NN	press_reportage	press	D	D	DE	CDE	Z	Z	Z	Z	Z	 a small one at noon tomorrow in St. Bernadine 's <font color=green>church</font> , Forest Park. A small reception will follow in the Oak	NN	informative	4	2	1.57	0.5	6	church
church/NN/br-a17/1770	-0.236934928782222	-0.22904602730964	church	NN	press_reportage	press	D	D	DE	CDE	Z	Z	Z	Z	Z	 College of Technology, in the chapel of the First Presbyterian <font color=green>Church</font>  of Houston. The bride, daughter of Rhodes Semmes Baker Jr.	NNP	informative	2	0	2.16	0	4	Church
church/NN/br-a17/2228	-0.0623928630936856	-0.0936452696045573	church	NN	press_reportage	press	D	D	DE	CDE	Z	Z	Z	Z	Z	 Burgher Jr. seated guests. A reception was held at the <font color=green>church</font> . The First Christian Church of Pampa was the setting for	NN	informative	5	4	2.15	0.8	9	church
church/NN/br-a17/2233	-0.0542899751284944	-0.103934654716874	church	NN	press_reportage	press	D	D	DE	CDE	Z	Z	Z	Z	Z	 A reception was held at the church. The First Christian <font color=green>Church</font>  of Pampa was the setting for the wedding last Sunday	NNP	informative	4	2	1.97	0.5	8	Church
church/NN/br-a21/677	-0.0244966912803959	-0.301242089508704	church	NN	press_reportage	press	D	D	DE	CDE	Z	Z	Z	Z	Z	 for 10 a. m. tomorrow in St. Anne 's Catholic <font color=green>Church</font> , 31978 Mound, in Warren. The mother and daughter, who will	NNP	informative	4	1	2.63	0.25	4	Church
church/NN/br-a22/1206	-0.132547561617869	-0.281246039364706	church	NN	press_reportage	press	B	B	AB	AB	Z	Z	Z	Z	Z	 World War 1,. He was a member of the Baptist <font color=green>church</font> . Survivors include two brothers, C. E. Killingsworth, Atlanta, and John	NN	informative	2	1	1.79	0.5	4	church
church/NN/br-a22/1283	-0.0554004451772526	-0.255204282594625	church	NN	press_reportage	press	C	C	C	CDE	Z	Z	Z	Z	Z	 painter. He was a member of the Oakland City Methodist <font color=green>Church</font>  and a native of Atlanta. Funeral services will be at	NNP	informative	2	1	1.72	0.5	7	Church
church/NN/br-a22/310	0.0044975699560892	-0.14259786016766	church	NN	press_reportage	press	A	A	AB	AB	Z	Z	Z	Z	Z	 the state. Emory is affiliated with the Methodist Church. Some <font color=green>church</font>  leaders, both clerical and lay, have criticized the university for	NN	informative	5	1	2.9	0.2	3	church
church/NN/br-a31/1395	-0.10637864408915	-0.0203273530453026	church	NN	press_reportage	press	D	D	DE	CDE	Z	Z	Z	Z	Z	 from 4 to 8 p. m. Sunday at First Presbyterian <font color=green>Church</font> . At that time the second half of the Christian Youth	NNP	informative	5	1	1.03	0.2	8	Church
church/NN/br-a31/1542	-0.0843249979831077	0.0498856741700606	church	NN	press_reportage	press	C	C	C	CDE	Z	Z	Z	Z	Z	 he and his wife serve as advisors at First Presbyterian <font color=green>Church</font> . And he wanted to be careful that the kids not	NNP	informative	3	1	0.59	0.33	7	Church
church/NN/br-a31/1842	-0.0819553292483001	-0.248313054973518	church	NN	press_reportage	press	D	D	DE	CDE	Z	Z	Z	Z	Z	 planned for 10: 50 a. m. Sunday at First Christian <font color=green>Church</font> . It will be the second time the assistant manager of	NNP	informative	3	1	1.56	0.33	6	Church
church/NN/br-a31/2087	-0.142694372041624	-0.15304927789643	church	NN	press_reportage	press	D	D	DE	CDE	Z	Z	Z	Z	Z	 Family'' at 7: 30 p. m. Sunday at Christ Lutheran <font color=green>Church</font> . Mr. and Mrs. George Treadwell will be honored at a	NNP	informative	3	0	1.25	0	7	Church
church/NN/br-a31/2112	-0.0693631123071974	-0.158960334031872	church	NN	press_reportage	press	D	D	DE	CDE	Z	Z	Z	Z	Z	 and program at 6 p. m. Sunday at Trinity Methodist <font color=green>Church</font> . He is the sexton of the church. A family worship	NNP	informative	3	0	1.81	0	4	Church
church/NN/br-a31/2120	-0.00603599637414673	-0.0454061821522008	church	NN	press_reportage	press	D	D	DE	CDE	Z	Z	Z	Z	Z	 at Trinity Methodist Church. He is the sexton of the <font color=green>church</font> . A family worship service will follow the program at 7	NN	informative	4	2	1.74	0.5	7	church
church/NN/br-a31/2172	-0.023540843588755	-0.0155873680584788	church	NN	press_reportage	press	C	C	C	CDE	Z	Z	Z	Z	Z	 service marking National Family Week. Every family of Riviera Presbyterian <font color=green>Church</font>  has been asked to read the Bible and pray together	NNP	informative	6	6	1.09	1	12	Church
church/NN/br-a31/2212	-0.0596105518757722	-0.0355088881588652	church	NN	press_reportage	press	C	C	C	CDE	Z	Z	Z	Z	Z	 participate. To start the week of special programs at the <font color=green>church</font> , the Rev. John D. Henderson will preach on`` A Successful	NN	informative	4	2	1.28	0.5	7	church
church/NN/br-a31/2241	-0.317474026241735	-0.133908993527036	church	NN	press_reportage	press	C	C	C	CDE	Z	Z	Z	Z	Z	 40 and 11 a. m. Sunday. New officers of the <font color=green>church</font>  will be ordained and installed at the 7: 30 p.	NN	informative	4	2	1.11	0.5	3	church
church/NN/br-b08/1866	-0.0108328101397325	-0.0292699592754332	church	NN	press_editorial	press	D	D	DE	CDE	Z	Z	Z	Z	Z	 wrote after almost a decade of service to this majestic <font color=green>church</font> .`` Such a church needs vigor and vitality in its rector	NN	informative	2	0	2.03	0	7	church
church/NN/br-b08/1871	-0.0109638925526334	-0.0894231811431854	church	NN	press_editorial	press	C	C	C	CDE	Z	Z	Z	Z	Z	 a decade of service to this majestic church.`` Such a <font color=green>church</font>  needs vigor and vitality in its rector and one man	NN	informative	4	2	2.45	0.5	4	church
church/NN/br-b08/2063	0.0198197532126954	0.109203775812618	church	NN	press_editorial	press	C	C	C	CDE	Z	Z	Z	Z	Z	 gives himself to God and to the believers of his <font color=green>church</font>  takes upon himself a life of giving. He does not	NN	informative	4	1	0.92	0.25	4	church
church/NN/br-b08/2363	-0.0671280444773198	0.0102511950232883	church	NN	press_editorial	press	D	D	DE	CDE	Z	Z	Z	Z	Z	 through him. But how little love we give him. The <font color=green>church</font>  truly is not a rest home for saints, but a	NN	informative	3	2	0.96	0.67	6	church
church/NN/br-b08/834	-0.0962804472164788	0.00173602794726256	church	NN	press_editorial	press	D	D	DE	CDE	Z	Z	Z	Z	Z	 agreement. I settled it tonight'', he continued.`` I leave this <font color=green>church</font>  with a feeling that a great weight has been lifted	NN	informative	1	0	1.27	0	6	church
church/NN/br-b12/2009	-0.0473410911978732	-0.0612410718896418	church	NN	press_editorial	press	A	A	AB	AB	Z	Z	Z	Z	Z	 new version retains, however, the old phrase`` angel of the <font color=green>church</font> '' which Biblical scholars have previously interpreted as meaning bishop. This	NN	informative	4	2	1.8	0.5	8	church
church/NN/br-b12/2217	-0.0194889398405364	-0.0799598392062257	church	NN	press_editorial	press	B	B	AB	AB	Z	Z	Z	Z	Z	 of a joint committee made up of representatives of the <font color=green>Church</font>  of England, Church of Scotland, Methodist Church, Congregational Union, Baptist	NNP	informative	6	1	2.17	0.17	6	Church
church/NN/br-b15/1190	-0.393583759907307	-0.329798079932913	church	NN	press_editorial	press	C	C	C	CDE	Z	Z	Z	Z	Z	 El; Rev. DeWitt Clemens, pastor of the Mathewson Street Methodist <font color=green>Church</font> ; Mr. Felix Miranda, of the Imperial Knife Co.; and to	NNP	informative	2	1	1.78	0.5	3	Church
church/NN/br-b18/1829	0.0826976252826633	-0.101377796413429	church	NN	press_editorial	press	C	C	C	CDE	Z	Z	Z	Z	Z	 the Women 's Association of the Trumbull Ave. United Presbyterian <font color=green>Church</font> , considerable use was made of material from The Detroit News	NNP	informative	4	1	1.18	0.25	6	Church
church/NN/br-b24/1259	0.0481537972359388	-0.0103144225164091	church	NN	press_editorial	press	C	C	C	CDE	Z	Z	Z	Z	Z	 or less native. Sometimes they get their initial experience in <font color=green>church</font>  haflis, conducted by Lebanese and Syrians in the U. S.	NN	informative	2	1	1.21	0.5	7	church
church/NN/br-d02/1641	0.15507669758366	-0.23207381489054	church	NN	religion	non-fiction	B	B	AB	AB	church%1:14:00::	B	B	AB	AB	 concerned to stand squarely within the tradition of the apostolic <font color=green>church</font> , they have exhibited no willingness whatever to sacrifice their modernity	NN	informative	2	1	2.37	0.5	4	church
church/NN/br-d02/786	0.322201967702198	-0.127608367196119	church	NN	religion	non-fiction	A	A	AB	AB	church%1:14:00::	B	B	AB	AB	 longer afford the luxury of such smug indignation? Can the <font color=green>church</font>  risk assuming that the`` folly'' of men is as dear	NN	informative	3	0	1.9	0	5	church
church/NN/br-d02/923	0.100824171009944	-0.0302113900753501	church	NN	religion	non-fiction	A	A	AB	AB	church%1:14:00::	B	B	AB	AB	 for accomplishing his work in the world. by analogy, the <font color=green>church</font>  also has been regarded as entirely independent of the`` world	NN	informative	3	2	1.15	0.67	7	church
church/NN/br-d02/949	-0.121648530191265	-0.192971277042255	church	NN	religion	non-fiction	A	A	AB	AB	church%1:14:00::	B	B	AB	AB	 of requiring nothing from it in order to be the <font color=green>church</font> . But, as Scripture everywhere reminds us, God does have need	NN	informative	2	1	1.2	0.5	6	church
church/NN/br-d02/969	-0.0097730882661224	-0.206338660109948	church	NN	religion	non-fiction	A	A	AB	AB	church%1:14:00::	B	B	AB	AB	 us, God does have need of his creatures, and the <font color=green>church</font> , a fortiori, can ill afford to do without the talents	NN	informative	4	3	1.48	0.75	5	church
church/NN/br-d03/1350	-0.0200689106202442	-0.0541517195730561	church	NN	religion	non-fiction	E	E	DE	CDE	church%1:06:00::	D	D	DE	CDE	 as women in church, and to hear almost everyone in <font color=green>church</font>  congregations reciting the Latin prayers and responses at Mass. They	NN	informative	5	4	2.38	0.8	10	church
church/NN/br-d03/1871	0.0356364749624173	-0.153648246730012	church	NN	religion	non-fiction	B	B	AB	AB	catholic_church%1:14:00::	B1	B	AB	AB	 the Sunday Observer implies a kindly recognition that the Catholic <font color=green>Church</font>  is now at least of equal stature in England with	NNP	informative	2	2	2.11	1	10	Church
church/NN/br-d03/2097	-0.0287308506264827	-0.0339461957293555	church	NN	religion	non-fiction	A	A	AB	AB	church%1:14:00::	B	B	AB	AB	 Canterbury. The good feeling which exists between these two important <font color=green>church</font>  figures is now well known in England. The Holy Sacrifice	NN	informative	4	2	1.23	0.5	9	church
church/NN/br-d03/2336	0.030540557144079	-0.12681058190512	church	NN	religion	non-fiction	D	D	DE	CDE	catholic_church%1:14:00::	B1	B	AB	AB	 a votive Mass offered for Christian unity at a Catholic <font color=green>church</font>  in Slough during the Church Unity Octave.	NN	informative	2	1	2.61	0.5	7	church
church/NN/br-d03/721	-0.158921616514341	-0.38262164766679	church	NN	religion	non-fiction	B	B	AB	AB	church%1:06:00::	D	D	DE	CDE	 crowds going in and out of the Birmingham Oratory( Catholic) <font color=green>Church</font>  on Sunday mornings. She found this a marvel because, as	NNP	informative	1	0	2.85	0	3	Church
church/NN/br-d03/862	0.00313127270882855	-0.0575429516050743	church	NN	religion	non-fiction	B	B	AB	AB	church_of_england%1:14:00::	B2	B	AB	AB	 to a newspaper report of the 1961 statistics of the <font color=green>Church</font>  of England, the`` total of confirmed members is 9748000, but	NNP	informative	3	2	1.86	0.67	7	Church
church/NN/br-d03/883	0.190556879149463	-0.350517641782409	church	NN	religion	non-fiction	C	C	C	CDE	church_roll%1:10:00::	C	C	C	CDE	 is 9748000, but only 2887671 are registered on the parochial <font color=green>church</font>  rolls'', and`` over 27 million people in England are baptized	NN	informative	4	3	2	0.75	4	church
church/NN/br-d03/899	0.0221942220162751	-0.277050860673505	church	NN	religion	non-fiction	B	B	AB	AB	church_of_england%1:14:00::	B2	B	AB	AB	 over 27 million people in England are baptized into the <font color=green>Church</font>  of England, but roughly only a tenth of them continue	NNP	informative	3	2	2.22	0.67	4	Church
church/NN/br-d03/945	0.0115910585718279	-0.0709590629197108	church	NN	religion	non-fiction	B	B	AB	AB	church_of_england%1:14:00::	B2	B	AB	AB	 than an Archbishops' Commission`` reported last month that in the <font color=green>Church</font>  of England alone there are 790 churches which are redundant	NNP	informative	1	0	1.3	0	8	Church
church/NN/br-d04/56	-0.0980037587940787	-0.142543241121997	church	NN	religion	non-fiction	A	A	AB	AB	church_father%1:18:00::	A	A	AB	AB	 Jesus Christ the unique and the universal concur. Perhaps no <font color=green>church</font>  father saw this concurrence of the unique and the universal	NN	informative	4	6	2.11	1.5	7	church
church/NN/br-d05/1163	-0.0993770301048666	-0.277251389615943	church	NN	religion	non-fiction	B	B	AB	AB	Z	Z	Z	Z	Z	 Parker as the ultra-liberal minister within the pale of a <font color=green>church</font>  which had proclaimed itself the repository of liberality poses a	NN	informative	2	0	1.96	0	5	church
church/NN/br-d06/2048	0.000983384883783447	-0.016300924378115	church	NN	religion	non-fiction	E	E	DE	CDE	Z	Z	Z	Z	Z	 not one of the 70000000 Americans who do not attend <font color=green>church</font> , but who feel that various forms of recreation are more	NN	informative	1	1	1.37	1	7	church
church/NN/br-d06/2174	0.0217069558883018	-0.1258095781509	church	NN	religion	non-fiction	C	C	C	CDE	Z	Z	Z	Z	Z	 spiritually. No amount of religious ceremonies or even joining a <font color=green>church</font>  will relieve the gnawing of your`` inner'' space. Why? Because	NN	informative	3	3	1.81	1	7	church
church/NN/br-d07/1408	-0.0933139605167528	-0.110923060803072	church	NN	religion	non-fiction	D	D	DE	CDE	Z	Z	Z	Z	Z	 then jumped; she was fatally injured. The entrance to a <font color=green>church</font>  has been walled up, so that the congregation, most of	NN	informative	2	1	1.1	0.5	8	church
church/NN/br-d09/1044	-0.0371529252993687	-0.078189614245198	church	NN	religion	non-fiction	C	C	C	CDE	Z	Z	Z	Z	Z	 such topics as:`` What Christ Means to Me'',`` What the <font color=green>Church</font>  Means to Me'',`` Why Join the Church'',`` The Duties of	NNP	informative	3	2	2.24	0.67	5	Church
church/NN/br-d09/1054	-0.0146255712997336	-0.0524495623374904	church	NN	religion	non-fiction	C	C	C	CDE	Z	Z	Z	Z	Z	 Me'',`` What the Church Means to Me'',`` Why Join the <font color=green>Church</font> '',`` The Duties of Church Members'', etc.. Assign a series of	NNP	informative	3	3	2.73	1	6	Church
church/NN/br-d09/1061	-0.0114861830518525	-0.0579850073302121	church	NN	religion	non-fiction	C	C	C	CDE	Z	Z	Z	Z	Z	 Means to Me'',`` Why Join the Church'',`` The Duties of <font color=green>Church</font>  Members'', etc.. Assign a series of catechism questions to be	NNP	informative	4	3	2.3	0.75	6	Church
church/NN/br-d09/1260	0.0346177045798758	-0.00661736614162499	church	NN	religion	non-fiction	C	C	C	CDE	Z	Z	Z	Z	Z	 provides a natural transition into the life of the local <font color=green>church</font>  and its organizations. The total process of evangelism reaches the	NN	informative	4	3	1.27	0.75	9	church
church/NN/br-d09/1619	0.00346056803269803	-0.0668869408926007	church	NN	religion	non-fiction	C	C	C	CDE	Z	Z	Z	Z	Z	 the group of new members to be put in the <font color=green>church</font>  paper or placed on the bulletin board. Have a fellowship	NN	informative	5	4	1.1	0.8	7	church
church/NN/br-d09/1641	-0.0592260144354521	-0.0591516747654975	church	NN	religion	non-fiction	C	C	C	CDE	Z	Z	Z	Z	Z	 fellowship luncheon or dinner with new members as guests. The <font color=green>church</font>  is`` the family of God''. The members of the`` family	NN	informative	3	4	1.87	1.33	8	church
church/NN/br-d09/1829	0.0236566695792436	-0.04840608508513	church	NN	religion	non-fiction	C	C	C	CDE	Z	Z	Z	Z	Z	 during the same period there were 1080062 additions. Another major <font color=green>church</font>  body had 4499608 members and twenty years later its membership	NN	informative	5	4	1.13	0.8	7	church
church/NN/br-d09/2026	0.0569367172742959	-0.0421714520593588	church	NN	religion	non-fiction	C	C	C	CDE	Z	Z	Z	Z	Z	 planned and carefully developed. The entire membership of the local <font color=green>church</font>  must be alerted to their part in this dynamic process	NN	informative	3	3	1.09	1	11	church
church/NN/br-d09/2040	0.0797880339106039	-0.0212837389279209	church	NN	religion	non-fiction	C	C	C	CDE	Z	Z	Z	Z	Z	 alerted to their part in this dynamic process. If the <font color=green>church</font>  has followed the plan of cultivation of prospects and carried	NN	informative	3	2	1.1	0.67	10	church
church/NN/br-d09/2174	-0.00682254761502646	-0.0323192094075168	church	NN	religion	non-fiction	C	C	C	CDE	Z	Z	Z	Z	Z	 members. The new members justifiably expect some things from their <font color=green>church</font>  family:	NN	informative	3	4	1.47	1.33	6	church
church/NN/br-d09/724	0.0112595546879005	-0.047534390006285	church	NN	religion	non-fiction	C	C	C	CDE	Z	Z	Z	Z	Z	 as well as the program and activities of the local <font color=green>church</font> . The lay leadership of the church may be invited to	NN	informative	5	4	1.82	0.8	7	church
church/NN/br-d09/731	0.00610261917060853	-0.0387645101714103	church	NN	religion	non-fiction	C	C	C	CDE	Z	Z	Z	Z	Z	 activities of the local church. The lay leadership of the <font color=green>church</font>  may be invited to speak on the various phases of	NN	informative	2	2	2.04	1	8	church
church/NN/br-d09/742	0.00562379064726222	-0.0303068857411079	church	NN	religion	non-fiction	C	C	C	CDE	Z	Z	Z	Z	Z	 may be invited to speak on the various phases of <font color=green>church</font>  life, service opportunities, the church school, missions, men 's work	NN	informative	6	3	2.11	0.5	10	church
church/NN/br-d09/775	0.0718842413493591	-0.0261288218230795	church	NN	religion	non-fiction	C	C	C	CDE	Z	Z	Z	Z	Z	 youth program, social activities, and finances. The budget of the <font color=green>church</font>  may be presented and pledges solicited at this session. An	NN	informative	5	4	1.32	0.8	6	church
church/NN/br-d09/825	0.0285991077397872	-0.0119442442182061	church	NN	religion	non-fiction	D	D	DE	CDE	Z	Z	Z	Z	Z	 fourth session may be concluded with a tour of the <font color=green>church</font>  facilities and refreshments. The social time gives an opportunity for	NN	informative	4	3	1.5	0.75	8	church
church/NN/br-d09/837	0.024350905821614	-0.0194456822238729	church	NN	religion	non-fiction	C	C	C	CDE	Z	Z	Z	Z	Z	 facilities and refreshments. The social time gives an opportunity for <font color=green>church</font>  leaders to become acquainted with the new members. In conducting	NN	informative	5	4	1.84	0.8	6	church
church/NN/br-d09/935	-0.173306501057568	-0.228253070808949	church	NN	religion	non-fiction	A	A	AB	AB	Z	Z	Z	Z	Z	 dramatization- for example, in discussing the Lord 's Supper or <font color=green>church</font>  symbolism. Use audio-visual aids. Some excellent filmstrips with recordings and	NN	informative	3	1	1.59	0.33	6	church
church/NN/br-d10/2166	0.100157265162047	-0.196475565489277	church	NN	religion	non-fiction	B	B	AB	AB	Z	Z	Z	Z	Z	 the Christian claim is of considerable significance. The Roman Catholic <font color=green>Church</font>  has excommunicated one of its priests, Father Feeney, for insisting	NNP	informative	6	4	2.06	0.67	8	Church
church/NN/br-d10/2187	0.0678589360352069	-0.446732596006413	church	NN	religion	non-fiction	A	A	AB	AB	Z	Z	Z	Z	Z	 for insisting that there is no salvation outside the visible <font color=green>church</font> . In mentioning this under`` salvation reconsidered'' I do not mean	NN	informative	1	2	2.34	2	4	church
church/NN/br-d12/233	0.102030868490765	-0.0872868939915632	church	NN	religion	non-fiction	A	A	AB	AB	Z	Z	Z	Z	Z	 social change? What social, ethical and theological insights can the <font color=green>church</font>  and university help him bring to bear upon his situation	NN	informative	5	6	1.87	1.2	8	church
church/NN/br-d12/976	0.0372744924944417	-0.047305378329886	church	NN	religion	non-fiction	C	C	C	CDE	Z	Z	Z	Z	Z	 social and professional organizations, as citizens and civic leaders, as <font color=green>church</font>  laymen, as university alumni, as newspaper readers, etc.. From such	NN	informative	4	3	1.99	0.75	8	church
church/NN/br-d14/209	0.0254541497962403	-0.0752874817046218	church	NN	religion	non-fiction	A	A	AB	AB	Z	Z	Z	Z	Z	 of churches. Presumably those who did not have a formal <font color=green>church</font>  connexion had also felt the influence of Christianity to a	NN	informative	3	3	1.49	1	9	church
church/NN/br-d14/234	0.00163762873890076	-0.043845732866086	church	NN	religion	non-fiction	C	C	C	CDE	Z	Z	Z	Z	Z	 extent. Many of them had once been members of a <font color=green>church</font>  or at least had been given instruction in Christianity but	NN	informative	3	3	1.18	1	10	church
church/NN/br-d14/410	0.0661654290638304	-0.07030300898729	church	NN	religion	non-fiction	A	A	AB	AB	Z	Z	Z	Z	Z	 be absurd. For instance, we cannot know whether even for <font color=green>church</font>  members the degree of conformity to Christian standards of morality	NN	informative	5	3	1.9	0.6	6	church
church/NN/br-d14/428	0.043608031929878	-0.0656323859229607	church	NN	religion	non-fiction	C	C	C	CDE	Z	Z	Z	Z	Z	 standards of morality increased or declined as the proportion of <font color=green>church</font>  members in the population rose. The temptation is to say	NN	informative	2	2	1.71	1	9	church
church/NN/br-d14/446	0.0318421415638689	-0.0551071524559741	church	NN	religion	non-fiction	C	C	C	CDE	Z	Z	Z	Z	Z	 The temptation is to say that, as the percentage of <font color=green>church</font>  members mounted, the degree of discipline exercised by the churches	NN	informative	3	3	1.42	1	9	church
church/NN/br-d14/557	0.260122132435737	-0.107656160022107	church	NN	religion	non-fiction	A	A	AB	AB	Z	Z	Z	Z	Z	 If guilty, the offender might be excluded from membership. As <font color=green>church</font>  membership burgeoned, such measures faded into desuetude. But whether this	NN	informative	2	3	1.98	1.5	5	church
church/NN/br-d14/726	0.0742868768132214	-0.225254521298802	church	NN	religion	non-fiction	B	B	AB	AB	Z	Z	Z	Z	Z	 stock. By the end of the century the Roman Catholic <font color=green>Church</font>  was beginning to make itself felt, mainly through such institutions	NNP	informative	3	2	1.51	0.67	8	Church
church/NN/br-d16/1644	-0.107440753818537	-0.491789846841779	church	NN	religion	non-fiction	A	A	AB	AB	Z	Z	Z	Z	Z	 and zealously keep all the sacraments and ceremonies of the <font color=green>church</font> ; you may have the final and extreme unction but if	NN	informative	5	1	2.1	0.2	2	church
church/NN/br-d16/220	0.0587872850054267	-0.23359281747647	church	NN	religion	non-fiction	B	B	AB	AB	Z	Z	Z	Z	Z	 a short reading of the Holy Scriptures''. Since the Catholic <font color=green>Church</font>  expresses such desire that the Sacred Scriptures be read, the	NNP	informative	4	3	2.36	0.75	8	Church
church/NN/br-d17/1073	-0.0155585961246307	0.122645317397862	church	NN	religion	non-fiction	C	C	C	CDE	Z	Z	Z	Z	Z	 different, and something important: Ruth Peale, her wide experience in <font color=green>church</font>  work; Sidney Fields, years of experience as a New York	NN	informative	2	3	1.02	1.5	7	church
church/NN/br-e13/754	-0.107031659966091	0.162299339894922	church	NN	skill_and_hobbies	non-fiction	D	D	DE	CDE	Z	Z	Z	Z	Z	 the first of which was begun by Constantine, this fourth <font color=green>church</font>  was started by Justinian in 532 and completed twenty years	NN	informative	4	4	0.36	1	6	church
church/NN/br-f15/713	0.092137461209587	-0.180267905782751	church	NN	popular_lore	fiction	B	B	AB	AB	roman_catholic_church%1:14:00::	B1	B	AB	AB	 permit birth control only for medical reasons. The Roman Catholic <font color=green>Church</font> , however, sanctions a much more liberal policy on family planning	NNP	informative	5	4	1.24	0.8	11	Church
