id	model.x	model.y	lemma	pos	genre	broadGenre	marisense	mbroad	mari3	mari2	sensekey	wnsense	wnbroad	wn3	wn2	text	newPos	newBroadGenre	cues	cuesWithWeight	meanWeight	weightedCuesRatio	weightedCW	wf
country/NN/br-f19/140	0.0888207538621845	-0.00831689634116724	country	NN	popular_lore	fiction	B2	B	B23	B	country%1:14:00::	B2	B	BB2	B	 a given generation feels must have occurred. 2) As a <font color=green>country</font>  superimposes its cultural and political attitudes on others, it searches	NN	informative	4	3	1.18	0.75	8	country
country/NN/br-f19/350	0.13707374323494	0.0306399422756774	country	NN	popular_lore	fiction	B4	B	B14	B	country%1:14:00::	B2	B	BB2	B	 Of course, nationalism has really outlived its usefulness in a <font color=green>country</font>  as world oriented as ours, and its continued existence reflects	NN	informative	3	2	1	0.67	6	country
country/NN/br-f23/1615	-0.0280546499191743	0.13160459977422	country	NN	popular_lore	fiction	B2	B	B23	B	country%1:14:00::	B2	B	BB2	B	 Soviets understand, moreover, that the first step in turning a <font color=green>country</font>  toward Communism is to turn it against the West. Thus	NN	informative	5	3	0.8	0.6	7	country
country/NN/br-f23/1643	0.323290881535873	0.20975953365727	country	NN	popular_lore	fiction	B2	B	B23	B	country%1:14:00::	B2	B	BB2	B	 first stage of a Communist takeover is to`` neutralize'' a <font color=green>country</font> . The second stage is to retain the nominal classification of	NN	informative	3	1	1.04	0.33	7	country
country/NN/br-f23/2012	0.0528532913335648	0.067794321546007	country	NN	popular_lore	fiction	B2	B	B23	B	country%1:14:00::	B2	B	BB2	B	 Nixon. Today it is up for grabs. One Latin American <font color=green>country</font> , Cuba, has become a Soviet bridgehead ninety miles off our	NN	informative	4	3	0.64	0.75	8	country
country/NN/br-g01/1421	-0.0262878680940356	-0.13973093278596	country	NN	belles_lettres	fiction	B4	B	B14	B	mother_country%1:15:00::	B1	B	B1	B	 the sympathy they felt extended to them by the mother <font color=green>country</font> . And no doubt many people in states like the Carolinas	NN	informative	2	1	1.04	0.5	7	country
country/NN/br-g03/84	-0.0605347908002948	0.190551922060609	country	NN	belles_lettres	fiction	B1	B	B14	B	Z	Z	Z	Z	Z	 the White House, in offices of key scientists across the <font color=green>country</font>  and aboard the submarines that prowl for months underwater, with	NN	informative	3	1	1.47	0.33	10	country
country/NN/br-g04/688	-0.0804961771031148	0.0713936679569163	country	NN	belles_lettres	fiction	A	A	A	A	Z	Z	Z	Z	Z	 They went well-equipped with everything except knowledge of the`` outback'' <font color=green>country</font> .`` The countryside looked like a beautiful open park with gentle	NN	informative	5	3	0.92	0.6	6	country
country/NN/br-g06/2232	0.0431749108623816	0.0102391111341157	country	NN	belles_lettres	fiction	B1	B	B14	B	Z	Z	Z	Z	Z	 for help and that to be stranded in a foreign <font color=green>country</font>  without sufficient funds did not contribute to international understanding. The	NN	informative	3	2	1.02	0.67	11	country
country/NN/br-g06/2329	0.00308685943320941	0.0136798875057059	country	NN	belles_lettres	fiction	B2	B	B23	B	Z	Z	Z	Z	Z	 feared most was war or political instability in their own <font color=green>country</font> . The ideal home, they agreed, would be a small private	NN	informative	4	3	1.15	0.75	10	country
country/NN/br-g07/1662	-0.0230669130648969	0.18880073268592	country	NN	belles_lettres	fiction	B4	B	B14	B	Z	Z	Z	Z	Z	 viewing a man who had made the fortune of his <font color=green>country</font> , but now is working all night in order to support	NN	informative	1	0	0.82	0	6	country
country/NN/br-g10/530	-0.129451772139633	0.15930176767219	country	NN	belles_lettres	fiction	B	B	B14	B	Z	Z	Z	Z	Z	 it comes to this, I shall prefer emigrating to some <font color=green>country</font>  where they make no pretence of loving liberty- to Russia	NN	informative	2	0	1.28	0	5	country
country/NN/br-g11/1229	0.0433304210449027	0.04921845227477	country	NN	belles_lettres	fiction	B4	B	B14	B	country%1:14:00::	B2	B	BB2	B	 shorter and our present fear of war. We, in our <font color=green>country</font> , think of war as an external threat which, if it	NN	informative	5	4	1.18	0.8	8	country
country/NN/br-g17/2183	-0.0533291136362365	-0.0154299886608585	country	NN	belles_lettres	fiction	B1	B	B14	B	country%1:15:00::	B1	B	B1	B	 New England as it did in other parts of the <font color=green>country</font> ? Is n't it a bit odd that the three states	NN	informative	3	1	1.13	0.33	6	country
country/NN/br-g17/767	0.205232283350694	-0.0381673430663353	country	NN	belles_lettres	fiction	B4	B	B14	B	country%1:14:01::	B	B	BB2	B	 all partial or local legislation''. Who will say that our <font color=green>country</font>  is even now a homogeneous community? that regional peculiarities do	NN	informative	4	2	0.75	0.5	6	country
country/NN/br-g18/1754	0.0902765810500544	0.182572246210602	country	NN	belles_lettres	fiction	B4	B	B14	B	country%1:14:01::	B	B	BB2	B	 an invasion of Russia and each brought ruin on the <font color=green>country</font>  that worshipped him. Each is still glorified as a national	NN	informative	3	0	1.6	0	4	country
country/NN/br-g21/1021	0.0137001491748489	0.0137236725998005	country	NN	belles_lettres	fiction	B4	B	B14	B	country%1:15:00::	B1	B	B1	B	 by the time the war ended, liberal leadership in this <font color=green>country</font>  was spiritually Marxist. We will recall that the still confident	NN	informative	3	2	1.27	0.67	8	country
country/NN/br-g21/106	0.0221139343796552	0.00142195203245229	country	NN	belles_lettres	fiction	B4	B	B14	B	country%1:14:01::	B	B	BB2	B	 relationship that he found between religion and politics in this <font color=green>country</font>  and what happened to it. He points out that from	NN	informative	2	2	1.3	1	8	country
country/NN/br-g21/15	0.0315147521561605	-0.00682300856674925	country	NN	belles_lettres	fiction	B4	B	B14	B	country%1:14:01::	B	B	BB2	B	 pointed up the relation between the Protestant movement in this <font color=green>country</font>  and the development of a social religion, which he called	NN	informative	4	4	1.68	1	9	country
country/NN/br-g21/964	0.025358275832297	-0.00586761149519698	country	NN	belles_lettres	fiction	B4	B	B14	B	country%1:14:01::	B	B	BB2	B	 peace. The long road that had taken liberals in this <font color=green>country</font>  into the social religion of democracy, into a worship of	NN	informative	5	5	1.53	1	9	country
country/NN/br-g23/17	0.0481069902400552	0.0895500664913941	country	NN	belles_lettres	fiction	B4	B	B14	B	country%1:14:00::	B2	B	BB2	B	 Woodrow Wilson 's administration, a red scare developed in our <font color=green>country</font> . Many Americans reacted irrationally to the challenge of Russia and	NN	informative	5	2	1.66	0.4	8	country
country/NN/br-g28/1507	-0.0433306394585451	0.040383818415673	country	NN	belles_lettres	fiction	A	A	A	A	back_country%1:15:00::	A	A	A	A	 William Byrd described the Lubberlanders he encountered in the back <font color=green>country</font>  of Virginia and North Carolina. The chief literary antecedents of	NN	informative	3	2	1.24	0.67	11	country
country/NN/br-g43/348	-0.029465806452854	0.0218738885480233	country	NN	belles_lettres	fiction	A	A	A	A	country_doctor%1:18:00::	A	A	A	A	 most unforgettable character I ever met'' deals with village grocers, <font color=green>country</font>  doctors, favorite if illiterate aunts, and so forth. Scientists often	NN	informative	2	1	1.34	0.5	8	country
country/NN/br-h02/105	0.0555632582490022	0.0119252961291912	country	NN	miscellaneous	non-fiction	B2	B	B23	B	Z	Z	Z	Z	Z	 growth nor a development program can be imposed on a <font color=green>country</font> ; it must express the nation 's own will and goal	NN	informative	4	4	0.97	1	8	country
country/NN/br-h02/1401	0.0306893029176462	0.0153280332477374	country	NN	miscellaneous	non-fiction	B3	B	B23	B	Z	Z	Z	Z	Z	 show substantial success in this effort will vary greatly from <font color=green>country</font>  to country. In several significant cases, such as India, a	NN	informative	4	3	1.59	0.75	11	country
country/NN/br-h02/1403	0.0309756711752935	0.0146862368417883	country	NN	miscellaneous	non-fiction	B3	B	B23	B	Z	Z	Z	Z	Z	 success in this effort will vary greatly from country to <font color=green>country</font> . In several significant cases, such as India, a decade of	NN	informative	4	4	1.64	1	11	country
country/NN/br-h02/1763	0.0668075736166866	0.0219699137651278	country	NN	miscellaneous	non-fiction	B3	B	B23	B	Z	Z	Z	Z	Z	 firms involve multi-year budgeting and the same is true of <font color=green>country</font>  development programs. More importantly, several of the more advanced of	NN	informative	3	2	1.14	0.67	8	country
country/NN/br-h02/206	0.14464151678286	0.0239745607998904	country	NN	miscellaneous	non-fiction	B3	B	B23	B	Z	Z	Z	Z	Z	 formulation of programs for development which are adapted to the <font color=green>country</font>  's objectives and resources. This includes assistance in- assembling the	NN	informative	5	5	1.99	1	7	country
country/NN/br-h02/351	0.284081963665368	0.0610081795046774	country	NN	miscellaneous	non-fiction	B3	B	B23	B	Z	Z	Z	Z	Z	 programing and budgeting completely beyond the capabilities of the recipient <font color=green>country</font>  would result in the frustration of the basic objective of	NN	informative	3	1	1.3	0.33	5	country
country/NN/br-h02/439	0.175103339701402	0.0359777007292613	country	NN	miscellaneous	non-fiction	B3	B	B23	B	Z	Z	Z	Z	Z	 transport, communications, and agricultural improvement despite the absence of acceptable <font color=green>country</font>  programs. In such a case, however, we would encourage the	NN	informative	3	3	1.53	1	7	country
country/NN/br-h02/490	0.155676953441572	0.0439719536865462	country	NN	miscellaneous	non-fiction	B3	B	B23	B	Z	Z	Z	Z	Z	 expansion or even a continuation of our assistance to the <font color=green>country</font>  's development was conditional upon programing progress being made. At	NN	informative	4	4	1.5	1	7	country
country/NN/br-h02/572	0.0712770484597273	0.0172880237736713	country	NN	miscellaneous	non-fiction	B3	B	B23	B	Z	Z	Z	Z	Z	 developed countries, of the essential foreign exchange requirements of the <font color=green>country</font>  's development program. A systematic approach to development budgeting and	NN	informative	5	4	1.32	0.8	9	country
country/NN/br-h02/801	0.199889153542505	0.0377909660941915	country	NN	miscellaneous	non-fiction	B3	B	B23	B	Z	Z	Z	Z	Z	 have made clear that we are genuinely concerned with a <font color=green>country</font>  's development potential, we can be blunt in suggesting the	NN	informative	2	2	1.12	1	5	country
country/NN/br-h02/952	0.101875146610992	0.025398730861376	country	NN	miscellaneous	non-fiction	B3	B	B23	B	Z	Z	Z	Z	Z	 must be able to share in the growth of a <font color=green>country</font> . Otherwise, development will not lead to longrun stability. In many	NN	informative	3	2	1.09	0.67	5	country
country/NN/br-h03/1589	0.0108641160699871	0.0198102090982122	country	NN	miscellaneous	non-fiction	B4	B	B14	B	Z	Z	Z	Z	Z	 all the Americans who have played a part in the <font color=green>country</font>  's history since the beginning. I pay my personal tribute	NN	informative	4	3	1.14	0.75	6	country
country/NN/br-h03/1847	-0.0342022934221037	-0.0439792611402165	country	NN	miscellaneous	non-fiction	B4	B	B14	B	Z	Z	Z	Z	Z	 the greatest American public figures in the history of our <font color=green>country</font>  and I consider that I have been signally honored in	NN	informative	4	3	1.63	0.75	5	country
country/NN/br-h03/351	-0.0254521849855007	-0.00454407664959349	country	NN	miscellaneous	non-fiction	B4	B	B14	B	Z	Z	Z	Z	Z	 alone his own district but all the people of our <font color=green>country</font> . To honor him is to honor ourselves. In this my	NN	informative	3	1	1.53	0.33	8	country
country/NN/br-h03/66	-0.0678047147168014	0.0305802770840446	country	NN	miscellaneous	non-fiction	B4	B	B14	B	Z	Z	Z	Z	Z	 has ever known. Then I have seen the pride of <font color=green>country</font>  well in the eyes of these young people. So, I	NN	informative	2	2	1.09	1	6	country
country/NN/br-h03/862	0.047976742762636	0.0151504882750198	country	NN	miscellaneous	non-fiction	B4	B	B14	B	Z	Z	Z	Z	Z	 would define the immense service of this patriot to his <font color=green>country</font> . But the task is beyond me because I hold it	NN	informative	2	1	1.21	0.5	6	country
country/NN/br-h08/2000	0.0108876796961762	0.0154445276282835	country	NN	miscellaneous	non-fiction	B4	B	B14	B	Z	Z	Z	Z	Z	 and high standard of living we enjoy in this great <font color=green>country</font>  with the oppression and frugality of other nations to realize	NN	informative	6	4	1.19	0.67	9	country
country/NN/br-h08/2028	0.162432375953201	0.257478881150498	country	NN	miscellaneous	non-fiction	B4	B	B14	B	Z	Z	Z	Z	Z	 has been with us since the very beginning of our <font color=green>country</font> . And yet, accompanying our gratitude is the realization that we	NN	informative	3	1	1.14	0.33	6	country
country/NN/br-h09/1301	0.0373377474538116	0.0113657199744912	country	NN	miscellaneous	non-fiction	B1	B	B14	B	country%1:14:00::	B2	B	BB2	B	 made with any public or private agency in a foreign <font color=green>country</font>  shall contain provisions effective to insure that the results or	NN	informative	2	2	1.22	1	11	country
country/NN/br-h18/1493	0.0339857048788763	0.000429902825727395	country	NN	miscellaneous	non-fiction	B2	B	B23	B	country%1:14:00::	B2	B	BB2	B	 we are to conduct ourselves, in policy literature such as <font color=green>country</font>  papers and National Security Council papers accumulated in the Department	NN	informative	5	6	1.13	1.2	9	country
country/NN/br-h18/1813	0.0146398522179749	0.0107294813974233	country	NN	miscellaneous	non-fiction	B4	B	B14	B	country%1:14:00::	B2	B	BB2	B	 action can hope to win public support, first in this <font color=green>country</font>  and then abroad? For the policy officer will know that	NN	informative	5	5	1.64	1	9	country
country/NN/br-h18/1847	0.0646829698979422	0.00394020214121408	country	NN	miscellaneous	non-fiction	B3	B	B23	B	country%1:14:01::	B	B	BB2	B	 of policy will be conditioned by the readiness of the <font color=green>country</font>  to sustain it. He is interested in public opinion for	NN	informative	5	5	1.46	1	9	country
country/NN/br-h18/2142	0.349576946331752	0.0493139993769927	country	NN	miscellaneous	non-fiction	B4	B	B14	B	country%1:14:01::	B	B	BB2	B	 Marshall plan, any public-opinion expert would have said that the <font color=green>country</font>  would have accepted such proposals. The problem in the policy	NN	informative	4	2	0.87	0.5	6	country
country/NN/br-j22/38	0.104568410006276	0.17334479712726	country	NN	learned	non-fiction	A	A	A	A	country%1:14:00::	B2	B	BB2	B	 divisive forces, the gaps between rulers and subjects, town and <font color=green>country</font> , will widen; new aspirants for power will emerge whose ambitions	NN	informative	4	0	0.59	0	4	country
country/NN/br-j37/958	0.0510238512367881	0.0124013593169379	country	NN	learned	non-fiction	B2	B	B23	B	country%1:14:00::	B2	B	BB2	B	 a developing country and evaluating their results. In the new <font color=green>country</font>  the electoral process is considered as a means of resolving	NN	informative	4	3	1.07	0.75	9	country
country/NN/br-j42/2159	0.0610680015076408	0.0151058839950134	country	NN	learned	non-fiction	B2	B	B23	B	country%1:14:00::	B2	B	BB2	B	 in private litigation because of some contact with a foreign <font color=green>country</font>  were all severed from the older Law of Nations and	NN	informative	3	2	1.37	0.67	5	country
country/NN/br-j56/1063	-0.213553246491575	-0.077750308435738	country	NN	learned	non-fiction	A	A	A	A	country_club%1:14:00::	A	A	A	A	 had come into vogue, but also to witness the Ekwanok <font color=green>Country</font>  Club tournaments. New Yorkers were kept informed of scores by	NNP	informative	2	1	1.39	0.5	5	Country
country/NN/br-j58/690	-0.109440334156464	0.21107268120717	country	NN	learned	non-fiction	B4	B	B14	B	country%1:14:00::	B2	B	BB2	B	 commuted to imprisonment, it would be well- well for the <font color=green>country</font>  and for Virginia''. Despite the excitement being caused by the	NN	informative	1	0	1.39	0	7	country
country/NN/br-k03/1240	-0.124196781251504	0.0690286412034155	country	NN	fiction_gral	fiction	A	A	A	A	country%5:00:01:rural:00	A	A	A	A	 sit in the back seat of cars along a dark <font color=green>country</font>  lane. No, they must look the other way and climb	NN	imaginative	5	2	1.16	0.4	8	country
country/NN/br-k08/28	-0.380825118802118	-0.0903951867320243	country	NN	fiction_gral	fiction	A	A	A	A	country%1:15:00::	B1	B	B1	B	 too. But while the two men are riding into the <font color=green>country</font> , where they are going to dinner, they are attacked in	NN	imaginative	3	2	1.25	0.67	2	country
country/NN/br-k08/973	-0.337021492786205	0.236266439305989	country	NN	fiction_gral	fiction	A	A	A	A	country%1:15:01::	A	A	A	A	 just for this once, for this one weekend in the <font color=green>country</font> , he would make a little piece out of his melodies	NN	imaginative	3	1	0.81	0.33	5	country
country/NN/br-k17/1967	-0.0419407002871943	0.00696281987243581	country	NN	fiction_gral	fiction	B4	B	B14	B	country%1:15:00::	B1	B	B1	B	 wanted was to be a free man in my own <font color=green>country</font> . I 've lost faith, Styka. I used to love this	NN	imaginative	4	2	0.69	0.5	8	country
country/NN/br-k17/1981	-0.0790674796605804	0.000538110945729355	country	NN	fiction_gral	fiction	B4	B	B14	B	country%1:15:00::	B1	B	B1	B	 I 've lost faith, Styka. I used to love this <font color=green>country</font>  and believe that someday we 'd win our battle for	NN	imaginative	2	2	1.48	1	8	country
country/NN/br-k22/1652	-0.00709690982449032	0.130121091498887	country	NN	fiction_gral	fiction	A	A	A	A	country%1:15:01::	A	A	A	A	 where she had many friends, but Mr. Flannagan thought the <font color=green>country</font>  would be safer in case of war. She would rather	NN	imaginative	2	1	0.53	0.5	6	country
country/NN/br-k23/1336	-0.119089205451106	0.0812114076852426	country	NN	fiction_gral	fiction	A1	A	A	A	country%1:15:01::	A	A	A	A	 wheel. They rarely spoke. Abel sat and regarded the farm <font color=green>country</font>  which, spreading out from both sides of the road, rolled	NN	imaginative	3	2	1.03	0.67	8	country
country/NN/br-k25/869	-0.0488662617208972	0.234679153390083	country	NN	fiction_gral	fiction	B1	B	B14	B	country%1:15:00::	B1	B	B1	B	 shawl over her head, which she had bought in that <font color=green>country</font>  during one of their trips abroad, and handed him a	NN	imaginative	4	3	1.21	0.75	5	country
country/NN/br-l04/2288	-0.10624444436621	0.0700075814796213	country	NN	fiction_mystery	fiction	A1	A	A	A	Z	Z	Z	Z	Z	 should never have come out here alone. This is redneck <font color=green>country</font> . Every man in every one of these houses is a	NN	imaginative	5	4	0.62	0.8	9	country
country/NN/br-m04/110	-0.150252454275081	0.0857073101796348	country	NN	fiction_science	fiction	A	A	A	A	Z	Z	Z	Z	Z	 Okay''.`` Well, let 's take a ground-level look at the <font color=green>country</font>  around here''. The facsiport rolled open on the landscape. A	NN	imaginative	4	0	0.79	0	5	country
country/NN/br-n01/1082	-0.146083526586971	0.147942289396636	country	NN	fiction_adventure	fiction	A	A	A	A	Z	Z	Z	Z	Z	 He had seen a few nester wagons go through the <font color=green>country</font> , the families almost starving to death, but he had never	NN	imaginative	4	2	0.89	0.5	6	country
country/NN/br-n01/113	-0.119332584279729	0.283923242841732	country	NN	fiction_adventure	fiction	B1	B	B14	B	Z	Z	Z	Z	Z	 be to sell out to Al Budd and leave the <font color=green>country</font> , but there was a stubborn streak in him that would	NN	imaginative	1	1	0.58	1	3	country
country/NN/br-n01/1326	-0.363775076155818	0.123136235121491	country	NN	fiction_adventure	fiction	A	A	A	A	Z	Z	Z	Z	Z	 want town work'', Jones said.`` This is a mighty empty <font color=green>country</font> '', Morgan said.`` There 's only one more ranch three miles	NN	imaginative	5	2	1.26	0.4	4	country
country/NN/br-n01/399	-0.0193314428401085	0.0254997163737417	country	NN	fiction_adventure	fiction	B1	B	B14	B	Z	Z	Z	Z	Z	 trick Budd had thought up. No one walked in this <font color=green>country</font> , least of all Ed Dow or Dutch Renfro or any	NN	imaginative	1	1	1.01	1	6	country
country/NN/br-n04/448	-0.0063678667847603	0.028988803303191	country	NN	fiction_adventure	fiction	B1	B	B14	B	Z	Z	Z	Z	Z	 no war on now''.`` You 're wrong, Matt. In this <font color=green>country</font>  there 's a war on every time the grass turns	NN	imaginative	1	2	1.3	2	9	country
country/NN/br-n04/831	-0.0190548226300306	0.0309195912297273	country	NN	fiction_adventure	fiction	B1	B	B14	B	Z	Z	Z	Z	Z	 calmly,`` Trouble ai n't easy to dodge out in this <font color=green>country</font> , rev ' rend''. Gray Eyes attacked our camp just as	NN	imaginative	1	0	1.33	0	6	country
country/NN/br-n09/1051	0.255888612703899	0.168549630997443	country	NN	fiction_adventure	fiction	A	A	A	A	country%1:15:01::	A	A	A	A	 distant derrick of the wildcat- a test well in unexplored <font color=green>country</font> . And even with her limited knowledge of such things, she	NN	imaginative	2	0	1.6	0	5	country
country/NN/br-n09/492	-0.00748793286370015	0.0226416764010655	country	NN	fiction_adventure	fiction	B1	B	B14	B	country%1:15:00::	B1	B	B1	B	 gun- a strange ommission for a peace officer in this <font color=green>country</font> . Never, he 'd once told Joyce, had he encountered any	NN	imaginative	3	3	1.3	1	8	country
country/NN/br-n11/1733	-0.0969586982253666	0.130883898180673	country	NN	fiction_adventure	fiction	B1	B	B14	B	country%1:15:02::	A1	A	A	A	 on a first notice: If you do n't leave this <font color=green>country</font>  within 3 days, your life will be taken the same	NN	imaginative	1	1	0.61	1	6	country
country/NN/br-n11/2133	-0.106181154220379	0.404252849070762	country	NN	fiction_adventure	fiction	A1	A	A	A	country%1:15:02::	A1	A	A	A	 to frighten three rustling homesteaders out of the Upper Laramie <font color=green>country</font>  in a single week.`` My reputation 's my stock in	NN	imaginative	3	0	1.37	0	5	country
country/NN/br-p01/180	-0.0782537425118518	0.129887652530158	country	NN	fiction_romance	fiction	A1	A	A	A	old_country%1:15:00::	B1	B	B1	B	 Rossi, that 's what he was called in the old <font color=green>country</font> ; but here he was just Signore or the Old Man	NN	imaginative	1	0	0.57	0	5	country
country/NN/br-p01/465	-0.0208312954651197	0.0198560317471159	country	NN	fiction_romance	fiction	A1	A	A	A	old_country%1:15:00::	B1	B	B1	B	 she had a part on the stage in the old <font color=green>country</font> , she thought she could carry her head higher than ours	NN	imaginative	1	0	0.42	0	7	country
country/NN/br-p02/1422	-0.023566298566781	0.132874769644484	country	NN	fiction_romance	fiction	B2	B	B23	B	Z	Z	Z	Z	Z	 rates. The East was popularly supposed to have got the <font color=green>country</font>  into war and into depression, dragging the west along; and	NN	imaginative	4	3	1.44	0.75	6	country
country/NN/br-p03/2318	-0.0503914566163555	0.0100518355309394	country	NN	fiction_romance	fiction	A	A	A	A	Z	Z	Z	Z	Z	 early summer day as she was walking home from the <font color=green>country</font>  school where she was teaching now that Eph Showers had	NN	imaginative	3	3	0.81	1	7	country
country/NN/br-p05/1375	-0.0211516499988839	0.0372060515820286	country	NN	fiction_romance	fiction	B1	B	B14	B	Z	Z	Z	Z	Z	 was learning that so long as she was in this <font color=green>country</font> , and wore civilian dress in the Club, there would always	NN	imaginative	1	0	0.98	0	7	country
country/NN/br-p12/2090	-0.100994784116746	0.020249894709016	country	NN	fiction_romance	fiction	B1	B	B14	B	country%1:15:00::	B1	B	B1	B	 him she had met a nice man from his adopted <font color=green>country</font> . And Sam thanked her, and hoped he might meet her	NN	imaginative	2	0	1.41	0	6	country
country/NN/br-r06/1538	-0.138709691963321	0.115556947991817	country	NN	humor	fiction	B4	B	B14	B	country%1:15:00::	B1	B	B1	B	 too, has undergone a change. It now means, in my <font color=green>country</font> , homosexual'', I said.`` Oh, I forgot to say that if	NN	imaginative	3	1	0.22	0.33	2	country
country/NN/br-r08/1810	0.00964469767755279	0.0689652038443316	country	NN	humor	fiction	B4	B	B14	B	country%1:15:00::	B1	B	B1	B	 seems to be staging a well deserved comeback. In this <font color=green>country</font> , the two guiding lights are, without doubt, Felix Fing and	NN	imaginative	2	0	1.43	0	7	country
country/NNS/br-a04/1454	0.0490186160369812	0.0582374721200999	country	NNS	press_reportage	press	B3	B	B23	B	Z	Z	Z	Z	Z	 did recommend that President Kennedy state clearly that if Communist <font color=green>countries</font>  shipped any further arms to Cuba that it would not	NNS	informative	3	2	1.9	0.67	6	countries
country/NNS/br-a04/766	0.077380992920672	0.0133369069316762	country	NNS	press_reportage	press	B3	B	B23	B	Z	Z	Z	Z	Z	 ratified) as a method of coordinating aid to the underdeveloped <font color=green>countries</font> , and the need for strengthening conventional forces as well as	NNS	informative	4	3	2.1	0.75	9	countries
country/NNS/br-a04/938	0.110073478804814	0.000138734887688034	country	NNS	press_reportage	press	B2	B	B23	B	Z	Z	Z	Z	Z	 Viet Nam. They count on the aid of the neutral <font color=green>countries</font>  attending the Geneva conference to achieve this. The United States	NNS	informative	4	3	2.62	0.75	8	countries
country/NNS/br-a07/1587	0.221343181687836	0.115385327552049	country	NNS	press_reportage	press	B3	B	B23	B	Z	Z	Z	Z	Z	 the successful banker. Indonesia is one of the twenty under-developed <font color=green>countries</font>  of Asia, Africa and Latin America that are receiving Soviet	NNS	informative	4	1	1.86	0.25	7	countries
